Name, Health, NHL Team, Position, GFHL Team, Opponent, Score, GS, W, L, GA, SV, SO, FPTS
Daniil Tarasov, Healthy, Cls, G, FA, --, --, 1, 1, 0, 2, 39, 0, 6.9
Joey Daccord, Healthy, Sea, G, FA, --, --, 1, 1, 0, 1, 32, 0, 6.7
Devon Levi, Healthy, Buf, G, SALT, --, --, 1, 1, 0, 1, 32, 0, 6.7
Alex Lyon, Healthy, Det, G, SALT, --, --, 1, 1, 0, 3, 40, 0, 6.5
Connor Hellebuyck, Healthy, Wpg, G, HERB, --, --, 1, 1, 0, 1, 27, 0, 6.2
Sergei Bobrovsky, Healthy, Fla, G, ME, --, --, 1, 1, 0, 1, 26, 0, 6.1
Ilya Sorokin, Healthy, NYI, G, CLB, --, --, 1, 1, 0, 1, 26, 0, 6.1
Jordan Binnington, Healthy, StL, G, ME, --, --, 1, 1, 0, 1, 25, 0, 6.0
Igor Shesterkin, Healthy, NYR, G, DINK, --, --, 1, 1, 0, 1, 22, 0, 5.7
Andrei Vasilevskiy, Healthy, TB, G, LKR, --, --, 1, 1, 0, 1, 22, 0, 5.7
Dan Vladar, O, Cgy, G, FA, --, --, 1, 1, 0, 3, 29, 0, 5.4
Alexandar Georgiev, Healthy, Col, G, SLC, --, --, 1, 1, 0, 4, 28, 0, 4.8
Alex Nedeljkovic, Healthy, Pit, G, FA, --, --, 1, 1, 0, 5, 24, 0, 3.9
Samuel Ersson, Healthy, Phi, G, BBS, --, --, 1, 0, 0, 2, 26, 0, 1.6
Thatcher Demko, IR, Van, G, BOWS, --, --, 1, 0, 1, 2, 30, 0, 1.0
David Rittich, Healthy, LA, G, HERB, --, --, 1, 0, 0, 3, 24, 0, 0.9
Mackenzie Blackwood, Healthy, SJ, G, FA, --, --, 1, 0, 1, 2, 28, 0, 0.8
Kevin Lankinen, Healthy, Nsh, G, FA, --, --, 0, 0, 0, 1, 13, 0, 0.8
Scott Wedgewood, Healthy, Dal, G, FA, --, --, 1, 0, 0, 5, 29, 0, 0.4
Logan Thompson, Healthy, Vgk, G, DINK, --, --, 1, 0, 1, 4, 32, 0, 0.2
Marc-Andre Fleury, Healthy, Min, G, FA, --, --, 1, 0, 1, 3, 26, 0, 0.1
Linus Ullmark, Healthy, Bos, G, LKR, --, --, --, --, --, --, --, --, --
Jake Oettinger, Healthy, Dal, G, LKR, --, --, --, --, --, --, --, --, --
Adin Hill, O, Vgk, G, DINK, --, --, --, --, --, --, --, --, --
Tristan Jarry, Healthy, Pit, G, SLC, --, --, --, --, --, --, --, --, --
Cam Talbot, Healthy, LA, G, BOWS, --, --, --, --, --, --, --, --, --
Jacob Markstrom, Healthy, Cgy, G, BBS, --, --, --, --, --, --, --, --, --
Filip Gustavsson, Healthy, Min, G, BOWS, --, --, --, --, --, --, --, --, --
Ukko-Pekka Luukkonen, Healthy, Buf, G, CLB, --, --, --, --, --, --, --, --, --
Carter Hart, IR, Phi, G, FA, --, --, --, --, --, --, --, --, --
Jonathan Quick, Healthy, NYR, G, OXP, --, --, --, --, --, --, --, --, --
Spencer Knight, Healthy, Fla, G, FA, --, --, --, --, --, --, --, --, --
Casey DeSmith, Healthy, Van, G, DINK, --, --, --, --, --, --, --, --, --
Ville Husso, O, Det, G, OXP, --, --, --, --, --, --, --, --, --
Jonas Johansson, Healthy, TB, G, OXP, --, --, --, --, --, --, --, --, --
Semyon Varlamov, Healthy, NYI, G, FA, --, --, --, --, --, --, --, --, --
Laurent Brossoit, Healthy, Wpg, G, FA, --, --, --, --, --, --, --, --, --
Philipp Grubauer, Healthy, Sea, G, FA, --, --, --, --, --, --, --, --, --
Justus Annunen, Healthy, Col, G, FA, --, --, --, --, --, --, --, --, --
Anthony Stolarz, Healthy, Fla, G, FA, --, --, --, --, --, --, --, --, --
Elvis Merzlikins, Healthy, Cls, G, FA, --, --, --, --, --, --, --, --, --
Sam Montembeault, Healthy, Mon, G, BOWS, --, --, --, --, --, --, --, --, --
Karel Vejmelka, Healthy, Ari, G, FA, --, --, --, --, --, --, --, --, --
James Reimer, Healthy, Det, G, FA, --, --, --, --, --, --, --, --, --
Joel Hofer, Healthy, StL, G, FA, --, --, --, --, --, --, --, --, --
Dustin Wolf, Healthy, Cgy, G, SLC, --, --, --, --, --, --, --, --, --
Pheonix Copley, IR, LA, G, FA, --, --, --, --, --, --, --, --, --
Anton Forsberg, Healthy, Ott, G, FA, --, --, --, --, --, --, --, --, --
Robin Lehner, IR, Vgk, G, FA, --, --, --, --, --, --, --, --, --
Yaroslav Askarov, Healthy, Nsh, G, FA, --, --, --, --, --, --, --, --, --
Kaapo Kahkonen, Healthy, NJ, G, FA, --, --, --, --, --, --, --, --, --
Arvid Soderblom, Healthy, Chi, G, FA, --, --, --, --, --, --, --, --, --
Mads Sogaard, Healthy, Ott, G, FA, --, --, --, --, --, --, --, --, --
Jesper Wallstedt, Healthy, Min, G, FA, --, --, --, --, --, --, --, --, --
Louis Domingue, Healthy, NYR, G, FA, --, --, --, --, --, --, --, --, --
Matt Murray, Healthy, Dal, G, FA, --, --, --, --, --, --, --, --, --
Carey Price, IR, Mon, G, FA, --, --, --, --, --, --, --, --, --
Cayden Primeau, Healthy, Mon, G, FA, --, --, --, --, --, --, --, --, --
Jiri Patera, Healthy, Vgk, G, FA, --, --, --, --, --, --, --, --, --
Chris Driedger, Healthy, Sea, G, FA, --, --, --, --, --, --, --, --, --
Tuukka Rask, Healthy, Bos, G, FA, --, --, --, --, --, --, --, --, --
Ivan Prosvetov, Healthy, Col, G, FA, --, --, --, --, --, --, --, --, --
Malcolm Subban, Healthy, StL, G, FA, --, --, --, --, --, --, --, --, --
Spencer Martin, Healthy, Car, G, FA, --, --, --, --, --, --, --, --, --
Pavel Francouz, IR, Col, G, FA, --, --, --, --, --, --, --, --, --
Eric Comrie, Healthy, Buf, G, FA, --, --, --, --, --, --, --, --, --
Jet Greaves, Healthy, Cls, G, FA, --, --, --, --, --, --, --, --, --
Braden Holtby, Healthy, Dal, G, FA, --, --, --, --, --, --, --, --, --
Sebastian Cossa, Healthy, Det, G, FA, --, --, --, --, --, --, --, --, --
Cal Petersen, Healthy, Phi, G, FA, --, --, --, --, --, --, --, --, --
Felix Sandstrom, Healthy, Phi, G, FA, --, --, --, --, --, --, --, --, --
Jaroslav Halak, Healthy, NYR, G, FA, --, --, --, --, --, --, --, --, --
Magnus Chrona, Healthy, SJ, G, FA, --, --, --, --, --, --, --, --, --
Artyom Zagidulin, Healthy, Cgy, G, FA, --, --, --, --, --, --, --, --, --
Arturs Silovs, Healthy, Van, G, FA, --, --, --, --, --, --, --, --, --
Craig Anderson, Healthy, Buf, G, FA, --, --, --, --, --, --, --, --, --
Brian Elliott, Healthy, TB, G, FA, --, --, --, --, --, --, --, --, --
Drew Commesso, Healthy, Chi, G, FA, --, --, --, --, --, --, --, --, --
Anton Khudobin, Healthy, Chi, G, FA, --, --, --, --, --, --, --, --, --
Magnus Hellberg, Healthy, Fla, G, FA, --, --, --, --, --, --, --, --, --
Michael DiPietro, Healthy, Bos, G, FA, --, --, --, --, --, --, --, --, --
Matt Tomkins, Healthy, TB, G, FA, --, --, --, --, --, --, --, --, --
Adam Gajan, Healthy, Chi, G, FA, --, --, --, --, --, --, --, --, --
Dylan Wells, Healthy, Dal, G, FA, --, --, --, --, --, --, --, --, --
Jaxson Stauber, Healthy, Chi, G, FA, --, --, --, --, --, --, --, --, --
Thomas Greiss, Healthy, StL, G, FA, --, --, --, --, --, --, --, --, --
Trey Augustine, Healthy, Det, G, FA, --, --, --, --, --, --, --, --, --
Hugo Alnefelt, Healthy, TB, G, FA, --, --, --, --, --, --, --, --, --
Collin Delia, Healthy, Wpg, G, FA, --, --, --, --, --, --, --, --, --
Eetu Makiniemi, Healthy, SJ, G, FA, --, --, --, --, --, --, --, --, --
Michael Hrabal, Healthy, Ari, G, FA, --, --, --, --, --, --, --, --, --
Jack LaFontaine, Healthy, TB, G, FA, --, --, --, --, --, --, --, --, --
Hunter Miska, Healthy, Col, G, FA, --, --, --, --, --, --, --, --, --
Niklas Svedberg, Healthy, Min, G, FA, --, --, --, --, --, --, --, --, --
Antti Niemi, Healthy, Mon, G, FA, --, --, --, --, --, --, --, --, --
Kasimir Kaskisuo, Healthy, Nsh, G, FA, --, --, --, --, --, --, --, --, --
Leevi Merilainen, Healthy, Ott, G, FA, --, --, --, --, --, --, --, --, --
Michael Hutchinson, Healthy, Det, G, FA, --, --, --, --, --, --, --, --, --
Alexei Melnichuk, Healthy, TB, G, FA, --, --, --, --, --, --, --, --, --
Kenneth Appleby, Healthy, NYI, G, FA, --, --, --, --, --, --, --, --, --
Cory Schneider, Healthy, NYI, G, FA, --, --, --, --, --, --, --, --, --
Carson Bjarnason, Healthy, Phi, G, FA, --, --, --, --, --, --, --, --, --
Mike Condon, Healthy, TB, G, FA, --, --, --, --, --, --, --, --, --
Garret Sparks, Healthy, LA, G, FA, --, --, --, --, --, --, --, --, --
Aaron Dell, Healthy, Cls, G, FA, --, --, --, --, --, --, --, --, --
Adam Huska, Healthy, NYR, G, FA, --, --, --, --, --, --, --, --, --
Danny Taylor, Healthy, Ott, G, FA, --, --, --, --, --, --, --, --, --
Troy Grosenick, Healthy, Nsh, G, FA, --, --, --, --, --, --, --, --, --
Jeff Glass, Healthy, Chi, G, FA, --, --, --, --, --, --, --, --, --
Maxime Lagace, Healthy, TB, G, FA, --, --, --, --, --, --, --, --, --
Dylan Ferguson, Healthy, Ott, G, FA, --, --, --, --, --, --, --, --, --
Landon Bow, Healthy, Dal, G, FA, --, --, --, --, --, --, --, --, --
Dustin Tokarski, Healthy, Buf, G, FA, --, --, --, --, --, --, --, --, --
Michael McNiven, Healthy, Ott, G, FA, --, --, --, --, --, --, --, --, --
Michael Houser, Healthy, Buf, G, FA, --, --, --, --, --, --, --, --, --
Harri Sateri, Healthy, Ari, G, FA, --, --, --, --, --, --, --, --, --
Jared Coreau, Healthy, NYI, G, FA, --, --, --, --, --, --, --, --, --
Jon Gillies, O, Cls, G, FA, --, --, --, --, --, --, --, --, --
Kevin Boyle, Healthy, Det, G, FA, --, --, --, --, --, --, --, --, --
Zach Sawchenko, Healthy, Van, G, FA, --, --, --, --, --, --, --, --, --
Josef Korenar, Healthy, Ari, G, FA, --, --, --, --, --, --, --, --, --
Kaden Fulcher, Healthy, Det, G, FA, --, --, --, --, --, --, --, --, --
Kevin Mandolese, Healthy, Ott, G, FA, --, --, --, --, --, --, --, --, --
Jean-Francois Berube, Healthy, LA, G, FA, --, --, --, --, --, --, --, --, --
Joonas Korpisalo, Healthy, Ott, G, FA, --, --, 1, 0, 1, 3, 24, 0, -0.1
Petr Mrazek, Healthy, Chi, G, FA, --, --, 1, 0, 1, 4, 28, 0, -0.2
Jake Allen, Healthy, NJ, G, FA, --, --, 1, 0, 1, 5, 32, 0, -0.3
Connor Ingram, Healthy, Ari, G, OXP, --, --, 1, 0, 1, 5, 26, 0, -0.9
Jeremy Swayman, Healthy, Bos, G, SALT, --, --, 1, 0, 1, 6, 29, 0, -1.1
Juuse Saros, Healthy, Nsh, G, SALT, --, --, 1, 0, 1, 5, 20, 0, -1.5
Stuart Skinner, Healthy, Edm, G, ME, --, --, --, --, --, --, --, --, --
Frederik Andersen, Healthy, Car, G, BBS, --, --, --, --, --, --, --, --, --
Ilya Samsonov, Healthy, Tor, G, HERB, --, --, --, --, --, --, --, --, --
Vitek Vanecek, IR, SJ, G, BOWS, --, --, --, --, --, --, --, --, --
Pyotr Kochetkov, Healthy, Car, G, BBS, --, --, --, --, --, --, --, --, --
Charlie Lindgren, Healthy, Wsh, G, HERB, --, --, --, --, --, --, --, --, --
Joseph Woll, Healthy, Tor, G, BBS, --, --, --, --, --, --, --, --, --
Darcy Kuemper, Healthy, Wsh, G, FA, --, --, --, --, --, --, --, --, --
John Gibson, Healthy, Ana, G, FA, --, --, --, --, --, --, --, --, --
Martin Jones, Healthy, Tor, G, FA, --, --, --, --, --, --, --, --, --
Lukas Dostal, Healthy, Ana, G, FA, --, --, --, --, --, --, --, --, --
Calvin Pickard, Healthy, Edm, G, FA, --, --, --, --, --, --, --, --, --
Antti Raanta, Healthy, Car, G, FA, --, --, --, --, --, --, --, --, --
Jack Campbell, Healthy, Edm, G, FA, --, --, --, --, --, --, --, --, --
Nico Daws, Healthy, NJ, G, FA, --, --, --, --, --, --, --, --, --
Akira Schmid, Healthy, NJ, G, FA, --, --, --, --, --, --, --, --, --
Matt Murray, IR, Tor, G, FA, --, --, --, --, --, --, --, --, --
Hunter Shepard, Healthy, Wsh, G, FA, --, --, --, --, --, --, --, --, --
Mike Smith, Healthy, Edm, G, FA, --, --, --, --, --, --, --, --, --
Alex Stalock, Healthy, Ana, G, FA, --, --, --, --, --, --, --, --, --
Jonathan Bernier, Healthy, NJ, G, FA, --, --, --, --, --, --, --, --, --
Mikko Koskinen, Healthy, Edm, G, FA, --, --, --, --, --, --, --, --, --
Dennis Hildeby, Healthy, Tor, G, FA, --, --, --, --, --, --, --, --, --
Jett Alexander, Healthy, Tor, G, FA, --, --, --, --, --, --, --, --, --
Olle Eriksson Ek, Healthy, Ana, G, FA, --, --, --, --, --, --, --, --, --
Andrew Hammond, Healthy, NJ, G, FA, --, --, --, --, --, --, --, --, --
Damian Clara, Healthy, Ana, G, FA, --, --, --, --, --, --, --, --, --
Zach Fucale, Healthy, Wsh, G, FA, --, --, --, --, --, --, --, --, --
Keith Petruzzelli, Healthy, Tor, G, FA, --, --, --, --, --, --, --, --, --
Erik Kallgren, Healthy, NJ, G, FA, --, --, --, --, --, --, --, --, --
Shane Starrett, Healthy, Edm, G, FA, --, --, --, --, --, --, --, --, --
Matthew Berlin, Healthy, Edm, G, FA, --, --, --, --, --, --, --, --, --
Eddie Lack, Healthy, NJ, G, FA, --, --, --, --, --, --, --, --, --
Keith Kinkaid, Healthy, NJ, G, FA, --, --, --, --, --, --, --, --, --
Tom Hodges, Healthy, Ana, G, FA, --, --, --, --, --, --, --, --, --
Carter Hutton, Healthy, Tor, G, FA, --, --, --, --, --, --, --, --, --
Yaniv Perets, Healthy, Car, G, FA, --, --, --, --, --, --, --, --, --
Devin Cooley, Healthy, SJ, G, FA, --, --, --, --, --, --, --, --, --
Matt Villalta, Healthy, Ari, G, FA, --, --, --, --, --, --, --, --, --
