Jeff Skinner, Healthy, Buf, LW- RW, LKR, --, --, 0, 0, 0, 0, 0, 0, 0, 0, 0, 0, 0, 0, 0, 0, 0, 0, --
Thomas Chabot, O, Ott, D, ME, --, --, 0, 0, 0, 0, 0, 0, 0, 0, 0, 0, 0, 0, 0, 0, 0, 0, --
Tyson Barrie, Healthy, Nsh, D, ME, NYI, W 5-4, 0, 0, 0, 0, 0, 0, 0, 0, 0, 0, 0, 0, 0, 0, 0, 0, --
Andrei Kuzmenko, Healthy, Van, LW, SLC, --, --, 0, 0, 0, 0, 0, 0, 0, 0, 0, 0, 0, 0, 0, 0, 0, 0, --
Phillip Danault, Healthy, LA, C, FA, --, --, 0, 0, 0, 0, 0, 0, 0, 0, 0, 0, 0, 0, 0, 0, 0, 0, --
Viktor Arvidsson, Healthy, LA, RW- LW, FA, --, --, 0, 0, 0, 0, 0, 0, 0, 0, 0, 0, 0, 0, 0, 0, 0, 0, --
Evan Bouchard, Healthy, Edm, D, FA, --, --, 0, 0, 0, 0, 0, 0, 0, 0, 0, 0, 0, 0, 0, 0, 0, 0, --
Dylan Cozens, Healthy, Buf, C- LW, FA, --, --, 0, 0, 0, 0, 0, 0, 0, 0, 0, 0, 0, 0, 0, 0, 0, 0, --
Colton Parayko, Healthy, StL, D, FA, Wsh, W 5-4, 0, 0, 0, 0, 0, 0, 0, 0, 0, 0, 0, 0, 0, 0, 0, 0, --
Brock Boeser, Healthy, Van, RW, OXP, --, --, 0, 0, 0, 0, 0, 0, 0, 0, 0, 0, 0, 0, 0, 0, 0, 0, --
Owen Power, Healthy, Buf, D, SLC, --, --, 0, 0, 0, 0, 0, 0, 0, 0, 0, 0, 0, 0, 0, 0, 0, 0, --
Sean Durzi, Healthy, LA, D, HERB, --, --, 0, 0, 0, 0, 0, 0, 0, 0, 0, 0, 0, 0, 0, 0, 0, 0, --
Bowen Byram, Healthy, Col, D, BBS, @Car, W 3-2, 0, 0, 0, 0, 0, 0, 0, 0, 0, 0, 0, 0, 0, 0, 0, 0, --
Josh Norris, IR, Ott, C, SLC, --, --, 0, 0, 0, 0, 0, 0, 0, 0, 0, 0, 0, 0, 0, 0, 0, 0, --
Matt Roy, Healthy, LA, D, FA, --, --, 0, 0, 0, 0, 0, 0, 0, 0, 0, 0, 0, 0, 0, 0, 0, 0, --
Shane Wright, Healthy, Sea, C, FA, NYR, W 3-2, 0, 0, 0, 0, 0, 0, 0, 0, 0, 0, 0, 0, 0, 0, 0, 0, --
Gabriel Vilardi, DTD, LA, C- RW, FA, --, --, 0, 0, 0, 0, 0, 0, 0, 0, 0, 0, 0, 0, 0, 0, 0, 0, --
Max Domi, Healthy, Dal, C- LW- RW, FA, @Fla, W 6-4, 0, 0, 0, 0, 0, 0, 0, 0, 0, 0, 0, 0, 0, 0, 0, 0, --
Jake McCabe, DTD, Tor, D, FA, NJ, L 2-3, 0, 0, 0, 0, 0, 0, 0, 0, 0, 0, 0, 0, 0, 0, 0, 0, --
Jake Sanderson, Healthy, Ott, D, FA, --, --, 0, 0, 0, 0, 0, 0, 0, 0, 0, 0, 0, 0, 0, 0, 0, 0, --
Cam Atkinson, IR, Phi, RW- LW, FA, @Bos, L 1-4, 0, 0, 0, 0, 0, 0, 0, 0, 0, 0, 0, 0, 0, 0, 0, 0, --
Luke Schenn, Healthy, Tor, D, FA, NJ, L 2-3, 0, 0, 0, 0, 0, 0, 0, 0, 0, 0, 0, 0, 0, 0, 0, 0, --
Samuel Girard, Healthy, Col, D, FA, @Car, W 3-2, 0, 0, 0, 0, 0, 0, 0, 0, 0, 0, 0, 0, 0, 0, 0, 0, --
Victor Olofsson, Healthy, Buf, RW, FA, --, --, 0, 0, 0, 0, 0, 0, 0, 0, 0, 0, 0, 0, 0, 0, 0, 0, --
Jonathan Toews, Healthy, Chi, C, FA, --, --, 0, 0, 0, 0, 0, 0, 0, 0, 0, 0, 0, 0, 0, 0, 0, 0, --
Tyler Myers, Healthy, Van, D, FA, --, --, 0, 0, 0, 0, 0, 0, 0, 0, 0, 0, 0, 0, 0, 0, 0, 0, --
Alex Iafallo, Healthy, LA, LW, FA, --, --, 0, 0, 0, 0, 0, 0, 0, 0, 0, 0, 0, 0, 0, 0, 0, 0, --
Connor Murphy, Healthy, Chi, D, FA, --, --, 0, 0, 0, 0, 0, 0, 0, 0, 0, 0, 0, 0, 0, 0, 0, 0, --
Conor Garland, Healthy, Van, RW- LW, FA, --, --, 0, 0, 0, 0, 0, 0, 0, 0, 0, 0, 0, 0, 0, 0, 0, 0, --
Vasily Podkolzin, DTD, Van, RW- LW, FA, --, --, 0, 0, 0, 0, 0, 0, 0, 0, 0, 0, 0, 0, 0, 0, 0, 0, --
Shane Pinto, Healthy, Ott, C, FA, --, --, 0, 0, 0, 0, 0, 0, 0, 0, 0, 0, 0, 0, 0, 0, 0, 0, --
Kailer Yamamoto, Healthy, Edm, RW, FA, --, --, 0, 0, 0, 0, 0, 0, 0, 0, 0, 0, 0, 0, 0, 0, 0, 0, --
Oliver Ekman-Larsson, IR, Van, D, FA, --, --, 0, 0, 0, 0, 0, 0, 0, 0, 0, 0, 0, 0, 0, 0, 0, 0, --
Trevor Moore, Healthy, LA, LW- RW, FA, --, --, 0, 0, 0, 0, 0, 0, 0, 0, 0, 0, 0, 0, 0, 0, 0, 0, --
Kasperi Kapanen, Healthy, StL, RW, FA, Wsh, W 5-4, 0, 0, 0, 0, 0, 0, 0, 0, 0, 0, 0, 0, 0, 0, 0, 0, --
Mikey Anderson, DTD, LA, D, FA, --, --, 0, 0, 0, 0, 0, 0, 0, 0, 0, 0, 0, 0, 0, 0, 0, 0, --
Artem Zub, Healthy, Ott, D, FA, --, --, 0, 0, 0, 0, 0, 0, 0, 0, 0, 0, 0, 0, 0, 0, 0, 0, --
Arthur Kaliyev, Healthy, LA, RW- LW, FA, --, --, 0, 0, 0, 0, 0, 0, 0, 0, 0, 0, 0, 0, 0, 0, 0, 0, --
Travis Hamonic, DTD, Ott, D, FA, --, --, 0, 0, 0, 0, 0, 0, 0, 0, 0, 0, 0, 0, 0, 0, 0, 0, --
Tyler Motte, Healthy, NYR, C- LW, FA, @Sea, L 2-3, 0, 0, 0, 0, 0, 0, 0, 0, 0, 0, 0, 0, 0, 0, 0, 0, --
Erik Cernak, Healthy, TB, D, FA, Cgy, W 4-1, 0, 0, 0, 0, 0, 0, 0, 0, 0, 0, 0, 0, 0, 0, 0, 0, --
Cody Ceci, Healthy, Edm, D, FA, --, --, 0, 0, 0, 0, 0, 0, 0, 0, 0, 0, 0, 0, 0, 0, 0, 0, --
Jack Quinn, Healthy, Buf, RW, FA, --, --, 0, 0, 0, 0, 0, 0, 0, 0, 0, 0, 0, 0, 0, 0, 0, 0, --
Casey Mittelstadt, Healthy, Buf, C- LW, FA, --, --, 0, 0, 0, 0, 0, 0, 0, 0, 0, 0, 0, 0, 0, 0, 0, 0, --
Vitali Kravtsov, Healthy, Van, LW- RW, FA, --, --, 0, 0, 0, 0, 0, 0, 0, 0, 0, 0, 0, 0, 0, 0, 0, 0, --
Taylor Raddysh, Healthy, Chi, RW, FA, --, --, 0, 0, 0, 0, 0, 0, 0, 0, 0, 0, 0, 0, 0, 0, 0, 0, --
Ilya Mikheyev, IR, Van, RW- LW, FA, --, --, 0, 0, 0, 0, 0, 0, 0, 0, 0, 0, 0, 0, 0, 0, 0, 0, --
Quinton Byfield, Healthy, LA, C, FA, --, --, 0, 0, 0, 0, 0, 0, 0, 0, 0, 0, 0, 0, 0, 0, 0, 0, --
Nicholas Robertson, IR, Tor, LW, FA, NJ, L 2-3, 0, 0, 0, 0, 0, 0, 0, 0, 0, 0, 0, 0, 0, 0, 0, 0, --
Jesse Puljujarvi, Healthy, Car, RW, FA, Col, L 2-3, 0, 0, 0, 0, 0, 0, 0, 0, 0, 0, 0, 0, 0, 0, 0, 0, --
Andreas Athanasiou, Healthy, Chi, LW- RW, FA, --, --, 0, 0, 0, 0, 0, 0, 0, 0, 0, 0, 0, 0, 0, 0, 0, 0, --
Jason Dickinson, Healthy, Chi, C- LW, FA, --, --, 0, 0, 0, 0, 0, 0, 0, 0, 0, 0, 0, 0, 0, 0, 0, 0, --
Ryan Reaves, Healthy, Min, RW, FA, Pit, L 4-6, 0, 0, 0, 0, 0, 0, 0, 0, 0, 0, 0, 0, 0, 0, 0, 0, --
Tanner Pearson, IR, Van, LW, FA, --, --, 0, 0, 0, 0, 0, 0, 0, 0, 0, 0, 0, 0, 0, 0, 0, 0, --
Alex Goligoski, Healthy, Min, D, FA, Pit, L 4-6, 0, 0, 0, 0, 0, 0, 0, 0, 0, 0, 0, 0, 0, 0, 0, 0, --
Tyler Johnson, Healthy, Chi, C- RW, FA, --, --, 0, 0, 0, 0, 0, 0, 0, 0, 0, 0, 0, 0, 0, 0, 0, 0, --
Luke Evangelista, Healthy, Nsh, RW, FA, NYI, W 5-4, 0, 0, 0, 0, 0, 0, 0, 0, 0, 0, 0, 0, 0, 0, 0, 0, --
Kyle Okposo, Healthy, Buf, RW, FA, --, --, 0, 0, 0, 0, 0, 0, 0, 0, 0, 0, 0, 0, 0, 0, 0, 0, --
Dylan Holloway, Healthy, Edm, C- LW- RW, FA, --, --, 0, 0, 0, 0, 0, 0, 0, 0, 0, 0, 0, 0, 0, 0, 0, 0, --
Craig Smith, Healthy, Wsh, RW, FA, @StL, L 4-5, 0, 0, 0, 0, 0, 0, 0, 0, 0, 0, 0, 0, 0, 0, 0, 0, --
Kyle Burroughs, Healthy, Van, D, FA, --, --, 0, 0, 0, 0, 0, 0, 0, 0, 0, 0, 0, 0, 0, 0, 0, 0, --
JJ Peterka, Healthy, Buf, RW- LW, FA, --, --, 0, 0, 0, 0, 0, 0, 0, 0, 0, 0, 0, 0, 0, 0, 0, 0, --
Cody Glass, Healthy, Nsh, C, FA, NYI, W 5-4, 0, 0, 0, 0, 0, 0, 0, 0, 0, 0, 0, 0, 0, 0, 0, 0, --
Lukas Reichel, Healthy, Chi, LW- C, FA, --, --, 0, 0, 0, 0, 0, 0, 0, 0, 0, 0, 0, 0, 0, 0, 0, 0, --
Sam Lafferty, Healthy, Tor, C- LW, FA, NJ, L 2-3, 0, 0, 0, 0, 0, 0, 0, 0, 0, 0, 0, 0, 0, 0, 0, 0, --
Denis Gurianov, Healthy, Mon, LW- RW, FA, @Cls, L 4-6, 0, 0, 0, 0, 0, 0, 0, 0, 0, 0, 0, 0, 0, 0, 0, 0, --
Josh Bailey, Healthy, NYI, LW- RW, FA, @Nsh, L 4-5, 0, 0, 0, 0, 0, 0, 0, 0, 0, 0, 0, 0, 0, 0, 0, 0, --
Caleb Jones, Healthy, Chi, D, FA, --, --, 0, 0, 0, 0, 0, 0, 0, 0, 0, 0, 0, 0, 0, 0, 0, 0, --
Nikita Zaitsev, Healthy, Chi, D, FA, --, --, 0, 0, 0, 0, 0, 0, 0, 0, 0, 0, 0, 0, 0, 0, 0, 0, --
Dakota Joshua, Healthy, Van, C, FA, --, --, 0, 0, 0, 0, 0, 0, 0, 0, 0, 0, 0, 0, 0, 0, 0, 0, --
Peyton Krebs, Healthy, Buf, C- LW, FA, --, --, 0, 0, 0, 0, 0, 0, 0, 0, 0, 0, 0, 0, 0, 0, 0, 0, --
Alexander Holtz, Healthy, NJ, RW- LW, FA, @Tor, W 3-2, 0, 0, 0, 0, 0, 0, 0, 0, 0, 0, 0, 0, 0, 0, 0, 0, --
Alexander Edler, DTD, LA, D, FA, --, --, 0, 0, 0, 0, 0, 0, 0, 0, 0, 0, 0, 0, 0, 0, 0, 0, --
Austin Watson, Healthy, Ott, RW- LW, FA, --, --, 0, 0, 0, 0, 0, 0, 0, 0, 0, 0, 0, 0, 0, 0, 0, 0, --
Dylan DeMelo, Healthy, Wpg, D, FA, Ana, W 3-2, 0, 0, 0, 0, 0, 0, 0, 0, 0, 0, 0, 0, 0, 0, 0, 0, --
Klim Kostin, Healthy, Edm, RW, FA, --, --, 0, 0, 0, 0, 0, 0, 0, 0, 0, 0, 0, 0, 0, 0, 0, 0, --
Jordan Greenway, Healthy, Buf, LW, FA, --, --, 0, 0, 0, 0, 0, 0, 0, 0, 0, 0, 0, 0, 0, 0, 0, 0, --
Carl Grundstrom, Healthy, LA, LW, FA, --, --, 0, 0, 0, 0, 0, 0, 0, 0, 0, 0, 0, 0, 0, 0, 0, 0, --
Jarred Tinordi, DTD, Chi, D, FA, --, --, 0, 0, 0, 0, 0, 0, 0, 0, 0, 0, 0, 0, 0, 0, 0, 0, --
Mattias Samuelsson, Healthy, Buf, D, FA, --, --, 0, 0, 0, 0, 0, 0, 0, 0, 0, 0, 0, 0, 0, 0, 0, 0, --
Ethan Bear, Healthy, Van, D, FA, --, --, 0, 0, 0, 0, 0, 0, 0, 0, 0, 0, 0, 0, 0, 0, 0, 0, --
Brett Kulak, Healthy, Edm, D, FA, --, --, 0, 0, 0, 0, 0, 0, 0, 0, 0, 0, 0, 0, 0, 0, 0, 0, --
Erik Brannstrom, Healthy, Ott, D, FA, --, --, 0, 0, 0, 0, 0, 0, 0, 0, 0, 0, 0, 0, 0, 0, 0, 0, --
Max Comtois, Healthy, Ana, LW, FA, @Wpg, L 2-3, 0, 0, 0, 0, 0, 0, 0, 0, 0, 0, 0, 0, 0, 0, 0, 0, --
Conor Timmins, Healthy, Tor, D, FA, NJ, L 2-3, 0, 0, 0, 0, 0, 0, 0, 0, 0, 0, 0, 0, 0, 0, 0, 0, --
Sean Walker, Healthy, LA, D, FA, --, --, 0, 0, 0, 0, 0, 0, 0, 0, 0, 0, 0, 0, 0, 0, 0, 0, --
Wayne Simmonds, Healthy, Tor, RW, FA, NJ, L 2-3, 0, 0, 0, 0, 0, 0, 0, 0, 0, 0, 0, 0, 0, 0, 0, 0, --
Ilya Lyubushkin, Healthy, Buf, D, FA, --, --, 0, 0, 0, 0, 0, 0, 0, 0, 0, 0, 0, 0, 0, 0, 0, 0, --
Ryan McLeod, DTD, Edm, C- LW, FA, --, --, 0, 0, 0, 0, 0, 0, 0, 0, 0, 0, 0, 0, 0, 0, 0, 0, --
Duncan Keith, Healthy, Edm, D, FA, --, --, 0, 0, 0, 0, 0, 0, 0, 0, 0, 0, 0, 0, 0, 0, 0, 0, --
Zac Jones, Healthy, NYR, D, FA, @Sea, L 2-3, 0, 0, 0, 0, 0, 0, 0, 0, 0, 0, 0, 0, 0, 0, 0, 0, --
Nils Hoglander, Healthy, Van, LW- RW, FA, --, --, 0, 0, 0, 0, 0, 0, 0, 0, 0, 0, 0, 0, 0, 0, 0, 0, --
Warren Foegele, Healthy, Edm, LW, FA, --, --, 0, 0, 0, 0, 0, 0, 0, 0, 0, 0, 0, 0, 0, 0, 0, 0, --
Jack Johnson, Healthy, Col, D, FA, @Car, W 3-2, 0, 0, 0, 0, 0, 0, 0, 0, 0, 0, 0, 0, 0, 0, 0, 0, --
Ben Hutton, Healthy, Vgk, D, FA, Ari, W 4-1, 0, 0, 0, 0, 0, 0, 0, 0, 0, 0, 0, 0, 0, 0, 0, 0, --
Brandt Clarke, Healthy, LA, D, FA, --, --, 0, 0, 0, 0, 0, 0, 0, 0, 0, 0, 0, 0, 0, 0, 0, 0, --
Zach Sanford, Healthy, Nsh, LW- RW, FA, NYI, W 5-4, 0, 0, 0, 0, 0, 0, 0, 0, 0, 0, 0, 0, 0, 0, 0, 0, --
Walker Duehr, Healthy, Cgy, RW, FA, @TB, L 1-4, 0, 0, 0, 0, 0, 0, 0, 0, 0, 0, 0, 0, 0, 0, 0, 0, --
Yakov Trenin, Healthy, Nsh, C- LW, FA, NYI, W 5-4, 0, 0, 0, 0, 0, 0, 0, 0, 0, 0, 0, 0, 0, 0, 0, 0, --
Colin Miller, Healthy, Dal, D, FA, @Fla, W 6-4, 0, 0, 0, 0, 0, 0, 0, 0, 0, 0, 0, 0, 0, 0, 0, 0, --
Brendan Lemieux, Healthy, Phi, LW- RW, FA, @Bos, L 1-4, 0, 0, 0, 0, 0, 0, 0, 0, 0, 0, 0, 0, 0, 0, 0, 0, --
Mathieu Joseph, Healthy, Ott, RW- LW, FA, --, --, 0, 0, 0, 0, 0, 0, 0, 0, 0, 0, 0, 0, 0, 0, 0, 0, --
Blake Lizotte, Healthy, LA, C, FA, --, --, 0, 0, 0, 0, 0, 0, 0, 0, 0, 0, 0, 0, 0, 0, 0, 0, --
Henri Jokiharju, Healthy, Buf, D, FA, --, --, 0, 0, 0, 0, 0, 0, 0, 0, 0, 0, 0, 0, 0, 0, 0, 0, --
Philipp Kurashev, O, Chi, LW- RW, FA, --, --, 0, 0, 0, 0, 0, 0, 0, 0, 0, 0, 0, 0, 0, 0, 0, 0, --
Cal Foote, Healthy, Nsh, D, FA, NYI, W 5-4, 0, 0, 0, 0, 0, 0, 0, 0, 0, 0, 0, 0, 0, 0, 0, 0, --
William Lockwood, Healthy, NYR, RW, FA, @Sea, L 2-3, 0, 0, 0, 0, 0, 0, 0, 0, 0, 0, 0, 0, 0, 0, 0, 0, --
Matthew Savoie, Healthy, Buf, C, FA, --, --, 0, 0, 0, 0, 0, 0, 0, 0, 0, 0, 0, 0, 0, 0, 0, 0, --
Ridly Greig, Healthy, Ott, C, FA, --, --, 0, 0, 0, 0, 0, 0, 0, 0, 0, 0, 0, 0, 0, 0, 0, 0, --
Phillip Di Giuseppe, Healthy, Van, LW, FA, --, --, 0, 0, 0, 0, 0, 0, 0, 0, 0, 0, 0, 0, 0, 0, 0, 0, --
Alex Turcotte, Healthy, LA, C, FA, --, --, 0, 0, 0, 0, 0, 0, 0, 0, 0, 0, 0, 0, 0, 0, 0, 0, --
Zemgus Girgensons, Healthy, Buf, C- LW, FA, --, --, 0, 0, 0, 0, 0, 0, 0, 0, 0, 0, 0, 0, 0, 0, 0, 0, --
Derick Brassard, O, Ott, C- LW, FA, --, --, 0, 0, 0, 0, 0, 0, 0, 0, 0, 0, 0, 0, 0, 0, 0, 0, --
Michael Amadio, Healthy, Vgk, C- RW, FA, Ari, W 4-1, 0, 0, 0, 0, 0, 0, 0, 0, 0, 0, 0, 0, 0, 0, 0, 0, --
Philip Broberg, Healthy, Edm, D, FA, --, --, 0, 0, 0, 0, 0, 0, 0, 0, 0, 0, 0, 0, 0, 0, 0, 0, --
Kevin Korchinski, Healthy, Chi, D, FA, --, --, 0, 0, 0, 0, 0, 0, 0, 0, 0, 0, 0, 0, 0, 0, 0, 0, --
Jujhar Khaira, Healthy, Chi, LW, FA, --, --, 0, 0, 0, 0, 0, 0, 0, 0, 0, 0, 0, 0, 0, 0, 0, 0, --
Chad Ruhwedel, Healthy, Pit, D, FA, @Min, W 6-4, 0, 0, 0, 0, 0, 0, 0, 0, 0, 0, 0, 0, 0, 0, 0, 0, --
Connor Mackey, Healthy, Ari, D, FA, @Vgk, L 1-4, 0, 0, 0, 0, 0, 0, 0, 0, 0, 0, 0, 0, 0, 0, 0, 0, --
Kurtis MacDermid, Healthy, Col, D, FA, @Car, W 3-2, 0, 0, 0, 0, 0, 0, 0, 0, 0, 0, 0, 0, 0, 0, 0, 0, --
Chris Wideman, Healthy, Mon, D, FA, @Cls, L 4-6, 0, 0, 0, 0, 0, 0, 0, 0, 0, 0, 0, 0, 0, 0, 0, 0, --
Henry Thrun, Healthy, Ana, D, FA, @Wpg, L 2-3, 0, 0, 0, 0, 0, 0, 0, 0, 0, 0, 0, 0, 0, 0, 0, 0, --
Riley Stillman, Healthy, Buf, D, FA, --, --, 0, 0, 0, 0, 0, 0, 0, 0, 0, 0, 0, 0, 0, 0, 0, 0, --
Jacob Bryson, Healthy, Buf, D, FA, --, --, 0, 0, 0, 0, 0, 0, 0, 0, 0, 0, 0, 0, 0, 0, 0, 0, --
Alexey Toropchenko, Healthy, StL, RW- C, FA, Wsh, W 5-4, 0, 0, 0, 0, 0, 0, 0, 0, 0, 0, 0, 0, 0, 0, 0, 0, --
Nick Holden, Healthy, Ott, D, FA, --, --, 0, 0, 0, 0, 0, 0, 0, 0, 0, 0, 0, 0, 0, 0, 0, 0, --
Lukas Rousek, Healthy, Buf, LW- RW, FA, --, --, 0, 0, 0, 0, 0, 0, 0, 0, 0, 0, 0, 0, 0, 0, 0, 0, --
Curtis Lazar, DTD, NJ, RW- C, FA, @Tor, W 3-2, 0, 0, 0, 0, 0, 0, 0, 0, 0, 0, 0, 0, 0, 0, 0, 0, --
Boris Katchouk, Healthy, Chi, LW, FA, --, --, 0, 0, 0, 0, 0, 0, 0, 0, 0, 0, 0, 0, 0, 0, 0, 0, --
Dustin Brown, Healthy, LA, RW, FA, --, --, 0, 0, 0, 0, 0, 0, 0, 0, 0, 0, 0, 0, 0, 0, 0, 0, --
Samuel Fagemo, Healthy, LA, LW- RW, FA, --, --, 0, 0, 0, 0, 0, 0, 0, 0, 0, 0, 0, 0, 0, 0, 0, 0, --
Robin Salo, Healthy, NYI, D, FA, @Nsh, L 4-5, 0, 0, 0, 0, 0, 0, 0, 0, 0, 0, 0, 0, 0, 0, 0, 0, --
Jakub Zboril, Healthy, Bos, D, FA, Phi, W 4-1, 0, 0, 0, 0, 0, 0, 0, 0, 0, 0, 0, 0, 0, 0, 0, 0, --
Mattias Janmark, Healthy, Edm, LW- C, FA, --, --, 0, 0, 0, 0, 0, 0, 0, 0, 0, 0, 0, 0, 0, 0, 0, 0, --
Nicolas Aube-Kubel, Healthy, Wsh, RW, FA, @StL, L 4-5, 0, 0, 0, 0, 0, 0, 0, 0, 0, 0, 0, 0, 0, 0, 0, 0, --
Tobias Bjornfot, Healthy, LA, D, FA, --, --, 0, 0, 0, 0, 0, 0, 0, 0, 0, 0, 0, 0, 0, 0, 0, 0, --
Vinnie Hinostroza, Healthy, Buf, RW- LW, FA, --, --, 0, 0, 0, 0, 0, 0, 0, 0, 0, 0, 0, 0, 0, 0, 0, 0, --
Mark Kastelic, Healthy, Ott, C, FA, --, --, 0, 0, 0, 0, 0, 0, 0, 0, 0, 0, 0, 0, 0, 0, 0, 0, --
Derek Ryan, Healthy, Edm, C- RW, FA, --, --, 0, 0, 0, 0, 0, 0, 0, 0, 0, 0, 0, 0, 0, 0, 0, 0, --
Jack Rathbone, Healthy, Van, D, FA, --, --, 0, 0, 0, 0, 0, 0, 0, 0, 0, 0, 0, 0, 0, 0, 0, 0, --
Frank Nazar, Healthy, Chi, C, FA, --, --, 0, 0, 0, 0, 0, 0, 0, 0, 0, 0, 0, 0, 0, 0, 0, 0, --
Zack Kassian, DTD, Ari, RW, FA, @Vgk, L 1-4, 0, 0, 0, 0, 0, 0, 0, 0, 0, 0, 0, 0, 0, 0, 0, 0, --
Ville Heinola, Healthy, Wpg, D, FA, Ana, W 3-2, 0, 0, 0, 0, 0, 0, 0, 0, 0, 0, 0, 0, 0, 0, 0, 0, --
Rasmus Kupari, Healthy, LA, C- RW, FA, --, --, 0, 0, 0, 0, 0, 0, 0, 0, 0, 0, 0, 0, 0, 0, 0, 0, --
Jonathan Lekkerimaki, Healthy, Van, RW, FA, --, --, 0, 0, 0, 0, 0, 0, 0, 0, 0, 0, 0, 0, 0, 0, 0, 0, --
Joel Armia, Healthy, Mon, RW- LW, FA, @Cls, L 4-6, 0, 0, 0, 0, 0, 0, 0, 0, 0, 0, 0, 0, 0, 0, 0, 0, --
Colin Blackwell, O, Chi, C, FA, --, --, 0, 0, 0, 0, 0, 0, 0, 0, 0, 0, 0, 0, 0, 0, 0, 0, --
Rem Pitlick, Healthy, Mon, C- RW, FA, @Cls, L 4-6, 0, 0, 0, 0, 0, 0, 0, 0, 0, 0, 0, 0, 0, 0, 0, 0, --
Rasmus Asplund, Healthy, Nsh, C- LW- RW, FA, NYI, W 5-4, 0, 0, 0, 0, 0, 0, 0, 0, 0, 0, 0, 0, 0, 0, 0, 0, --
Jordan Spence, Healthy, LA, D, FA, --, --, 0, 0, 0, 0, 0, 0, 0, 0, 0, 0, 0, 0, 0, 0, 0, 0, --
Ryan Murray, IR, Edm, D, FA, --, --, 0, 0, 0, 0, 0, 0, 0, 0, 0, 0, 0, 0, 0, 0, 0, 0, --
Nathan Walker, Healthy, StL, C- LW, FA, Wsh, W 5-4, 0, 0, 0, 0, 0, 0, 0, 0, 0, 0, 0, 0, 0, 0, 0, 0, --
Ian Mitchell, Healthy, Chi, D, FA, --, --, 0, 0, 0, 0, 0, 0, 0, 0, 0, 0, 0, 0, 0, 0, 0, 0, --
Sean Farrell, Healthy, Mon, LW- C, FA, @Cls, L 4-6, 0, 0, 0, 0, 0, 0, 0, 0, 0, 0, 0, 0, 0, 0, 0, 0, --
Jack Studnicka, Healthy, Van, C- RW, FA, --, --, 0, 0, 0, 0, 0, 0, 0, 0, 0, 0, 0, 0, 0, 0, 0, 0, --
Jake Virtanen, Healthy, Edm, RW, FA, --, --, 0, 0, 0, 0, 0, 0, 0, 0, 0, 0, 0, 0, 0, 0, 0, 0, --
MacKenzie Entwistle, Healthy, Chi, RW- C, FA, --, --, 0, 0, 0, 0, 0, 0, 0, 0, 0, 0, 0, 0, 0, 0, 0, 0, --
Alexander Alexeyev, Healthy, Wsh, D, FA, @StL, L 4-5, 0, 0, 0, 0, 0, 0, 0, 0, 0, 0, 0, 0, 0, 0, 0, 0, --
Reese Johnson, Healthy, Chi, RW- C, FA, --, --, 0, 0, 0, 0, 0, 0, 0, 0, 0, 0, 0, 0, 0, 0, 0, 0, --
Kieffer Bellows, Healthy, Phi, LW- C, FA, @Bos, L 1-4, 0, 0, 0, 0, 0, 0, 0, 0, 0, 0, 0, 0, 0, 0, 0, 0, --
Sheldon Dries, Healthy, Van, C- LW, FA, --, --, 0, 0, 0, 0, 0, 0, 0, 0, 0, 0, 0, 0, 0, 0, 0, 0, --
Tucker Poolman, IR, Van, D, FA, --, --, 0, 0, 0, 0, 0, 0, 0, 0, 0, 0, 0, 0, 0, 0, 0, 0, --
Kale Clague, Healthy, Buf, D, FA, --, --, 0, 0, 0, 0, 0, 0, 0, 0, 0, 0, 0, 0, 0, 0, 0, 0, --
Alex Formenton, DTD, Ott, LW, FA, --, --, 0, 0, 0, 0, 0, 0, 0, 0, 0, 0, 0, 0, 0, 0, 0, 0, --
Vincent Desharnais, Healthy, Edm, D, FA, --, --, 0, 0, 0, 0, 0, 0, 0, 0, 0, 0, 0, 0, 0, 0, 0, 0, --
Dylan Gambrell, Healthy, Ott, C, FA, --, --, 0, 0, 0, 0, 0, 0, 0, 0, 0, 0, 0, 0, 0, 0, 0, 0, --
Devin Shore, Healthy, Edm, C- LW, FA, --, --, 0, 0, 0, 0, 0, 0, 0, 0, 0, 0, 0, 0, 0, 0, 0, 0, --
Alex Vlasic, Healthy, Chi, D, FA, --, --, 0, 0, 0, 0, 0, 0, 0, 0, 0, 0, 0, 0, 0, 0, 0, 0, --
Travis Dermott, IR, Van, D, FA, --, --, 0, 0, 0, 0, 0, 0, 0, 0, 0, 0, 0, 0, 0, 0, 0, 0, --
Parker Kelly, O, Ott, C- LW, FA, --, --, 0, 0, 0, 0, 0, 0, 0, 0, 0, 0, 0, 0, 0, 0, 0, 0, --
Cole Guttman, Healthy, Chi, C, FA, --, --, 0, 0, 0, 0, 0, 0, 0, 0, 0, 0, 0, 0, 0, 0, 0, 0, --
Kevin Bahl, Healthy, NJ, D, FA, @Tor, W 3-2, 0, 0, 0, 0, 0, 0, 0, 0, 0, 0, 0, 0, 0, 0, 0, 0, --
Billy Sweezey, Healthy, Cls, D, FA, Mon, W 6-4, 0, 0, 0, 0, 0, 0, 0, 0, 0, 0, 0, 0, 0, 0, 0, 0, --
Jiri Kulich, Healthy, Buf, C, FA, --, --, 0, 0, 0, 0, 0, 0, 0, 0, 0, 0, 0, 0, 0, 0, 0, 0, --
Casey Fitzgerald, Healthy, Fla, D, FA, Dal, L 4-6, 0, 0, 0, 0, 0, 0, 0, 0, 0, 0, 0, 0, 0, 0, 0, 0, --
Dylan Coghlan, Healthy, Car, D, FA, Col, L 2-3, 0, 0, 0, 0, 0, 0, 0, 0, 0, 0, 0, 0, 0, 0, 0, 0, --
Danny DeKeyser, Healthy, Van, D, FA, --, --, 0, 0, 0, 0, 0, 0, 0, 0, 0, 0, 0, 0, 0, 0, 0, 0, --
Noah Ostlund, Healthy, Buf, C, FA, --, --, 0, 0, 0, 0, 0, 0, 0, 0, 0, 0, 0, 0, 0, 0, 0, 0, --
Tyler Kleven, Healthy, Ott, D, FA, --, --, 0, 0, 0, 0, 0, 0, 0, 0, 0, 0, 0, 0, 0, 0, 0, 0, --
Nils Aman, Healthy, Van, C, FA, --, --, 0, 0, 0, 0, 0, 0, 0, 0, 0, 0, 0, 0, 0, 0, 0, 0, --
Adam Beckman, Healthy, Min, C- LW, FA, Pit, L 4-6, 0, 0, 0, 0, 0, 0, 0, 0, 0, 0, 0, 0, 0, 0, 0, 0, --
Alex Nylander, Healthy, Pit, LW, FA, @Min, W 6-4, 0, 0, 0, 0, 0, 0, 0, 0, 0, 0, 0, 0, 0, 0, 0, 0, --
Anders Bjork, Healthy, Chi, LW- RW, FA, --, --, 0, 0, 0, 0, 0, 0, 0, 0, 0, 0, 0, 0, 0, 0, 0, 0, --
Isaak Phillips, Healthy, Chi, D, FA, --, --, 0, 0, 0, 0, 0, 0, 0, 0, 0, 0, 0, 0, 0, 0, 0, 0, --
Jaret Anderson-Dolan, Healthy, LA, C, FA, --, --, 0, 0, 0, 0, 0, 0, 0, 0, 0, 0, 0, 0, 0, 0, 0, 0, --
Kris Russell, Healthy, Edm, D, FA, --, --, 0, 0, 0, 0, 0, 0, 0, 0, 0, 0, 0, 0, 0, 0, 0, 0, --
Greg McKegg, Healthy, Edm, C- LW, FA, --, --, 0, 0, 0, 0, 0, 0, 0, 0, 0, 0, 0, 0, 0, 0, 0, 0, --
Christian Wolanin, O, Van, D, FA, --, --, 0, 0, 0, 0, 0, 0, 0, 0, 0, 0, 0, 0, 0, 0, 0, 0, --
Slater Koekkoek, Healthy, Edm, D, FA, --, --, 0, 0, 0, 0, 0, 0, 0, 0, 0, 0, 0, 0, 0, 0, 0, 0, --
Kevin Rooney, Healthy, Cgy, C- LW, FA, @TB, L 1-4, 0, 0, 0, 0, 0, 0, 0, 0, 0, 0, 0, 0, 0, 0, 0, 0, --
Joe Snively, Healthy, Wsh, LW, FA, @StL, L 4-5, 0, 0, 0, 0, 0, 0, 0, 0, 0, 0, 0, 0, 0, 0, 0, 0, --
Samuel Walker, Healthy, Min, LW, FA, Pit, L 4-6, 0, 0, 0, 0, 0, 0, 0, 0, 0, 0, 0, 0, 0, 0, 0, 0, --
Noah Juulsen, O, Van, D, FA, --, --, 0, 0, 0, 0, 0, 0, 0, 0, 0, 0, 0, 0, 0, 0, 0, 0, --
Josh Gorges, Healthy, Buf, D, FA, --, --, 0, 0, 0, 0, 0, 0, 0, 0, 0, 0, 0, 0, 0, 0, 0, 0, --
Egor Zamula, Healthy, Phi, D, FA, @Bos, L 1-4, 0, 0, 0, 0, 0, 0, 0, 0, 0, 0, 0, 0, 0, 0, 0, 0, --
Andrew Shaw, Healthy, Chi, C- RW, FA, --, --, 0, 0, 0, 0, 0, 0, 0, 0, 0, 0, 0, 0, 0, 0, 0, 0, --
Jacob Larsson, Healthy, Ott, D, FA, --, --, 0, 0, 0, 0, 0, 0, 0, 0, 0, 0, 0, 0, 0, 0, 0, 0, --
Vladimir Tkachev, Healthy, LA, LW- RW, FA, --, --, 0, 0, 0, 0, 0, 0, 0, 0, 0, 0, 0, 0, 0, 0, 0, 0, --
Sam Rinzel, Healthy, Chi, D, FA, --, --, 0, 0, 0, 0, 0, 0, 0, 0, 0, 0, 0, 0, 0, 0, 0, 0, --
Patrick Wiercioch, Healthy, Van, D, FA, --, --, 0, 0, 0, 0, 0, 0, 0, 0, 0, 0, 0, 0, 0, 0, 0, 0, --
Alec Regula, Healthy, Chi, D, FA, --, --, 0, 0, 0, 0, 0, 0, 0, 0, 0, 0, 0, 0, 0, 0, 0, 0, --
Nikita Nesterenko, Healthy, Ana, LW, FA, @Wpg, L 2-3, 0, 0, 0, 0, 0, 0, 0, 0, 0, 0, 0, 0, 0, 0, 0, 0, --
Jansen Harkins, Healthy, Wpg, C- LW, FA, Ana, W 3-2, 0, 0, 0, 0, 0, 0, 0, 0, 0, 0, 0, 0, 0, 0, 0, 0, --
Karson Kuhlman, Healthy, Wpg, C- RW, FA, Ana, W 3-2, 0, 0, 0, 0, 0, 0, 0, 0, 0, 0, 0, 0, 0, 0, 0, 0, --
Lawrence Pilut, Healthy, Buf, D, FA, --, --, 0, 0, 0, 0, 0, 0, 0, 0, 0, 0, 0, 0, 0, 0, 0, 0, --
Jacob Bernard-Docker, Healthy, Ott, D, FA, --, --, 0, 0, 0, 0, 0, 0, 0, 0, 0, 0, 0, 0, 0, 0, 0, 0, --
Lane Pederson, DTD, Cls, C, FA, Mon, W 6-4, 0, 0, 0, 0, 0, 0, 0, 0, 0, 0, 0, 0, 0, 0, 0, 0, --
Jake Leschyshyn, Healthy, NYR, C, FA, @Sea, L 2-3, 0, 0, 0, 0, 0, 0, 0, 0, 0, 0, 0, 0, 0, 0, 0, 0, --
Markus Niemelainen, Healthy, Edm, D, FA, --, --, 0, 0, 0, 0, 0, 0, 0, 0, 0, 0, 0, 0, 0, 0, 0, 0, --
Chris Kunitz, Healthy, Chi, LW, FA, --, --, 0, 0, 0, 0, 0, 0, 0, 0, 0, 0, 0, 0, 0, 0, 0, 0, --
Dave Gust, Healthy, Chi, RW, FA, --, --, 0, 0, 0, 0, 0, 0, 0, 0, 0, 0, 0, 0, 0, 0, 0, 0, --
Reid Schaefer, Healthy, Nsh, LW, FA, NYI, W 5-4, 0, 0, 0, 0, 0, 0, 0, 0, 0, 0, 0, 0, 0, 0, 0, 0, --
Josiah Slavin, Healthy, Chi, LW, FA, --, --, 0, 0, 0, 0, 0, 0, 0, 0, 0, 0, 0, 0, 0, 0, 0, 0, --
Brandon Manning, Healthy, Edm, D, FA, --, --, 0, 0, 0, 0, 0, 0, 0, 0, 0, 0, 0, 0, 0, 0, 0, 0, --
Oskar Olausson, Healthy, Col, RW, FA, @Car, W 3-2, 0, 0, 0, 0, 0, 0, 0, 0, 0, 0, 0, 0, 0, 0, 0, 0, --
Buddy Robinson, Healthy, Chi, RW, FA, --, --, 0, 0, 0, 0, 0, 0, 0, 0, 0, 0, 0, 0, 0, 0, 0, 0, --
Filip Roos, Healthy, Chi, D, FA, --, --, 0, 0, 0, 0, 0, 0, 0, 0, 0, 0, 0, 0, 0, 0, 0, 0, --
Brad Malone, Healthy, Edm, LW- C, FA, --, --, 0, 0, 0, 0, 0, 0, 0, 0, 0, 0, 0, 0, 0, 0, 0, 0, --
Lassi Thomson, Healthy, Ott, D, FA, --, --, 0, 0, 0, 0, 0, 0, 0, 0, 0, 0, 0, 0, 0, 0, 0, 0, --
Lias Andersson, Healthy, LA, C- LW, FA, --, --, 0, 0, 0, 0, 0, 0, 0, 0, 0, 0, 0, 0, 0, 0, 0, 0, --
Egor Sokolov, Healthy, Ott, LW, FA, --, --, 0, 0, 0, 0, 0, 0, 0, 0, 0, 0, 0, 0, 0, 0, 0, 0, --
Alex Burrows, Healthy, Ott, RW, FA, --, --, 0, 0, 0, 0, 0, 0, 0, 0, 0, 0, 0, 0, 0, 0, 0, 0, --
Brandon Davidson, Healthy, Buf, D, FA, --, --, 0, 0, 0, 0, 0, 0, 0, 0, 0, 0, 0, 0, 0, 0, 0, 0, --
Fredrik Olofsson, Healthy, Dal, LW, FA, @Fla, W 6-4, 0, 0, 0, 0, 0, 0, 0, 0, 0, 0, 0, 0, 0, 0, 0, 0, --
Guillaume Brisebois, Healthy, Van, D, FA, --, --, 0, 0, 0, 0, 0, 0, 0, 0, 0, 0, 0, 0, 0, 0, 0, 0, --
Justin Bailey, Healthy, Van, RW, FA, --, --, 0, 0, 0, 0, 0, 0, 0, 0, 0, 0, 0, 0, 0, 0, 0, 0, --
Tim Berni, Healthy, Cls, D, FA, Mon, W 6-4, 0, 0, 0, 0, 0, 0, 0, 0, 0, 0, 0, 0, 0, 0, 0, 0, --
Owen Beck, Healthy, Mon, C, FA, @Cls, L 4-6, 0, 0, 0, 0, 0, 0, 0, 0, 0, 0, 0, 0, 0, 0, 0, 0, --
Wyatt Kaiser, Healthy, Chi, D, FA, --, --, 0, 0, 0, 0, 0, 0, 0, 0, 0, 0, 0, 0, 0, 0, 0, 0, --
Mike Hardman, Healthy, Chi, RW- LW, FA, --, --, 0, 0, 0, 0, 0, 0, 0, 0, 0, 0, 0, 0, 0, 0, 0, 0, --
Charles Hudon, Healthy, Col, LW- RW, FA, @Car, W 3-2, 0, 0, 0, 0, 0, 0, 0, 0, 0, 0, 0, 0, 0, 0, 0, 0, --
Jason Garrison, Healthy, Chi, D, FA, --, --, 0, 0, 0, 0, 0, 0, 0, 0, 0, 0, 0, 0, 0, 0, 0, 0, --
Jason Demers, Healthy, Edm, D, FA, --, --, 0, 0, 0, 0, 0, 0, 0, 0, 0, 0, 0, 0, 0, 0, 0, 0, --
Aidan McDonough, Healthy, Van, LW, FA, --, --, 0, 0, 0, 0, 0, 0, 0, 0, 0, 0, 0, 0, 0, 0, 0, 0, --
Casey Nelson, Healthy, Buf, D, FA, --, --, 0, 0, 0, 0, 0, 0, 0, 0, 0, 0, 0, 0, 0, 0, 0, 0, --
Samuel Bolduc, Healthy, NYI, D, FA, @Nsh, L 4-5, 0, 0, 0, 0, 0, 0, 0, 0, 0, 0, 0, 0, 0, 0, 0, 0, --
Dillon Heatherington, Healthy, Ott, D, FA, --, --, 0, 0, 0, 0, 0, 0, 0, 0, 0, 0, 0, 0, 0, 0, 0, 0, --
Kyle Turris, Healthy, Edm, C- RW, FA, --, --, 0, 0, 0, 0, 0, 0, 0, 0, 0, 0, 0, 0, 0, 0, 0, 0, --
James Hamblin, Healthy, Edm, RW, FA, --, --, 0, 0, 0, 0, 0, 0, 0, 0, 0, 0, 0, 0, 0, 0, 0, 0, --
Cody Franson, Healthy, Chi, D, FA, --, --, 0, 0, 0, 0, 0, 0, 0, 0, 0, 0, 0, 0, 0, 0, 0, 0, --
Stefan Elliott, Healthy, Ott, D, FA, --, --, 0, 0, 0, 0, 0, 0, 0, 0, 0, 0, 0, 0, 0, 0, 0, 0, --
William Cuylle, Healthy, NYR, LW, FA, @Sea, L 2-3, 0, 0, 0, 0, 0, 0, 0, 0, 0, 0, 0, 0, 0, 0, 0, 0, --
Nate Thompson, Healthy, LA, C, FA, --, --, 0, 0, 0, 0, 0, 0, 0, 0, 0, 0, 0, 0, 0, 0, 0, 0, --
Chase Priskie, Healthy, Ana, D, FA, @Wpg, L 2-3, 0, 0, 0, 0, 0, 0, 0, 0, 0, 0, 0, 0, 0, 0, 0, 0, --
Alexander Burmistrov, Healthy, Van, C, FA, --, --, 0, 0, 0, 0, 0, 0, 0, 0, 0, 0, 0, 0, 0, 0, 0, 0, --
Dylan Sikura, Healthy, Ana, C- LW, FA, @Wpg, L 2-3, 0, 0, 0, 0, 0, 0, 0, 0, 0, 0, 0, 0, 0, 0, 0, 0, --
Michael Kesselring, Healthy, Ari, D, FA, @Vgk, L 1-4, 0, 0, 0, 0, 0, 0, 0, 0, 0, 0, 0, 0, 0, 0, 0, 0, --
Tyler Benson, IR, Edm, LW- RW, FA, --, --, 0, 0, 0, 0, 0, 0, 0, 0, 0, 0, 0, 0, 0, 0, 0, 0, --
Elliot Desnoyers, Healthy, Phi, LW, FA, @Bos, L 1-4, 0, 0, 0, 0, 0, 0, 0, 0, 0, 0, 0, 0, 0, 0, 0, 0, --
Anthony Richard, Healthy, Mon, C, FA, @Cls, L 4-6, 0, 0, 0, 0, 0, 0, 0, 0, 0, 0, 0, 0, 0, 0, 0, 0, --
Mac Hollowell, O, Tor, D, FA, NJ, L 2-3, 0, 0, 0, 0, 0, 0, 0, 0, 0, 0, 0, 0, 0, 0, 0, 0, --
Bobby McMann, IR, Tor, C, FA, NJ, L 2-3, 0, 0, 0, 0, 0, 0, 0, 0, 0, 0, 0, 0, 0, 0, 0, 0, --
Arttu Ruotsalainen, Healthy, Buf, C- LW, FA, --, --, 0, 0, 0, 0, 0, 0, 0, 0, 0, 0, 0, 0, 0, 0, 0, 0, --
Kristians Rubins, Healthy, Cgy, D, FA, @TB, L 1-4, 0, 0, 0, 0, 0, 0, 0, 0, 0, 0, 0, 0, 0, 0, 0, 0, --
Brady Keeper, Healthy, Van, D, FA, --, --, 0, 0, 0, 0, 0, 0, 0, 0, 0, 0, 0, 0, 0, 0, 0, 0, --
Jacob Moverare, Healthy, LA, D, FA, --, --, 0, 0, 0, 0, 0, 0, 0, 0, 0, 0, 0, 0, 0, 0, 0, 0, --
Brooks Laich, Healthy, LA, C, FA, --, --, 0, 0, 0, 0, 0, 0, 0, 0, 0, 0, 0, 0, 0, 0, 0, 0, --
Ryan MacInnis, Healthy, Buf, C, FA, --, --, 0, 0, 0, 0, 0, 0, 0, 0, 0, 0, 0, 0, 0, 0, 0, 0, --
Riley Sheahan, Healthy, Buf, C- LW, FA, --, --, 0, 0, 0, 0, 0, 0, 0, 0, 0, 0, 0, 0, 0, 0, 0, 0, --
Frederic Allard, Healthy, Mon, D, FA, @Cls, L 4-6, 0, 0, 0, 0, 0, 0, 0, 0, 0, 0, 0, 0, 0, 0, 0, 0, --
Jean-Luc Foudy, Healthy, Col, RW, FA, @Car, W 3-2, 0, 0, 0, 0, 0, 0, 0, 0, 0, 0, 0, 0, 0, 0, 0, 0, --
Egor Afanasyev, Healthy, Nsh, LW, FA, NYI, W 5-4, 0, 0, 0, 0, 0, 0, 0, 0, 0, 0, 0, 0, 0, 0, 0, 0, --
Austin Wagner, Healthy, Chi, LW, FA, --, --, 0, 0, 0, 0, 0, 0, 0, 0, 0, 0, 0, 0, 0, 0, 0, 0, --
T.J. Tynan, Healthy, LA, C, FA, --, --, 0, 0, 0, 0, 0, 0, 0, 0, 0, 0, 0, 0, 0, 0, 0, 0, --
Jacob Nilsson, Healthy, Chi, C, FA, --, --, 0, 0, 0, 0, 0, 0, 0, 0, 0, 0, 0, 0, 0, 0, 0, 0, --
William Dufour, Healthy, NYI, RW, FA, @Nsh, L 4-5, 0, 0, 0, 0, 0, 0, 0, 0, 0, 0, 0, 0, 0, 0, 0, 0, --
