Steven Lorentz, Healthy, SJ, C- LW, FA, @NJ, L 1-2, 1, 0, 0, 0, 0, 0, 0, 0, 0, 0, 4, 8, 0, 1, 0, 0, -0.3
Jake DeBrusk, Healthy, Bos, LW- RW, BBS, Min, W 4-3, 1, 0, 0, -2, 0, 0, 0, 0, 0, 0, 0, 1, 0, 4, 1, 0, -0.4
Leon Draisaitl, Healthy, Edm, LW- C, SALT, StL, L 0-2, 1, 0, 0, -1, 2, 0, 0, 0, 0, 0, 6, 6, 0, 3, 0, 0, -0.4
Martin Necas, Healthy, Car, C- RW, HERB, @Cgy, L 2-3, 1, 0, 0, -1, 0, 0, 0, 0, 0, 0, 2, 2, 0, 1, 0, 0, -0.4
Scott Mayfield, Healthy, NYI, D, FA, @TB, L 3-5, 1, 0, 0, -1, 0, 0, 0, 0, 0, 0, 0, 0, 0, 1, 0, 0, -0.4
Arthur Kaliyev, Healthy, LA, RW- LW, FA, @Wsh, L 3-4, 1, 0, 0, -1, 0, 0, 0, 0, 0, 0, 0, 0, 0, 1, 0, 0, -0.4
Dante Fabbro, Healthy, Nsh, D, FA, Phi, L 1-3, 1, 0, 0, -2, 0, 0, 0, 0, 0, 0, 0, 0, 0, 0, 2, 0, -0.4
Zack Kassian, DTD, Ari, RW, FA, @Ott, L 2-6, 1, 0, 0, -2, 0, 0, 0, 0, 0, 0, 0, 0, 0, 0, 2, 0, -0.4
Sam Steel, Healthy, Min, C- LW, FA, @Bos, L 3-4, 1, 0, 0, 0, 0, 0, 0, 0, 0, 0, 2, 6, 0, 0, 0, 0, -0.4
Josh Morrissey, Healthy, Wpg, D, LKR, Tor, L 1-4, 1, 0, 0, -1, 11, 0, 0, 0, 0, 0, 0, 0, 0, 1, 0, 2, -0.5
Alexander Kerfoot, Healthy, Tor, C- LW- RW, FA, @Wpg, W 4-1, 1, 0, 0, -1, 0, 0, 0, 0, 0, 0, 1, 2, 0, 1, 0, 0, -0.5
Nicolas Deslauriers, Healthy, Phi, LW- RW, FA, @Nsh, W 3-1, 1, 0, 0, 0, 5, 0, 0, 0, 0, 0, 0, 0, 0, 0, 0, 0, -0.5
Michael Stone, Healthy, Cgy, D, FA, Car, W 3-2, 1, 0, 0, -1, 0, 0, 0, 0, 0, 0, 0, 0, 0, 0, 0, 0, -0.5
Brent Burns, Healthy, Car, D, BBS, @Cgy, L 2-3, 1, 0, 0, -1, 2, 0, 0, 0, 0, 0, 0, 0, 0, 1, 0, 0, -0.6
Ryan McLeod, DTD, Edm, C- LW, FA, StL, L 0-2, 1, 0, 0, 0, 0, 0, 0, 0, 0, 0, 3, 9, 0, 0, 0, 0, -0.6
"Liam OBrien", Healthy, Ari, LW- C, FA, @Ott, L 2-6, 1, 0, 0, -2, 7, 0, 0, 0, 0, 0, 0, 0, 0, 0, 2, 1, -0.6
Connor McDavid, Healthy, Edm, C, DINK, StL, L 0-2, 1, 0, 0, -1, 0, 0, 0, 0, 0, 0, 5, 8, 0, 2, 0, 0, -0.6
Kevin Fiala, DTD, LA, C- LW- RW, CLB, @Wsh, L 3-4, 1, 0, 0, -2, 2, 0, 0, 0, 0, 0, 0, 0, 0, 1, 0, 1, -0.6
Mathew Barzal, O, NYI, C, HERB, @TB, L 3-5, 1, 0, 0, -2, 2, 0, 0, 0, 0, 0, 2, 3, 0, 2, 0, 1, -0.6
Joel Eriksson Ek, Healthy, Min, C, ME, @Bos, L 3-4, 1, 0, 0, -3, 2, 0, 0, 0, 0, 0, 8, 11, 0, 2, 2, 1, -0.7
Christian Fischer, Healthy, Ari, RW- LW, FA, @Ott, L 2-6, 1, 0, 0, -1, 0, 0, 0, 0, 0, 0, 0, 2, 0, 0, 0, 0, -0.7
Kyle Palmieri, Healthy, NYI, RW, FA, @TB, L 3-5, 1, 0, 0, -2, 0, 0, 0, 0, 0, 0, 1, 0, 0, 1, 0, 0, -0.8
Gabriel Vilardi, DTD, LA, C- RW, FA, @Wsh, L 3-4, 1, 0, 0, -2, 0, 0, 0, 0, 0, 0, 0, 0, 0, 1, 0, 0, -0.9
Evgeni Malkin, Healthy, Pit, C, SLC, @Cls, W 6-3, 1, 0, 0, -2, 0, 0, 0, 0, 0, 0, 6, 8, 0, 2, 0, 0, -1.0
Bryan Rust, Healthy, Pit, RW, FA, @Cls, W 6-3, 1, 0, 0, -2, 2, 0, 0, 0, 0, 0, 0, 0, 0, 1, 0, 0, -1.1
J.J. Moser, Healthy, Ari, D, FA, @Ott, L 2-6, 1, 0, 0, -3, 0, 0, 0, 0, 0, 0, 0, 0, 0, 1, 1, 0, -1.1
Jani Hakanpaa, Healthy, Dal, D, HERB, @Mon, W 5-2, 1, 0, 0, -1, 6, 0, 0, 0, 0, 0, 0, 0, 0, 0, 0, 0, -1.1
Tyson Jost, Healthy, Buf, C- LW, FA, @Van, W 5-1, 1, 0, 0, -3, 0, 0, 0, 0, 0, 0, 0, 1, 0, 0, 1, 0, -1.3
Jack Rathbone, Healthy, Van, D, FA, Buf, L 1-5, 1, 0, 0, -3, 0, 0, 0, 0, 0, 0, 0, 0, 0, 2, 0, 0, -1.3
Adam Fox, Healthy, NYR, D, SALT, --, --, 0, 0, 0, 0, 0, 0, 0, 0, 0, 0, 0, 0, 0, 0, 0, 0, --
Matthew Tkachuk, Healthy, Fla, LW- RW, CLB, --, --, 0, 0, 0, 0, 0, 0, 0, 0, 0, 0, 0, 0, 0, 0, 0, 0, --
Mika Zibanejad, Healthy, NYR, C, ME, --, --, 0, 0, 0, 0, 0, 0, 0, 0, 0, 0, 0, 0, 0, 0, 0, 0, --
Aleksander Barkov, Healthy, Fla, C, SALT, --, --, 0, 0, 0, 0, 0, 0, 0, 0, 0, 0, 0, 0, 0, 0, 0, 0, --
Artemi Panarin, Healthy, NYR, LW, HERB, --, --, 0, 0, 0, 0, 0, 0, 0, 0, 0, 0, 0, 0, 0, 0, 0, 0, --
Moritz Seider, Healthy, Det, D, SALT, --, --, 0, 0, 0, 0, 0, 0, 0, 0, 0, 0, 0, 0, 0, 0, 0, 0, --
Jacob Trouba, Healthy, NYR, D, BBS, --, --, 0, 0, 0, 0, 0, 0, 0, 0, 0, 0, 0, 0, 0, 0, 0, 0, --
Dylan Larkin, Healthy, Det, C, OXP, --, --, 0, 0, 0, 0, 0, 0, 0, 0, 0, 0, 0, 0, 0, 0, 0, 0, --
Chris Kreider, Healthy, NYR, LW- RW, LKR, --, --, 0, 0, 0, 0, 0, 0, 0, 0, 0, 0, 0, 0, 0, 0, 0, 0, --
Patrick Kane, Healthy, NYR, RW, FA, --, --, 0, 0, 0, 0, 0, 0, 0, 0, 0, 0, 0, 0, 0, 0, 0, 0, --
Brandon Montour, Healthy, Fla, D, CLB, --, --, 0, 0, 0, 0, 0, 0, 0, 0, 0, 0, 0, 0, 0, 0, 0, 0, --
Aaron Ekblad, Healthy, Fla, D, SALT, --, --, 0, 0, 0, 0, 0, 0, 0, 0, 0, 0, 0, 0, 0, 0, 0, 0, --
Sam Reinhart, Healthy, Fla, RW- C, ME, --, --, 0, 0, 0, 0, 0, 0, 0, 0, 0, 0, 0, 0, 0, 0, 0, 0, --
Seth Jones, Healthy, Chi, D, BOWS, --, --, 0, 0, 0, 0, 0, 0, 0, 0, 0, 0, 0, 0, 0, 0, 0, 0, --
Vincent Trocheck, Healthy, NYR, C, OXP, --, --, 0, 0, 0, 0, 0, 0, 0, 0, 0, 0, 0, 0, 0, 0, 0, 0, --
Trevor Zegras, Healthy, Ana, C, FA, --, --, 0, 0, 0, 0, 0, 0, 0, 0, 0, 0, 0, 0, 0, 0, 0, 0, --
Adam Larsson, Healthy, Sea, D, DINK, --, --, 0, 0, 0, 0, 0, 0, 0, 0, 0, 0, 0, 0, 0, 0, 0, 0, --
Vince Dunn, Healthy, Sea, D, LKR, --, --, 0, 0, 0, 0, 0, 0, 0, 0, 0, 0, 0, 0, 0, 0, 0, 0, --
Matty Beniers, Healthy, Sea, C, CLB, --, --, 0, 0, 0, 0, 0, 0, 0, 0, 0, 0, 0, 0, 0, 0, 0, 0, --
Carter Verhaeghe, Healthy, Fla, C- LW, HERB, --, --, 0, 0, 0, 0, 0, 0, 0, 0, 0, 0, 0, 0, 0, 0, 0, 0, --
Troy Terry, O, Ana, C- RW, FA, --, --, 0, 0, 0, 0, 0, 0, 0, 0, 0, 0, 0, 0, 0, 0, 0, 0, --
David Perron, Healthy, Det, RW, FA, --, --, 0, 0, 0, 0, 0, 0, 0, 0, 0, 0, 0, 0, 0, 0, 0, 0, --
Jared McCann, Healthy, Sea, LW- C, FA, --, --, 0, 0, 0, 0, 0, 0, 0, 0, 0, 0, 0, 0, 0, 0, 0, 0, --
Oliver Bjorkstrand, Healthy, Sea, RW, FA, --, --, 0, 0, 0, 0, 0, 0, 0, 0, 0, 0, 0, 0, 0, 0, 0, 0, --
Sam Bennett, O, Fla, LW- C, FA, --, --, 0, 0, 0, 0, 0, 0, 0, 0, 0, 0, 0, 0, 0, 0, 0, 0, --
John Klingberg, Healthy, Min, D, FA, @Bos, L 3-4, 0, 0, 0, 0, 0, 0, 0, 0, 0, 0, 0, 0, 0, 0, 0, 0, --
Andre Burakovsky, IR, Sea, LW- RW, FA, --, --, 0, 0, 0, 0, 0, 0, 0, 0, 0, 0, 0, 0, 0, 0, 0, 0, --
Gustav Forsling, Healthy, Fla, D, HERB, --, --, 0, 0, 0, 0, 0, 0, 0, 0, 0, 0, 0, 0, 0, 0, 0, 0, --
Tyler Bertuzzi, Healthy, Bos, LW- RW, ME, Min, W 4-3, 0, 0, 0, 0, 0, 0, 0, 0, 0, 0, 0, 0, 0, 0, 0, 0, --
Kevin Shattenkirk, Healthy, Ana, D, FA, --, --, 0, 0, 0, 0, 0, 0, 0, 0, 0, 0, 0, 0, 0, 0, 0, 0, --
Lucas Raymond, Healthy, Det, LW- RW, BOWS, --, --, 0, 0, 0, 0, 0, 0, 0, 0, 0, 0, 0, 0, 0, 0, 0, 0, --
Jakub Vrana, Healthy, StL, C- LW, FA, @Edm, W 2-0, 0, 0, 0, 0, 0, 0, 0, 0, 0, 0, 0, 0, 0, 0, 0, 0, --
Ben Chiarot, Healthy, Det, D, FA, --, --, 0, 0, 0, 0, 0, 0, 0, 0, 0, 0, 0, 0, 0, 0, 0, 0, --
Ryan Strome, Healthy, Ana, C, FA, --, --, 0, 0, 0, 0, 0, 0, 0, 0, 0, 0, 0, 0, 0, 0, 0, 0, --
Anton Lundell, Healthy, Fla, C, FA, --, --, 0, 0, 0, 0, 0, 0, 0, 0, 0, 0, 0, 0, 0, 0, 0, 0, --
Dominik Kubalik, Healthy, Det, LW- RW, FA, --, --, 0, 0, 0, 0, 0, 0, 0, 0, 0, 0, 0, 0, 0, 0, 0, 0, --
Filip Hronek, O, Van, D, OXP, Buf, L 1-5, 0, 0, 0, 0, 0, 0, 0, 0, 0, 0, 0, 0, 0, 0, 0, 0, --
Andrew Copp, Healthy, Det, C- LW- RW, FA, --, --, 0, 0, 0, 0, 0, 0, 0, 0, 0, 0, 0, 0, 0, 0, 0, 0, --
"KAndre Miller", Healthy, NYR, D, ME, --, --, 0, 0, 0, 0, 0, 0, 0, 0, 0, 0, 0, 0, 0, 0, 0, 0, --
Shane Wright, Healthy, Sea, C, FA, --, --, 0, 0, 0, 0, 0, 0, 0, 0, 0, 0, 0, 0, 0, 0, 0, 0, --
Brandon Tanev, Healthy, Sea, LW- RW, FA, --, --, 0, 0, 0, 0, 0, 0, 0, 0, 0, 0, 0, 0, 0, 0, 0, 0, --
Cam Fowler, Healthy, Ana, D, FA, --, --, 0, 0, 0, 0, 0, 0, 0, 0, 0, 0, 0, 0, 0, 0, 0, 0, --
Max Domi, Healthy, Dal, C- LW- RW, FA, @Mon, W 5-2, 0, 0, 0, 0, 0, 0, 0, 0, 0, 0, 0, 0, 0, 0, 0, 0, --
Jake McCabe, DTD, Tor, D, FA, @Wpg, W 4-1, 0, 0, 0, 0, 0, 0, 0, 0, 0, 0, 0, 0, 0, 0, 0, 0, --
Radko Gudas, Healthy, Fla, D, BOWS, --, --, 0, 0, 0, 0, 0, 0, 0, 0, 0, 0, 0, 0, 0, 0, 0, 0, --
Alexis Lafreniere, Healthy, NYR, LW- RW, CLB, --, --, 0, 0, 0, 0, 0, 0, 0, 0, 0, 0, 0, 0, 0, 0, 0, 0, --
Jordan Eberle, Healthy, Sea, RW- LW, FA, --, --, 0, 0, 0, 0, 0, 0, 0, 0, 0, 0, 0, 0, 0, 0, 0, 0, --
Filip Chytil, Healthy, NYR, RW- C, FA, --, --, 0, 0, 0, 0, 0, 0, 0, 0, 0, 0, 0, 0, 0, 0, 0, 0, --
Sammy Blais, Healthy, StL, LW- RW, FA, @Edm, W 2-0, 0, 0, 0, 0, 0, 0, 0, 0, 0, 0, 0, 0, 0, 0, 0, 0, --
Yanni Gourde, Healthy, Sea, LW- C- RW, FA, --, --, 0, 0, 0, 0, 0, 0, 0, 0, 0, 0, 0, 0, 0, 0, 0, 0, --
Jonathan Toews, Healthy, Chi, C, FA, --, --, 0, 0, 0, 0, 0, 0, 0, 0, 0, 0, 0, 0, 0, 0, 0, 0, --
Mason McTavish, Healthy, Ana, C, BOWS, --, --, 0, 0, 0, 0, 0, 0, 0, 0, 0, 0, 0, 0, 0, 0, 0, 0, --
Frank Vatrano, Healthy, Ana, LW- RW, FA, --, --, 0, 0, 0, 0, 0, 0, 0, 0, 0, 0, 0, 0, 0, 0, 0, 0, --
Connor Murphy, Healthy, Chi, D, FA, --, --, 0, 0, 0, 0, 0, 0, 0, 0, 0, 0, 0, 0, 0, 0, 0, 0, --
Jaden Schwartz, Healthy, Sea, LW- RW, FA, --, --, 0, 0, 0, 0, 0, 0, 0, 0, 0, 0, 0, 0, 0, 0, 0, 0, --
Justin Schultz, Healthy, Sea, D, FA, --, --, 0, 0, 0, 0, 0, 0, 0, 0, 0, 0, 0, 0, 0, 0, 0, 0, --
Adam Henrique, IR, Ana, C- LW, FA, --, --, 0, 0, 0, 0, 0, 0, 0, 0, 0, 0, 0, 0, 0, 0, 0, 0, --
Anthony Duclair, Healthy, Fla, LW- RW, SLC, --, --, 0, 0, 0, 0, 0, 0, 0, 0, 0, 0, 0, 0, 0, 0, 0, 0, --
Jamie Drysdale, IR, Ana, D, FA, --, --, 0, 0, 0, 0, 0, 0, 0, 0, 0, 0, 0, 0, 0, 0, 0, 0, --
Kaapo Kakko, Healthy, NYR, RW, FA, --, --, 0, 0, 0, 0, 0, 0, 0, 0, 0, 0, 0, 0, 0, 0, 0, 0, --
Daniel Sprong, Healthy, Sea, RW- LW, FA, --, --, 0, 0, 0, 0, 0, 0, 0, 0, 0, 0, 0, 0, 0, 0, 0, 0, --
Jake Walman, Healthy, Det, D, FA, --, --, 0, 0, 0, 0, 0, 0, 0, 0, 0, 0, 0, 0, 0, 0, 0, 0, --
Jamie Oleksiak, Healthy, Sea, D, FA, --, --, 0, 0, 0, 0, 0, 0, 0, 0, 0, 0, 0, 0, 0, 0, 0, 0, --
Ryan Lindgren, O, NYR, D, FA, --, --, 0, 0, 0, 0, 0, 0, 0, 0, 0, 0, 0, 0, 0, 0, 0, 0, --
Olli Maatta, Healthy, Det, D, FA, --, --, 0, 0, 0, 0, 0, 0, 0, 0, 0, 0, 0, 0, 0, 0, 0, 0, --
Eetu Luostarinen, Healthy, Fla, C- LW, FA, --, --, 0, 0, 0, 0, 0, 0, 0, 0, 0, 0, 0, 0, 0, 0, 0, 0, --
Robby Fabbri, O, Det, C- LW, FA, --, --, 0, 0, 0, 0, 0, 0, 0, 0, 0, 0, 0, 0, 0, 0, 0, 0, --
Vitali Kravtsov, Healthy, Van, LW- RW, FA, Buf, L 1-5, 0, 0, 0, 0, 0, 0, 0, 0, 0, 0, 0, 0, 0, 0, 0, 0, --
Taylor Raddysh, Healthy, Chi, RW, FA, --, --, 0, 0, 0, 0, 0, 0, 0, 0, 0, 0, 0, 0, 0, 0, 0, 0, --
Barclay Goodrow, Healthy, NYR, RW- C- LW, FA, --, --, 0, 0, 0, 0, 0, 0, 0, 0, 0, 0, 0, 0, 0, 0, 0, 0, --
Andreas Athanasiou, Healthy, Chi, LW- RW, FA, --, --, 0, 0, 0, 0, 0, 0, 0, 0, 0, 0, 0, 0, 0, 0, 0, 0, --
Alex Wennberg, Healthy, Sea, C, FA, --, --, 0, 0, 0, 0, 0, 0, 0, 0, 0, 0, 0, 0, 0, 0, 0, 0, --
Jason Dickinson, Healthy, Chi, C- LW, FA, --, --, 0, 0, 0, 0, 0, 0, 0, 0, 0, 0, 0, 0, 0, 0, 0, 0, --
Michael Rasmussen, IR, Det, C- LW, FA, --, --, 0, 0, 0, 0, 0, 0, 0, 0, 0, 0, 0, 0, 0, 0, 0, 0, --
Ryan Reaves, Healthy, Min, RW, FA, @Bos, L 3-4, 0, 0, 0, 0, 0, 0, 0, 0, 0, 0, 0, 0, 0, 0, 0, 0, --
Braden Schneider, Healthy, NYR, D, FA, --, --, 0, 0, 0, 0, 0, 0, 0, 0, 0, 0, 0, 0, 0, 0, 0, 0, --
Tyler Johnson, Healthy, Chi, C- RW, FA, --, --, 0, 0, 0, 0, 0, 0, 0, 0, 0, 0, 0, 0, 0, 0, 0, 0, --
Luke Evangelista, Healthy, Nsh, RW, FA, Phi, L 1-3, 0, 0, 0, 0, 0, 0, 0, 0, 0, 0, 0, 0, 0, 0, 0, 0, --
Dmitry Kulikov, IR, Pit, D, FA, @Cls, W 6-3, 0, 0, 0, 0, 0, 0, 0, 0, 0, 0, 0, 0, 0, 0, 0, 0, --
Lukas Reichel, Healthy, Chi, LW- C, FA, --, --, 0, 0, 0, 0, 0, 0, 0, 0, 0, 0, 0, 0, 0, 0, 0, 0, --
Sam Lafferty, Healthy, Tor, C- LW, FA, @Wpg, W 4-1, 0, 0, 0, 0, 0, 0, 0, 0, 0, 0, 0, 0, 0, 0, 0, 0, --
Simon Benoit, Healthy, Ana, D, FA, --, --, 0, 0, 0, 0, 0, 0, 0, 0, 0, 0, 0, 0, 0, 0, 0, 0, --
Caleb Jones, Healthy, Chi, D, FA, --, --, 0, 0, 0, 0, 0, 0, 0, 0, 0, 0, 0, 0, 0, 0, 0, 0, --
Pius Suter, Healthy, Det, C- LW, FA, --, --, 0, 0, 0, 0, 0, 0, 0, 0, 0, 0, 0, 0, 0, 0, 0, 0, --
Juuso Parssinen, DTD, Nsh, C, BOWS, Phi, L 1-3, 0, 0, 0, 0, 0, 0, 0, 0, 0, 0, 0, 0, 0, 0, 0, 0, --
Elmer Soderblom, Healthy, Det, LW, FA, --, --, 0, 0, 0, 0, 0, 0, 0, 0, 0, 0, 0, 0, 0, 0, 0, 0, --
Colin White, Healthy, Fla, C- RW, FA, --, --, 0, 0, 0, 0, 0, 0, 0, 0, 0, 0, 0, 0, 0, 0, 0, 0, --
Morgan Geekie, Healthy, Sea, C, FA, --, --, 0, 0, 0, 0, 0, 0, 0, 0, 0, 0, 0, 0, 0, 0, 0, 0, --
Carson Soucy, Healthy, Sea, D, FA, --, --, 0, 0, 0, 0, 0, 0, 0, 0, 0, 0, 0, 0, 0, 0, 0, 0, --
Rudolfs Balcers, Healthy, TB, LW- RW, FA, NYI, W 5-3, 0, 0, 0, 0, 0, 0, 0, 0, 0, 0, 0, 0, 0, 0, 0, 0, --
Patric Hornqvist, IR, Fla, RW, FA, --, --, 0, 0, 0, 0, 0, 0, 0, 0, 0, 0, 0, 0, 0, 0, 0, 0, --
Adam Erne, Healthy, Det, LW- RW, FA, --, --, 0, 0, 0, 0, 0, 0, 0, 0, 0, 0, 0, 0, 0, 0, 0, 0, --
Jimmy Vesey, Healthy, NYR, LW- RW, FA, --, --, 0, 0, 0, 0, 0, 0, 0, 0, 0, 0, 0, 0, 0, 0, 0, 0, --
Eric Staal, Healthy, Fla, C, FA, --, --, 0, 0, 0, 0, 0, 0, 0, 0, 0, 0, 0, 0, 0, 0, 0, 0, --
Jarred Tinordi, DTD, Chi, D, FA, --, --, 0, 0, 0, 0, 0, 0, 0, 0, 0, 0, 0, 0, 0, 0, 0, 0, --
Ryan Donato, Healthy, Sea, RW- LW, FA, --, --, 0, 0, 0, 0, 0, 0, 0, 0, 0, 0, 0, 0, 0, 0, 0, 0, --
Jonatan Berggren, Healthy, Det, RW- C, FA, --, --, 0, 0, 0, 0, 0, 0, 0, 0, 0, 0, 0, 0, 0, 0, 0, 0, --
Will Borgen, Healthy, Sea, D, FA, --, --, 0, 0, 0, 0, 0, 0, 0, 0, 0, 0, 0, 0, 0, 0, 0, 0, --
Jakob Silfverberg, Healthy, Ana, RW- LW, FA, --, --, 0, 0, 0, 0, 0, 0, 0, 0, 0, 0, 0, 0, 0, 0, 0, 0, --
Marcus Bjork, Healthy, Cls, D, FA, Pit, L 3-6, 0, 0, 0, 0, 0, 0, 0, 0, 0, 0, 0, 0, 0, 0, 0, 0, --
Max Comtois, Healthy, Ana, LW, FA, --, --, 0, 0, 0, 0, 0, 0, 0, 0, 0, 0, 0, 0, 0, 0, 0, 0, --
Simon Edvinsson, DTD, Det, D, FA, --, --, 0, 0, 0, 0, 0, 0, 0, 0, 0, 0, 0, 0, 0, 0, 0, 0, --
Marco Kasper, Healthy, Det, C, FA, --, --, 0, 0, 0, 0, 0, 0, 0, 0, 0, 0, 0, 0, 0, 0, 0, 0, --
Zac Jones, Healthy, NYR, D, FA, --, --, 0, 0, 0, 0, 0, 0, 0, 0, 0, 0, 0, 0, 0, 0, 0, 0, --
Marc Staal, Healthy, Fla, D, FA, --, --, 0, 0, 0, 0, 0, 0, 0, 0, 0, 0, 0, 0, 0, 0, 0, 0, --
Jack Johnson, Healthy, Col, D, FA, @Vgk, W 3-2, 0, 0, 0, 0, 0, 0, 0, 0, 0, 0, 0, 0, 0, 0, 0, 0, --
Oskar Sundqvist, Healthy, Min, C- RW, FA, @Bos, L 3-4, 0, 0, 0, 0, 0, 0, 0, 0, 0, 0, 0, 0, 0, 0, 0, 0, --
Walker Duehr, Healthy, Cgy, RW, FA, Car, W 3-2, 0, 0, 0, 0, 0, 0, 0, 0, 0, 0, 0, 0, 0, 0, 0, 0, --
Filip Zadina, O, Det, RW- LW, FA, --, --, 0, 0, 0, 0, 0, 0, 0, 0, 0, 0, 0, 0, 0, 0, 0, 0, --
Joonas Donskoi, IR, Sea, RW- LW, FA, --, --, 0, 0, 0, 0, 0, 0, 0, 0, 0, 0, 0, 0, 0, 0, 0, 0, --
Derek Grant, Healthy, Ana, C- RW, FA, --, --, 0, 0, 0, 0, 0, 0, 0, 0, 0, 0, 0, 0, 0, 0, 0, 0, --
Robert Hagg, Healthy, Det, D, FA, --, --, 0, 0, 0, 0, 0, 0, 0, 0, 0, 0, 0, 0, 0, 0, 0, 0, --
Philipp Kurashev, O, Chi, LW- RW, FA, --, --, 0, 0, 0, 0, 0, 0, 0, 0, 0, 0, 0, 0, 0, 0, 0, 0, --
Ridly Greig, Healthy, Ott, C, FA, Ari, W 6-2, 0, 0, 0, 0, 0, 0, 0, 0, 0, 0, 0, 0, 0, 0, 0, 0, --
Ryan Lomberg, Healthy, Fla, LW- C, FA, --, --, 0, 0, 0, 0, 0, 0, 0, 0, 0, 0, 0, 0, 0, 0, 0, 0, --
Joe Veleno, Healthy, Det, C, FA, --, --, 0, 0, 0, 0, 0, 0, 0, 0, 0, 0, 0, 0, 0, 0, 0, 0, --
Joe Thornton, Healthy, Fla, C, FA, --, --, 0, 0, 0, 0, 0, 0, 0, 0, 0, 0, 0, 0, 0, 0, 0, 0, --
Kevin Korchinski, Healthy, Chi, D, FA, --, --, 0, 0, 0, 0, 0, 0, 0, 0, 0, 0, 0, 0, 0, 0, 0, 0, --
Jujhar Khaira, Healthy, Chi, LW, FA, --, --, 0, 0, 0, 0, 0, 0, 0, 0, 0, 0, 0, 0, 0, 0, 0, 0, --
Pavel Mintyukov, Healthy, Ana, D, FA, --, --, 0, 0, 0, 0, 0, 0, 0, 0, 0, 0, 0, 0, 0, 0, 0, 0, --
Ryan Carpenter, Healthy, NYR, C- LW- RW, FA, --, --, 0, 0, 0, 0, 0, 0, 0, 0, 0, 0, 0, 0, 0, 0, 0, 0, --
Julien Gauthier, DTD, Ott, RW, FA, Ari, W 6-2, 0, 0, 0, 0, 0, 0, 0, 0, 0, 0, 0, 0, 0, 0, 0, 0, --
Henry Thrun, Healthy, Ana, D, FA, --, --, 0, 0, 0, 0, 0, 0, 0, 0, 0, 0, 0, 0, 0, 0, 0, 0, --
Josh Mahura, Healthy, Fla, D, FA, --, --, 0, 0, 0, 0, 0, 0, 0, 0, 0, 0, 0, 0, 0, 0, 0, 0, --
Ryan Getzlaf, Healthy, Ana, C, FA, --, --, 0, 0, 0, 0, 0, 0, 0, 0, 0, 0, 0, 0, 0, 0, 0, 0, --
Max Jones, Healthy, Ana, LW- RW, FA, --, --, 0, 0, 0, 0, 0, 0, 0, 0, 0, 0, 0, 0, 0, 0, 0, 0, --
Libor Hajek, Healthy, NYR, D, FA, --, --, 0, 0, 0, 0, 0, 0, 0, 0, 0, 0, 0, 0, 0, 0, 0, 0, --
Lukas Rousek, Healthy, Buf, LW- RW, FA, @Van, W 5-1, 0, 0, 0, 0, 0, 0, 0, 0, 0, 0, 0, 0, 0, 0, 0, 0, --
Boris Katchouk, Healthy, Chi, LW, FA, --, --, 0, 0, 0, 0, 0, 0, 0, 0, 0, 0, 0, 0, 0, 0, 0, 0, --
Isac Lundestrom, Healthy, Ana, C- LW, FA, --, --, 0, 0, 0, 0, 0, 0, 0, 0, 0, 0, 0, 0, 0, 0, 0, 0, --
Gustav Lindstrom, Healthy, Det, D, FA, --, --, 0, 0, 0, 0, 0, 0, 0, 0, 0, 0, 0, 0, 0, 0, 0, 0, --
Givani Smith, Healthy, Fla, RW, FA, --, --, 0, 0, 0, 0, 0, 0, 0, 0, 0, 0, 0, 0, 0, 0, 0, 0, --
Frank Nazar, Healthy, Chi, C, FA, --, --, 0, 0, 0, 0, 0, 0, 0, 0, 0, 0, 0, 0, 0, 0, 0, 0, --
Colin Blackwell, O, Chi, C, FA, --, --, 0, 0, 0, 0, 0, 0, 0, 0, 0, 0, 0, 0, 0, 0, 0, 0, --
Cale Fleury, Healthy, Sea, D, FA, --, --, 0, 0, 0, 0, 0, 0, 0, 0, 0, 0, 0, 0, 0, 0, 0, 0, --
Jordan Oesterle, Healthy, Det, D, FA, --, --, 0, 0, 0, 0, 0, 0, 0, 0, 0, 0, 0, 0, 0, 0, 0, 0, --
Nathan Beaulieu, Healthy, Ana, D, FA, --, --, 0, 0, 0, 0, 0, 0, 0, 0, 0, 0, 0, 0, 0, 0, 0, 0, --
Michael Del Zotto, Healthy, Ana, D, FA, --, --, 0, 0, 0, 0, 0, 0, 0, 0, 0, 0, 0, 0, 0, 0, 0, 0, --
Nick Cousins, Healthy, Fla, C- LW- RW, FA, --, --, 0, 0, 0, 0, 0, 0, 0, 0, 0, 0, 0, 0, 0, 0, 0, 0, --
Ian Mitchell, Healthy, Chi, D, FA, --, --, 0, 0, 0, 0, 0, 0, 0, 0, 0, 0, 0, 0, 0, 0, 0, 0, --
Sean Farrell, Healthy, Mon, LW- C, FA, Dal, L 2-5, 0, 0, 0, 0, 0, 0, 0, 0, 0, 0, 0, 0, 0, 0, 0, 0, --
Grigori Denisenko, Healthy, Fla, LW, FA, --, --, 0, 0, 0, 0, 0, 0, 0, 0, 0, 0, 0, 0, 0, 0, 0, 0, --
MacKenzie Entwistle, Healthy, Chi, RW- C, FA, --, --, 0, 0, 0, 0, 0, 0, 0, 0, 0, 0, 0, 0, 0, 0, 0, 0, --
Reese Johnson, Healthy, Chi, RW- C, FA, --, --, 0, 0, 0, 0, 0, 0, 0, 0, 0, 0, 0, 0, 0, 0, 0, 0, --
Vincent Desharnais, Healthy, Edm, D, FA, StL, L 0-2, 0, 0, 0, 0, 0, 0, 0, 0, 0, 0, 0, 0, 0, 0, 0, 0, --
Zac Dalpe, Healthy, Fla, C, FA, --, --, 0, 0, 0, 0, 0, 0, 0, 0, 0, 0, 0, 0, 0, 0, 0, 0, --
Alex Vlasic, Healthy, Chi, D, FA, --, --, 0, 0, 0, 0, 0, 0, 0, 0, 0, 0, 0, 0, 0, 0, 0, 0, --
Cameron Hughes, Healthy, Sea, C- LW, FA, --, --, 0, 0, 0, 0, 0, 0, 0, 0, 0, 0, 0, 0, 0, 0, 0, 0, --
Cole Guttman, Healthy, Chi, C, FA, --, --, 0, 0, 0, 0, 0, 0, 0, 0, 0, 0, 0, 0, 0, 0, 0, 0, --
Billy Sweezey, Healthy, Cls, D, FA, Pit, L 3-6, 0, 0, 0, 0, 0, 0, 0, 0, 0, 0, 0, 0, 0, 0, 0, 0, --
Sam Carrick, Healthy, Ana, C, FA, --, --, 0, 0, 0, 0, 0, 0, 0, 0, 0, 0, 0, 0, 0, 0, 0, 0, --
Tyler Kleven, Healthy, Ott, D, FA, Ari, W 6-2, 0, 0, 0, 0, 0, 0, 0, 0, 0, 0, 0, 0, 0, 0, 0, 0, --
Urho Vaakanainen, IR, Ana, D, FA, --, --, 0, 0, 0, 0, 0, 0, 0, 0, 0, 0, 0, 0, 0, 0, 0, 0, --
Lucas Carlsson, Healthy, Fla, D, FA, --, --, 0, 0, 0, 0, 0, 0, 0, 0, 0, 0, 0, 0, 0, 0, 0, 0, --
Alex Nylander, Healthy, Pit, LW, FA, @Cls, W 6-3, 0, 0, 0, 0, 0, 0, 0, 0, 0, 0, 0, 0, 0, 0, 0, 0, --
Isaak Phillips, Healthy, Chi, D, FA, --, --, 0, 0, 0, 0, 0, 0, 0, 0, 0, 0, 0, 0, 0, 0, 0, 0, --
Mark Pysyk, O, Det, D, FA, --, --, 0, 0, 0, 0, 0, 0, 0, 0, 0, 0, 0, 0, 0, 0, 0, 0, --
Colton White, Healthy, Ana, D, FA, --, --, 0, 0, 0, 0, 0, 0, 0, 0, 0, 0, 0, 0, 0, 0, 0, 0, --
Alexander True, Healthy, Sea, C- RW, FA, --, --, 0, 0, 0, 0, 0, 0, 0, 0, 0, 0, 0, 0, 0, 0, 0, 0, --
Matt Bartkowski, Healthy, NYR, D, FA, --, --, 0, 0, 0, 0, 0, 0, 0, 0, 0, 0, 0, 0, 0, 0, 0, 0, --
Pontus Holmberg, Healthy, Tor, C, FA, @Wpg, W 4-1, 0, 0, 0, 0, 0, 0, 0, 0, 0, 0, 0, 0, 0, 0, 0, 0, --
Andreas Englund, Healthy, Chi, D, FA, --, --, 0, 0, 0, 0, 0, 0, 0, 0, 0, 0, 0, 0, 0, 0, 0, 0, --
Samuel Walker, Healthy, Min, LW, FA, @Bos, L 3-4, 0, 0, 0, 0, 0, 0, 0, 0, 0, 0, 0, 0, 0, 0, 0, 0, --
Andrew Shaw, Healthy, Chi, C- RW, FA, --, --, 0, 0, 0, 0, 0, 0, 0, 0, 0, 0, 0, 0, 0, 0, 0, 0, --
Petteri Lindbohm, Healthy, Fla, D, FA, --, --, 0, 0, 0, 0, 0, 0, 0, 0, 0, 0, 0, 0, 0, 0, 0, 0, --
Chris Tierney, Healthy, Mon, C, FA, Dal, L 2-5, 0, 0, 0, 0, 0, 0, 0, 0, 0, 0, 0, 0, 0, 0, 0, 0, --
Sam Rinzel, Healthy, Chi, D, FA, --, --, 0, 0, 0, 0, 0, 0, 0, 0, 0, 0, 0, 0, 0, 0, 0, 0, --
Alec Regula, Healthy, Chi, D, FA, --, --, 0, 0, 0, 0, 0, 0, 0, 0, 0, 0, 0, 0, 0, 0, 0, 0, --
Nikita Nesterenko, Healthy, Ana, LW, FA, --, --, 0, 0, 0, 0, 0, 0, 0, 0, 0, 0, 0, 0, 0, 0, 0, 0, --
Tyler Tucker, Healthy, StL, D, FA, @Edm, W 2-0, 0, 0, 0, 0, 0, 0, 0, 0, 0, 0, 0, 0, 0, 0, 0, 0, --
Karson Kuhlman, Healthy, Wpg, C- RW, FA, Tor, L 1-4, 0, 0, 0, 0, 0, 0, 0, 0, 0, 0, 0, 0, 0, 0, 0, 0, --
David Backes, Healthy, Ana, C, FA, --, --, 0, 0, 0, 0, 0, 0, 0, 0, 0, 0, 0, 0, 0, 0, 0, 0, --
John Hayden, O, Sea, RW, FA, --, --, 0, 0, 0, 0, 0, 0, 0, 0, 0, 0, 0, 0, 0, 0, 0, 0, --
Jonny Brodzinski, Healthy, NYR, C, FA, --, --, 0, 0, 0, 0, 0, 0, 0, 0, 0, 0, 0, 0, 0, 0, 0, 0, --
Chris Kunitz, Healthy, Chi, LW, FA, --, --, 0, 0, 0, 0, 0, 0, 0, 0, 0, 0, 0, 0, 0, 0, 0, 0, --
Dave Gust, Healthy, Chi, RW, FA, --, --, 0, 0, 0, 0, 0, 0, 0, 0, 0, 0, 0, 0, 0, 0, 0, 0, --
John Moore, IR, Ana, D, FA, --, --, 0, 0, 0, 0, 0, 0, 0, 0, 0, 0, 0, 0, 0, 0, 0, 0, --
Andy Welinski, Healthy, Chi, D, FA, --, --, 0, 0, 0, 0, 0, 0, 0, 0, 0, 0, 0, 0, 0, 0, 0, 0, --
Josiah Slavin, Healthy, Chi, LW, FA, --, --, 0, 0, 0, 0, 0, 0, 0, 0, 0, 0, 0, 0, 0, 0, 0, 0, --
Nikita Alexandrov, Healthy, StL, C, FA, @Edm, W 2-0, 0, 0, 0, 0, 0, 0, 0, 0, 0, 0, 0, 0, 0, 0, 0, 0, --
Oskar Olausson, Healthy, Col, RW, FA, @Vgk, W 3-2, 0, 0, 0, 0, 0, 0, 0, 0, 0, 0, 0, 0, 0, 0, 0, 0, --
Buddy Robinson, Healthy, Chi, RW, FA, --, --, 0, 0, 0, 0, 0, 0, 0, 0, 0, 0, 0, 0, 0, 0, 0, 0, --
Filip Roos, Healthy, Chi, D, FA, --, --, 0, 0, 0, 0, 0, 0, 0, 0, 0, 0, 0, 0, 0, 0, 0, 0, --
Olli Juolevi, Healthy, Ana, D, FA, --, --, 0, 0, 0, 0, 0, 0, 0, 0, 0, 0, 0, 0, 0, 0, 0, 0, --
Riley Nash, Healthy, Fla, C- RW, FA, --, --, 0, 0, 0, 0, 0, 0, 0, 0, 0, 0, 0, 0, 0, 0, 0, 0, --
Anthony Bitetto, Healthy, Fla, D, FA, --, --, 0, 0, 0, 0, 0, 0, 0, 0, 0, 0, 0, 0, 0, 0, 0, 0, --
Austin Czarnik, Healthy, Det, RW- C- LW, FA, --, --, 0, 0, 0, 0, 0, 0, 0, 0, 0, 0, 0, 0, 0, 0, 0, 0, --
Andrew Poturalski, Healthy, Sea, C, FA, --, --, 0, 0, 0, 0, 0, 0, 0, 0, 0, 0, 0, 0, 0, 0, 0, 0, --
Matt Tennyson, Healthy, Sea, D, FA, --, --, 0, 0, 0, 0, 0, 0, 0, 0, 0, 0, 0, 0, 0, 0, 0, 0, --
Greg Pateryn, Healthy, Ana, D, FA, --, --, 0, 0, 0, 0, 0, 0, 0, 0, 0, 0, 0, 0, 0, 0, 0, 0, --
Christian Djoos, Healthy, Det, D, FA, --, --, 0, 0, 0, 0, 0, 0, 0, 0, 0, 0, 0, 0, 0, 0, 0, 0, --
Aleksi Heponiemi, Healthy, Fla, C, FA, --, --, 0, 0, 0, 0, 0, 0, 0, 0, 0, 0, 0, 0, 0, 0, 0, 0, --
Bobby Ryan, Healthy, Det, RW- LW, FA, --, --, 0, 0, 0, 0, 0, 0, 0, 0, 0, 0, 0, 0, 0, 0, 0, 0, --
Matej Blumel, Healthy, Dal, LW, FA, @Mon, W 5-2, 0, 0, 0, 0, 0, 0, 0, 0, 0, 0, 0, 0, 0, 0, 0, 0, --
Steven Kampfer, Healthy, Det, D, FA, --, --, 0, 0, 0, 0, 0, 0, 0, 0, 0, 0, 0, 0, 0, 0, 0, 0, --
Fredrik Olofsson, Healthy, Dal, LW, FA, @Mon, W 5-2, 0, 0, 0, 0, 0, 0, 0, 0, 0, 0, 0, 0, 0, 0, 0, 0, --
Pavol Regenda, Healthy, Ana, C, FA, --, --, 0, 0, 0, 0, 0, 0, 0, 0, 0, 0, 0, 0, 0, 0, 0, 0, --
Kole Lind, Healthy, Sea, RW, FA, --, --, 0, 0, 0, 0, 0, 0, 0, 0, 0, 0, 0, 0, 0, 0, 0, 0, --
Jacob Perreault, Healthy, Ana, RW, FA, --, --, 0, 0, 0, 0, 0, 0, 0, 0, 0, 0, 0, 0, 0, 0, 0, 0, --
Tim Berni, Healthy, Cls, D, FA, Pit, L 3-6, 0, 0, 0, 0, 0, 0, 0, 0, 0, 0, 0, 0, 0, 0, 0, 0, --
David Desharnais, Healthy, NYR, C, FA, --, --, 0, 0, 0, 0, 0, 0, 0, 0, 0, 0, 0, 0, 0, 0, 0, 0, --
Owen Beck, Healthy, Mon, C, FA, Dal, L 2-5, 0, 0, 0, 0, 0, 0, 0, 0, 0, 0, 0, 0, 0, 0, 0, 0, --
Matt Kiersted, Healthy, Fla, D, FA, --, --, 0, 0, 0, 0, 0, 0, 0, 0, 0, 0, 0, 0, 0, 0, 0, 0, --
Wyatt Kaiser, Healthy, Chi, D, FA, --, --, 0, 0, 0, 0, 0, 0, 0, 0, 0, 0, 0, 0, 0, 0, 0, 0, --
Mike Hardman, Healthy, Chi, RW- LW, FA, --, --, 0, 0, 0, 0, 0, 0, 0, 0, 0, 0, 0, 0, 0, 0, 0, 0, --
Benoit-Olivier Groulx, Healthy, Ana, C- LW, FA, --, --, 0, 0, 0, 0, 0, 0, 0, 0, 0, 0, 0, 0, 0, 0, 0, 0, --
Brayden Tracey, Healthy, Ana, LW, FA, --, --, 0, 0, 0, 0, 0, 0, 0, 0, 0, 0, 0, 0, 0, 0, 0, 0, --
Charles Hudon, Healthy, Col, LW- RW, FA, @Vgk, W 3-2, 0, 0, 0, 0, 0, 0, 0, 0, 0, 0, 0, 0, 0, 0, 0, 0, --
Jason Garrison, Healthy, Chi, D, FA, --, --, 0, 0, 0, 0, 0, 0, 0, 0, 0, 0, 0, 0, 0, 0, 0, 0, --
Aidan McDonough, Healthy, Van, LW, FA, Buf, L 1-5, 0, 0, 0, 0, 0, 0, 0, 0, 0, 0, 0, 0, 0, 0, 0, 0, --
Brian Lashoff, Healthy, Det, D, FA, --, --, 0, 0, 0, 0, 0, 0, 0, 0, 0, 0, 0, 0, 0, 0, 0, 0, --
P.A. Parenteau, Healthy, Det, RW- C, FA, --, --, 0, 0, 0, 0, 0, 0, 0, 0, 0, 0, 0, 0, 0, 0, 0, 0, --
Samuel Bolduc, Healthy, NYI, D, FA, @TB, L 3-5, 0, 0, 0, 0, 0, 0, 0, 0, 0, 0, 0, 0, 0, 0, 0, 0, --
Kyle Criscuolo, Healthy, SJ, C, FA, @NJ, L 1-2, 0, 0, 0, 0, 0, 0, 0, 0, 0, 0, 0, 0, 0, 0, 0, 0, --
Dominik Simon, Healthy, Ana, LW- RW, FA, --, --, 0, 0, 0, 0, 0, 0, 0, 0, 0, 0, 0, 0, 0, 0, 0, 0, --
James Hamblin, Healthy, Edm, RW, FA, StL, L 0-2, 0, 0, 0, 0, 0, 0, 0, 0, 0, 0, 0, 0, 0, 0, 0, 0, --
Cody Franson, Healthy, Chi, D, FA, --, --, 0, 0, 0, 0, 0, 0, 0, 0, 0, 0, 0, 0, 0, 0, 0, 0, --
Michal Kempny, Healthy, Sea, D, FA, --, --, 0, 0, 0, 0, 0, 0, 0, 0, 0, 0, 0, 0, 0, 0, 0, 0, --
Chase De Leo, Healthy, Ana, C- LW, FA, --, --, 0, 0, 0, 0, 0, 0, 0, 0, 0, 0, 0, 0, 0, 0, 0, 0, --
Nick Merkley, Healthy, NYR, RW- C, FA, --, --, 0, 0, 0, 0, 0, 0, 0, 0, 0, 0, 0, 0, 0, 0, 0, 0, --
Taro Hirose, Healthy, Det, LW, FA, --, --, 0, 0, 0, 0, 0, 0, 0, 0, 0, 0, 0, 0, 0, 0, 0, 0, --
William Cuylle, Healthy, NYR, LW, FA, --, --, 0, 0, 0, 0, 0, 0, 0, 0, 0, 0, 0, 0, 0, 0, 0, 0, --
Brett Leason, Healthy, Ana, RW, FA, --, --, 0, 0, 0, 0, 0, 0, 0, 0, 0, 0, 0, 0, 0, 0, 0, 0, --
Matt Luff, Healthy, Det, RW, FA, --, --, 0, 0, 0, 0, 0, 0, 0, 0, 0, 0, 0, 0, 0, 0, 0, 0, --
Dylan Sikura, Healthy, Ana, C- LW, FA, --, --, 0, 0, 0, 0, 0, 0, 0, 0, 0, 0, 0, 0, 0, 0, 0, 0, --
Glenn Gawdin, Healthy, Ana, C- RW, FA, --, --, 0, 0, 0, 0, 0, 0, 0, 0, 0, 0, 0, 0, 0, 0, 0, 0, --
Michael Kesselring, Healthy, Ari, D, FA, @Ott, L 2-6, 0, 0, 0, 0, 0, 0, 0, 0, 0, 0, 0, 0, 0, 0, 0, 0, --
Brogan Rafferty, Healthy, Sea, D, FA, --, --, 0, 0, 0, 0, 0, 0, 0, 0, 0, 0, 0, 0, 0, 0, 0, 0, --
Elliot Desnoyers, Healthy, Phi, LW, FA, @Nsh, W 3-1, 0, 0, 0, 0, 0, 0, 0, 0, 0, 0, 0, 0, 0, 0, 0, 0, --
Anthony Richard, Healthy, Mon, C, FA, Dal, L 2-5, 0, 0, 0, 0, 0, 0, 0, 0, 0, 0, 0, 0, 0, 0, 0, 0, --
Mac Hollowell, O, Tor, D, FA, @Wpg, W 4-1, 0, 0, 0, 0, 0, 0, 0, 0, 0, 0, 0, 0, 0, 0, 0, 0, --
Connor Bunnaman, Healthy, Fla, LW- C, FA, --, --, 0, 0, 0, 0, 0, 0, 0, 0, 0, 0, 0, 0, 0, 0, 0, 0, --
Bobby McMann, IR, Tor, C, FA, @Wpg, W 4-1, 0, 0, 0, 0, 0, 0, 0, 0, 0, 0, 0, 0, 0, 0, 0, 0, --
"Joel LEsperance", Healthy, Det, C- RW, FA, --, --, 0, 0, 0, 0, 0, 0, 0, 0, 0, 0, 0, 0, 0, 0, 0, 0, --
Tanner Fritz, Healthy, NYR, C, FA, --, --, 0, 0, 0, 0, 0, 0, 0, 0, 0, 0, 0, 0, 0, 0, 0, 0, --
Gerry Mayhew, Healthy, Fla, RW- C, FA, --, --, 0, 0, 0, 0, 0, 0, 0, 0, 0, 0, 0, 0, 0, 0, 0, 0, --
