Conor Geekie, Healthy, Ari, C, FA, @Vgk, L 1-4, 0, 0, 0, 0, 0, 0, 0, 0, 0, 0, 0, 0, 0, 0, 0, 0, --
Hudson Fasching, Healthy, NYI, RW, FA, @Nsh, L 4-5, 0, 0, 0, 0, 0, 0, 0, 0, 0, 0, 0, 0, 0, 0, 0, 0, --
Joakim Kemell, Healthy, Nsh, RW, FA, NYI, W 5-4, 0, 0, 0, 0, 0, 0, 0, 0, 0, 0, 0, 0, 0, 0, 0, 0, --
Bobby Brink, IR, Phi, RW, FA, @Bos, L 1-4, 0, 0, 0, 0, 0, 0, 0, 0, 0, 0, 0, 0, 0, 0, 0, 0, --
Jason Spezza, Healthy, Tor, C- LW, FA, NJ, L 2-3, 0, 0, 0, 0, 0, 0, 0, 0, 0, 0, 0, 0, 0, 0, 0, 0, --
Noah Gregor, Healthy, SJ, C- LW- RW, FA, Det, L 4-7, 0, 0, 0, 0, 0, 0, 0, 0, 0, 0, 0, 0, 0, 0, 0, 0, --
Alex Galchenyuk, Healthy, Col, LW- RW, FA, @Car, W 3-2, 0, 0, 0, 0, 0, 0, 0, 0, 0, 0, 0, 0, 0, 0, 0, 0, --
Gustav Lindstrom, Healthy, Det, D, FA, @SJ, W 7-4, 0, 0, 0, 0, 0, 0, 0, 0, 0, 0, 0, 0, 0, 0, 0, 0, --
Givani Smith, Healthy, Fla, RW, FA, Dal, L 4-6, 0, 0, 0, 0, 0, 0, 0, 0, 0, 0, 0, 0, 0, 0, 0, 0, --
Scott Harrington, Healthy, NJ, D, FA, @Tor, W 3-2, 0, 0, 0, 0, 0, 0, 0, 0, 0, 0, 0, 0, 0, 0, 0, 0, --
Brad Lambert, Healthy, Wpg, C, FA, Ana, W 3-2, 0, 0, 0, 0, 0, 0, 0, 0, 0, 0, 0, 0, 0, 0, 0, 0, --
Alexander Radulov, Healthy, Dal, RW, FA, @Fla, W 6-4, 0, 0, 0, 0, 0, 0, 0, 0, 0, 0, 0, 0, 0, 0, 0, 0, --
Denton Mateychuk, Healthy, Cls, D, FA, Mon, W 6-4, 0, 0, 0, 0, 0, 0, 0, 0, 0, 0, 0, 0, 0, 0, 0, 0, --
Mason Appleton, Healthy, Wpg, C- RW, FA, Ana, W 3-2, 0, 0, 0, 0, 0, 0, 0, 0, 0, 0, 0, 0, 0, 0, 0, 0, --
Logan Stanley, Healthy, Wpg, D, FA, Ana, W 3-2, 0, 0, 0, 0, 0, 0, 0, 0, 0, 0, 0, 0, 0, 0, 0, 0, --
Jimmy Snuggerud, Healthy, StL, RW, FA, Wsh, W 5-4, 0, 0, 0, 0, 0, 0, 0, 0, 0, 0, 0, 0, 0, 0, 0, 0, --
Ivan Miroshnichenko, Healthy, Wsh, LW, FA, @StL, L 4-5, 0, 0, 0, 0, 0, 0, 0, 0, 0, 0, 0, 0, 0, 0, 0, 0, --
Marco Scandella, DTD, StL, D, FA, Wsh, W 5-4, 0, 0, 0, 0, 0, 0, 0, 0, 0, 0, 0, 0, 0, 0, 0, 0, --
Hendrix Lapierre, Healthy, Wsh, C, FA, @StL, L 4-5, 0, 0, 0, 0, 0, 0, 0, 0, 0, 0, 0, 0, 0, 0, 0, 0, --
Darren Helm, Healthy, Col, C, FA, @Car, W 3-2, 0, 0, 0, 0, 0, 0, 0, 0, 0, 0, 0, 0, 0, 0, 0, 0, --
Alex Belzile, O, Mon, C- RW, FA, @Cls, L 4-6, 0, 0, 0, 0, 0, 0, 0, 0, 0, 0, 0, 0, 0, 0, 0, 0, --
Thomas Harley, Healthy, Dal, D, FA, @Fla, W 6-4, 0, 0, 0, 0, 0, 0, 0, 0, 0, 0, 0, 0, 0, 0, 0, 0, --
Bokondji Imama, Healthy, Ari, LW, FA, @Vgk, L 1-4, 0, 0, 0, 0, 0, 0, 0, 0, 0, 0, 0, 0, 0, 0, 0, 0, --
Brad Hunt, Healthy, Col, D, FA, @Car, W 3-2, 0, 0, 0, 0, 0, 0, 0, 0, 0, 0, 0, 0, 0, 0, 0, 0, --
Joel Ward, Healthy, SJ, RW, FA, Det, L 4-7, 0, 0, 0, 0, 0, 0, 0, 0, 0, 0, 0, 0, 0, 0, 0, 0, --
Mark Friedman, Healthy, Pit, D, FA, @Min, W 6-4, 0, 0, 0, 0, 0, 0, 0, 0, 0, 0, 0, 0, 0, 0, 0, 0, --
Rutger McGroarty, Healthy, Wpg, RW, FA, Ana, W 3-2, 0, 0, 0, 0, 0, 0, 0, 0, 0, 0, 0, 0, 0, 0, 0, 0, --
Ryan Suzuki, Healthy, Car, C, FA, Col, L 2-3, 0, 0, 0, 0, 0, 0, 0, 0, 0, 0, 0, 0, 0, 0, 0, 0, --
Logan Brown, Healthy, StL, C- LW, FA, Wsh, W 5-4, 0, 0, 0, 0, 0, 0, 0, 0, 0, 0, 0, 0, 0, 0, 0, 0, --
Chris Wagner, Healthy, Bos, RW- C, FA, Phi, W 4-1, 0, 0, 0, 0, 0, 0, 0, 0, 0, 0, 0, 0, 0, 0, 0, 0, --
Owen Pickering, Healthy, Pit, D, FA, @Min, W 6-4, 0, 0, 0, 0, 0, 0, 0, 0, 0, 0, 0, 0, 0, 0, 0, 0, --
Mavrik Bourque, Healthy, Dal, C, FA, @Fla, W 6-4, 0, 0, 0, 0, 0, 0, 0, 0, 0, 0, 0, 0, 0, 0, 0, 0, --
Nathan Beaulieu, Healthy, Ana, D, FA, @Wpg, L 2-3, 0, 0, 0, 0, 0, 0, 0, 0, 0, 0, 0, 0, 0, 0, 0, 0, --
Michael Del Zotto, Healthy, Ana, D, FA, @Wpg, L 2-3, 0, 0, 0, 0, 0, 0, 0, 0, 0, 0, 0, 0, 0, 0, 0, 0, --
Patrick Marleau, Healthy, SJ, LW, FA, Det, L 4-7, 0, 0, 0, 0, 0, 0, 0, 0, 0, 0, 0, 0, 0, 0, 0, 0, --
Nolan Patrick, IR, Vgk, C- RW, FA, Ari, W 4-1, 0, 0, 0, 0, 0, 0, 0, 0, 0, 0, 0, 0, 0, 0, 0, 0, --
Steven Santini, Healthy, StL, D, FA, Wsh, W 5-4, 0, 0, 0, 0, 0, 0, 0, 0, 0, 0, 0, 0, 0, 0, 0, 0, --
Brendan Brisson, Healthy, Vgk, C- LW, FA, Ari, W 4-1, 0, 0, 0, 0, 0, 0, 0, 0, 0, 0, 0, 0, 0, 0, 0, 0, --
Victor Mete, IR, Tor, D, FA, NJ, L 2-3, 0, 0, 0, 0, 0, 0, 0, 0, 0, 0, 0, 0, 0, 0, 0, 0, --
Simon Holmstrom, Healthy, NYI, RW, FA, @Nsh, L 4-5, 0, 0, 0, 0, 0, 0, 0, 0, 0, 0, 0, 0, 0, 0, 0, 0, --
Alex Barre-Boulet, Healthy, TB, C- LW- RW, FA, Cgy, W 4-1, 0, 0, 0, 0, 0, 0, 0, 0, 0, 0, 0, 0, 0, 0, 0, 0, --
Grigori Denisenko, Healthy, Fla, LW, FA, Dal, L 4-6, 0, 0, 0, 0, 0, 0, 0, 0, 0, 0, 0, 0, 0, 0, 0, 0, --
Gabriel Carlsson, Healthy, Wsh, D, FA, @StL, L 4-5, 0, 0, 0, 0, 0, 0, 0, 0, 0, 0, 0, 0, 0, 0, 0, 0, --
Gemel Smith, Healthy, TB, C, FA, Cgy, W 4-1, 0, 0, 0, 0, 0, 0, 0, 0, 0, 0, 0, 0, 0, 0, 0, 0, --
Carl Soderberg, Healthy, Col, C, FA, @Car, W 3-2, 0, 0, 0, 0, 0, 0, 0, 0, 0, 0, 0, 0, 0, 0, 0, 0, --
Morgan Barron, Healthy, Wpg, C, FA, Ana, W 3-2, 0, 0, 0, 0, 0, 0, 0, 0, 0, 0, 0, 0, 0, 0, 0, 0, --
Daniil Miromanov, Healthy, Vgk, D, FA, Ari, W 4-1, 0, 0, 0, 0, 0, 0, 0, 0, 0, 0, 0, 0, 0, 0, 0, 0, --
Danila Yurov, Healthy, Min, RW, FA, Pit, L 4-6, 0, 0, 0, 0, 0, 0, 0, 0, 0, 0, 0, 0, 0, 0, 0, 0, --
Connor Zary, Healthy, Cgy, C, FA, @TB, L 1-4, 0, 0, 0, 0, 0, 0, 0, 0, 0, 0, 0, 0, 0, 0, 0, 0, --
Paul LaDue, Healthy, NYI, D, FA, @Nsh, L 4-5, 0, 0, 0, 0, 0, 0, 0, 0, 0, 0, 0, 0, 0, 0, 0, 0, --
Jakub Lauko, Healthy, Bos, RW, FA, Phi, W 4-1, 0, 0, 0, 0, 0, 0, 0, 0, 0, 0, 0, 0, 0, 0, 0, 0, --
Loui Eriksson, Healthy, Ari, LW- RW, FA, @Vgk, L 1-4, 0, 0, 0, 0, 0, 0, 0, 0, 0, 0, 0, 0, 0, 0, 0, 0, --
Sam Poulin, Healthy, Pit, RW- LW, FA, @Min, W 6-4, 0, 0, 0, 0, 0, 0, 0, 0, 0, 0, 0, 0, 0, 0, 0, 0, --
Liam Ohgren, Healthy, Min, LW, FA, Pit, L 4-6, 0, 0, 0, 0, 0, 0, 0, 0, 0, 0, 0, 0, 0, 0, 0, 0, --
Nolan Foote, Healthy, NJ, LW, FA, @Tor, W 3-2, 0, 0, 0, 0, 0, 0, 0, 0, 0, 0, 0, 0, 0, 0, 0, 0, --
Zac Dalpe, Healthy, Fla, C, FA, Dal, L 4-6, 0, 0, 0, 0, 0, 0, 0, 0, 0, 0, 0, 0, 0, 0, 0, 0, --
Radim Zohorna, Healthy, Tor, LW, FA, NJ, L 2-3, 0, 0, 0, 0, 0, 0, 0, 0, 0, 0, 0, 0, 0, 0, 0, 0, --
"Drew OConnor", Healthy, Pit, LW, FA, @Min, W 6-4, 0, 0, 0, 0, 0, 0, 0, 0, 0, 0, 0, 0, 0, 0, 0, 0, --
Dan Renouf, Healthy, Bos, D, FA, Phi, W 4-1, 0, 0, 0, 0, 0, 0, 0, 0, 0, 0, 0, 0, 0, 0, 0, 0, --
Cameron Hughes, Healthy, Sea, C- LW, FA, NYR, W 3-2, 0, 0, 0, 0, 0, 0, 0, 0, 0, 0, 0, 0, 0, 0, 0, 0, --
Jonathan Dahlen, Healthy, SJ, RW- LW, FA, Det, L 4-7, 0, 0, 0, 0, 0, 0, 0, 0, 0, 0, 0, 0, 0, 0, 0, 0, --
J.T. Brown, Healthy, Min, RW, FA, Pit, L 4-6, 0, 0, 0, 0, 0, 0, 0, 0, 0, 0, 0, 0, 0, 0, 0, 0, --
John Leonard, Healthy, Nsh, LW- RW, FA, NYI, W 5-4, 0, 0, 0, 0, 0, 0, 0, 0, 0, 0, 0, 0, 0, 0, 0, 0, --
Ryan Merkley, Healthy, Col, D, FA, @Car, W 3-2, 0, 0, 0, 0, 0, 0, 0, 0, 0, 0, 0, 0, 0, 0, 0, 0, --
Radim Simek, Healthy, SJ, D, FA, Det, L 4-7, 0, 0, 0, 0, 0, 0, 0, 0, 0, 0, 0, 0, 0, 0, 0, 0, --
Adam Gaudette, Healthy, StL, C- RW, FA, Wsh, W 5-4, 0, 0, 0, 0, 0, 0, 0, 0, 0, 0, 0, 0, 0, 0, 0, 0, --
Madison Bowey, Healthy, Mon, D, FA, @Cls, L 4-6, 0, 0, 0, 0, 0, 0, 0, 0, 0, 0, 0, 0, 0, 0, 0, 0, --
Ben Meyers, Healthy, Col, RW, FA, @Car, W 3-2, 0, 0, 0, 0, 0, 0, 0, 0, 0, 0, 0, 0, 0, 0, 0, 0, --
Urho Vaakanainen, IR, Ana, D, FA, @Wpg, L 2-3, 0, 0, 0, 0, 0, 0, 0, 0, 0, 0, 0, 0, 0, 0, 0, 0, --
Brian Boyle, O, Pit, C- LW, FA, @Min, W 6-4, 0, 0, 0, 0, 0, 0, 0, 0, 0, 0, 0, 0, 0, 0, 0, 0, --
Lucas Carlsson, Healthy, Fla, D, FA, Dal, L 4-6, 0, 0, 0, 0, 0, 0, 0, 0, 0, 0, 0, 0, 0, 0, 0, 0, --
Ben Harpur, Healthy, NYR, D, FA, @Sea, L 2-3, 0, 0, 0, 0, 0, 0, 0, 0, 0, 0, 0, 0, 0, 0, 0, 0, --
Vinni Lettieri, IR, Bos, C- RW, FA, Phi, W 4-1, 0, 0, 0, 0, 0, 0, 0, 0, 0, 0, 0, 0, 0, 0, 0, 0, --
Mark Pysyk, O, Det, D, FA, @SJ, W 7-4, 0, 0, 0, 0, 0, 0, 0, 0, 0, 0, 0, 0, 0, 0, 0, 0, --
Alexandre Texier, O, Cls, C- RW, FA, Mon, W 6-4, 0, 0, 0, 0, 0, 0, 0, 0, 0, 0, 0, 0, 0, 0, 0, 0, --
Joey Anderson, Healthy, Tor, RW, FA, NJ, L 2-3, 0, 0, 0, 0, 0, 0, 0, 0, 0, 0, 0, 0, 0, 0, 0, 0, --
Jan Jenik, Healthy, Ari, C- RW, FA, @Vgk, L 1-4, 0, 0, 0, 0, 0, 0, 0, 0, 0, 0, 0, 0, 0, 0, 0, 0, --
Derrick Pouliot, Healthy, SJ, D, FA, Det, L 4-7, 0, 0, 0, 0, 0, 0, 0, 0, 0, 0, 0, 0, 0, 0, 0, 0, --
Marc McLaughlin, Healthy, Bos, C, FA, Phi, W 4-1, 0, 0, 0, 0, 0, 0, 0, 0, 0, 0, 0, 0, 0, 0, 0, 0, --
Kyle Clifford, Healthy, Tor, LW, FA, NJ, L 2-3, 0, 0, 0, 0, 0, 0, 0, 0, 0, 0, 0, 0, 0, 0, 0, 0, --
Kevin Stenlund, Healthy, Wpg, RW- C, FA, Ana, W 3-2, 0, 0, 0, 0, 0, 0, 0, 0, 0, 0, 0, 0, 0, 0, 0, 0, --
Alexander True, Healthy, Sea, C- RW, FA, NYR, W 3-2, 0, 0, 0, 0, 0, 0, 0, 0, 0, 0, 0, 0, 0, 0, 0, 0, --
Lian Bichsel, Healthy, Dal, D, FA, @Fla, W 6-4, 0, 0, 0, 0, 0, 0, 0, 0, 0, 0, 0, 0, 0, 0, 0, 0, --
Matt Bartkowski, Healthy, NYR, D, FA, @Sea, L 2-3, 0, 0, 0, 0, 0, 0, 0, 0, 0, 0, 0, 0, 0, 0, 0, 0, --
Jake Gardiner, IR, Car, D, FA, Col, L 2-3, 0, 0, 0, 0, 0, 0, 0, 0, 0, 0, 0, 0, 0, 0, 0, 0, --
Isaac Howard, Healthy, TB, LW, FA, Cgy, W 4-1, 0, 0, 0, 0, 0, 0, 0, 0, 0, 0, 0, 0, 0, 0, 0, 0, --
Jacob Peterson, Healthy, SJ, C- LW, FA, Det, L 4-7, 0, 0, 0, 0, 0, 0, 0, 0, 0, 0, 0, 0, 0, 0, 0, 0, --
Dennis Wideman, Healthy, Cgy, D, FA, @TB, L 1-4, 0, 0, 0, 0, 0, 0, 0, 0, 0, 0, 0, 0, 0, 0, 0, 0, --
Steven Fogarty, Healthy, Min, C- RW, FA, Pit, L 4-6, 0, 0, 0, 0, 0, 0, 0, 0, 0, 0, 0, 0, 0, 0, 0, 0, --
Rodion Amirov, IR, Tor, LW, FA, NJ, L 2-3, 0, 0, 0, 0, 0, 0, 0, 0, 0, 0, 0, 0, 0, 0, 0, 0, --
"Zachary LHeureux", Healthy, Nsh, LW, FA, NYI, W 5-4, 0, 0, 0, 0, 0, 0, 0, 0, 0, 0, 0, 0, 0, 0, 0, 0, --
Petteri Lindbohm, Healthy, Fla, D, FA, Dal, L 4-6, 0, 0, 0, 0, 0, 0, 0, 0, 0, 0, 0, 0, 0, 0, 0, 0, --
Justin Danforth, IR, Cls, RW- C, FA, Mon, W 6-4, 0, 0, 0, 0, 0, 0, 0, 0, 0, 0, 0, 0, 0, 0, 0, 0, --
Yannick Weber, Healthy, Pit, D, FA, @Min, W 6-4, 0, 0, 0, 0, 0, 0, 0, 0, 0, 0, 0, 0, 0, 0, 0, 0, --
Chris Tierney, Healthy, Mon, C, FA, @Cls, L 4-6, 0, 0, 0, 0, 0, 0, 0, 0, 0, 0, 0, 0, 0, 0, 0, 0, --
Carl Hagelin, IR, Wsh, LW, FA, @StL, L 4-5, 0, 0, 0, 0, 0, 0, 0, 0, 0, 0, 0, 0, 0, 0, 0, 0, --
Filip Mesar, Healthy, Mon, RW, FA, @Cls, L 4-6, 0, 0, 0, 0, 0, 0, 0, 0, 0, 0, 0, 0, 0, 0, 0, 0, --
Ben Thomas, Healthy, TB, D, FA, Cgy, W 4-1, 0, 0, 0, 0, 0, 0, 0, 0, 0, 0, 0, 0, 0, 0, 0, 0, --
Luca Sbisa, Healthy, Nsh, D, FA, NYI, W 5-4, 0, 0, 0, 0, 0, 0, 0, 0, 0, 0, 0, 0, 0, 0, 0, 0, --
Michael Carcone, Healthy, Ari, RW- LW, FA, @Vgk, L 1-4, 0, 0, 0, 0, 0, 0, 0, 0, 0, 0, 0, 0, 0, 0, 0, 0, --
Brennan Menell, Healthy, Tor, D, FA, NJ, L 2-3, 0, 0, 0, 0, 0, 0, 0, 0, 0, 0, 0, 0, 0, 0, 0, 0, --
Zac Rinaldo, Healthy, Cls, LW, FA, Mon, W 6-4, 0, 0, 0, 0, 0, 0, 0, 0, 0, 0, 0, 0, 0, 0, 0, 0, --
Keaton Middleton, Healthy, Col, D, FA, @Car, W 3-2, 0, 0, 0, 0, 0, 0, 0, 0, 0, 0, 0, 0, 0, 0, 0, 0, --
Jonah Gadjovich, IR, SJ, LW- RW, FA, Det, L 4-7, 0, 0, 0, 0, 0, 0, 0, 0, 0, 0, 0, 0, 0, 0, 0, 0, --
Maveric Lamoureux, Healthy, Ari, D, FA, @Vgk, L 1-4, 0, 0, 0, 0, 0, 0, 0, 0, 0, 0, 0, 0, 0, 0, 0, 0, --
David Backes, Healthy, Ana, C, FA, @Wpg, L 2-3, 0, 0, 0, 0, 0, 0, 0, 0, 0, 0, 0, 0, 0, 0, 0, 0, --
John Hayden, O, Sea, RW, FA, NYR, W 3-2, 0, 0, 0, 0, 0, 0, 0, 0, 0, 0, 0, 0, 0, 0, 0, 0, --
Will Butcher, Healthy, Dal, D, FA, @Fla, W 6-4, 0, 0, 0, 0, 0, 0, 0, 0, 0, 0, 0, 0, 0, 0, 0, 0, --
Par Lindholm, Healthy, Bos, C, FA, Phi, W 4-1, 0, 0, 0, 0, 0, 0, 0, 0, 0, 0, 0, 0, 0, 0, 0, 0, --
John Beecher, Healthy, Bos, C, FA, Phi, W 4-1, 0, 0, 0, 0, 0, 0, 0, 0, 0, 0, 0, 0, 0, 0, 0, 0, --
Tyce Thompson, Healthy, NJ, RW, FA, @Tor, W 3-2, 0, 0, 0, 0, 0, 0, 0, 0, 0, 0, 0, 0, 0, 0, 0, 0, --
Jonny Brodzinski, Healthy, NYR, C, FA, @Sea, L 2-3, 0, 0, 0, 0, 0, 0, 0, 0, 0, 0, 0, 0, 0, 0, 0, 0, --
Kevan Miller, Healthy, Bos, D, FA, Phi, W 4-1, 0, 0, 0, 0, 0, 0, 0, 0, 0, 0, 0, 0, 0, 0, 0, 0, --
Tanner Laczynski, Healthy, Phi, C, FA, @Bos, L 1-4, 0, 0, 0, 0, 0, 0, 0, 0, 0, 0, 0, 0, 0, 0, 0, 0, --
Dan Girardi, Healthy, TB, D, FA, Cgy, W 4-1, 0, 0, 0, 0, 0, 0, 0, 0, 0, 0, 0, 0, 0, 0, 0, 0, --
Riley Tufte, Healthy, Dal, LW, FA, @Fla, W 6-4, 0, 0, 0, 0, 0, 0, 0, 0, 0, 0, 0, 0, 0, 0, 0, 0, --
John Moore, IR, Ana, D, FA, @Wpg, L 2-3, 0, 0, 0, 0, 0, 0, 0, 0, 0, 0, 0, 0, 0, 0, 0, 0, --
Jackson Cates, Healthy, Phi, C, FA, @Bos, L 1-4, 0, 0, 0, 0, 0, 0, 0, 0, 0, 0, 0, 0, 0, 0, 0, 0, --
David Schlemko, Healthy, Phi, D, FA, @Bos, L 1-4, 0, 0, 0, 0, 0, 0, 0, 0, 0, 0, 0, 0, 0, 0, 0, 0, --
Daniel Walcott, Healthy, TB, D, FA, Cgy, W 4-1, 0, 0, 0, 0, 0, 0, 0, 0, 0, 0, 0, 0, 0, 0, 0, 0, --
Fredrik Claesson, Healthy, TB, D, FA, Cgy, W 4-1, 0, 0, 0, 0, 0, 0, 0, 0, 0, 0, 0, 0, 0, 0, 0, 0, --
Gabriel Fortier, Healthy, TB, LW, FA, Cgy, W 4-1, 0, 0, 0, 0, 0, 0, 0, 0, 0, 0, 0, 0, 0, 0, 0, 0, --
Jasper Weatherby, Healthy, Det, LW- C, FA, @SJ, W 7-4, 0, 0, 0, 0, 0, 0, 0, 0, 0, 0, 0, 0, 0, 0, 0, 0, --
Andy Welinski, Healthy, Chi, D, FA, --, --, 0, 0, 0, 0, 0, 0, 0, 0, 0, 0, 0, 0, 0, 0, 0, 0, --
James Neal, Healthy, Cls, RW- LW, FA, Mon, W 6-4, 0, 0, 0, 0, 0, 0, 0, 0, 0, 0, 0, 0, 0, 0, 0, 0, --
Mike Liambas, Healthy, Min, D, FA, Pit, L 4-6, 0, 0, 0, 0, 0, 0, 0, 0, 0, 0, 0, 0, 0, 0, 0, 0, --
Vladislav Kolyachonok, Healthy, Ari, D, FA, @Vgk, L 1-4, 0, 0, 0, 0, 0, 0, 0, 0, 0, 0, 0, 0, 0, 0, 0, 0, --
Carl Gunnarsson, Healthy, StL, D, FA, Wsh, W 5-4, 0, 0, 0, 0, 0, 0, 0, 0, 0, 0, 0, 0, 0, 0, 0, 0, --
Mark Alt, Healthy, SJ, D, FA, Det, L 4-7, 0, 0, 0, 0, 0, 0, 0, 0, 0, 0, 0, 0, 0, 0, 0, 0, --
Tyler Bozak, Healthy, StL, C, FA, Wsh, W 5-4, 0, 0, 0, 0, 0, 0, 0, 0, 0, 0, 0, 0, 0, 0, 0, 0, --
Olli Juolevi, Healthy, Ana, D, FA, @Wpg, L 2-3, 0, 0, 0, 0, 0, 0, 0, 0, 0, 0, 0, 0, 0, 0, 0, 0, --
Oskar Steen, Healthy, Bos, C, FA, Phi, W 4-1, 0, 0, 0, 0, 0, 0, 0, 0, 0, 0, 0, 0, 0, 0, 0, 0, --
Darren Raddysh, Healthy, TB, D, FA, Cgy, W 4-1, 0, 0, 0, 0, 0, 0, 0, 0, 0, 0, 0, 0, 0, 0, 0, 0, --
Mikko Koivu, Healthy, Cls, C, FA, Mon, W 6-4, 0, 0, 0, 0, 0, 0, 0, 0, 0, 0, 0, 0, 0, 0, 0, 0, --
Braydon Coburn, Healthy, NYI, D, FA, @Nsh, L 4-5, 0, 0, 0, 0, 0, 0, 0, 0, 0, 0, 0, 0, 0, 0, 0, 0, --
Igor Ozhiganov, Healthy, Tor, D, FA, NJ, L 2-3, 0, 0, 0, 0, 0, 0, 0, 0, 0, 0, 0, 0, 0, 0, 0, 0, --
Mason Geertsen, Healthy, NJ, D, FA, @Tor, W 3-2, 0, 0, 0, 0, 0, 0, 0, 0, 0, 0, 0, 0, 0, 0, 0, 0, --
Riley Nash, Healthy, Fla, C- RW, FA, Dal, L 4-6, 0, 0, 0, 0, 0, 0, 0, 0, 0, 0, 0, 0, 0, 0, 0, 0, --
Anthony Bitetto, Healthy, Fla, D, FA, Dal, L 4-6, 0, 0, 0, 0, 0, 0, 0, 0, 0, 0, 0, 0, 0, 0, 0, 0, --
Austin Czarnik, Healthy, Det, RW- C- LW, FA, @SJ, W 7-4, 0, 0, 0, 0, 0, 0, 0, 0, 0, 0, 0, 0, 0, 0, 0, 0, --
Ryan Dzingel, Healthy, Car, C- LW- RW, FA, Col, L 2-3, 0, 0, 0, 0, 0, 0, 0, 0, 0, 0, 0, 0, 0, 0, 0, 0, --
Andrew Poturalski, Healthy, Sea, C, FA, NYR, W 3-2, 0, 0, 0, 0, 0, 0, 0, 0, 0, 0, 0, 0, 0, 0, 0, 0, --
Cody Eakin, Healthy, Cgy, C, FA, @TB, L 1-4, 0, 0, 0, 0, 0, 0, 0, 0, 0, 0, 0, 0, 0, 0, 0, 0, --
Mikhail Maltsev, Healthy, Col, LW, FA, @Car, W 3-2, 0, 0, 0, 0, 0, 0, 0, 0, 0, 0, 0, 0, 0, 0, 0, 0, --
Matthew Phillips, Healthy, Cgy, C, FA, @TB, L 1-4, 0, 0, 0, 0, 0, 0, 0, 0, 0, 0, 0, 0, 0, 0, 0, 0, --
Matt Tennyson, Healthy, Sea, D, FA, NYR, W 3-2, 0, 0, 0, 0, 0, 0, 0, 0, 0, 0, 0, 0, 0, 0, 0, 0, --
Ben Lovejoy, Healthy, Dal, D, FA, @Fla, W 6-4, 0, 0, 0, 0, 0, 0, 0, 0, 0, 0, 0, 0, 0, 0, 0, 0, --
Nathan Smith, Healthy, Ari, LW- C, FA, @Vgk, L 1-4, 0, 0, 0, 0, 0, 0, 0, 0, 0, 0, 0, 0, 0, 0, 0, 0, --
Greg Pateryn, Healthy, Ana, D, FA, @Wpg, L 2-3, 0, 0, 0, 0, 0, 0, 0, 0, 0, 0, 0, 0, 0, 0, 0, 0, --
Andrew Ladd, IR, Ari, LW, FA, @Vgk, L 1-4, 0, 0, 0, 0, 0, 0, 0, 0, 0, 0, 0, 0, 0, 0, 0, 0, --
Andrej Sekera, Healthy, Dal, D, FA, @Fla, W 6-4, 0, 0, 0, 0, 0, 0, 0, 0, 0, 0, 0, 0, 0, 0, 0, 0, --
Christian Djoos, Healthy, Det, D, FA, @SJ, W 7-4, 0, 0, 0, 0, 0, 0, 0, 0, 0, 0, 0, 0, 0, 0, 0, 0, --
Dean Kukan, Healthy, Cls, D, FA, Mon, W 6-4, 0, 0, 0, 0, 0, 0, 0, 0, 0, 0, 0, 0, 0, 0, 0, 0, --
Johan Larsson, Healthy, Wsh, LW- C, FA, @StL, L 4-5, 0, 0, 0, 0, 0, 0, 0, 0, 0, 0, 0, 0, 0, 0, 0, 0, --
Drake Caggiula, Healthy, Pit, LW- RW, FA, @Min, W 6-4, 0, 0, 0, 0, 0, 0, 0, 0, 0, 0, 0, 0, 0, 0, 0, 0, --
Aleksi Heponiemi, Healthy, Fla, C, FA, Dal, L 4-6, 0, 0, 0, 0, 0, 0, 0, 0, 0, 0, 0, 0, 0, 0, 0, 0, --
Darren Archibald, Healthy, Tor, LW- RW, FA, NJ, L 2-3, 0, 0, 0, 0, 0, 0, 0, 0, 0, 0, 0, 0, 0, 0, 0, 0, --
Filip Hallander, Healthy, Pit, C, FA, @Min, W 6-4, 0, 0, 0, 0, 0, 0, 0, 0, 0, 0, 0, 0, 0, 0, 0, 0, --
Ronnie Attard, Healthy, Phi, D, FA, @Bos, L 1-4, 0, 0, 0, 0, 0, 0, 0, 0, 0, 0, 0, 0, 0, 0, 0, 0, --
Bobby Ryan, Healthy, Det, RW- LW, FA, @SJ, W 7-4, 0, 0, 0, 0, 0, 0, 0, 0, 0, 0, 0, 0, 0, 0, 0, 0, --
Sami Vatanen, Healthy, Dal, D, FA, @Fla, W 6-4, 0, 0, 0, 0, 0, 0, 0, 0, 0, 0, 0, 0, 0, 0, 0, 0, --
Michael Raffl, Healthy, Dal, LW, FA, @Fla, W 6-4, 0, 0, 0, 0, 0, 0, 0, 0, 0, 0, 0, 0, 0, 0, 0, 0, --
Nikita Nesterov, Healthy, Cgy, D, FA, @TB, L 1-4, 0, 0, 0, 0, 0, 0, 0, 0, 0, 0, 0, 0, 0, 0, 0, 0, --
Andrej Sustr, Healthy, Ana, D, FA, @Wpg, L 2-3, 0, 0, 0, 0, 0, 0, 0, 0, 0, 0, 0, 0, 0, 0, 0, 0, --
Kaedan Korczak, Healthy, Vgk, D, FA, Ari, W 4-1, 0, 0, 0, 0, 0, 0, 0, 0, 0, 0, 0, 0, 0, 0, 0, 0, --
Matthew Highmore, Healthy, StL, C- LW- RW, FA, Wsh, W 5-4, 0, 0, 0, 0, 0, 0, 0, 0, 0, 0, 0, 0, 0, 0, 0, 0, --
CJ Suess, Healthy, SJ, LW, FA, Det, L 4-7, 0, 0, 0, 0, 0, 0, 0, 0, 0, 0, 0, 0, 0, 0, 0, 0, --
Nikolai Knyzhov, Healthy, SJ, D, FA, Det, L 4-7, 0, 0, 0, 0, 0, 0, 0, 0, 0, 0, 0, 0, 0, 0, 0, 0, --
Alex Biega, Healthy, Nsh, D, FA, NYI, W 5-4, 0, 0, 0, 0, 0, 0, 0, 0, 0, 0, 0, 0, 0, 0, 0, 0, --
Mathieu Perreault, Healthy, Mon, C- LW, FA, @Cls, L 4-6, 0, 0, 0, 0, 0, 0, 0, 0, 0, 0, 0, 0, 0, 0, 0, 0, --
Beck Malenstyn, Healthy, Wsh, LW- C, FA, @StL, L 4-5, 0, 0, 0, 0, 0, 0, 0, 0, 0, 0, 0, 0, 0, 0, 0, 0, --
Taylor Fedun, Healthy, Pit, D, FA, @Min, W 6-4, 0, 0, 0, 0, 0, 0, 0, 0, 0, 0, 0, 0, 0, 0, 0, 0, --
Samuel Morin, Healthy, Phi, D, FA, @Bos, L 1-4, 0, 0, 0, 0, 0, 0, 0, 0, 0, 0, 0, 0, 0, 0, 0, 0, --
Steven Kampfer, Healthy, Det, D, FA, @SJ, W 7-4, 0, 0, 0, 0, 0, 0, 0, 0, 0, 0, 0, 0, 0, 0, 0, 0, --
Trey Fix-Wolansky, Healthy, Cls, RW, FA, Mon, W 6-4, 0, 0, 0, 0, 0, 0, 0, 0, 0, 0, 0, 0, 0, 0, 0, 0, --
Kole Lind, Healthy, Sea, RW, FA, NYR, W 3-2, 0, 0, 0, 0, 0, 0, 0, 0, 0, 0, 0, 0, 0, 0, 0, 0, --
Kyle Rau, Healthy, Min, C- LW, FA, Pit, L 4-6, 0, 0, 0, 0, 0, 0, 0, 0, 0, 0, 0, 0, 0, 0, 0, 0, --
Kyle Quincey, Healthy, Min, D, FA, Pit, L 4-6, 0, 0, 0, 0, 0, 0, 0, 0, 0, 0, 0, 0, 0, 0, 0, 0, --
Filip Bystedt, Healthy, SJ, C, FA, Det, L 4-7, 0, 0, 0, 0, 0, 0, 0, 0, 0, 0, 0, 0, 0, 0, 0, 0, --
Jacob Perreault, Healthy, Ana, RW, FA, @Wpg, L 2-3, 0, 0, 0, 0, 0, 0, 0, 0, 0, 0, 0, 0, 0, 0, 0, 0, --
Aaron Ness, Healthy, Wsh, D, FA, @StL, L 4-5, 0, 0, 0, 0, 0, 0, 0, 0, 0, 0, 0, 0, 0, 0, 0, 0, --
David Desharnais, Healthy, NYR, C, FA, @Sea, L 2-3, 0, 0, 0, 0, 0, 0, 0, 0, 0, 0, 0, 0, 0, 0, 0, 0, --
Matt Kiersted, Healthy, Fla, D, FA, Dal, L 4-6, 0, 0, 0, 0, 0, 0, 0, 0, 0, 0, 0, 0, 0, 0, 0, 0, --
Richard Panik, Healthy, NYI, RW- LW, FA, @Nsh, L 4-5, 0, 0, 0, 0, 0, 0, 0, 0, 0, 0, 0, 0, 0, 0, 0, 0, --
Nicholas Abruzzese, Healthy, Tor, C, FA, NJ, L 2-3, 0, 0, 0, 0, 0, 0, 0, 0, 0, 0, 0, 0, 0, 0, 0, 0, --
Nate Prosser, Healthy, Phi, D, FA, @Bos, L 1-4, 0, 0, 0, 0, 0, 0, 0, 0, 0, 0, 0, 0, 0, 0, 0, 0, --
Nikita Okhotiuk, Healthy, SJ, D, FA, Det, L 4-7, 0, 0, 0, 0, 0, 0, 0, 0, 0, 0, 0, 0, 0, 0, 0, 0, --
Brett Seney, Healthy, Chi, LW, FA, --, --, 0, 0, 0, 0, 0, 0, 0, 0, 0, 0, 0, 0, 0, 0, 0, 0, --
Niklas Hjalmarsson, Healthy, Ari, D, FA, @Vgk, L 1-4, 0, 0, 0, 0, 0, 0, 0, 0, 0, 0, 0, 0, 0, 0, 0, 0, --
Benoit-Olivier Groulx, Healthy, Ana, C- LW, FA, @Wpg, L 2-3, 0, 0, 0, 0, 0, 0, 0, 0, 0, 0, 0, 0, 0, 0, 0, 0, --
Brayden Tracey, Healthy, Ana, LW, FA, @Wpg, L 2-3, 0, 0, 0, 0, 0, 0, 0, 0, 0, 0, 0, 0, 0, 0, 0, 0, --
Jeffrey Viel, Healthy, SJ, LW, FA, Det, L 4-7, 0, 0, 0, 0, 0, 0, 0, 0, 0, 0, 0, 0, 0, 0, 0, 0, --
Dakota Mermis, Healthy, Min, D, FA, Pit, L 4-6, 0, 0, 0, 0, 0, 0, 0, 0, 0, 0, 0, 0, 0, 0, 0, 0, --
Laurent Dauphin, Healthy, Ari, C, FA, @Vgk, L 1-4, 0, 0, 0, 0, 0, 0, 0, 0, 0, 0, 0, 0, 0, 0, 0, 0, --
Brian Lashoff, Healthy, Det, D, FA, @SJ, W 7-4, 0, 0, 0, 0, 0, 0, 0, 0, 0, 0, 0, 0, 0, 0, 0, 0, --
Sami Niku, Healthy, Mon, D, FA, @Cls, L 4-6, 0, 0, 0, 0, 0, 0, 0, 0, 0, 0, 0, 0, 0, 0, 0, 0, --
Nathan Gerbe, Healthy, Cls, LW- RW, FA, Mon, W 6-4, 0, 0, 0, 0, 0, 0, 0, 0, 0, 0, 0, 0, 0, 0, 0, 0, --
Leo Komarov, Healthy, NYI, LW- RW, FA, @Nsh, L 4-5, 0, 0, 0, 0, 0, 0, 0, 0, 0, 0, 0, 0, 0, 0, 0, 0, --
Mikko Lehtonen, Healthy, Cls, D, FA, Mon, W 6-4, 0, 0, 0, 0, 0, 0, 0, 0, 0, 0, 0, 0, 0, 0, 0, 0, --
"Will ONeill", Healthy, Pit, D, FA, @Min, W 6-4, 0, 0, 0, 0, 0, 0, 0, 0, 0, 0, 0, 0, 0, 0, 0, 0, --
P.A. Parenteau, Healthy, Det, RW- C, FA, @SJ, W 7-4, 0, 0, 0, 0, 0, 0, 0, 0, 0, 0, 0, 0, 0, 0, 0, 0, --
Daniel Carr, Healthy, Wsh, LW, FA, @StL, L 4-5, 0, 0, 0, 0, 0, 0, 0, 0, 0, 0, 0, 0, 0, 0, 0, 0, --
Xavier Ouellet, Healthy, Pit, D, FA, @Min, W 6-4, 0, 0, 0, 0, 0, 0, 0, 0, 0, 0, 0, 0, 0, 0, 0, 0, --
Tyler Lewington, Healthy, Bos, D, FA, Phi, W 4-1, 0, 0, 0, 0, 0, 0, 0, 0, 0, 0, 0, 0, 0, 0, 0, 0, --
Egor Yakovlev, Healthy, NJ, D, FA, @Tor, W 3-2, 0, 0, 0, 0, 0, 0, 0, 0, 0, 0, 0, 0, 0, 0, 0, 0, --
William Lagesson, Healthy, Car, D, FA, Col, L 2-3, 0, 0, 0, 0, 0, 0, 0, 0, 0, 0, 0, 0, 0, 0, 0, 0, --
Mackenzie MacEachern, Healthy, Car, LW- RW, FA, Col, L 2-3, 0, 0, 0, 0, 0, 0, 0, 0, 0, 0, 0, 0, 0, 0, 0, 0, --
Kyle Criscuolo, Healthy, SJ, C, FA, Det, L 4-7, 0, 0, 0, 0, 0, 0, 0, 0, 0, 0, 0, 0, 0, 0, 0, 0, --
Dominik Simon, Healthy, Ana, LW- RW, FA, @Wpg, L 2-3, 0, 0, 0, 0, 0, 0, 0, 0, 0, 0, 0, 0, 0, 0, 0, 0, --
Jonas Rondbjerg, Healthy, Vgk, RW, FA, Ari, W 4-1, 0, 0, 0, 0, 0, 0, 0, 0, 0, 0, 0, 0, 0, 0, 0, 0, --
Kole Sherwood, Healthy, Nsh, RW, FA, NYI, W 5-4, 0, 0, 0, 0, 0, 0, 0, 0, 0, 0, 0, 0, 0, 0, 0, 0, --
Martin Frk, Healthy, StL, RW, FA, Wsh, W 5-4, 0, 0, 0, 0, 0, 0, 0, 0, 0, 0, 0, 0, 0, 0, 0, 0, --
Jack Dugan, Healthy, Vgk, RW- LW, FA, Ari, W 4-1, 0, 0, 0, 0, 0, 0, 0, 0, 0, 0, 0, 0, 0, 0, 0, 0, --
Sasha Chmelevski, Healthy, SJ, C, FA, Det, L 4-7, 0, 0, 0, 0, 0, 0, 0, 0, 0, 0, 0, 0, 0, 0, 0, 0, --
Sampo Ranta, Healthy, Col, LW, FA, @Car, W 3-2, 0, 0, 0, 0, 0, 0, 0, 0, 0, 0, 0, 0, 0, 0, 0, 0, --
Melker Karlsson, Healthy, SJ, RW- C, FA, Det, L 4-7, 0, 0, 0, 0, 0, 0, 0, 0, 0, 0, 0, 0, 0, 0, 0, 0, --
Stefan Matteau, Healthy, Col, C- LW, FA, @Car, W 3-2, 0, 0, 0, 0, 0, 0, 0, 0, 0, 0, 0, 0, 0, 0, 0, 0, --
Michal Kempny, Healthy, Sea, D, FA, NYR, W 3-2, 0, 0, 0, 0, 0, 0, 0, 0, 0, 0, 0, 0, 0, 0, 0, 0, --
Chase De Leo, Healthy, Ana, C- LW, FA, @Wpg, L 2-3, 0, 0, 0, 0, 0, 0, 0, 0, 0, 0, 0, 0, 0, 0, 0, 0, --
Louie Belpedio, Healthy, Phi, D, FA, @Bos, L 1-4, 0, 0, 0, 0, 0, 0, 0, 0, 0, 0, 0, 0, 0, 0, 0, 0, --
Thomas Hickey, Healthy, NJ, D, FA, @Tor, W 3-2, 0, 0, 0, 0, 0, 0, 0, 0, 0, 0, 0, 0, 0, 0, 0, 0, --
Cameron Schilling, Healthy, Wsh, D, FA, @StL, L 4-5, 0, 0, 0, 0, 0, 0, 0, 0, 0, 0, 0, 0, 0, 0, 0, 0, --
Josh Dunne, Healthy, Cls, C, FA, Mon, W 6-4, 0, 0, 0, 0, 0, 0, 0, 0, 0, 0, 0, 0, 0, 0, 0, 0, --
Carson Meyer, DTD, Cls, RW, FA, Mon, W 6-4, 0, 0, 0, 0, 0, 0, 0, 0, 0, 0, 0, 0, 0, 0, 0, 0, --
Nick Merkley, Healthy, NYR, RW- C, FA, @Sea, L 2-3, 0, 0, 0, 0, 0, 0, 0, 0, 0, 0, 0, 0, 0, 0, 0, 0, --
Lucas Johansen, Healthy, Wsh, D, FA, @StL, L 4-5, 0, 0, 0, 0, 0, 0, 0, 0, 0, 0, 0, 0, 0, 0, 0, 0, --
Paul Postma, Healthy, Bos, D, FA, Phi, W 4-1, 0, 0, 0, 0, 0, 0, 0, 0, 0, 0, 0, 0, 0, 0, 0, 0, --
Taro Hirose, Healthy, Det, LW, FA, @SJ, W 7-4, 0, 0, 0, 0, 0, 0, 0, 0, 0, 0, 0, 0, 0, 0, 0, 0, --
Mark Streit, Healthy, Mon, D, FA, @Cls, L 4-6, 0, 0, 0, 0, 0, 0, 0, 0, 0, 0, 0, 0, 0, 0, 0, 0, --
Antoine Roussel, Healthy, Phi, LW, FA, @Bos, L 1-4, 0, 0, 0, 0, 0, 0, 0, 0, 0, 0, 0, 0, 0, 0, 0, 0, --
Zachary Hayes, Healthy, NJ, D, FA, @Tor, W 3-2, 0, 0, 0, 0, 0, 0, 0, 0, 0, 0, 0, 0, 0, 0, 0, 0, --
Markus Nutivaara, IR, SJ, D, FA, Det, L 4-7, 0, 0, 0, 0, 0, 0, 0, 0, 0, 0, 0, 0, 0, 0, 0, 0, --
Henrik Borgstrom, Healthy, Wsh, C- LW, FA, @StL, L 4-5, 0, 0, 0, 0, 0, 0, 0, 0, 0, 0, 0, 0, 0, 0, 0, 0, --
Victor Rask, Healthy, Cls, C- LW, FA, Mon, W 6-4, 0, 0, 0, 0, 0, 0, 0, 0, 0, 0, 0, 0, 0, 0, 0, 0, --
Matt Luff, Healthy, Det, RW, FA, @SJ, W 7-4, 0, 0, 0, 0, 0, 0, 0, 0, 0, 0, 0, 0, 0, 0, 0, 0, --
Vladislav Provolnev, Healthy, Ari, D, FA, @Vgk, L 1-4, 0, 0, 0, 0, 0, 0, 0, 0, 0, 0, 0, 0, 0, 0, 0, 0, --
Michael Frolik, Healthy, StL, RW, FA, Wsh, W 5-4, 0, 0, 0, 0, 0, 0, 0, 0, 0, 0, 0, 0, 0, 0, 0, 0, --
Jay Beagle, O, Ari, C, FA, @Vgk, L 1-4, 0, 0, 0, 0, 0, 0, 0, 0, 0, 0, 0, 0, 0, 0, 0, 0, --
Glenn Gawdin, Healthy, Ana, C- RW, FA, @Wpg, L 2-3, 0, 0, 0, 0, 0, 0, 0, 0, 0, 0, 0, 0, 0, 0, 0, 0, --
Kevin Gravel, Healthy, Nsh, D, FA, NYI, W 5-4, 0, 0, 0, 0, 0, 0, 0, 0, 0, 0, 0, 0, 0, 0, 0, 0, --
Nic Petan, Healthy, Min, C- RW, FA, Pit, L 4-6, 0, 0, 0, 0, 0, 0, 0, 0, 0, 0, 0, 0, 0, 0, 0, 0, --
Dmitrij Jaskin, Healthy, Ari, RW, FA, @Vgk, L 1-4, 0, 0, 0, 0, 0, 0, 0, 0, 0, 0, 0, 0, 0, 0, 0, 0, --
Nicolas Meloche, Healthy, Cgy, D, FA, @TB, L 1-4, 0, 0, 0, 0, 0, 0, 0, 0, 0, 0, 0, 0, 0, 0, 0, 0, --
Blake Comeau, Healthy, Dal, LW- RW, FA, @Fla, W 6-4, 0, 0, 0, 0, 0, 0, 0, 0, 0, 0, 0, 0, 0, 0, 0, 0, --
Brogan Rafferty, Healthy, Sea, D, FA, NYR, W 3-2, 0, 0, 0, 0, 0, 0, 0, 0, 0, 0, 0, 0, 0, 0, 0, 0, --
Cole Schwindt, Healthy, Cgy, RW- C, FA, @TB, L 1-4, 0, 0, 0, 0, 0, 0, 0, 0, 0, 0, 0, 0, 0, 0, 0, 0, --
Joakim Ryan, Healthy, Car, D, FA, Col, L 2-3, 0, 0, 0, 0, 0, 0, 0, 0, 0, 0, 0, 0, 0, 0, 0, 0, --
Connor Bunnaman, Healthy, Fla, LW- C, FA, Dal, L 4-6, 0, 0, 0, 0, 0, 0, 0, 0, 0, 0, 0, 0, 0, 0, 0, 0, --
Nikita Gusev, Healthy, Tor, LW, FA, NJ, L 2-3, 0, 0, 0, 0, 0, 0, 0, 0, 0, 0, 0, 0, 0, 0, 0, 0, --
Olle Lycksell, Healthy, Phi, RW, FA, @Bos, L 1-4, 0, 0, 0, 0, 0, 0, 0, 0, 0, 0, 0, 0, 0, 0, 0, 0, --
Erik Burgdoerfer, Healthy, Wsh, D, FA, @StL, L 4-5, 0, 0, 0, 0, 0, 0, 0, 0, 0, 0, 0, 0, 0, 0, 0, 0, --
Carl Dahlstrom, Healthy, Tor, D, FA, NJ, L 2-3, 0, 0, 0, 0, 0, 0, 0, 0, 0, 0, 0, 0, 0, 0, 0, 0, --
Logan Shaw, Healthy, Tor, RW- C, FA, NJ, L 2-3, 0, 0, 0, 0, 0, 0, 0, 0, 0, 0, 0, 0, 0, 0, 0, 0, --
Juuso Riikola, Healthy, Pit, D, FA, @Min, W 6-4, 0, 0, 0, 0, 0, 0, 0, 0, 0, 0, 0, 0, 0, 0, 0, 0, --
Artem Anisimov, DTD, Phi, C, FA, @Bos, L 1-4, 0, 0, 0, 0, 0, 0, 0, 0, 0, 0, 0, 0, 0, 0, 0, 0, --
"Joel LEsperance", Healthy, Det, C- RW, FA, @SJ, W 7-4, 0, 0, 0, 0, 0, 0, 0, 0, 0, 0, 0, 0, 0, 0, 0, 0, --
Dennis Cholowski, Healthy, NYI, D, FA, @Nsh, L 4-5, 0, 0, 0, 0, 0, 0, 0, 0, 0, 0, 0, 0, 0, 0, 0, 0, --
Joakim Nordstrom, Healthy, Cgy, C, FA, @TB, L 1-4, 0, 0, 0, 0, 0, 0, 0, 0, 0, 0, 0, 0, 0, 0, 0, 0, --
Zack Mitchell, Healthy, Min, RW, FA, Pit, L 4-6, 0, 0, 0, 0, 0, 0, 0, 0, 0, 0, 0, 0, 0, 0, 0, 0, --
