Cutter Gauthier, Healthy, Phi, LW, FA, @Det, W 2-1, 0, 0, 0, 0, 0, 0, 0, 0, 0, 0, 0, 0, 0, 0, 0, 0, --
Connor McMichael, Healthy, Wsh, C- LW, FA, @Vgk, L 2-6, 0, 0, 0, 0, 0, 0, 0, 0, 0, 0, 0, 0, 0, 0, 0, 0, --
Victor Soderstrom, Healthy, Ari, D, FA, @Dal, L 0-4, 0, 0, 0, 0, 0, 0, 0, 0, 0, 0, 0, 0, 0, 0, 0, 0, --
Andy Greene, Healthy, NYI, D, FA, Car, L 2-5, 0, 0, 0, 0, 0, 0, 0, 0, 0, 0, 0, 0, 0, 0, 0, 0, --
Joe Thornton, Healthy, Fla, C, FA, Min, W 5-3, 0, 0, 0, 0, 0, 0, 0, 0, 0, 0, 0, 0, 0, 0, 0, 0, --
Jake Evans, Healthy, Mon, RW- C, FA, Tor, W 3-2, 0, 0, 0, 0, 0, 0, 0, 0, 0, 0, 0, 0, 0, 0, 0, 0, --
Kevin Korchinski, Healthy, Chi, D, FA, @StL, W 5-3, 0, 0, 0, 0, 0, 0, 0, 0, 0, 0, 0, 0, 0, 0, 0, 0, --
Keith Yandle, Healthy, Phi, D, FA, @Det, W 2-1, 0, 0, 0, 0, 0, 0, 0, 0, 0, 0, 0, 0, 0, 0, 0, 0, --
Jujhar Khaira, Healthy, Chi, LW, FA, @StL, W 5-3, 0, 0, 0, 0, 0, 0, 0, 0, 0, 0, 0, 0, 0, 0, 0, 0, --
Pavel Mintyukov, Healthy, Ana, D, FA, @Buf, L 3-6, 0, 0, 0, 0, 0, 0, 0, 0, 0, 0, 0, 0, 0, 0, 0, 0, --
Luke Witkowski, Healthy, StL, LW- RW- D, FA, Chi, L 3-5, 0, 0, 0, 0, 0, 0, 0, 0, 0, 0, 0, 0, 0, 0, 0, 0, --
Ryan Getzlaf, Healthy, Ana, C, FA, @Buf, L 3-6, 0, 0, 0, 0, 0, 0, 0, 0, 0, 0, 0, 0, 0, 0, 0, 0, --
Conor Geekie, Healthy, Ari, C, FA, @Dal, L 0-4, 0, 0, 0, 0, 0, 0, 0, 0, 0, 0, 0, 0, 0, 0, 0, 0, --
Joakim Kemell, Healthy, Nsh, RW, FA, LA, W 5-3, 0, 0, 0, 0, 0, 0, 0, 0, 0, 0, 0, 0, 0, 0, 0, 0, --
Bobby Brink, IR, Phi, RW, FA, @Det, W 2-1, 0, 0, 0, 0, 0, 0, 0, 0, 0, 0, 0, 0, 0, 0, 0, 0, --
Jason Spezza, Healthy, Tor, C- LW, FA, @Mon, L 2-3, 0, 0, 0, 0, 0, 0, 0, 0, 0, 0, 0, 0, 0, 0, 0, 0, --
Dustin Brown, Healthy, LA, RW, FA, @Nsh, L 3-5, 0, 0, 0, 0, 0, 0, 0, 0, 0, 0, 0, 0, 0, 0, 0, 0, --
Samuel Fagemo, Healthy, LA, LW- RW, FA, @Nsh, L 3-5, 1, 0, 0, 0, 0, 0, 0, 0, 0, 0, 0, 1, 0, 1, 0, 0, 0.0
Robin Salo, Healthy, NYI, D, FA, Car, L 2-5, 0, 0, 0, 0, 0, 0, 0, 0, 0, 0, 0, 0, 0, 0, 0, 0, --
Alex Galchenyuk, Healthy, Col, LW- RW, FA, @Sea, W 2-1, 0, 0, 0, 0, 0, 0, 0, 0, 0, 0, 0, 0, 0, 0, 0, 0, --
Gustav Lindstrom, Healthy, Det, D, FA, Phi, L 1-2, 0, 0, 0, 0, 0, 0, 0, 0, 0, 0, 0, 0, 0, 0, 0, 0, --
Vinnie Hinostroza, Healthy, Buf, RW- LW, FA, Ana, W 6-3, 0, 0, 0, 0, 0, 0, 0, 0, 0, 0, 0, 0, 0, 0, 0, 0, --
Jack Rathbone, Healthy, Van, D, FA, Edm, L 2-4, 0, 0, 0, 0, 0, 0, 0, 0, 0, 0, 0, 0, 0, 0, 0, 0, --
Frank Nazar, Healthy, Chi, C, FA, @StL, W 5-3, 0, 0, 0, 0, 0, 0, 0, 0, 0, 0, 0, 0, 0, 0, 0, 0, --
Brad Lambert, Healthy, Wpg, C, FA, @Ott, W 5-1, 0, 0, 0, 0, 0, 0, 0, 0, 0, 0, 0, 0, 0, 0, 0, 0, --
Alexander Radulov, Healthy, Dal, RW, FA, Ari, W 4-0, 0, 0, 0, 0, 0, 0, 0, 0, 0, 0, 0, 0, 0, 0, 0, 0, --
Denton Mateychuk, Healthy, Cls, D, FA, SJ, W 5-3, 0, 0, 0, 0, 0, 0, 0, 0, 0, 0, 0, 0, 0, 0, 0, 0, --
Mason Appleton, Healthy, Wpg, C- RW, FA, @Ott, W 5-1, 0, 0, 0, 0, 0, 0, 0, 0, 0, 0, 0, 0, 0, 0, 0, 0, --
Logan Stanley, Healthy, Wpg, D, FA, @Ott, W 5-1, 0, 0, 0, 0, 0, 0, 0, 0, 0, 0, 0, 0, 0, 0, 0, 0, --
Jonathan Lekkerimaki, Healthy, Van, RW, FA, Edm, L 2-4, 0, 0, 0, 0, 0, 0, 0, 0, 0, 0, 0, 0, 0, 0, 0, 0, --
Jimmy Snuggerud, Healthy, StL, RW, FA, Chi, L 3-5, 0, 0, 0, 0, 0, 0, 0, 0, 0, 0, 0, 0, 0, 0, 0, 0, --
Jack Drury, Healthy, Car, C, FA, @NYI, W 5-2, 0, 0, 0, 0, 0, 0, 0, 0, 0, 0, 0, 0, 0, 0, 0, 0, --
Joel Armia, Healthy, Mon, RW- LW, FA, Tor, W 3-2, 0, 0, 0, 0, 0, 0, 0, 0, 0, 0, 0, 0, 0, 0, 0, 0, --
Ivan Miroshnichenko, Healthy, Wsh, LW, FA, @Vgk, L 2-6, 0, 0, 0, 0, 0, 0, 0, 0, 0, 0, 0, 0, 0, 0, 0, 0, --
Marco Scandella, DTD, StL, D, FA, Chi, L 3-5, 0, 0, 0, 0, 0, 0, 0, 0, 0, 0, 0, 0, 0, 0, 0, 0, --
Philippe Myers, Healthy, TB, D, FA, @Cgy, L 3-6, 0, 0, 0, 0, 0, 0, 0, 0, 0, 0, 0, 0, 0, 0, 0, 0, --
Hendrix Lapierre, Healthy, Wsh, C, FA, @Vgk, L 2-6, 0, 0, 0, 0, 0, 0, 0, 0, 0, 0, 0, 0, 0, 0, 0, 0, --
Brett Ritchie, Healthy, Ari, RW, FA, @Dal, L 0-4, 0, 0, 0, 0, 0, 0, 0, 0, 0, 0, 0, 0, 0, 0, 0, 0, --
Jordan Spence, Healthy, LA, D, FA, @Nsh, L 3-5, 0, 0, 0, 0, 0, 0, 0, 0, 0, 0, 0, 0, 0, 0, 0, 0, --
Ryan Murray, IR, Edm, D, FA, @Van, W 4-2, 0, 0, 0, 0, 0, 0, 0, 0, 0, 0, 0, 0, 0, 0, 0, 0, --
Thomas Harley, Healthy, Dal, D, FA, Ari, W 4-0, 0, 0, 0, 0, 0, 0, 0, 0, 0, 0, 0, 0, 0, 0, 0, 0, --
Bokondji Imama, Healthy, Ari, LW, FA, @Dal, L 0-4, 0, 0, 0, 0, 0, 0, 0, 0, 0, 0, 0, 0, 0, 0, 0, 0, --
Brad Hunt, Healthy, Col, D, FA, @Sea, W 2-1, 1, 0, 0, 0, 0, 0, 0, 0, 0, 0, 0, 0, 0, 0, 0, 0, 0.0
Joel Ward, Healthy, SJ, RW, FA, @Cls, L 3-5, 0, 0, 0, 0, 0, 0, 0, 0, 0, 0, 0, 0, 0, 0, 0, 0, --
Rutger McGroarty, Healthy, Wpg, RW, FA, @Ott, W 5-1, 0, 0, 0, 0, 0, 0, 0, 0, 0, 0, 0, 0, 0, 0, 0, 0, --
Ryan Suzuki, Healthy, Car, C, FA, @NYI, W 5-2, 0, 0, 0, 0, 0, 0, 0, 0, 0, 0, 0, 0, 0, 0, 0, 0, --
Mavrik Bourque, Healthy, Dal, C, FA, Ari, W 4-0, 0, 0, 0, 0, 0, 0, 0, 0, 0, 0, 0, 0, 0, 0, 0, 0, --
Michael Del Zotto, Healthy, Ana, D, FA, @Buf, L 3-6, 0, 0, 0, 0, 0, 0, 0, 0, 0, 0, 0, 0, 0, 0, 0, 0, --
Patrick Marleau, Healthy, SJ, LW, FA, @Cls, L 3-5, 0, 0, 0, 0, 0, 0, 0, 0, 0, 0, 0, 0, 0, 0, 0, 0, --
Nolan Patrick, IR, Vgk, C- RW, FA, Wsh, W 6-2, 0, 0, 0, 0, 0, 0, 0, 0, 0, 0, 0, 0, 0, 0, 0, 0, --
Brett Howden, Healthy, Vgk, C, FA, Wsh, W 6-2, 0, 0, 0, 0, 0, 0, 0, 0, 0, 0, 0, 0, 0, 0, 0, 0, --
Brendan Brisson, Healthy, Vgk, C- LW, FA, Wsh, W 6-2, 0, 0, 0, 0, 0, 0, 0, 0, 0, 0, 0, 0, 0, 0, 0, 0, --
Victor Mete, IR, Tor, D, FA, @Mon, L 2-3, 0, 0, 0, 0, 0, 0, 0, 0, 0, 0, 0, 0, 0, 0, 0, 0, --
Alex Barre-Boulet, Healthy, TB, C- LW- RW, FA, @Cgy, L 3-6, 0, 0, 0, 0, 0, 0, 0, 0, 0, 0, 0, 0, 0, 0, 0, 0, --
Jake Virtanen, Healthy, Edm, RW, FA, @Van, W 4-2, 0, 0, 0, 0, 0, 0, 0, 0, 0, 0, 0, 0, 0, 0, 0, 0, --
Gabriel Carlsson, Healthy, Wsh, D, FA, @Vgk, L 2-6, 0, 0, 0, 0, 0, 0, 0, 0, 0, 0, 0, 0, 0, 0, 0, 0, --
Gemel Smith, Healthy, TB, C, FA, @Cgy, L 3-6, 0, 0, 0, 0, 0, 0, 0, 0, 0, 0, 0, 0, 0, 0, 0, 0, --
Carl Soderberg, Healthy, Col, C, FA, @Sea, W 2-1, 0, 0, 0, 0, 0, 0, 0, 0, 0, 0, 0, 0, 0, 0, 0, 0, --
Kieffer Bellows, Healthy, Phi, LW- C, FA, @Det, W 2-1, 0, 0, 0, 0, 0, 0, 0, 0, 0, 0, 0, 0, 0, 0, 0, 0, --
Danila Yurov, Healthy, Min, RW, FA, @Fla, L 3-5, 0, 0, 0, 0, 0, 0, 0, 0, 0, 0, 0, 0, 0, 0, 0, 0, --
Connor Zary, Healthy, Cgy, C, FA, TB, W 6-3, 0, 0, 0, 0, 0, 0, 0, 0, 0, 0, 0, 0, 0, 0, 0, 0, --
Paul LaDue, Healthy, NYI, D, FA, Car, L 2-5, 0, 0, 0, 0, 0, 0, 0, 0, 0, 0, 0, 0, 0, 0, 0, 0, --
Tucker Poolman, IR, Van, D, FA, Edm, L 2-4, 0, 0, 0, 0, 0, 0, 0, 0, 0, 0, 0, 0, 0, 0, 0, 0, --
Loui Eriksson, Healthy, Ari, LW- RW, FA, @Dal, L 0-4, 0, 0, 0, 0, 0, 0, 0, 0, 0, 0, 0, 0, 0, 0, 0, 0, --
Alex Formenton, DTD, Ott, LW, FA, Wpg, L 1-5, 0, 0, 0, 0, 0, 0, 0, 0, 0, 0, 0, 0, 0, 0, 0, 0, --
Dennis Gilbert, Healthy, Cgy, D, FA, TB, W 6-3, 0, 0, 0, 0, 0, 0, 0, 0, 0, 0, 0, 0, 0, 0, 0, 0, --
Liam Ohgren, Healthy, Min, LW, FA, @Fla, L 3-5, 0, 0, 0, 0, 0, 0, 0, 0, 0, 0, 0, 0, 0, 0, 0, 0, --
Vincent Desharnais, Healthy, Edm, D, FA, @Van, W 4-2, 1, 0, 0, 0, 0, 0, 0, 0, 0, 0, 0, 0, 0, 0, 0, 0, 0.0
Zac Dalpe, Healthy, Fla, C, FA, Min, W 5-3, 0, 0, 0, 0, 0, 0, 0, 0, 0, 0, 0, 0, 0, 0, 0, 0, --
Radim Zohorna, Healthy, Tor, LW, FA, @Mon, L 2-3, 0, 0, 0, 0, 0, 0, 0, 0, 0, 0, 0, 0, 0, 0, 0, 0, --
Alex Vlasic, Healthy, Chi, D, FA, @StL, W 5-3, 0, 0, 0, 0, 0, 0, 0, 0, 0, 0, 0, 0, 0, 0, 0, 0, --
Cameron Hughes, Healthy, Sea, C- LW, FA, Col, L 1-2, 0, 0, 0, 0, 0, 0, 0, 0, 0, 0, 0, 0, 0, 0, 0, 0, --
Jonathan Dahlen, Healthy, SJ, RW- LW, FA, @Cls, L 3-5, 0, 0, 0, 0, 0, 0, 0, 0, 0, 0, 0, 0, 0, 0, 0, 0, --
J.T. Brown, Healthy, Min, RW, FA, @Fla, L 3-5, 0, 0, 0, 0, 0, 0, 0, 0, 0, 0, 0, 0, 0, 0, 0, 0, --
John Leonard, Healthy, Nsh, LW- RW, FA, LA, W 5-3, 0, 0, 0, 0, 0, 0, 0, 0, 0, 0, 0, 0, 0, 0, 0, 0, --
Ryan Merkley, Healthy, Col, D, FA, @Sea, W 2-1, 0, 0, 0, 0, 0, 0, 0, 0, 0, 0, 0, 0, 0, 0, 0, 0, --
Billy Sweezey, Healthy, Cls, D, FA, SJ, W 5-3, 0, 0, 0, 0, 0, 0, 0, 0, 0, 0, 0, 0, 0, 0, 0, 0, --
Radim Simek, Healthy, SJ, D, FA, @Cls, L 3-5, 0, 0, 0, 0, 0, 0, 0, 0, 0, 0, 0, 0, 0, 0, 0, 0, --
Jiri Kulich, Healthy, Buf, C, FA, Ana, W 6-3, 0, 0, 0, 0, 0, 0, 0, 0, 0, 0, 0, 0, 0, 0, 0, 0, --
Adam Gaudette, Healthy, StL, C- RW, FA, Chi, L 3-5, 0, 0, 0, 0, 0, 0, 0, 0, 0, 0, 0, 0, 0, 0, 0, 0, --
Danny DeKeyser, Healthy, Van, D, FA, Edm, L 2-4, 0, 0, 0, 0, 0, 0, 0, 0, 0, 0, 0, 0, 0, 0, 0, 0, --
Martin Kaut, Healthy, SJ, C- RW, FA, @Cls, L 3-5, 0, 0, 0, 0, 0, 0, 0, 0, 0, 0, 0, 0, 0, 0, 0, 0, --
Noah Ostlund, Healthy, Buf, C, FA, Ana, W 6-3, 0, 0, 0, 0, 0, 0, 0, 0, 0, 0, 0, 0, 0, 0, 0, 0, --
Madison Bowey, Healthy, Mon, D, FA, Tor, W 3-2, 0, 0, 0, 0, 0, 0, 0, 0, 0, 0, 0, 0, 0, 0, 0, 0, --
Nils Aman, Healthy, Van, C, FA, Edm, L 2-4, 0, 0, 0, 0, 0, 0, 0, 0, 0, 0, 0, 0, 0, 0, 0, 0, --
Michael McCarron, Healthy, Nsh, RW- C, FA, LA, W 5-3, 0, 0, 0, 0, 0, 0, 0, 0, 0, 0, 0, 0, 0, 0, 0, 0, --
Adam Beckman, Healthy, Min, C- LW, FA, @Fla, L 3-5, 0, 0, 0, 0, 0, 0, 0, 0, 0, 0, 0, 0, 0, 0, 0, 0, --
Lucas Carlsson, Healthy, Fla, D, FA, Min, W 5-3, 0, 0, 0, 0, 0, 0, 0, 0, 0, 0, 0, 0, 0, 0, 0, 0, --
Anders Bjork, Healthy, Chi, LW- RW, FA, @StL, W 5-3, 0, 0, 0, 0, 0, 0, 0, 0, 0, 0, 0, 0, 0, 0, 0, 0, --
Mark Pysyk, O, Det, D, FA, Phi, L 1-2, 0, 0, 0, 0, 0, 0, 0, 0, 0, 0, 0, 0, 0, 0, 0, 0, --
Alexandre Texier, O, Cls, C- RW, FA, SJ, W 5-3, 0, 0, 0, 0, 0, 0, 0, 0, 0, 0, 0, 0, 0, 0, 0, 0, --
Joey Anderson, Healthy, Tor, RW, FA, @Mon, L 2-3, 0, 0, 0, 0, 0, 0, 0, 0, 0, 0, 0, 0, 0, 0, 0, 0, --
Jan Jenik, Healthy, Ari, C- RW, FA, @Dal, L 0-4, 0, 0, 0, 0, 0, 0, 0, 0, 0, 0, 0, 0, 0, 0, 0, 0, --
Dominic Toninato, Healthy, Wpg, C- LW, FA, @Ott, W 5-1, 0, 0, 0, 0, 0, 0, 0, 0, 0, 0, 0, 0, 0, 0, 0, 0, --
Derrick Pouliot, Healthy, SJ, D, FA, @Cls, L 3-5, 0, 0, 0, 0, 0, 0, 0, 0, 0, 0, 0, 0, 0, 0, 0, 0, --
Kris Russell, Healthy, Edm, D, FA, @Van, W 4-2, 0, 0, 0, 0, 0, 0, 0, 0, 0, 0, 0, 0, 0, 0, 0, 0, --
Kyle Clifford, Healthy, Tor, LW, FA, @Mon, L 2-3, 0, 0, 0, 0, 0, 0, 0, 0, 0, 0, 0, 0, 0, 0, 0, 0, --
Greg McKegg, Healthy, Edm, C- LW, FA, @Van, W 4-2, 0, 0, 0, 0, 0, 0, 0, 0, 0, 0, 0, 0, 0, 0, 0, 0, --
Christian Wolanin, O, Van, D, FA, Edm, L 2-4, 0, 0, 0, 0, 0, 0, 0, 0, 0, 0, 0, 0, 0, 0, 0, 0, --
Alexander True, Healthy, Sea, C- RW, FA, Col, L 1-2, 0, 0, 0, 0, 0, 0, 0, 0, 0, 0, 0, 0, 0, 0, 0, 0, --
Slater Koekkoek, Healthy, Edm, D, FA, @Van, W 4-2, 0, 0, 0, 0, 0, 0, 0, 0, 0, 0, 0, 0, 0, 0, 0, 0, --
Lian Bichsel, Healthy, Dal, D, FA, Ari, W 4-0, 0, 0, 0, 0, 0, 0, 0, 0, 0, 0, 0, 0, 0, 0, 0, 0, --
Kevin Rooney, Healthy, Cgy, C- LW, FA, TB, W 6-3, 0, 0, 0, 0, 0, 0, 0, 0, 0, 0, 0, 0, 0, 0, 0, 0, --
Jake Gardiner, IR, Car, D, FA, @NYI, W 5-2, 0, 0, 0, 0, 0, 0, 0, 0, 0, 0, 0, 0, 0, 0, 0, 0, --
Joe Snively, Healthy, Wsh, LW, FA, @Vgk, L 2-6, 0, 0, 0, 0, 0, 0, 0, 0, 0, 0, 0, 0, 0, 0, 0, 0, --
Pontus Holmberg, Healthy, Tor, C, FA, @Mon, L 2-3, 0, 0, 0, 0, 0, 0, 0, 0, 0, 0, 0, 0, 0, 0, 0, 0, --
Isaac Howard, Healthy, TB, LW, FA, @Cgy, L 3-6, 0, 0, 0, 0, 0, 0, 0, 0, 0, 0, 0, 0, 0, 0, 0, 0, --
Jacob Peterson, Healthy, SJ, C- LW, FA, @Cls, L 3-5, 0, 0, 0, 0, 0, 0, 0, 0, 0, 0, 0, 0, 0, 0, 0, 0, --
Samuel Walker, Healthy, Min, LW, FA, @Fla, L 3-5, 0, 0, 0, 0, 0, 0, 0, 0, 0, 0, 0, 0, 0, 0, 0, 0, --
Dennis Wideman, Healthy, Cgy, D, FA, TB, W 6-3, 0, 0, 0, 0, 0, 0, 0, 0, 0, 0, 0, 0, 0, 0, 0, 0, --
Noah Juulsen, O, Van, D, FA, Edm, L 2-4, 0, 0, 0, 0, 0, 0, 0, 0, 0, 0, 0, 0, 0, 0, 0, 0, --
Steven Fogarty, Healthy, Min, C- RW, FA, @Fla, L 3-5, 0, 0, 0, 0, 0, 0, 0, 0, 0, 0, 0, 0, 0, 0, 0, 0, --
Josh Gorges, Healthy, Buf, D, FA, Ana, W 6-3, 0, 0, 0, 0, 0, 0, 0, 0, 0, 0, 0, 0, 0, 0, 0, 0, --
Egor Zamula, Healthy, Phi, D, FA, @Det, W 2-1, 0, 0, 0, 0, 0, 0, 0, 0, 0, 0, 0, 0, 0, 0, 0, 0, --
Rodion Amirov, IR, Tor, LW, FA, @Mon, L 2-3, 0, 0, 0, 0, 0, 0, 0, 0, 0, 0, 0, 0, 0, 0, 0, 0, --
Andrew Shaw, Healthy, Chi, C- RW, FA, @StL, W 5-3, 0, 0, 0, 0, 0, 0, 0, 0, 0, 0, 0, 0, 0, 0, 0, 0, --
"Zachary LHeureux", Healthy, Nsh, LW, FA, LA, W 5-3, 0, 0, 0, 0, 0, 0, 0, 0, 0, 0, 0, 0, 0, 0, 0, 0, --
Petteri Lindbohm, Healthy, Fla, D, FA, Min, W 5-3, 0, 0, 0, 0, 0, 0, 0, 0, 0, 0, 0, 0, 0, 0, 0, 0, --
Justin Danforth, IR, Cls, RW- C, FA, SJ, W 5-3, 0, 0, 0, 0, 0, 0, 0, 0, 0, 0, 0, 0, 0, 0, 0, 0, --
Carl Hagelin, IR, Wsh, LW, FA, @Vgk, L 2-6, 0, 0, 0, 0, 0, 0, 0, 0, 0, 0, 0, 0, 0, 0, 0, 0, --
Filip Mesar, Healthy, Mon, RW, FA, Tor, W 3-2, 0, 0, 0, 0, 0, 0, 0, 0, 0, 0, 0, 0, 0, 0, 0, 0, --
Ben Thomas, Healthy, TB, D, FA, @Cgy, L 3-6, 0, 0, 0, 0, 0, 0, 0, 0, 0, 0, 0, 0, 0, 0, 0, 0, --
Jacob Larsson, Healthy, Ott, D, FA, Wpg, L 1-5, 0, 0, 0, 0, 0, 0, 0, 0, 0, 0, 0, 0, 0, 0, 0, 0, --
Vladimir Tkachev, Healthy, LA, LW- RW, FA, @Nsh, L 3-5, 0, 0, 0, 0, 0, 0, 0, 0, 0, 0, 0, 0, 0, 0, 0, 0, --
Luca Sbisa, Healthy, Nsh, D, FA, LA, W 5-3, 0, 0, 0, 0, 0, 0, 0, 0, 0, 0, 0, 0, 0, 0, 0, 0, --
Sam Rinzel, Healthy, Chi, D, FA, @StL, W 5-3, 0, 0, 0, 0, 0, 0, 0, 0, 0, 0, 0, 0, 0, 0, 0, 0, --
Brennan Menell, Healthy, Tor, D, FA, @Mon, L 2-3, 0, 0, 0, 0, 0, 0, 0, 0, 0, 0, 0, 0, 0, 0, 0, 0, --
Cole Koepke, Healthy, TB, LW, FA, @Cgy, L 3-6, 0, 0, 0, 0, 0, 0, 0, 0, 0, 0, 0, 0, 0, 0, 0, 0, --
Zac Rinaldo, Healthy, Cls, LW, FA, SJ, W 5-3, 0, 0, 0, 0, 0, 0, 0, 0, 0, 0, 0, 0, 0, 0, 0, 0, --
Keaton Middleton, Healthy, Col, D, FA, @Sea, W 2-1, 0, 0, 0, 0, 0, 0, 0, 0, 0, 0, 0, 0, 0, 0, 0, 0, --
Patrick Wiercioch, Healthy, Van, D, FA, Edm, L 2-4, 0, 0, 0, 0, 0, 0, 0, 0, 0, 0, 0, 0, 0, 0, 0, 0, --
Alec Regula, Healthy, Chi, D, FA, @StL, W 5-3, 0, 0, 0, 0, 0, 0, 0, 0, 0, 0, 0, 0, 0, 0, 0, 0, --
David Gustafsson, Healthy, Wpg, C, FA, @Ott, W 5-1, 0, 0, 0, 0, 0, 0, 0, 0, 0, 0, 0, 0, 0, 0, 0, 0, --
Jansen Harkins, Healthy, Wpg, C- LW, FA, @Ott, W 5-1, 0, 0, 0, 0, 0, 0, 0, 0, 0, 0, 0, 0, 0, 0, 0, 0, --
Maveric Lamoureux, Healthy, Ari, D, FA, @Dal, L 0-4, 0, 0, 0, 0, 0, 0, 0, 0, 0, 0, 0, 0, 0, 0, 0, 0, --
David Backes, Healthy, Ana, C, FA, @Buf, L 3-6, 0, 0, 0, 0, 0, 0, 0, 0, 0, 0, 0, 0, 0, 0, 0, 0, --
Will Butcher, Healthy, Dal, D, FA, Ari, W 4-0, 0, 0, 0, 0, 0, 0, 0, 0, 0, 0, 0, 0, 0, 0, 0, 0, --
Lawrence Pilut, Healthy, Buf, D, FA, Ana, W 6-3, 0, 0, 0, 0, 0, 0, 0, 0, 0, 0, 0, 0, 0, 0, 0, 0, --
Tanner Laczynski, Healthy, Phi, C, FA, @Det, W 2-1, 0, 0, 0, 0, 0, 0, 0, 0, 0, 0, 0, 0, 0, 0, 0, 0, --
Dan Girardi, Healthy, TB, D, FA, @Cgy, L 3-6, 0, 0, 0, 0, 0, 0, 0, 0, 0, 0, 0, 0, 0, 0, 0, 0, --
Markus Niemelainen, Healthy, Edm, D, FA, @Van, W 4-2, 0, 0, 0, 0, 0, 0, 0, 0, 0, 0, 0, 0, 0, 0, 0, 0, --
Chris Kunitz, Healthy, Chi, LW, FA, @StL, W 5-3, 0, 0, 0, 0, 0, 0, 0, 0, 0, 0, 0, 0, 0, 0, 0, 0, --
Riley Tufte, Healthy, Dal, LW, FA, Ari, W 4-0, 0, 0, 0, 0, 0, 0, 0, 0, 0, 0, 0, 0, 0, 0, 0, 0, --
Reid Schaefer, Healthy, Nsh, LW, FA, LA, W 5-3, 0, 0, 0, 0, 0, 0, 0, 0, 0, 0, 0, 0, 0, 0, 0, 0, --
John Moore, IR, Ana, D, FA, @Buf, L 3-6, 0, 0, 0, 0, 0, 0, 0, 0, 0, 0, 0, 0, 0, 0, 0, 0, --
Jackson Cates, Healthy, Phi, C, FA, @Det, W 2-1, 0, 0, 0, 0, 0, 0, 0, 0, 0, 0, 0, 0, 0, 0, 0, 0, --
David Schlemko, Healthy, Phi, D, FA, @Det, W 2-1, 0, 0, 0, 0, 0, 0, 0, 0, 0, 0, 0, 0, 0, 0, 0, 0, --
Daniel Walcott, Healthy, TB, D, FA, @Cgy, L 3-6, 0, 0, 0, 0, 0, 0, 0, 0, 0, 0, 0, 0, 0, 0, 0, 0, --
Fredrik Claesson, Healthy, TB, D, FA, @Cgy, L 3-6, 0, 0, 0, 0, 0, 0, 0, 0, 0, 0, 0, 0, 0, 0, 0, 0, --
Gabriel Fortier, Healthy, TB, LW, FA, @Cgy, L 3-6, 0, 0, 0, 0, 0, 0, 0, 0, 0, 0, 0, 0, 0, 0, 0, 0, --
Jasper Weatherby, Healthy, Det, LW- C, FA, Phi, L 1-2, 0, 0, 0, 0, 0, 0, 0, 0, 0, 0, 0, 0, 0, 0, 0, 0, --
James Neal, Healthy, Cls, RW- LW, FA, SJ, W 5-3, 0, 0, 0, 0, 0, 0, 0, 0, 0, 0, 0, 0, 0, 0, 0, 0, --
Mike Liambas, Healthy, Min, D, FA, @Fla, L 3-5, 0, 0, 0, 0, 0, 0, 0, 0, 0, 0, 0, 0, 0, 0, 0, 0, --
Josiah Slavin, Healthy, Chi, LW, FA, @StL, W 5-3, 0, 0, 0, 0, 0, 0, 0, 0, 0, 0, 0, 0, 0, 0, 0, 0, --
Brandon Manning, Healthy, Edm, D, FA, @Van, W 4-2, 0, 0, 0, 0, 0, 0, 0, 0, 0, 0, 0, 0, 0, 0, 0, 0, --
Vladislav Kolyachonok, Healthy, Ari, D, FA, @Dal, L 0-4, 0, 0, 0, 0, 0, 0, 0, 0, 0, 0, 0, 0, 0, 0, 0, 0, --
Nikita Alexandrov, Healthy, StL, C, FA, Chi, L 3-5, 0, 0, 0, 0, 0, 0, 0, 0, 0, 0, 0, 0, 0, 0, 0, 0, --
Oskar Olausson, Healthy, Col, RW, FA, @Sea, W 2-1, 0, 0, 0, 0, 0, 0, 0, 0, 0, 0, 0, 0, 0, 0, 0, 0, --
Buddy Robinson, Healthy, Chi, RW, FA, @StL, W 5-3, 0, 0, 0, 0, 0, 0, 0, 0, 0, 0, 0, 0, 0, 0, 0, 0, --
Carl Gunnarsson, Healthy, StL, D, FA, Chi, L 3-5, 0, 0, 0, 0, 0, 0, 0, 0, 0, 0, 0, 0, 0, 0, 0, 0, --
Mark Alt, Healthy, SJ, D, FA, @Cls, L 3-5, 0, 0, 0, 0, 0, 0, 0, 0, 0, 0, 0, 0, 0, 0, 0, 0, --
Filip Roos, Healthy, Chi, D, FA, @StL, W 5-3, 0, 0, 0, 0, 0, 0, 0, 0, 0, 0, 0, 0, 0, 0, 0, 0, --
Tyler Bozak, Healthy, StL, C, FA, Chi, L 3-5, 0, 0, 0, 0, 0, 0, 0, 0, 0, 0, 0, 0, 0, 0, 0, 0, --
Olli Juolevi, Healthy, Ana, D, FA, @Buf, L 3-6, 0, 0, 0, 0, 0, 0, 0, 0, 0, 0, 0, 0, 0, 0, 0, 0, --
Jake Christiansen, Healthy, Cls, D, FA, SJ, W 5-3, 0, 0, 0, 0, 0, 0, 0, 0, 0, 0, 0, 0, 0, 0, 0, 0, --
Darren Raddysh, Healthy, TB, D, FA, @Cgy, L 3-6, 0, 0, 0, 0, 0, 0, 0, 0, 0, 0, 0, 0, 0, 0, 0, 0, --
Mikko Koivu, Healthy, Cls, C, FA, SJ, W 5-3, 0, 0, 0, 0, 0, 0, 0, 0, 0, 0, 0, 0, 0, 0, 0, 0, --
Braydon Coburn, Healthy, NYI, D, FA, Car, L 2-5, 0, 0, 0, 0, 0, 0, 0, 0, 0, 0, 0, 0, 0, 0, 0, 0, --
Igor Ozhiganov, Healthy, Tor, D, FA, @Mon, L 2-3, 0, 0, 0, 0, 0, 0, 0, 0, 0, 0, 0, 0, 0, 0, 0, 0, --
Riley Nash, Healthy, Fla, C- RW, FA, Min, W 5-3, 0, 0, 0, 0, 0, 0, 0, 0, 0, 0, 0, 0, 0, 0, 0, 0, --
Max Willman, Healthy, Phi, C- LW, FA, @Det, W 2-1, 0, 0, 0, 0, 0, 0, 0, 0, 0, 0, 0, 0, 0, 0, 0, 0, --
Lukas Sedlak, Healthy, Phi, C, FA, @Det, W 2-1, 0, 0, 0, 0, 0, 0, 0, 0, 0, 0, 0, 0, 0, 0, 0, 0, --
Anthony Bitetto, Healthy, Fla, D, FA, Min, W 5-3, 0, 0, 0, 0, 0, 0, 0, 0, 0, 0, 0, 0, 0, 0, 0, 0, --
Austin Czarnik, Healthy, Det, RW- C- LW, FA, Phi, L 1-2, 0, 0, 0, 0, 0, 0, 0, 0, 0, 0, 0, 0, 0, 0, 0, 0, --
Ryan Dzingel, Healthy, Car, C- LW- RW, FA, @NYI, W 5-2, 0, 0, 0, 0, 0, 0, 0, 0, 0, 0, 0, 0, 0, 0, 0, 0, --
Andrew Poturalski, Healthy, Sea, C, FA, Col, L 1-2, 0, 0, 0, 0, 0, 0, 0, 0, 0, 0, 0, 0, 0, 0, 0, 0, --
Cody Eakin, Healthy, Cgy, C, FA, TB, W 6-3, 0, 0, 0, 0, 0, 0, 0, 0, 0, 0, 0, 0, 0, 0, 0, 0, --
Mikhail Maltsev, Healthy, Col, LW, FA, @Sea, W 2-1, 0, 0, 0, 0, 0, 0, 0, 0, 0, 0, 0, 0, 0, 0, 0, 0, --
Matthew Phillips, Healthy, Cgy, C, FA, TB, W 6-3, 0, 0, 0, 0, 0, 0, 0, 0, 0, 0, 0, 0, 0, 0, 0, 0, --
Matt Tennyson, Healthy, Sea, D, FA, Col, L 1-2, 0, 0, 0, 0, 0, 0, 0, 0, 0, 0, 0, 0, 0, 0, 0, 0, --
Ben Lovejoy, Healthy, Dal, D, FA, Ari, W 4-0, 0, 0, 0, 0, 0, 0, 0, 0, 0, 0, 0, 0, 0, 0, 0, 0, --
Nathan Smith, Healthy, Ari, LW- C, FA, @Dal, L 0-4, 0, 0, 0, 0, 0, 0, 0, 0, 0, 0, 0, 0, 0, 0, 0, 0, --
Greg Pateryn, Healthy, Ana, D, FA, @Buf, L 3-6, 0, 0, 0, 0, 0, 0, 0, 0, 0, 0, 0, 0, 0, 0, 0, 0, --
Brad Malone, Healthy, Edm, LW- C, FA, @Van, W 4-2, 0, 0, 0, 0, 0, 0, 0, 0, 0, 0, 0, 0, 0, 0, 0, 0, --
Andrew Ladd, IR, Ari, LW, FA, @Dal, L 0-4, 0, 0, 0, 0, 0, 0, 0, 0, 0, 0, 0, 0, 0, 0, 0, 0, --
Andrej Sekera, Healthy, Dal, D, FA, Ari, W 4-0, 0, 0, 0, 0, 0, 0, 0, 0, 0, 0, 0, 0, 0, 0, 0, 0, --
Christian Djoos, Healthy, Det, D, FA, Phi, L 1-2, 0, 0, 0, 0, 0, 0, 0, 0, 0, 0, 0, 0, 0, 0, 0, 0, --
Lassi Thomson, Healthy, Ott, D, FA, Wpg, L 1-5, 0, 0, 0, 0, 0, 0, 0, 0, 0, 0, 0, 0, 0, 0, 0, 0, --
Dean Kukan, Healthy, Cls, D, FA, SJ, W 5-3, 0, 0, 0, 0, 0, 0, 0, 0, 0, 0, 0, 0, 0, 0, 0, 0, --
Johan Larsson, Healthy, Wsh, LW- C, FA, @Vgk, L 2-6, 0, 0, 0, 0, 0, 0, 0, 0, 0, 0, 0, 0, 0, 0, 0, 0, --
Aleksi Heponiemi, Healthy, Fla, C, FA, Min, W 5-3, 0, 0, 0, 0, 0, 0, 0, 0, 0, 0, 0, 0, 0, 0, 0, 0, --
Darren Archibald, Healthy, Tor, LW- RW, FA, @Mon, L 2-3, 0, 0, 0, 0, 0, 0, 0, 0, 0, 0, 0, 0, 0, 0, 0, 0, --
Ronnie Attard, Healthy, Phi, D, FA, @Det, W 2-1, 0, 0, 0, 0, 0, 0, 0, 0, 0, 0, 0, 0, 0, 0, 0, 0, --
Bobby Ryan, Healthy, Det, RW- LW, FA, Phi, L 1-2, 0, 0, 0, 0, 0, 0, 0, 0, 0, 0, 0, 0, 0, 0, 0, 0, --
Lias Andersson, Healthy, LA, C- LW, FA, @Nsh, L 3-5, 0, 0, 0, 0, 0, 0, 0, 0, 0, 0, 0, 0, 0, 0, 0, 0, --
Sami Vatanen, Healthy, Dal, D, FA, Ari, W 4-0, 0, 0, 0, 0, 0, 0, 0, 0, 0, 0, 0, 0, 0, 0, 0, 0, --
Michael Raffl, Healthy, Dal, LW, FA, Ari, W 4-0, 0, 0, 0, 0, 0, 0, 0, 0, 0, 0, 0, 0, 0, 0, 0, 0, --
Nikita Nesterov, Healthy, Cgy, D, FA, TB, W 6-3, 0, 0, 0, 0, 0, 0, 0, 0, 0, 0, 0, 0, 0, 0, 0, 0, --
Andrej Sustr, Healthy, Ana, D, FA, @Buf, L 3-6, 0, 0, 0, 0, 0, 0, 0, 0, 0, 0, 0, 0, 0, 0, 0, 0, --
Matej Blumel, Healthy, Dal, LW, FA, Ari, W 4-0, 0, 0, 0, 0, 0, 0, 0, 0, 0, 0, 0, 0, 0, 0, 0, 0, --
Matthew Highmore, Healthy, StL, C- LW- RW, FA, Chi, L 3-5, 0, 0, 0, 0, 0, 0, 0, 0, 0, 0, 0, 0, 0, 0, 0, 0, --
CJ Suess, Healthy, SJ, LW, FA, @Cls, L 3-5, 0, 0, 0, 0, 0, 0, 0, 0, 0, 0, 0, 0, 0, 0, 0, 0, --
Nikolai Knyzhov, Healthy, SJ, D, FA, @Cls, L 3-5, 0, 0, 0, 0, 0, 0, 0, 0, 0, 0, 0, 0, 0, 0, 0, 0, --
Alex Biega, Healthy, Nsh, D, FA, LA, W 5-3, 0, 0, 0, 0, 0, 0, 0, 0, 0, 0, 0, 0, 0, 0, 0, 0, --
Mathieu Perreault, Healthy, Mon, C- LW, FA, Tor, W 3-2, 0, 0, 0, 0, 0, 0, 0, 0, 0, 0, 0, 0, 0, 0, 0, 0, --
Beck Malenstyn, Healthy, Wsh, LW- C, FA, @Vgk, L 2-6, 0, 0, 0, 0, 0, 0, 0, 0, 0, 0, 0, 0, 0, 0, 0, 0, --
Egor Sokolov, Healthy, Ott, LW, FA, Wpg, L 1-5, 0, 0, 0, 0, 0, 0, 0, 0, 0, 0, 0, 0, 0, 0, 0, 0, --
Samuel Morin, Healthy, Phi, D, FA, @Det, W 2-1, 0, 0, 0, 0, 0, 0, 0, 0, 0, 0, 0, 0, 0, 0, 0, 0, --
Steven Kampfer, Healthy, Det, D, FA, Phi, L 1-2, 0, 0, 0, 0, 0, 0, 0, 0, 0, 0, 0, 0, 0, 0, 0, 0, --
Alex Burrows, Healthy, Ott, RW, FA, Wpg, L 1-5, 0, 0, 0, 0, 0, 0, 0, 0, 0, 0, 0, 0, 0, 0, 0, 0, --
Brandon Davidson, Healthy, Buf, D, FA, Ana, W 6-3, 0, 0, 0, 0, 0, 0, 0, 0, 0, 0, 0, 0, 0, 0, 0, 0, --
Trey Fix-Wolansky, Healthy, Cls, RW, FA, SJ, W 5-3, 0, 0, 0, 0, 0, 0, 0, 0, 0, 0, 0, 0, 0, 0, 0, 0, --
Pavol Regenda, Healthy, Ana, C, FA, @Buf, L 3-6, 0, 0, 0, 0, 0, 0, 0, 0, 0, 0, 0, 0, 0, 0, 0, 0, --
Guillaume Brisebois, Healthy, Van, D, FA, Edm, L 2-4, 0, 0, 0, 0, 0, 0, 0, 0, 0, 0, 0, 0, 0, 0, 0, 0, --
Kole Lind, Healthy, Sea, RW, FA, Col, L 1-2, 0, 0, 0, 0, 0, 0, 0, 0, 0, 0, 0, 0, 0, 0, 0, 0, --
Justin Bailey, Healthy, Van, RW, FA, Edm, L 2-4, 0, 0, 0, 0, 0, 0, 0, 0, 0, 0, 0, 0, 0, 0, 0, 0, --
Kyle Rau, Healthy, Min, C- LW, FA, @Fla, L 3-5, 0, 0, 0, 0, 0, 0, 0, 0, 0, 0, 0, 0, 0, 0, 0, 0, --
Kyle Quincey, Healthy, Min, D, FA, @Fla, L 3-5, 0, 0, 0, 0, 0, 0, 0, 0, 0, 0, 0, 0, 0, 0, 0, 0, --
Filip Bystedt, Healthy, SJ, C, FA, @Cls, L 3-5, 0, 0, 0, 0, 0, 0, 0, 0, 0, 0, 0, 0, 0, 0, 0, 0, --
Jacob Perreault, Healthy, Ana, RW, FA, @Buf, L 3-6, 0, 0, 0, 0, 0, 0, 0, 0, 0, 0, 0, 0, 0, 0, 0, 0, --
Aaron Ness, Healthy, Wsh, D, FA, @Vgk, L 2-6, 0, 0, 0, 0, 0, 0, 0, 0, 0, 0, 0, 0, 0, 0, 0, 0, --
Matt Kiersted, Healthy, Fla, D, FA, Min, W 5-3, 0, 0, 0, 0, 0, 0, 0, 0, 0, 0, 0, 0, 0, 0, 0, 0, --
Richard Panik, Healthy, NYI, RW- LW, FA, Car, L 2-5, 0, 0, 0, 0, 0, 0, 0, 0, 0, 0, 0, 0, 0, 0, 0, 0, --
Nicholas Abruzzese, Healthy, Tor, C, FA, @Mon, L 2-3, 0, 0, 0, 0, 0, 0, 0, 0, 0, 0, 0, 0, 0, 0, 0, 0, --
Nate Prosser, Healthy, Phi, D, FA, @Det, W 2-1, 0, 0, 0, 0, 0, 0, 0, 0, 0, 0, 0, 0, 0, 0, 0, 0, --
Brett Seney, Healthy, Chi, LW, FA, @StL, W 5-3, 0, 0, 0, 0, 0, 0, 0, 0, 0, 0, 0, 0, 0, 0, 0, 0, --
Niklas Hjalmarsson, Healthy, Ari, D, FA, @Dal, L 0-4, 0, 0, 0, 0, 0, 0, 0, 0, 0, 0, 0, 0, 0, 0, 0, 0, --
Mike Hardman, Healthy, Chi, RW- LW, FA, @StL, W 5-3, 0, 0, 0, 0, 0, 0, 0, 0, 0, 0, 0, 0, 0, 0, 0, 0, --
Benoit-Olivier Groulx, Healthy, Ana, C- LW, FA, @Buf, L 3-6, 0, 0, 0, 0, 0, 0, 0, 0, 0, 0, 0, 0, 0, 0, 0, 0, --
Brayden Tracey, Healthy, Ana, LW, FA, @Buf, L 3-6, 0, 0, 0, 0, 0, 0, 0, 0, 0, 0, 0, 0, 0, 0, 0, 0, --
Charles Hudon, Healthy, Col, LW- RW, FA, @Sea, W 2-1, 0, 0, 0, 0, 0, 0, 0, 0, 0, 0, 0, 0, 0, 0, 0, 0, --
Jeffrey Viel, Healthy, SJ, LW, FA, @Cls, L 3-5, 0, 0, 0, 0, 0, 0, 0, 0, 0, 0, 0, 0, 0, 0, 0, 0, --
Jason Garrison, Healthy, Chi, D, FA, @StL, W 5-3, 0, 0, 0, 0, 0, 0, 0, 0, 0, 0, 0, 0, 0, 0, 0, 0, --
Jason Demers, Healthy, Edm, D, FA, @Van, W 4-2, 0, 0, 0, 0, 0, 0, 0, 0, 0, 0, 0, 0, 0, 0, 0, 0, --
Dakota Mermis, Healthy, Min, D, FA, @Fla, L 3-5, 0, 0, 0, 0, 0, 0, 0, 0, 0, 0, 0, 0, 0, 0, 0, 0, --
Laurent Dauphin, Healthy, Ari, C, FA, @Dal, L 0-4, 0, 0, 0, 0, 0, 0, 0, 0, 0, 0, 0, 0, 0, 0, 0, 0, --
Brian Lashoff, Healthy, Det, D, FA, Phi, L 1-2, 0, 0, 0, 0, 0, 0, 0, 0, 0, 0, 0, 0, 0, 0, 0, 0, --
Casey Nelson, Healthy, Buf, D, FA, Ana, W 6-3, 0, 0, 0, 0, 0, 0, 0, 0, 0, 0, 0, 0, 0, 0, 0, 0, --
Sami Niku, Healthy, Mon, D, FA, Tor, W 3-2, 0, 0, 0, 0, 0, 0, 0, 0, 0, 0, 0, 0, 0, 0, 0, 0, --
Nathan Gerbe, Healthy, Cls, LW- RW, FA, SJ, W 5-3, 0, 0, 0, 0, 0, 0, 0, 0, 0, 0, 0, 0, 0, 0, 0, 0, --
Leo Komarov, Healthy, NYI, LW- RW, FA, Car, L 2-5, 0, 0, 0, 0, 0, 0, 0, 0, 0, 0, 0, 0, 0, 0, 0, 0, --
Mikko Lehtonen, Healthy, Cls, D, FA, SJ, W 5-3, 0, 0, 0, 0, 0, 0, 0, 0, 0, 0, 0, 0, 0, 0, 0, 0, --
P.A. Parenteau, Healthy, Det, RW- C, FA, Phi, L 1-2, 0, 0, 0, 0, 0, 0, 0, 0, 0, 0, 0, 0, 0, 0, 0, 0, --
Daniel Carr, Healthy, Wsh, LW, FA, @Vgk, L 2-6, 0, 0, 0, 0, 0, 0, 0, 0, 0, 0, 0, 0, 0, 0, 0, 0, --
Dillon Heatherington, Healthy, Ott, D, FA, Wpg, L 1-5, 0, 0, 0, 0, 0, 0, 0, 0, 0, 0, 0, 0, 0, 0, 0, 0, --
William Lagesson, Healthy, Car, D, FA, @NYI, W 5-2, 0, 0, 0, 0, 0, 0, 0, 0, 0, 0, 0, 0, 0, 0, 0, 0, --
Mackenzie MacEachern, Healthy, Car, LW- RW, FA, @NYI, W 5-2, 0, 0, 0, 0, 0, 0, 0, 0, 0, 0, 0, 0, 0, 0, 0, 0, --
Kyle Criscuolo, Healthy, SJ, C, FA, @Cls, L 3-5, 0, 0, 0, 0, 0, 0, 0, 0, 0, 0, 0, 0, 0, 0, 0, 0, --
Dominik Simon, Healthy, Ana, LW- RW, FA, @Buf, L 3-6, 0, 0, 0, 0, 0, 0, 0, 0, 0, 0, 0, 0, 0, 0, 0, 0, --
Kyle Turris, Healthy, Edm, C- RW, FA, @Van, W 4-2, 0, 0, 0, 0, 0, 0, 0, 0, 0, 0, 0, 0, 0, 0, 0, 0, --
Kole Sherwood, Healthy, Nsh, RW, FA, LA, W 5-3, 0, 0, 0, 0, 0, 0, 0, 0, 0, 0, 0, 0, 0, 0, 0, 0, --
Martin Frk, Healthy, StL, RW, FA, Chi, L 3-5, 0, 0, 0, 0, 0, 0, 0, 0, 0, 0, 0, 0, 0, 0, 0, 0, --
Jack Dugan, Healthy, Vgk, RW- LW, FA, Wsh, W 6-2, 0, 0, 0, 0, 0, 0, 0, 0, 0, 0, 0, 0, 0, 0, 0, 0, --
Sasha Chmelevski, Healthy, SJ, C, FA, @Cls, L 3-5, 0, 0, 0, 0, 0, 0, 0, 0, 0, 0, 0, 0, 0, 0, 0, 0, --
Sampo Ranta, Healthy, Col, LW, FA, @Sea, W 2-1, 0, 0, 0, 0, 0, 0, 0, 0, 0, 0, 0, 0, 0, 0, 0, 0, --
Melker Karlsson, Healthy, SJ, RW- C, FA, @Cls, L 3-5, 0, 0, 0, 0, 0, 0, 0, 0, 0, 0, 0, 0, 0, 0, 0, 0, --
Stefan Matteau, Healthy, Col, C- LW, FA, @Sea, W 2-1, 0, 0, 0, 0, 0, 0, 0, 0, 0, 0, 0, 0, 0, 0, 0, 0, --
Cody Franson, Healthy, Chi, D, FA, @StL, W 5-3, 0, 0, 0, 0, 0, 0, 0, 0, 0, 0, 0, 0, 0, 0, 0, 0, --
