Keith Yandle, Healthy, Phi, D, FA, @Nsh, W 3-1, 0, 0, 0, 0, 0, 0, 0, 0, 0, 0, 0, 0, 0, 0, 0, 0, --
Luke Witkowski, Healthy, StL, LW- RW- D, FA, @Edm, W 2-0, 0, 0, 0, 0, 0, 0, 0, 0, 0, 0, 0, 0, 0, 0, 0, 0, --
Mason Shaw, O, Min, C, FA, @Bos, L 3-4, 0, 0, 0, 0, 0, 0, 0, 0, 0, 0, 0, 0, 0, 0, 0, 0, 0.0
Connor Mackey, Healthy, Ari, D, FA, @Ott, L 2-6, 0, 0, 0, 0, 0, 0, 0, 0, 0, 0, 0, 0, 0, 0, 0, 0, 0.0
Kurtis MacDermid, Healthy, Col, D, FA, @Vgk, W 3-2, 0, 0, 0, 0, 0, 0, 0, 0, 0, 0, 0, 0, 0, 0, 0, 0, 0.0
Emil Bemstrom, Healthy, Cls, C- RW, FA, Pit, L 3-6, 0, 0, 0, 0, 0, 0, 0, 0, 0, 0, 0, 0, 0, 0, 0, 0, --
Jesse Ylonen, Healthy, Mon, RW- LW, FA, Dal, L 2-5, 0, 0, 0, 0, 0, 0, 0, 0, 0, 0, 0, 0, 0, 0, 0, 0, --
Fabian Lysell, Healthy, Bos, RW, FA, Min, W 4-3, 0, 0, 0, 0, 0, 0, 0, 0, 0, 0, 0, 0, 0, 0, 0, 0, --
Riley Stillman, Healthy, Buf, D, FA, @Van, W 5-1, 0, 0, 0, 0, 0, 0, 0, 0, 0, 0, 0, 0, 0, 0, 0, 0, 0.0
Andreas Johnsson, O, SJ, LW- RW, FA, @NJ, L 1-2, 0, 0, 0, 0, 0, 0, 0, 0, 0, 0, 0, 0, 0, 0, 0, 0, --
Conor Geekie, Healthy, Ari, C, FA, @Ott, L 2-6, 0, 0, 0, 0, 0, 0, 0, 0, 0, 0, 0, 0, 0, 0, 0, 0, --
Hudson Fasching, Healthy, NYI, RW, FA, @TB, L 3-5, 0, 0, 0, 0, 0, 0, 0, 0, 0, 0, 0, 0, 0, 0, 0, 0, --
Joakim Kemell, Healthy, Nsh, RW, FA, Phi, L 1-3, 0, 0, 0, 0, 0, 0, 0, 0, 0, 0, 0, 0, 0, 0, 0, 0, --
Bobby Brink, IR, Phi, RW, FA, @Nsh, W 3-1, 0, 0, 0, 0, 0, 0, 0, 0, 0, 0, 0, 0, 0, 0, 0, 0, --
Jason Spezza, Healthy, Tor, C- LW, FA, @Wpg, W 4-1, 0, 0, 0, 0, 0, 0, 0, 0, 0, 0, 0, 0, 0, 0, 0, 0, --
Noah Gregor, Healthy, SJ, C- LW- RW, FA, @NJ, L 1-2, 0, 0, 0, 0, 0, 0, 0, 0, 0, 0, 0, 0, 0, 0, 0, 0, 0.0
Dustin Brown, Healthy, LA, RW, FA, @Wsh, L 3-4, 0, 0, 0, 0, 0, 0, 0, 0, 0, 0, 0, 0, 0, 0, 0, 0, --
Samuel Fagemo, Healthy, LA, LW- RW, FA, @Wsh, L 3-4, 0, 0, 0, 0, 0, 0, 0, 0, 0, 0, 0, 0, 0, 0, 0, 0, --
Robin Salo, Healthy, NYI, D, FA, @TB, L 3-5, 0, 0, 0, 0, 0, 0, 0, 0, 0, 0, 0, 0, 0, 0, 0, 0, --
Alex Galchenyuk, Healthy, Col, LW- RW, FA, @Vgk, W 3-2, 0, 0, 0, 0, 0, 0, 0, 0, 0, 0, 0, 0, 0, 0, 0, 0, --
Mattias Janmark, Healthy, Edm, LW- C, FA, StL, L 0-2, 0, 0, 0, 0, 0, 0, 0, 0, 0, 0, 0, 0, 0, 0, 0, 0, --
Nicolas Aube-Kubel, Healthy, Wsh, RW, FA, LA, W 4-3, 0, 0, 0, 0, 0, 0, 0, 0, 0, 0, 0, 0, 0, 0, 0, 0, 0.0
Tobias Bjornfot, Healthy, LA, D, FA, @Wsh, L 3-4, 0, 0, 0, 0, 0, 0, 0, 0, 0, 0, 0, 0, 0, 0, 0, 0, --
Michael Eyssimont, Healthy, TB, C, FA, NYI, W 5-3, 0, 0, 0, 0, 0, 0, 0, 0, 0, 0, 0, 0, 0, 0, 0, 0, --
Brad Lambert, Healthy, Wpg, C, FA, Tor, L 1-4, 0, 0, 0, 0, 0, 0, 0, 0, 0, 0, 0, 0, 0, 0, 0, 0, --
Ville Heinola, Healthy, Wpg, D, FA, Tor, L 1-4, 0, 0, 0, 0, 0, 0, 0, 0, 0, 0, 0, 0, 0, 0, 0, 0, --
Alexander Radulov, Healthy, Dal, RW, FA, @Mon, W 5-2, 0, 0, 0, 0, 0, 0, 0, 0, 0, 0, 0, 0, 0, 0, 0, 0, --
Rasmus Kupari, Healthy, LA, C- RW, FA, @Wsh, L 3-4, 0, 0, 0, 0, 0, 0, 0, 0, 0, 0, 0, 0, 0, 0, 0, 0, --
Jesper Boqvist, Healthy, NJ, C- RW, FA, SJ, W 2-1, 0, 0, 0, 0, 0, 0, 0, 0, 0, 0, 0, 0, 0, 0, 0, 0, 0.0
Denton Mateychuk, Healthy, Cls, D, FA, Pit, L 3-6, 0, 0, 0, 0, 0, 0, 0, 0, 0, 0, 0, 0, 0, 0, 0, 0, --
Jonathan Lekkerimaki, Healthy, Van, RW, FA, Buf, L 1-5, 0, 0, 0, 0, 0, 0, 0, 0, 0, 0, 0, 0, 0, 0, 0, 0, --
Jimmy Snuggerud, Healthy, StL, RW, FA, @Edm, W 2-0, 0, 0, 0, 0, 0, 0, 0, 0, 0, 0, 0, 0, 0, 0, 0, 0, --
Jack Drury, Healthy, Car, C, FA, @Cgy, L 2-3, 0, 0, 0, 0, 0, 0, 0, 0, 0, 0, 0, 0, 0, 0, 0, 0, --
Joel Armia, Healthy, Mon, RW- LW, FA, Dal, L 2-5, 0, 0, 0, 0, 0, 0, 0, 0, 0, 0, 0, 0, 0, 0, 0, 0, --
Ivan Miroshnichenko, Healthy, Wsh, LW, FA, LA, W 4-3, 0, 0, 0, 0, 0, 0, 0, 0, 0, 0, 0, 0, 0, 0, 0, 0, --
Marco Scandella, DTD, StL, D, FA, @Edm, W 2-0, 0, 0, 0, 0, 0, 0, 0, 0, 0, 0, 0, 0, 0, 0, 0, 0, --
Hendrix Lapierre, Healthy, Wsh, C, FA, LA, W 4-3, 0, 0, 0, 0, 0, 0, 0, 0, 0, 0, 0, 0, 0, 0, 0, 0, --
Darren Helm, Healthy, Col, C, FA, @Vgk, W 3-2, 0, 0, 0, 0, 0, 0, 0, 0, 0, 0, 0, 0, 0, 0, 0, 0, --
Jordan Spence, Healthy, LA, D, FA, @Wsh, L 3-4, 0, 0, 0, 0, 0, 0, 0, 0, 0, 0, 0, 0, 0, 0, 0, 0, --
Alex Belzile, O, Mon, C- RW, FA, Dal, L 2-5, 0, 0, 0, 0, 0, 0, 0, 0, 0, 0, 0, 0, 0, 0, 0, 0, --
Thomas Harley, Healthy, Dal, D, FA, @Mon, W 5-2, 0, 0, 0, 0, 0, 0, 0, 0, 0, 0, 0, 0, 0, 0, 0, 0, --
Dylan Samberg, Healthy, Wpg, D, FA, Tor, L 1-4, 0, 0, 0, 0, 0, 0, 0, 0, 0, 0, 0, 0, 0, 0, 0, 0, 0.0
Bokondji Imama, Healthy, Ari, LW, FA, @Ott, L 2-6, 0, 0, 0, 0, 0, 0, 0, 0, 0, 0, 0, 0, 0, 0, 0, 0, --
Brad Hunt, Healthy, Col, D, FA, @Vgk, W 3-2, 0, 0, 0, 0, 0, 0, 0, 0, 0, 0, 0, 0, 0, 0, 0, 0, --
Joel Ward, Healthy, SJ, RW, FA, @NJ, L 1-2, 0, 0, 0, 0, 0, 0, 0, 0, 0, 0, 0, 0, 0, 0, 0, 0, --
Mark Friedman, Healthy, Pit, D, FA, @Cls, W 6-3, 0, 0, 0, 0, 0, 0, 0, 0, 0, 0, 0, 0, 0, 0, 0, 0, --
Rutger McGroarty, Healthy, Wpg, RW, FA, Tor, L 1-4, 0, 0, 0, 0, 0, 0, 0, 0, 0, 0, 0, 0, 0, 0, 0, 0, --
Ryan Suzuki, Healthy, Car, C, FA, @Cgy, L 2-3, 0, 0, 0, 0, 0, 0, 0, 0, 0, 0, 0, 0, 0, 0, 0, 0, --
Logan Brown, Healthy, StL, C- LW, FA, @Edm, W 2-0, 0, 0, 0, 0, 0, 0, 0, 0, 0, 0, 0, 0, 0, 0, 0, 0, 0.0
Chris Wagner, Healthy, Bos, RW- C, FA, Min, W 4-3, 0, 0, 0, 0, 0, 0, 0, 0, 0, 0, 0, 0, 0, 0, 0, 0, --
Owen Pickering, Healthy, Pit, D, FA, @Cls, W 6-3, 0, 0, 0, 0, 0, 0, 0, 0, 0, 0, 0, 0, 0, 0, 0, 0, --
Mavrik Bourque, Healthy, Dal, C, FA, @Mon, W 5-2, 0, 0, 0, 0, 0, 0, 0, 0, 0, 0, 0, 0, 0, 0, 0, 0, --
Patrick Marleau, Healthy, SJ, LW, FA, @NJ, L 1-2, 0, 0, 0, 0, 0, 0, 0, 0, 0, 0, 0, 0, 0, 0, 0, 0, --
Nolan Patrick, IR, Vgk, C- RW, FA, Col, L 2-3, 0, 0, 0, 0, 0, 0, 0, 0, 0, 0, 0, 0, 0, 0, 0, 0, --
Steven Santini, Healthy, StL, D, FA, @Edm, W 2-0, 0, 0, 0, 0, 0, 0, 0, 0, 0, 0, 0, 0, 0, 0, 0, 0, --
Brendan Brisson, Healthy, Vgk, C- LW, FA, Col, L 2-3, 0, 0, 0, 0, 0, 0, 0, 0, 0, 0, 0, 0, 0, 0, 0, 0, --
Matt Irwin, Healthy, Wsh, D, FA, LA, W 4-3, 0, 0, 0, 0, 0, 0, 0, 0, 0, 0, 0, 0, 0, 0, 0, 0, 0.0
Patrick Brown, Healthy, Ott, C- RW, FA, Ari, W 6-2, 0, 0, 0, 0, 0, 0, 0, 0, 0, 0, 0, 0, 0, 0, 0, 0, --
Simon Holmstrom, Healthy, NYI, RW, FA, @TB, L 3-5, 0, 0, 0, 0, 0, 0, 0, 0, 0, 0, 0, 0, 0, 0, 0, 0, --
Alex Barre-Boulet, Healthy, TB, C- LW- RW, FA, NYI, W 5-3, 0, 0, 0, 0, 0, 0, 0, 0, 0, 0, 0, 0, 0, 0, 0, 0, --
Jack Studnicka, Healthy, Van, C- RW, FA, Buf, L 1-5, 0, 0, 0, 0, 0, 0, 0, 0, 0, 0, 0, 0, 0, 0, 0, 0, 0.0
Jake Virtanen, Healthy, Edm, RW, FA, StL, L 0-2, 0, 0, 0, 0, 0, 0, 0, 0, 0, 0, 0, 0, 0, 0, 0, 0, --
Gabriel Carlsson, Healthy, Wsh, D, FA, LA, W 4-3, 0, 0, 0, 0, 0, 0, 0, 0, 0, 0, 0, 0, 0, 0, 0, 0, --
Gemel Smith, Healthy, TB, C, FA, NYI, W 5-3, 0, 0, 0, 0, 0, 0, 0, 0, 0, 0, 0, 0, 0, 0, 0, 0, --
Alexander Alexeyev, Healthy, Wsh, D, FA, LA, W 4-3, 0, 0, 0, 0, 0, 0, 0, 0, 0, 0, 0, 0, 0, 0, 0, 0, --
Carl Soderberg, Healthy, Col, C, FA, @Vgk, W 3-2, 0, 0, 0, 0, 0, 0, 0, 0, 0, 0, 0, 0, 0, 0, 0, 0, --
Josh Leivo, Healthy, StL, LW- RW, FA, @Edm, W 2-0, 0, 0, 0, 0, 0, 0, 0, 0, 0, 0, 0, 0, 0, 0, 0, 0, 0.0
Kieffer Bellows, Healthy, Phi, LW- C, FA, @Nsh, W 3-1, 0, 0, 0, 0, 0, 0, 0, 0, 0, 0, 0, 0, 0, 0, 0, 0, 0.0
Daniil Miromanov, Healthy, Vgk, D, FA, Col, L 2-3, 0, 0, 0, 0, 0, 0, 0, 0, 0, 0, 0, 0, 0, 0, 0, 0, --
Danila Yurov, Healthy, Min, RW, FA, @Bos, L 3-4, 0, 0, 0, 0, 0, 0, 0, 0, 0, 0, 0, 0, 0, 0, 0, 0, --
Connor Zary, Healthy, Cgy, C, FA, Car, W 3-2, 0, 0, 0, 0, 0, 0, 0, 0, 0, 0, 0, 0, 0, 0, 0, 0, --
Paul LaDue, Healthy, NYI, D, FA, @TB, L 3-5, 0, 0, 0, 0, 0, 0, 0, 0, 0, 0, 0, 0, 0, 0, 0, 0, --
Liam Foudy, Healthy, Cls, C- LW, FA, Pit, L 3-6, 0, 0, 0, 0, 0, 0, 0, 0, 0, 0, 0, 0, 0, 0, 0, 0, 0.0
Sheldon Dries, Healthy, Van, C- LW, FA, Buf, L 1-5, 0, 0, 0, 0, 0, 0, 0, 0, 0, 0, 0, 0, 0, 0, 0, 0, --
Tucker Poolman, IR, Van, D, FA, Buf, L 1-5, 0, 0, 0, 0, 0, 0, 0, 0, 0, 0, 0, 0, 0, 0, 0, 0, 0.0
Loui Eriksson, Healthy, Ari, LW- RW, FA, @Ott, L 2-6, 0, 0, 0, 0, 0, 0, 0, 0, 0, 0, 0, 0, 0, 0, 0, 0, --
Kale Clague, Healthy, Buf, D, FA, @Van, W 5-1, 0, 0, 0, 0, 0, 0, 0, 0, 0, 0, 0, 0, 0, 0, 0, 0, --
Sam Poulin, Healthy, Pit, RW- LW, FA, @Cls, W 6-3, 0, 0, 0, 0, 0, 0, 0, 0, 0, 0, 0, 0, 0, 0, 0, 0, --
Alex Formenton, DTD, Ott, LW, FA, Ari, W 6-2, 0, 0, 0, 0, 0, 0, 0, 0, 0, 0, 0, 0, 0, 0, 0, 0, --
Dennis Gilbert, Healthy, Cgy, D, FA, Car, W 3-2, 0, 0, 0, 0, 0, 0, 0, 0, 0, 0, 0, 0, 0, 0, 0, 0, --
Liam Ohgren, Healthy, Min, LW, FA, @Bos, L 3-4, 0, 0, 0, 0, 0, 0, 0, 0, 0, 0, 0, 0, 0, 0, 0, 0, --
Nolan Foote, Healthy, NJ, LW, FA, SJ, W 2-1, 0, 0, 0, 0, 0, 0, 0, 0, 0, 0, 0, 0, 0, 0, 0, 0, --
Dylan Gambrell, Healthy, Ott, C, FA, Ari, W 6-2, 0, 0, 0, 0, 0, 0, 0, 0, 0, 0, 0, 0, 0, 0, 0, 0, 0.0
Radim Zohorna, Healthy, Tor, LW, FA, @Wpg, W 4-1, 0, 0, 0, 0, 0, 0, 0, 0, 0, 0, 0, 0, 0, 0, 0, 0, --
Tyler Pitlick, Healthy, StL, RW, FA, @Edm, W 2-0, 0, 0, 0, 0, 0, 0, 0, 0, 0, 0, 0, 0, 0, 0, 0, 0, --
"Drew OConnor", Healthy, Pit, LW, FA, @Cls, W 6-3, 0, 0, 0, 0, 0, 0, 0, 0, 0, 0, 0, 0, 0, 0, 0, 0, --
Dan Renouf, Healthy, Bos, D, FA, Min, W 4-3, 0, 0, 0, 0, 0, 0, 0, 0, 0, 0, 0, 0, 0, 0, 0, 0, --
Jonathan Dahlen, Healthy, SJ, RW- LW, FA, @NJ, L 1-2, 0, 0, 0, 0, 0, 0, 0, 0, 0, 0, 0, 0, 0, 0, 0, 0, --
Travis Dermott, IR, Van, D, FA, Buf, L 1-5, 0, 0, 0, 0, 0, 0, 0, 0, 0, 0, 0, 0, 0, 0, 0, 0, --
J.T. Brown, Healthy, Min, RW, FA, @Bos, L 3-4, 0, 0, 0, 0, 0, 0, 0, 0, 0, 0, 0, 0, 0, 0, 0, 0, --
John Leonard, Healthy, Nsh, LW- RW, FA, Phi, L 1-3, 0, 0, 0, 0, 0, 0, 0, 0, 0, 0, 0, 0, 0, 0, 0, 0, --
Ryan Merkley, Healthy, Col, D, FA, @Vgk, W 3-2, 0, 0, 0, 0, 0, 0, 0, 0, 0, 0, 0, 0, 0, 0, 0, 0, --
Jiri Kulich, Healthy, Buf, C, FA, @Van, W 5-1, 0, 0, 0, 0, 0, 0, 0, 0, 0, 0, 0, 0, 0, 0, 0, 0, --
Dylan Coghlan, Healthy, Car, D, FA, @Cgy, L 2-3, 0, 0, 0, 0, 0, 0, 0, 0, 0, 0, 0, 0, 0, 0, 0, 0, 0.0
Adam Gaudette, Healthy, StL, C- RW, FA, @Edm, W 2-0, 0, 0, 0, 0, 0, 0, 0, 0, 0, 0, 0, 0, 0, 0, 0, 0, --
Danny DeKeyser, Healthy, Van, D, FA, Buf, L 1-5, 0, 0, 0, 0, 0, 0, 0, 0, 0, 0, 0, 0, 0, 0, 0, 0, --
Joel Hanley, Healthy, Dal, D, FA, @Mon, W 5-2, 0, 0, 0, 0, 0, 0, 0, 0, 0, 0, 0, 0, 0, 0, 0, 0, 0.0
Martin Kaut, Healthy, SJ, C- RW, FA, @NJ, L 1-2, 1, 0, 0, 0, 0, 0, 0, 0, 0, 0, 0, 0, 0, 0, 0, 0, 0.0
Noah Ostlund, Healthy, Buf, C, FA, @Van, W 5-1, 0, 0, 0, 0, 0, 0, 0, 0, 0, 0, 0, 0, 0, 0, 0, 0, --
Madison Bowey, Healthy, Mon, D, FA, Dal, L 2-5, 0, 0, 0, 0, 0, 0, 0, 0, 0, 0, 0, 0, 0, 0, 0, 0, --
Ben Meyers, Healthy, Col, RW, FA, @Vgk, W 3-2, 0, 0, 0, 0, 0, 0, 0, 0, 0, 0, 0, 0, 0, 0, 0, 0, --
Adam Beckman, Healthy, Min, C- LW, FA, @Bos, L 3-4, 0, 0, 0, 0, 0, 0, 0, 0, 0, 0, 0, 0, 0, 0, 0, 0, --
Brian Boyle, O, Pit, C- LW, FA, @Cls, W 6-3, 0, 0, 0, 0, 0, 0, 0, 0, 0, 0, 0, 0, 0, 0, 0, 0, --
Gavin Bayreuther, Healthy, Cls, D, FA, Pit, L 3-6, 0, 0, 0, 0, 0, 0, 0, 0, 0, 0, 0, 0, 0, 0, 0, 0, --
Anders Bjork, Healthy, Chi, LW- RW, FA, --, --, 0, 0, 0, 0, 0, 0, 0, 0, 0, 0, 0, 0, 0, 0, 0, 0, --
Ben Harpur, Healthy, NYR, D, FA, --, --, 0, 0, 0, 0, 0, 0, 0, 0, 0, 0, 0, 0, 0, 0, 0, 0, --
Vinni Lettieri, IR, Bos, C- RW, FA, Min, W 4-3, 0, 0, 0, 0, 0, 0, 0, 0, 0, 0, 0, 0, 0, 0, 0, 0, --
Jaret Anderson-Dolan, Healthy, LA, C, FA, @Wsh, L 3-4, 0, 0, 0, 0, 0, 0, 0, 0, 0, 0, 0, 0, 0, 0, 0, 0, 0.0
Alexandre Texier, O, Cls, C- RW, FA, Pit, L 3-6, 0, 0, 0, 0, 0, 0, 0, 0, 0, 0, 0, 0, 0, 0, 0, 0, --
Joey Anderson, Healthy, Tor, RW, FA, @Wpg, W 4-1, 0, 0, 0, 0, 0, 0, 0, 0, 0, 0, 0, 0, 0, 0, 0, 0, --
Jan Jenik, Healthy, Ari, C- RW, FA, @Ott, L 2-6, 0, 0, 0, 0, 0, 0, 0, 0, 0, 0, 0, 0, 0, 0, 0, 0, --
Dominic Toninato, Healthy, Wpg, C- LW, FA, Tor, L 1-4, 0, 0, 0, 0, 0, 0, 0, 0, 0, 0, 0, 0, 0, 0, 0, 0, 0.0
Derrick Pouliot, Healthy, SJ, D, FA, @NJ, L 1-2, 0, 0, 0, 0, 0, 0, 0, 0, 0, 0, 0, 0, 0, 0, 0, 0, --
Kris Russell, Healthy, Edm, D, FA, StL, L 0-2, 0, 0, 0, 0, 0, 0, 0, 0, 0, 0, 0, 0, 0, 0, 0, 0, --
Marc McLaughlin, Healthy, Bos, C, FA, Min, W 4-3, 0, 0, 0, 0, 0, 0, 0, 0, 0, 0, 0, 0, 0, 0, 0, 0, --
Greg McKegg, Healthy, Edm, C- LW, FA, StL, L 0-2, 0, 0, 0, 0, 0, 0, 0, 0, 0, 0, 0, 0, 0, 0, 0, 0, --
Kevin Stenlund, Healthy, Wpg, RW- C, FA, Tor, L 1-4, 0, 0, 0, 0, 0, 0, 0, 0, 0, 0, 0, 0, 0, 0, 0, 0, --
Christian Wolanin, O, Van, D, FA, Buf, L 1-5, 0, 0, 0, 0, 0, 0, 0, 0, 0, 0, 0, 0, 0, 0, 0, 0, --
Slater Koekkoek, Healthy, Edm, D, FA, StL, L 0-2, 0, 0, 0, 0, 0, 0, 0, 0, 0, 0, 0, 0, 0, 0, 0, 0, --
Lian Bichsel, Healthy, Dal, D, FA, @Mon, W 5-2, 0, 0, 0, 0, 0, 0, 0, 0, 0, 0, 0, 0, 0, 0, 0, 0, --
Jake Gardiner, IR, Car, D, FA, @Cgy, L 2-3, 0, 0, 0, 0, 0, 0, 0, 0, 0, 0, 0, 0, 0, 0, 0, 0, --
Isaac Howard, Healthy, TB, LW, FA, NYI, W 5-3, 0, 0, 0, 0, 0, 0, 0, 0, 0, 0, 0, 0, 0, 0, 0, 0, --
Jacob Peterson, Healthy, SJ, C- LW, FA, @NJ, L 1-2, 0, 0, 0, 0, 0, 0, 0, 0, 0, 0, 0, 0, 0, 0, 0, 0, 0.0
Dennis Wideman, Healthy, Cgy, D, FA, Car, W 3-2, 0, 0, 0, 0, 0, 0, 0, 0, 0, 0, 0, 0, 0, 0, 0, 0, --
Steven Fogarty, Healthy, Min, C- RW, FA, @Bos, L 3-4, 0, 0, 0, 0, 0, 0, 0, 0, 0, 0, 0, 0, 0, 0, 0, 0, --
Ross Johnston, Healthy, NYI, LW, FA, @TB, L 3-5, 0, 0, 0, 0, 0, 0, 0, 0, 0, 0, 0, 0, 0, 0, 0, 0, 0.0
Josh Gorges, Healthy, Buf, D, FA, @Van, W 5-1, 0, 0, 0, 0, 0, 0, 0, 0, 0, 0, 0, 0, 0, 0, 0, 0, --
Rodion Amirov, IR, Tor, LW, FA, @Wpg, W 4-1, 0, 0, 0, 0, 0, 0, 0, 0, 0, 0, 0, 0, 0, 0, 0, 0, --
"Zachary LHeureux", Healthy, Nsh, LW, FA, Phi, L 1-3, 0, 0, 0, 0, 0, 0, 0, 0, 0, 0, 0, 0, 0, 0, 0, 0, --
Kyle Capobianco, Healthy, Wpg, D, FA, Tor, L 1-4, 0, 0, 0, 0, 0, 0, 0, 0, 0, 0, 0, 0, 0, 0, 0, 0, 0.0
Yannick Weber, Healthy, Pit, D, FA, @Cls, W 6-3, 0, 0, 0, 0, 0, 0, 0, 0, 0, 0, 0, 0, 0, 0, 0, 0, --
Carl Hagelin, IR, Wsh, LW, FA, LA, W 4-3, 0, 0, 0, 0, 0, 0, 0, 0, 0, 0, 0, 0, 0, 0, 0, 0, --
Filip Mesar, Healthy, Mon, RW, FA, Dal, L 2-5, 0, 0, 0, 0, 0, 0, 0, 0, 0, 0, 0, 0, 0, 0, 0, 0, --
Ben Thomas, Healthy, TB, D, FA, NYI, W 5-3, 0, 0, 0, 0, 0, 0, 0, 0, 0, 0, 0, 0, 0, 0, 0, 0, --
Jacob Larsson, Healthy, Ott, D, FA, Ari, W 6-2, 0, 0, 0, 0, 0, 0, 0, 0, 0, 0, 0, 0, 0, 0, 0, 0, --
Vladimir Tkachev, Healthy, LA, LW- RW, FA, @Wsh, L 3-4, 0, 0, 0, 0, 0, 0, 0, 0, 0, 0, 0, 0, 0, 0, 0, 0, --
Luca Sbisa, Healthy, Nsh, D, FA, Phi, L 1-3, 0, 0, 0, 0, 0, 0, 0, 0, 0, 0, 0, 0, 0, 0, 0, 0, --
Michael Carcone, Healthy, Ari, RW- LW, FA, @Ott, L 2-6, 0, 0, 0, 0, 0, 0, 0, 0, 0, 0, 0, 0, 0, 0, 0, 0, --
Brennan Menell, Healthy, Tor, D, FA, @Wpg, W 4-1, 0, 0, 0, 0, 0, 0, 0, 0, 0, 0, 0, 0, 0, 0, 0, 0, --
Zac Rinaldo, Healthy, Cls, LW, FA, Pit, L 3-6, 0, 0, 0, 0, 0, 0, 0, 0, 0, 0, 0, 0, 0, 0, 0, 0, --
Keaton Middleton, Healthy, Col, D, FA, @Vgk, W 3-2, 0, 0, 0, 0, 0, 0, 0, 0, 0, 0, 0, 0, 0, 0, 0, 0, --
Patrick Wiercioch, Healthy, Van, D, FA, Buf, L 1-5, 0, 0, 0, 0, 0, 0, 0, 0, 0, 0, 0, 0, 0, 0, 0, 0, --
David Gustafsson, Healthy, Wpg, C, FA, Tor, L 1-4, 1, 0, 0, 0, 0, 0, 0, 0, 0, 0, 2, 2, 0, 0, 0, 0, 0.0
Jansen Harkins, Healthy, Wpg, C- LW, FA, Tor, L 1-4, 0, 0, 0, 0, 0, 0, 0, 0, 0, 0, 0, 0, 0, 0, 0, 0, --
Jonah Gadjovich, IR, SJ, LW- RW, FA, @NJ, L 1-2, 0, 0, 0, 0, 0, 0, 0, 0, 0, 0, 0, 0, 0, 0, 0, 0, 0.0
Maveric Lamoureux, Healthy, Ari, D, FA, @Ott, L 2-6, 0, 0, 0, 0, 0, 0, 0, 0, 0, 0, 0, 0, 0, 0, 0, 0, --
Will Butcher, Healthy, Dal, D, FA, @Mon, W 5-2, 0, 0, 0, 0, 0, 0, 0, 0, 0, 0, 0, 0, 0, 0, 0, 0, --
Par Lindholm, Healthy, Bos, C, FA, Min, W 4-3, 0, 0, 0, 0, 0, 0, 0, 0, 0, 0, 0, 0, 0, 0, 0, 0, --
John Beecher, Healthy, Bos, C, FA, Min, W 4-3, 0, 0, 0, 0, 0, 0, 0, 0, 0, 0, 0, 0, 0, 0, 0, 0, --
Tyce Thompson, Healthy, NJ, RW, FA, SJ, W 2-1, 0, 0, 0, 0, 0, 0, 0, 0, 0, 0, 0, 0, 0, 0, 0, 0, --
Lawrence Pilut, Healthy, Buf, D, FA, @Van, W 5-1, 0, 0, 0, 0, 0, 0, 0, 0, 0, 0, 0, 0, 0, 0, 0, 0, 0.0
Jacob Bernard-Docker, Healthy, Ott, D, FA, Ari, W 6-2, 0, 0, 0, 0, 0, 0, 0, 0, 0, 0, 0, 0, 0, 0, 0, 0, --
Kevan Miller, Healthy, Bos, D, FA, Min, W 4-3, 0, 0, 0, 0, 0, 0, 0, 0, 0, 0, 0, 0, 0, 0, 0, 0, --
Tanner Laczynski, Healthy, Phi, C, FA, @Nsh, W 3-1, 1, 0, 0, 0, 0, 0, 0, 0, 0, 0, 0, 0, 0, 0, 0, 0, 0.0
Dan Girardi, Healthy, TB, D, FA, NYI, W 5-3, 0, 0, 0, 0, 0, 0, 0, 0, 0, 0, 0, 0, 0, 0, 0, 0, --
Lane Pederson, DTD, Cls, C, FA, Pit, L 3-6, 0, 0, 0, 0, 0, 0, 0, 0, 0, 0, 0, 0, 0, 0, 0, 0, --
Jake Leschyshyn, Healthy, NYR, C, FA, --, --, 0, 0, 0, 0, 0, 0, 0, 0, 0, 0, 0, 0, 0, 0, 0, 0, 0.0
Riley Tufte, Healthy, Dal, LW, FA, @Mon, W 5-2, 0, 0, 0, 0, 0, 0, 0, 0, 0, 0, 0, 0, 0, 0, 0, 0, --
Reid Schaefer, Healthy, Nsh, LW, FA, Phi, L 1-3, 0, 0, 0, 0, 0, 0, 0, 0, 0, 0, 0, 0, 0, 0, 0, 0, --
Jackson Cates, Healthy, Phi, C, FA, @Nsh, W 3-1, 0, 0, 0, 0, 0, 0, 0, 0, 0, 0, 0, 0, 0, 0, 0, 0, 0.0
David Schlemko, Healthy, Phi, D, FA, @Nsh, W 3-1, 0, 0, 0, 0, 0, 0, 0, 0, 0, 0, 0, 0, 0, 0, 0, 0, --
Daniel Walcott, Healthy, TB, D, FA, NYI, W 5-3, 0, 0, 0, 0, 0, 0, 0, 0, 0, 0, 0, 0, 0, 0, 0, 0, --
Fredrik Claesson, Healthy, TB, D, FA, NYI, W 5-3, 0, 0, 0, 0, 0, 0, 0, 0, 0, 0, 0, 0, 0, 0, 0, 0, --
Gabriel Fortier, Healthy, TB, LW, FA, NYI, W 5-3, 0, 0, 0, 0, 0, 0, 0, 0, 0, 0, 0, 0, 0, 0, 0, 0, --
Jasper Weatherby, Healthy, Det, LW- C, FA, --, --, 0, 0, 0, 0, 0, 0, 0, 0, 0, 0, 0, 0, 0, 0, 0, 0, --
James Neal, Healthy, Cls, RW- LW, FA, Pit, L 3-6, 0, 0, 0, 0, 0, 0, 0, 0, 0, 0, 0, 0, 0, 0, 0, 0, --
Mike Liambas, Healthy, Min, D, FA, @Bos, L 3-4, 0, 0, 0, 0, 0, 0, 0, 0, 0, 0, 0, 0, 0, 0, 0, 0, --
Brandon Manning, Healthy, Edm, D, FA, StL, L 0-2, 0, 0, 0, 0, 0, 0, 0, 0, 0, 0, 0, 0, 0, 0, 0, 0, --
Vladislav Kolyachonok, Healthy, Ari, D, FA, @Ott, L 2-6, 0, 0, 0, 0, 0, 0, 0, 0, 0, 0, 0, 0, 0, 0, 0, 0, --
Carl Gunnarsson, Healthy, StL, D, FA, @Edm, W 2-0, 0, 0, 0, 0, 0, 0, 0, 0, 0, 0, 0, 0, 0, 0, 0, 0, --
Mark Alt, Healthy, SJ, D, FA, @NJ, L 1-2, 0, 0, 0, 0, 0, 0, 0, 0, 0, 0, 0, 0, 0, 0, 0, 0, --
Tyler Bozak, Healthy, StL, C, FA, @Edm, W 2-0, 0, 0, 0, 0, 0, 0, 0, 0, 0, 0, 0, 0, 0, 0, 0, 0, --
Oskar Steen, Healthy, Bos, C, FA, Min, W 4-3, 0, 0, 0, 0, 0, 0, 0, 0, 0, 0, 0, 0, 0, 0, 0, 0, --
Jake Christiansen, Healthy, Cls, D, FA, Pit, L 3-6, 0, 0, 0, 0, 0, 0, 0, 0, 0, 0, 0, 0, 0, 0, 0, 0, --
Darren Raddysh, Healthy, TB, D, FA, NYI, W 5-3, 0, 0, 0, 0, 0, 0, 0, 0, 0, 0, 0, 0, 0, 0, 0, 0, --
Mikko Koivu, Healthy, Cls, C, FA, Pit, L 3-6, 0, 0, 0, 0, 0, 0, 0, 0, 0, 0, 0, 0, 0, 0, 0, 0, --
Braydon Coburn, Healthy, NYI, D, FA, @TB, L 3-5, 0, 0, 0, 0, 0, 0, 0, 0, 0, 0, 0, 0, 0, 0, 0, 0, --
Igor Ozhiganov, Healthy, Tor, D, FA, @Wpg, W 4-1, 0, 0, 0, 0, 0, 0, 0, 0, 0, 0, 0, 0, 0, 0, 0, 0, --
Mason Geertsen, Healthy, NJ, D, FA, SJ, W 2-1, 0, 0, 0, 0, 0, 0, 0, 0, 0, 0, 0, 0, 0, 0, 0, 0, --
Max Willman, Healthy, Phi, C- LW, FA, @Nsh, W 3-1, 0, 0, 0, 0, 0, 0, 0, 0, 0, 0, 0, 0, 0, 0, 0, 0, --
Ryan Dzingel, Healthy, Car, C- LW- RW, FA, @Cgy, L 2-3, 0, 0, 0, 0, 0, 0, 0, 0, 0, 0, 0, 0, 0, 0, 0, 0, --
Anton Blidh, Healthy, NYR, LW, FA, --, --, 0, 0, 0, 0, 0, 0, 0, 0, 0, 0, 0, 0, 0, 0, 0, 0, --
Cody Eakin, Healthy, Cgy, C, FA, Car, W 3-2, 0, 0, 0, 0, 0, 0, 0, 0, 0, 0, 0, 0, 0, 0, 0, 0, --
Mikhail Maltsev, Healthy, Col, LW, FA, @Vgk, W 3-2, 0, 0, 0, 0, 0, 0, 0, 0, 0, 0, 0, 0, 0, 0, 0, 0, --
Matthew Phillips, Healthy, Cgy, C, FA, Car, W 3-2, 0, 0, 0, 0, 0, 0, 0, 0, 0, 0, 0, 0, 0, 0, 0, 0, --
Ben Lovejoy, Healthy, Dal, D, FA, @Mon, W 5-2, 0, 0, 0, 0, 0, 0, 0, 0, 0, 0, 0, 0, 0, 0, 0, 0, --
Nathan Smith, Healthy, Ari, LW- C, FA, @Ott, L 2-6, 0, 0, 0, 0, 0, 0, 0, 0, 0, 0, 0, 0, 0, 0, 0, 0, --
Brad Malone, Healthy, Edm, LW- C, FA, StL, L 0-2, 0, 0, 0, 0, 0, 0, 0, 0, 0, 0, 0, 0, 0, 0, 0, 0, --
Andrew Ladd, IR, Ari, LW, FA, @Ott, L 2-6, 0, 0, 0, 0, 0, 0, 0, 0, 0, 0, 0, 0, 0, 0, 0, 0, --
Andrej Sekera, Healthy, Dal, D, FA, @Mon, W 5-2, 0, 0, 0, 0, 0, 0, 0, 0, 0, 0, 0, 0, 0, 0, 0, 0, --
Lassi Thomson, Healthy, Ott, D, FA, Ari, W 6-2, 0, 0, 0, 0, 0, 0, 0, 0, 0, 0, 0, 0, 0, 0, 0, 0, --
Dean Kukan, Healthy, Cls, D, FA, Pit, L 3-6, 0, 0, 0, 0, 0, 0, 0, 0, 0, 0, 0, 0, 0, 0, 0, 0, --
Johan Larsson, Healthy, Wsh, LW- C, FA, LA, W 4-3, 0, 0, 0, 0, 0, 0, 0, 0, 0, 0, 0, 0, 0, 0, 0, 0, --
Drake Caggiula, Healthy, Pit, LW- RW, FA, @Cls, W 6-3, 0, 0, 0, 0, 0, 0, 0, 0, 0, 0, 0, 0, 0, 0, 0, 0, --
Darren Archibald, Healthy, Tor, LW- RW, FA, @Wpg, W 4-1, 0, 0, 0, 0, 0, 0, 0, 0, 0, 0, 0, 0, 0, 0, 0, 0, --
Filip Hallander, Healthy, Pit, C, FA, @Cls, W 6-3, 0, 0, 0, 0, 0, 0, 0, 0, 0, 0, 0, 0, 0, 0, 0, 0, --
Ronnie Attard, Healthy, Phi, D, FA, @Nsh, W 3-1, 0, 0, 0, 0, 0, 0, 0, 0, 0, 0, 0, 0, 0, 0, 0, 0, --
Lias Andersson, Healthy, LA, C- LW, FA, @Wsh, L 3-4, 0, 0, 0, 0, 0, 0, 0, 0, 0, 0, 0, 0, 0, 0, 0, 0, --
Sami Vatanen, Healthy, Dal, D, FA, @Mon, W 5-2, 0, 0, 0, 0, 0, 0, 0, 0, 0, 0, 0, 0, 0, 0, 0, 0, --
Michael Raffl, Healthy, Dal, LW, FA, @Mon, W 5-2, 0, 0, 0, 0, 0, 0, 0, 0, 0, 0, 0, 0, 0, 0, 0, 0, --
Nikita Nesterov, Healthy, Cgy, D, FA, Car, W 3-2, 0, 0, 0, 0, 0, 0, 0, 0, 0, 0, 0, 0, 0, 0, 0, 0, --
Andrej Sustr, Healthy, Ana, D, FA, --, --, 0, 0, 0, 0, 0, 0, 0, 0, 0, 0, 0, 0, 0, 0, 0, 0, 0.0
Kaedan Korczak, Healthy, Vgk, D, FA, Col, L 2-3, 0, 0, 0, 0, 0, 0, 0, 0, 0, 0, 0, 0, 0, 0, 0, 0, --
Matthew Highmore, Healthy, StL, C- LW- RW, FA, @Edm, W 2-0, 0, 0, 0, 0, 0, 0, 0, 0, 0, 0, 0, 0, 0, 0, 0, 0, --
CJ Suess, Healthy, SJ, LW, FA, @NJ, L 1-2, 0, 0, 0, 0, 0, 0, 0, 0, 0, 0, 0, 0, 0, 0, 0, 0, --
Nikolai Knyzhov, Healthy, SJ, D, FA, @NJ, L 1-2, 0, 0, 0, 0, 0, 0, 0, 0, 0, 0, 0, 0, 0, 0, 0, 0, --
Alex Biega, Healthy, Nsh, D, FA, Phi, L 1-3, 0, 0, 0, 0, 0, 0, 0, 0, 0, 0, 0, 0, 0, 0, 0, 0, --
Mathieu Perreault, Healthy, Mon, C- LW, FA, Dal, L 2-5, 0, 0, 0, 0, 0, 0, 0, 0, 0, 0, 0, 0, 0, 0, 0, 0, --
Beck Malenstyn, Healthy, Wsh, LW- C, FA, LA, W 4-3, 0, 0, 0, 0, 0, 0, 0, 0, 0, 0, 0, 0, 0, 0, 0, 0, 0.0
Egor Sokolov, Healthy, Ott, LW, FA, Ari, W 6-2, 0, 0, 0, 0, 0, 0, 0, 0, 0, 0, 0, 0, 0, 0, 0, 0, --
Taylor Fedun, Healthy, Pit, D, FA, @Cls, W 6-3, 0, 0, 0, 0, 0, 0, 0, 0, 0, 0, 0, 0, 0, 0, 0, 0, --
Samuel Morin, Healthy, Phi, D, FA, @Nsh, W 3-1, 0, 0, 0, 0, 0, 0, 0, 0, 0, 0, 0, 0, 0, 0, 0, 0, --
Alex Burrows, Healthy, Ott, RW, FA, Ari, W 6-2, 0, 0, 0, 0, 0, 0, 0, 0, 0, 0, 0, 0, 0, 0, 0, 0, --
Brandon Davidson, Healthy, Buf, D, FA, @Van, W 5-1, 0, 0, 0, 0, 0, 0, 0, 0, 0, 0, 0, 0, 0, 0, 0, 0, --
Trey Fix-Wolansky, Healthy, Cls, RW, FA, Pit, L 3-6, 0, 0, 0, 0, 0, 0, 0, 0, 0, 0, 0, 0, 0, 0, 0, 0, --
Guillaume Brisebois, Healthy, Van, D, FA, Buf, L 1-5, 0, 0, 0, 0, 0, 0, 0, 0, 0, 0, 0, 0, 0, 0, 0, 0, --
Justin Bailey, Healthy, Van, RW, FA, Buf, L 1-5, 0, 0, 0, 0, 0, 0, 0, 0, 0, 0, 0, 0, 0, 0, 0, 0, --
Kyle Rau, Healthy, Min, C- LW, FA, @Bos, L 3-4, 0, 0, 0, 0, 0, 0, 0, 0, 0, 0, 0, 0, 0, 0, 0, 0, --
Kyle Quincey, Healthy, Min, D, FA, @Bos, L 3-4, 0, 0, 0, 0, 0, 0, 0, 0, 0, 0, 0, 0, 0, 0, 0, 0, --
Filip Bystedt, Healthy, SJ, C, FA, @NJ, L 1-2, 0, 0, 0, 0, 0, 0, 0, 0, 0, 0, 0, 0, 0, 0, 0, 0, --
Aaron Ness, Healthy, Wsh, D, FA, LA, W 4-3, 0, 0, 0, 0, 0, 0, 0, 0, 0, 0, 0, 0, 0, 0, 0, 0, --
Richard Panik, Healthy, NYI, RW- LW, FA, @TB, L 3-5, 0, 0, 0, 0, 0, 0, 0, 0, 0, 0, 0, 0, 0, 0, 0, 0, --
Nicholas Abruzzese, Healthy, Tor, C, FA, @Wpg, W 4-1, 0, 0, 0, 0, 0, 0, 0, 0, 0, 0, 0, 0, 0, 0, 0, 0, --
Nate Prosser, Healthy, Phi, D, FA, @Nsh, W 3-1, 0, 0, 0, 0, 0, 0, 0, 0, 0, 0, 0, 0, 0, 0, 0, 0, --
Nikita Okhotiuk, Healthy, SJ, D, FA, @NJ, L 1-2, 0, 0, 0, 0, 0, 0, 0, 0, 0, 0, 0, 0, 0, 0, 0, 0, --
Brett Seney, Healthy, Chi, LW, FA, --, --, 0, 0, 0, 0, 0, 0, 0, 0, 0, 0, 0, 0, 0, 0, 0, 0, --
Niklas Hjalmarsson, Healthy, Ari, D, FA, @Ott, L 2-6, 0, 0, 0, 0, 0, 0, 0, 0, 0, 0, 0, 0, 0, 0, 0, 0, --
Jeffrey Viel, Healthy, SJ, LW, FA, @NJ, L 1-2, 0, 0, 0, 0, 0, 0, 0, 0, 0, 0, 0, 0, 0, 0, 0, 0, --
Jason Demers, Healthy, Edm, D, FA, StL, L 0-2, 0, 0, 0, 0, 0, 0, 0, 0, 0, 0, 0, 0, 0, 0, 0, 0, --
Dakota Mermis, Healthy, Min, D, FA, @Bos, L 3-4, 0, 0, 0, 0, 0, 0, 0, 0, 0, 0, 0, 0, 0, 0, 0, 0, --
Laurent Dauphin, Healthy, Ari, C, FA, @Ott, L 2-6, 0, 0, 0, 0, 0, 0, 0, 0, 0, 0, 0, 0, 0, 0, 0, 0, --
Casey Nelson, Healthy, Buf, D, FA, @Van, W 5-1, 0, 0, 0, 0, 0, 0, 0, 0, 0, 0, 0, 0, 0, 0, 0, 0, --
Sami Niku, Healthy, Mon, D, FA, Dal, L 2-5, 0, 0, 0, 0, 0, 0, 0, 0, 0, 0, 0, 0, 0, 0, 0, 0, --
Nathan Gerbe, Healthy, Cls, LW- RW, FA, Pit, L 3-6, 0, 0, 0, 0, 0, 0, 0, 0, 0, 0, 0, 0, 0, 0, 0, 0, --
Leo Komarov, Healthy, NYI, LW- RW, FA, @TB, L 3-5, 0, 0, 0, 0, 0, 0, 0, 0, 0, 0, 0, 0, 0, 0, 0, 0, --
Mikko Lehtonen, Healthy, Cls, D, FA, Pit, L 3-6, 0, 0, 0, 0, 0, 0, 0, 0, 0, 0, 0, 0, 0, 0, 0, 0, --
"Will ONeill", Healthy, Pit, D, FA, @Cls, W 6-3, 0, 0, 0, 0, 0, 0, 0, 0, 0, 0, 0, 0, 0, 0, 0, 0, --
Daniel Carr, Healthy, Wsh, LW, FA, LA, W 4-3, 0, 0, 0, 0, 0, 0, 0, 0, 0, 0, 0, 0, 0, 0, 0, 0, --
Dillon Heatherington, Healthy, Ott, D, FA, Ari, W 6-2, 0, 0, 0, 0, 0, 0, 0, 0, 0, 0, 0, 0, 0, 0, 0, 0, --
Xavier Ouellet, Healthy, Pit, D, FA, @Cls, W 6-3, 0, 0, 0, 0, 0, 0, 0, 0, 0, 0, 0, 0, 0, 0, 0, 0, --
Tyler Lewington, Healthy, Bos, D, FA, Min, W 4-3, 0, 0, 0, 0, 0, 0, 0, 0, 0, 0, 0, 0, 0, 0, 0, 0, --
Egor Yakovlev, Healthy, NJ, D, FA, SJ, W 2-1, 0, 0, 0, 0, 0, 0, 0, 0, 0, 0, 0, 0, 0, 0, 0, 0, --
William Lagesson, Healthy, Car, D, FA, @Cgy, L 2-3, 0, 0, 0, 0, 0, 0, 0, 0, 0, 0, 0, 0, 0, 0, 0, 0, --
Mackenzie MacEachern, Healthy, Car, LW- RW, FA, @Cgy, L 2-3, 0, 0, 0, 0, 0, 0, 0, 0, 0, 0, 0, 0, 0, 0, 0, 0, --
Kyle Turris, Healthy, Edm, C- RW, FA, StL, L 0-2, 0, 0, 0, 0, 0, 0, 0, 0, 0, 0, 0, 0, 0, 0, 0, 0, --
Jonas Rondbjerg, Healthy, Vgk, RW, FA, Col, L 2-3, 0, 0, 0, 0, 0, 0, 0, 0, 0, 0, 0, 0, 0, 0, 0, 0, --
Kole Sherwood, Healthy, Nsh, RW, FA, Phi, L 1-3, 0, 0, 0, 0, 0, 0, 0, 0, 0, 0, 0, 0, 0, 0, 0, 0, --
Martin Frk, Healthy, StL, RW, FA, @Edm, W 2-0, 0, 0, 0, 0, 0, 0, 0, 0, 0, 0, 0, 0, 0, 0, 0, 0, --
Jack Dugan, Healthy, Vgk, RW- LW, FA, Col, L 2-3, 0, 0, 0, 0, 0, 0, 0, 0, 0, 0, 0, 0, 0, 0, 0, 0, --
Sasha Chmelevski, Healthy, SJ, C, FA, @NJ, L 1-2, 0, 0, 0, 0, 0, 0, 0, 0, 0, 0, 0, 0, 0, 0, 0, 0, --
Sampo Ranta, Healthy, Col, LW, FA, @Vgk, W 3-2, 0, 0, 0, 0, 0, 0, 0, 0, 0, 0, 0, 0, 0, 0, 0, 0, --
Melker Karlsson, Healthy, SJ, RW- C, FA, @NJ, L 1-2, 0, 0, 0, 0, 0, 0, 0, 0, 0, 0, 0, 0, 0, 0, 0, 0, --
Stefan Matteau, Healthy, Col, C- LW, FA, @Vgk, W 3-2, 0, 0, 0, 0, 0, 0, 0, 0, 0, 0, 0, 0, 0, 0, 0, 0, --
Louie Belpedio, Healthy, Phi, D, FA, @Nsh, W 3-1, 0, 0, 0, 0, 0, 0, 0, 0, 0, 0, 0, 0, 0, 0, 0, 0, 0.0
Thomas Hickey, Healthy, NJ, D, FA, SJ, W 2-1, 0, 0, 0, 0, 0, 0, 0, 0, 0, 0, 0, 0, 0, 0, 0, 0, --
Cameron Schilling, Healthy, Wsh, D, FA, LA, W 4-3, 0, 0, 0, 0, 0, 0, 0, 0, 0, 0, 0, 0, 0, 0, 0, 0, --
Josh Dunne, Healthy, Cls, C, FA, Pit, L 3-6, 0, 0, 0, 0, 0, 0, 0, 0, 0, 0, 0, 0, 0, 0, 0, 0, --
Carson Meyer, DTD, Cls, RW, FA, Pit, L 3-6, 0, 0, 0, 0, 0, 0, 0, 0, 0, 0, 0, 0, 0, 0, 0, 0, --
