Jimmy Huntington, Healthy, Nsh, LW, FA, LA, W 5-3, 0, 0, 0, 0, 0, 0, 0, 0, 0, 0, 0, 0, 0, 0, 0, 0, --
Jayden Halbgewachs, Healthy, SJ, LW, FA, @Cls, L 3-5, 0, 0, 0, 0, 0, 0, 0, 0, 0, 0, 0, 0, 0, 0, 0, 0, --
Oscar Fantenberg, Healthy, Van, D, FA, Edm, L 2-4, 0, 0, 0, 0, 0, 0, 0, 0, 0, 0, 0, 0, 0, 0, 0, 0, --
Tyler Graovac, Healthy, Van, C, FA, Edm, L 2-4, 0, 0, 0, 0, 0, 0, 0, 0, 0, 0, 0, 0, 0, 0, 0, 0, --
Curtis Valk, Healthy, Fla, C- LW, FA, Min, W 5-3, 0, 0, 0, 0, 0, 0, 0, 0, 0, 0, 0, 0, 0, 0, 0, 0, --
Olle Alsing, Healthy, Ott, D, FA, Wpg, L 1-5, 0, 0, 0, 0, 0, 0, 0, 0, 0, 0, 0, 0, 0, 0, 0, 0, --
Linus Sandin, Healthy, Phi, RW, FA, @Det, W 2-1, 0, 0, 0, 0, 0, 0, 0, 0, 0, 0, 0, 0, 0, 0, 0, 0, --
Pierre-Cedric Labrie, Healthy, TB, LW, FA, @Cgy, L 3-6, 0, 0, 0, 0, 0, 0, 0, 0, 0, 0, 0, 0, 0, 0, 0, 0, --
Henrik Haapala, Healthy, Fla, LW, FA, Min, W 5-3, 0, 0, 0, 0, 0, 0, 0, 0, 0, 0, 0, 0, 0, 0, 0, 0, --
Semyon Der-Arguchintsev, Healthy, Tor, RW, FA, @Mon, L 2-3, 0, 0, 0, 0, 0, 0, 0, 0, 0, 0, 0, 0, 0, 0, 0, 0, --
Danick Martel, Healthy, Mon, C- LW, FA, Tor, W 3-2, 0, 0, 0, 0, 0, 0, 0, 0, 0, 0, 0, 0, 0, 0, 0, 0, --
David Kase, Healthy, Phi, RW, FA, @Det, W 2-1, 0, 0, 0, 0, 0, 0, 0, 0, 0, 0, 0, 0, 0, 0, 0, 0, --
Brian Gibbons, Healthy, Car, LW- C, FA, @NYI, W 5-2, 0, 0, 0, 0, 0, 0, 0, 0, 0, 0, 0, 0, 0, 0, 0, 0, --
Filip Chlapik, Healthy, Ott, C, FA, Wpg, L 1-5, 0, 0, 0, 0, 0, 0, 0, 0, 0, 0, 0, 0, 0, 0, 0, 0, --
Philippe Maillet, Healthy, Wsh, C, FA, @Vgk, L 2-6, 0, 0, 0, 0, 0, 0, 0, 0, 0, 0, 0, 0, 0, 0, 0, 0, --
Lucas Wallmark, Healthy, Fla, C, FA, Min, W 5-3, 0, 0, 0, 0, 0, 0, 0, 0, 0, 0, 0, 0, 0, 0, 0, 0, --
Jayce Hawryluk, Healthy, Ott, C, FA, Wpg, L 1-5, 0, 0, 0, 0, 0, 0, 0, 0, 0, 0, 0, 0, 0, 0, 0, 0, --
Cooper Marody, Healthy, Phi, C- RW, FA, @Det, W 2-1, 0, 0, 0, 0, 0, 0, 0, 0, 0, 0, 0, 0, 0, 0, 0, 0, --
Fredrik Handemark, Healthy, SJ, C, FA, @Cls, L 3-5, 0, 0, 0, 0, 0, 0, 0, 0, 0, 0, 0, 0, 0, 0, 0, 0, --
Aidan Dudas, Healthy, LA, C, FA, @Nsh, L 3-5, 0, 0, 0, 0, 0, 0, 0, 0, 0, 0, 0, 0, 0, 0, 0, 0, --
Kalle Kossila, Healthy, Ana, LW, FA, @Buf, L 3-6, 0, 0, 0, 0, 0, 0, 0, 0, 0, 0, 0, 0, 0, 0, 0, 0, --
Lean Bergmann, Healthy, SJ, LW- C, FA, @Cls, L 3-5, 0, 0, 0, 0, 0, 0, 0, 0, 0, 0, 0, 0, 0, 0, 0, 0, --
Adam Brooks, Healthy, Phi, C, FA, @Det, W 2-1, 0, 0, 0, 0, 0, 0, 0, 0, 0, 0, 0, 0, 0, 0, 0, 0, --
Jack Studnicka, Healthy, Van, C- RW, FA, Edm, L 2-4, 1, 0, 0, 0, 0, 0, 0, 0, 0, 0, 1, 3, 0, 2, 0, 0, 0.0
Adam Lowry, Healthy, Wpg, C, FA, @Ott, W 5-1, 1, 0, 0, -1, 5, 0, 0, 0, 0, 0, 5, 5, 0, 1, 3, 0, 0.0
Kevin Shattenkirk, Healthy, Ana, D, FA, @Buf, L 3-6, 1, 0, 0, -2, 2, 0, 0, 0, 0, 0, 0, 0, 0, 1, 0, 2, -0.1
Viktor Arvidsson, Healthy, LA, RW- LW, FA, @Nsh, L 3-5, 1, 0, 0, -1, 0, 0, 0, 0, 0, 0, 0, 0, 0, 1, 1, 0, -0.1
Brock Boeser, Healthy, Van, RW, OXP, Edm, L 2-4, 1, 0, 0, -1, 0, 0, 0, 0, 0, 0, 0, 0, 0, 1, 1, 0, -0.1
Vladislav Gavrikov, Healthy, LA, D, FA, @Nsh, L 3-5, 1, 0, 0, -1, 0, 0, 0, 0, 0, 0, 0, 0, 0, 1, 1, 0, -0.1
Philipp Kurashev, O, Chi, LW- RW, FA, @StL, W 5-3, 1, 0, 0, -1, 0, 0, 0, 0, 0, 0, 0, 1, 0, 0, 0, 1, -0.1
Jonah Gadjovich, IR, SJ, LW- RW, FA, @Cls, L 3-5, 1, 0, 0, 0, 5, 0, 0, 0, 0, 0, 0, 0, 0, 1, 1, 0, -0.1
Phil Kessel, Healthy, Vgk, RW, FA, Wsh, W 6-2, 1, 0, 0, 0, 2, 0, 0, 0, 0, 0, 1, 1, 0, 1, 0, 0, -0.1
Dylan Gambrell, Healthy, Ott, C, FA, Wpg, L 1-5, 1, 0, 0, 0, 0, 0, 0, 0, 0, 0, 1, 2, 0, 0, 0, 0, -0.1
Pius Suter, Healthy, Det, C- LW, FA, Phi, L 1-2, 1, 0, 0, 0, 0, 0, 0, 0, 0, 0, 4, 9, 0, 1, 1, 0, -0.1
Nick Jensen, Healthy, Wsh, D, FA, @Vgk, L 2-6, 1, 0, 0, -3, 0, 0, 0, 0, 0, 0, 0, 0, 0, 0, 3, 1, -0.1
Michael Bunting, Healthy, Tor, LW, BOWS, @Mon, L 2-3, 1, 0, 0, -1, 0, 0, 0, 0, 0, 0, 0, 0, 0, 3, 0, 0, -0.2
Frank Vatrano, Healthy, Ana, LW- RW, FA, @Buf, L 3-6, 1, 0, 0, -2, 0, 0, 0, 0, 0, 0, 0, 0, 0, 2, 2, 0, -0.2
Sonny Milano, Healthy, Wsh, LW, FA, @Vgk, L 2-6, 1, 0, 0, -3, 0, 0, 0, 0, 0, 0, 0, 0, 0, 2, 2, 1, -0.2
Sam Steel, Healthy, Min, C- LW, FA, @Fla, L 3-5, 1, 0, 0, -1, 0, 0, 0, 0, 0, 0, 6, 8, 0, 0, 0, 1, -0.2
Alexander Alexeyev, Healthy, Wsh, D, FA, @Vgk, L 2-6, 1, 0, 0, -3, 0, 0, 0, 0, 0, 0, 0, 0, 0, 1, 4, 0, -0.2
Nick Ritchie, Healthy, Cgy, LW, FA, TB, W 6-3, 1, 0, 0, -1, 2, 0, 0, 0, 0, 0, 0, 0, 0, 2, 1, 0, -0.2
Lars Eller, Healthy, Col, C, FA, @Sea, W 2-1, 1, 0, 0, -1, 0, 0, 0, 0, 0, 0, 2, 5, 0, 0, 2, 0, -0.2
Brendan Lemieux, Healthy, Phi, LW- RW, FA, @Det, W 2-1, 1, 0, 0, 0, 5, 0, 0, 0, 0, 0, 0, 0, 0, 0, 1, 0, -0.2
Philip Broberg, Healthy, Edm, D, FA, @Van, W 4-2, 1, 0, 0, -1, 0, 0, 0, 0, 0, 0, 0, 0, 0, 0, 1, 0, -0.2
Steven Lorentz, Healthy, SJ, C- LW, FA, @Cls, L 3-5, 1, 0, 0, 0, 0, 0, 0, 0, 0, 0, 4, 8, 0, 2, 0, 0, -0.2
Pierre-Luc Dubois, Healthy, Wpg, C, SLC, @Ott, W 5-1, 1, 0, 0, 0, 0, 0, 0, 0, 0, 0, 4, 10, 0, 3, 0, 0, -0.3
Pierre Engvall, Healthy, NYI, LW- C- RW, FA, Car, L 2-5, 1, 0, 0, -1, 0, 0, 0, 0, 0, 0, 0, 1, 0, 3, 0, 0, -0.3
Mats Zuccarello, Healthy, Min, RW- LW, CLB, @Fla, L 3-5, 1, 0, 0, -1, 0, 0, 0, 0, 0, 0, 1, 0, 0, 1, 0, 0, -0.3
Troy Terry, O, Ana, C- RW, FA, @Buf, L 3-6, 1, 0, 0, -1, 0, 0, 0, 0, 0, 0, 0, 0, 0, 2, 0, 0, -0.3
Jack Quinn, Healthy, Buf, RW, FA, Ana, W 6-3, 1, 0, 0, -1, 0, 0, 0, 0, 0, 0, 0, 0, 0, 2, 0, 0, -0.3
Mattias Samuelsson, Healthy, Buf, D, FA, Ana, W 6-3, 1, 0, 0, -1, 0, 0, 0, 0, 0, 0, 0, 0, 0, 2, 0, 0, -0.3
Michael Carcone, Healthy, Ari, RW- LW, FA, @Dal, L 0-4, 1, 0, 0, -1, 0, 0, 0, 0, 0, 0, 0, 0, 0, 2, 0, 0, -0.3
Brandon Hagel, Healthy, TB, LW- RW, DINK, @Cgy, L 3-6, 1, 0, 0, -2, 0, 0, 0, 0, 0, 0, 0, 1, 0, 2, 2, 0, -0.3
Evan Rodrigues, Healthy, Col, C- RW, FA, @Sea, W 2-1, 1, 0, 0, 0, 2, 0, 0, 0, 0, 0, 0, 3, 0, 2, 0, 0, -0.3
Ben Meyers, Healthy, Col, RW, FA, @Sea, W 2-1, 1, 0, 0, 0, 0, 0, 0, 0, 0, 0, 0, 3, 0, 0, 0, 0, -0.3
Travis Boyd, Healthy, Ari, C- RW, FA, @Dal, L 0-4, 1, 0, 0, -1, 0, 0, 0, 0, 0, 0, 5, 11, 0, 5, 1, 0, -0.3
Jakob Chychrun, O, Ott, D, ME, Wpg, L 1-5, 1, 0, 0, -2, 0, 0, 0, 0, 0, 0, 0, 0, 0, 3, 1, 0, -0.4
Bo Horvat, Healthy, NYI, C, SALT, Car, L 2-5, 1, 0, 0, -2, 0, 0, 0, 0, 0, 0, 10, 5, 0, 1, 0, 0, -0.4
Evan Bouchard, Healthy, Edm, D, FA, @Van, W 4-2, 1, 0, 0, -1, 0, 0, 0, 0, 0, 0, 0, 0, 0, 1, 0, 0, -0.4
Shane Pinto, Healthy, Ott, C, FA, Wpg, L 1-5, 1, 0, 0, 0, 0, 0, 0, 0, 0, 0, 1, 5, 0, 0, 0, 0, -0.4
James van Riemsdyk, Healthy, Phi, LW- RW, FA, @Det, W 2-1, 1, 0, 0, -1, 0, 0, 0, 0, 0, 0, 0, 0, 0, 1, 0, 0, -0.4
Brandon Saad, Healthy, StL, LW- RW, FA, Chi, L 3-5, 1, 0, 0, -1, 0, 0, 0, 0, 0, 0, 0, 0, 0, 1, 0, 0, -0.4
Frederick Gaudreau, Healthy, Min, C- LW, FA, @Fla, L 3-5, 1, 0, 0, -1, 0, 0, 0, 0, 0, 0, 1, 2, 0, 2, 0, 0, -0.4
Brandon Duhaime, Healthy, Min, RW- LW, FA, @Fla, L 3-5, 1, 0, 0, -2, 0, 0, 0, 0, 0, 0, 0, 1, 0, 1, 2, 0, -0.4
Jayson Megna, Healthy, Ana, C- RW, FA, @Buf, L 3-6, 1, 0, 0, -1, 0, 0, 0, 0, 0, 0, 4, 4, 0, 1, 0, 0, -0.4
Mark Kastelic, Healthy, Ott, C, FA, Wpg, L 1-5, 1, 0, 0, 0, 7, 0, 0, 0, 0, 0, 0, 2, 0, 2, 1, 0, -0.4
Brayden Point, Healthy, TB, C- RW, BBS, @Cgy, L 3-6, 1, 0, 0, -3, 0, 0, 0, 0, 0, 0, 7, 3, 0, 1, 0, 1, -0.5
Drake Batherson, Healthy, Ott, C- RW, OXP, Wpg, L 1-5, 1, 0, 0, -2, 2, 0, 0, 0, 0, 0, 2, 0, 0, 2, 1, 0, -0.5
Jordan Eberle, Healthy, Sea, RW- LW, FA, Col, L 1-2, 1, 0, 0, -1, 0, 0, 0, 0, 0, 0, 0, 0, 0, 0, 0, 0, -0.5
Anthony Mantha, Healthy, Wsh, RW- LW, FA, @Vgk, L 2-6, 1, 0, 0, -2, 2, 0, 0, 0, 0, 0, 0, 1, 0, 2, 2, 0, -0.5
Jordan Harris, Healthy, Mon, D, FA, Tor, W 3-2, 1, 0, 0, -1, 0, 0, 0, 0, 0, 0, 0, 0, 0, 0, 0, 0, -0.5
Jake Neighbours, Healthy, StL, LW, FA, Chi, L 3-5, 1, 0, 0, -3, 0, 0, 0, 0, 0, 0, 0, 0, 0, 2, 1, 1, -0.5
Karson Kuhlman, Healthy, Wpg, C- RW, FA, @Ott, W 5-1, 1, 0, 0, -1, 0, 0, 0, 0, 0, 0, 0, 0, 0, 0, 0, 0, -0.5
Shayne Gostisbehere, Healthy, Car, D, FA, @NYI, W 5-2, 1, 0, 0, -1, 2, 0, 0, 0, 0, 0, 0, 0, 0, 1, 0, 0, -0.6
Tyler Myers, Healthy, Van, D, FA, Edm, L 2-4, 1, 0, 0, -2, 0, 0, 0, 0, 0, 0, 0, 0, 0, 1, 1, 0, -0.6
Matt Benning, DTD, SJ, D, FA, @Cls, L 3-5, 1, 0, 0, -2, 0, 0, 0, 0, 0, 0, 0, 0, 0, 1, 1, 0, -0.6
Nicolas Aube-Kubel, Healthy, Wsh, RW, FA, @Vgk, L 2-6, 1, 0, 0, -2, 0, 0, 0, 0, 0, 0, 0, 0, 0, 1, 1, 0, -0.6
Jaret Anderson-Dolan, Healthy, LA, C, FA, @Nsh, L 3-5, 1, 0, 0, -2, 0, 0, 0, 0, 0, 0, 0, 0, 0, 1, 1, 0, -0.6
Logan Couture, Healthy, SJ, C, BOWS, @Cls, L 3-5, 1, 0, 0, -3, 0, 0, 0, 0, 0, 0, 2, 10, 0, 3, 3, 1, -0.6
Jean-Gabriel Pageau, Healthy, NYI, C, FA, Car, L 2-5, 1, 0, 0, -1, 2, 0, 0, 0, 0, 0, 15, 14, 0, 0, 0, 0, -0.6
Jesperi Kotkaniemi, Healthy, Car, C- LW, FA, @NYI, W 5-2, 1, 0, 0, -1, 0, 0, 0, 0, 0, 0, 1, 3, 0, 1, 0, 0, -0.6
Pavel Buchnevich, DTD, StL, RW- LW, SALT, Chi, L 3-5, 1, 0, 0, -1, 4, 0, 0, 0, 0, 0, 0, 1, 0, 3, 0, 0, -0.7
Thomas Chabot, O, Ott, D, ME, Wpg, L 1-5, 1, 0, 0, -3, 0, 0, 0, 0, 0, 0, 0, 0, 0, 2, 2, 0, -0.7
Matt Roy, Healthy, LA, D, FA, @Nsh, L 3-5, 1, 0, 0, -2, 0, 0, 0, 0, 0, 0, 0, 0, 0, 0, 1, 0, -0.7
Dante Fabbro, Healthy, Nsh, D, FA, LA, W 5-3, 1, 0, 0, -1, 2, 0, 0, 0, 0, 0, 0, 0, 0, 0, 0, 0, -0.7
Tim Stutzle, Healthy, Ott, LW- C, LKR, Wpg, L 1-5, 1, 0, 0, -3, 4, 0, 0, 0, 0, 0, 0, 4, 0, 2, 3, 1, -0.7
Tom Wilson, Healthy, Wsh, RW, FA, @Vgk, L 2-6, 1, 0, 0, -3, 2, 0, 0, 0, 0, 0, 0, 0, 0, 0, 3, 0, -0.8
Nicklas Backstrom, Healthy, Wsh, C, FA, @Vgk, L 2-6, 1, 0, 0, -2, 0, 0, 0, 0, 0, 0, 4, 5, 0, 2, 0, 0, -0.9
John Klingberg, Healthy, Min, D, FA, @Fla, L 3-5, 1, 0, 0, -2, 0, 0, 0, 0, 0, 0, 0, 0, 0, 1, 0, 0, -0.9
Adam Boqvist, DTD, Cls, D, FA, SJ, W 5-3, 1, 0, 0, -2, 0, 0, 0, 0, 0, 0, 0, 0, 0, 1, 0, 0, -0.9
Mathieu Joseph, Healthy, Ott, RW- LW, FA, Wpg, L 1-5, 1, 0, 0, -1, 10, 0, 0, 0, 0, 0, 0, 0, 0, 1, 0, 1, -0.9
Blake Lizotte, Healthy, LA, C, FA, @Nsh, L 3-5, 1, 0, 0, -2, 0, 0, 0, 0, 0, 0, 4, 3, 0, 0, 0, 0, -0.9
Zack Kassian, DTD, Ari, RW, FA, @Dal, L 0-4, 1, 0, 0, -2, 0, 0, 0, 0, 0, 0, 0, 1, 0, 1, 0, 0, -1.0
Kirill Marchenko, Healthy, Cls, LW, FA, SJ, W 5-3, 1, 0, 0, -3, 0, 0, 0, 0, 0, 0, 0, 0, 0, 0, 1, 0, -1.2
Anthony Beauvillier, Healthy, Van, LW- RW, FA, Edm, L 2-4, 1, 0, 0, -4, 0, 0, 0, 0, 0, 0, 0, 0, 0, 5, 0, 0, -1.5
Josh Bailey, Healthy, NYI, LW- RW, FA, Car, L 2-5, 1, 0, 0, -3, 0, 0, 0, 0, 0, 0, 0, 0, 0, 0, 0, 0, -1.5
Matt Nieto, Healthy, Col, LW- RW, FA, @Sea, W 2-1, 1, 0, 0, -3, 0, 0, 0, 0, 0, 0, 0, 0, 0, 0, 0, 0, -1.5
Brady Tkachuk, Healthy, Ott, LW- C, BOWS, Wpg, L 1-5, 1, 0, 0, -2, 12, 0, 0, 0, 0, 0, 5, 4, 0, 3, 1, 0, -1.5
Corey Perry, Healthy, TB, RW, FA, @Cgy, L 3-6, 1, 0, 0, -1, 12, 0, 0, 0, 0, 0, 0, 0, 0, 2, 0, 0, -1.5
Emil Bemstrom, Healthy, Cls, C- RW, FA, SJ, W 5-3, 1, 0, 0, -3, 0, 0, 0, 0, 0, 0, 0, 1, 0, 0, 0, 0, -1.6
Alexander Barabanov, O, SJ, LW- RW, FA, @Cls, L 3-5, 1, 0, 0, -4, 0, 0, 0, 0, 0, 0, 0, 0, 0, 0, 0, 0, -2.0
David Pastrnak, Healthy, Bos, RW, CLB, --, --, 0, 0, 0, 0, 0, 0, 0, 0, 0, 0, 0, 0, 0, 0, 0, 0, --
Cale Makar, Healthy, Col, D, DINK, @Sea, W 2-1, 0, 0, 0, 0, 0, 0, 0, 0, 0, 0, 0, 0, 0, 0, 0, 0, --
Adam Fox, Healthy, NYR, D, SALT, --, --, 0, 0, 0, 0, 0, 0, 0, 0, 0, 0, 0, 0, 0, 0, 0, 0, --
Alex Ovechkin, Healthy, Wsh, LW, SALT, @Vgk, L 2-6, 0, 0, 0, 0, 0, 0, 0, 0, 0, 0, 0, 0, 0, 0, 0, 0, --
Sidney Crosby, Healthy, Pit, C, DINK, --, --, 0, 0, 0, 0, 0, 0, 0, 0, 0, 0, 0, 0, 0, 0, 0, 0, --
Mika Zibanejad, Healthy, NYR, C, ME, --, --, 0, 0, 0, 0, 0, 0, 0, 0, 0, 0, 0, 0, 0, 0, 0, 0, --
Jack Hughes, Healthy, NJ, C- LW, BBS, --, --, 0, 0, 0, 0, 0, 0, 0, 0, 0, 0, 0, 0, 0, 0, 0, 0, --
Dougie Hamilton, Healthy, NJ, D, BBS, --, --, 0, 0, 0, 0, 0, 0, 0, 0, 0, 0, 0, 0, 0, 0, 0, 0, --
Jake Guentzel, Healthy, Pit, LW, SALT, --, --, 0, 0, 0, 0, 0, 0, 0, 0, 0, 0, 0, 0, 0, 0, 0, 0, --
Artemi Panarin, Healthy, NYR, LW, HERB, --, --, 0, 0, 0, 0, 0, 0, 0, 0, 0, 0, 0, 0, 0, 0, 0, 0, --
Roope Hintz, Healthy, Dal, C- LW, ME, Ari, W 4-0, 0, 0, 0, 0, 0, 0, 0, 0, 0, 0, 0, 0, 0, 0, 0, 0, --
Jacob Trouba, Healthy, NYR, D, BBS, --, --, 0, 0, 0, 0, 0, 0, 0, 0, 0, 0, 0, 0, 0, 0, 0, 0, --
Brad Marchand, Healthy, Bos, LW, SALT, --, --, 0, 0, 0, 0, 0, 0, 0, 0, 0, 0, 0, 0, 0, 0, 0, 0, --
Chris Kreider, Healthy, NYR, LW- RW, LKR, --, --, 0, 0, 0, 0, 0, 0, 0, 0, 0, 0, 0, 0, 0, 0, 0, 0, --
Patrice Bergeron, DTD, Bos, C, CLB, --, --, 0, 0, 0, 0, 0, 0, 0, 0, 0, 0, 0, 0, 0, 0, 0, 0, --
Kris Letang, Healthy, Pit, D, DINK, --, --, 0, 0, 0, 0, 0, 0, 0, 0, 0, 0, 0, 0, 0, 0, 0, 0, --
Charlie McAvoy, Healthy, Bos, D, SLC, --, --, 0, 0, 0, 0, 0, 0, 0, 0, 0, 0, 0, 0, 0, 0, 0, 0, --
Nico Hischier, Healthy, NJ, C, SLC, --, --, 0, 0, 0, 0, 0, 0, 0, 0, 0, 0, 0, 0, 0, 0, 0, 0, --
Evgeni Malkin, Healthy, Pit, C, SLC, --, --, 0, 0, 0, 0, 0, 0, 0, 0, 0, 0, 0, 0, 0, 0, 0, 0, --
Jesper Bratt, Healthy, NJ, RW- LW, HERB, --, --, 0, 0, 0, 0, 0, 0, 0, 0, 0, 0, 0, 0, 0, 0, 0, 0, --
Vincent Trocheck, Healthy, NYR, C, OXP, --, --, 0, 0, 0, 0, 0, 0, 0, 0, 0, 0, 0, 0, 0, 0, 0, 0, --
Hampus Lindholm, Healthy, Bos, D, SLC, --, --, 0, 0, 0, 0, 0, 0, 0, 0, 0, 0, 0, 0, 0, 0, 0, 0, --
Rickard Rakell, Healthy, Pit, C- LW- RW, HERB, --, --, 0, 0, 0, 0, 0, 0, 0, 0, 0, 0, 0, 0, 0, 0, 0, 0, --
Jeff Petry, Healthy, Pit, D, LKR, --, --, 0, 0, 0, 0, 0, 0, 0, 0, 0, 0, 0, 0, 0, 0, 0, 0, --
Jake DeBrusk, Healthy, Bos, LW- RW, BBS, --, --, 0, 0, 0, 0, 0, 0, 0, 0, 0, 0, 0, 0, 0, 0, 0, 0, --
David Krejci, DTD, Bos, C, OXP, --, --, 0, 0, 0, 0, 0, 0, 0, 0, 0, 0, 0, 0, 0, 0, 0, 0, --
Mark Stone, IR, Vgk, RW, DINK, Wsh, W 6-2, 0, 0, 0, 0, 0, 0, 0, 0, 0, 0, 0, 0, 0, 0, 0, 0, --
Taylor Hall, IR, Bos, LW, FA, --, --, 0, 0, 0, 0, 0, 0, 0, 0, 0, 0, 0, 0, 0, 0, 0, 0, --
Bryan Rust, Healthy, Pit, RW, FA, --, --, 0, 0, 0, 0, 0, 0, 0, 0, 0, 0, 0, 0, 0, 0, 0, 0, --
Andre Burakovsky, IR, Sea, LW- RW, FA, Col, L 1-2, 0, 0, 0, 0, 0, 0, 0, 0, 0, 0, 0, 0, 0, 0, 0, 0, --
Cole Caufield, IR, Mon, RW- LW, LKR, Tor, W 3-2, 0, 0, 0, 0, 0, 0, 0, 0, 0, 0, 0, 0, 0, 0, 0, 0, --
Damon Severson, Healthy, NJ, D, FA, --, --, 0, 0, 0, 0, 0, 0, 0, 0, 0, 0, 0, 0, 0, 0, 0, 0, --
Ondrej Palat, Healthy, NJ, LW, OXP, --, --, 0, 0, 0, 0, 0, 0, 0, 0, 0, 0, 0, 0, 0, 0, 0, 0, --
Jaccob Slavin, Healthy, Car, D, ME, @NYI, W 5-2, 0, 0, 0, 0, 0, 0, 0, 0, 0, 0, 0, 0, 0, 0, 0, 0, --
Dawson Mercer, Healthy, NJ, C- RW, FA, --, --, 0, 0, 0, 0, 0, 0, 0, 0, 0, 0, 0, 0, 0, 0, 0, 0, --
"KAndre Miller", Healthy, NYR, D, ME, --, --, 0, 0, 0, 0, 0, 0, 0, 0, 0, 0, 0, 0, 0, 0, 0, 0, --
Jason Zucker, Healthy, Pit, LW, OXP, --, --, 0, 0, 0, 0, 0, 0, 0, 0, 0, 0, 0, 0, 0, 0, 0, 0, --
Gabriel Vilardi, DTD, LA, C- RW, FA, @Nsh, L 3-5, 0, 0, 0, 0, 0, 0, 0, 0, 0, 0, 0, 0, 0, 0, 0, 0, --
Ryan Graves, Healthy, NJ, D, DINK, --, --, 0, 0, 0, 0, 0, 0, 0, 0, 0, 0, 0, 0, 0, 0, 0, 0, --
Lawson Crouse, Healthy, Ari, LW- RW, FA, @Dal, L 0-4, 0, 0, 0, 0, 0, 0, 0, 0, 0, 0, 0, 0, 0, 0, 0, 0, --
Alexis Lafreniere, Healthy, NYR, LW- RW, CLB, --, --, 0, 0, 0, 0, 0, 0, 0, 0, 0, 0, 0, 0, 0, 0, 0, 0, --
Filip Chytil, Healthy, NYR, RW- C, FA, --, --, 0, 0, 0, 0, 0, 0, 0, 0, 0, 0, 0, 0, 0, 0, 0, 0, --
Matt Dumba, Healthy, Min, D, FA, @Fla, L 3-5, 0, 0, 0, 0, 0, 0, 0, 0, 0, 0, 0, 0, 0, 0, 0, 0, --
Sammy Blais, Healthy, StL, LW- RW, FA, Chi, L 3-5, 0, 0, 0, 0, 0, 0, 0, 0, 0, 0, 0, 0, 0, 0, 0, 0, --
Pavel Zacha, Healthy, Bos, C- LW- RW, FA, --, --, 0, 0, 0, 0, 0, 0, 0, 0, 0, 0, 0, 0, 0, 0, 0, 0, --
Connor Clifton, Healthy, Bos, D, FA, --, --, 0, 0, 0, 0, 0, 0, 0, 0, 0, 0, 0, 0, 0, 0, 0, 0, --
Jaden Schwartz, Healthy, Sea, LW- RW, FA, Col, L 1-2, 0, 0, 0, 0, 0, 0, 0, 0, 0, 0, 0, 0, 0, 0, 0, 0, --
Marcus Foligno, Healthy, Min, LW- RW, FA, @Fla, L 3-5, 0, 0, 0, 0, 0, 0, 0, 0, 0, 0, 0, 0, 0, 0, 0, 0, --
Charlie Coyle, Healthy, Bos, C, FA, --, --, 0, 0, 0, 0, 0, 0, 0, 0, 0, 0, 0, 0, 0, 0, 0, 0, --
Justin Schultz, Healthy, Sea, D, FA, Col, L 1-2, 0, 0, 0, 0, 0, 0, 0, 0, 0, 0, 0, 0, 0, 0, 0, 0, --
Yegor Sharangovich, Healthy, NJ, C- LW, FA, --, --, 0, 0, 0, 0, 0, 0, 0, 0, 0, 0, 0, 0, 0, 0, 0, 0, --
Tomas Tatar, Healthy, NJ, LW- RW, FA, --, --, 0, 0, 0, 0, 0, 0, 0, 0, 0, 0, 0, 0, 0, 0, 0, 0, --
Marcus Pettersson, IR, Pit, D, FA, --, --, 0, 0, 0, 0, 0, 0, 0, 0, 0, 0, 0, 0, 0, 0, 0, 0, --
Kasperi Kapanen, Healthy, StL, RW, FA, Chi, L 3-5, 0, 0, 0, 0, 0, 0, 0, 0, 0, 0, 0, 0, 0, 0, 0, 0, --
Jeff Carter, Healthy, Pit, C- RW, FA, --, --, 0, 0, 0, 0, 0, 0, 0, 0, 0, 0, 0, 0, 0, 0, 0, 0, --
Kaapo Kakko, Healthy, NYR, RW, FA, --, --, 0, 0, 0, 0, 0, 0, 0, 0, 0, 0, 0, 0, 0, 0, 0, 0, --
Matt Grzelcyk, Healthy, Bos, D, FA, --, --, 0, 0, 0, 0, 0, 0, 0, 0, 0, 0, 0, 0, 0, 0, 0, 0, --
Erik Haula, Healthy, NJ, LW- C, FA, --, --, 0, 0, 0, 0, 0, 0, 0, 0, 0, 0, 0, 0, 0, 0, 0, 0, --
Matias Maccelli, Healthy, Ari, LW, CLB, @Dal, L 0-4, 0, 0, 0, 0, 0, 0, 0, 0, 0, 0, 0, 0, 0, 0, 0, 0, --
Jonas Siegenthaler, Healthy, NJ, D, FA, --, --, 0, 0, 0, 0, 0, 0, 0, 0, 0, 0, 0, 0, 0, 0, 0, 0, --
Ryan Lindgren, O, NYR, D, FA, --, --, 0, 0, 0, 0, 0, 0, 0, 0, 0, 0, 0, 0, 0, 0, 0, 0, --
Brian Dumoulin, Healthy, Pit, D, FA, --, --, 0, 0, 0, 0, 0, 0, 0, 0, 0, 0, 0, 0, 0, 0, 0, 0, --
Jordie Benn, Healthy, Tor, D, FA, @Mon, L 2-3, 0, 0, 0, 0, 0, 0, 0, 0, 0, 0, 0, 0, 0, 0, 0, 0, --
Vitali Kravtsov, Healthy, Van, LW- RW, FA, Edm, L 2-4, 0, 0, 0, 0, 0, 0, 0, 0, 0, 0, 0, 0, 0, 0, 0, 0, --
Barclay Goodrow, Healthy, NYR, RW- C- LW, FA, --, --, 0, 0, 0, 0, 0, 0, 0, 0, 0, 0, 0, 0, 0, 0, 0, 0, --
Brandon Carlo, Healthy, Bos, D, FA, --, --, 0, 0, 0, 0, 0, 0, 0, 0, 0, 0, 0, 0, 0, 0, 0, 0, --
John Marino, Healthy, NJ, D, FA, --, --, 0, 0, 0, 0, 0, 0, 0, 0, 0, 0, 0, 0, 0, 0, 0, 0, --
Nick Foligno, IR, Bos, LW- RW, FA, --, --, 0, 0, 0, 0, 0, 0, 0, 0, 0, 0, 0, 0, 0, 0, 0, 0, --
Miles Wood, Healthy, NJ, LW, FA, --, --, 0, 0, 0, 0, 0, 0, 0, 0, 0, 0, 0, 0, 0, 0, 0, 0, --
Luke Hughes, Healthy, NJ, D, SLC, --, --, 0, 0, 0, 0, 0, 0, 0, 0, 0, 0, 0, 0, 0, 0, 0, 0, --
Braden Schneider, Healthy, NYR, D, FA, --, --, 0, 0, 0, 0, 0, 0, 0, 0, 0, 0, 0, 0, 0, 0, 0, 0, --
Derek Forbort, O, Bos, D, FA, --, --, 0, 0, 0, 0, 0, 0, 0, 0, 0, 0, 0, 0, 0, 0, 0, 0, --
Luke Evangelista, Healthy, Nsh, RW, FA, LA, W 5-3, 0, 0, 0, 0, 0, 0, 0, 0, 0, 0, 0, 0, 0, 0, 0, 0, --
Trent Frederic, Healthy, Bos, C- LW, FA, --, --, 0, 0, 0, 0, 0, 0, 0, 0, 0, 0, 0, 0, 0, 0, 0, 0, --
A.J. Greer, Healthy, Bos, LW, FA, --, --, 0, 0, 0, 0, 0, 0, 0, 0, 0, 0, 0, 0, 0, 0, 0, 0, --
Craig Smith, Healthy, Wsh, RW, FA, @Vgk, L 2-6, 0, 0, 0, 0, 0, 0, 0, 0, 0, 0, 0, 0, 0, 0, 0, 0, --
Danton Heinen, Healthy, Pit, C- LW- RW, FA, --, --, 0, 0, 0, 0, 0, 0, 0, 0, 0, 0, 0, 0, 0, 0, 0, 0, --
Kyle Burroughs, Healthy, Van, D, FA, Edm, L 2-4, 0, 0, 0, 0, 0, 0, 0, 0, 0, 0, 0, 0, 0, 0, 0, 0, --
P.K. Subban, Healthy, NJ, D, FA, --, --, 0, 0, 0, 0, 0, 0, 0, 0, 0, 0, 0, 0, 0, 0, 0, 0, --
Kevin Labanc, Healthy, SJ, RW- LW, FA, @Cls, L 3-5, 0, 0, 0, 0, 0, 0, 0, 0, 0, 0, 0, 0, 0, 0, 0, 0, --
Nils Lundkvist, Healthy, Dal, D, FA, Ari, W 4-0, 0, 0, 0, 0, 0, 0, 0, 0, 0, 0, 0, 0, 0, 0, 0, 0, --
Adam Ruzicka, Healthy, Cgy, C- LW, FA, TB, W 6-3, 0, 0, 0, 0, 0, 0, 0, 0, 0, 0, 0, 0, 0, 0, 0, 0, --
Cal Clutterbuck, Healthy, NYI, RW, FA, Car, L 2-5, 0, 0, 0, 0, 0, 0, 0, 0, 0, 0, 0, 0, 0, 0, 0, 0, --
Ty Smith, Healthy, Pit, D, FA, --, --, 0, 0, 0, 0, 0, 0, 0, 0, 0, 0, 0, 0, 0, 0, 0, 0, --
Alexander Holtz, Healthy, NJ, RW- LW, FA, --, --, 0, 0, 0, 0, 0, 0, 0, 0, 0, 0, 0, 0, 0, 0, 0, 0, --
Michael McLeod, Healthy, NJ, C, FA, --, --, 0, 0, 0, 0, 0, 0, 0, 0, 0, 0, 0, 0, 0, 0, 0, 0, --
Colin White, Healthy, Fla, C- RW, FA, Min, W 5-3, 0, 0, 0, 0, 0, 0, 0, 0, 0, 0, 0, 0, 0, 0, 0, 0, --
Simon Nemec, Healthy, NJ, D, FA, --, --, 0, 0, 0, 0, 0, 0, 0, 0, 0, 0, 0, 0, 0, 0, 0, 0, --
Jimmy Vesey, Healthy, NYR, LW- RW, FA, --, --, 0, 0, 0, 0, 0, 0, 0, 0, 0, 0, 0, 0, 0, 0, 0, 0, --
Ethan Bear, Healthy, Van, D, FA, Edm, L 2-4, 0, 0, 0, 0, 0, 0, 0, 0, 0, 0, 0, 0, 0, 0, 0, 0, --
Pierre-Olivier Joseph, Healthy, Pit, D, FA, --, --, 0, 0, 0, 0, 0, 0, 0, 0, 0, 0, 0, 0, 0, 0, 0, 0, --
Brock McGinn, Healthy, Ana, LW- RW, FA, @Buf, L 3-6, 0, 0, 0, 0, 0, 0, 0, 0, 0, 0, 0, 0, 0, 0, 0, 0, --
Zdeno Chara, Healthy, Bos, D, FA, --, --, 0, 0, 0, 0, 0, 0, 0, 0, 0, 0, 0, 0, 0, 0, 0, 0, --
Jan Rutta, DTD, Pit, D, FA, --, --, 0, 0, 0, 0, 0, 0, 0, 0, 0, 0, 0, 0, 0, 0, 0, 0, --
Teddy Blueger, Healthy, Vgk, C- LW, FA, Wsh, W 6-2, 0, 0, 0, 0, 0, 0, 0, 0, 0, 0, 0, 0, 0, 0, 0, 0, --
Zac Jones, Healthy, NYR, D, FA, --, --, 0, 0, 0, 0, 0, 0, 0, 0, 0, 0, 0, 0, 0, 0, 0, 0, --
Mike Reilly, Healthy, Bos, D, FA, --, --, 0, 0, 0, 0, 0, 0, 0, 0, 0, 0, 0, 0, 0, 0, 0, 0, --
Nick Perbix, Healthy, TB, D, FA, @Cgy, L 3-6, 0, 0, 0, 0, 0, 0, 0, 0, 0, 0, 0, 0, 0, 0, 0, 0, --
"Liam OBrien", Healthy, Ari, LW- C, FA, @Dal, L 0-4, 0, 0, 0, 0, 0, 0, 0, 0, 0, 0, 0, 0, 0, 0, 0, 0, --
Fabian Zetterlund, Healthy, SJ, LW- C- RW, FA, @Cls, L 3-5, 0, 0, 0, 0, 0, 0, 0, 0, 0, 0, 0, 0, 0, 0, 0, 0, --
Tomas Nosek, Healthy, Bos, C- LW, FA, --, --, 0, 0, 0, 0, 0, 0, 0, 0, 0, 0, 0, 0, 0, 0, 0, 0, --
Josh Archibald, Healthy, Pit, RW, FA, --, --, 0, 0, 0, 0, 0, 0, 0, 0, 0, 0, 0, 0, 0, 0, 0, 0, --
Anton Stralman, Healthy, Bos, D, FA, --, --, 0, 0, 0, 0, 0, 0, 0, 0, 0, 0, 0, 0, 0, 0, 0, 0, --
Mark Jankowski, Healthy, Nsh, C- LW, FA, LA, W 5-3, 0, 0, 0, 0, 0, 0, 0, 0, 0, 0, 0, 0, 0, 0, 0, 0, --
Nathan Bastian, DTD, NJ, RW- LW, FA, --, --, 0, 0, 0, 0, 0, 0, 0, 0, 0, 0, 0, 0, 0, 0, 0, 0, --
Ridly Greig, Healthy, Ott, C, FA, Wpg, L 1-5, 0, 0, 0, 0, 0, 0, 0, 0, 0, 0, 0, 0, 0, 0, 0, 0, --
Alex Turcotte, Healthy, LA, C, FA, @Nsh, L 3-5, 0, 0, 0, 0, 0, 0, 0, 0, 0, 0, 0, 0, 0, 0, 0, 0, --
Derick Brassard, O, Ott, C- LW, FA, Wpg, L 1-5, 0, 0, 0, 0, 0, 0, 0, 0, 0, 0, 0, 0, 0, 0, 0, 0, --
Haydn Fleury, Healthy, TB, D, FA, @Cgy, L 3-6, 0, 0, 0, 0, 0, 0, 0, 0, 0, 0, 0, 0, 0, 0, 0, 0, --
Chad Ruhwedel, Healthy, Pit, D, FA, --, --, 0, 0, 0, 0, 0, 0, 0, 0, 0, 0, 0, 0, 0, 0, 0, 0, --
Connor Mackey, Healthy, Ari, D, FA, @Dal, L 0-4, 0, 0, 0, 0, 0, 0, 0, 0, 0, 0, 0, 0, 0, 0, 0, 0, --
Ryan Carpenter, Healthy, NYR, C- LW- RW, FA, --, --, 0, 0, 0, 0, 0, 0, 0, 0, 0, 0, 0, 0, 0, 0, 0, 0, --
Julien Gauthier, DTD, Ott, RW, FA, Wpg, L 1-5, 0, 0, 0, 0, 0, 0, 0, 0, 0, 0, 0, 0, 0, 0, 0, 0, --
Chris Wideman, Healthy, Mon, D, FA, Tor, W 3-2, 0, 0, 0, 0, 0, 0, 0, 0, 0, 0, 0, 0, 0, 0, 0, 0, --
Henry Thrun, Healthy, Ana, D, FA, @Buf, L 3-6, 0, 0, 0, 0, 0, 0, 0, 0, 0, 0, 0, 0, 0, 0, 0, 0, --
Fabian Lysell, Healthy, Bos, RW, FA, --, --, 0, 0, 0, 0, 0, 0, 0, 0, 0, 0, 0, 0, 0, 0, 0, 0, --
Brendan Smith, Healthy, NJ, D, FA, --, --, 0, 0, 0, 0, 0, 0, 0, 0, 0, 0, 0, 0, 0, 0, 0, 0, --
Ryan Poehling, Healthy, Pit, C, FA, --, --, 0, 0, 0, 0, 0, 0, 0, 0, 0, 0, 0, 0, 0, 0, 0, 0, --
Andreas Johnsson, O, SJ, LW- RW, FA, @Cls, L 3-5, 0, 0, 0, 0, 0, 0, 0, 0, 0, 0, 0, 0, 0, 0, 0, 0, --
Hudson Fasching, Healthy, NYI, RW, FA, Car, L 2-5, 0, 0, 0, 0, 0, 0, 0, 0, 0, 0, 0, 0, 0, 0, 0, 0, --
Libor Hajek, Healthy, NYR, D, FA, --, --, 0, 0, 0, 0, 0, 0, 0, 0, 0, 0, 0, 0, 0, 0, 0, 0, --
Lukas Rousek, Healthy, Buf, LW- RW, FA, Ana, W 6-3, 0, 0, 0, 0, 0, 0, 0, 0, 0, 0, 0, 0, 0, 0, 0, 0, --
Boris Katchouk, Healthy, Chi, LW, FA, @StL, W 5-3, 0, 0, 0, 0, 0, 0, 0, 0, 0, 0, 0, 0, 0, 0, 0, 0, --
Jakub Zboril, Healthy, Bos, D, FA, --, --, 0, 0, 0, 0, 0, 0, 0, 0, 0, 0, 0, 0, 0, 0, 0, 0, --
Mattias Janmark, Healthy, Edm, LW- C, FA, @Van, W 4-2, 0, 0, 0, 0, 0, 0, 0, 0, 0, 0, 0, 0, 0, 0, 0, 0, --
Tobias Bjornfot, Healthy, LA, D, FA, @Nsh, L 3-5, 0, 0, 0, 0, 0, 0, 0, 0, 0, 0, 0, 0, 0, 0, 0, 0, --
Evgeny Svechnikov, Healthy, SJ, LW- RW, FA, @Cls, L 3-5, 0, 0, 0, 0, 0, 0, 0, 0, 0, 0, 0, 0, 0, 0, 0, 0, --
Ville Heinola, Healthy, Wpg, D, FA, @Ott, W 5-1, 0, 0, 0, 0, 0, 0, 0, 0, 0, 0, 0, 0, 0, 0, 0, 0, --
Jesper Boqvist, Healthy, NJ, C- RW, FA, --, --, 0, 0, 0, 0, 0, 0, 0, 0, 0, 0, 0, 0, 0, 0, 0, 0, --
Dryden Hunt, Healthy, Cgy, LW- RW, FA, TB, W 6-3, 0, 0, 0, 0, 0, 0, 0, 0, 0, 0, 0, 0, 0, 0, 0, 0, --
Darren Helm, Healthy, Col, C, FA, @Sea, W 2-1, 0, 0, 0, 0, 0, 0, 0, 0, 0, 0, 0, 0, 0, 0, 0, 0, --
Rasmus Asplund, Healthy, Nsh, C- LW- RW, FA, LA, W 5-3, 0, 0, 0, 0, 0, 0, 0, 0, 0, 0, 0, 0, 0, 0, 0, 0, --
Mark Friedman, Healthy, Pit, D, FA, --, --, 0, 0, 0, 0, 0, 0, 0, 0, 0, 0, 0, 0, 0, 0, 0, 0, --
Sam Gagner, O, Wpg, C- LW- RW, FA, @Ott, W 5-1, 0, 0, 0, 0, 0, 0, 0, 0, 0, 0, 0, 0, 0, 0, 0, 0, --
Logan Brown, Healthy, StL, C- LW, FA, Chi, L 3-5, 0, 0, 0, 0, 0, 0, 0, 0, 0, 0, 0, 0, 0, 0, 0, 0, --
Chris Wagner, Healthy, Bos, RW- C, FA, --, --, 0, 0, 0, 0, 0, 0, 0, 0, 0, 0, 0, 0, 0, 0, 0, 0, --
Owen Pickering, Healthy, Pit, D, FA, --, --, 0, 0, 0, 0, 0, 0, 0, 0, 0, 0, 0, 0, 0, 0, 0, 0, --
Ian Mitchell, Healthy, Chi, D, FA, @StL, W 5-3, 0, 0, 0, 0, 0, 0, 0, 0, 0, 0, 0, 0, 0, 0, 0, 0, --
Steven Santini, Healthy, StL, D, FA, Chi, L 3-5, 0, 0, 0, 0, 0, 0, 0, 0, 0, 0, 0, 0, 0, 0, 0, 0, --
Sean Farrell, Healthy, Mon, LW- C, FA, Tor, W 3-2, 0, 0, 0, 0, 0, 0, 0, 0, 0, 0, 0, 0, 0, 0, 0, 0, --
Matt Irwin, Healthy, Wsh, D, FA, @Vgk, L 2-6, 0, 0, 0, 0, 0, 0, 0, 0, 0, 0, 0, 0, 0, 0, 0, 0, --
Daniil Miromanov, Healthy, Vgk, D, FA, Wsh, W 6-2, 0, 0, 0, 0, 0, 0, 0, 0, 0, 0, 0, 0, 0, 0, 0, 0, --
Aliaksei Protas, Healthy, Wsh, C- RW, FA, @Vgk, L 2-6, 0, 0, 0, 0, 0, 0, 0, 0, 0, 0, 0, 0, 0, 0, 0, 0, --
Liam Foudy, Healthy, Cls, C- LW, FA, SJ, W 5-3, 0, 0, 0, 0, 0, 0, 0, 0, 0, 0, 0, 0, 0, 0, 0, 0, --
Jakub Lauko, Healthy, Bos, RW, FA, --, --, 0, 0, 0, 0, 0, 0, 0, 0, 0, 0, 0, 0, 0, 0, 0, 0, --
Sheldon Dries, Healthy, Van, C- LW, FA, Edm, L 2-4, 0, 0, 0, 0, 0, 0, 0, 0, 0, 0, 0, 0, 0, 0, 0, 0, --
Kale Clague, Healthy, Buf, D, FA, Ana, W 6-3, 0, 0, 0, 0, 0, 0, 0, 0, 0, 0, 0, 0, 0, 0, 0, 0, --
Sam Poulin, Healthy, Pit, RW- LW, FA, --, --, 0, 0, 0, 0, 0, 0, 0, 0, 0, 0, 0, 0, 0, 0, 0, 0, --
Nolan Foote, Healthy, NJ, LW, FA, --, --, 0, 0, 0, 0, 0, 0, 0, 0, 0, 0, 0, 0, 0, 0, 0, 0, --
Devin Shore, Healthy, Edm, C- LW, FA, @Van, W 4-2, 0, 0, 0, 0, 0, 0, 0, 0, 0, 0, 0, 0, 0, 0, 0, 0, --
"Drew OConnor", Healthy, Pit, LW, FA, --, --, 0, 0, 0, 0, 0, 0, 0, 0, 0, 0, 0, 0, 0, 0, 0, 0, --
Dan Renouf, Healthy, Bos, D, FA, --, --, 0, 0, 0, 0, 0, 0, 0, 0, 0, 0, 0, 0, 0, 0, 0, 0, --
Cole Guttman, Healthy, Chi, C, FA, @StL, W 5-3, 0, 0, 0, 0, 0, 0, 0, 0, 0, 0, 0, 0, 0, 0, 0, 0, --
Kevin Bahl, Healthy, NJ, D, FA, --, --, 0, 0, 0, 0, 0, 0, 0, 0, 0, 0, 0, 0, 0, 0, 0, 0, --
Casey Fitzgerald, Healthy, Fla, D, FA, Min, W 5-3, 0, 0, 0, 0, 0, 0, 0, 0, 0, 0, 0, 0, 0, 0, 0, 0, --
Tyler Kleven, Healthy, Ott, D, FA, Wpg, L 1-5, 0, 0, 0, 0, 0, 0, 0, 0, 0, 0, 0, 0, 0, 0, 0, 0, --
Urho Vaakanainen, IR, Ana, D, FA, @Buf, L 3-6, 0, 0, 0, 0, 0, 0, 0, 0, 0, 0, 0, 0, 0, 0, 0, 0, --
