Name, Health, NHL Team, Position, GFHL Team, Opponent, Score, GP, G, A, +/-, PIM, PPG, PPA, SHG, SHA, GWG, FOW, FOL, HAT, SOG, HIT, BLK, FPTS
Sebastian Aho, Healthy, Car, C, SALT, @NYI, W 5-2, 1, 3, 0, 3, 0, 0, 0, 0, 0, 1, 4, 7, 1, 3, 3, 2, 12.4
Alec Martinez, Healthy, Vgk, D, FA, Wsh, W 6-2, 1, 1, 1, 5, 0, 0, 0, 0, 0, 0, 0, 0, 0, 1, 3, 4, 9.0
Rasmus Andersson, Healthy, Cgy, D, HERB, TB, W 6-3, 1, 1, 2, 4, 0, 0, 1, 0, 0, 0, 0, 0, 0, 4, 1, 2, 8.95
Zach Hyman, Healthy, Edm, LW- RW, LKR, @Van, W 4-2, 1, 1, 3, 1, 0, 1, 0, 0, 0, 0, 0, 0, 0, 5, 0, 1, 8.5
Sam Lafferty, Healthy, Tor, C- LW, FA, @Mon, L 2-3, 1, 1, 1, 3, 2, 0, 0, 1, 0, 0, 6, 4, 0, 5, 5, 1, 8.5
Mark Scheifele, Healthy, Wpg, C, LKR, @Ott, W 5-1, 1, 2, 1, 3, 2, 0, 1, 0, 0, 1, 7, 7, 0, 2, 0, 0, 8.25
Radek Faksa, Healthy, Dal, C, FA, Ari, W 4-0, 1, 2, 0, 2, 0, 0, 0, 0, 0, 1, 7, 5, 0, 3, 3, 1, 7.9
Jason Dickinson, Healthy, Chi, C- LW, FA, @StL, W 5-3, 1, 1, 2, 3, 0, 0, 0, 0, 1, 0, 0, 6, 0, 1, 3, 0, 7.65
Rem Pitlick, Healthy, Mon, C- RW, FA, Tor, W 3-2, 1, 1, 1, 2, 0, 0, 0, 0, 0, 1, 0, 0, 0, 1, 2, 2, 7.2
Noah Hanifin, Healthy, Cgy, D, BOWS, TB, W 6-3, 1, 0, 3, 3, 0, 0, 0, 0, 0, 0, 0, 0, 0, 3, 1, 1, 7.1
Nikolaj Ehlers, Healthy, Wpg, LW- RW, BBS, @Ott, W 5-1, 1, 1, 2, 1, 0, 1, 1, 0, 0, 0, 0, 0, 0, 4, 1, 0, 6.95
Blake Wheeler, Healthy, Wpg, RW- C, FA, @Ott, W 5-1, 1, 1, 2, 3, 0, 0, 1, 0, 0, 0, 2, 1, 0, 1, 0, 0, 6.95
Matt Duchene, O, Nsh, C- RW, FA, LA, W 5-3, 1, 2, 0, 2, 0, 0, 0, 0, 0, 1, 1, 2, 0, 2, 2, 0, 6.7
Roman Josi, DTD, Nsh, D, SALT, LA, W 5-3, 1, 0, 3, 2, 2, 0, 1, 0, 0, 0, 0, 0, 0, 3, 1, 1, 6.65
Alex Pietrangelo, Healthy, Vgk, D, DINK, Wsh, W 6-2, 1, 0, 2, 5, 0, 0, 0, 0, 0, 0, 0, 0, 0, 1, 0, 2, 6.6
Trevor Zegras, Healthy, Ana, C, FA, @Buf, L 3-6, 1, 2, 1, 0, 0, 0, 0, 0, 0, 0, 9, 5, 0, 4, 1, 0, 6.6
Ilya Lyubushkin, Healthy, Buf, D, FA, Ana, W 6-3, 1, 0, 3, 2, 0, 0, 0, 0, 0, 0, 0, 0, 0, 3, 2, 0, 6.4
Paul Cotter, Healthy, Vgk, C, FA, Wsh, W 6-2, 1, 2, 0, 2, 0, 0, 0, 0, 0, 0, 0, 0, 0, 5, 3, 0, 6.4
Ryan Nugent-Hopkins, Healthy, Edm, C- LW, BBS, @Van, W 4-2, 1, 1, 2, 2, 0, 0, 1, 0, 0, 0, 2, 3, 0, 2, 0, 0, 6.35
Nicolas Roy, Healthy, Vgk, C- RW, FA, Wsh, W 6-2, 1, 1, 2, 2, 0, 0, 0, 0, 0, 0, 4, 7, 0, 1, 1, 0, 6.1
Gustav Nyquist, IR, Min, RW- LW, FA, @Fla, L 3-5, 1, 1, 1, 2, 0, 0, 0, 0, 0, 1, 0, 0, 0, 3, 1, 0, 6.1
Jordan Staal, Healthy, Car, C, FA, @NYI, W 5-2, 1, 1, 1, 1, 0, 0, 0, 0, 0, 0, 10, 11, 0, 4, 4, 1, 6.0
Dillon Dube, Healthy, Cgy, C- LW, FA, TB, W 6-3, 1, 1, 1, 1, 2, 0, 0, 0, 0, 1, 1, 0, 0, 2, 3, 0, 6.0
Victor Olofsson, Healthy, Buf, RW, FA, Ana, W 6-3, 1, 2, 0, 1, 0, 0, 0, 0, 0, 1, 0, 0, 0, 4, 0, 0, 5.9
Sam Reinhart, Healthy, Fla, RW- C, ME, Min, W 5-3, 1, 1, 1, 2, 0, 0, 0, 0, 0, 0, 1, 1, 0, 2, 3, 0, 5.6
Joel Eriksson Ek, Healthy, Min, C, ME, @Fla, L 3-5, 1, 1, 1, -1, 0, 1, 1, 0, 0, 0, 11, 8, 0, 7, 1, 1, 5.55
David Savard, O, Mon, D, OXP, Tor, W 3-2, 1, 0, 1, 1, 0, 0, 0, 0, 0, 0, 0, 0, 0, 2, 1, 6, 5.5
Kirill Kaprizov, O, Min, LW, CLB, @Fla, L 3-5, 1, 0, 3, 0, 0, 0, 2, 0, 0, 0, 0, 0, 0, 1, 1, 0, 5.4
Boone Jenner, Healthy, Cls, C- LW, BBS, SJ, W 5-3, 1, 1, 0, 2, 0, 0, 0, 0, 0, 0, 8, 3, 0, 5, 3, 1, 5.4
Cody Glass, Healthy, Nsh, C, FA, LA, W 5-3, 1, 0, 2, 2, 2, 0, 0, 0, 0, 0, 9, 6, 0, 1, 2, 1, 5.3
Connor McDavid, Healthy, Edm, C, DINK, @Van, W 4-2, 1, 1, 1, 0, 0, 0, 1, 0, 0, 0, 6, 6, 0, 7, 1, 1, 5.25
Nick Blankenburg, DTD, Cls, D, FA, SJ, W 5-3, 1, 0, 2, 1, 0, 0, 1, 0, 0, 0, 0, 0, 0, 0, 1, 2, 5.05
Chandler Stephenson, Healthy, Vgk, C- LW- RW, HERB, Wsh, W 6-2, 1, 0, 2, 2, 0, 0, 0, 0, 0, 0, 6, 2, 0, 0, 0, 1, 4.9
Anton Lundell, Healthy, Fla, C, FA, Min, W 5-3, 1, 1, 1, 2, 0, 0, 0, 0, 0, 0, 1, 0, 0, 3, 0, 0, 4.9
Alexandre Carrier, O, Nsh, D, FA, LA, W 5-3, 1, 0, 2, 1, 0, 0, 0, 0, 0, 0, 0, 0, 0, 1, 1, 2, 4.9
Mikael Granlund, Healthy, Pit, LW- C- RW, FA, --, --, 1, 1, 1, -1, 2, 0, 1, 0, 0, 0, 0, 1, 0, 2, 4, 1, 4.85
Johnny Gaudreau, Healthy, Cls, LW, BOWS, SJ, W 5-3, 1, 1, 1, 1, 0, 1, 0, 0, 0, 0, 0, 0, 0, 3, 0, 0, 4.8
Patrik Laine, O, Cls, RW- LW, SLC, SJ, W 5-3, 1, 1, 1, 1, 0, 0, 1, 0, 0, 0, 0, 0, 0, 5, 0, 0, 4.75
Ryan Johansen, O, Nsh, C, FA, LA, W 5-3, 1, 1, 1, -1, 0, 1, 0, 0, 0, 0, 11, 7, 0, 3, 0, 1, 4.7
Quinton Byfield, Healthy, LA, C, FA, @Nsh, L 3-5, 1, 1, 0, 1, 0, 1, 0, 0, 0, 0, 0, 1, 0, 4, 3, 1, 4.7
Josh Anderson, O, Mon, RW, FA, Tor, W 3-2, 1, 1, 0, 1, 0, 0, 0, 0, 0, 0, 0, 1, 0, 4, 6, 0, 4.6
Andreas Athanasiou, Healthy, Chi, LW- RW, FA, @StL, W 5-3, 1, 1, 0, 2, 0, 0, 0, 0, 0, 1, 0, 0, 0, 1, 0, 1, 4.6
Peyton Krebs, Healthy, Buf, C- LW, FA, Ana, W 6-3, 1, 2, 0, 2, 5, 0, 0, 0, 0, 0, 3, 5, 0, 3, 0, 0, 4.6
Drew Doughty, Healthy, LA, D, ME, @Nsh, L 3-5, 1, 0, 1, 0, 0, 0, 0, 0, 0, 0, 0, 0, 0, 2, 1, 5, 4.5
Gustav Forsling, Healthy, Fla, D, HERB, Min, W 5-3, 1, 1, 0, 1, 0, 0, 0, 0, 0, 1, 0, 0, 0, 1, 3, 0, 4.5
Matt Boldy, Healthy, Min, LW- RW, FA, @Fla, L 3-5, 1, 1, 1, 0, 0, 1, 0, 0, 0, 0, 0, 0, 0, 4, 0, 0, 4.4
Nate Schmidt, Healthy, Wpg, D, FA, @Ott, W 5-1, 1, 0, 1, 2, 0, 0, 0, 0, 0, 0, 0, 0, 0, 4, 0, 3, 4.4
Noah Cates, Healthy, Phi, LW, FA, @Det, W 2-1, 1, 1, 0, 1, 0, 0, 0, 0, 0, 1, 6, 7, 0, 2, 1, 1, 4.4
Jesper Fast, Healthy, Car, RW, FA, @NYI, W 5-2, 1, 1, 0, 1, 0, 0, 0, 0, 0, 0, 0, 0, 0, 1, 1, 3, 4.4
Miro Heiskanen, Healthy, Dal, D, LKR, Ari, W 4-0, 1, 0, 2, 1, 0, 0, 1, 0, 0, 0, 0, 0, 0, 1, 0, 1, 4.35
Blake Coleman, Healthy, Cgy, LW- RW, FA, TB, W 6-3, 1, 1, 0, 2, 4, 0, 0, 0, 0, 0, 0, 0, 0, 6, 2, 1, 4.3
Jordan Kyrou, Healthy, StL, C- LW- RW, ME, Chi, L 3-5, 1, 1, 1, 0, 0, 1, 0, 0, 0, 0, 0, 0, 0, 3, 0, 0, 4.3
Byron Froese, Healthy, Vgk, C, FA, Wsh, W 6-2, 1, 1, 0, 1, 0, 0, 0, 0, 0, 0, 8, 1, 0, 2, 1, 1, 4.2
Anze Kopitar, Healthy, LA, C, LKR, @Nsh, L 3-5, 1, 0, 2, 1, 0, 0, 0, 0, 0, 0, 10, 13, 0, 1, 1, 1, 4.1
Vince Dunn, Healthy, Sea, D, LKR, Col, L 1-2, 1, 0, 0, 1, 0, 0, 0, 0, 0, 0, 0, 0, 0, 1, 5, 4, 4.1
Teuvo Teravainen, DTD, Car, RW- LW, FA, @NYI, W 5-2, 1, 0, 2, 2, 0, 0, 0, 0, 0, 0, 1, 0, 0, 0, 0, 0, 4.1
T.J. Oshie, O, Wsh, RW, BOWS, @Vgk, L 2-6, 1, 1, 0, 1, 0, 0, 0, 0, 0, 0, 2, 2, 0, 2, 3, 1, 4.1
Wyatt Johnston, Healthy, Dal, C, FA, Ari, W 4-0, 1, 1, 0, 1, 0, 0, 0, 0, 0, 0, 6, 1, 0, 5, 2, 0, 4.1
Nick Bonino, IR, Pit, C- LW, FA, --, --, 1, 1, 0, 2, 0, 0, 0, 0, 0, 0, 2, 1, 0, 2, 1, 1, 4.1
Simon Benoit, Healthy, Ana, D, FA, @Buf, L 3-6, 1, 1, 0, 1, 0, 0, 0, 0, 0, 0, 0, 0, 0, 2, 3, 1, 4.1
Nico Sturm, Healthy, SJ, C, FA, @Cls, L 3-5, 1, 1, 1, 1, 0, 0, 0, 0, 0, 0, 7, 6, 0, 0, 0, 0, 4.1
Jalen Chatfield, Healthy, Car, D, FA, @NYI, W 5-2, 1, 0, 1, 4, 0, 0, 0, 0, 0, 0, 0, 0, 0, 1, 0, 1, 4.1
Leon Draisaitl, Healthy, Edm, LW- C, SALT, @Van, W 4-2, 1, 1, 0, 1, 0, 0, 0, 0, 0, 1, 10, 6, 0, 1, 0, 0, 4.0
Ivan Provorov, Healthy, Phi, D, LKR, @Det, W 2-1, 1, 0, 0, 0, 0, 0, 0, 0, 0, 0, 0, 0, 0, 0, 0, 8, 4.0
Cole Perfetti, IR, Wpg, C- LW- RW, FA, @Ott, W 5-1, 1, 1, 0, 0, 0, 1, 0, 0, 0, 0, 0, 0, 0, 2, 1, 2, 4.0
Grigori Denisenko, Healthy, Fla, LW, FA, Min, W 5-3, 1, 0, 1, 2, 0, 0, 0, 0, 0, 0, 0, 0, 0, 2, 1, 2, 4.0
Reese Johnson, Healthy, Chi, RW- C, FA, @StL, W 5-3, 1, 1, 0, 0, 0, 0, 0, 0, 0, 0, 3, 2, 0, 2, 4, 1, 4.0
Steven Stamkos, Healthy, TB, C- LW- RW, HERB, @Cgy, L 3-6, 1, 1, 0, 0, 0, 0, 0, 0, 0, 0, 13, 3, 0, 1, 1, 1, 3.9
Quinn Hughes, Healthy, Van, D, HERB, Edm, L 2-4, 1, 0, 2, 0, 0, 0, 0, 0, 0, 0, 0, 0, 0, 1, 1, 1, 3.9
Scott Laughton, Healthy, Phi, C- RW, DINK, @Det, W 2-1, 1, 1, 0, 1, 0, 0, 0, 0, 0, 0, 7, 16, 0, 2, 2, 3, 3.9
Michael Pezzetta, Healthy, Mon, C- LW- RW, FA, Tor, W 3-2, 1, 0, 1, 0, 0, 0, 0, 0, 0, 0, 0, 0, 0, 1, 6, 1, 3.9
Cole Smith, O, Nsh, LW, FA, LA, W 5-3, 1, 1, 0, 1, 0, 0, 0, 0, 0, 0, 0, 0, 0, 2, 4, 0, 3.9
Tyler Toffoli, Healthy, Cgy, RW- LW, SLC, TB, W 6-3, 1, 1, 1, 0, 2, 0, 1, 0, 0, 0, 0, 0, 0, 3, 0, 0, 3.85
Brent Burns, Healthy, Car, D, BBS, @NYI, W 5-2, 1, 0, 1, 3, 0, 0, 0, 0, 0, 0, 0, 0, 0, 3, 0, 1, 3.8
Seth Jones, Healthy, Chi, D, BOWS, @StL, W 5-3, 1, 0, 1, 1, 0, 0, 0, 0, 0, 0, 0, 0, 0, 1, 4, 1, 3.8
Ivan Barbashev, Healthy, Vgk, C- LW- RW, FA, Wsh, W 6-2, 1, 1, 1, -1, 5, 0, 0, 0, 0, 0, 3, 0, 0, 2, 1, 1, 3.8
Kent Johnson, Healthy, Cls, C- LW, FA, SJ, W 5-3, 1, 0, 2, 2, 0, 0, 0, 0, 0, 0, 0, 2, 0, 0, 0, 0, 3.8
Michael Amadio, Healthy, Vgk, C- RW, FA, Wsh, W 6-2, 1, 1, 0, 1, 0, 0, 0, 0, 0, 1, 0, 0, 0, 3, 0, 0, 3.8
Phillip Danault, Healthy, LA, C, FA, @Nsh, L 3-5, 1, 0, 1, -1, 0, 0, 1, 0, 0, 0, 8, 8, 0, 3, 4, 2, 3.75
Mikael Backlund, Healthy, Cgy, C, CLB, TB, W 6-3, 1, 0, 2, 1, 0, 0, 0, 0, 0, 0, 6, 14, 0, 2, 1, 1, 3.7
Garnet Hathaway, Healthy, Bos, RW- LW, FA, --, --, 1, 0, 0, 0, 0, 0, 0, 0, 0, 0, 0, 0, 0, 0, 9, 2, 3.7
Keegan Kolesar, Healthy, Vgk, RW, FA, Wsh, W 6-2, 1, 0, 1, 2, 2, 0, 0, 0, 0, 0, 0, 0, 0, 2, 4, 0, 3.7
Colin Miller, Healthy, Dal, D, FA, Ari, W 4-0, 1, 0, 1, 1, 2, 0, 0, 0, 0, 0, 0, 0, 0, 3, 2, 2, 3.7
Alex Tuch, Healthy, Buf, RW, LKR, Ana, W 6-3, 1, 0, 2, 0, 0, 0, 1, 0, 0, 0, 0, 0, 0, 4, 0, 0, 3.65
Mitchell Marner, DTD, Tor, RW, OXP, @Mon, L 2-3, 1, 0, 1, 1, 0, 0, 0, 0, 0, 0, 0, 0, 0, 6, 0, 2, 3.6
Owen Power, Healthy, Buf, D, SLC, Ana, W 6-3, 1, 0, 1, 1, 0, 0, 0, 0, 0, 0, 0, 0, 0, 1, 0, 3, 3.6
Radko Gudas, Healthy, Fla, D, BOWS, Min, W 5-3, 1, 0, 0, 1, 0, 0, 0, 0, 0, 0, 0, 0, 0, 0, 7, 2, 3.6
Marc Staal, Healthy, Fla, D, FA, Min, W 5-3, 1, 0, 1, 1, 0, 0, 0, 0, 0, 0, 0, 0, 0, 2, 3, 1, 3.6
Rasmus Dahlin, Healthy, Buf, D, BBS, Ana, W 6-3, 1, 0, 2, 0, 2, 0, 0, 0, 0, 0, 0, 0, 0, 2, 0, 1, 3.5
Aleksander Barkov, Healthy, Fla, C, SALT, Min, W 5-3, 1, 0, 1, 2, 0, 0, 0, 0, 0, 0, 8, 9, 0, 1, 0, 2, 3.5
Mark Giordano, DTD, Tor, D, FA, @Mon, L 2-3, 1, 1, 0, 0, 2, 0, 0, 0, 0, 0, 0, 0, 0, 2, 0, 3, 3.5
Sean Kuraly, Healthy, Cls, C- LW, FA, SJ, W 5-3, 1, 1, 0, 0, 0, 0, 0, 0, 0, 0, 9, 7, 0, 1, 4, 0, 3.5
Wade Allison, Healthy, Phi, RW, FA, @Det, W 2-1, 1, 0, 1, 1, 0, 0, 0, 0, 0, 0, 0, 0, 0, 1, 3, 1, 3.5
Jack Johnson, Healthy, Col, D, FA, @Sea, W 2-1, 1, 0, 0, 3, 0, 0, 0, 0, 0, 0, 0, 0, 0, 0, 0, 4, 3.5
Fredrik Olofsson, Healthy, Dal, LW, FA, Ari, W 4-0, 1, 0, 1, 2, 0, 0, 0, 0, 0, 0, 1, 1, 0, 1, 3, 0, 3.5
Brandon Montour, Healthy, Fla, D, CLB, Min, W 5-3, 1, 0, 1, 3, 10, 0, 1, 0, 0, 0, 0, 0, 0, 2, 0, 2, 3.45
Claude Giroux, Healthy, Ott, LW- C- RW, CLB, Wpg, L 1-5, 1, 0, 1, 1, 0, 0, 0, 0, 0, 0, 18, 8, 0, 1, 1, 0, 3.4
Timo Meier, Healthy, NJ, RW- LW, SALT, --, --, 1, 1, 0, 0, 0, 0, 0, 0, 0, 0, 0, 0, 0, 5, 3, 0, 3.4
Cody Ceci, Healthy, Edm, D, FA, @Van, W 4-2, 1, 0, 0, 2, 0, 0, 0, 0, 0, 0, 0, 0, 0, 1, 1, 4, 3.4
Vladislav Namestnikov, Healthy, Wpg, C- LW, FA, @Ott, W 5-1, 1, 1, 0, 1, 0, 0, 0, 0, 0, 0, 0, 0, 0, 3, 2, 0, 3.4
Tyler Johnson, Healthy, Chi, C- RW, FA, @StL, W 5-3, 1, 0, 1, 1, 0, 0, 0, 0, 0, 0, 0, 0, 0, 3, 0, 2, 3.3
Nathan Beaulieu, Healthy, Ana, D, FA, @Buf, L 3-6, 1, 0, 1, -1, 0, 0, 0, 0, 0, 0, 0, 0, 0, 4, 3, 2, 3.3
Auston Matthews, Healthy, Tor, C, BOWS, @Mon, L 2-3, 1, 0, 1, -1, 0, 0, 0, 0, 0, 0, 8, 2, 0, 3, 1, 2, 3.2
Jamie Benn, Healthy, Dal, LW- C, LKR, Ari, W 4-0, 1, 1, 0, 1, 0, 1, 0, 0, 0, 0, 3, 2, 0, 1, 0, 0, 3.2
Dylan Cozens, Healthy, Buf, C- LW, FA, Ana, W 6-3, 1, 1, 0, 1, 0, 0, 0, 0, 0, 0, 11, 7, 0, 3, 0, 0, 3.2
Connor Murphy, Healthy, Chi, D, FA, @StL, W 5-3, 1, 0, 0, 3, 2, 0, 0, 0, 0, 0, 0, 0, 0, 0, 3, 2, 3.2
Carter Verhaeghe, Healthy, Fla, C- LW, HERB, Min, W 5-3, 1, 1, 0, -1, 2, 1, 0, 0, 0, 0, 0, 1, 0, 4, 2, 1, 3.2
Moritz Seider, Healthy, Det, D, SALT, Phi, L 1-2, 1, 0, 1, 1, 0, 0, 0, 0, 0, 0, 0, 0, 0, 1, 0, 2, 3.1
Adrian Kempe, Healthy, LA, C- LW- RW, DINK, @Nsh, L 3-5, 1, 1, 0, 1, 0, 0, 0, 0, 0, 0, 0, 0, 0, 3, 1, 0, 3.1
Trevor van Riemsdyk, O, Wsh, D, FA, @Vgk, L 2-6, 1, 0, 1, 2, 0, 0, 0, 0, 0, 0, 0, 0, 0, 1, 0, 1, 3.1
Jani Hakanpaa, Healthy, Dal, D, HERB, Ari, W 4-0, 1, 0, 1, 2, 0, 0, 0, 0, 0, 0, 0, 0, 0, 1, 0, 1, 3.1
Denis Gurianov, Healthy, Mon, LW- RW, FA, Tor, W 3-2, 1, 0, 1, 2, 0, 0, 0, 0, 0, 0, 0, 0, 0, 3, 1, 0, 3.1
Patrick Brown, Healthy, Ott, C- RW, FA, Wpg, L 1-5, 1, 0, 0, 0, 0, 0, 0, 0, 0, 0, 6, 2, 0, 2, 5, 2, 3.1
Rafael Harvey-Pinard, DTD, Mon, LW- RW, DINK, Tor, W 3-2, 1, 1, 0, 0, 0, 0, 0, 0, 0, 0, 0, 0, 0, 2, 3, 0, 3.1
Jeff Skinner, Healthy, Buf, LW- RW, LKR, Ana, W 6-3, 1, 1, 0, 0, 0, 1, 0, 0, 0, 0, 0, 2, 0, 2, 0, 1, 3.0
Ryan McDonagh, Healthy, Nsh, D, FA, LA, W 5-3, 1, 0, 0, 2, 0, 0, 0, 0, 0, 0, 0, 0, 0, 2, 1, 3, 3.0
Brenden Dillon, Healthy, Wpg, D, FA, @Ott, W 5-1, 1, 0, 0, 0, 0, 0, 0, 0, 0, 0, 0, 0, 0, 1, 3, 4, 3.0
Justin Faulk, Healthy, StL, D, FA, Chi, L 3-5, 1, 0, 1, 0, 0, 0, 1, 0, 0, 0, 0, 0, 0, 2, 0, 2, 2.95
Elias Pettersson, Healthy, Van, C, SLC, Edm, L 2-4, 1, 0, 1, 0, 0, 0, 0, 0, 0, 0, 7, 7, 0, 3, 2, 1, 2.9
Erik Karlsson, Healthy, SJ, D, CLB, @Cls, L 3-5, 1, 0, 0, 0, 0, 0, 0, 0, 0, 0, 0, 0, 0, 1, 1, 5, 2.9
Elias Lindholm, Healthy, Cgy, RW- C, CLB, TB, W 6-3, 1, 0, 1, 1, 0, 0, 0, 0, 0, 0, 7, 12, 0, 1, 1, 2, 2.9
Filip Forsberg, IR, Nsh, LW, CLB, LA, W 5-3, 1, 0, 0, 2, 0, 0, 0, 0, 0, 0, 0, 0, 0, 7, 4, 0, 2.9
Josh Norris, IR, Ott, C, SLC, Wpg, L 1-5, 1, 1, 0, 1, 2, 0, 0, 0, 0, 0, 0, 0, 0, 3, 1, 0, 2.9
Kevin Hayes, Healthy, Phi, C, FA, @Det, W 2-1, 1, 0, 1, 1, 0, 0, 0, 0, 0, 0, 2, 1, 0, 3, 0, 1, 2.9
Mattias Ekholm, Healthy, Edm, D, FA, @Van, W 4-2, 1, 0, 0, 1, 0, 0, 0, 0, 0, 0, 0, 0, 0, 1, 1, 4, 2.9
Ryan Donato, Healthy, Sea, RW- LW, FA, Col, L 1-2, 1, 1, 0, 1, 0, 0, 0, 0, 0, 0, 0, 0, 0, 1, 1, 0, 2.9
Jonas Rondbjerg, Healthy, Vgk, RW, FA, Wsh, W 6-2, 1, 0, 1, 1, 0, 0, 0, 0, 0, 0, 0, 0, 0, 1, 1, 1, 2.9
Sean Durzi, Healthy, LA, D, HERB, @Nsh, L 3-5, 1, 1, 1, -2, 2, 0, 1, 0, 0, 0, 0, 0, 0, 3, 0, 0, 2.85
Tomas Hertl, Healthy, SJ, C, BOWS, @Cls, L 3-5, 1, 0, 1, 1, 0, 0, 0, 0, 0, 0, 12, 5, 0, 1, 0, 0, 2.8
Mike Matheson, Healthy, Mon, D, FA, Tor, W 3-2, 1, 0, 0, 1, 2, 0, 0, 0, 0, 0, 0, 0, 0, 2, 1, 4, 2.8
Max Domi, Healthy, Dal, C- LW- RW, FA, Ari, W 4-0, 1, 1, 0, 1, 0, 0, 0, 0, 0, 0, 8, 7, 0, 2, 0, 0, 2.8
Alex Newhook, Healthy, Col, C- LW, FA, @Sea, W 2-1, 1, 1, 0, 1, 0, 0, 0, 0, 0, 0, 2, 0, 0, 1, 0, 0, 2.8
Eetu Luostarinen, Healthy, Fla, C- LW, FA, Min, W 5-3, 1, 1, 0, 0, 0, 0, 0, 0, 0, 0, 9, 8, 0, 1, 2, 0, 2.8
Juuso Parssinen, DTD, Nsh, C, BOWS, LA, W 5-3, 1, 0, 1, 1, 0, 0, 0, 0, 0, 0, 3, 1, 0, 0, 2, 0, 2.8
Zach Bogosian, Healthy, TB, D, FA, @Cgy, L 3-6, 1, 0, 0, 0, 2, 0, 0, 0, 0, 0, 0, 0, 0, 0, 5, 3, 2.8
Axel Jonsson-Fjallby, Healthy, Wpg, LW, FA, @Ott, W 5-1, 1, 0, 1, 1, 0, 0, 0, 0, 0, 0, 0, 0, 0, 0, 1, 1, 2.8
Josh Morrissey, Healthy, Wpg, D, LKR, @Ott, W 5-1, 1, 0, 1, 0, 2, 0, 1, 0, 0, 0, 0, 0, 0, 2, 0, 2, 2.75
Kyle Connor, Healthy, Wpg, LW, BBS, @Ott, W 5-1, 1, 0, 1, 1, 0, 0, 0, 0, 0, 0, 0, 0, 0, 7, 0, 0, 2.7
Jared Spurgeon, Healthy, Min, D, DINK, @Fla, L 3-5, 1, 1, 0, -1, 0, 0, 0, 0, 0, 0, 0, 0, 0, 4, 1, 1, 2.7
Esa Lindell, Healthy, Dal, D, ME, Ari, W 4-0, 1, 0, 1, 2, 0, 0, 0, 0, 0, 0, 0, 0, 0, 2, 0, 0, 2.7
Conor Timmins, Healthy, Tor, D, FA, @Mon, L 2-3, 1, 0, 1, 0, 0, 0, 0, 0, 0, 0, 0, 0, 0, 1, 2, 1, 2.7
Colin Blackwell, O, Chi, C, FA, @StL, W 5-3, 1, 0, 1, 0, 0, 0, 0, 0, 0, 0, 0, 0, 0, 0, 4, 0, 2.7
Simon Holmstrom, Healthy, NYI, RW, FA, Car, L 2-5, 1, 1, 0, 1, 0, 0, 0, 0, 0, 0, 0, 0, 0, 2, 0, 0, 2.7
Andrew Mangiapane, Healthy, Cgy, LW- RW, FA, TB, W 6-3, 1, 0, 1, 0, 0, 0, 0, 0, 0, 0, 0, 0, 0, 3, 1, 1, 2.6
Andrew Peeke, Healthy, Cls, D, FA, SJ, W 5-3, 1, 0, 1, 2, 0, 0, 0, 0, 0, 0, 0, 0, 0, 1, 0, 0, 2.6
Pat Maroon, Healthy, TB, LW- RW, FA, @Cgy, L 3-6, 1, 0, 1, 1, 0, 0, 0, 0, 0, 0, 0, 0, 0, 0, 2, 0, 2.6
Yakov Trenin, Healthy, Nsh, C- LW, FA, LA, W 5-3, 1, 0, 0, 0, 0, 0, 0, 0, 0, 0, 0, 0, 0, 0, 7, 1, 2.6
Jason Robertson, Healthy, Dal, LW, ME, Ari, W 4-0, 1, 0, 1, 0, 0, 0, 1, 0, 0, 0, 0, 0, 0, 5, 1, 0, 2.55
William Nylander, Healthy, Tor, RW- LW, LKR, @Mon, L 2-3, 1, 0, 1, 0, 2, 0, 0, 0, 0, 0, 0, 0, 0, 7, 0, 1, 2.5
Kyle Okposo, Healthy, Buf, RW, FA, Ana, W 6-3, 1, 0, 1, 1, 0, 0, 0, 0, 0, 0, 1, 1, 0, 2, 1, 0, 2.5
Nicolas Hague, Healthy, Vgk, D, FA, Wsh, W 6-2, 1, 0, 0, 0, 2, 0, 0, 0, 0, 0, 0, 0, 0, 0, 4, 3, 2.5
Tyson Jost, Healthy, Buf, C- LW, FA, Ana, W 6-3, 1, 0, 1, 2, 0, 0, 0, 0, 0, 0, 4, 5, 0, 1, 0, 0, 2.5
Nick Holden, Healthy, Ott, D, FA, Wpg, L 1-5, 1, 0, 0, 1, 0, 0, 0, 0, 0, 0, 0, 0, 0, 1, 3, 2, 2.5
Cale Fleury, Healthy, Sea, D, FA, Col, L 1-2, 1, 0, 0, -1, 0, 0, 0, 0, 0, 0, 0, 0, 0, 0, 5, 3, 2.5
Adam Larsson, Healthy, Sea, D, DINK, Col, L 1-2, 1, 0, 0, 1, 0, 0, 0, 0, 0, 0, 0, 0, 0, 1, 1, 3, 2.4
Anders Lee, Healthy, NYI, LW, FA, Car, L 2-5, 1, 0, 1, 0, 0, 0, 0, 0, 0, 0, 0, 0, 0, 1, 1, 1, 2.4
Dominik Kubalik, Healthy, Det, LW- RW, FA, Phi, L 1-2, 1, 0, 1, -1, 0, 0, 0, 0, 0, 0, 1, 0, 0, 2, 2, 1, 2.4
Nick Seeler, Healthy, Phi, D, FA, @Det, W 2-1, 1, 0, 0, 1, 0, 0, 0, 0, 0, 0, 0, 0, 0, 1, 1, 3, 2.4
Noah Gregor, Healthy, SJ, C- LW- RW, FA, @Cls, L 3-5, 1, 0, 1, 2, 4, 0, 0, 0, 0, 0, 0, 0, 0, 3, 0, 0, 2.4
Jacob MacDonald, Healthy, SJ, D, FA, @Cls, L 3-5, 1, 0, 1, 1, 0, 0, 0, 0, 0, 0, 0, 0, 0, 1, 1, 0, 2.4
Jonathan Huberdeau, Healthy, Cgy, LW, LKR, TB, W 6-3, 1, 1, 0, 0, 0, 0, 0, 0, 0, 0, 0, 0, 0, 3, 0, 0, 2.3
Travis Konecny, Healthy, Phi, RW- LW, SALT, @Det, W 2-1, 1, 0, 1, 1, 2, 0, 0, 0, 0, 0, 0, 1, 0, 3, 1, 0, 2.3
Neal Pionk, Healthy, Wpg, D, OXP, @Ott, W 5-1, 1, 0, 1, 0, 2, 0, 0, 0, 0, 0, 0, 0, 0, 2, 1, 1, 2.3
Evgeny Kuznetsov, Healthy, Wsh, C, FA, @Vgk, L 2-6, 1, 0, 1, 0, 0, 0, 0, 0, 0, 0, 5, 6, 0, 3, 2, 0, 2.3
Jack Roslovic, DTD, Cls, C, FA, SJ, W 5-3, 1, 0, 1, 1, 0, 0, 0, 0, 0, 0, 6, 9, 0, 3, 1, 0, 2.3
Zach Parise, Healthy, NYI, LW, FA, Car, L 2-5, 1, 0, 0, 0, 0, 0, 0, 0, 0, 0, 0, 0, 0, 2, 2, 3, 2.3
Calle Jarnkrok, Healthy, Tor, C- LW- RW, FA, @Mon, L 2-3, 1, 1, 0, 1, 2, 0, 0, 0, 0, 0, 0, 1, 0, 1, 0, 0, 2.3
Jaycob Megna, Healthy, Sea, D, FA, Col, L 1-2, 1, 0, 1, 1, 0, 0, 0, 0, 0, 0, 0, 0, 0, 0, 1, 0, 2.3
Nick Leddy, Healthy, StL, D, FA, Chi, L 3-5, 1, 1, 0, 0, 0, 0, 0, 0, 0, 0, 0, 0, 0, 3, 0, 0, 2.3
Will Borgen, Healthy, Sea, D, FA, Col, L 1-2, 1, 0, 0, 0, 0, 0, 0, 0, 0, 0, 0, 0, 0, 2, 2, 3, 2.3
Henri Jokiharju, Healthy, Buf, D, FA, Ana, W 6-3, 1, 0, 0, 0, 0, 0, 0, 0, 0, 0, 0, 0, 0, 1, 4, 2, 2.3
Dylan Samberg, Healthy, Wpg, D, FA, @Ott, W 5-1, 1, 0, 0, 2, 0, 0, 0, 0, 0, 0, 0, 0, 0, 0, 1, 2, 2.3
MacKenzie Entwistle, Healthy, Chi, RW- C, FA, @StL, W 5-3, 1, 0, 1, 0, 2, 0, 0, 0, 0, 0, 1, 0, 0, 0, 3, 0, 2.3
Colton Parayko, Healthy, StL, D, FA, Chi, L 3-5, 1, 0, 1, -1, 0, 0, 0, 0, 0, 0, 0, 0, 0, 1, 2, 1, 2.2
Marcus Johansson, Healthy, Min, LW- C- RW, FA, @Fla, L 3-5, 1, 1, 0, 0, 0, 0, 0, 0, 0, 0, 1, 0, 0, 1, 0, 0, 2.2
Cam York, Healthy, Phi, D, FA, @Det, W 2-1, 1, 0, 0, 0, 0, 0, 0, 0, 0, 0, 0, 0, 0, 2, 0, 4, 2.2
"Logan OConnor", Healthy, Col, RW- LW, FA, @Sea, W 2-1, 1, 0, 0, 1, 0, 0, 0, 0, 0, 0, 0, 0, 0, 0, 4, 1, 2.2
Milan Lucic, Healthy, Cgy, LW, FA, TB, W 6-3, 1, 0, 1, 1, 5, 0, 0, 0, 0, 0, 0, 1, 0, 2, 2, 0, 2.2
Nick Cousins, Healthy, Fla, C- LW- RW, FA, Min, W 5-3, 1, 0, 1, 2, 5, 0, 0, 0, 0, 0, 0, 0, 0, 2, 0, 0, 2.2
Nazem Kadri, Healthy, Cgy, C, ME, TB, W 6-3, 1, 1, 0, 0, 2, 1, 0, 0, 0, 0, 5, 10, 0, 3, 0, 0, 2.1
Jonathan Marchessault, Healthy, Vgk, LW, BOWS, Wsh, W 6-2, 1, 0, 1, 1, 0, 0, 0, 0, 0, 0, 0, 0, 0, 1, 0, 0, 2.1
Lucas Raymond, Healthy, Det, LW- RW, BOWS, Phi, L 1-2, 1, 1, 0, -1, 0, 0, 0, 0, 0, 0, 0, 0, 0, 6, 0, 0, 2.1
Luke Schenn, Healthy, Tor, D, FA, @Mon, L 2-3, 1, 0, 0, 1, 0, 0, 0, 0, 0, 0, 0, 0, 0, 4, 4, 0, 2.1
Pierre-Edouard Bellemare, Healthy, TB, RW- C, FA, @Cgy, L 3-6, 1, 0, 0, 0, 0, 0, 0, 0, 0, 0, 7, 2, 0, 1, 0, 3, 2.1
Parker Wotherspoon, Healthy, NYI, D, FA, Car, L 2-5, 1, 0, 0, 2, 0, 0, 0, 0, 0, 0, 0, 0, 0, 0, 2, 1, 2.1
Matt Martin, Healthy, NYI, LW, FA, Car, L 2-5, 1, 0, 0, 0, 2, 0, 0, 0, 0, 0, 0, 0, 0, 0, 6, 1, 2.1
Artturi Lehkonen, O, Col, LW- RW, FA, @Sea, W 2-1, 1, 0, 1, 0, 0, 0, 0, 0, 0, 0, 0, 0, 0, 2, 1, 0, 2.0
Ben Chiarot, Healthy, Det, D, FA, Phi, L 1-2, 1, 0, 0, -1, 0, 0, 0, 0, 0, 0, 0, 0, 0, 1, 3, 3, 2.0
Mikey Anderson, DTD, LA, D, FA, @Nsh, L 3-5, 1, 0, 0, 0, 0, 0, 0, 0, 0, 0, 0, 0, 0, 0, 5, 1, 2.0
Paul Stastny, Healthy, Car, C- LW, FA, @NYI, W 5-2, 1, 0, 0, 1, 0, 0, 0, 0, 0, 0, 8, 4, 0, 1, 0, 2, 2.0
Michael Rasmussen, IR, Det, C- LW, FA, Phi, L 1-2, 1, 0, 0, 0, 2, 0, 0, 0, 0, 0, 3, 0, 0, 2, 4, 1, 2.0
Nicholas Paul, Healthy, TB, C- LW, FA, @Cgy, L 3-6, 1, 0, 1, 0, 2, 0, 0, 0, 0, 0, 7, 7, 0, 0, 2, 0, 1.9
J.T. Miller, Healthy, Van, C- LW, HERB, Edm, L 2-4, 1, 1, 0, -1, 0, 0, 0, 0, 0, 0, 0, 0, 0, 1, 1, 0, 1.9
Jack Eichel, Healthy, Vgk, C, BBS, Wsh, W 6-2, 1, 0, 0, 2, 0, 0, 0, 0, 0, 0, 4, 5, 0, 0, 0, 2, 1.9
Tony DeAngelo, Healthy, Phi, D, FA, @Det, W 2-1, 1, 0, 0, 0, 0, 0, 0, 0, 0, 0, 0, 0, 0, 3, 2, 2, 1.9
Max Comtois, Healthy, Ana, LW, FA, @Buf, L 3-6, 1, 0, 1, 0, 0, 0, 0, 0, 0, 0, 0, 0, 0, 1, 1, 0, 1.9
Johnathan Kovacevic, Healthy, Mon, D, FA, Tor, W 3-2, 1, 0, 0, 1, 0, 0, 0, 0, 0, 0, 0, 0, 0, 1, 1, 2, 1.9
Matthew Tkachuk, Healthy, Fla, LW- RW, CLB, Min, W 5-3, 1, 0, 1, -1, 0, 0, 1, 0, 0, 0, 0, 0, 0, 3, 1, 0, 1.85
Calen Addison, Healthy, Min, D, FA, @Fla, L 3-5, 1, 0, 1, -2, 0, 0, 1, 0, 0, 0, 0, 0, 0, 1, 0, 2, 1.85
Nick Suzuki, Healthy, Mon, C, OXP, Tor, W 3-2, 1, 0, 1, 1, 0, 0, 0, 0, 0, 0, 6, 13, 0, 2, 1, 0, 1.8
Robert Thomas, DTD, StL, C- RW, ME, Chi, L 3-5, 1, 0, 1, 0, 2, 0, 0, 0, 0, 0, 4, 7, 0, 3, 0, 1, 1.8
Erik Gustafsson, DTD, Tor, D, SLC, @Mon, L 2-3, 1, 0, 1, 0, 0, 0, 0, 0, 0, 0, 0, 0, 0, 3, 0, 0, 1.8
Arber Xhekaj, IR, Mon, D, FA, Tor, W 3-2, 1, 0, 0, 0, 0, 0, 0, 0, 0, 0, 0, 0, 0, 1, 4, 1, 1.8
Justin Holl, Healthy, Tor, D, FA, @Mon, L 2-3, 1, 0, 0, 0, 0, 0, 0, 0, 0, 0, 0, 0, 0, 0, 1, 3, 1.8
Sean Walker, Healthy, LA, D, FA, @Nsh, L 3-5, 1, 0, 0, 0, 0, 0, 0, 0, 0, 0, 0, 0, 0, 2, 2, 2, 1.8
Noah Dobson, Healthy, NYI, D, SLC, Car, L 2-5, 1, 0, 0, -2, 0, 0, 0, 0, 0, 0, 0, 0, 0, 5, 1, 4, 1.8
Colton Sissons, Healthy, Nsh, C- RW, DINK, LA, W 5-3, 1, 0, 0, 1, 0, 0, 0, 0, 0, 0, 3, 5, 0, 1, 3, 1, 1.8
Tage Thompson, DTD, Buf, C- RW, ME, Ana, W 6-3, 1, 0, 1, -2, 0, 0, 1, 0, 0, 0, 5, 6, 0, 3, 1, 1, 1.75
Brayden Schenn, Healthy, StL, C- LW, FA, Chi, L 3-5, 1, 0, 1, -1, 0, 0, 1, 0, 0, 0, 8, 9, 0, 3, 1, 0, 1.75
Andrei Kuzmenko, Healthy, Van, LW, SLC, Edm, L 2-4, 1, 1, 0, -1, 0, 0, 0, 0, 0, 0, 0, 0, 0, 2, 0, 0, 1.7
Anthony Cirelli, Healthy, TB, C, FA, @Cgy, L 3-6, 1, 1, 0, -1, 2, 0, 0, 0, 0, 0, 6, 5, 0, 3, 0, 0, 1.7
Andrew Copp, Healthy, Det, C- LW- RW, FA, Phi, L 1-2, 1, 0, 0, 1, 0, 0, 0, 0, 0, 0, 10, 3, 0, 5, 0, 0, 1.7
Brandon Tanev, Healthy, Sea, LW- RW, FA, Col, L 1-2, 1, 0, 0, 0, 0, 0, 0, 0, 0, 0, 0, 0, 0, 2, 5, 0, 1.7
Oliver Ekman-Larsson, IR, Van, D, FA, Edm, L 2-4, 1, 0, 0, 0, 0, 0, 0, 0, 0, 0, 0, 0, 0, 1, 2, 2, 1.7
Mike Hoffman, Healthy, Mon, LW- RW, FA, Tor, W 3-2, 1, 0, 1, 0, 0, 0, 0, 0, 0, 0, 1, 1, 0, 2, 0, 0, 1.7
Jacob Bryson, Healthy, Buf, D, FA, Ana, W 6-3, 1, 0, 0, 2, 0, 0, 0, 0, 0, 0, 0, 0, 0, 2, 0, 1, 1.7
Curtis Lazar, DTD, NJ, RW- C, FA, --, --, 1, 0, 0, 0, 0, 0, 0, 0, 0, 0, 5, 10, 0, 2, 5, 1, 1.7
Darnell Nurse, Healthy, Edm, D, OXP, @Van, W 4-2, 1, 0, 0, 2, 0, 0, 0, 0, 0, 0, 0, 0, 0, 1, 0, 1, 1.6
Jordan Martinook, Healthy, Car, RW- LW, FA, @NYI, W 5-2, 1, 0, 0, 1, 2, 0, 0, 0, 0, 0, 0, 0, 0, 2, 2, 1, 1.6
Cal Foote, Healthy, Nsh, D, FA, LA, W 5-3, 1, 0, 0, 1, 0, 0, 0, 0, 0, 0, 0, 0, 0, 0, 2, 1, 1.6
Marc-Edouard Vlasic, Healthy, SJ, D, FA, @Cls, L 3-5, 1, 0, 0, 1, 0, 0, 0, 0, 0, 0, 0, 0, 0, 1, 0, 2, 1.6
Travis Hamonic, DTD, Ott, D, FA, Wpg, L 1-5, 1, 0, 0, 0, 0, 0, 0, 0, 0, 0, 0, 0, 0, 2, 3, 1, 1.6
Conor Sheary, Healthy, Wsh, LW- RW, FA, @Vgk, L 2-6, 1, 0, 0, 1, 0, 0, 0, 0, 0, 0, 0, 0, 0, 2, 3, 0, 1.6
Zemgus Girgensons, Healthy, Buf, C- LW, FA, Ana, W 6-3, 1, 0, 0, 1, 0, 0, 0, 0, 0, 0, 1, 1, 0, 2, 3, 0, 1.6
Mikhail Sergachev, DTD, TB, D, CLB, @Cgy, L 3-6, 1, 0, 0, 0, 0, 0, 0, 0, 0, 0, 0, 0, 0, 2, 1, 2, 1.5
Patrick Kane, Healthy, NYR, RW, FA, --, --, 1, 0, 1, 0, 0, 0, 0, 0, 0, 0, 0, 0, 0, 0, 0, 0, 1.5
Valeri Nichushkin, Healthy, Col, RW- LW, DINK, @Sea, W 2-1, 1, 0, 0, 0, 0, 0, 0, 0, 0, 0, 0, 0, 0, 6, 3, 0, 1.5
Seth Jarvis, Healthy, Car, C- RW, FA, @NYI, W 5-2, 1, 0, 0, 1, 0, 0, 0, 0, 0, 0, 0, 0, 0, 2, 1, 1, 1.5
Adam Henrique, IR, Ana, C- LW, FA, @Buf, L 3-6, 1, 0, 1, 0, 0, 0, 0, 0, 0, 0, 2, 5, 0, 3, 0, 0, 1.5
Brett Kulak, Healthy, Edm, D, FA, @Van, W 4-2, 1, 0, 0, 0, 0, 0, 0, 0, 0, 0, 0, 0, 0, 0, 0, 3, 1.5
Scott Harrington, Healthy, NJ, D, FA, --, --, 1, 0, 0, -1, 0, 0, 0, 0, 0, 0, 0, 0, 0, 1, 3, 2, 1.5
Nathan MacKinnon, Healthy, Col, C, HERB, @Sea, W 2-1, 1, 0, 0, 0, 0, 0, 0, 0, 0, 0, 10, 6, 0, 7, 1, 0, 1.4
Victor Hedman, Healthy, TB, D, LKR, @Cgy, L 3-6, 1, 0, 1, -3, 0, 0, 0, 0, 0, 0, 0, 0, 0, 1, 1, 2, 1.4
Casey Mittelstadt, Healthy, Buf, C- LW, FA, Ana, W 6-3, 1, 0, 0, 1, 0, 0, 0, 0, 0, 0, 2, 1, 0, 0, 1, 1, 1.4
Jake Middleton, Healthy, Min, D, FA, @Fla, L 3-5, 1, 0, 0, 0, 0, 0, 0, 0, 0, 0, 0, 0, 0, 1, 1, 2, 1.4
Erik Johnson, Healthy, Col, D, FA, @Sea, W 2-1, 1, 0, 0, 0, 0, 0, 0, 0, 0, 0, 0, 0, 0, 0, 3, 1, 1.4
William Lockwood, Healthy, NYR, RW, FA, --, --, 1, 0, 0, 0, 0, 0, 0, 0, 0, 0, 0, 0, 0, 1, 1, 2, 1.4
Joe Veleno, Healthy, Det, C, FA, Phi, L 1-2, 1, 0, 0, 0, 0, 0, 0, 0, 0, 0, 1, 1, 0, 3, 2, 1, 1.4
Connor Dewar, Healthy, Min, C- LW, FA, @Fla, L 3-5, 1, 0, 0, 0, 0, 0, 0, 0, 0, 0, 2, 3, 0, 1, 3, 1, 1.4
Mason Shaw, O, Min, C, FA, @Fla, L 3-5, 1, 0, 0, 0, 0, 0, 0, 0, 0, 0, 0, 1, 0, 1, 3, 1, 1.4
Eric Robinson, Healthy, Cls, LW, FA, SJ, W 5-3, 1, 0, 0, 1, 0, 0, 0, 0, 0, 0, 0, 0, 0, 3, 2, 0, 1.4
Alex Belzile, O, Mon, C- RW, FA, Tor, W 3-2, 1, 0, 1, 0, 0, 0, 0, 0, 0, 0, 0, 6, 0, 0, 0, 1, 1.4
Devon Toews, Healthy, Col, D, BBS, @Sea, W 2-1, 1, 0, 0, 0, 0, 0, 0, 0, 0, 0, 0, 0, 0, 2, 2, 1, 1.3
J.T. Compher, Healthy, Col, RW- C, FA, @Sea, W 2-1, 1, 0, 0, -1, 0, 0, 0, 0, 0, 0, 7, 10, 0, 0, 2, 3, 1.3
Jake Sanderson, Healthy, Ott, D, FA, Wpg, L 1-5, 1, 0, 0, 0, 0, 0, 0, 0, 0, 0, 0, 0, 0, 3, 0, 2, 1.3
Erik Gudbranson, O, Cls, D, FA, SJ, W 5-3, 1, 0, 0, 1, 0, 0, 0, 0, 0, 0, 0, 0, 0, 0, 1, 1, 1.3
Dmitry Kulikov, IR, Pit, D, FA, --, --, 1, 0, 0, 1, 0, 0, 0, 0, 0, 0, 0, 0, 0, 2, 2, 0, 1.3
Troy Stecher, Healthy, Cgy, D, FA, TB, W 6-3, 1, 0, 0, 0, 0, 0, 0, 0, 0, 0, 0, 0, 0, 2, 2, 1, 1.3
Chris Tanev, DTD, Cgy, D, FA, TB, W 6-3, 1, 0, 0, -2, 2, 0, 0, 0, 0, 0, 0, 0, 0, 2, 1, 4, 1.3
Mathew Barzal, O, NYI, C, HERB, Car, L 2-5, 1, 0, 0, 0, 0, 0, 0, 0, 0, 0, 1, 0, 0, 6, 0, 1, 1.2
Cole Sillinger, Healthy, Cls, C, FA, SJ, W 5-3, 1, 0, 0, -1, 2, 0, 0, 0, 0, 0, 7, 5, 0, 2, 5, 0, 1.2
Mikko Rantanen, Healthy, Col, RW, HERB, @Sea, W 2-1, 1, 0, 0, -1, 2, 0, 0, 0, 0, 0, 3, 3, 0, 3, 2, 2, 1.2
Matty Beniers, Healthy, Sea, C, CLB, Col, L 1-2, 1, 0, 0, -1, 0, 0, 0, 0, 0, 0, 10, 5, 0, 1, 2, 1, 1.2
