Name, Health, NHL Team, Position, GFHL Team, Opponent, Score, GP, G, A, +/-, PIM, PPG, PPA, SHG, SHA, GWG, FOW, FOL, HAT, SOG, HIT, BLK, FPTS
Kyle Connor, Healthy, Wpg, LW, BBS, Ana, W 3-2, 1, 3, 0, 2, 0, 1, 0, 0, 0, 1, 0, 0, 1, 6, 0, 0, 11.1
Roman Josi, DTD, Nsh, D, SALT, NYI, W 5-4, 1, 0, 4, 2, 2, 0, 1, 0, 0, 0, 0, 0, 0, 7, 0, 4, 9.75
Sidney Crosby, Healthy, Pit, C, DINK, @Min, W 6-4, 1, 2, 2, 0, 0, 1, 1, 0, 0, 0, 19, 8, 0, 3, 1, 0, 9.45
Juuso Parssinen, DTD, Nsh, C, BOWS, NYI, W 5-4, 1, 2, 1, 2, 0, 1, 0, 0, 0, 1, 6, 5, 0, 3, 2, 0, 9.0
John Carlson, Healthy, Wsh, D, ME, @StL, L 4-5, 1, 2, 0, 1, 0, 1, 0, 1, 0, 0, 0, 0, 0, 5, 1, 3, 8.3
David Perron, Healthy, Det, RW, FA, @SJ, W 7-4, 1, 1, 2, 4, 0, 0, 0, 0, 0, 0, 0, 0, 0, 2, 3, 0, 8.1
Sean Kuraly, Healthy, Cls, C- LW, FA, Mon, W 6-4, 1, 2, 1, 2, 0, 0, 0, 0, 0, 0, 11, 10, 0, 4, 2, 1, 8.1
Alex Ovechkin, Healthy, Wsh, LW, SALT, @StL, L 4-5, 1, 1, 2, 2, 2, 0, 1, 0, 0, 0, 0, 0, 0, 9, 0, 0, 6.95
Alex Pietrangelo, Healthy, Vgk, D, DINK, Ari, W 4-1, 1, 1, 2, 1, 0, 1, 0, 0, 0, 0, 0, 0, 0, 4, 0, 1, 6.9
Roope Hintz, Healthy, Dal, C- LW, ME, @Fla, W 6-4, 1, 2, 0, 2, 0, 0, 0, 0, 0, 1, 4, 6, 0, 5, 0, 1, 6.8
Ian Cole, Healthy, TB, D, FA, Cgy, W 4-1, 1, 0, 1, 1, 0, 0, 0, 0, 0, 0, 0, 0, 0, 0, 6, 6, 6.8
Justin Schultz, Healthy, Sea, D, FA, NYR, W 3-2, 1, 2, 0, 2, 0, 0, 0, 0, 0, 1, 0, 0, 0, 5, 0, 0, 6.5
Erik Karlsson, Healthy, SJ, D, CLB, Det, L 4-7, 1, 1, 3, -1, 0, 0, 0, 0, 0, 0, 0, 0, 0, 4, 0, 0, 6.4
Auston Matthews, Healthy, Tor, C, BOWS, NJ, L 2-3, 1, 1, 1, 1, 0, 1, 0, 0, 0, 0, 10, 8, 0, 3, 1, 2, 6.3
Nikita Kucherov, Healthy, TB, RW, DINK, Cgy, W 4-1, 1, 2, 0, 1, 2, 1, 0, 0, 0, 1, 0, 0, 0, 5, 0, 0, 6.3
Jean-Gabriel Pageau, Healthy, NYI, C, FA, @Nsh, L 4-5, 1, 1, 1, 0, 0, 1, 0, 0, 0, 0, 7, 5, 0, 2, 6, 0, 6.2
Jake Guentzel, Healthy, Pit, LW, SALT, @Min, W 6-4, 1, 1, 2, 0, 0, 0, 1, 0, 0, 0, 0, 0, 0, 6, 1, 0, 6.15
Filip Forsberg, IR, Nsh, LW, CLB, NYI, W 5-4, 1, 1, 1, 2, 0, 0, 0, 0, 0, 0, 0, 0, 0, 5, 2, 1, 6.1
William Carrier, O, Vgk, LW, FA, Ari, W 4-1, 1, 1, 0, 1, 0, 0, 0, 0, 0, 1, 0, 0, 0, 2, 6, 1, 6.0
Sam Bennett, O, Fla, LW- C, FA, Dal, L 4-6, 1, 0, 3, 0, 2, 0, 1, 0, 0, 0, 9, 9, 0, 3, 2, 1, 5.95
Boone Jenner, Healthy, Cls, C- LW, BBS, Mon, W 6-4, 1, 1, 1, 2, 0, 0, 0, 0, 0, 0, 12, 8, 0, 2, 1, 1, 5.9
Esa Lindell, Healthy, Dal, D, ME, @Fla, W 6-4, 1, 0, 1, 4, 0, 0, 0, 0, 0, 0, 0, 0, 0, 0, 3, 3, 5.9
Joel Eriksson Ek, Healthy, Min, C, ME, Pit, L 4-6, 1, 2, 0, 1, 2, 0, 0, 1, 0, 0, 7, 14, 0, 4, 3, 0, 5.9
Dylan Larkin, Healthy, Det, C, OXP, @SJ, W 7-4, 1, 0, 2, 3, 0, 0, 0, 0, 0, 0, 11, 6, 0, 3, 0, 1, 5.8
Martin Necas, Healthy, Car, C- RW, HERB, Col, L 2-3, 1, 1, 1, 1, 0, 0, 0, 0, 0, 0, 3, 3, 0, 6, 3, 0, 5.5
Philippe Myers, Healthy, TB, D, FA, Cgy, W 4-1, 1, 1, 0, 1, 0, 0, 0, 0, 0, 0, 0, 0, 0, 1, 8, 1, 5.5
Adam Pelech, Healthy, NYI, D, FA, @Nsh, L 4-5, 1, 1, 1, 1, 0, 0, 0, 0, 0, 0, 0, 0, 0, 4, 0, 2, 5.4
Nick Foligno, IR, Bos, LW- RW, FA, Phi, W 4-1, 1, 0, 2, 1, 0, 0, 1, 0, 0, 0, 1, 0, 0, 1, 3, 1, 5.35
David Krejci, DTD, Bos, C, OXP, Phi, W 4-1, 1, 2, 0, 1, 0, 1, 0, 0, 0, 0, 5, 4, 0, 2, 0, 0, 5.3
Brandon Duhaime, Healthy, Min, RW- LW, FA, Pit, L 4-6, 1, 1, 0, 2, 2, 0, 0, 0, 0, 0, 0, 0, 0, 2, 6, 1, 5.3
Artturi Lehkonen, O, Col, LW- RW, FA, @Car, W 3-2, 1, 1, 0, 1, 0, 0, 0, 0, 0, 1, 0, 0, 0, 2, 3, 1, 5.1
Dominik Kubalik, Healthy, Det, LW- RW, FA, @SJ, W 7-4, 1, 1, 1, 2, 0, 0, 0, 0, 0, 0, 0, 0, 0, 2, 1, 0, 5.0
Erik Gudbranson, O, Cls, D, FA, Mon, W 6-4, 1, 0, 2, 2, 0, 0, 0, 0, 0, 0, 0, 0, 0, 2, 1, 1, 5.0
Steven Stamkos, Healthy, TB, C- LW- RW, HERB, Cgy, W 4-1, 1, 1, 1, 1, 0, 0, 1, 0, 0, 0, 9, 6, 0, 1, 1, 0, 4.95
Tyler Seguin, Healthy, Dal, C- RW, BOWS, @Fla, W 6-4, 1, 1, 1, 2, 2, 0, 0, 0, 0, 0, 9, 5, 0, 2, 0, 0, 4.9
Hampus Lindholm, Healthy, Bos, D, SLC, Phi, W 4-1, 1, 0, 1, 2, 0, 0, 0, 0, 0, 0, 0, 0, 0, 2, 0, 4, 4.7
Marcus Foligno, Healthy, Min, LW- RW, FA, Pit, L 4-6, 1, 0, 1, 2, 0, 0, 0, 0, 0, 0, 0, 0, 0, 1, 7, 0, 4.7
Luke Glendening, Healthy, Dal, C- RW, FA, @Fla, W 6-4, 1, 0, 2, 3, 0, 0, 0, 0, 0, 0, 4, 5, 0, 0, 1, 0, 4.7
Mathieu Olivier, O, Cls, C- RW, FA, Mon, W 6-4, 1, 1, 0, 1, 5, 0, 0, 0, 0, 1, 0, 2, 0, 5, 3, 1, 4.7
Jonas Brodin, Healthy, Min, D, FA, Pit, L 4-6, 1, 0, 1, 2, 0, 0, 0, 0, 1, 0, 0, 0, 0, 3, 2, 1, 4.65
Jonathan Marchessault, Healthy, Vgk, LW, BOWS, Ari, W 4-1, 1, 0, 2, 0, 2, 0, 1, 0, 0, 0, 0, 0, 0, 4, 2, 1, 4.55
Mark Scheifele, Healthy, Wpg, C, LKR, Ana, W 3-2, 1, 0, 2, 2, 0, 0, 0, 0, 0, 0, 6, 5, 0, 4, 0, 0, 4.5
Ryan McDonagh, Healthy, Nsh, D, FA, NYI, W 5-4, 1, 0, 1, 3, 0, 0, 0, 0, 0, 0, 0, 0, 0, 0, 0, 3, 4.5
Yegor Sharangovich, Healthy, NJ, C- LW, FA, @Tor, W 3-2, 1, 1, 0, 0, 0, 0, 0, 0, 0, 1, 0, 0, 0, 4, 2, 1, 4.5
Pius Suter, Healthy, Det, C- LW, FA, @SJ, W 7-4, 1, 1, 1, 1, 0, 0, 0, 0, 0, 0, 0, 0, 0, 2, 1, 0, 4.5
Mikhail Sergachev, DTD, TB, D, CLB, Cgy, W 4-1, 1, 0, 2, 1, 2, 0, 1, 0, 0, 0, 0, 0, 0, 1, 1, 1, 4.45
Jordan Eberle, Healthy, Sea, RW- LW, FA, NYR, W 3-2, 1, 0, 2, 2, 0, 0, 0, 0, 0, 0, 0, 0, 0, 1, 1, 0, 4.4
Nils Lundkvist, Healthy, Dal, D, FA, @Fla, W 6-4, 1, 1, 0, 2, 0, 0, 0, 0, 0, 0, 0, 0, 0, 4, 0, 2, 4.4
Jamie Benn, Healthy, Dal, LW- C, LKR, @Fla, W 6-4, 1, 1, 1, 1, 0, 0, 0, 0, 0, 0, 6, 6, 0, 3, 0, 0, 4.3
Matt Martin, Healthy, NYI, LW, FA, @Nsh, L 4-5, 1, 0, 1, 2, 0, 0, 0, 0, 0, 0, 0, 0, 0, 0, 6, 0, 4.3
Vincent Trocheck, Healthy, NYR, C, OXP, @Sea, L 2-3, 1, 1, 1, 0, 2, 1, 1, 0, 0, 0, 8, 9, 0, 3, 0, 0, 4.25
Christian Dvorak, O, Mon, LW- C, FA, @Cls, L 4-6, 1, 0, 2, 1, 0, 0, 1, 0, 0, 0, 10, 5, 0, 0, 0, 0, 4.25
Carter Verhaeghe, Healthy, Fla, C- LW, HERB, Dal, L 4-6, 1, 1, 1, -2, 0, 1, 0, 0, 0, 0, 0, 1, 0, 5, 1, 1, 4.2
Pavel Zacha, Healthy, Bos, C- LW- RW, FA, Phi, W 4-1, 1, 0, 2, 2, 0, 0, 0, 0, 0, 0, 1, 1, 0, 2, 0, 0, 4.2
Jake Walman, Healthy, Det, D, FA, @SJ, W 7-4, 1, 1, 0, 2, 0, 0, 0, 0, 0, 0, 0, 0, 0, 1, 2, 1, 4.2
Kevin Labanc, Healthy, SJ, RW- LW, FA, Det, L 4-7, 1, 1, 1, 1, 0, 0, 0, 0, 0, 0, 0, 0, 0, 2, 0, 0, 4.2
Matt Dumba, Healthy, Min, D, FA, Pit, L 4-6, 1, 1, 0, 2, 2, 0, 0, 0, 0, 0, 0, 0, 0, 1, 1, 2, 4.2
Moritz Seider, Healthy, Det, D, SALT, @SJ, W 7-4, 1, 1, 0, -2, 0, 0, 0, 0, 0, 1, 0, 0, 0, 3, 1, 3, 4.1
Jake DeBrusk, Healthy, Bos, LW- RW, BBS, Phi, W 4-1, 1, 1, 0, 0, 2, 1, 0, 0, 0, 1, 0, 0, 0, 2, 2, 0, 4.1
Filip Hronek, O, Van, D, OXP, --, --, 1, 1, 0, 3, 0, 0, 0, 0, 0, 0, 0, 0, 0, 1, 0, 1, 4.1
Nick Leddy, Healthy, StL, D, FA, Wsh, W 5-4, 1, 0, 1, 1, 0, 0, 0, 0, 0, 0, 0, 0, 0, 0, 2, 3, 4.1
Adam Erne, Healthy, Det, LW- RW, FA, @SJ, W 7-4, 1, 0, 1, -1, 0, 0, 0, 0, 0, 0, 0, 1, 0, 0, 4, 4, 4.1
Ty Dellandrea, Healthy, Dal, C- RW, FA, @Fla, W 6-4, 1, 1, 1, 1, 2, 0, 0, 0, 0, 0, 1, 0, 0, 2, 0, 0, 4.1
Jesper Bratt, Healthy, NJ, RW- LW, HERB, @Tor, W 3-2, 1, 1, 0, 1, 0, 0, 0, 0, 0, 0, 0, 0, 0, 2, 1, 2, 4.0
Mark Stone, IR, Vgk, RW, DINK, Ari, W 4-1, 1, 1, 0, 1, 0, 0, 0, 0, 0, 0, 0, 0, 0, 4, 2, 1, 4.0
Nick Jensen, Healthy, Wsh, D, FA, @StL, L 4-5, 1, 0, 1, 1, 0, 0, 0, 0, 1, 0, 0, 0, 0, 1, 2, 1, 3.95
Brock McGinn, Healthy, Ana, LW- RW, FA, @Wpg, L 2-3, 1, 1, 0, 1, 0, 0, 0, 0, 0, 1, 0, 0, 0, 1, 1, 0, 3.9
Jake Christiansen, Healthy, Cls, D, FA, Mon, W 6-4, 1, 0, 1, 1, 0, 0, 0, 0, 0, 0, 0, 0, 0, 1, 1, 3, 3.9
Vladimir Tarasenko, Healthy, NYR, RW, OXP, @Sea, L 2-3, 1, 0, 2, 0, 0, 0, 1, 0, 0, 0, 0, 0, 0, 1, 0, 1, 3.85
Cam Fowler, Healthy, Ana, D, FA, @Wpg, L 2-3, 1, 0, 2, 0, 0, 0, 0, 0, 0, 0, 0, 0, 0, 0, 1, 1, 3.8
Eetu Luostarinen, Healthy, Fla, C- LW, FA, Dal, L 4-6, 1, 1, 0, 0, 0, 0, 0, 0, 0, 0, 0, 0, 0, 4, 3, 1, 3.8
Torey Krug, Healthy, StL, D, FA, Wsh, W 5-4, 1, 1, 0, 0, 0, 1, 0, 0, 0, 0, 0, 0, 0, 2, 0, 2, 3.7
Marcus Pettersson, IR, Pit, D, FA, @Min, W 6-4, 1, 0, 1, 0, 0, 0, 0, 0, 0, 0, 0, 0, 0, 0, 4, 2, 3.7
Ross Colton, Healthy, TB, LW- C, FA, Cgy, W 4-1, 1, 0, 1, 1, 0, 0, 0, 0, 0, 0, 5, 3, 0, 2, 1, 2, 3.7
Ben Chiarot, Healthy, Det, D, FA, @SJ, W 7-4, 1, 0, 1, -2, 0, 0, 0, 0, 0, 0, 0, 0, 0, 0, 2, 5, 3.6
Jordan Harris, Healthy, Mon, D, FA, @Cls, L 4-6, 1, 1, 0, -1, 0, 0, 0, 0, 0, 0, 0, 0, 0, 3, 1, 3, 3.6
Joe Veleno, Healthy, Det, C, FA, @SJ, W 7-4, 1, 1, 0, 1, 2, 0, 0, 0, 0, 0, 3, 7, 0, 1, 2, 2, 3.6
Gustav Forsling, Healthy, Fla, D, HERB, Dal, L 4-6, 1, 0, 1, 1, 0, 0, 1, 0, 0, 0, 0, 0, 0, 3, 0, 2, 3.55
Brendan Gallagher, Healthy, Mon, RW, FA, @Cls, L 4-6, 1, 1, 1, -1, 0, 0, 1, 0, 0, 0, 1, 0, 0, 2, 0, 0, 3.55
Vince Dunn, Healthy, Sea, D, LKR, NYR, W 3-2, 1, 0, 1, 0, 0, 0, 0, 0, 0, 0, 0, 0, 0, 3, 4, 1, 3.5
Jeff Petry, Healthy, Pit, D, LKR, @Min, W 6-4, 1, 0, 0, 1, 0, 0, 0, 0, 0, 0, 0, 0, 0, 2, 6, 2, 3.5
Jack Eichel, Healthy, Vgk, C, BBS, Ari, W 4-1, 1, 0, 1, 1, 0, 0, 1, 0, 0, 0, 3, 3, 0, 2, 0, 2, 3.45
Matthew Tkachuk, Healthy, Fla, LW- RW, CLB, Dal, L 4-6, 1, 1, 1, 0, 5, 0, 0, 0, 0, 0, 0, 0, 0, 4, 0, 0, 3.4
Kris Letang, Healthy, Pit, D, DINK, @Min, W 6-4, 1, 1, 0, -1, 0, 1, 0, 0, 0, 0, 0, 0, 0, 3, 2, 1, 3.4
Nico Hischier, Healthy, NJ, C, SLC, @Tor, W 3-2, 1, 1, 0, 0, 0, 0, 0, 0, 0, 0, 6, 6, 0, 4, 0, 2, 3.4
Nazem Kadri, Healthy, Cgy, C, ME, @TB, L 1-4, 1, 1, 0, -1, 0, 1, 0, 0, 0, 0, 9, 7, 0, 4, 1, 1, 3.4
Mason Marchment, O, Dal, LW- RW, FA, @Fla, W 6-4, 1, 0, 1, 1, 7, 0, 0, 0, 0, 0, 3, 0, 0, 2, 2, 2, 3.4
Tomas Nosek, Healthy, Bos, C- LW, FA, Phi, W 4-1, 1, 1, 0, 1, 0, 0, 0, 0, 0, 0, 7, 2, 0, 1, 1, 0, 3.4
Logan Couture, Healthy, SJ, C, BOWS, Det, L 4-7, 1, 1, 0, 1, 0, 0, 0, 0, 0, 0, 5, 10, 0, 2, 2, 1, 3.3
Chandler Stephenson, Healthy, Vgk, C- LW- RW, HERB, Ari, W 4-1, 1, 0, 1, 1, 0, 0, 0, 0, 0, 0, 2, 3, 0, 0, 3, 1, 3.3
Gustav Nyquist, IR, Min, RW- LW, FA, Pit, L 4-6, 1, 1, 0, 2, 2, 0, 0, 0, 0, 0, 1, 0, 0, 4, 0, 0, 3.3
Kyle Palmieri, Healthy, NYI, RW, FA, @Nsh, L 4-5, 1, 1, 0, 0, 0, 0, 0, 0, 0, 0, 0, 2, 0, 2, 4, 0, 3.2
Dante Fabbro, Healthy, Nsh, D, FA, NYI, W 5-4, 1, 0, 1, -1, 0, 0, 0, 0, 0, 0, 0, 0, 0, 2, 0, 4, 3.2
Brendan Smith, Healthy, NJ, D, FA, @Tor, W 3-2, 1, 0, 1, 1, 0, 0, 0, 0, 0, 0, 0, 0, 0, 1, 2, 1, 3.2
Chris Kreider, Healthy, NYR, LW- RW, LKR, @Sea, L 2-3, 1, 0, 1, 0, 0, 0, 1, 0, 0, 0, 2, 0, 0, 3, 3, 0, 3.15
Mikael Granlund, Healthy, Pit, LW- C- RW, FA, @Min, W 6-4, 1, 0, 1, 2, 0, 0, 1, 0, 0, 0, 2, 3, 0, 0, 0, 1, 3.15
Alec Martinez, Healthy, Vgk, D, FA, Ari, W 4-1, 1, 0, 0, 1, 0, 0, 0, 0, 0, 0, 0, 0, 0, 1, 0, 5, 3.1
Jared McCann, Healthy, Sea, LW- C, FA, NYR, W 3-2, 1, 1, 0, 1, 0, 0, 0, 0, 0, 0, 1, 0, 0, 2, 1, 0, 3.1
Erik Johnson, Healthy, Col, D, FA, @Car, W 3-2, 1, 0, 1, 1, 0, 0, 0, 0, 0, 0, 0, 0, 0, 0, 2, 1, 3.1
Jonatan Berggren, Healthy, Det, RW- C, FA, @SJ, W 7-4, 1, 0, 1, 2, 0, 0, 0, 0, 0, 0, 0, 0, 0, 1, 0, 1, 3.1
Will Borgen, Healthy, Sea, D, FA, NYR, W 3-2, 1, 0, 1, 1, 0, 0, 0, 0, 0, 0, 0, 0, 0, 0, 2, 1, 3.1
Mika Zibanejad, Healthy, NYR, C, ME, @Sea, L 2-3, 1, 1, 0, 0, 2, 1, 0, 0, 0, 0, 8, 7, 0, 4, 1, 0, 3.1
Ryan Pulock, Healthy, NYI, D, FA, @Nsh, L 4-5, 1, 0, 1, 1, 0, 0, 0, 0, 0, 0, 0, 0, 0, 2, 3, 0, 3.1
Cole Sillinger, Healthy, Cls, C, FA, Mon, W 6-4, 1, 1, 0, 1, 2, 0, 0, 0, 0, 0, 7, 7, 0, 2, 2, 0, 3.1
Cal Clutterbuck, Healthy, NYI, RW, FA, @Nsh, L 4-5, 1, 1, 0, 0, 0, 0, 0, 0, 0, 0, 0, 1, 0, 3, 3, 0, 3.1
Frederick Gaudreau, Healthy, Min, C- LW, FA, Pit, L 4-6, 1, 0, 1, 0, 0, 0, 0, 0, 1, 0, 5, 11, 0, 1, 1, 2, 3.05
Conor Sheary, Healthy, Wsh, LW- RW, FA, @StL, L 4-5, 1, 1, 0, 2, 0, 0, 0, 0, 0, 0, 0, 1, 0, 1, 0, 0, 3.0
Nikita Zadorov, Healthy, Cgy, D, FA, @TB, L 1-4, 1, 0, 0, 0, 2, 0, 0, 0, 0, 0, 0, 0, 0, 5, 4, 3, 3.0
Michael Bunting, Healthy, Tor, LW, BOWS, NJ, L 2-3, 1, 0, 1, 1, 0, 0, 1, 0, 0, 0, 0, 0, 0, 1, 2, 0, 2.95
William Nylander, Healthy, Tor, RW- LW, LKR, NJ, L 2-3, 1, 1, 0, 1, 0, 0, 0, 0, 0, 0, 0, 0, 0, 4, 0, 0, 2.9
Nick Suzuki, Healthy, Mon, C, OXP, @Cls, L 4-6, 1, 1, 1, -1, 0, 0, 0, 0, 0, 0, 8, 11, 0, 2, 0, 0, 2.9
Devon Toews, Healthy, Col, D, BBS, @Car, W 3-2, 1, 0, 1, 1, 0, 0, 0, 0, 0, 0, 0, 0, 0, 1, 1, 1, 2.9
Brayden Schenn, Healthy, StL, C- LW, FA, Wsh, W 5-4, 1, 1, 0, 0, 0, 0, 0, 0, 0, 0, 10, 4, 0, 3, 0, 0, 2.9
Michael Rasmussen, IR, Det, C- LW, FA, @SJ, W 7-4, 1, 0, 1, 1, 0, 0, 0, 0, 0, 0, 5, 5, 0, 0, 3, 0, 2.9
Nick Perbix, Healthy, TB, D, FA, Cgy, W 4-1, 1, 0, 0, 1, 0, 0, 0, 0, 0, 0, 0, 0, 0, 1, 1, 4, 2.9
Pierre-Luc Dubois, Healthy, Wpg, C, SLC, Ana, W 3-2, 1, 0, 1, -1, 0, 0, 1, 0, 0, 0, 12, 5, 0, 3, 2, 0, 2.85
Dylan Strome, Healthy, Wsh, C- LW, FA, @StL, L 4-5, 1, 0, 2, 0, 2, 0, 1, 0, 0, 0, 6, 9, 0, 1, 0, 0, 2.85
Taylor Hall, IR, Bos, LW, FA, Phi, W 4-1, 1, 0, 1, 1, 2, 0, 1, 0, 0, 0, 0, 1, 0, 6, 1, 0, 2.85
Sebastian Aho, Healthy, Car, C, SALT, Col, L 2-3, 1, 1, 0, 1, 0, 0, 0, 0, 0, 0, 3, 8, 0, 5, 1, 0, 2.8
Adam Larsson, Healthy, Sea, D, DINK, NYR, W 3-2, 1, 0, 0, 0, 0, 0, 0, 0, 0, 0, 0, 0, 0, 2, 2, 4, 2.8
Rickard Rakell, Healthy, Pit, C- LW- RW, HERB, @Min, W 6-4, 1, 0, 1, 1, 0, 0, 0, 0, 0, 0, 0, 0, 0, 2, 2, 0, 2.8
Troy Terry, O, Ana, C- RW, FA, @Wpg, L 2-3, 1, 1, 0, 1, 0, 0, 0, 0, 0, 0, 0, 0, 0, 3, 0, 0, 2.8
Reilly Smith, Healthy, Vgk, RW- LW, HERB, Ari, W 4-1, 1, 1, 0, 0, 0, 0, 0, 0, 0, 0, 0, 0, 0, 5, 1, 0, 2.8
Erik Haula, Healthy, NJ, LW- C, FA, @Tor, W 3-2, 1, 0, 1, 1, 0, 0, 0, 0, 0, 0, 6, 8, 0, 2, 1, 1, 2.8
Yegor Chinakhov, IR, Cls, RW- LW, FA, Mon, W 6-4, 1, 0, 1, 1, 0, 0, 0, 0, 0, 0, 0, 0, 0, 2, 2, 0, 2.8
Josh Archibald, Healthy, Pit, RW, FA, @Min, W 6-4, 1, 0, 1, 1, 2, 0, 0, 0, 0, 0, 0, 0, 0, 4, 2, 0, 2.8
Eric Robinson, Healthy, Cls, LW, FA, Mon, W 6-4, 1, 0, 1, 1, 0, 0, 0, 0, 0, 0, 0, 0, 0, 0, 1, 1, 2.8
Adam Fox, Healthy, NYR, D, SALT, @Sea, L 2-3, 1, 0, 1, 0, 0, 0, 1, 0, 0, 0, 0, 0, 0, 2, 1, 1, 2.75
Brandon Montour, Healthy, Fla, D, CLB, Dal, L 4-6, 1, 0, 1, -2, 0, 0, 1, 0, 0, 0, 0, 0, 0, 2, 1, 3, 2.75
Jordan Staal, Healthy, Car, C, FA, Col, L 2-3, 1, 0, 0, 0, 0, 0, 0, 0, 0, 0, 24, 3, 0, 0, 2, 0, 2.7
Jack Hughes, Healthy, NJ, C- LW, BBS, @Tor, W 3-2, 1, 0, 1, 2, 0, 0, 0, 0, 0, 0, 0, 4, 0, 6, 0, 0, 2.7
Justin Faulk, Healthy, StL, D, FA, Wsh, W 5-4, 1, 0, 1, 0, 0, 0, 0, 0, 0, 0, 0, 0, 0, 2, 0, 2, 2.7
Andre Burakovsky, IR, Sea, LW- RW, FA, NYR, W 3-2, 1, 0, 1, 1, 0, 0, 0, 0, 0, 0, 0, 0, 0, 2, 0, 1, 2.7
"Ryan OReilly", IR, Tor, C, FA, NJ, L 2-3, 1, 1, 0, 1, 4, 0, 0, 0, 0, 0, 12, 7, 0, 1, 0, 0, 2.7
Radko Gudas, Healthy, Fla, D, BOWS, Dal, L 4-6, 1, 0, 0, -1, 0, 0, 0, 0, 0, 0, 0, 0, 0, 1, 7, 2, 2.7
Connor Clifton, Healthy, Bos, D, FA, Phi, W 4-1, 1, 0, 0, 2, 0, 0, 0, 0, 0, 0, 0, 0, 0, 3, 3, 1, 2.7
Jaden Schwartz, Healthy, Sea, LW- RW, FA, NYR, W 3-2, 1, 0, 1, 1, 0, 0, 0, 0, 0, 0, 3, 1, 0, 2, 1, 0, 2.7
Adam Henrique, IR, Ana, C- LW, FA, @Wpg, L 2-3, 1, 0, 1, 1, 0, 0, 0, 0, 0, 0, 5, 6, 0, 3, 0, 1, 2.7
Colton Sissons, Healthy, Nsh, C- RW, DINK, NYI, W 5-4, 1, 1, 0, 0, 0, 0, 0, 0, 0, 0, 6, 6, 0, 1, 2, 0, 2.7
Radek Faksa, Healthy, Dal, C, FA, @Fla, W 6-4, 1, 0, 1, 1, 0, 0, 0, 0, 0, 0, 2, 3, 0, 0, 1, 1, 2.7
Matt Nieto, Healthy, Col, LW- RW, FA, @Car, W 3-2, 1, 1, 0, 1, 0, 0, 0, 0, 0, 0, 0, 0, 0, 2, 0, 0, 2.7
Cale Fleury, Healthy, Sea, D, FA, NYR, W 3-2, 1, 0, 0, 2, 0, 0, 0, 0, 0, 0, 0, 0, 0, 0, 4, 1, 2.7
Brandon Hagel, Healthy, TB, LW- RW, DINK, Cgy, W 4-1, 1, 0, 1, 1, 2, 0, 0, 0, 0, 0, 0, 2, 0, 5, 2, 0, 2.7
Aaron Ekblad, Healthy, Fla, D, SALT, Dal, L 4-6, 1, 0, 1, -2, 2, 0, 1, 0, 0, 0, 0, 0, 0, 6, 5, 0, 2.65
Brent Burns, Healthy, Car, D, BBS, Col, L 2-3, 1, 0, 0, 2, 2, 0, 0, 0, 0, 0, 0, 0, 0, 5, 1, 2, 2.6
Ivan Barbashev, Healthy, Vgk, C- LW- RW, FA, Ari, W 4-1, 1, 0, 1, 1, 0, 0, 0, 0, 0, 0, 0, 0, 0, 0, 2, 0, 2.6
Jani Hakanpaa, Healthy, Dal, D, HERB, @Fla, W 6-4, 1, 0, 0, 3, 2, 0, 0, 0, 0, 0, 0, 0, 0, 0, 1, 2, 2.6
Jeff Carter, Healthy, Pit, C- RW, FA, @Min, W 6-4, 1, 0, 1, 1, 2, 0, 0, 0, 0, 0, 8, 5, 0, 0, 0, 1, 2.6
Jacob Trouba, Healthy, NYR, D, BBS, @Sea, L 2-3, 1, 0, 0, 0, 0, 0, 0, 0, 0, 0, 0, 0, 0, 3, 4, 2, 2.5
Trevor Zegras, Healthy, Ana, C, FA, @Wpg, L 2-3, 1, 1, 0, 0, 0, 0, 0, 0, 0, 0, 7, 10, 0, 5, 1, 0, 2.5
Owen Tippett, Healthy, Phi, RW- LW, FA, @Bos, L 1-4, 1, 1, 0, -1, 0, 1, 0, 0, 0, 0, 0, 0, 0, 2, 1, 0, 2.5
Jaycob Megna, Healthy, Sea, D, FA, NYR, W 3-2, 1, 0, 1, -1, 0, 0, 0, 0, 0, 0, 0, 0, 0, 2, 1, 2, 2.5
Tony DeAngelo, Healthy, Phi, D, FA, @Bos, L 1-4, 1, 0, 1, -1, 0, 0, 1, 0, 0, 0, 0, 0, 0, 2, 0, 2, 2.45
Barclay Goodrow, Healthy, NYR, RW- C- LW, FA, @Sea, L 2-3, 1, 0, 1, 0, 0, 0, 1, 0, 0, 0, 0, 3, 0, 2, 1, 1, 2.45
Tomas Hertl, Healthy, SJ, C, BOWS, Det, L 4-7, 1, 0, 1, -1, 0, 0, 0, 0, 0, 0, 12, 10, 0, 1, 2, 1, 2.4
Jason Robertson, Healthy, Dal, LW, ME, @Fla, W 6-4, 1, 0, 1, 1, 0, 0, 0, 0, 0, 0, 0, 0, 0, 4, 0, 0, 2.4
Clayton Keller, Healthy, Ari, C- LW- RW, SLC, @Vgk, L 1-4, 1, 1, 0, 0, 0, 0, 0, 0, 0, 0, 1, 0, 0, 3, 0, 0, 2.4
Josh Anderson, O, Mon, RW, FA, @Cls, L 4-6, 1, 1, 0, -1, 0, 1, 0, 0, 0, 0, 0, 1, 0, 5, 0, 0, 2.4
Mitchell Marner, DTD, Tor, RW, OXP, NJ, L 2-3, 1, 0, 1, 0, 0, 0, 1, 0, 0, 0, 0, 0, 0, 3, 1, 0, 2.35
Josh Morrissey, Healthy, Wpg, D, LKR, Ana, W 3-2, 1, 0, 1, 0, 0, 0, 1, 0, 0, 0, 0, 0, 0, 1, 0, 1, 2.35
Anders Lee, Healthy, NYI, LW, FA, @Nsh, L 4-5, 1, 0, 1, -1, 0, 0, 1, 0, 0, 0, 0, 0, 0, 3, 1, 1, 2.35
Neal Pionk, Healthy, Wpg, D, OXP, Ana, W 3-2, 1, 0, 1, 0, 0, 0, 0, 0, 0, 0, 0, 0, 0, 0, 1, 1, 2.3
Dysin Mayo, Healthy, Vgk, D, FA, Ari, W 4-1, 1, 0, 0, 1, 0, 0, 0, 0, 0, 0, 0, 0, 0, 1, 4, 1, 2.3
Alex Newhook, Healthy, Col, C- LW, FA, @Car, W 3-2, 1, 1, 0, 0, 2, 0, 0, 0, 0, 0, 2, 2, 0, 2, 1, 0, 2.3
Michael McLeod, Healthy, NJ, C, FA, @Tor, W 3-2, 1, 0, 0, 0, 2, 0, 0, 0, 0, 0, 7, 7, 0, 2, 6, 1, 2.3
Sam Gagner, O, Wpg, C- LW- RW, FA, Ana, W 3-2, 1, 0, 1, 1, 0, 0, 0, 0, 0, 0, 0, 0, 0, 3, 0, 0, 2.3
Josh Leivo, Healthy, StL, LW- RW, FA, Wsh, W 5-4, 1, 0, 1, 0, 0, 0, 0, 0, 0, 0, 0, 0, 0, 3, 0, 1, 2.3
Sam Carrick, Healthy, Ana, C, FA, @Wpg, L 2-3, 1, 0, 1, 1, 7, 0, 0, 0, 0, 0, 0, 0, 0, 2, 1, 1, 2.3
Johnny Gaudreau, Healthy, Cls, LW, BOWS, Mon, W 6-4, 1, 0, 1, 1, 0, 0, 0, 0, 0, 0, 0, 0, 0, 2, 0, 0, 2.2
Mats Zuccarello, Healthy, Min, RW- LW, CLB, Pit, L 4-6, 1, 0, 1, -2, 0, 0, 0, 0, 0, 0, 0, 0, 0, 2, 0, 3, 2.2
Pavel Buchnevich, DTD, StL, RW- LW, SALT, Wsh, W 5-4, 1, 1, 0, 0, 0, 0, 0, 0, 0, 0, 0, 1, 0, 3, 0, 0, 2.2
Nino Niederreiter, Healthy, Wpg, RW- LW, FA, Ana, W 3-2, 1, 1, 0, 1, 4, 0, 0, 0, 0, 0, 0, 0, 0, 1, 0, 0, 2.2
Rasmus Ristolainen, DTD, Phi, D, FA, @Bos, L 1-4, 1, 0, 0, 0, 0, 0, 0, 0, 0, 0, 0, 0, 0, 1, 2, 3, 2.2
Fabian Zetterlund, Healthy, SJ, LW- C- RW, FA, Det, L 4-7, 1, 0, 1, 0, 0, 0, 0, 0, 0, 0, 0, 0, 0, 2, 0, 1, 2.2
Evgeny Kuznetsov, Healthy, Wsh, C, FA, @StL, L 4-5, 1, 0, 1, 0, 0, 0, 0, 0, 0, 0, 10, 10, 0, 6, 0, 0, 2.1
Jaccob Slavin, Healthy, Car, D, ME, Col, L 2-3, 1, 0, 1, 1, 0, 0, 0, 0, 0, 0, 0, 0, 0, 1, 0, 0, 2.1
Olli Maatta, Healthy, Det, D, FA, @SJ, W 7-4, 1, 0, 0, 2, 0, 0, 0, 0, 0, 0, 0, 0, 0, 0, 2, 1, 2.1
Nate Schmidt, Healthy, Wpg, D, FA, Ana, W 3-2, 1, 0, 0, 0, 0, 0, 0, 0, 0, 0, 0, 0, 0, 1, 0, 4, 2.1
Nicolas Roy, Healthy, Vgk, C- RW, FA, Ari, W 4-1, 1, 0, 1, 1, 0, 0, 0, 0, 0, 0, 1, 8, 0, 2, 2, 0, 2.1
Dmitry Kulikov, IR, Pit, D, FA, @Min, W 6-4, 1, 0, 0, 2, 2, 0, 0, 0, 0, 0, 0, 0, 0, 0, 1, 2, 2.1
Pavol Regenda, Healthy, Ana, C, FA, @Wpg, L 2-3, 1, 0, 0, -1, 0, 0, 0, 0, 0, 0, 0, 0, 0, 1, 0, 5, 2.1
Jack Roslovic, DTD, Cls, C, FA, Mon, W 6-4, 1, 0, 0, -1, 0, 0, 0, 0, 0, 0, 4, 6, 0, 2, 2, 4, 2.1
J.T. Compher, Healthy, Col, RW- C, FA, @Car, W 3-2, 1, 0, 1, 1, 0, 0, 0, 0, 0, 0, 8, 12, 0, 0, 0, 1, 2.1
Charlie McAvoy, Healthy, Bos, D, SLC, Phi, W 4-1, 1, 0, 1, 0, 2, 0, 1, 0, 0, 0, 0, 0, 0, 0, 0, 1, 2.05
Mike Hoffman, Healthy, Mon, LW- RW, FA, @Cls, L 4-6, 1, 0, 1, 0, 0, 0, 0, 0, 0, 0, 0, 0, 0, 0, 0, 1, 2.0
Marcus Bjork, Healthy, Cls, D, FA, Mon, W 6-4, 1, 0, 0, 2, 2, 0, 0, 0, 0, 0, 0, 0, 0, 2, 0, 2, 2.0
Teddy Blueger, Healthy, Vgk, C- LW, FA, Ari, W 4-1, 1, 0, 1, 0, 0, 0, 0, 0, 0, 0, 4, 4, 0, 2, 1, 0, 2.0
Christian Fischer, Healthy, Ari, RW- LW, FA, @Vgk, L 1-4, 1, 0, 0, 0, 0, 0, 0, 0, 0, 0, 0, 0, 0, 3, 4, 1, 2.0
Trevor Lewis, Healthy, Cgy, C- RW, FA, @TB, L 1-4, 1, 0, 0, -2, 0, 0, 0, 0, 0, 0, 0, 1, 0, 2, 8, 1, 2.0
Ryan Poehling, Healthy, Pit, C, FA, @Min, W 6-4, 1, 1, 0, 0, 0, 0, 0, 0, 0, 0, 0, 2, 0, 2, 0, 0, 2.0
Dennis Gilbert, Healthy, Cgy, D, FA, @TB, L 1-4, 1, 0, 0, 0, 0, 0, 0, 0, 0, 0, 0, 0, 0, 2, 6, 0, 2.0
David Pastrnak, Healthy, Bos, RW, CLB, Phi, W 4-1, 1, 0, 1, 0, 0, 0, 1, 0, 0, 0, 0, 0, 0, 2, 0, 0, 1.95
Timo Meier, Healthy, NJ, RW- LW, SALT, @Tor, W 3-2, 1, 0, 1, -1, 0, 0, 0, 0, 0, 0, 0, 0, 0, 3, 2, 0, 1.9
Morgan Rielly, Healthy, Tor, D, CLB, NJ, L 2-3, 1, 0, 1, -1, 0, 0, 0, 0, 0, 0, 0, 0, 0, 4, 0, 1, 1.9
William Karlsson, Healthy, Vgk, C, FA, Ari, W 4-1, 1, 0, 0, 0, 0, 0, 0, 0, 0, 0, 13, 8, 0, 4, 0, 2, 1.9
Rasmus Sandin, Healthy, Wsh, D, CLB, @StL, L 4-5, 1, 0, 0, 0, 0, 0, 0, 0, 0, 0, 0, 0, 0, 0, 3, 2, 1.9
John Marino, Healthy, NJ, D, FA, @Tor, W 3-2, 1, 0, 0, 1, 0, 0, 0, 0, 0, 0, 0, 0, 0, 1, 1, 2, 1.9
J.J. Moser, Healthy, Ari, D, FA, @Vgk, L 1-4, 1, 0, 1, -2, 2, 0, 0, 0, 0, 0, 0, 0, 0, 2, 3, 1, 1.9
Kevin Hayes, Healthy, Phi, C, FA, @Bos, L 1-4, 1, 0, 1, -1, 0, 0, 1, 0, 0, 0, 7, 8, 0, 4, 1, 0, 1.85
Victor Hedman, Healthy, TB, D, LKR, Cgy, W 4-1, 1, 0, 0, 1, 0, 0, 0, 0, 0, 0, 0, 0, 0, 0, 1, 2, 1.8
Jordan Kyrou, Healthy, StL, C- LW- RW, ME, Wsh, W 5-4, 1, 0, 1, 0, 0, 0, 0, 0, 0, 0, 0, 0, 0, 3, 0, 0, 1.8
Brayden McNabb, Healthy, Vgk, D, CLB, Ari, W 4-1, 1, 0, 0, 1, 0, 0, 0, 0, 0, 0, 0, 0, 0, 1, 4, 0, 1.8
Brandon Tanev, Healthy, Sea, LW- RW, FA, NYR, W 3-2, 1, 0, 0, 1, 2, 0, 0, 0, 0, 0, 0, 1, 0, 3, 1, 2, 1.8
Nathan Bastian, DTD, NJ, RW- LW, FA, @Tor, W 3-2, 1, 0, 0, 0, 2, 0, 0, 0, 0, 0, 0, 2, 0, 0, 4, 2, 1.8
Johnathan Kovacevic, Healthy, Mon, D, FA, @Cls, L 4-6, 1, 0, 1, 0, 0, 0, 0, 0, 0, 0, 0, 0, 0, 3, 0, 0, 1.8
Lawson Crouse, Healthy, Ari, LW- RW, FA, @Vgk, L 1-4, 1, 0, 0, -1, 0, 0, 0, 0, 0, 0, 0, 1, 0, 0, 3, 3, 1.8
Mathew Barzal, O, NYI, C, HERB, @Nsh, L 4-5, 1, 0, 1, 0, 2, 0, 1, 0, 0, 0, 2, 6, 0, 3, 1, 0, 1.75
Alexander Romanov, DTD, NYI, D, OXP, @Nsh, L 4-5, 1, 0, 1, -2, 0, 0, 0, 0, 0, 0, 0, 0, 0, 1, 2, 1, 1.7
Garnet Hathaway, Healthy, Bos, RW- LW, FA, Phi, W 4-1, 1, 0, 0, -1, 0, 0, 0, 0, 0, 0, 0, 0, 0, 5, 4, 1, 1.7
Martin Fehervary, Healthy, Wsh, D, DINK, @StL, L 4-5, 1, 0, 0, -1, 0, 0, 0, 0, 0, 0, 0, 0, 0, 2, 5, 1, 1.7
Josh Mahura, Healthy, Fla, D, FA, Dal, L 4-6, 1, 0, 0, -1, 0, 0, 0, 0, 0, 0, 0, 0, 0, 1, 2, 3, 1.7
Evan Rodrigues, Healthy, Col, C- RW, FA, @Car, W 3-2, 1, 1, 0, -1, 2, 1, 0, 0, 0, 0, 2, 4, 0, 1, 0, 0, 1.7
Danton Heinen, Healthy, Pit, C- LW- RW, FA, @Min, W 6-4, 1, 0, 1, 0, 0, 0, 0, 0, 0, 0, 0, 0, 0, 2, 0, 0, 1.7
Jan Rutta, DTD, Pit, D, FA, @Min, W 6-4, 1, 0, 0, 0, 2, 0, 0, 0, 0, 0, 0, 0, 0, 1, 1, 3, 1.7
Mark Jankowski, Healthy, Nsh, C- LW, FA, NYI, W 5-4, 1, 0, 0, 0, 0, 0, 0, 0, 0, 0, 3, 4, 0, 0, 1, 3, 1.7
Connor Dewar, Healthy, Min, C- LW, FA, Pit, L 4-6, 1, 0, 0, 0, 2, 0, 0, 0, 0, 0, 7, 5, 0, 1, 2, 2, 1.7
Tyler Tucker, Healthy, StL, D, FA, Wsh, W 5-4, 1, 0, 0, 0, 0, 0, 0, 0, 0, 0, 0, 0, 0, 0, 4, 1, 1.7
Kirill Kaprizov, O, Min, LW, CLB, Pit, L 4-6, 1, 0, 1, -2, 0, 0, 0, 0, 0, 0, 0, 0, 0, 3, 1, 1, 1.6
Andrew Copp, Healthy, Det, C- LW- RW, FA, @SJ, W 7-4, 1, 0, 1, -1, 0, 0, 0, 0, 0, 0, 7, 7, 0, 3, 1, 0, 1.6
Nicholas Paul, Healthy, TB, C- LW, FA, Cgy, W 4-1, 1, 0, 0, 1, 0, 0, 0, 0, 0, 0, 8, 5, 0, 0, 1, 1, 1.6
Andrew Peeke, Healthy, Cls, D, FA, Mon, W 6-4, 1, 0, 0, -1, 0, 0, 0, 0, 0, 0, 0, 0, 0, 0, 2, 3, 1.6
Patrick Brown, Healthy, Ott, C- RW, FA, --, --, 1, 0, 0, 0, 0, 0, 0, 0, 0, 0, 3, 4, 0, 0, 4, 1, 1.6
Gavin Bayreuther, Healthy, Cls, D, FA, Mon, W 6-4, 1, 0, 1, -1, 0, 0, 0, 0, 0, 0, 0, 0, 0, 1, 0, 1, 1.6
Zack MacEwen, Healthy, LA, C- RW, FA, --, --, 1, 0, 0, 0, 0, 0, 0, 0, 0, 0, 2, 1, 0, 1, 3, 1, 1.6
Jayson Megna, Healthy, Ana, C- RW, FA, @Wpg, L 2-3, 1, 0, 0, 0, 0, 0, 0, 0, 0, 0, 0, 1, 0, 0, 4, 1, 1.6
Lukas Sedlak, Healthy, Phi, C, FA, @Bos, L 1-4, 1, 0, 0, 0, 0, 0, 0, 0, 0, 0, 0, 2, 0, 1, 4, 1, 1.6
Jonathan Huberdeau, Healthy, Cgy, LW, LKR, @TB, L 1-4, 1, 0, 1, -1, 2, 0, 1, 0, 0, 0, 0, 1, 0, 3, 1, 0, 1.55
Robert Thomas, DTD, StL, C- RW, ME, Wsh, W 5-4, 1, 0, 1, -2, 2, 0, 1, 0, 0, 0, 16, 8, 0, 2, 0, 0, 1.55
Sam Reinhart, Healthy, Fla, RW- C, ME, Dal, L 4-6, 1, 1, 0, -3, 0, 1, 0, 0, 0, 0, 4, 3, 0, 1, 1, 0, 1.5
Ryan Johansen, O, Nsh, C, FA, NYI, W 5-4, 1, 0, 0, 0, 0, 0, 0, 0, 0, 0, 11, 6, 0, 0, 0, 2, 1.5
Vladislav Gavrikov, Healthy, LA, D, FA, --, --, 1, 0, 0, 3, 0, 0, 0, 0, 0, 0, 0, 0, 0, 0, 0, 0, 1.5
Timothy Liljegren, Healthy, Tor, D, FA, NJ, L 2-3, 1, 0, 0, 0, 0, 0, 0, 0, 0, 0, 0, 0, 0, 2, 1, 2, 1.5
Mario Ferraro, Healthy, SJ, D, FA, Det, L 4-7, 1, 0, 0, -1, 0, 0, 0, 0, 0, 0, 0, 0, 0, 1, 3, 2, 1.5
Kent Johnson, Healthy, Cls, C- LW, FA, Mon, W 6-4, 1, 0, 1, 0, 0, 0, 0, 0, 0, 0, 0, 0, 0, 0, 0, 0, 1.5
Joel Farabee, Healthy, Phi, LW- RW, FA, @Bos, L 1-4, 1, 0, 0, -1, 0, 0, 0, 0, 0, 0, 0, 1, 0, 1, 0, 4, 1.5
Juraj Slafkovsky, IR, Mon, LW, SLC, @Cls, L 4-6, 1, 0, 1, 0, 2, 0, 0, 0, 0, 0, 0, 0, 0, 2, 0, 0, 1.5
Brandon Carlo, Healthy, Bos, D, FA, Phi, W 4-1, 1, 0, 0, 0, 0, 0, 0, 0, 0, 0, 0, 0, 0, 1, 3, 1, 1.5
Jordan Oesterle, Healthy, Det, D, FA, @SJ, W 7-4, 1, 0, 0, 2, 0, 0, 0, 0, 0, 0, 0, 0, 0, 2, 1, 0, 1.5
Kyle Capobianco, Healthy, Wpg, D, FA, Ana, W 3-2, 1, 0, 0, 0, 0, 0, 0, 0, 0, 0, 0, 0, 0, 1, 3, 1, 1.5
Max Willman, Healthy, Phi, C- LW, FA, @Bos, L 1-4, 1, 0, 0, 0, 2, 0, 0, 0, 0, 0, 0, 0, 0, 1, 2, 2, 1.5
Anton Blidh, Healthy, NYR, LW, FA, @Sea, L 2-3, 1, 0, 0, 0, 2, 0, 0, 0, 0, 0, 0, 0, 0, 0, 4, 1, 1.5
Nick Cicek, Healthy, SJ, D, FA, Det, L 4-7, 1, 0, 1, 0, 0, 0, 0, 0, 0, 0, 0, 0, 0, 0, 0, 0, 1.5
Nic Dowd, Healthy, Wsh, C, FA, @StL, L 4-5, 1, 0, 1, 0, 0, 0, 0, 0, 1, 0, 2, 13, 0, 3, 0, 0, 1.45
Haydn Fleury, Healthy, TB, D, FA, Cgy, W 4-1, 1, 0, 0, 1, 2, 0, 0, 0, 0, 0, 0, 0, 0, 0, 2, 1, 1.4
John Tavares, Healthy, Tor, C, BBS, NJ, L 2-3, 1, 0, 0, 0, 0, 0, 0, 0, 0, 0, 9, 7, 0, 3, 3, 0, 1.4
Noah Hanifin, Healthy, Cgy, D, BOWS, @TB, L 1-4, 1, 0, 0, -1, 0, 0, 0, 0, 0, 0, 0, 0, 0, 3, 2, 2, 1.4
Chris Tanev, DTD, Cgy, D, FA, @TB, L 1-4, 1, 0, 0, -2, 0, 0, 0, 0, 0, 0, 0, 0, 0, 0, 3, 3, 1.4
Morgan Frost, Healthy, Phi, C- RW, FA, @Bos, L 1-4, 1, 0, 0, -1, 0, 0, 0, 0, 0, 0, 8, 4, 0, 4, 2, 1, 1.4
"Liam OBrien", Healthy, Ari, LW- C, FA, @Vgk, L 1-4, 1, 0, 0, 0, 5, 0, 0, 0, 0, 0, 0, 1, 0, 0, 5, 1, 1.4
Joel Kiviranta, Healthy, Dal, LW- RW, FA, @Fla, W 6-4, 1, 0, 0, 1, 0, 0, 0, 0, 0, 0, 0, 0, 0, 1, 1, 1, 1.4
Andreas Englund, Healthy, Chi, D, FA, --, --, 1, 0, 0, -1, 0, 0, 0, 0, 0, 0, 0, 0, 0, 0, 3, 2, 1.4
Nikita Alexandrov, Healthy, StL, C, FA, Wsh, W 5-4, 1, 0, 0, 0, 0, 0, 0, 0, 0, 0, 0, 0, 0, 0, 3, 1, 1.4
