Name, Health, NHL Team, Position, GFHL Team, Opponent, Score, GS, W, L, GA, SV, SO, FPTS
Elvis Merzlikins, Healthy, Cls, G, BOWS, Wpg, W 3-0, 1, 1, 0, 0, 36, 1, 9.6
Tristan Jarry, O, Pit, G, DINK, Van, W 4-1, 1, 1, 0, 1, 36, 0, 7.1
Cam Talbot, Healthy, Min, G, HERB, @NJ, W 3-2, 1, 1, 0, 2, 40, 0, 7.0
Philipp Grubauer, Healthy, Sea, G, FA, Car, W 2-1, 1, 1, 0, 1, 35, 0, 7.0
Sergei Bobrovsky, Healthy, Fla, G, SALT, Phi, W 2-1, 1, 1, 0, 1, 32, 0, 6.7
Alex Nedeljkovic, Healthy, Det, G, FA, StL, W 4-2, 1, 1, 0, 2, 35, 0, 6.5
Jack Campbell, Healthy, Tor, G, OXP, @LA, W 6-2, 1, 1, 0, 2, 30, 0, 6.0
Jeremy Swayman, Healthy, Bos, G, BBS, @Buf, W 5-1, 1, 1, 0, 1, 24, 0, 5.9
Robin Lehner, O, VGK, G, ME, @Nsh, W 5-2, 1, 1, 0, 2, 26, 0, 5.6
Igor Shesterkin, Healthy, NYR, G, DINK, @NYI, W 4-1, 1, 1, 0, 1, 20, 0, 5.5
Jonas Johansson, IR, Fla, G, FA, Phi, W 2-1, 0, 1, 0, 1, 19, 0, 5.4
James Reimer, Healthy, SJ, G, OXP, Ott, W 6-3, 1, 1, 0, 3, 26, 0, 5.1
Ilya Samsonov, Healthy, Wsh, G, FA, Mon, W 6-3, 1, 1, 0, 3, 25, 0, 5.0
Mikko Koskinen, Healthy, Edm, G, ME, @Ari, W 5-3, 1, 1, 0, 3, 24, 0, 4.9
Martin Jones, Healthy, Phi, G, FA, @Fla, L 1-2, 1, 0, 0, 2, 43, 0, 3.3
Dustin Tokarski, Healthy, Buf, G, FA, Bos, L 1-5, 0, 0, 0, 1, 24, 0, 1.9
Mackenzie Blackwood, Healthy, NJ, G, FA, Min, L 2-3, 1, 0, 0, 2, 25, 0, 1.5
Connor Hellebuyck, Healthy, Wpg, G, ME, @Cls, L 0-3, 1, 0, 1, 2, 29, 0, 0.9
Scott Wedgewood, Healthy, Dal, G, FA, --, --, 1, 0, 1, 4, 39, 0, 0.9
Thatcher Demko, DTD, Van, G, BOWS, @Pit, L 1-4, 1, 0, 1, 3, 33, 0, 0.8
Darcy Kuemper, Healthy, Col, G, SALT, Ana, W 5-2, 1, 0, 0, 1, 5, 0, 0.0
Juuse Saros, O, Nsh, G, BOWS, VGK, L 2-5, 1, 0, 1, 4, 30, 0, 0.0
Frederik Andersen, DTD, Car, G, HERB, @Sea, L 1-2, 1, 0, 1, 2, 20, 0, 0.0
Ilya Sorokin, Healthy, NYI, G, CLB, NYR, L 1-4, 0, 0, 0, 0, 0, 0, --
Linus Ullmark, Healthy, Bos, G, CLB, @Buf, W 5-1, 0, 0, 0, 0, 0, 0, --
Mike Smith, Healthy, Edm, G, LKR, @Ari, W 5-3, 0, 0, 0, 0, 0, 0, --
Jordan Binnington, Healthy, StL, G, FA, @Det, L 2-4, 0, 0, 0, 0, 0, 0, --
Carter Hart, O, Phi, G, FA, @Fla, L 1-2, 0, 0, 0, 0, 0, 0, --
Spencer Knight, Healthy, Fla, G, BBS, Phi, W 2-1, 0, 0, 0, 0, 0, 0, --
Vitek Vanecek, Healthy, Wsh, G, FA, Mon, W 6-3, 0, 0, 0, 0, 0, 0, --
Carey Price, O, Mon, G, LKR, @Wsh, L 3-6, 0, 0, 0, 0, 0, 0, --
Adin Hill, O, SJ, G, FA, Ott, W 6-3, 0, 0, 0, 0, 0, 0, --
Anton Forsberg, Healthy, Ott, G, BOWS, @SJ, L 3-6, 0, 0, 0, 0, 0, 0, --
Antti Raanta, Healthy, Car, G, FA, @Sea, L 1-2, 0, 0, 0, 0, 0, 0, --
Pavel Francouz, Healthy, Col, G, DINK, Ana, W 5-2, 0, 0, 0, 0, 0, 0, --
Petr Mrazek, IR, Tor, G, FA, @LA, W 6-2, 0, 0, 0, 0, 0, 0, --
Cal Petersen, Healthy, LA, G, FA, Tor, L 2-6, 0, 0, 0, 0, 0, 0, --
Casey DeSmith, Healthy, Pit, G, FA, Van, W 4-1, 0, 0, 0, 0, 0, 0, --
Alexandar Georgiev, Healthy, NYR, G, NBUS, @NYI, W 4-1, 0, 0, 0, 0, 0, 0, --
Chris Driedger, Healthy, Sea, G, FA, Car, W 2-1, 0, 0, 0, 0, 0, 0, --
Tuukka Rask, O, Bos, G, FA, @Buf, W 5-1, 0, 0, 0, 0, 0, 0, --
Kaapo Kahkonen, Healthy, SJ, G, FA, Ott, W 6-3, 0, 0, 0, 0, 0, 0, --
Logan Thompson, Healthy, VGK, G, FA, @Nsh, W 5-2, 0, 0, 0, 0, 0, 0, --
Craig Anderson, DTD, Buf, G, FA, Bos, L 1-5, 0, 0, 0, 0, 0, 0, --
Anthony Stolarz, Healthy, Ana, G, FA, @Col, L 2-5, 0, 0, 0, 0, 0, 0, --
Jaroslav Halak, O, Van, G, FA, @Pit, L 1-4, 0, 0, 0, 0, 0, 0, --
Thomas Greiss, Healthy, Det, G, FA, StL, W 4-2, 0, 0, 0, 0, 0, 0, --
Karel Vejmelka, Healthy, Ari, G, FA, Edm, L 3-5, 0, 0, 0, 0, 0, 0, --
Laurent Brossoit, IR, VGK, G, FA, @Nsh, W 5-2, 0, 0, 0, 0, 0, 0, --
Jonathan Bernier, IR, NJ, G, FA, Min, L 2-3, 0, 0, 0, 0, 0, 0, --
David Rittich, Healthy, Nsh, G, FA, VGK, L 2-5, 0, 0, 0, 0, 0, 0, --
Louis Domingue, Healthy, Pit, G, FA, Van, W 4-1, 0, 0, 0, 0, 0, 0, --
Sam Montembeault, Healthy, Mon, G, FA, @Wsh, L 3-6, 0, 0, 0, 0, 0, 0, --
Joonas Korpisalo, O, Cls, G, FA, Wpg, W 3-0, 0, 0, 0, 0, 0, 0, --
Eric Comrie, Healthy, Wpg, G, FA, @Cls, L 0-3, 0, 0, 0, 0, 0, 0, --
Charlie Lindgren, Healthy, StL, G, FA, @Det, L 2-4, 0, 0, 0, 0, 0, 0, --
Nico Daws, Healthy, NJ, G, FA, Min, L 2-3, 0, 0, 0, 0, 0, 0, --
Filip Gustavsson, Healthy, Ott, G, FA, @SJ, L 3-6, 0, 0, 0, 0, 0, 0, --
Stuart Skinner, Healthy, Edm, G, FA, @Ari, W 5-3, 0, 0, 0, 0, 0, 0, --
Ukko-Pekka Luukkonen, Healthy, Buf, G, FA, Bos, L 1-5, 0, 0, 0, 0, 0, 0, --
Devan Dubnyk, Healthy, Col, G, FA, Ana, W 5-2, 0, 0, 0, 0, 0, 0, --
Henrik Lundqvist, IR, Wsh, G, FA, Mon, W 6-3, 0, 0, 0, 0, 0, 0, --
Andrew Hammond, Healthy, NJ, G, FA, Min, L 2-3, 0, 0, 0, 0, 0, 0, --
Kasimir Kaskisuo, Healthy, Nsh, G, FA, VGK, L 2-5, 0, 0, 0, 0, 0, 0, --
Pekka Rinne, Healthy, Nsh, G, FA, VGK, L 2-5, 0, 0, 0, 0, 0, 0, --
Zach Fucale, Healthy, Wsh, G, FA, Mon, W 6-3, 0, 0, 0, 0, 0, 0, --
Carter Hutton, Healthy, Tor, G, FA, @LA, W 6-2, 0, 0, 0, 0, 0, 0, --
Yaroslav Askarov, Healthy, Nsh, G, FA, VGK, L 2-5, 0, 0, 0, 0, 0, 0, --
Marcus Hogberg, O, Ott, G, FA, @SJ, L 3-6, 0, 0, 0, 0, 0, 0, --
Corey Crawford, Healthy, NJ, G, FA, Min, L 2-3, 0, 0, 0, 0, 0, 0, --
Joseph Woll, O, Tor, G, FA, @LA, W 6-2, 0, 0, 0, 0, 0, 0, --
Josef Korenar, Healthy, Ari, G, FA, Edm, L 3-5, 0, 0, 0, 0, 0, 0, --
Jesper Wallstedt, Healthy, Min, G, FA, @NJ, W 3-2, 0, 0, 0, 0, 0, 0, --
Ryan Miller, Healthy, Ana, G, FA, @Col, L 2-5, 0, 0, 0, 0, 0, 0, --
Cayden Primeau, Healthy, Mon, G, FA, @Wsh, L 3-6, 0, 0, 0, 0, 0, 0, --
Keith Kinkaid, Healthy, NYR, G, FA, @NYI, W 4-1, 0, 0, 0, 0, 0, 0, --
Joey Daccord, Healthy, Sea, G, FA, Car, W 2-1, 0, 0, 0, 0, 0, 0, --
Michael Houser, Healthy, Buf, G, FA, Bos, L 1-5, 0, 0, 0, 0, 0, 0, --
Jimmy Howard, Healthy, Det, G, FA, StL, W 4-2, 0, 0, 0, 0, 0, 0, --
Michael DiPietro, Healthy, Van, G, FA, @Pit, L 1-4, 0, 0, 0, 0, 0, 0, --
Christopher Gibson, Healthy, Fla, G, FA, Phi, W 2-1, 0, 0, 0, 0, 0, 0, --
Cory Schneider, Healthy, NYI, G, FA, NYR, L 1-4, 0, 0, 0, 0, 0, 0, --
Connor Ingram, Healthy, Nsh, G, FA, VGK, L 2-5, 0, 0, 0, 0, 0, 0, --
Ivan Prosvetov, Healthy, Ari, G, FA, Edm, L 3-5, 0, 0, 0, 0, 0, 0, --
Joel Hofer, Healthy, StL, G, FA, @Det, L 2-4, 0, 0, 0, 0, 0, 0, --
Alex Lyon, Healthy, Car, G, FA, @Sea, L 1-2, 0, 0, 0, 0, 0, 0, --
Michael Hutchinson, Healthy, Tor, G, FA, @LA, W 6-2, 0, 0, 0, 0, 0, 0, --
Garret Sparks, Healthy, LA, G, FA, Tor, L 2-6, 0, 0, 0, 0, 0, 0, --
Alex Stalock, Healthy, SJ, G, FA, Ott, W 6-3, 0, 0, 0, 0, 0, 0, --
Veini Vehvilainen, Healthy, Tor, G, FA, @LA, W 6-2, 0, 0, 0, 0, 0, 0, --
Pheonix Copley, Healthy, Wsh, G, FA, Mon, W 6-3, 0, 0, 0, 0, 0, 0, --
Oscar Dansk, Healthy, VGK, G, FA, @Nsh, W 5-2, 0, 0, 0, 0, 0, 0, --
Danny Taylor, O, Ott, G, FA, @SJ, L 3-6, 0, 0, 0, 0, 0, 0, --
Antoine Bibeau, Healthy, Sea, G, FA, Car, W 2-1, 0, 0, 0, 0, 0, 0, --
Kenneth Appleby, Healthy, NYI, G, FA, NYR, L 1-4, 0, 0, 0, 0, 0, 0, --
Antti Niemi, Healthy, Mon, G, FA, @Wsh, L 3-6, 0, 0, 0, 0, 0, 0, --
Troy Grosenick, Healthy, Bos, G, FA, @Buf, W 5-1, 0, 0, 0, 0, 0, 0, --
Calvin Pickard, DTD, Det, G, FA, StL, W 4-2, 0, 0, 0, 0, 0, 0, --
Kevin Boyle, Healthy, Det, G, FA, StL, W 4-2, 0, 0, 0, 0, 0, 0, --
Niklas Svedberg, Healthy, Min, G, FA, @NJ, W 3-2, 0, 0, 0, 0, 0, 0, --
Hunter Miska, Healthy, Col, G, FA, Ana, W 5-2, 0, 0, 0, 0, 0, 0, --
Kaden Fulcher, Healthy, Det, G, FA, StL, W 4-2, 0, 0, 0, 0, 0, 0, --
Eddie Lack, Healthy, NJ, G, FA, Min, L 2-3, 0, 0, 0, 0, 0, 0, --
Jared Coreau, Healthy, NYI, G, FA, NYR, L 1-4, 0, 0, 0, 0, 0, 0, --
Gilles Senn, Healthy, NJ, G, FA, Min, L 2-3, 0, 0, 0, 0, 0, 0, --
Alexei Melnichuk, Healthy, TB, G, FA, --, --, 0, 0, 0, 0, 0, 0, --
Shane Starrett, Healthy, Edm, G, FA, @Ari, W 5-3, 0, 0, 0, 0, 0, 0, --
John Gibson, Healthy, Ana, G, ME, @Col, L 2-5, 1, 0, 1, 5, 31, 0, -0.4
Ville Husso, Healthy, StL, G, BBS, @Det, L 2-4, 1, 0, 1, 3, 19, 0, -0.6
Matt Murray, IR, Ott, G, FA, @SJ, L 3-6, 1, 0, 1, 4, 23, 0, -0.7
Jonathan Quick, Healthy, LA, G, FA, Tor, L 2-6, 1, 0, 1, 6, 32, 0, -0.8
Jake Allen, O, Mon, G, FA, @Wsh, L 3-6, 1, 0, 1, 6, 28, 0, -1.2
Aaron Dell, Healthy, Buf, G, FA, Bos, L 1-5, 1, 0, 1, 4, 18, 0, -1.2
Semyon Varlamov, Healthy, NYI, G, FA, NYR, L 1-4, 1, 0, 1, 4, 17, 0, -1.3
Andrei Vasilevskiy, Healthy, TB, G, LKR, --, --, 0, 0, 0, 0, 0, 0, --
Jacob Markstrom, Healthy, Cgy, G, DINK, --, --, 0, 0, 0, 0, 0, 0, --
Marc-Andre Fleury, Healthy, Min, G, SALT, @NJ, W 3-2, 0, 0, 0, 0, 0, 0, --
Jake Oettinger, Healthy, Dal, G, HERB, --, --, 0, 0, 0, 0, 0, 0, --
Kevin Lankinen, Healthy, Chi, G, NBUS, --, --, 0, 0, 0, 0, 0, 0, --
Braden Holtby, IR, Dal, G, FA, --, --, 0, 0, 0, 0, 0, 0, --
Ben Bishop, IR, Dal, G, FA, --, --, 0, 0, 0, 0, 0, 0, --
Anton Khudobin, O, Dal, G, FA, --, --, 0, 0, 0, 0, 0, 0, --
Dan Vladar, Healthy, Cgy, G, BBS, --, --, 0, 0, 0, 0, 0, 0, --
Erik Kallgren, Healthy, Tor, G, FA, @LA, W 6-2, 0, 0, 0, 0, 0, 0, --
Brian Elliott, Healthy, TB, G, FA, --, --, 0, 0, 0, 0, 0, 0, --
Felix Sandstrom, Healthy, Phi, G, FA, @Fla, L 1-2, 0, 0, 0, 0, 0, 0, --
Spencer Martin, Healthy, Van, G, FA, @Pit, L 1-4, 0, 0, 0, 0, 0, 0, --
Malcolm Subban, IR, Buf, G, FA, Bos, L 1-5, 0, 0, 0, 0, 0, 0, --
Jean-Francois Berube, Healthy, Cls, G, FA, Wpg, W 3-0, 0, 0, 0, 0, 0, 0, --
Curtis McElhinney, Healthy, TB, G, FA, --, --, 0, 0, 0, 0, 0, 0, --
Pyotr Kochetkov, Healthy, Car, G, FA, @Sea, L 1-2, 0, 0, 0, 0, 0, 0, --
Jon Gillies, Healthy, NJ, G, FA, Min, L 2-3, 0, 0, 0, 0, 0, 0, --
Artyom Zagidulin, Healthy, Cgy, G, FA, --, --, 0, 0, 0, 0, 0, 0, --
Dustin Wolf, Healthy, Cgy, G, FA, --, --, 0, 0, 0, 0, 0, 0, --
Mads Sogaard, Healthy, Ott, G, FA, @SJ, L 3-6, 0, 0, 0, 0, 0, 0, --
Harri Sateri, Healthy, Ari, G, FA, Edm, L 3-5, 0, 0, 0, 0, 0, 0, --
Collin Delia, Healthy, Chi, G, FA, --, --, 0, 0, 0, 0, 0, 0, --
Daniil Tarasov, IR, Cls, G, FA, Wpg, W 3-0, 0, 0, 0, 0, 0, 0, --
Adam Werner, Healthy, Cgy, G, FA, --, --, 0, 0, 0, 0, 0, 0, --
Justus Annunen, Healthy, Col, G, FA, Ana, W 5-2, 0, 0, 0, 0, 0, 0, --
Jeff Glass, Healthy, Chi, G, FA, --, --, 0, 0, 0, 0, 0, 0, --
Maxime Lagace, Healthy, TB, G, FA, --, --, 0, 0, 0, 0, 0, 0, --
Lukas Dostal, Healthy, Ana, G, FA, @Col, L 2-5, 0, 0, 0, 0, 0, 0, --
Mike Condon, Healthy, TB, G, FA, --, --, 0, 0, 0, 0, 0, 0, --
Zach Sawchenko, Healthy, SJ, G, FA, Ott, W 6-3, 0, 0, 0, 0, 0, 0, --
Akira Schmid, Healthy, NJ, G, FA, Min, L 2-3, 0, 0, 0, 0, 0, 0, --
Anders Nilsson, Healthy, TB, G, FA, --, --, 0, 0, 0, 0, 0, 0, --
Arvid Soderblom, Healthy, Chi, G, FA, --, --, 0, 0, 0, 0, 0, 0, --
Landon Bow, Healthy, Dal, G, FA, --, --, 0, 0, 0, 0, 0, 0, --
Hugo Alnefelt, Healthy, TB, G, FA, --, --, 0, 0, 0, 0, 0, 0, --
Jack LaFontaine, Healthy, Car, G, FA, @Sea, L 1-2, 0, 0, 0, 0, 0, 0, --
Adam Huska, Healthy, NYR, G, FA, @NYI, W 4-1, 0, 0, 0, 0, 0, 0, --
Michael McNiven, Healthy, Ott, G, FA, @SJ, L 3-6, 0, 0, 0, 0, 0, 0, --
