Name, Health, NHL Team, Position, GFHL Team, Opponent, Score, GS, W, L, GA, SV, SO, FPTS
Alex Nedeljkovic, Healthy, Det, G, FA, @NJ, W 3-0, 1, 1, 0, 0, 17, 1, 7.7
Martin Jones, Healthy, Phi, G, FA, Pit, W 4-1, 1, 1, 0, 1, 37, 0, 7.2
Connor Hellebuyck, Healthy, Wpg, G, ME, Col, W 4-1, 1, 1, 0, 1, 30, 0, 6.5
Elvis Merzlikins, Healthy, Cls, G, BOWS, Edm, W 5-2, 1, 1, 0, 2, 33, 0, 6.3
James Reimer, Healthy, SJ, G, OXP, @VGK, W 5-4, 1, 1, 0, 4, 42, 0, 6.2
Erik Kallgren, Healthy, Tor, G, FA, @Wsh, W 4-3, 1, 1, 0, 3, 34, 0, 5.9
Andrei Vasilevskiy, Healthy, TB, G, LKR, @Fla, W 8-4, 1, 1, 0, 4, 35, 0, 5.5
Jeremy Swayman, Healthy, Bos, G, BBS, @Mon, W 5-3, 1, 1, 0, 3, 23, 0, 4.8
Pyotr Kochetkov, Healthy, Car, G, FA, @NYI, W 5-2, 0, 1, 0, 1, 7, 0, 4.2
Marc-Andre Fleury, Healthy, Min, G, SALT, @Nsh, W 5-4, 1, 1, 0, 4, 21, 0, 4.1
Ville Husso, Healthy, StL, G, BBS, @Ana, W 6-3, 1, 1, 0, 3, 14, 0, 3.9
David Rittich, Healthy, Nsh, G, FA, Min, L 4-5, 1, 0, 0, 5, 42, 0, 1.7
Louis Domingue, Healthy, Pit, G, FA, @Phi, L 1-4, 1, 0, 1, 3, 39, 0, 1.4
Vitek Vanecek, Healthy, Wsh, G, FA, Tor, L 3-4, 1, 0, 0, 3, 27, 0, 1.2
Antti Raanta, Healthy, Car, G, FA, @NYI, W 5-2, 1, 0, 0, 1, 17, 0, 1.2
Darcy Kuemper, Healthy, Col, G, SALT, @Wpg, L 1-4, 1, 0, 1, 4, 40, 0, 1.0
Sam Montembeault, Healthy, Mon, G, FA, Bos, L 3-5, 1, 0, 1, 4, 37, 0, 0.7
Andrew Hammond, Healthy, NJ, G, FA, Det, L 0-3, 1, 0, 1, 1, 21, 0, 0.6
Logan Thompson, Healthy, VGK, G, FA, SJ, L 4-5, 1, 0, 0, 4, 25, 0, 0.5
Semyon Varlamov, Healthy, NYI, G, FA, Car, L 2-5, 1, 0, 1, 3, 29, 0, 0.4
Juuse Saros, O, Nsh, G, BOWS, Min, L 4-5, 0, 0, 0, 0, 0, 0, --
Jack Campbell, Healthy, Tor, G, OXP, @Wsh, W 4-3, 0, 0, 0, 0, 0, 0, --
Cam Talbot, Healthy, Min, G, HERB, @Nsh, W 5-4, 0, 0, 0, 0, 0, 0, --
Frederik Andersen, DTD, Car, G, HERB, @NYI, W 5-2, 0, 0, 0, 0, 0, 0, --
Tristan Jarry, O, Pit, G, DINK, @Phi, L 1-4, 0, 0, 0, 0, 0, 0, --
Ilya Sorokin, Healthy, NYI, G, CLB, Car, L 2-5, 0, 0, 0, 0, 0, 0, --
Linus Ullmark, Healthy, Bos, G, CLB, @Mon, W 5-3, 0, 0, 0, 0, 0, 0, --
Mike Smith, Healthy, Edm, G, LKR, @Cls, L 2-5, 0, 0, 0, 0, 0, 0, --
Robin Lehner, O, VGK, G, ME, SJ, L 4-5, 0, 0, 0, 0, 0, 0, --
Jordan Binnington, Healthy, StL, G, FA, @Ana, W 6-3, 0, 0, 0, 0, 0, 0, --
Ilya Samsonov, Healthy, Wsh, G, FA, Tor, L 3-4, 0, 0, 0, 0, 0, 0, --
Carter Hart, O, Phi, G, FA, Pit, W 4-1, 0, 0, 0, 0, 0, 0, --
Mackenzie Blackwood, Healthy, NJ, G, FA, Det, L 0-3, 0, 0, 0, 0, 0, 0, --
Carey Price, O, Mon, G, LKR, Bos, L 3-5, 0, 0, 0, 0, 0, 0, --
Adin Hill, O, SJ, G, FA, @VGK, W 5-4, 0, 0, 0, 0, 0, 0, --
Pavel Francouz, Healthy, Col, G, DINK, @Wpg, L 1-4, 0, 0, 0, 0, 0, 0, --
Petr Mrazek, IR, Tor, G, FA, @Wsh, W 4-3, 0, 0, 0, 0, 0, 0, --
Casey DeSmith, Healthy, Pit, G, FA, @Phi, L 1-4, 0, 0, 0, 0, 0, 0, --
Tuukka Rask, O, Bos, G, FA, @Mon, W 5-3, 0, 0, 0, 0, 0, 0, --
Kaapo Kahkonen, Healthy, SJ, G, FA, @VGK, W 5-4, 0, 0, 0, 0, 0, 0, --
Jake Allen, O, Mon, G, FA, Bos, L 3-5, 0, 0, 0, 0, 0, 0, --
Anthony Stolarz, Healthy, Ana, G, FA, StL, L 3-6, 0, 0, 0, 0, 0, 0, --
Thomas Greiss, Healthy, Det, G, FA, @NJ, W 3-0, 0, 0, 0, 0, 0, 0, --
Brian Elliott, Healthy, TB, G, FA, @Fla, W 8-4, 0, 0, 0, 0, 0, 0, --
Laurent Brossoit, IR, VGK, G, FA, SJ, L 4-5, 0, 0, 0, 0, 0, 0, --
Jonathan Bernier, IR, NJ, G, FA, Det, L 0-3, 0, 0, 0, 0, 0, 0, --
Felix Sandstrom, Healthy, Phi, G, FA, Pit, W 4-1, 0, 0, 0, 0, 0, 0, --
Joonas Korpisalo, O, Cls, G, FA, Edm, W 5-2, 0, 0, 0, 0, 0, 0, --
Eric Comrie, Healthy, Wpg, G, FA, Col, W 4-1, 0, 0, 0, 0, 0, 0, --
Charlie Lindgren, Healthy, StL, G, FA, @Ana, W 6-3, 0, 0, 0, 0, 0, 0, --
Nico Daws, Healthy, NJ, G, FA, Det, L 0-3, 0, 0, 0, 0, 0, 0, --
Stuart Skinner, Healthy, Edm, G, FA, @Cls, L 2-5, 0, 0, 0, 0, 0, 0, --
Jean-Francois Berube, Healthy, Cls, G, FA, Edm, W 5-2, 0, 0, 0, 0, 0, 0, --
Devan Dubnyk, Healthy, Col, G, FA, @Wpg, L 1-4, 0, 0, 0, 0, 0, 0, --
Henrik Lundqvist, IR, Wsh, G, FA, Tor, L 3-4, 0, 0, 0, 0, 0, 0, --
Kasimir Kaskisuo, Healthy, Nsh, G, FA, Min, L 4-5, 0, 0, 0, 0, 0, 0, --
Curtis McElhinney, Healthy, TB, G, FA, @Fla, W 8-4, 0, 0, 0, 0, 0, 0, --
Pekka Rinne, Healthy, Nsh, G, FA, Min, L 4-5, 0, 0, 0, 0, 0, 0, --
Zach Fucale, Healthy, Wsh, G, FA, Tor, L 3-4, 0, 0, 0, 0, 0, 0, --
Carter Hutton, Healthy, Tor, G, FA, @Wsh, W 4-3, 0, 0, 0, 0, 0, 0, --
Yaroslav Askarov, Healthy, Nsh, G, FA, Min, L 4-5, 0, 0, 0, 0, 0, 0, --
Corey Crawford, Healthy, NJ, G, FA, Det, L 0-3, 0, 0, 0, 0, 0, 0, --
Joseph Woll, O, Tor, G, FA, @Wsh, W 4-3, 0, 0, 0, 0, 0, 0, --
Jesper Wallstedt, Healthy, Min, G, FA, @Nsh, W 5-4, 0, 0, 0, 0, 0, 0, --
Jon Gillies, Healthy, NJ, G, FA, Det, L 0-3, 0, 0, 0, 0, 0, 0, --
Ryan Miller, Healthy, Ana, G, FA, StL, L 3-6, 0, 0, 0, 0, 0, 0, --
Cayden Primeau, Healthy, Mon, G, FA, Bos, L 3-5, 0, 0, 0, 0, 0, 0, --
Jonas Johansson, IR, Fla, G, FA, TB, L 4-8, 0, 0, 0, 0, 0, 0, --
Jimmy Howard, Healthy, Det, G, FA, @NJ, W 3-0, 0, 0, 0, 0, 0, 0, --
Christopher Gibson, Healthy, Fla, G, FA, TB, L 4-8, 0, 0, 0, 0, 0, 0, --
Cory Schneider, Healthy, NYI, G, FA, Car, L 2-5, 0, 0, 0, 0, 0, 0, --
Connor Ingram, Healthy, Nsh, G, FA, Min, L 4-5, 0, 0, 0, 0, 0, 0, --
Daniil Tarasov, IR, Cls, G, FA, Edm, W 5-2, 0, 0, 0, 0, 0, 0, --
Joel Hofer, Healthy, StL, G, FA, @Ana, W 6-3, 0, 0, 0, 0, 0, 0, --
Justus Annunen, Healthy, Col, G, FA, @Wpg, L 1-4, 0, 0, 0, 0, 0, 0, --
Alex Lyon, Healthy, Car, G, FA, @NYI, W 5-2, 0, 0, 0, 0, 0, 0, --
Michael Hutchinson, Healthy, Tor, G, FA, @Wsh, W 4-3, 0, 0, 0, 0, 0, 0, --
Maxime Lagace, Healthy, TB, G, FA, @Fla, W 8-4, 0, 0, 0, 0, 0, 0, --
Alex Stalock, Healthy, SJ, G, FA, @VGK, W 5-4, 0, 0, 0, 0, 0, 0, --
Lukas Dostal, Healthy, Ana, G, FA, StL, L 3-6, 0, 0, 0, 0, 0, 0, --
Veini Vehvilainen, Healthy, Tor, G, FA, @Wsh, W 4-3, 0, 0, 0, 0, 0, 0, --
Pheonix Copley, Healthy, Wsh, G, FA, Tor, L 3-4, 0, 0, 0, 0, 0, 0, --
Oscar Dansk, Healthy, VGK, G, FA, SJ, L 4-5, 0, 0, 0, 0, 0, 0, --
Mike Condon, Healthy, TB, G, FA, @Fla, W 8-4, 0, 0, 0, 0, 0, 0, --
Kenneth Appleby, Healthy, NYI, G, FA, Car, L 2-5, 0, 0, 0, 0, 0, 0, --
Antti Niemi, Healthy, Mon, G, FA, Bos, L 3-5, 0, 0, 0, 0, 0, 0, --
Troy Grosenick, Healthy, Bos, G, FA, @Mon, W 5-3, 0, 0, 0, 0, 0, 0, --
Zach Sawchenko, Healthy, SJ, G, FA, @VGK, W 5-4, 0, 0, 0, 0, 0, 0, --
Calvin Pickard, DTD, Det, G, FA, @NJ, W 3-0, 0, 0, 0, 0, 0, 0, --
Kevin Boyle, Healthy, Det, G, FA, @NJ, W 3-0, 0, 0, 0, 0, 0, 0, --
Niklas Svedberg, Healthy, Min, G, FA, @Nsh, W 5-4, 0, 0, 0, 0, 0, 0, --
Hunter Miska, Healthy, Col, G, FA, @Wpg, L 1-4, 0, 0, 0, 0, 0, 0, --
Akira Schmid, Healthy, NJ, G, FA, Det, L 0-3, 0, 0, 0, 0, 0, 0, --
Kaden Fulcher, Healthy, Det, G, FA, @NJ, W 3-0, 0, 0, 0, 0, 0, 0, --
Eddie Lack, Healthy, NJ, G, FA, Det, L 0-3, 0, 0, 0, 0, 0, 0, --
Anders Nilsson, Healthy, TB, G, FA, @Fla, W 8-4, 0, 0, 0, 0, 0, 0, --
Jared Coreau, Healthy, NYI, G, FA, Car, L 2-5, 0, 0, 0, 0, 0, 0, --
Gilles Senn, Healthy, NJ, G, FA, Det, L 0-3, 0, 0, 0, 0, 0, 0, --
Alexei Melnichuk, Healthy, TB, G, FA, @Fla, W 8-4, 0, 0, 0, 0, 0, 0, --
Shane Starrett, Healthy, Edm, G, FA, @Cls, L 2-5, 0, 0, 0, 0, 0, 0, --
Hugo Alnefelt, Healthy, TB, G, FA, @Fla, W 8-4, 0, 0, 0, 0, 0, 0, --
Jack LaFontaine, Healthy, Car, G, FA, @NYI, W 5-2, 0, 0, 0, 0, 0, 0, --
Sergei Bobrovsky, Healthy, Fla, G, SALT, TB, L 4-8, 0, 0, 0, 3, 13, 0, -0.2
Mikko Koskinen, Healthy, Edm, G, ME, @Cls, L 2-5, 1, 0, 1, 4, 26, 0, -0.4
John Gibson, Healthy, Ana, G, ME, StL, L 3-6, 1, 0, 1, 6, 31, 0, -0.9
Spencer Knight, Healthy, Fla, G, BBS, TB, L 4-8, 1, 0, 1, 5, 12, 0, -2.3
Igor Shesterkin, Healthy, NYR, G, DINK, --, --, 0, 0, 0, 0, 0, 0, --
Jacob Markstrom, Healthy, Cgy, G, DINK, --, --, 0, 0, 0, 0, 0, 0, --
Thatcher Demko, DTD, Van, G, BOWS, --, --, 0, 0, 0, 0, 0, 0, --
Philipp Grubauer, Healthy, Sea, G, FA, --, --, 0, 0, 0, 0, 0, 0, --
Jake Oettinger, Healthy, Dal, G, HERB, --, --, 0, 0, 0, 0, 0, 0, --
Jonathan Quick, Healthy, LA, G, FA, --, --, 0, 0, 0, 0, 0, 0, --
Anton Forsberg, Healthy, Ott, G, BOWS, --, --, 0, 0, 0, 0, 0, 0, --
Cal Petersen, Healthy, LA, G, FA, --, --, 0, 0, 0, 0, 0, 0, --
Kevin Lankinen, Healthy, Chi, G, NBUS, --, --, 0, 0, 0, 0, 0, 0, --
Braden Holtby, IR, Dal, G, FA, --, --, 0, 0, 0, 0, 0, 0, --
Alexandar Georgiev, Healthy, NYR, G, NBUS, --, --, 0, 0, 0, 0, 0, 0, --
Chris Driedger, Healthy, Sea, G, FA, --, --, 0, 0, 0, 0, 0, 0, --
Ben Bishop, IR, Dal, G, FA, --, --, 0, 0, 0, 0, 0, 0, --
Anton Khudobin, O, Dal, G, FA, --, --, 0, 0, 0, 0, 0, 0, --
Craig Anderson, DTD, Buf, G, FA, --, --, 0, 0, 0, 0, 0, 0, --
Scott Wedgewood, Healthy, Dal, G, FA, --, --, 0, 0, 0, 0, 0, 0, --
Dan Vladar, Healthy, Cgy, G, BBS, --, --, 0, 0, 0, 0, 0, 0, --
Jaroslav Halak, O, Van, G, FA, --, --, 0, 0, 0, 0, 0, 0, --
Karel Vejmelka, Healthy, Ari, G, FA, --, --, 0, 0, 0, 0, 0, 0, --
Dustin Tokarski, Healthy, Buf, G, FA, --, --, 0, 0, 0, 0, 0, 0, --
Matt Murray, IR, Ott, G, FA, --, --, 0, 0, 0, 0, 0, 0, --
Spencer Martin, Healthy, Van, G, FA, --, --, 0, 0, 0, 0, 0, 0, --
Malcolm Subban, IR, Buf, G, FA, --, --, 0, 0, 0, 0, 0, 0, --
Filip Gustavsson, Healthy, Ott, G, FA, --, --, 0, 0, 0, 0, 0, 0, --
Ukko-Pekka Luukkonen, Healthy, Buf, G, FA, --, --, 0, 0, 0, 0, 0, 0, --
Aaron Dell, Healthy, Buf, G, FA, --, --, 0, 0, 0, 0, 0, 0, --
Marcus Hogberg, O, Ott, G, FA, --, --, 0, 0, 0, 0, 0, 0, --
Josef Korenar, Healthy, Ari, G, FA, --, --, 0, 0, 0, 0, 0, 0, --
Artyom Zagidulin, Healthy, Cgy, G, FA, --, --, 0, 0, 0, 0, 0, 0, --
Keith Kinkaid, Healthy, NYR, G, FA, --, --, 0, 0, 0, 0, 0, 0, --
Dustin Wolf, Healthy, Cgy, G, FA, --, --, 0, 0, 0, 0, 0, 0, --
Mads Sogaard, Healthy, Ott, G, FA, --, --, 0, 0, 0, 0, 0, 0, --
Joey Daccord, Healthy, Sea, G, FA, --, --, 0, 0, 0, 0, 0, 0, --
Harri Sateri, Healthy, Ari, G, FA, --, --, 0, 0, 0, 0, 0, 0, --
Michael Houser, Healthy, Buf, G, FA, --, --, 0, 0, 0, 0, 0, 0, --
Collin Delia, Healthy, Chi, G, FA, --, --, 0, 0, 0, 0, 0, 0, --
Michael DiPietro, Healthy, Van, G, FA, --, --, 0, 0, 0, 0, 0, 0, --
Ivan Prosvetov, Healthy, Ari, G, FA, --, --, 0, 0, 0, 0, 0, 0, --
Adam Werner, Healthy, Cgy, G, FA, --, --, 0, 0, 0, 0, 0, 0, --
Jeff Glass, Healthy, Chi, G, FA, --, --, 0, 0, 0, 0, 0, 0, --
Garret Sparks, Healthy, LA, G, FA, --, --, 0, 0, 0, 0, 0, 0, --
Danny Taylor, O, Ott, G, FA, --, --, 0, 0, 0, 0, 0, 0, --
Antoine Bibeau, Healthy, Sea, G, FA, --, --, 0, 0, 0, 0, 0, 0, --
Arvid Soderblom, Healthy, Chi, G, FA, --, --, 0, 0, 0, 0, 0, 0, --
Landon Bow, Healthy, Dal, G, FA, --, --, 0, 0, 0, 0, 0, 0, --
Adam Huska, Healthy, NYR, G, FA, --, --, 0, 0, 0, 0, 0, 0, --
Michael McNiven, Healthy, Ott, G, FA, --, --, 0, 0, 0, 0, 0, 0, --
