Name, Health, NHL Team, Position, GFHL Team, Opponent, Score, GS, W, L, GA, SV, SO, FPTS
Jack Campbell, Healthy, Tor, G, OXP, Det, W 3-0, 1, 1, 0, 0, 20, 1, 8.0
Mike Smith, Healthy, Edm, G, LKR, @Pit, W 5-1, 1, 1, 0, 1, 33, 0, 6.8
Ilya Sorokin, Healthy, NYI, G, CLB, @Wsh, W 4-1, 1, 1, 0, 1, 32, 0, 6.7
Jake Oettinger, Healthy, Dal, G, HERB, VGK, W 3-2, 1, 1, 0, 2, 33, 0, 6.3
Anthony Stolarz, Healthy, Ana, G, FA, @SJ, W 5-2, 1, 1, 0, 2, 31, 0, 6.1
Karel Vejmelka, Healthy, Ari, G, FA, @Min, W 5-3, 1, 1, 0, 3, 35, 0, 6.0
Spencer Martin, Healthy, Van, G, FA, Sea, W 5-2, 1, 1, 0, 2, 30, 0, 6.0
Anton Forsberg, Healthy, Ott, G, BOWS, NJ, W 5-4, 1, 1, 0, 4, 37, 0, 5.7
Pyotr Kochetkov, Healthy, Car, G, FA, @NYR, W 4-3, 1, 1, 0, 3, 31, 0, 5.6
Andrei Vasilevskiy, Healthy, TB, G, LKR, Cls, W 4-1, 1, 1, 0, 1, 20, 0, 5.5
Darcy Kuemper, Healthy, Col, G, SALT, StL, W 5-3, 1, 1, 0, 3, 29, 0, 5.4
Linus Ullmark, Healthy, Bos, G, CLB, Fla, W 4-2, 1, 1, 0, 2, 19, 0, 4.9
Dan Vladar, Healthy, Cgy, G, BBS, @Nsh, W 5-4, 1, 1, 0, 4, 19, 0, 3.9
Logan Thompson, Healthy, VGK, G, FA, @Dal, L 2-3, 1, 0, 0, 2, 28, 0, 1.8
Juuse Saros, O, Nsh, G, BOWS, Cgy, L 4-5, 1, 0, 0, 3, 30, 0, 1.5
Sergei Bobrovsky, Healthy, Fla, G, SALT, @Bos, L 2-4, 1, 0, 1, 3, 34, 0, 0.9
Alex Nedeljkovic, Healthy, Det, G, FA, @Tor, L 0-3, 1, 0, 1, 3, 33, 0, 0.8
Casey DeSmith, Healthy, Pit, G, FA, Edm, L 1-5, 1, 0, 1, 4, 37, 0, 0.7
Mackenzie Blackwood, Healthy, NJ, G, FA, @Ott, L 4-5, 1, 0, 0, 5, 29, 0, 0.4
Igor Shesterkin, Healthy, NYR, G, DINK, Car, L 3-4, 1, 0, 1, 4, 32, 0, 0.2
Jacob Markstrom, Healthy, Cgy, G, DINK, @Nsh, W 5-4, 0, 0, 0, 0, 0, 0, --
Cam Talbot, Healthy, Min, G, HERB, Ari, L 3-5, 0, 0, 0, 0, 0, 0, --
Thatcher Demko, DTD, Van, G, BOWS, Sea, W 5-2, 0, 0, 0, 0, 0, 0, --
Frederik Andersen, DTD, Car, G, HERB, @NYR, W 4-3, 0, 0, 0, 0, 0, 0, --
Tristan Jarry, O, Pit, G, DINK, Edm, L 1-5, 0, 0, 0, 0, 0, 0, --
Robin Lehner, O, VGK, G, ME, @Dal, L 2-3, 0, 0, 0, 0, 0, 0, --
Ville Husso, Healthy, StL, G, BBS, @Col, L 3-5, 0, 0, 0, 0, 0, 0, --
Philipp Grubauer, Healthy, Sea, G, FA, @Van, L 2-5, 0, 0, 0, 0, 0, 0, --
Semyon Varlamov, Healthy, NYI, G, FA, @Wsh, W 4-1, 0, 0, 0, 0, 0, 0, --
Jeremy Swayman, Healthy, Bos, G, BBS, Fla, W 4-2, 0, 0, 0, 0, 0, 0, --
Spencer Knight, Healthy, Fla, G, BBS, @Bos, L 2-4, 0, 0, 0, 0, 0, 0, --
John Gibson, Healthy, Ana, G, ME, @SJ, W 5-2, 0, 0, 0, 0, 0, 0, --
Vitek Vanecek, Healthy, Wsh, G, FA, NYI, L 1-4, 0, 0, 0, 0, 0, 0, --
Adin Hill, O, SJ, G, FA, Ana, L 2-5, 0, 0, 0, 0, 0, 0, --
Mikko Koskinen, Healthy, Edm, G, ME, @Pit, W 5-1, 0, 0, 0, 0, 0, 0, --
James Reimer, Healthy, SJ, G, OXP, Ana, L 2-5, 0, 0, 0, 0, 0, 0, --
Antti Raanta, Healthy, Car, G, FA, @NYR, W 4-3, 0, 0, 0, 0, 0, 0, --
Pavel Francouz, Healthy, Col, G, DINK, StL, W 5-3, 0, 0, 0, 0, 0, 0, --
Petr Mrazek, IR, Tor, G, FA, Det, W 3-0, 0, 0, 0, 0, 0, 0, --
Braden Holtby, IR, Dal, G, FA, VGK, W 3-2, 0, 0, 0, 0, 0, 0, --
Alexandar Georgiev, Healthy, NYR, G, NBUS, Car, L 3-4, 0, 0, 0, 0, 0, 0, --
Chris Driedger, Healthy, Sea, G, FA, @Van, L 2-5, 0, 0, 0, 0, 0, 0, --
Tuukka Rask, O, Bos, G, FA, Fla, W 4-2, 0, 0, 0, 0, 0, 0, --
Ben Bishop, IR, Dal, G, FA, VGK, W 3-2, 0, 0, 0, 0, 0, 0, --
Anton Khudobin, O, Dal, G, FA, VGK, W 3-2, 0, 0, 0, 0, 0, 0, --
Scott Wedgewood, Healthy, Dal, G, FA, VGK, W 3-2, 0, 0, 0, 0, 0, 0, --
Erik Kallgren, Healthy, Tor, G, FA, Det, W 3-0, 0, 0, 0, 0, 0, 0, --
Jaroslav Halak, O, Van, G, FA, Sea, W 5-2, 0, 0, 0, 0, 0, 0, --
Thomas Greiss, Healthy, Det, G, FA, @Tor, L 0-3, 0, 0, 0, 0, 0, 0, --
Brian Elliott, Healthy, TB, G, FA, Cls, W 4-1, 0, 0, 0, 0, 0, 0, --
Laurent Brossoit, IR, VGK, G, FA, @Dal, L 2-3, 0, 0, 0, 0, 0, 0, --
Matt Murray, IR, Ott, G, FA, NJ, W 5-4, 0, 0, 0, 0, 0, 0, --
Jonathan Bernier, IR, NJ, G, FA, @Ott, L 4-5, 0, 0, 0, 0, 0, 0, --
Louis Domingue, Healthy, Pit, G, FA, Edm, L 1-5, 0, 0, 0, 0, 0, 0, --
Joonas Korpisalo, O, Cls, G, FA, @TB, L 1-4, 0, 0, 0, 0, 0, 0, --
Charlie Lindgren, Healthy, StL, G, FA, @Col, L 3-5, 0, 0, 0, 0, 0, 0, --
Nico Daws, Healthy, NJ, G, FA, @Ott, L 4-5, 0, 0, 0, 0, 0, 0, --
Filip Gustavsson, Healthy, Ott, G, FA, NJ, W 5-4, 0, 0, 0, 0, 0, 0, --
Stuart Skinner, Healthy, Edm, G, FA, @Pit, W 5-1, 0, 0, 0, 0, 0, 0, --
Jean-Francois Berube, Healthy, Cls, G, FA, @TB, L 1-4, 0, 0, 0, 0, 0, 0, --
Devan Dubnyk, Healthy, Col, G, FA, StL, W 5-3, 0, 0, 0, 0, 0, 0, --
Henrik Lundqvist, IR, Wsh, G, FA, NYI, L 1-4, 0, 0, 0, 0, 0, 0, --
Andrew Hammond, Healthy, NJ, G, FA, @Ott, L 4-5, 0, 0, 0, 0, 0, 0, --
Kasimir Kaskisuo, Healthy, Nsh, G, FA, Cgy, L 4-5, 0, 0, 0, 0, 0, 0, --
Curtis McElhinney, Healthy, TB, G, FA, Cls, W 4-1, 0, 0, 0, 0, 0, 0, --
Pekka Rinne, Healthy, Nsh, G, FA, Cgy, L 4-5, 0, 0, 0, 0, 0, 0, --
Zach Fucale, Healthy, Wsh, G, FA, NYI, L 1-4, 0, 0, 0, 0, 0, 0, --
Carter Hutton, Healthy, Tor, G, FA, Det, W 3-0, 0, 0, 0, 0, 0, 0, --
Yaroslav Askarov, Healthy, Nsh, G, FA, Cgy, L 4-5, 0, 0, 0, 0, 0, 0, --
Marcus Hogberg, O, Ott, G, FA, NJ, W 5-4, 0, 0, 0, 0, 0, 0, --
Corey Crawford, Healthy, NJ, G, FA, @Ott, L 4-5, 0, 0, 0, 0, 0, 0, --
Joseph Woll, O, Tor, G, FA, Det, W 3-0, 0, 0, 0, 0, 0, 0, --
Josef Korenar, Healthy, Ari, G, FA, @Min, W 5-3, 0, 0, 0, 0, 0, 0, --
Jesper Wallstedt, Healthy, Min, G, FA, Ari, L 3-5, 0, 0, 0, 0, 0, 0, --
Jon Gillies, Healthy, NJ, G, FA, @Ott, L 4-5, 0, 0, 0, 0, 0, 0, --
Ryan Miller, Healthy, Ana, G, FA, @SJ, W 5-2, 0, 0, 0, 0, 0, 0, --
Artyom Zagidulin, Healthy, Cgy, G, FA, @Nsh, W 5-4, 0, 0, 0, 0, 0, 0, --
Keith Kinkaid, Healthy, NYR, G, FA, Car, L 3-4, 0, 0, 0, 0, 0, 0, --
Dustin Wolf, Healthy, Cgy, G, FA, @Nsh, W 5-4, 0, 0, 0, 0, 0, 0, --
Mads Sogaard, Healthy, Ott, G, FA, NJ, W 5-4, 0, 0, 0, 0, 0, 0, --
Jonas Johansson, IR, Fla, G, FA, @Bos, L 2-4, 0, 0, 0, 0, 0, 0, --
Harri Sateri, Healthy, Ari, G, FA, @Min, W 5-3, 0, 0, 0, 0, 0, 0, --
Jimmy Howard, Healthy, Det, G, FA, @Tor, L 0-3, 0, 0, 0, 0, 0, 0, --
Michael DiPietro, Healthy, Van, G, FA, Sea, W 5-2, 0, 0, 0, 0, 0, 0, --
Christopher Gibson, Healthy, Fla, G, FA, @Bos, L 2-4, 0, 0, 0, 0, 0, 0, --
Cory Schneider, Healthy, NYI, G, FA, @Wsh, W 4-1, 0, 0, 0, 0, 0, 0, --
Connor Ingram, Healthy, Nsh, G, FA, Cgy, L 4-5, 0, 0, 0, 0, 0, 0, --
Daniil Tarasov, IR, Cls, G, FA, @TB, L 1-4, 0, 0, 0, 0, 0, 0, --
Ivan Prosvetov, Healthy, Ari, G, FA, @Min, W 5-3, 0, 0, 0, 0, 0, 0, --
Adam Werner, Healthy, Cgy, G, FA, @Nsh, W 5-4, 0, 0, 0, 0, 0, 0, --
Joel Hofer, Healthy, StL, G, FA, @Col, L 3-5, 0, 0, 0, 0, 0, 0, --
Justus Annunen, Healthy, Col, G, FA, StL, W 5-3, 0, 0, 0, 0, 0, 0, --
Alex Lyon, Healthy, Car, G, FA, @NYR, W 4-3, 0, 0, 0, 0, 0, 0, --
Michael Hutchinson, Healthy, Tor, G, FA, Det, W 3-0, 0, 0, 0, 0, 0, 0, --
Maxime Lagace, Healthy, TB, G, FA, Cls, W 4-1, 0, 0, 0, 0, 0, 0, --
Alex Stalock, Healthy, SJ, G, FA, Ana, L 2-5, 0, 0, 0, 0, 0, 0, --
Lukas Dostal, Healthy, Ana, G, FA, @SJ, W 5-2, 0, 0, 0, 0, 0, 0, --
Veini Vehvilainen, Healthy, Tor, G, FA, Det, W 3-0, 0, 0, 0, 0, 0, 0, --
Pheonix Copley, Healthy, Wsh, G, FA, NYI, L 1-4, 0, 0, 0, 0, 0, 0, --
Oscar Dansk, Healthy, VGK, G, FA, @Dal, L 2-3, 0, 0, 0, 0, 0, 0, --
Mike Condon, Healthy, TB, G, FA, Cls, W 4-1, 0, 0, 0, 0, 0, 0, --
Danny Taylor, O, Ott, G, FA, NJ, W 5-4, 0, 0, 0, 0, 0, 0, --
Antoine Bibeau, Healthy, Sea, G, FA, @Van, L 2-5, 0, 0, 0, 0, 0, 0, --
Kenneth Appleby, Healthy, NYI, G, FA, @Wsh, W 4-1, 0, 0, 0, 0, 0, 0, --
Troy Grosenick, Healthy, Bos, G, FA, Fla, W 4-2, 0, 0, 0, 0, 0, 0, --
Zach Sawchenko, Healthy, SJ, G, FA, Ana, L 2-5, 0, 0, 0, 0, 0, 0, --
Calvin Pickard, DTD, Det, G, FA, @Tor, L 0-3, 0, 0, 0, 0, 0, 0, --
Kevin Boyle, Healthy, Det, G, FA, @Tor, L 0-3, 0, 0, 0, 0, 0, 0, --
Niklas Svedberg, Healthy, Min, G, FA, Ari, L 3-5, 0, 0, 0, 0, 0, 0, --
Hunter Miska, Healthy, Col, G, FA, StL, W 5-3, 0, 0, 0, 0, 0, 0, --
Akira Schmid, Healthy, NJ, G, FA, @Ott, L 4-5, 0, 0, 0, 0, 0, 0, --
Kaden Fulcher, Healthy, Det, G, FA, @Tor, L 0-3, 0, 0, 0, 0, 0, 0, --
Eddie Lack, Healthy, NJ, G, FA, @Ott, L 4-5, 0, 0, 0, 0, 0, 0, --
Anders Nilsson, Healthy, TB, G, FA, Cls, W 4-1, 0, 0, 0, 0, 0, 0, --
Jared Coreau, Healthy, NYI, G, FA, @Wsh, W 4-1, 0, 0, 0, 0, 0, 0, --
Gilles Senn, Healthy, NJ, G, FA, @Ott, L 4-5, 0, 0, 0, 0, 0, 0, --
Alexei Melnichuk, Healthy, TB, G, FA, Cls, W 4-1, 0, 0, 0, 0, 0, 0, --
Shane Starrett, Healthy, Edm, G, FA, @Pit, W 5-1, 0, 0, 0, 0, 0, 0, --
Landon Bow, Healthy, Dal, G, FA, VGK, W 3-2, 0, 0, 0, 0, 0, 0, --
Hugo Alnefelt, Healthy, TB, G, FA, Cls, W 4-1, 0, 0, 0, 0, 0, 0, --
Jack LaFontaine, Healthy, Car, G, FA, @NYR, W 4-3, 0, 0, 0, 0, 0, 0, --
Adam Huska, Healthy, NYR, G, FA, Car, L 3-4, 0, 0, 0, 0, 0, 0, --
Michael McNiven, Healthy, Ott, G, FA, NJ, W 5-4, 0, 0, 0, 0, 0, 0, --
Jordan Binnington, Healthy, StL, G, FA, @Col, L 3-5, 1, 0, 1, 4, 29, 0, -0.1
Elvis Merzlikins, Healthy, Cls, G, BOWS, @TB, L 1-4, 1, 0, 1, 4, 28, 0, -0.2
Kaapo Kahkonen, Healthy, SJ, G, FA, Ana, L 2-5, 1, 0, 1, 4, 26, 0, -0.4
David Rittich, Healthy, Nsh, G, FA, Cgy, L 4-5, 0, 0, 0, 2, 3, 0, -0.7
Ilya Samsonov, Healthy, Wsh, G, FA, NYI, L 1-4, 1, 0, 1, 4, 22, 0, -0.8
Marc-Andre Fleury, Healthy, Min, G, SALT, Ari, L 3-5, 1, 0, 1, 4, 21, 0, -0.9
Joey Daccord, Healthy, Sea, G, FA, @Van, L 2-5, 1, 0, 1, 5, 22, 0, -1.3
Connor Hellebuyck, Healthy, Wpg, G, ME, --, --, 0, 0, 0, 0, 0, 0, --
Carter Hart, O, Phi, G, FA, --, --, 0, 0, 0, 0, 0, 0, --
Carey Price, O, Mon, G, LKR, --, --, 0, 0, 0, 0, 0, 0, --
Jonathan Quick, Healthy, LA, G, FA, --, --, 0, 0, 0, 0, 0, 0, --
Cal Petersen, Healthy, LA, G, FA, --, --, 0, 0, 0, 0, 0, 0, --
Kevin Lankinen, Healthy, Chi, G, NBUS, --, --, 0, 0, 0, 0, 0, 0, --
Jake Allen, O, Mon, G, FA, --, --, 0, 0, 0, 0, 0, 0, --
Craig Anderson, DTD, Buf, G, FA, --, --, 0, 0, 0, 0, 0, 0, --
Martin Jones, Healthy, Phi, G, FA, --, --, 0, 0, 0, 0, 0, 0, --
Dustin Tokarski, Healthy, Buf, G, FA, --, --, 0, 0, 0, 0, 0, 0, --
Felix Sandstrom, Healthy, Phi, G, FA, --, --, 0, 0, 0, 0, 0, 0, --
Sam Montembeault, Healthy, Mon, G, FA, --, --, 0, 0, 0, 0, 0, 0, --
Eric Comrie, Healthy, Wpg, G, FA, --, --, 0, 0, 0, 0, 0, 0, --
Malcolm Subban, IR, Buf, G, FA, --, --, 0, 0, 0, 0, 0, 0, --
Ukko-Pekka Luukkonen, Healthy, Buf, G, FA, --, --, 0, 0, 0, 0, 0, 0, --
Aaron Dell, Healthy, Buf, G, FA, --, --, 0, 0, 0, 0, 0, 0, --
Cayden Primeau, Healthy, Mon, G, FA, --, --, 0, 0, 0, 0, 0, 0, --
Michael Houser, Healthy, Buf, G, FA, --, --, 0, 0, 0, 0, 0, 0, --
Collin Delia, Healthy, Chi, G, FA, --, --, 0, 0, 0, 0, 0, 0, --
Jeff Glass, Healthy, Chi, G, FA, --, --, 0, 0, 0, 0, 0, 0, --
Garret Sparks, Healthy, LA, G, FA, --, --, 0, 0, 0, 0, 0, 0, --
Antti Niemi, Healthy, Mon, G, FA, --, --, 0, 0, 0, 0, 0, 0, --
Arvid Soderblom, Healthy, Chi, G, FA, --, --, 0, 0, 0, 0, 0, 0, --
