Ethan Bear, O, Wsh, D, FA, Col, L 3-6, 1, 0, 0, -2, 0, 0, 0, 0, 0, 0, 0, 0, 0, 1, 0, 1, -0.4
Brady Skjei, Healthy, Car, D, FA, @Dal, L 2-4, 1, 0, 0, -3, 0, 0, 0, 0, 0, 0, 0, 0, 0, 4, 2, 0, -0.5
Vladislav Gavrikov, Healthy, LA, D, FA, @Buf, L 0-7, 1, 0, 0, -2, 0, 0, 0, 0, 0, 0, 0, 0, 0, 0, 0, 1, -0.5
Leo Carlsson, Healthy, Ana, C, SALT, @Mon, L 0-5, 1, 0, 0, -2, 2, 0, 0, 0, 0, 0, 2, 2, 0, 3, 1, 0, -0.6
Jake Walman, DTD, Det, D, CLB, @Edm, L 4-8, 1, 0, 0, -2, 0, 0, 0, 0, 0, 0, 0, 0, 0, 4, 0, 0, -0.6
Pavel Buchnevich, Healthy, StL, RW- C- LW, OXP, @Tor, L 1-4, 1, 0, 0, -2, 0, 0, 0, 0, 0, 0, 0, 0, 0, 1, 1, 0, -0.6
Trevor Moore, Healthy, LA, LW, OXP, @Buf, L 0-7, 1, 0, 0, -3, 0, 0, 0, 0, 0, 0, 0, 0, 0, 1, 1, 1, -0.6
Lucas Raymond, Healthy, Det, LW, FA, @Edm, L 4-8, 1, 0, 0, -2, 0, 0, 0, 0, 0, 0, 0, 0, 0, 1, 1, 0, -0.6
Michael Rasmussen, Healthy, Det, C, FA, @Edm, L 4-8, 1, 0, 0, -2, 0, 0, 0, 0, 0, 0, 0, 0, 0, 4, 0, 0, -0.6
Klim Kostin, Healthy, SJ, RW- LW, FA, --, --, 1, 0, 0, -2, 0, 0, 0, 0, 0, 0, 0, 0, 0, 1, 1, 0, -0.6
Brayden Point, Healthy, TB, C, BBS, @Bos, W 3-2, 1, 0, 0, -1, 0, 0, 0, 0, 0, 0, 1, 4, 0, 2, 0, 0, -0.6
Brayden Schenn, Healthy, StL, C, SLC, @Tor, L 1-4, 1, 0, 0, -2, 0, 0, 0, 0, 0, 0, 4, 6, 0, 0, 2, 0, -0.6
Teuvo Teravainen, Healthy, Car, RW, OXP, @Dal, L 2-4, 1, 0, 0, -2, 0, 0, 0, 0, 0, 0, 0, 0, 0, 0, 1, 0, -0.7
Max Pacioretty, Healthy, Wsh, LW, FA, Col, L 3-6, 1, 0, 0, -2, 0, 0, 0, 0, 0, 0, 0, 0, 0, 0, 1, 0, -0.7
Ross Johnston, Healthy, Ana, LW, FA, @Mon, L 0-5, 1, 0, 0, 0, 7, 0, 0, 0, 0, 0, 0, 0, 0, 0, 0, 0, -0.7
Sebastian Aho, Healthy, Car, C, LKR, @Dal, L 2-4, 1, 0, 0, -2, 0, 0, 0, 0, 0, 0, 8, 6, 0, 0, 0, 0, -0.8
Johnathan Kovacevic, Healthy, Mon, D, FA, Ana, W 5-0, 1, 0, 0, 0, 9, 0, 0, 0, 0, 0, 0, 0, 0, 1, 0, 0, -0.8
Adam Henrique, Healthy, Edm, LW- C, CLB, Det, W 8-4, 1, 0, 0, -2, 5, 0, 0, 0, 0, 0, 5, 5, 0, 0, 2, 0, -0.9
Torey Krug, DTD, StL, D, FA, @Tor, L 1-4, 1, 0, 0, -2, 0, 0, 0, 0, 0, 0, 0, 0, 0, 1, 0, 0, -0.9
Pavel Mintyukov, Healthy, Ana, D, FA, @Mon, L 0-5, 1, 0, 0, -2, 0, 0, 0, 0, 0, 0, 0, 0, 0, 1, 0, 0, -0.9
Dylan Larkin, Healthy, Det, C, OXP, @Edm, L 4-8, 1, 0, 0, -3, 0, 0, 0, 0, 0, 0, 9, 11, 0, 2, 2, 0, -0.9
Adrian Kempe, Healthy, LA, RW- LW, BOWS, @Buf, L 0-7, 1, 0, 0, -4, 0, 0, 0, 0, 0, 0, 0, 0, 0, 2, 3, 0, -0.9
Brett Pesce, Healthy, Car, D, FA, @Dal, L 2-4, 1, 0, 0, -3, 0, 0, 0, 0, 0, 0, 0, 0, 0, 5, 0, 0, -1.0
Colin Blackwell, DTD, Chi, C- RW, FA, Van, L 2-4, 1, 0, 0, -3, 2, 0, 0, 0, 0, 0, 0, 1, 0, 4, 1, 0, -1.1
Aliaksei Protas, Healthy, Wsh, C, FA, Col, L 3-6, 1, 0, 0, -2, 0, 0, 0, 0, 0, 0, 0, 1, 0, 0, 0, 0, -1.1
Michael Sgarbossa, Healthy, Wsh, C, FA, Col, L 3-6, 1, 0, 0, -1, 0, 0, 0, 0, 0, 0, 0, 6, 0, 0, 0, 0, -1.1
Joey Anderson, Healthy, Chi, RW, FA, Van, L 2-4, 1, 0, 0, -2, 2, 0, 0, 0, 0, 0, 0, 0, 0, 0, 0, 0, -1.2
Mason McTavish, Healthy, Ana, C- LW, CLB, @Mon, L 0-5, 1, 0, 0, -1, 2, 0, 0, 0, 0, 0, 6, 12, 0, 0, 0, 0, -1.3
Anze Kopitar, Healthy, LA, C, ME, @Buf, L 0-7, 1, 0, 0, -6, 0, 0, 0, 0, 0, 0, 12, 5, 0, 2, 0, 0, -2.1
Matthew Tkachuk, Healthy, Fla, RW- LW, CLB, --, --, --, --, --, --, --, --, --, --, --, --, --, --, --, --, --, --, --
Adam Fox, Healthy, NYR, D, SALT, --, --, --, --, --, --, --, --, --, --, --, --, --, --, --, --, --, --, --
Sidney Crosby, Healthy, Pit, C, DINK, --, --, --, --, --, --, --, --, --, --, --, --, --, --, --, --, --, --, --
Kirill Kaprizov, Healthy, Min, LW, CLB, --, --, --, --, --, --, --, --, --, --, --, --, --, --, --, --, --, --, --
Sam Reinhart, Healthy, Fla, RW, ME, --, --, --, --, --, --, --, --, --, --, --, --, --, --, --, --, --, --, --
Artemi Panarin, Healthy, NYR, LW, BOWS, --, --, --, --, --, --, --, --, --, --, --, --, --, --, --, --, --, --, --
Josh Morrissey, Healthy, Wpg, D, LKR, --, --, --, --, --, --, --, --, --, --, --, --, --, --, --, --, --, --, --
Jack Eichel, Healthy, Vgk, C, BBS, --, --, --, --, --, --, --, --, --, --, --, --, --, --, --, --, --, --, --
Mika Zibanejad, Healthy, NYR, C, ME, --, --, --, --, --, --, --, --, --, --, --, --, --, --, --, --, --, --, --
Aleksander Barkov, Healthy, Fla, C, SALT, --, --, --, --, --, --, --, --, --, --, --, --, --, --, --, --, --, --, --
Carter Verhaeghe, Healthy, Fla, LW- C, BOWS, --, --, --, --, --, --, --, --, --, --, --, --, --, --, --, --, --, --, --
Kyle Connor, Healthy, Wpg, LW, ME, --, --, --, --, --, --, --, --, --, --, --, --, --, --, --, --, --, --, --
Jake Guentzel, Healthy, Car, LW, DINK, @Dal, L 2-4, --, --, --, --, --, --, --, --, --, --, --, --, --, --, --, --, --
Clayton Keller, Healthy, Ari, LW- C- RW, SLC, --, --, --, --, --, --, --, --, --, --, --, --, --, --, --, --, --, --, --
Joel Eriksson Ek, DTD, Min, C, OXP, --, --, --, --, --, --, --, --, --, --, --, --, --, --, --, --, --, --, --
Travis Konecny, Healthy, Phi, RW, FA, --, --, --, --, --, --, --, --, --, --, --, --, --, --, --, --, --, --, --
MacKenzie Weegar, Healthy, Cgy, D, ME, --, --, --, --, --, --, --, --, --, --, --, --, --, --, --, --, --, --, --
Erik Karlsson, Healthy, Pit, D, CLB, --, --, --, --, --, --, --, --, --, --, --, --, --, --, --, --, --, --, --
Rasmus Andersson, Healthy, Cgy, D, ME, --, --, --, --, --, --, --, --, --, --, --, --, --, --, --, --, --, --, --
Vincent Trocheck, Healthy, NYR, C, LKR, --, --, --, --, --, --, --, --, --, --, --, --, --, --, --, --, --, --, --
Alex Pietrangelo, DTD, Vgk, D, DINK, --, --, --, --, --, --, --, --, --, --, --, --, --, --, --, --, --, --, --
Chris Kreider, Healthy, NYR, LW, LKR, --, --, --, --, --, --, --, --, --, --, --, --, --, --, --, --, --, --, --
Kris Letang, Healthy, Pit, D, HERB, --, --, --, --, --, --, --, --, --, --, --, --, --, --, --, --, --, --, --
Jacob Trouba, O, NYR, D, BOWS, --, --, --, --, --, --, --, --, --, --, --, --, --, --, --, --, --, --, --
Mark Scheifele, Healthy, Wpg, C, ME, --, --, --, --, --, --, --, --, --, --, --, --, --, --, --, --, --, --, --
Jonathan Marchessault, Healthy, Vgk, RW- LW, HERB, --, --, --, --, --, --, --, --, --, --, --, --, --, --, --, --, --, --, --
Shea Theodore, Healthy, Vgk, D, BBS, --, --, --, --, --, --, --, --, --, --, --, --, --, --, --, --, --, --, --
Noah Hanifin, Healthy, Vgk, D, BBS, --, --, --, --, --, --, --, --, --, --, --, --, --, --, --, --, --, --, --
Owen Tippett, Healthy, Phi, RW, FA, --, --, --, --, --, --, --, --, --, --, --, --, --, --, --, --, --, --, --
Brandon Montour, Healthy, Fla, D, OXP, --, --, --, --, --, --, --, --, --, --, --, --, --, --, --, --, --, --, --
Evgeni Malkin, Healthy, Pit, C, FA, --, --, --, --, --, --, --, --, --, --, --, --, --, --, --, --, --, --, --
Matt Boldy, Healthy, Min, LW, SALT, --, --, --, --, --, --, --, --, --, --, --, --, --, --, --, --, --, --, --
Sean Durzi, Healthy, Ari, D, BOWS, --, --, --, --, --, --, --, --, --, --, --, --, --, --, --, --, --, --, --
Brayden McNabb, Healthy, Vgk, D, LKR, --, --, --, --, --, --, --, --, --, --, --, --, --, --, --, --, --, --, --
Mats Zuccarello, Healthy, Min, RW, BOWS, --, --, --, --, --, --, --, --, --, --, --, --, --, --, --, --, --, --, --
Travis Sanheim, Healthy, Phi, D, BOWS, --, --, --, --, --, --, --, --, --, --, --, --, --, --, --, --, --, --, --
William Karlsson, Healthy, Vgk, C, HERB, --, --, --, --, --, --, --, --, --, --, --, --, --, --, --, --, --, --, --
Blake Coleman, Healthy, Cgy, RW- LW, LKR, --, --, --, --, --, --, --, --, --, --, --, --, --, --, --, --, --, --, --
Tomas Hertl, IR, Vgk, C- LW, ME, --, --, --, --, --, --, --, --, --, --, --, --, --, --, --, --, --, --, --
"KAndre Miller", Healthy, NYR, D, FA, --, --, --, --, --, --, --, --, --, --, --, --, --, --, --, --, --, --, --
Neal Pionk, Healthy, Wpg, D, DINK, --, --, --, --, --, --, --, --, --, --, --, --, --, --, --, --, --, --, --
Lawson Crouse, Healthy, Ari, RW- LW, SLC, --, --, --, --, --, --, --, --, --, --, --, --, --, --, --, --, --, --, --
Brock Faber, Healthy, Min, D, HERB, --, --, --, --, --, --, --, --, --, --, --, --, --, --, --, --, --, --, --
Mark Stone, IR, Vgk, RW, BBS, --, --, --, --, --, --, --, --, --, --, --, --, --, --, --, --, --, --, --
Ivan Barbashev, Healthy, Vgk, LW- C- RW, OXP, --, --, --, --, --, --, --, --, --, --, --, --, --, --, --, --, --, --, --
Gustav Forsling, Healthy, Fla, D, BOWS, --, --, --, --, --, --, --, --, --, --, --, --, --, --, --, --, --, --, --
Sean Couturier, Healthy, Phi, C, FA, --, --, --, --, --, --, --, --, --, --, --, --, --, --, --, --, --, --, --
Bryan Rust, Healthy, Pit, RW, CLB, --, --, --, --, --, --, --, --, --, --, --, --, --, --, --, --, --, --, --
Nazem Kadri, Healthy, Cgy, C, BOWS, --, --, --, --, --, --, --, --, --, --, --, --, --, --, --, --, --, --, --
Andrei Kuzmenko, Healthy, Cgy, LW- RW, FA, --, --, --, --, --, --, --, --, --, --, --, --, --, --, --, --, --, --, --
Nikolaj Ehlers, Healthy, Wpg, LW, HERB, --, --, --, --, --, --, --, --, --, --, --, --, --, --, --, --, --, --, --
Jonathan Huberdeau, Healthy, Cgy, LW, FA, --, --, --, --, --, --, --, --, --, --, --, --, --, --, --, --, --, --, --
Chandler Stephenson, Healthy, Vgk, C, FA, --, --, --, --, --, --, --, --, --, --, --, --, --, --, --, --, --, --, --
Sam Bennett, Healthy, Fla, C- LW, ME, --, --, --, --, --, --, --, --, --, --, --, --, --, --, --, --, --, --, --
Logan Cooley, Healthy, Ari, C, SLC, --, --, --, --, --, --, --, --, --, --, --, --, --, --, --, --, --, --, --
Juuso Valimaki, Healthy, Ari, D, FA, --, --, --, --, --, --, --, --, --, --, --, --, --, --, --, --, --, --, --
Ryan Graves, Healthy, Pit, D, FA, --, --, --, --, --, --, --, --, --, --, --, --, --, --, --, --, --, --, --
Gabriel Vilardi, O, Wpg, C, FA, --, --, --, --, --, --, --, --, --, --, --, --, --, --, --, --, --, --, --
Matias Maccelli, Healthy, Ari, LW, FA, --, --, --, --, --, --, --, --, --, --, --, --, --, --, --, --, --, --, --
Alec Martinez, Healthy, Vgk, D, BBS, --, --, --, --, --, --, --, --, --, --, --, --, --, --, --, --, --, --, --
Aaron Ekblad, DTD, Fla, D, FA, --, --, --, --, --, --, --, --, --, --, --, --, --, --, --, --, --, --, --
Rickard Rakell, Healthy, Pit, RW- C- LW, FA, --, --, --, --, --, --, --, --, --, --, --, --, --, --, --, --, --, --, --
Jared Spurgeon, IR, Min, D, FA, --, --, --, --, --, --, --, --, --, --, --, --, --, --, --, --, --, --, --
Cam York, Healthy, Phi, D, FA, --, --, --, --, --, --, --, --, --, --, --, --, --, --, --, --, --, --, --
Yegor Sharangovich, Healthy, Cgy, C- LW- RW, FA, --, --, --, --, --, --, --, --, --, --, --, --, --, --, --, --, --, --, --
Mario Ferraro, Healthy, SJ, D, FA, --, --, --, --, --, --, --, --, --, --, --, --, --, --, --, --, --, --, --
Joel Farabee, Healthy, Phi, LW, FA, --, --, --, --, --, --, --, --, --, --, --, --, --, --, --, --, --, --, --
Logan Couture, IR, SJ, C, FA, --, --, --, --, --, --, --, --, --, --, --, --, --, --, --, --, --, --, --
Anthony Duclair, Healthy, TB, LW, FA, @Bos, W 3-2, --, --, --, --, --, --, --, --, --, --, --, --, --, --, --, --, --
Nick Schmaltz, Healthy, Ari, RW- C, FA, --, --, --, --, --, --, --, --, --, --, --, --, --, --, --, --, --, --, --
Sean Monahan, Healthy, Wpg, C, CLB, --, --, --, --, --, --, --, --, --, --, --, --, --, --, --, --, --, --, --
Ryan Hartman, Healthy, Min, C- RW, FA, --, --, --, --, --, --, --, --, --, --, --, --, --, --, --, --, --, --, --
Jake Middleton, Healthy, Min, D, FA, --, --, --, --, --, --, --, --, --, --, --, --, --, --, --, --, --, --, --
Oliver Ekman-Larsson, Healthy, Fla, D, FA, --, --, --, --, --, --, --, --, --, --, --, --, --, --, --, --, --, --, --
Marcus Pettersson, Healthy, Pit, D, FA, --, --, --, --, --, --, --, --, --, --, --, --, --, --, --, --, --, --, --
Alexis Lafreniere, Healthy, NYR, LW, FA, --, --, --, --, --, --, --, --, --, --, --, --, --, --, --, --, --, --, --
Nick Seeler, IR, Phi, D, SLC, --, --, --, --, --, --, --, --, --, --, --, --, --, --, --, --, --, --, --
Jonas Brodin, DTD, Min, D, CLB, --, --, --, --, --, --, --, --, --, --, --, --, --, --, --, --, --, --, --
Mikael Granlund, Healthy, SJ, LW, FA, --, --, --, --, --, --, --, --, --, --, --, --, --, --, --, --, --, --, --
Chris Tanev, Healthy, Dal, D, FA, Car, W 4-2, --, --, --, --, --, --, --, --, --, --, --, --, --, --, --, --, --
Sean Walker, Healthy, Col, D, FA, @Wsh, W 6-3, --, --, --, --, --, --, --, --, --, --, --, --, --, --, --, --, --
Nino Niederreiter, Healthy, Wpg, RW, FA, --, --, --, --, --, --, --, --, --, --, --, --, --, --, --, --, --, --, --
Cam Atkinson, Healthy, Phi, RW, FA, --, --, --, --, --, --, --, --, --, --, --, --, --, --, --, --, --, --, --
Scott Laughton, Healthy, Phi, C- LW- RW, FA, --, --, --, --, --, --, --, --, --, --, --, --, --, --, --, --, --, --, --
Erik Gustafsson, DTD, NYR, D, FA, --, --, --, --, --, --, --, --, --, --, --, --, --, --, --, --, --, --, --
Dylan DeMelo, Healthy, Wpg, D, FA, --, --, --, --, --, --, --, --, --, --, --, --, --, --, --, --, --, --, --
Cole Perfetti, Healthy, Wpg, LW- C- RW, FA, --, --, --, --, --, --, --, --, --, --, --, --, --, --, --, --, --, --, --
Evan Rodrigues, Healthy, Fla, C, FA, --, --, --, --, --, --, --, --, --, --, --, --, --, --, --, --, --, --, --
Pavel Dorofeyev, Healthy, Vgk, RW, FA, --, --, --, --, --, --, --, --, --, --, --, --, --, --, --, --, --, --, --
Andrew Mangiapane, Healthy, Cgy, RW- LW, FA, --, --, --, --, --, --, --, --, --, --, --, --, --, --, --, --, --, --, --
Brenden Dillon, Healthy, Wpg, D, FA, --, --, --, --, --, --, --, --, --, --, --, --, --, --, --, --, --, --, --
Nick Bjugstad, Healthy, Ari, C, BOWS, --, --, --, --, --, --, --, --, --, --, --, --, --, --, --, --, --, --, --
Dylan Guenther, Healthy, Ari, RW, FA, --, --, --, --, --, --, --, --, --, --, --, --, --, --, --, --, --, --, --
Reilly Smith, Healthy, Pit, RW, FA, --, --, --, --, --, --, --, --, --, --, --, --, --, --, --, --, --, --, --
Jamie Drysdale, IR, Phi, D, FA, --, --, --, --, --, --, --, --, --, --, --, --, --, --, --, --, --, --, --
Fabian Zetterlund, Healthy, SJ, RW- LW, FA, --, --, --, --, --, --, --, --, --, --, --, --, --, --, --, --, --, --, --
Mikael Backlund, Healthy, Cgy, C, FA, --, --, --, --, --, --, --, --, --, --, --, --, --, --, --, --, --, --, --
Filip Chytil, IR, NYR, C- RW, FA, --, --, --, --, --, --, --, --, --, --, --, --, --, --, --, --, --, --, --
Adam Lowry, Healthy, Wpg, C, FA, --, --, --, --, --, --, --, --, --, --, --, --, --, --, --, --, --, --, --
Morgan Frost, Healthy, Phi, C, FA, --, --, --, --, --, --, --, --, --, --, --, --, --, --, --, --, --, --, --
Marco Rossi, Healthy, Min, C, FA, --, --, --, --, --, --, --, --, --, --, --, --, --, --, --, --, --, --, --
Niko Mikkola, Healthy, Fla, D, FA, --, --, --, --, --, --, --, --, --, --, --, --, --, --, --, --, --, --, --
J.J. Moser, Healthy, Ari, D, FA, --, --, --, --, --, --, --, --, --, --, --, --, --, --, --, --, --, --, --
Tyson Foerster, Healthy, Phi, RW, FA, --, --, --, --, --, --, --, --, --, --, --, --, --, --, --, --, --, --, --
Eetu Luostarinen, Healthy, Fla, LW- C, FA, --, --, --, --, --, --, --, --, --, --, --, --, --, --, --, --, --, --, --
Rasmus Ristolainen, IR, Phi, D, FA, --, --, --, --, --, --, --, --, --, --, --, --, --, --, --, --, --, --, --
Barrett Hayton, DTD, Ari, C, FA, --, --, --, --, --, --, --, --, --, --, --, --, --, --, --, --, --, --, --
Alexander Nylander, DTD, Cls, LW- RW, FA, @Ott, L 3-6, --, --, --, --, --, --, --, --, --, --, --, --, --, --, --, --, --
Nicolas Roy, Healthy, Vgk, C, FA, --, --, --, --, --, --, --, --, --, --, --, --, --, --, --, --, --, --, --
William Eklund, Healthy, SJ, LW- C, FA, --, --, --, --, --, --, --, --, --, --, --, --, --, --, --, --, --, --, --
Garnet Hathaway, Healthy, Phi, RW, FA, --, --, --, --, --, --, --, --, --, --, --, --, --, --, --, --, --, --, --
Alex Iafallo, Healthy, Wpg, LW, FA, --, --, --, --, --, --, --, --, --, --, --, --, --, --, --, --, --, --, --
Matt Dumba, Healthy, TB, D, FA, @Bos, W 3-2, --, --, --, --, --, --, --, --, --, --, --, --, --, --, --, --, --
Anton Lundell, Healthy, Fla, LW- C, FA, --, --, --, --, --, --, --, --, --, --, --, --, --, --, --, --, --, --, --
Alex Kerfoot, Healthy, Ari, C, FA, --, --, --, --, --, --, --, --, --, --, --, --, --, --, --, --, --, --, --
Marcus Foligno, Healthy, Min, RW- LW, FA, --, --, --, --, --, --, --, --, --, --, --, --, --, --, --, --, --, --, --
Blake Wheeler, IR, NYR, RW, FA, --, --, --, --, --, --, --, --, --, --, --, --, --, --, --, --, --, --, --
Jack McBain, Healthy, Ari, C- LW, FA, --, --, --, --, --, --, --, --, --, --, --, --, --, --, --, --, --, --, --
Paul Cotter, Healthy, Vgk, C, FA, --, --, --, --, --, --, --, --, --, --, --, --, --, --, --, --, --, --, --
Dillon Dube, Healthy, Cgy, C, FA, --, --, --, --, --, --, --, --, --, --, --, --, --, --, --, --, --, --, --
Nicolas Hague, Healthy, Vgk, D, FA, --, --, --, --, --, --, --, --, --, --, --, --, --, --, --, --, --, --, --
Kaapo Kakko, Healthy, NYR, RW, FA, --, --, --, --, --, --, --, --, --, --, --, --, --, --, --, --, --, --, --
Mason Appleton, Healthy, Wpg, RW- C, FA, --, --, --, --, --, --, --, --, --, --, --, --, --, --, --, --, --, --, --
Jason Zucker, Healthy, Nsh, LW- RW, FA, NJ, L 2-4, --, --, --, --, --, --, --, --, --, --, --, --, --, --, --, --, --
Braden Schneider, Healthy, NYR, D, FA, --, --, --, --, --, --, --, --, --, --, --, --, --, --, --, --, --, --, --
Justin Brazeau, Healthy, Bos, RW, FA, TB, L 2-3, --, --, --, --, --, --, --, --, --, --, --, --, --, --, --, --, --
Connor Zary, Healthy, Cgy, C, FA, --, --, --, --, --, --, --, --, --, --, --, --, --, --, --, --, --, --, --
Jacob Peterson, Healthy, SJ, C- LW- RW, FA, --, --, --, --, --, --, --, --, --, --, --, --, --, --, --, --, --, --, --
Michael Carcone, Healthy, Ari, RW, FA, --, --, --, --, --, --, --, --, --, --, --, --, --, --, --, --, --, --, --
Martin Pospisil, Healthy, Cgy, LW- RW, FA, --, --, --, --, --, --, --, --, --, --, --, --, --, --, --, --, --, --, --
Matt Rempe, Healthy, NYR, C, SLC, --, --, --, --, --, --, --, --, --, --, --, --, --, --, --, --, --, --, --
Daniil Miromanov, Healthy, Cgy, D, FA, --, --, --, --, --, --, --, --, --, --, --, --, --, --, --, --, --, --, --
Calen Addison, Healthy, SJ, D, FA, --, --, --, --, --, --, --, --, --, --, --, --, --, --, --, --, --, --, --
Ty Smith, Healthy, Car, D, FA, @Dal, L 2-4, --, --, --, --, --, --, --, --, --, --, --, --, --, --, --, --, --
Dmitry Kulikov, Healthy, Fla, D, FA, --, --, --, --, --, --, --, --, --, --, --, --, --, --, --, --, --, --, --
Ryan Lindgren, O, NYR, D, FA, --, --, --, --, --, --, --, --, --, --, --, --, --, --, --, --, --, --, --
Keegan Kolesar, Healthy, Vgk, RW, FA, --, --, --, --, --, --, --, --, --, --, --, --, --, --, --, --, --, --, --
Will Cuylle, Healthy, NYR, LW, FA, --, --, --, --, --, --, --, --, --, --, --, --, --, --, --, --, --, --, --
Adam Edstrom, Healthy, NYR, C, FA, --, --, --, --, --, --, --, --, --, --, --, --, --, --, --, --, --, --, --
Vladislav Namestnikov, Healthy, Wpg, C, FA, --, --, --, --, --, --, --, --, --, --, --, --, --, --, --, --, --, --, --
"Liam OBrien", Healthy, Ari, LW, FA, --, --, --, --, --, --, --, --, --, --, --, --, --, --, --, --, --, --, --
Ryan Poehling, Healthy, Phi, C, FA, --, --, --, --, --, --, --, --, --, --, --, --, --, --, --, --, --, --, --
Zach Whitecloud, Healthy, Vgk, D, FA, --, --, --, --, --, --, --, --, --, --, --, --, --, --, --, --, --, --, --
Kyle Burroughs, Healthy, SJ, D, FA, --, --, --, --, --, --, --, --, --, --, --, --, --, --, --, --, --, --, --
Shakir Mukhamadullin, Healthy, SJ, D, FA, --, --, --, --, --, --, --, --, --, --, --, --, --, --, --, --, --, --, --
Phil Kessel, Healthy, Vgk, RW, FA, --, --, --, --, --, --, --, --, --, --, --, --, --, --, --, --, --, --, --
Connor Mackey, Healthy, NYR, D, FA, --, --, --, --, --, --, --, --, --, --, --, --, --, --, --, --, --, --, --
Noah Cates, Healthy, Phi, LW, FA, --, --, --, --, --, --, --, --, --, --, --, --, --, --, --, --, --, --, --
Lars Eller, Healthy, Pit, C, FA, --, --, --, --, --, --, --, --, --, --, --, --, --, --, --, --, --, --, --
Alexander Barabanov, DTD, SJ, LW, FA, --, --, --, --, --, --, --, --, --, --, --, --, --, --, --, --, --, --, --
Henry Thrun, Healthy, SJ, D, FA, --, --, --, --, --, --, --, --, --, --, --, --, --, --, --, --, --, --, --
Barclay Goodrow, Healthy, NYR, C- LW- RW, FA, --, --, --, --, --, --, --, --, --, --, --, --, --, --, --, --, --, --, --
Bobby Brink, Healthy, Phi, RW, FA, --, --, --, --, --, --, --, --, --, --, --, --, --, --, --, --, --, --, --
Thomas Bordeleau, Healthy, SJ, C- LW, FA, --, --, --, --, --, --, --, --, --, --, --, --, --, --, --, --, --, --, --
Matvei Michkov, Healthy, Phi, RW, FA, --, --, --, --, --, --, --, --, --, --, --, --, --, --, --, --, --, --, --
Marc-Edouard Vlasic, Healthy, SJ, D, FA, --, --, --, --, --, --, --, --, --, --, --, --, --, --, --, --, --, --, --
Wade Allison, Healthy, Nsh, RW, FA, NJ, L 2-4, --, --, --, --, --, --, --, --, --, --, --, --, --, --, --, --, --
Egor Zamula, Healthy, Phi, D, FA, --, --, --, --, --, --, --, --, --, --, --, --, --, --, --, --, --, --, --
Matt Coronato, Healthy, Cgy, RW, FA, --, --, --, --, --, --, --, --, --, --, --, --, --, --, --, --, --, --, --
Marcus Johansson, IR, Min, LW- RW, FA, --, --, --, --, --, --, --, --, --, --, --, --, --, --, --, --, --, --, --
Frederick Gaudreau, Healthy, Min, C, FA, --, --, --, --, --, --, --, --, --, --, --, --, --, --, --, --, --, --, --
"Drew OConnor", Healthy, Pit, LW, FA, --, --, --, --, --, --, --, --, --, --, --, --, --, --, --, --, --, --, --
Michael Amadio, Healthy, Vgk, RW- C- LW, FA, --, --, --, --, --, --, --, --, --, --, --, --, --, --, --, --, --, --, --
Pat Maroon, IR, Bos, LW, FA, TB, L 2-3, --, --, --, --, --, --, --, --, --, --, --, --, --, --, --, --, --
Nate Schmidt, Healthy, Wpg, D, FA, --, --, --, --, --, --, --, --, --, --, --, --, --, --, --, --, --, --, --
Jimmy Vesey, Healthy, NYR, LW, FA, --, --, --, --, --, --, --, --, --, --, --, --, --, --, --, --, --, --, --
Marat Khusnutdinov, Healthy, Min, C, FA, --, --, --, --, --, --, --, --, --, --, --, --, --, --, --, --, --, --, --
William Smith, Healthy, SJ, C, FA, --, --, --, --, --, --, --, --, --, --, --, --, --, --, --, --, --, --, --
Noel Acciari, IR, Pit, C, FA, --, --, --, --, --, --, --, --, --, --, --, --, --, --, --, --, --, --, --
Oliver Kylington, Healthy, Cgy, D, FA, --, --, --, --, --, --, --, --, --, --, --, --, --, --, --, --, --, --, --
Matt Benning, IR, SJ, D, FA, --, --, --, --, --, --, --, --, --, --, --, --, --, --, --, --, --, --, --
Brandon Duhaime, Healthy, Col, LW- RW, FA, @Wsh, W 6-3, --, --, --, --, --, --, --, --, --, --, --, --, --, --, --, --, --
Marc Staal, Healthy, Phi, D, FA, --, --, --, --, --, --, --, --, --, --, --, --, --, --, --, --, --, --, --
Declan Chisholm, Healthy, Min, D, FA, --, --, --, --, --, --, --, --, --, --, --, --, --, --, --, --, --, --, --
Nicolas Deslauriers, Healthy, Phi, RW- LW, FA, --, --, --, --, --, --, --, --, --, --, --, --, --, --, --, --, --, --, --
Jakob Pelletier, Healthy, Cgy, LW, FA, --, --, --, --, --, --, --, --, --, --, --, --, --, --, --, --, --, --, --
Pierre-Olivier Joseph, Healthy, Pit, D, FA, --, --, --, --, --, --, --, --, --, --, --, --, --, --, --, --, --, --, --
Zach Bogosian, Healthy, Min, D, FA, --, --, --, --, --, --, --, --, --, --, --, --, --, --, --, --, --, --, --
Danil Gushchin, Healthy, SJ, RW, FA, --, --, --, --, --, --, --, --, --, --, --, --, --, --, --, --, --, --, --
Nick Bonino, Healthy, NYR, C, FA, --, --, --, --, --, --, --, --, --, --, --, --, --, --, --, --, --, --, --
Brayden Pachal, Healthy, Cgy, D, FA, --, --, --, --, --, --, --, --, --, --, --, --, --, --, --, --, --, --, --
Luke Kunin, Healthy, SJ, C, FA, --, --, --, --, --, --, --, --, --, --, --, --, --, --, --, --, --, --, --
Dylan Samberg, Healthy, Wpg, D, FA, --, --, --, --, --, --, --, --, --, --, --, --, --, --, --, --, --, --, --
Nico Sturm, Healthy, SJ, C, FA, --, --, --, --, --, --, --, --, --, --, --, --, --, --, --, --, --, --, --
Connor Dewar, Healthy, Tor, C, FA, StL, W 4-1, --, --, --, --, --, --, --, --, --, --, --, --, --, --, --, --, --
Kaedan Korczak, Healthy, Vgk, D, FA, --, --, --, --, --, --, --, --, --, --, --, --, --, --, --, --, --, --, --
Jeff Carter, DTD, Pit, C, FA, --, --, --, --, --, --, --, --, --, --, --, --, --, --, --, --, --, --, --
Josh Brown, Healthy, Ari, D, FA, --, --, --, --, --, --, --, --, --, --, --, --, --, --, --, --, --, --, --
Filip Zadina, Healthy, SJ, RW, FA, --, --, --, --, --, --, --, --, --, --, --, --, --, --, --, --, --, --, --
Brett Howden, Healthy, Vgk, LW- C, FA, --, --, --, --, --, --, --, --, --, --, --, --, --, --, --, --, --, --, --
Mike Hoffman, DTD, SJ, LW, FA, --, --, --, --, --, --, --, --, --, --, --, --, --, --, --, --, --, --, --
Nikita Okhotiuk, Healthy, Cgy, D, FA, --, --, --, --, --, --, --, --, --, --, --, --, --, --, --, --, --, --, --
Radim Zohorna, Healthy, Pit, LW, FA, --, --, --, --, --, --, --, --, --, --, --, --, --, --, --, --, --, --, --
Ben Hutton, Healthy, Vgk, D, FA, --, --, --, --, --, --, --, --, --, --, --, --, --, --, --, --, --, --, --
Jacob MacDonald, Healthy, SJ, D, FA, --, --, --, --, --, --, --, --, --, --, --, --, --, --, --, --, --, --, --
Ryan Lomberg, Healthy, Fla, LW, FA, --, --, --, --, --, --, --, --, --, --, --, --, --, --, --, --, --, --, --
Valtteri Puustinen, Healthy, Pit, LW, FA, --, --, --, --, --, --, --, --, --, --, --, --, --, --, --, --, --, --, --
Jan Rutta, Healthy, SJ, D, FA, --, --, --, --, --, --, --, --, --, --, --, --, --, --, --, --, --, --, --
Kevin Stenlund, Healthy, Fla, RW, FA, --, --, --, --, --, --, --, --, --, --, --, --, --, --, --, --, --, --, --
Dominic Toninato, Healthy, Wpg, C, FA, --, --, --, --, --, --, --, --, --, --, --, --, --, --, --, --, --, --, --
Zac Jones, Healthy, NYR, D, FA, --, --, --, --, --, --, --, --, --, --, --, --, --, --, --, --, --, --, --
Chad Ruhwedel, Healthy, NYR, D, FA, --, --, --, --, --, --, --, --, --, --, --, --, --, --, --, --, --, --, --
William Carrier, DTD, Vgk, LW, FA, --, --, --, --, --, --, --, --, --, --, --, --, --, --, --, --, --, --, --
Brayden Yager, Healthy, Pit, C, FA, --, --, --, --, --, --, --, --, --, --, --, --, --, --, --, --, --, --, --
