Grigori Denisenko, Healthy, Vgk, LW, FA, @Chi, W 5-3, --, --, --, --, --, --, --, --, --, --, --, --, --, --, --, --, --
Matthew Kessel, Healthy, StL, D, FA, Pit, W 4-2, --, --, --, --, --, --, --, --, --, --, --, --, --, --, --, --, --
Daniil Miromanov, IR, Vgk, D, FA, @Chi, W 5-3, --, --, --, --, --, --, --, --, --, --, --, --, --, --, --, --, --
Declan Chisholm, Healthy, Wpg, D, FA, @Edm, W 3-2, --, --, --, --, --, --, --, --, --, --, --, --, --, --, --, --, --
Patrik Nemeth, Healthy, Ari, D, FA, Ana, W 2-1, --, --, --, --, --, --, --, --, --, --, --, --, --, --, --, --, --
Tucker Poolman, IR, Van, D, FA, @Fla, W 5-3, --, --, --, --, --, --, --, --, --, --, --, --, --, --, --, --, --
Vladimir Tkachev, Healthy, LA, LW, FA, Bos, L 2-4, --, --, --, --, --, --, --, --, --, --, --, --, --, --, --, --, --
Vitali Kravtsov, Healthy, Van, LW, FA, @Fla, W 5-3, --, --, --, --, --, --, --, --, --, --, --, --, --, --, --, --, --
Zach Sanford, Healthy, Chi, LW, FA, Vgk, L 3-5, --, --, --, --, --, --, --, --, --, --, --, --, --, --, --, --, --
Philippe Myers, Healthy, TB, D, FA, Tor, L 3-4, --, --, --, --, --, --, --, --, --, --, --, --, --, --, --, --, --
Dylan McIlrath, Healthy, Wsh, D, FA, @Mon, L 2-3, --, --, --, --, --, --, --, --, --, --, --, --, --, --, --, --, --
Bradly Nadeau, Healthy, Car, C, FA, @Col, L 4-6, --, --, --, --, --, --, --, --, --, --, --, --, --, --, --, --, --
Noah Ostlund, Healthy, Buf, C, FA, NYI, W 3-1, --, --, --, --, --, --, --, --, --, --, --, --, --, --, --, --, --
Radim Simek, Healthy, SJ, D, FA, @Nsh, L 1-5, --, --, --, --, --, --, --, --, --, --, --, --, --, --, --, --, --
Gage Quinney, Healthy, Vgk, LW, FA, @Chi, W 5-3, --, --, --, --, --, --, --, --, --, --, --, --, --, --, --, --, --
Zack Kassian, Healthy, Ari, RW, FA, Ana, W 2-1, --, --, --, --, --, --, --, --, --, --, --, --, --, --, --, --, --
Keith Yandle, Healthy, Phi, D, FA, @Dal, L 4-5, --, --, --, --, --, --, --, --, --, --, --, --, --, --, --, --, --
Paul Stastny, Healthy, Car, C, FA, @Col, L 4-6, --, --, --, --, --, --, --, --, --, --, --, --, --, --, --, --, --
Brinson Pasichnuk, Healthy, SJ, D, FA, @Nsh, L 1-5, --, --, --, --, --, --, --, --, --, --, --, --, --, --, --, --, --
Akito Hirose, Healthy, Van, D, FA, @Fla, W 5-3, --, --, --, --, --, --, --, --, --, --, --, --, --, --, --, --, --
Cale Fleury, Healthy, Sea, D, FA, NYR, L 1-4, --, --, --, --, --, --, --, --, --, --, --, --, --, --, --, --, --
Brock McGinn, Healthy, Ana, LW, FA, @Ari, L 1-2, --, --, --, --, --, --, --, --, --, --, --, --, --, --, --, --, --
David Gustafsson, IR, Wpg, C, FA, @Edm, W 3-2, 1, 0, 0, 0, 0, 0, 0, 0, 0, 0, 2, 2, 0, 0, 0, 0, 0.0
Otto Stenberg, Healthy, StL, C, FA, Pit, W 4-2, --, --, --, --, --, --, --, --, --, --, --, --, --, --, --, --, --
Ryan Getzlaf, Healthy, Ana, C, FA, @Ari, L 1-2, --, --, --, --, --, --, --, --, --, --, --, --, --, --, --, --, --
Andrew Poturalski, Healthy, Sea, C, FA, NYR, L 1-4, --, --, --, --, --, --, --, --, --, --, --, --, --, --, --, --, --
Justin Braun, Healthy, Phi, D, FA, @Dal, L 4-5, --, --, --, --, --, --, --, --, --, --, --, --, --, --, --, --, --
Derick Brassard, O, Ott, C, FA, Det, L 2-5, --, --, --, --, --, --, --, --, --, --, --, --, --, --, --, --, --
Darren Archibald, Healthy, Tor, LW, FA, @TB, W 4-3, --, --, --, --, --, --, --, --, --, --, --, --, --, --, --, --, --
Colin White, Healthy, Pit, C, FA, @StL, L 2-4, --, --, --, --, --, --, --, --, --, --, --, --, --, --, --, --, --
Zach Aston-Reese, Healthy, Det, C, FA, @Ott, W 5-2, --, --, --, --, --, --, --, --, --, --, --, --, --, --, --, --, --
Josh Bailey, Healthy, Ott, LW, FA, Det, L 2-5, --, --, --, --, --, --, --, --, --, --, --, --, --, --, --, --, --
Cole McWard, Healthy, Van, D, FA, @Fla, W 5-3, --, --, --, --, --, --, --, --, --, --, --, --, --, --, --, --, --
Filip Roos, Healthy, Chi, D, FA, Vgk, L 3-5, --, --, --, --, --, --, --, --, --, --, --, --, --, --, --, --, --
Jaret Anderson-Dolan, Healthy, LA, C- RW, FA, Bos, L 2-4, --, --, --, --, --, --, --, --, --, --, --, --, --, --, --, --, --
Jonas Rondbjerg, Healthy, Vgk, RW- LW, FA, @Chi, W 5-3, --, --, --, --, --, --, --, --, --, --, --, --, --, --, --, --, --
Max Veronneau, Healthy, SJ, RW, FA, @Nsh, L 1-5, --, --, --, --, --, --, --, --, --, --, --, --, --, --, --, --, --
Mark Jankowski, Healthy, Nsh, C, FA, SJ, W 5-1, --, --, --, --, --, --, --, --, --, --, --, --, --, --, --, --, --
Adam Beckman, Healthy, Min, C, FA, Cls, L 4-5, --, --, --, --, --, --, --, --, --, --, --, --, --, --, --, --, --
Vinni Lettieri, Healthy, Min, C, FA, Cls, L 4-5, --, --, --, --, --, --, --, --, --, --, --, --, --, --, --, --, --
Kale Clague, Healthy, Buf, D, FA, NYI, W 3-1, --, --, --, --, --, --, --, --, --, --, --, --, --, --, --, --, --
Connor Bunnaman, Healthy, Fla, LW, FA, Van, L 3-5, --, --, --, --, --, --, --, --, --, --, --, --, --, --, --, --, --
Joe Snively, Healthy, Wsh, RW- LW, FA, @Mon, L 2-3, --, --, --, --, --, --, --, --, --, --, --, --, --, --, --, --, --
Gracyn Sawchyn, Healthy, Fla, C, FA, Van, L 3-5, --, --, --, --, --, --, --, --, --, --, --, --, --, --, --, --, --
Isaac Howard, Healthy, TB, LW, FA, Tor, L 3-4, --, --, --, --, --, --, --, --, --, --, --, --, --, --, --, --, --
Mackenzie MacEachern, Healthy, StL, LW, FA, Pit, W 4-2, --, --, --, --, --, --, --, --, --, --, --, --, --, --, --, --, --
Alex Chiasson, Healthy, Bos, RW, FA, @LA, W 4-2, --, --, --, --, --, --, --, --, --, --, --, --, --, --, --, --, --
Connor Carrick, Healthy, Sea, D, FA, NYR, L 1-4, --, --, --, --, --, --, --, --, --, --, --, --, --, --, --, --, --
Lukas Dragicevic, Healthy, Sea, D, FA, NYR, L 1-4, --, --, --, --, --, --, --, --, --, --, --, --, --, --, --, --, --
Vladislav Kolyachonok, IR, Ari, D, FA, Ana, W 2-1, --, --, --, --, --, --, --, --, --, --, --, --, --, --, --, --, --
Scott Harrington, Healthy, Ana, D, FA, @Ari, L 1-2, --, --, --, --, --, --, --, --, --, --, --, --, --, --, --, --, --
Carey Terrance, Healthy, Ana, C, FA, @Ari, L 1-2, --, --, --, --, --, --, --, --, --, --, --, --, --, --, --, --, --
Jacob Bryson, Healthy, Buf, D, FA, NYI, W 3-1, --, --, --, --, --, --, --, --, --, --, --, --, --, --, --, --, --
Jack Rathbone, Healthy, Pit, D, FA, @StL, L 2-4, --, --, --, --, --, --, --, --, --, --, --, --, --, --, --, --, --
Cole Koepke, Healthy, TB, LW, FA, Tor, L 3-4, --, --, --, --, --, --, --, --, --, --, --, --, --, --, --, --, --
Marc McLaughlin, Healthy, Bos, C, FA, @LA, W 4-2, --, --, --, --, --, --, --, --, --, --, --, --, --, --, --, --, --
Danny Nelson, Healthy, NYI, C, FA, @Buf, L 1-3, --, --, --, --, --, --, --, --, --, --, --, --, --, --, --, --, --
Owen Beck, Healthy, Mon, C, FA, Wsh, W 3-2, --, --, --, --, --, --, --, --, --, --, --, --, --, --, --, --, --
Liam Foudy, Healthy, Nsh, RW- C- LW, FA, SJ, W 5-1, --, --, --, --, --, --, --, --, --, --, --, --, --, --, --, --, --
Ryan Murray, O, Edm, D, FA, Wpg, L 2-3, --, --, --, --, --, --, --, --, --, --, --, --, --, --, --, --, --
Jason Demers, Healthy, Edm, D, FA, Wpg, L 2-3, --, --, --, --, --, --, --, --, --, --, --, --, --, --, --, --, --
Sam Rinzel, Healthy, Chi, D, FA, Vgk, L 3-5, --, --, --, --, --, --, --, --, --, --, --, --, --, --, --, --, --
Slater Koekkoek, Healthy, Edm, D, FA, Wpg, L 2-3, --, --, --, --, --, --, --, --, --, --, --, --, --, --, --, --, --
Andrej Sekera, Healthy, Dal, D, FA, Phi, W 5-4, --, --, --, --, --, --, --, --, --, --, --, --, --, --, --, --, --
Darren Helm, Healthy, Col, C, FA, Car, W 6-4, --, --, --, --, --, --, --, --, --, --, --, --, --, --, --, --, --
Calum Ritchie, Healthy, Col, C, FA, Car, W 6-4, --, --, --, --, --, --, --, --, --, --, --, --, --, --, --, --, --
Carson Rehkopf, Healthy, Sea, LW, FA, NYR, L 1-4, --, --, --, --, --, --, --, --, --, --, --, --, --, --, --, --, --
Mason Shaw, O, Min, C, FA, Cls, L 4-5, --, --, --, --, --, --, --, --, --, --, --, --, --, --, --, --, --
Dustin Brown, Healthy, LA, RW, FA, Bos, L 2-4, --, --, --, --, --, --, --, --, --, --, --, --, --, --, --, --, --
Denis Malgin, Healthy, Col, C- RW, FA, Car, W 6-4, --, --, --, --, --, --, --, --, --, --, --, --, --, --, --, --, --
Brett Seney, Healthy, Chi, LW, FA, Vgk, L 3-5, --, --, --, --, --, --, --, --, --, --, --, --, --, --, --, --, --
Nic Petan, Healthy, Min, C, FA, Cls, L 4-5, --, --, --, --, --, --, --, --, --, --, --, --, --, --, --, --, --
Jacob Perreault, Healthy, Ana, RW, FA, @Ari, L 1-2, --, --, --, --, --, --, --, --, --, --, --, --, --, --, --, --, --
Andrew Gibson, Healthy, Det, D, FA, @Ott, W 5-2, --, --, --, --, --, --, --, --, --, --, --, --, --, --, --, --, --
Victor Mete, Healthy, Phi, D, FA, @Dal, L 4-5, --, --, --, --, --, --, --, --, --, --, --, --, --, --, --, --, --
Jackson Cates, Healthy, Phi, C, FA, @Dal, L 4-5, --, --, --, --, --, --, --, --, --, --, --, --, --, --, --, --, --
Riley Nash, Healthy, NYR, C, FA, @Sea, W 4-1, --, --, --, --, --, --, --, --, --, --, --, --, --, --, --, --, --
Curtis Valk, Healthy, Fla, C, FA, Van, L 3-5, --, --, --, --, --, --, --, --, --, --, --, --, --, --, --, --, --
Brett Murray, Healthy, Buf, LW, FA, NYI, W 3-1, --, --, --, --, --, --, --, --, --, --, --, --, --, --, --, --, --
Alexander True, Healthy, Fla, C, FA, Van, L 3-5, --, --, --, --, --, --, --, --, --, --, --, --, --, --, --, --, --
Lukas Vejdemo, Healthy, Mon, C, FA, Wsh, W 3-2, --, --, --, --, --, --, --, --, --, --, --, --, --, --, --, --, --
Maveric Lamoureux, Healthy, Ari, D, FA, Ana, W 2-1, --, --, --, --, --, --, --, --, --, --, --, --, --, --, --, --, --
Jan Jenik, Healthy, Ari, C, FA, Ana, W 2-1, --, --, --, --, --, --, --, --, --, --, --, --, --, --, --, --, --
Greg McKegg, Healthy, Edm, C, FA, Wpg, L 2-3, --, --, --, --, --, --, --, --, --, --, --, --, --, --, --, --, --
"Zachary LHeureux", Healthy, Nsh, LW, FA, SJ, W 5-1, --, --, --, --, --, --, --, --, --, --, --, --, --, --, --, --, --
Sampo Ranta, Healthy, Col, LW, FA, Car, W 6-4, --, --, --, --, --, --, --, --, --, --, --, --, --, --, --, --, --
Jeffrey Viel, Healthy, Wpg, LW, FA, @Edm, W 3-2, --, --, --, --, --, --, --, --, --, --, --, --, --, --, --, --, --
Derek Grant, Healthy, Ana, C- LW, FA, @Ari, L 1-2, --, --, --, --, --, --, --, --, --, --, --, --, --, --, --, --, --
Stanislav Svozil, Healthy, Cls, D, FA, @Min, W 5-4, --, --, --, --, --, --, --, --, --, --, --, --, --, --, --, --, --
Ronnie Attard, Healthy, Phi, D, FA, @Dal, L 4-5, --, --, --, --, --, --, --, --, --, --, --, --, --, --, --, --, --
Mike Vecchione, Healthy, Wsh, C, FA, @Mon, L 2-3, --, --, --, --, --, --, --, --, --, --, --, --, --, --, --, --, --
William Dufour, Healthy, NYI, RW, FA, @Buf, L 1-3, --, --, --, --, --, --, --, --, --, --, --, --, --, --, --, --, --
Derek Stepan, Healthy, Car, C, FA, @Col, L 4-6, --, --, --, --, --, --, --, --, --, --, --, --, --, --, --, --, --
Logan Brown, IR, TB, C, FA, Tor, L 3-4, --, --, --, --, --, --, --, --, --, --, --, --, --, --, --, --, --
Rudolfs Balcers, Healthy, TB, LW, FA, Tor, L 3-4, --, --, --, --, --, --, --, --, --, --, --, --, --, --, --, --, --
Dylan Gambrell, Healthy, Tor, C, FA, @TB, W 4-3, --, --, --, --, --, --, --, --, --, --, --, --, --, --, --, --, --
Mark Borowiecki, Healthy, Nsh, D, FA, SJ, W 5-1, --, --, --, --, --, --, --, --, --, --, --, --, --, --, --, --, --
Matt Irwin, Healthy, Van, D, FA, @Fla, W 5-3, --, --, --, --, --, --, --, --, --, --, --, --, --, --, --, --, --
Markus Nutivaara, Healthy, SJ, D, FA, @Nsh, L 1-5, --, --, --, --, --, --, --, --, --, --, --, --, --, --, --, --, --
Mason Geertsen, Healthy, Vgk, D, FA, @Chi, W 5-3, --, --, --, --, --, --, --, --, --, --, --, --, --, --, --, --, --
Martin Frk, Healthy, StL, RW, FA, Pit, W 4-2, --, --, --, --, --, --, --, --, --, --, --, --, --, --, --, --, --
Nikita Nesterenko, Healthy, Ana, LW, FA, @Ari, L 1-2, --, --, --, --, --, --, --, --, --, --, --, --, --, --, --, --, --
Milos Kelemen, Healthy, Ari, LW, FA, Ana, W 2-1, --, --, --, --, --, --, --, --, --, --, --, --, --, --, --, --, --
Riley Heidt, Healthy, Min, C, FA, Cls, L 4-5, --, --, --, --, --, --, --, --, --, --, --, --, --, --, --, --, --
Filip Bystedt, Healthy, SJ, C, FA, @Nsh, L 1-5, --, --, --, --, --, --, --, --, --, --, --, --, --, --, --, --, --
Andrew Ladd, Healthy, Ari, LW, FA, Ana, W 2-1, --, --, --, --, --, --, --, --, --, --, --, --, --, --, --, --, --
Lucas Carlsson, Healthy, Fla, D, FA, Van, L 3-5, --, --, --, --, --, --, --, --, --, --, --, --, --, --, --, --, --
Gabriel Carlsson, Healthy, Wsh, D, FA, @Mon, L 2-3, --, --, --, --, --, --, --, --, --, --, --, --, --, --, --, --, --
Jake Chelios, Healthy, Det, D, FA, @Ott, W 5-2, --, --, --, --, --, --, --, --, --, --, --, --, --, --, --, --, --
Lucas Johansen, Healthy, Wsh, D, FA, @Mon, L 2-3, --, --, --, --, --, --, --, --, --, --, --, --, --, --, --, --, --
Zac Dalpe, Healthy, Fla, RW- C, FA, Van, L 3-5, --, --, --, --, --, --, --, --, --, --, --, --, --, --, --, --, --
William Lockwood, Healthy, Fla, RW, FA, Van, L 3-5, --, --, --, --, --, --, --, --, --, --, --, --, --, --, --, --, --
Cam Dineen, Healthy, Edm, D, FA, Wpg, L 2-3, --, --, --, --, --, --, --, --, --, --, --, --, --, --, --, --, --
Jacob Moverare, Healthy, LA, D, FA, Bos, L 2-4, --, --, --, --, --, --, --, --, --, --, --, --, --, --, --, --, --
Markus Niemelainen, Healthy, Edm, D, FA, Wpg, L 2-3, --, --, --, --, --, --, --, --, --, --, --, --, --, --, --, --, --
Tristan Bertucci, Healthy, Dal, D, FA, Phi, W 5-4, --, --, --, --, --, --, --, --, --, --, --, --, --, --, --, --, --
Michael Del Zotto, Healthy, Ana, D, FA, @Ari, L 1-2, --, --, --, --, --, --, --, --, --, --, --, --, --, --, --, --, --
Guillaume Brisebois, IR, Van, D, FA, @Fla, W 5-3, --, --, --, --, --, --, --, --, --, --, --, --, --, --, --, --, --
Gavin Bayreuther, Healthy, Dal, D, FA, Phi, W 5-4, --, --, --, --, --, --, --, --, --, --, --, --, --, --, --, --, --
Cody McLeod, Healthy, Nsh, LW, FA, SJ, W 5-1, --, --, --, --, --, --, --, --, --, --, --, --, --, --, --, --, --
Nick Swaney, Healthy, Min, RW, FA, Cls, L 4-5, --, --, --, --, --, --, --, --, --, --, --, --, --, --, --, --, --
Nathan Smith, Healthy, Ari, LW, FA, Ana, W 2-1, --, --, --, --, --, --, --, --, --, --, --, --, --, --, --, --, --
Marian Studenic, Healthy, Sea, RW, FA, NYR, L 1-4, --, --, --, --, --, --, --, --, --, --, --, --, --, --, --, --, --
Scott Reedy, Healthy, Dal, C, FA, Phi, W 5-4, --, --, --, --, --, --, --, --, --, --, --, --, --, --, --, --, --
Brayden Tracey, Healthy, Ana, LW, FA, @Ari, L 1-2, --, --, --, --, --, --, --, --, --, --, --, --, --, --, --, --, --
Max McCormick, Healthy, Sea, LW, FA, NYR, L 1-4, --, --, --, --, --, --, --, --, --, --, --, --, --, --, --, --, --
Egor Afanasyev, Healthy, Nsh, LW, FA, SJ, W 5-1, --, --, --, --, --, --, --, --, --, --, --, --, --, --, --, --, --
Adam Gaudette, Healthy, StL, C, FA, Pit, W 4-2, --, --, --, --, --, --, --, --, --, --, --, --, --, --, --, --, --
CJ Suess, Healthy, SJ, LW, FA, @Nsh, L 1-5, --, --, --, --, --, --, --, --, --, --, --, --, --, --, --, --, --
Libor Hajek, Healthy, Pit, D, FA, @StL, L 2-4, --, --, --, --, --, --, --, --, --, --, --, --, --, --, --, --, --
Dylan Coghlan, Healthy, Car, D, FA, @Col, L 4-6, --, --, --, --, --, --, --, --, --, --, --, --, --, --, --, --, --
Mark Streit, Healthy, Mon, D, FA, Wsh, W 3-2, --, --, --, --, --, --, --, --, --, --, --, --, --, --, --, --, --
Marcus Bjork, Healthy, Cls, D, FA, @Min, W 5-4, --, --, --, --, --, --, --, --, --, --, --, --, --, --, --, --, --
Dan Girardi, Healthy, TB, D, FA, Tor, L 3-4, --, --, --, --, --, --, --, --, --, --, --, --, --, --, --, --, --
Mitchell Chaffee, Healthy, TB, RW, FA, Tor, L 3-4, --, --, --, --, --, --, --, --, --, --, --, --, --, --, --, --, --
Egor Sokolov, Healthy, Ott, LW, FA, Det, L 2-5, --, --, --, --, --, --, --, --, --, --, --, --, --, --, --, --, --
Lukas Rousek, Healthy, Buf, RW- LW, FA, NYI, W 3-1, --, --, --, --, --, --, --, --, --, --, --, --, --, --, --, --, --
Matthew Highmore, Healthy, Ott, C, FA, Det, L 2-5, --, --, --, --, --, --, --, --, --, --, --, --, --, --, --, --, --
Beau Akey, Healthy, Edm, D, FA, Wpg, L 2-3, --, --, --, --, --, --, --, --, --, --, --, --, --, --, --, --, --
Olli Juolevi, Healthy, Ari, D, FA, Ana, W 2-1, --, --, --, --, --, --, --, --, --, --, --, --, --, --, --, --, --
Derrick Pouliot, Healthy, Dal, D, FA, Phi, W 5-4, --, --, --, --, --, --, --, --, --, --, --, --, --, --, --, --, --
Kris Russell, Healthy, Edm, D, FA, Wpg, L 2-3, --, --, --, --, --, --, --, --, --, --, --, --, --, --, --, --, --
Jean-Luc Foudy, Healthy, Col, RW- C, FA, Car, W 6-4, --, --, --, --, --, --, --, --, --, --, --, --, --, --, --, --, --
John Leonard, Healthy, Ari, LW, FA, Ana, W 2-1, --, --, --, --, --, --, --, --, --, --, --, --, --, --, --, --, --
Pavol Regenda, Healthy, Ana, C, FA, @Ari, L 1-2, --, --, --, --, --, --, --, --, --, --, --, --, --, --, --, --, --
Jonathan Dahlen, Healthy, SJ, RW, FA, @Nsh, L 1-5, --, --, --, --, --, --, --, --, --, --, --, --, --, --, --, --, --
Joonas Donskoi, Healthy, Sea, RW, FA, NYR, L 1-4, --, --, --, --, --, --, --, --, --, --, --, --, --, --, --, --, --
Anders Bjork, Healthy, Chi, LW, FA, Vgk, L 3-5, --, --, --, --, --, --, --, --, --, --, --, --, --, --, --, --, --
Hugh McGing, Healthy, StL, C- LW, FA, Pit, W 4-2, --, --, --, --, --, --, --, --, --, --, --, --, --, --, --, --, --
Chris Kunitz, Healthy, Chi, LW, FA, Vgk, L 3-5, --, --, --, --, --, --, --, --, --, --, --, --, --, --, --, --, --
Drake Caggiula, Healthy, Edm, LW, FA, Wpg, L 2-3, --, --, --, --, --, --, --, --, --, --, --, --, --, --, --, --, --
Aidan McDonough, Healthy, Van, LW, FA, @Fla, W 5-3, --, --, --, --, --, --, --, --, --, --, --, --, --, --, --, --, --
Alexander Radulov, Healthy, Dal, RW, FA, Phi, W 5-4, --, --, --, --, --, --, --, --, --, --, --, --, --, --, --, --, --
Sean Day, Healthy, TB, D, FA, Tor, L 3-4, --, --, --, --, --, --, --, --, --, --, --, --, --, --, --, --, --
Jacob Larsson, Healthy, Ott, D, FA, Det, L 2-5, --, --, --, --, --, --, --, --, --, --, --, --, --, --, --, --, --
Paul Postma, Healthy, Bos, D, FA, @LA, W 4-2, --, --, --, --, --, --, --, --, --, --, --, --, --, --, --, --, --
Sami Niku, Healthy, Mon, D, FA, Wsh, W 3-2, --, --, --, --, --, --, --, --, --, --, --, --, --, --, --, --, --
Ben Harpur, O, NYR, D, FA, @Sea, W 4-1, --, --, --, --, --, --, --, --, --, --, --, --, --, --, --, --, --
Nathan Beaulieu, Healthy, Car, D, FA, @Col, L 4-6, --, --, --, --, --, --, --, --, --, --, --, --, --, --, --, --, --
Brian Boyle, Healthy, Pit, C, FA, @StL, L 2-4, --, --, --, --, --, --, --, --, --, --, --, --, --, --, --, --, --
Ethan Gauthier, Healthy, TB, RW, FA, Tor, L 3-4, --, --, --, --, --, --, --, --, --, --, --, --, --, --, --, --, --
Mitchell Stephens, Healthy, Mon, C, FA, Wsh, W 3-2, --, --, --, --, --, --, --, --, --, --, --, --, --, --, --, --, --
Alex Belzile, Healthy, NYR, C, FA, @Sea, W 4-1, --, --, --, --, --, --, --, --, --, --, --, --, --, --, --, --, --
P.A. Parenteau, Healthy, Det, RW, FA, @Ott, W 5-2, --, --, --, --, --, --, --, --, --, --, --, --, --, --, --, --, --
Jake Leschyshyn, Healthy, NYR, C, FA, @Sea, W 4-1, --, --, --, --, --, --, --, --, --, --, --, --, --, --, --, --, --
Alex Burrows, Healthy, Ott, RW, FA, Det, L 2-5, --, --, --, --, --, --, --, --, --, --, --, --, --, --, --, --, --
Trevor Carrick, Healthy, Ana, D, FA, @Ari, L 1-2, --, --, --, --, --, --, --, --, --, --, --, --, --, --, --, --, --
John Moore, Healthy, Ana, D, FA, @Ari, L 1-2, --, --, --, --, --, --, --, --, --, --, --, --, --, --, --, --, --
Ryan Merkley, Healthy, Col, D, FA, Car, W 6-4, --, --, --, --, --, --, --, --, --, --, --, --, --, --, --, --, --
Kyle Capobianco, Healthy, Wpg, D, FA, @Edm, W 3-2, --, --, --, --, --, --, --, --, --, --, --, --, --, --, --, --, --
Nico Myatovic, Healthy, Ana, LW, FA, @Ari, L 1-2, --, --, --, --, --, --, --, --, --, --, --, --, --, --, --, --, --
Martin Misiak, Healthy, Chi, RW, FA, Vgk, L 3-5, --, --, --, --, --, --, --, --, --, --, --, --, --, --, --, --, --
Reid Schaefer, Healthy, Nsh, LW, FA, SJ, W 5-1, --, --, --, --, --, --, --, --, --, --, --, --, --, --, --, --, --
Andrew Agozzino, Healthy, Ana, LW, FA, @Ari, L 1-2, --, --, --, --, --, --, --, --, --, --, --, --, --, --, --, --, --
Austin Poganski, Healthy, Ari, RW, FA, Ana, W 2-1, --, --, --, --, --, --, --, --, --, --, --, --, --, --, --, --, --
Brett Connolly, Healthy, Chi, RW, FA, Vgk, L 3-5, --, --, --, --, --, --, --, --, --, --, --, --, --, --, --, --, --
Josh Leivo, Healthy, StL, LW, FA, Pit, W 4-2, --, --, --, --, --, --, --, --, --, --, --, --, --, --, --, --, --
Kole Lind, Healthy, Sea, RW, FA, NYR, L 1-4, --, --, --, --, --, --, --, --, --, --, --, --, --, --, --, --, --
T.J. Tynan, Healthy, LA, C, FA, Bos, L 2-4, --, --, --, --, --, --, --, --, --, --, --, --, --, --, --, --, --
Loui Eriksson, Healthy, Ari, LW, FA, Ana, W 2-1, --, --, --, --, --, --, --, --, --, --, --, --, --, --, --, --, --
Maxime Lajoie, Healthy, Tor, D, FA, @TB, W 4-3, --, --, --, --, --, --, --, --, --, --, --, --, --, --, --, --, --
Tim Berni, Healthy, Cls, D, FA, @Min, W 5-4, --, --, --, --, --, --, --, --, --, --, --, --, --, --, --, --, --
Grant Hutton, Healthy, NYI, D, FA, @Buf, L 1-3, --, --, --, --, --, --, --, --, --, --, --, --, --, --, --, --, --
Petteri Lindbohm, Healthy, Fla, D, FA, Van, L 3-5, --, --, --, --, --, --, --, --, --, --, --, --, --, --, --, --, --
Joey Keane, Healthy, Car, D, FA, @Col, L 4-6, --, --, --, --, --, --, --, --, --, --, --, --, --, --, --, --, --
Will Butcher, Healthy, Pit, D, FA, @StL, L 2-4, --, --, --, --, --, --, --, --, --, --, --, --, --, --, --, --, --
Andy Greene, Healthy, NYI, D, FA, @Buf, L 1-3, --, --, --, --, --, --, --, --, --, --, --, --, --, --, --, --, --
Lane Pederson, Healthy, Edm, C, FA, Wpg, L 2-3, --, --, --, --, --, --, --, --, --, --, --, --, --, --, --, --, --
Mikael Pyyhtia, Healthy, Cls, LW, FA, @Min, W 5-4, --, --, --, --, --, --, --, --, --, --, --, --, --, --, --, --, --
Lucas Condotta, Healthy, Mon, C, FA, Wsh, W 3-2, --, --, --, --, --, --, --, --, --, --, --, --, --, --, --, --, --
Frederik Tiffels, Healthy, Pit, LW, FA, @StL, L 2-4, --, --, --, --, --, --, --, --, --, --, --, --, --, --, --, --, --
Nick Merkley, Healthy, NYR, RW, FA, @Sea, W 4-1, --, --, --, --, --, --, --, --, --, --, --, --, --, --, --, --, --
Antoine Roussel, Healthy, Phi, LW, FA, @Dal, L 4-5, --, --, --, --, --, --, --, --, --, --, --, --, --, --, --, --, --
Anthony Richard, Healthy, Bos, C, FA, @LA, W 4-2, --, --, --, --, --, --, --, --, --, --, --, --, --, --, --, --, --
Chase Pearson, Healthy, Det, C, FA, @Ott, W 5-2, --, --, --, --, --, --, --, --, --, --, --, --, --, --, --, --, --
Kieffer Bellows, Healthy, Car, LW, FA, @Col, L 4-6, --, --, --, --, --, --, --, --, --, --, --, --, --, --, --, --, --
C.J. Smith, Healthy, NYR, LW, FA, @Sea, W 4-1, --, --, --, --, --, --, --, --, --, --, --, --, --, --, --, --, --
Jack Ahcan, Healthy, Col, D, FA, Car, W 6-4, --, --, --, --, --, --, --, --, --, --, --, --, --, --, --, --, --
Ben Lovejoy, Healthy, Dal, D, FA, Phi, W 5-4, --, --, --, --, --, --, --, --, --, --, --, --, --, --, --, --, --
Andrei Mironov, Healthy, Col, D, FA, Car, W 6-4, --, --, --, --, --, --, --, --, --, --, --, --, --, --, --, --, --
Andrej Sustr, Healthy, Ana, D, FA, @Ari, L 1-2, --, --, --, --, --, --, --, --, --, --, --, --, --, --, --, --, --
Drew Helleson, Healthy, Ana, D, FA, @Ari, L 1-2, --, --, --, --, --, --, --, --, --, --, --, --, --, --, --, --, --
Spencer Stastney, Healthy, Nsh, D, FA, SJ, W 5-1, --, --, --, --, --, --, --, --, --, --, --, --, --, --, --, --, --
Corey Schueneman, Healthy, Col, D, FA, Car, W 6-4, --, --, --, --, --, --, --, --, --, --, --, --, --, --, --, --, --
Patrick Russell, Healthy, Edm, RW, FA, Wpg, L 2-3, --, --, --, --, --, --, --, --, --, --, --, --, --, --, --, --, --
Matej Blumel, Healthy, Dal, LW, FA, Phi, W 5-4, --, --, --, --, --, --, --, --, --, --, --, --, --, --, --, --, --
Andreas Martinsen, Healthy, Ana, LW, FA, @Ari, L 1-2, --, --, --, --, --, --, --, --, --, --, --, --, --, --, --, --, --
Oscar Fisker Molgaard, Healthy, Sea, C, FA, NYR, L 1-4, --, --, --, --, --, --, --, --, --, --, --, --, --, --, --, --, --
Roman Kantserov, Healthy, Chi, RW, FA, Vgk, L 3-5, --, --, --, --, --, --, --, --, --, --, --, --, --, --, --, --, --
Brad Malone, Healthy, Edm, LW, FA, Wpg, L 2-3, --, --, --, --, --, --, --, --, --, --, --, --, --, --, --, --, --
Tyler Bozak, Healthy, StL, C, FA, Pit, W 4-2, --, --, --, --, --, --, --, --, --, --, --, --, --, --, --, --, --
Fredrik Karlstrom, Healthy, Dal, C, FA, Phi, W 5-4, --, --, --, --, --, --, --, --, --, --, --, --, --, --, --, --, --
Matthew Peca, Healthy, StL, LW, FA, Pit, W 4-2, --, --, --, --, --, --, --, --, --, --, --, --, --, --, --, --, --
Zack Mitchell, Healthy, Min, RW, FA, Cls, L 4-5, --, --, --, --, --, --, --, --, --, --, --, --, --, --, --, --, --
Michael Raffl, Healthy, Dal, LW, FA, Phi, W 5-4, --, --, --, --, --, --, --, --, --, --, --, --, --, --, --, --, --
Isaac Ratcliffe, Healthy, StL, LW, FA, Pit, W 4-2, --, --, --, --, --, --, --, --, --, --, --, --, --, --, --, --, --
John Hayden, Healthy, Sea, RW, FA, NYR, L 1-4, --, --, --, --, --, --, --, --, --, --, --, --, --, --, --, --, --
Jacob Lucchini, Healthy, Min, LW, FA, Cls, L 4-5, --, --, --, --, --, --, --, --, --, --, --, --, --, --, --, --, --
Saku Maenalanen, Healthy, Wpg, RW, FA, @Edm, W 3-2, --, --, --, --, --, --, --, --, --, --, --, --, --, --, --, --, --
Brennan Menell, Healthy, Tor, D, FA, @TB, W 4-3, --, --, --, --, --, --, --, --, --, --, --, --, --, --, --, --, --
Casey Nelson, Healthy, Buf, D, FA, NYI, W 3-1, --, --, --, --, --, --, --, --, --, --, --, --, --, --, --, --, --
David Schlemko, Healthy, Phi, D, FA, @Dal, L 4-5, --, --, --, --, --, --, --, --, --, --, --, --, --, --, --, --, --
Billy Sweezey, Healthy, Cls, D, FA, @Min, W 5-4, --, --, --, --, --, --, --, --, --, --, --, --, --, --, --, --, --
Maxim Strbak, Healthy, Buf, D, FA, NYI, W 3-1, --, --, --, --, --, --, --, --, --, --, --, --, --, --, --, --, --
