Kirill Marchenko, Healthy, Cls, LW- RW, FA, @Ana, W 7-4, 1, 0, 0, -1, 0, 0, 0, 0, 0, 0, 0, 0, 0, 1, 1, 0, -0.1
Egor Zamula, Healthy, Phi, D, FA, @Chi, W 3-1, 1, 0, 0, 0, 2, 0, 0, 0, 0, 0, 0, 0, 0, 1, 0, 0, -0.1
Joel Armia, Healthy, Mon, RW, FA, Buf, L 2-3, 1, 0, 0, 0, 0, 0, 0, 0, 0, 0, 0, 1, 0, 0, 0, 0, -0.1
Justin Danforth, O, Cls, RW, FA, @Ana, W 7-4, 1, 0, 0, -1, 2, 0, 0, 0, 0, 0, 0, 0, 0, 1, 0, 1, -0.1
Derek Ryan, Healthy, Edm, RW- C, FA, Bos, L 5-6, 1, 0, 0, -1, 0, 0, 0, 0, 0, 0, 1, 3, 0, 0, 2, 0, -0.1
Philipp Kurashev, Healthy, Chi, LW, FA, Phi, L 1-3, 1, 0, 0, -1, 0, 0, 0, 0, 0, 0, 0, 0, 0, 3, 0, 0, -0.2
Ryan Strome, Healthy, Ana, C, FA, Cls, L 4-7, 1, 0, 0, -1, 2, 0, 0, 0, 0, 0, 4, 0, 0, 1, 0, 0, -0.2
Jordan Greenway, Healthy, Buf, LW, FA, @Mon, W 3-2, 1, 0, 0, -1, 2, 0, 0, 0, 0, 0, 0, 2, 0, 1, 2, 0, -0.2
Jesse Ylonen, Healthy, Mon, RW, FA, Buf, L 2-3, 1, 0, 0, -1, 0, 0, 0, 0, 0, 0, 0, 0, 0, 0, 1, 0, -0.2
JJ Peterka, Healthy, Buf, RW, FA, @Mon, W 3-2, 1, 0, 0, -1, 0, 0, 0, 0, 0, 0, 0, 0, 0, 2, 0, 0, -0.3
Cam Atkinson, Healthy, Phi, RW, FA, @Chi, W 3-1, 1, 0, 0, -1, 0, 0, 0, 0, 0, 0, 0, 0, 0, 2, 0, 0, -0.3
Casey Mittelstadt, Healthy, Col, C, FA, --, --, 1, 0, 0, -1, 2, 0, 0, 0, 0, 0, 4, 5, 0, 1, 1, 0, -0.4
Reese Johnson, O, Chi, RW, FA, Phi, L 1-3, 1, 0, 0, -1, 5, 0, 0, 0, 0, 0, 0, 0, 0, 0, 2, 0, -0.4
Ryan Donato, Healthy, Chi, RW, FA, Phi, L 1-3, 1, 0, 0, -1, 0, 0, 0, 0, 0, 0, 0, 0, 0, 0, 0, 0, -0.5
Jackson LaCombe, Healthy, Ana, D, FA, Cls, L 4-7, 1, 0, 0, -2, 0, 0, 0, 0, 0, 0, 0, 0, 0, 0, 0, 1, -0.5
Kale Clague, Healthy, Buf, D, FA, @Mon, W 3-2, 1, 0, 0, -1, 0, 0, 0, 0, 0, 0, 0, 0, 0, 0, 0, 0, -0.5
Juraj Slafkovsky, Healthy, Mon, LW, SLC, Buf, L 2-3, 1, 0, 0, -1, 6, 0, 0, 0, 0, 0, 0, 0, 0, 1, 1, 0, -0.7
Cam Fowler, Healthy, Ana, D, FA, Cls, L 4-7, 1, 0, 0, -3, 2, 0, 0, 0, 0, 0, 0, 0, 0, 1, 1, 1, -0.8
MacKenzie Entwistle, Healthy, Chi, RW, FA, Phi, L 1-3, 1, 0, 0, -1, 0, 0, 0, 0, 0, 0, 1, 5, 0, 0, 0, 0, -0.9
Ross Johnston, Healthy, Ana, LW, FA, Cls, L 4-7, 1, 0, 0, -2, 5, 0, 0, 0, 0, 0, 0, 0, 0, 0, 0, 0, -1.5
Nathan MacKinnon, Healthy, Col, C, HERB, --, --, --, --, --, --, --, --, --, --, --, --, --, --, --, --, --, --, --
Cale Makar, Healthy, Col, D, DINK, --, --, --, --, --, --, --, --, --, --, --, --, --, --, --, --, --, --, --
Mikko Rantanen, Healthy, Col, RW, HERB, --, --, --, --, --, --, --, --, --, --, --, --, --, --, --, --, --, --, --
Nikita Kucherov, Healthy, TB, RW, DINK, --, --, --, --, --, --, --, --, --, --, --, --, --, --, --, --, --, --, --
Roman Josi, Healthy, Nsh, D, SALT, --, --, --, --, --, --, --, --, --, --, --, --, --, --, --, --, --, --, --
Matthew Tkachuk, Healthy, Fla, RW- LW, CLB, --, --, --, --, --, --, --, --, --, --, --, --, --, --, --, --, --, --, --
Elias Pettersson, Healthy, Van, C- LW, SLC, --, --, --, --, --, --, --, --, --, --, --, --, --, --, --, --, --, --, --
J.T. Miller, Healthy, Van, C- LW- RW, HERB, --, --, --, --, --, --, --, --, --, --, --, --, --, --, --, --, --, --, --
Adam Fox, Healthy, NYR, D, SALT, --, --, --, --, --, --, --, --, --, --, --, --, --, --, --, --, --, --, --
Jason Robertson, Healthy, Dal, LW, ME, --, --, --, --, --, --, --, --, --, --, --, --, --, --, --, --, --, --, --
Sidney Crosby, Healthy, Pit, C, DINK, --, --, --, --, --, --, --, --, --, --, --, --, --, --, --, --, --, --, --
Kirill Kaprizov, Healthy, Min, LW, CLB, --, --, --, --, --, --, --, --, --, --, --, --, --, --, --, --, --, --, --
Sam Reinhart, Healthy, Fla, RW, ME, --, --, --, --, --, --, --, --, --, --, --, --, --, --, --, --, --, --, --
Brady Tkachuk, Healthy, Ott, LW, BOWS, --, --, --, --, --, --, --, --, --, --, --, --, --, --, --, --, --, --, --
Jack Hughes, Healthy, NJ, C, BBS, --, --, --, --, --, --, --, --, --, --, --, --, --, --, --, --, --, --, --
Steven Stamkos, Healthy, TB, C, HERB, --, --, --, --, --, --, --, --, --, --, --, --, --, --, --, --, --, --, --
Brayden Point, Healthy, TB, C, BBS, --, --, --, --, --, --, --, --, --, --, --, --, --, --, --, --, --, --, --
Quinn Hughes, Healthy, Van, D, HERB, --, --, --, --, --, --, --, --, --, --, --, --, --, --, --, --, --, --, --
Artemi Panarin, Healthy, NYR, LW, BOWS, --, --, --, --, --, --, --, --, --, --, --, --, --, --, --, --, --, --, --
Victor Hedman, Healthy, TB, D, LKR, --, --, --, --, --, --, --, --, --, --, --, --, --, --, --, --, --, --, --
Alex Ovechkin, Healthy, Wsh, LW, BOWS, --, --, --, --, --, --, --, --, --, --, --, --, --, --, --, --, --, --, --
Moritz Seider, Healthy, Det, D, SALT, --, --, --, --, --, --, --, --, --, --, --, --, --, --, --, --, --, --, --
Josh Morrissey, Healthy, Wpg, D, LKR, --, --, --, --, --, --, --, --, --, --, --, --, --, --, --, --, --, --, --
Noah Dobson, Healthy, NYI, D, SLC, --, --, --, --, --, --, --, --, --, --, --, --, --, --, --, --, --, --, --
Jack Eichel, Healthy, Vgk, C, BBS, --, --, --, --, --, --, --, --, --, --, --, --, --, --, --, --, --, --, --
John Carlson, Healthy, Wsh, D, ME, --, --, --, --, --, --, --, --, --, --, --, --, --, --, --, --, --, --, --
Mika Zibanejad, Healthy, NYR, C, ME, --, --, --, --, --, --, --, --, --, --, --, --, --, --, --, --, --, --, --
Aleksander Barkov, Healthy, Fla, C, SALT, --, --, --, --, --, --, --, --, --, --, --, --, --, --, --, --, --, --, --
Sebastian Aho, Healthy, Car, C, LKR, --, --, --, --, --, --, --, --, --, --, --, --, --, --, --, --, --, --, --
Carter Verhaeghe, Healthy, Fla, LW- C, BOWS, --, --, --, --, --, --, --, --, --, --, --, --, --, --, --, --, --, --, --
Filip Forsberg, Healthy, Nsh, LW, LKR, --, --, --, --, --, --, --, --, --, --, --, --, --, --, --, --, --, --, --
Kyle Connor, Healthy, Wpg, LW, ME, --, --, --, --, --, --, --, --, --, --, --, --, --, --, --, --, --, --, --
Dylan Larkin, Healthy, Det, C, OXP, --, --, --, --, --, --, --, --, --, --, --, --, --, --, --, --, --, --, --
Jake Guentzel, Healthy, Car, LW, DINK, --, --, --, --, --, --, --, --, --, --, --, --, --, --, --, --, --, --, --
Tim Stutzle, Healthy, Ott, C- LW, LKR, --, --, --, --, --, --, --, --, --, --, --, --, --, --, --, --, --, --, --
Joel Eriksson Ek, DTD, Min, C, OXP, --, --, --, --, --, --, --, --, --, --, --, --, --, --, --, --, --, --, --
Brock Boeser, Healthy, Van, RW, BOWS, --, --, --, --, --, --, --, --, --, --, --, --, --, --, --, --, --, --, --
Bo Horvat, Healthy, NYI, C, DINK, --, --, --, --, --, --, --, --, --, --, --, --, --, --, --, --, --, --, --
Alex DeBrincat, Healthy, Det, LW- RW, SLC, --, --, --, --, --, --, --, --, --, --, --, --, --, --, --, --, --, --, --
Jakob Chychrun, Healthy, Ott, D, FA, --, --, --, --, --, --, --, --, --, --, --, --, --, --, --, --, --, --, --
MacKenzie Weegar, Healthy, Cgy, D, ME, --, --, --, --, --, --, --, --, --, --, --, --, --, --, --, --, --, --, --
Jesper Bratt, Healthy, NJ, RW, HERB, --, --, --, --, --, --, --, --, --, --, --, --, --, --, --, --, --, --, --
Erik Karlsson, Healthy, Pit, D, CLB, --, --, --, --, --, --, --, --, --, --, --, --, --, --, --, --, --, --, --
Adrian Kempe, Healthy, LA, RW- LW, BOWS, --, --, --, --, --, --, --, --, --, --, --, --, --, --, --, --, --, --, --
Rasmus Andersson, Healthy, Cgy, D, ME, --, --, --, --, --, --, --, --, --, --, --, --, --, --, --, --, --, --, --
Miro Heiskanen, Healthy, Dal, D, LKR, --, --, --, --, --, --, --, --, --, --, --, --, --, --, --, --, --, --, --
Vincent Trocheck, Healthy, NYR, C, LKR, --, --, --, --, --, --, --, --, --, --, --, --, --, --, --, --, --, --, --
Alex Pietrangelo, DTD, Vgk, D, DINK, --, --, --, --, --, --, --, --, --, --, --, --, --, --, --, --, --, --, --
Roope Hintz, Healthy, Dal, C, ME, --, --, --, --, --, --, --, --, --, --, --, --, --, --, --, --, --, --, --
Chris Kreider, Healthy, NYR, LW, LKR, --, --, --, --, --, --, --, --, --, --, --, --, --, --, --, --, --, --, --
Joe Pavelski, Healthy, Dal, RW, DINK, --, --, --, --, --, --, --, --, --, --, --, --, --, --, --, --, --, --, --
Kris Letang, Healthy, Pit, D, HERB, --, --, --, --, --, --, --, --, --, --, --, --, --, --, --, --, --, --, --
Mathew Barzal, Healthy, NYI, C, LKR, --, --, --, --, --, --, --, --, --, --, --, --, --, --, --, --, --, --, --
Andrei Svechnikov, Healthy, Car, LW, HERB, --, --, --, --, --, --, --, --, --, --, --, --, --, --, --, --, --, --, --
Kevin Fiala, Healthy, LA, LW- RW, SLC, --, --, --, --, --, --, --, --, --, --, --, --, --, --, --, --, --, --, --
Nico Hischier, Healthy, NJ, C, SLC, --, --, --, --, --, --, --, --, --, --, --, --, --, --, --, --, --, --, --
Jacob Trouba, O, NYR, D, BOWS, --, --, --, --, --, --, --, --, --, --, --, --, --, --, --, --, --, --, --
Mark Scheifele, Healthy, Wpg, C, ME, --, --, --, --, --, --, --, --, --, --, --, --, --, --, --, --, --, --, --
Brandon Hagel, Healthy, TB, LW, HERB, --, --, --, --, --, --, --, --, --, --, --, --, --, --, --, --, --, --, --
Anze Kopitar, Healthy, LA, C, ME, --, --, --, --, --, --, --, --, --, --, --, --, --, --, --, --, --, --, --
Jonathan Marchessault, Healthy, Vgk, RW- LW, HERB, --, --, --, --, --, --, --, --, --, --, --, --, --, --, --, --, --, --, --
Shea Theodore, Healthy, Vgk, D, BBS, --, --, --, --, --, --, --, --, --, --, --, --, --, --, --, --, --, --, --
Drew Doughty, Healthy, LA, D, ME, --, --, --, --, --, --, --, --, --, --, --, --, --, --, --, --, --, --, --
Timo Meier, Healthy, NJ, LW- RW, SALT, --, --, --, --, --, --, --, --, --, --, --, --, --, --, --, --, --, --, --
Jordan Kyrou, Healthy, StL, RW- LW, CLB, --, --, --, --, --, --, --, --, --, --, --, --, --, --, --, --, --, --, --
Valeri Nichushkin, DTD, Col, RW, SALT, --, --, --, --, --, --, --, --, --, --, --, --, --, --, --, --, --, --, --
Noah Hanifin, Healthy, Vgk, D, BBS, --, --, --, --, --, --, --, --, --, --, --, --, --, --, --, --, --, --, --
Robert Thomas, Healthy, StL, C, OXP, --, --, --, --, --, --, --, --, --, --, --, --, --, --, --, --, --, --, --
Tyler Toffoli, Healthy, Wpg, RW, CLB, --, --, --, --, --, --, --, --, --, --, --, --, --, --, --, --, --, --, --
Jared McCann, Healthy, Sea, RW- C- LW, DINK, --, --, --, --, --, --, --, --, --, --, --, --, --, --, --, --, --, --, --
Devon Toews, Healthy, Col, D, BBS, --, --, --, --, --, --, --, --, --, --, --, --, --, --, --, --, --, --, --
Brandon Montour, Healthy, Fla, D, OXP, --, --, --, --, --, --, --, --, --, --, --, --, --, --, --, --, --, --, --
Evgeni Malkin, Healthy, Pit, C, FA, --, --, --, --, --, --, --, --, --, --, --, --, --, --, --, --, --, --, --
Elias Lindholm, DTD, Van, RW, ME, --, --, --, --, --, --, --, --, --, --, --, --, --, --, --, --, --, --, --
Matt Boldy, Healthy, Min, LW, SALT, --, --, --, --, --, --, --, --, --, --, --, --, --, --, --, --, --, --, --
Brock Nelson, Healthy, NYI, C, FA, --, --, --, --, --, --, --, --, --, --, --, --, --, --, --, --, --, --, --
Colton Parayko, Healthy, StL, D, ME, --, --, --, --, --, --, --, --, --, --, --, --, --, --, --, --, --, --, --
Martin Necas, Healthy, Car, RW- C, SALT, --, --, --, --, --, --, --, --, --, --, --, --, --, --, --, --, --, --, --
Patrick Kane, Healthy, Det, RW, DINK, --, --, --, --, --, --, --, --, --, --, --, --, --, --, --, --, --, --, --
"Ryan OReilly", Healthy, Nsh, C, BOWS, --, --, --, --, --, --, --, --, --, --, --, --, --, --, --, --, --, --, --
Jake Walman, DTD, Det, D, CLB, --, --, --, --, --, --, --, --, --, --, --, --, --, --, --, --, --, --, --
Brayden McNabb, Healthy, Vgk, D, LKR, --, --, --, --, --, --, --, --, --, --, --, --, --, --, --, --, --, --, --
Mats Zuccarello, Healthy, Min, RW, BOWS, --, --, --, --, --, --, --, --, --, --, --, --, --, --, --, --, --, --, --
Vince Dunn, DTD, Sea, D, CLB, --, --, --, --, --, --, --, --, --, --, --, --, --, --, --, --, --, --, --
Vladimir Tarasenko, Healthy, Fla, RW, BBS, --, --, --, --, --, --, --, --, --, --, --, --, --, --, --, --, --, --, --
Pavel Buchnevich, Healthy, StL, RW- C- LW, OXP, --, --, --, --, --, --, --, --, --, --, --, --, --, --, --, --, --, --, --
Brent Burns, Healthy, Car, D, FA, --, --, --, --, --, --, --, --, --, --, --, --, --, --, --, --, --, --, --
Adam Larsson, Healthy, Sea, D, BOWS, --, --, --, --, --, --, --, --, --, --, --, --, --, --, --, --, --, --, --
Eeli Tolvanen, Healthy, Sea, LW- RW, SALT, --, --, --, --, --, --, --, --, --, --, --, --, --, --, --, --, --, --, --
Shayne Gostisbehere, Healthy, Det, D, FA, --, --, --, --, --, --, --, --, --, --, --, --, --, --, --, --, --, --, --
Filip Hronek, Healthy, Van, D, ME, --, --, --, --, --, --, --, --, --, --, --, --, --, --, --, --, --, --, --
Thomas Chabot, DTD, Ott, D, FA, --, --, --, --, --, --, --, --, --, --, --, --, --, --, --, --, --, --, --
Seth Jarvis, Healthy, Car, RW- C, BBS, --, --, --, --, --, --, --, --, --, --, --, --, --, --, --, --, --, --, --
Luke Hughes, Healthy, NJ, D, SLC, --, --, --, --, --, --, --, --, --, --, --, --, --, --, --, --, --, --, --
William Karlsson, Healthy, Vgk, C, HERB, --, --, --, --, --, --, --, --, --, --, --, --, --, --, --, --, --, --, --
Drake Batherson, Healthy, Ott, RW, FA, --, --, --, --, --, --, --, --, --, --, --, --, --, --, --, --, --, --, --
Blake Coleman, Healthy, Cgy, RW- LW, LKR, --, --, --, --, --, --, --, --, --, --, --, --, --, --, --, --, --, --, --
Justin Faulk, Healthy, StL, D, CLB, --, --, --, --, --, --, --, --, --, --, --, --, --, --, --, --, --, --, --
Matt Duchene, Healthy, Dal, C, SLC, --, --, --, --, --, --, --, --, --, --, --, --, --, --, --, --, --, --, --
Bowen Byram, Healthy, Buf, D, CLB, @Mon, W 3-2, --, --, --, --, --, --, --, --, --, --, --, --, --, --, --, --, --
Dylan Strome, Healthy, Wsh, C, FA, --, --, --, --, --, --, --, --, --, --, --, --, --, --, --, --, --, --, --
Jamie Benn, Healthy, Dal, LW, OXP, --, --, --, --, --, --, --, --, --, --, --, --, --, --, --, --, --, --, --
Pierre-Luc Dubois, Healthy, LA, C, FA, --, --, --, --, --, --, --, --, --, --, --, --, --, --, --, --, --, --, --
Trevor Moore, Healthy, LA, LW, OXP, --, --, --, --, --, --, --, --, --, --, --, --, --, --, --, --, --, --, --
Thomas Harley, Healthy, Dal, D, DINK, --, --, --, --, --, --, --, --, --, --, --, --, --, --, --, --, --, --, --
Tomas Hertl, IR, Vgk, C- LW, ME, --, --, --, --, --, --, --, --, --, --, --, --, --, --, --, --, --, --, --
Mikhail Sergachev, IR, TB, D, SLC, --, --, --, --, --, --, --, --, --, --, --, --, --, --, --, --, --, --, --
Matt Roy, Healthy, LA, D, OXP, --, --, --, --, --, --, --, --, --, --, --, --, --, --, --, --, --, --, --
Claude Giroux, Healthy, Ott, RW- C, FA, --, --, --, --, --, --, --, --, --, --, --, --, --, --, --, --, --, --, --
"KAndre Miller", Healthy, NYR, D, FA, --, --, --, --, --, --, --, --, --, --, --, --, --, --, --, --, --, --, --
Artturi Lehkonen, Healthy, Col, LW, FA, --, --, --, --, --, --, --, --, --, --, --, --, --, --, --, --, --, --, --
Neal Pionk, Healthy, Wpg, D, DINK, --, --, --, --, --, --, --, --, --, --, --, --, --, --, --, --, --, --, --
Brock Faber, Healthy, Min, D, HERB, --, --, --, --, --, --, --, --, --, --, --, --, --, --, --, --, --, --, --
Mark Stone, IR, Vgk, RW, BBS, --, --, --, --, --, --, --, --, --, --, --, --, --, --, --, --, --, --, --
Ivan Barbashev, Healthy, Vgk, LW- C- RW, OXP, --, --, --, --, --, --, --, --, --, --, --, --, --, --, --, --, --, --, --
Gustav Forsling, Healthy, Fla, D, BOWS, --, --, --, --, --, --, --, --, --, --, --, --, --, --, --, --, --, --, --
Bryan Rust, Healthy, Pit, RW, CLB, --, --, --, --, --, --, --, --, --, --, --, --, --, --, --, --, --, --, --
Brady Skjei, Healthy, Car, D, FA, --, --, --, --, --, --, --, --, --, --, --, --, --, --, --, --, --, --, --
Josh Norris, IR, Ott, C, FA, --, --, --, --, --, --, --, --, --, --, --, --, --, --, --, --, --, --, --
Nazem Kadri, Healthy, Cgy, C, BOWS, --, --, --, --, --, --, --, --, --, --, --, --, --, --, --, --, --, --, --
Jake Sanderson, Healthy, Ott, D, FA, --, --, --, --, --, --, --, --, --, --, --, --, --, --, --, --, --, --, --
Andrei Kuzmenko, Healthy, Cgy, LW- RW, FA, --, --, --, --, --, --, --, --, --, --, --, --, --, --, --, --, --, --, --
Dougie Hamilton, IR, NJ, D, BBS, --, --, --, --, --, --, --, --, --, --, --, --, --, --, --, --, --, --, --
Jeff Petry, Healthy, Det, D, FA, --, --, --, --, --, --, --, --, --, --, --, --, --, --, --, --, --, --, --
Phillip Danault, Healthy, LA, C, FA, --, --, --, --, --, --, --, --, --, --, --, --, --, --, --, --, --, --, --
Dawson Mercer, Healthy, NJ, RW- C, FA, --, --, --, --, --, --, --, --, --, --, --, --, --, --, --, --, --, --, --
Nikolaj Ehlers, Healthy, Wpg, LW, HERB, --, --, --, --, --, --, --, --, --, --, --, --, --, --, --, --, --, --, --
Tommy Novak, Healthy, Nsh, C, FA, --, --, --, --, --, --, --, --, --, --, --, --, --, --, --, --, --, --, --
Jonathan Huberdeau, Healthy, Cgy, LW, FA, --, --, --, --, --, --, --, --, --, --, --, --, --, --, --, --, --, --, --
Chandler Stephenson, Healthy, Vgk, C, FA, --, --, --, --, --, --, --, --, --, --, --, --, --, --, --, --, --, --, --
Sam Bennett, Healthy, Fla, C- LW, ME, --, --, --, --, --, --, --, --, --, --, --, --, --, --, --, --, --, --, --
Ben Chiarot, Healthy, Det, D, FA, --, --, --, --, --, --, --, --, --, --, --, --, --, --, --, --, --, --, --
Matty Beniers, Healthy, Sea, C, FA, --, --, --, --, --, --, --, --, --, --, --, --, --, --, --, --, --, --, --
Ryan Graves, Healthy, Pit, D, FA, --, --, --, --, --, --, --, --, --, --, --, --, --, --, --, --, --, --, --
Gabriel Vilardi, O, Wpg, C, FA, --, --, --, --, --, --, --, --, --, --, --, --, --, --, --, --, --, --, --
Wyatt Johnston, Healthy, Dal, C, HERB, --, --, --, --, --, --, --, --, --, --, --, --, --, --, --, --, --, --, --
Tyson Barrie, Healthy, Nsh, D, FA, --, --, --, --, --, --, --, --, --, --, --, --, --, --, --, --, --, --, --
Lucas Raymond, Healthy, Det, LW, FA, --, --, --, --, --, --, --, --, --, --, --, --, --, --, --, --, --, --, --
Alec Martinez, Healthy, Vgk, D, BBS, --, --, --, --, --, --, --, --, --, --, --, --, --, --, --, --, --, --, --
Aaron Ekblad, DTD, Fla, D, FA, --, --, --, --, --, --, --, --, --, --, --, --, --, --, --, --, --, --, --
Rickard Rakell, Healthy, Pit, RW- C- LW, FA, --, --, --, --, --, --, --, --, --, --, --, --, --, --, --, --, --, --, --
Jaccob Slavin, Healthy, Car, D, OXP, --, --, --, --, --, --, --, --, --, --, --, --, --, --, --, --, --, --, --
Tony DeAngelo, Healthy, Car, D, FA, --, --, --, --, --, --, --, --, --, --, --, --, --, --, --, --, --, --, --
Gustav Nyquist, Healthy, Nsh, RW, BBS, --, --, --, --, --, --, --, --, --, --, --, --, --, --, --, --, --, --, --
Jared Spurgeon, IR, Min, D, FA, --, --, --, --, --, --, --, --, --, --, --, --, --, --, --, --, --, --, --
J.T. Compher, Healthy, Det, RW- C- LW, FA, --, --, --, --, --, --, --, --, --, --, --, --, --, --, --, --, --, --, --
Jakub Vrana, Healthy, StL, RW- LW, FA, --, --, --, --, --, --, --, --, --, --, --, --, --, --, --, --, --, --, --
Esa Lindell, Healthy, Dal, D, FA, --, --, --, --, --, --, --, --, --, --, --, --, --, --, --, --, --, --, --
Philip Tomasino, Healthy, Nsh, C, FA, --, --, --, --, --, --, --, --, --, --, --, --, --, --, --, --, --, --, --
Yegor Sharangovich, Healthy, Cgy, C- LW- RW, FA, --, --, --, --, --, --, --, --, --, --, --, --, --, --, --, --, --, --, --
Mario Ferraro, Healthy, SJ, D, FA, --, --, --, --, --, --, --, --, --, --, --, --, --, --, --, --, --, --, --
Teuvo Teravainen, Healthy, Car, RW, OXP, --, --, --, --, --, --, --, --, --, --, --, --, --, --, --, --, --, --, --
Logan Couture, IR, SJ, C, FA, --, --, --, --, --, --, --, --, --, --, --, --, --, --, --, --, --, --, --
Alexander Romanov, Healthy, NYI, D, DINK, --, --, --, --, --, --, --, --, --, --, --, --, --, --, --, --, --, --, --
Anthony Duclair, Healthy, TB, LW, FA, --, --, --, --, --, --, --, --, --, --, --, --, --, --, --, --, --, --, --
Dmitry Orlov, Healthy, Car, D, FA, --, --, --, --, --, --, --, --, --, --, --, --, --, --, --, --, --, --, --
Sean Monahan, Healthy, Wpg, C, CLB, --, --, --, --, --, --, --, --, --, --, --, --, --, --, --, --, --, --, --
Viktor Arvidsson, Healthy, LA, RW, FA, --, --, --, --, --, --, --, --, --, --, --, --, --, --, --, --, --, --, --
Tom Wilson, SSPD, Wsh, RW, FA, --, --, --, --, --, --, --, --, --, --, --, --, --, --, --, --, --, --, --
Shane Pinto, Healthy, Ott, C, CLB, --, --, --, --, --, --, --, --, --, --, --, --, --, --, --, --, --, --, --
Tyler Seguin, Healthy, Dal, RW- C, SALT, --, --, --, --, --, --, --, --, --, --, --, --, --, --, --, --, --, --, --
Ryan Hartman, Healthy, Min, C- RW, FA, --, --, --, --, --, --, --, --, --, --, --, --, --, --, --, --, --, --, --
Jake Middleton, Healthy, Min, D, FA, --, --, --, --, --, --, --, --, --, --, --, --, --, --, --, --, --, --, --
Oliver Bjorkstrand, Healthy, Sea, RW, OXP, --, --, --, --, --, --, --, --, --, --, --, --, --, --, --, --, --, --, --
Oliver Ekman-Larsson, Healthy, Fla, D, FA, --, --, --, --, --, --, --, --, --, --, --, --, --, --, --, --, --, --, --
Ryan Pulock, Healthy, NYI, D, FA, --, --, --, --, --, --, --, --, --, --, --, --, --, --, --, --, --, --, --
Marcus Pettersson, Healthy, Pit, D, FA, --, --, --, --, --, --, --, --, --, --, --, --, --, --, --, --, --, --, --
Quinton Byfield, Healthy, LA, C- LW, SLC, --, --, --, --, --, --, --, --, --, --, --, --, --, --, --, --, --, --, --
Alexis Lafreniere, Healthy, NYR, LW, FA, --, --, --, --, --, --, --, --, --, --, --, --, --, --, --, --, --, --, --
Michael Bunting, Healthy, Pit, LW, FA, --, --, --, --, --, --, --, --, --, --, --, --, --, --, --, --, --, --, --
Jonas Brodin, DTD, Min, D, CLB, --, --, --, --, --, --, --, --, --, --, --, --, --, --, --, --, --, --, --
Mikael Granlund, Healthy, SJ, LW, FA, --, --, --, --, --, --, --, --, --, --, --, --, --, --, --, --, --, --, --
Mason Marchment, Healthy, Dal, LW, FA, --, --, --, --, --, --, --, --, --, --, --, --, --, --, --, --, --, --, --
Nicholas Paul, Healthy, TB, C, FA, --, --, --, --, --, --, --, --, --, --, --, --, --, --, --, --, --, --, --
Rasmus Sandin, Healthy, Wsh, D, FA, --, --, --, --, --, --, --, --, --, --, --, --, --, --, --, --, --, --, --
Logan Stankoven, Healthy, Dal, C, SALT, --, --, --, --, --, --, --, --, --, --, --, --, --, --, --, --, --, --, --
Jake Neighbours, Healthy, StL, LW, FA, --, --, --, --, --, --, --, --, --, --, --, --, --, --, --, --, --, --, --
Samuel Girard, DTD, Col, D, FA, --, --, --, --, --, --, --, --, --, --, --, --, --, --, --, --, --, --, --
Jamie Oleksiak, Healthy, Sea, D, FA, --, --, --, --, --, --, --, --, --, --, --, --, --, --, --, --, --, --, --
Chris Tanev, Healthy, Dal, D, FA, --, --, --, --, --, --, --, --, --, --, --, --, --, --, --, --, --, --, --
Kyle Palmieri, Healthy, NYI, RW- LW, FA, --, --, --, --, --, --, --, --, --, --, --, --, --, --, --, --, --, --, --
Torey Krug, DTD, StL, D, FA, --, --, --, --, --, --, --, --, --, --, --, --, --, --, --, --, --, --, --
Brayden Schenn, Healthy, StL, C, SLC, --, --, --, --, --, --, --, --, --, --, --, --, --, --, --, --, --, --, --
Jonathan Drouin, Healthy, Col, LW, FA, --, --, --, --, --, --, --, --, --, --, --, --, --, --, --, --, --, --, --
Ryan McDonagh, Healthy, Nsh, D, FA, --, --, --, --, --, --, --, --, --, --, --, --, --, --, --, --, --, --, --
Nino Niederreiter, Healthy, Wpg, RW, FA, --, --, --, --, --, --, --, --, --, --, --, --, --, --, --, --, --, --, --
Jesperi Kotkaniemi, Healthy, Car, C, FA, --, --, --, --, --, --, --, --, --, --, --, --, --, --, --, --, --, --, --
Jaden Schwartz, Healthy, Sea, LW, FA, --, --, --, --, --, --, --, --, --, --, --, --, --, --, --, --, --, --, --
Anders Lee, Healthy, NYI, LW- C, FA, --, --, --, --, --, --, --, --, --, --, --, --, --, --, --, --, --, --, --
Tyler Myers, Healthy, Van, D, FA, --, --, --, --, --, --, --, --, --, --, --, --, --, --, --, --, --, --, --
Erik Gustafsson, DTD, NYR, D, FA, --, --, --, --, --, --, --, --, --, --, --, --, --, --, --, --, --, --, --
Dylan DeMelo, Healthy, Wpg, D, FA, --, --, --, --, --, --, --, --, --, --, --, --, --, --, --, --, --, --, --
Daniel Sprong, Healthy, Det, RW, FA, --, --, --, --, --, --, --, --, --, --, --, --, --, --, --, --, --, --, --
Cole Perfetti, Healthy, Wpg, LW- C- RW, FA, --, --, --, --, --, --, --, --, --, --, --, --, --, --, --, --, --, --, --
Evan Rodrigues, Healthy, Fla, C, FA, --, --, --, --, --, --, --, --, --, --, --, --, --, --, --, --, --, --, --
Colton Sissons, Healthy, Nsh, C, FA, --, --, --, --, --, --, --, --, --, --, --, --, --, --, --, --, --, --, --
Evgeny Kuznetsov, Healthy, Car, C, FA, --, --, --, --, --, --, --, --, --, --, --, --, --, --, --, --, --, --, --
Pavel Dorofeyev, Healthy, Vgk, RW, FA, --, --, --, --, --, --, --, --, --, --, --, --, --, --, --, --, --, --, --
Alexandre Carrier, DTD, Nsh, D, FA, --, --, --, --, --, --, --, --, --, --, --, --, --, --, --, --, --, --, --
Andrew Mangiapane, Healthy, Cgy, RW- LW, FA, --, --, --, --, --, --, --, --, --, --, --, --, --, --, --, --, --, --, --
Jeremy Lauzon, Healthy, Nsh, D, CLB, --, --, --, --, --, --, --, --, --, --, --, --, --, --, --, --, --, --, --
Brenden Dillon, Healthy, Wpg, D, FA, --, --, --, --, --, --, --, --, --, --, --, --, --, --, --, --, --, --, --
Luke Evangelista, Healthy, Nsh, RW, FA, --, --, --, --, --, --, --, --, --, --, --, --, --, --, --, --, --, --, --
Josh Manson, Healthy, Col, D, FA, --, --, --, --, --, --, --, --, --, --, --, --, --, --, --, --, --, --, --
T.J. Oshie, Healthy, Wsh, RW, FA, --, --, --, --, --, --, --, --, --, --, --, --, --, --, --, --, --, --, --
Anthony Cirelli, Healthy, TB, C, FA, --, --, --, --, --, --, --, --, --, --, --, --, --, --, --, --, --, --, --
Erik Haula, Healthy, NJ, LW, FA, --, --, --, --, --, --, --, --, --, --, --, --, --, --, --, --, --, --, --
Jani Hakanpaa, DTD, Dal, D, HERB, --, --, --, --, --, --, --, --, --, --, --, --, --, --, --, --, --, --, --
Reilly Smith, Healthy, Pit, RW, FA, --, --, --, --, --, --, --, --, --, --, --, --, --, --, --, --, --, --, --
Dominik Kubalik, Healthy, Ott, LW, FA, --, --, --, --, --, --, --, --, --, --, --, --, --, --, --, --, --, --, --
Fabian Zetterlund, Healthy, SJ, RW- LW, FA, --, --, --, --, --, --, --, --, --, --, --, --, --, --, --, --, --, --, --
Mikael Backlund, Healthy, Cgy, C, FA, --, --, --, --, --, --, --, --, --, --, --, --, --, --, --, --, --, --, --
