Name, Health, NHL Team, Position, GFHL Team, Opponent, Score, GP, G, A, +/-, PIM, PPG, PPA, SHG, SHA, GWG, FOW, FOL, HAT, SOG, HIT, BLK, FPTS
Cole Caufield, Healthy, Mon, LW- RW, LKR, @NJ, W 3-2, 1, 1, 1, 2, 0, 0, 0, 0, 0, 1, 0, 0, 0, 2, 1, 0, 6.0
Olli Maatta, Healthy, Det, D, FA, @Fla, W 3-2, 1, 0, 2, 2, 0, 0, 0, 0, 0, 0, 0, 0, 0, 3, 1, 2, 5.6
Michael Rasmussen, Healthy, Det, C, FA, @Fla, W 3-2, 1, 1, 1, 2, 0, 0, 0, 0, 0, 0, 0, 0, 0, 4, 1, 0, 5.2
Jeff Petry, Healthy, Det, D, FA, @Fla, W 3-2, 1, 0, 0, -1, 0, 0, 0, 0, 0, 0, 0, 0, 0, 1, 2, 9, 4.7
Gustav Forsling, Healthy, Fla, D, BOWS, Det, L 2-3, 1, 1, 0, 1, 0, 0, 0, 0, 0, 0, 0, 0, 0, 4, 3, 1, 4.3
Sam Reinhart, Healthy, Fla, RW, ME, Det, L 2-3, 1, 1, 0, 1, 0, 0, 0, 1, 0, 0, 6, 3, 0, 4, 0, 0, 4.2
Anton Lundell, Healthy, Fla, LW- C, FA, Det, L 2-3, 1, 0, 1, 1, 0, 0, 0, 0, 1, 0, 5, 1, 0, 4, 1, 0, 3.85
Robby Fabbri, Healthy, Det, LW- C, FA, @Fla, W 3-2, 1, 1, 0, 1, 2, 0, 0, 0, 0, 0, 0, 0, 0, 2, 1, 2, 3.8
Joshua Roy, O, Mon, LW- RW, FA, @NJ, W 3-2, 1, 1, 0, 1, 0, 0, 0, 0, 0, 0, 0, 0, 0, 5, 1, 1, 3.8
Juraj Slafkovsky, Healthy, Mon, LW, SLC, @NJ, W 3-2, 1, 1, 0, 1, 0, 0, 0, 0, 0, 0, 0, 0, 0, 2, 0, 2, 3.7
Sam Bennett, Healthy, Fla, C- LW, ME, Det, L 2-3, 1, 0, 1, 1, 0, 0, 0, 0, 0, 0, 8, 7, 0, 3, 0, 2, 3.4
Sean Monahan, Healthy, Wpg, C, CLB, --, --, 1, 0, 2, 2, 0, 0, 0, 0, 0, 0, 3, 11, 0, 2, 0, 0, 3.4
Shayne Gostisbehere, Healthy, Det, D, FA, @Fla, W 3-2, 1, 0, 1, -1, 2, 0, 1, 0, 0, 0, 0, 0, 0, 3, 1, 3, 3.15
Dmitry Kulikov, Healthy, Fla, D, FA, Det, L 2-3, 1, 0, 1, 0, 0, 0, 0, 0, 1, 0, 0, 0, 0, 1, 1, 1, 3.15
Jordan Harris, Healthy, Mon, D, FA, @NJ, W 3-2, 1, 0, 1, 2, 0, 0, 0, 0, 0, 0, 0, 0, 0, 1, 0, 1, 3.1
Joel Armia, Healthy, Mon, RW, FA, @NJ, W 3-2, 1, 0, 1, 2, 0, 0, 0, 0, 0, 0, 0, 1, 0, 3, 1, 0, 3.0
Luke Hughes, Healthy, NJ, D, SLC, Mon, L 2-3, 1, 1, 0, 0, 0, 1, 0, 0, 0, 0, 0, 0, 0, 3, 0, 0, 2.8
Alexander Holtz, Healthy, NJ, RW, FA, Mon, L 2-3, 1, 1, 0, 0, 0, 1, 0, 0, 0, 0, 0, 1, 0, 4, 0, 0, 2.8
Kaiden Guhle, Healthy, Mon, D, HERB, @NJ, W 3-2, 1, 0, 0, 1, 2, 0, 0, 0, 0, 0, 0, 0, 0, 0, 1, 4, 2.6
Moritz Seider, Healthy, Det, D, SALT, @Fla, W 3-2, 1, 0, 0, 0, 0, 0, 0, 0, 0, 0, 0, 0, 0, 0, 5, 2, 2.5
Mike Matheson, Healthy, Mon, D, CLB, @NJ, W 3-2, 1, 0, 0, 1, 2, 0, 0, 0, 0, 0, 0, 0, 0, 4, 1, 3, 2.5
Cal Foote, Healthy, NJ, D, FA, Mon, L 2-3, 1, 0, 0, 0, 0, 0, 0, 0, 0, 0, 0, 0, 0, 0, 0, 5, 2.5
Andrew Copp, Healthy, Det, C, FA, @Fla, W 3-2, 1, 0, 1, 2, 0, 0, 0, 0, 0, 0, 7, 9, 0, 0, 0, 0, 2.3
Nico Hischier, Healthy, NJ, C, SLC, Mon, L 2-3, 1, 0, 1, 0, 0, 0, 1, 0, 0, 0, 9, 7, 0, 3, 0, 0, 2.25
Dylan Larkin, Healthy, Det, C, OXP, @Fla, W 3-2, 1, 1, 0, -2, 0, 1, 0, 0, 0, 1, 8, 15, 0, 4, 0, 0, 2.2
Rafael Harvey-Pinard, Healthy, Mon, LW, FA, @NJ, W 3-2, 1, 0, 0, 0, 0, 0, 0, 0, 0, 0, 0, 2, 0, 0, 2, 3, 1.9
Justin Holl, Healthy, Det, D, FA, @Fla, W 3-2, 1, 0, 0, 2, 0, 0, 0, 0, 0, 0, 0, 0, 0, 1, 1, 1, 1.9
Simon Nemec, Healthy, NJ, D, SALT, Mon, L 2-3, 1, 0, 1, -3, 0, 0, 1, 0, 0, 0, 0, 0, 0, 3, 1, 2, 1.85
Timo Meier, Healthy, NJ, LW- RW, SALT, Mon, L 2-3, 1, 0, 1, -2, 0, 0, 1, 0, 0, 0, 0, 0, 0, 4, 2, 0, 1.75
Aaron Ekblad, DTD, Fla, D, FA, Det, L 2-3, 1, 0, 0, 2, 2, 0, 0, 0, 0, 0, 0, 0, 0, 2, 0, 1, 1.5
David Savard, Healthy, Mon, D, FA, @NJ, W 3-2, 1, 0, 0, 0, 0, 0, 0, 0, 0, 0, 0, 0, 0, 0, 1, 2, 1.3
Matthew Tkachuk, Healthy, Fla, RW- LW, CLB, Det, L 2-3, 1, 0, 0, 1, 2, 0, 0, 0, 0, 0, 0, 0, 0, 1, 3, 0, 1.3
Ben Chiarot, Healthy, Det, D, FA, @Fla, W 3-2, 1, 0, 0, -1, 2, 0, 0, 0, 0, 0, 0, 0, 0, 1, 1, 3, 1.2
Daniel Sprong, Healthy, Det, RW, FA, @Fla, W 3-2, 1, 0, 0, 0, 2, 0, 0, 0, 0, 0, 0, 0, 0, 4, 0, 2, 1.2
Joe Veleno, Healthy, Det, C, FA, @Fla, W 3-2, 1, 0, 0, 0, 0, 0, 0, 0, 0, 0, 5, 4, 0, 0, 2, 1, 1.2
Klim Kostin, Healthy, SJ, RW- LW, FA, --, --, 1, 0, 0, 0, 0, 0, 0, 0, 0, 0, 1, 0, 0, 0, 2, 1, 1.2
Christian Fischer, Healthy, Det, RW, FA, @Fla, W 3-2, 1, 0, 0, 1, 0, 0, 0, 0, 0, 0, 0, 1, 0, 2, 2, 0, 1.2
Eetu Luostarinen, Healthy, Fla, LW- C, FA, Det, L 2-3, 1, 0, 0, 0, 0, 0, 0, 0, 0, 0, 0, 0, 0, 3, 1, 1, 1.1
Justin Barron, Healthy, Mon, D, FA, @NJ, W 3-2, 1, 0, 0, 2, 0, 0, 0, 0, 0, 0, 0, 0, 0, 1, 0, 0, 1.1
Colin Miller, Healthy, Wpg, D, FA, --, --, 1, 0, 0, 0, 0, 0, 0, 0, 0, 0, 0, 0, 0, 3, 1, 1, 1.1
David Perron, Healthy, Det, RW- LW, FA, @Fla, W 3-2, 1, 0, 1, -2, 0, 0, 1, 0, 0, 0, 0, 0, 0, 3, 0, 0, 1.05
Kevin Stenlund, Healthy, Fla, RW, FA, Det, L 2-3, 1, 0, 0, -2, 0, 0, 0, 0, 0, 0, 12, 5, 0, 0, 1, 2, 1.0
Dawson Mercer, Healthy, NJ, RW- C, FA, Mon, L 2-3, 1, 0, 1, -2, 0, 0, 1, 0, 0, 0, 1, 1, 0, 2, 0, 0, 0.95
Curtis Lazar, Healthy, NJ, RW, FA, Mon, L 2-3, 1, 0, 0, 0, 0, 0, 0, 0, 0, 0, 1, 2, 0, 1, 3, 0, 0.9
Jayden Struble, Healthy, Mon, D, FA, @NJ, W 3-2, 1, 0, 0, 0, 0, 0, 0, 0, 0, 0, 0, 0, 0, 0, 1, 1, 0.8
Carter Verhaeghe, Healthy, Fla, LW- C, BOWS, Det, L 2-3, 1, 0, 0, 1, 0, 0, 0, 0, 0, 0, 2, 1, 0, 1, 0, 0, 0.7
Brandon Montour, Healthy, Fla, D, OXP, Det, L 2-3, 1, 0, 0, -1, 4, 0, 0, 0, 0, 0, 0, 0, 0, 5, 0, 2, 0.6
Niko Mikkola, Healthy, Fla, D, FA, Det, L 2-3, 1, 0, 0, -1, 0, 0, 0, 0, 0, 0, 0, 0, 0, 1, 0, 2, 0.6
Chris Tierney, Healthy, NJ, C, FA, Mon, L 2-3, 1, 0, 0, 0, 0, 0, 0, 0, 0, 0, 1, 0, 0, 0, 0, 1, 0.6
Max Willman, Healthy, NJ, C, FA, Mon, L 2-3, 1, 0, 0, 0, 0, 0, 0, 0, 0, 0, 0, 0, 0, 0, 0, 1, 0.5
Jesper Bratt, Healthy, NJ, RW, HERB, Mon, L 2-3, 1, 0, 0, 0, 0, 0, 0, 0, 0, 0, 0, 0, 0, 1, 1, 0, 0.4
Jonah Gadjovich, DTD, Fla, LW, FA, Det, L 2-3, 1, 0, 0, 0, 0, 0, 0, 0, 0, 0, 0, 0, 0, 1, 1, 0, 0.4
William Lockwood, Healthy, Fla, RW, FA, Det, L 2-3, 1, 0, 0, 0, 0, 0, 0, 0, 0, 0, 0, 0, 0, 1, 1, 0, 0.4
Michael McLeod, IR, NJ, C, FA, Mon, L 2-3, 1, 0, 0, -2, 2, 0, 0, 0, 0, 0, 10, 3, 0, 1, 1, 1, 0.4
Tyler Toffoli, Healthy, Wpg, RW, CLB, --, --, 1, 0, 0, 0, 0, 0, 0, 0, 0, 0, 1, 0, 0, 2, 0, 0, 0.3
Brendan Gallagher, Healthy, Mon, RW, FA, @NJ, W 3-2, 1, 0, 0, 0, 0, 0, 0, 0, 0, 0, 0, 0, 0, 3, 0, 0, 0.3
Jake Evans, Healthy, Mon, C- RW, FA, @NJ, W 3-2, 1, 0, 0, 0, 0, 0, 0, 0, 0, 0, 6, 3, 0, 0, 0, 0, 0.3
Michael Pezzetta, Healthy, Mon, LW- RW, FA, @NJ, W 3-2, 1, 0, 0, 0, 0, 0, 0, 0, 0, 0, 0, 0, 0, 0, 1, 0, 0.3
Mitchell Stephens, Healthy, Mon, C, FA, @NJ, W 3-2, 1, 0, 0, 0, 0, 0, 0, 0, 0, 0, 3, 2, 0, 1, 0, 0, 0.2
Oliver Ekman-Larsson, Healthy, Fla, D, FA, Det, L 2-3, 1, 0, 0, -1, 0, 0, 0, 0, 0, 0, 0, 0, 0, 2, 0, 1, 0.2
Nick Suzuki, Healthy, Mon, C, CLB, @NJ, W 3-2, 1, 0, 0, 1, 4, 0, 0, 0, 0, 0, 5, 9, 0, 1, 1, 0, 0.1
Rasmus Dahlin, Healthy, Buf, D, BBS, Chi, Postponed, --, --, --, --, --, --, --, --, --, --, --, --, --, --, --, --, --
Jack Hughes, Healthy, NJ, C, BBS, Mon, L 2-3, --, --, --, --, --, --, --, --, --, --, --, --, --, --, --, --, --
Aleksander Barkov, Healthy, Fla, C, SALT, Det, L 2-3, --, --, --, --, --, --, --, --, --, --, --, --, --, --, --, --, --
Connor Bedard, Healthy, Chi, C, DINK, @Buf, Postponed, --, --, --, --, --, --, --, --, --, --, --, --, --, --, --, --, --
Alex DeBrincat, Healthy, Det, LW- RW, SLC, @Fla, W 3-2, 1, 0, 0, 0, 0, 0, 0, 0, 0, 0, 0, 0, 0, 0, 0, 0, 0.0
Tage Thompson, Healthy, Buf, C, OXP, Chi, Postponed, --, --, --, --, --, --, --, --, --, --, --, --, --, --, --, --, --
Alex Tuch, Healthy, Buf, RW, ME, Chi, Postponed, --, --, --, --, --, --, --, --, --, --, --, --, --, --, --, --, --
Patrick Kane, Healthy, Det, RW, DINK, @Fla, W 3-2, --, --, --, --, --, --, --, --, --, --, --, --, --, --, --, --, --
Jake Walman, DTD, Det, D, CLB, @Fla, W 3-2, --, --, --, --, --, --, --, --, --, --, --, --, --, --, --, --, --
Seth Jones, Healthy, Chi, D, FA, @Buf, Postponed, --, --, --, --, --, --, --, --, --, --, --, --, --, --, --, --, --
Dylan Cozens, Healthy, Buf, C, FA, Chi, Postponed, --, --, --, --, --, --, --, --, --, --, --, --, --, --, --, --, --
Jeff Skinner, Healthy, Buf, LW, FA, Chi, Postponed, --, --, --, --, --, --, --, --, --, --, --, --, --, --, --, --, --
Dougie Hamilton, IR, NJ, D, BBS, Mon, L 2-3, --, --, --, --, --, --, --, --, --, --, --, --, --, --, --, --, --
Lukas Reichel, Healthy, Chi, LW, FA, @Buf, Postponed, --, --, --, --, --, --, --, --, --, --, --, --, --, --, --, --, --
Owen Power, Healthy, Buf, D, SLC, Chi, Postponed, --, --, --, --, --, --, --, --, --, --, --, --, --, --, --, --, --
Casey Mittelstadt, Healthy, Col, C, FA, --, --, --, --, --, --, --, --, --, --, --, --, --, --, --, --, --, --, --
JJ Peterka, Healthy, Buf, RW, FA, Chi, Postponed, --, --, --, --, --, --, --, --, --, --, --, --, --, --, --, --, --
Kirby Dach, IR, Mon, C, FA, @NJ, W 3-2, --, --, --, --, --, --, --, --, --, --, --, --, --, --, --, --, --
Philipp Kurashev, Healthy, Chi, LW, FA, @Buf, Postponed, --, --, --, --, --, --, --, --, --, --, --, --, --, --, --, --, --
Taylor Hall, IR, Chi, LW, FA, @Buf, Postponed, --, --, --, --, --, --, --, --, --, --, --, --, --, --, --, --, --
Nick Foligno, Healthy, Chi, LW- C- RW, FA, @Buf, Postponed, --, --, --, --, --, --, --, --, --, --, --, --, --, --, --, --, --
Jason Dickinson, Healthy, Chi, C, FA, @Buf, Postponed, --, --, --, --, --, --, --, --, --, --, --, --, --, --, --, --, --
Jonas Siegenthaler, Healthy, NJ, D, FA, Mon, L 2-3, --, --, --, --, --, --, --, --, --, --, --, --, --, --, --, --, --
Connor Murphy, IR, Chi, D, FA, @Buf, Postponed, --, --, --, --, --, --, --, --, --, --, --, --, --, --, --, --, --
Mattias Samuelsson, IR, Buf, D, FA, Chi, Postponed, --, --, --, --, --, --, --, --, --, --, --, --, --, --, --, --, --
Arber Xhekaj, Healthy, Mon, D, FA, @NJ, W 3-2, --, --, --, --, --, --, --, --, --, --, --, --, --, --, --, --, --
Connor Clifton, Healthy, Buf, D, FA, Chi, Postponed, --, --, --, --, --, --, --, --, --, --, --, --, --, --, --, --, --
Alex Newhook, Healthy, Mon, C, FA, @NJ, W 3-2, --, --, --, --, --, --, --, --, --, --, --, --, --, --, --, --, --
Taylor Raddysh, Healthy, Chi, RW, FA, @Buf, Postponed, --, --, --, --, --, --, --, --, --, --, --, --, --, --, --, --, --
Josh Anderson, Healthy, Mon, RW- LW, FA, @NJ, W 3-2, --, --, --, --, --, --, --, --, --, --, --, --, --, --, --, --, --
Corey Perry, Healthy, Edm, RW, FA, --, --, --, --, --, --, --, --, --, --, --, --, --, --, --, --, --, --, --
Jordan Greenway, Healthy, Buf, LW, FA, Chi, Postponed, --, --, --, --, --, --, --, --, --, --, --, --, --, --, --, --, --
Jack Quinn, Healthy, Buf, RW, FA, Chi, Postponed, --, --, --, --, --, --, --, --, --, --, --, --, --, --, --, --, --
Zach Benson, Healthy, Buf, LW, FA, Chi, Postponed, --, --, --, --, --, --, --, --, --, --, --, --, --, --, --, --, --
Tyler Johnson, Healthy, Chi, C- LW- RW, FA, @Buf, Postponed, --, --, --, --, --, --, --, --, --, --, --, --, --, --, --, --, --
Ondrej Palat, Healthy, NJ, LW, FA, Mon, L 2-3, --, --, --, --, --, --, --, --, --, --, --, --, --, --, --, --, --
Anthony Beauvillier, Healthy, Nsh, RW- LW, FA, --, --, --, --, --, --, --, --, --, --, --, --, --, --, --, --, --, --, --
Kevin Korchinski, Healthy, Chi, D, FA, @Buf, Postponed, --, --, --, --, --, --, --, --, --, --, --, --, --, --, --, --, --
Ryan Donato, Healthy, Chi, RW, FA, @Buf, Postponed, --, --, --, --, --, --, --, --, --, --, --, --, --, --, --, --, --
Tanner Pearson, Healthy, Mon, LW, FA, @NJ, W 3-2, --, --, --, --, --, --, --, --, --, --, --, --, --, --, --, --, --
Simon Edvinsson, Healthy, Det, D, FA, @Fla, W 3-2, --, --, --, --, --, --, --, --, --, --, --, --, --, --, --, --, --
Victor Olofsson, Healthy, Buf, RW, FA, Chi, Postponed, --, --, --, --, --, --, --, --, --, --, --, --, --, --, --, --, --
Jesse Ylonen, Healthy, Mon, RW, FA, @NJ, W 3-2, 1, 0, 0, 0, 0, 0, 0, 0, 0, 0, 0, 0, 0, 0, 0, 0, 0.0
Henri Jokiharju, Healthy, Buf, D, FA, Chi, Postponed, --, --, --, --, --, --, --, --, --, --, --, --, --, --, --, --, --
Jarred Tinordi, Healthy, Chi, D, FA, @Buf, Postponed, --, --, --, --, --, --, --, --, --, --, --, --, --, --, --, --, --
Alex Vlasic, Healthy, Chi, D, FA, @Buf, Postponed, --, --, --, --, --, --, --, --, --, --, --, --, --, --, --, --, --
Andreas Athanasiou, Healthy, Chi, LW- C- RW, FA, @Buf, Postponed, --, --, --, --, --, --, --, --, --, --, --, --, --, --, --, --, --
Erik Johnson, Healthy, Phi, D, FA, --, --, --, --, --, --, --, --, --, --, --, --, --, --, --, --, --, --, --
Peyton Krebs, Healthy, Buf, C, FA, Chi, Postponed, --, --, --, --, --, --, --, --, --, --, --, --, --, --, --, --, --
Kyle Okposo, Healthy, Fla, RW, FA, Det, L 2-3, --, --, --, --, --, --, --, --, --, --, --, --, --, --, --, --, --
Jonathan Toews, Healthy, Chi, C, FA, @Buf, Postponed, --, --, --, --, --, --, --, --, --, --, --, --, --, --, --, --, --
Zemgus Girgensons, Healthy, Buf, C, FA, Chi, Postponed, --, --, --, --, --, --, --, --, --, --, --, --, --, --, --, --, --
P.K. Subban, Healthy, NJ, D, FA, Mon, L 2-3, --, --, --, --, --, --, --, --, --, --, --, --, --, --, --, --, --
Lane Hutson, Healthy, Mon, D, FA, @NJ, W 3-2, --, --, --, --, --, --, --, --, --, --, --, --, --, --, --, --, --
Brandon Biro, Healthy, Buf, LW, FA, Chi, Postponed, --, --, --, --, --, --, --, --, --, --, --, --, --, --, --, --, --
Nikita Zaitsev, Healthy, Chi, D, FA, @Buf, Postponed, --, --, --, --, --, --, --, --, --, --, --, --, --, --, --, --, --
David Reinbacher, Healthy, Mon, D, FA, @NJ, W 3-2, --, --, --, --, --, --, --, --, --, --, --, --, --, --, --, --, --
Kevin Bahl, Healthy, NJ, D, FA, Mon, L 2-3, 1, 0, 0, 0, 0, 0, 0, 0, 0, 0, 0, 0, 0, 0, 0, 0, 0.0
Matt Savoie, Healthy, Buf, C, FA, Chi, Postponed, --, --, --, --, --, --, --, --, --, --, --, --, --, --, --, --, --
Marco Kasper, Healthy, Det, C, FA, @Fla, W 3-2, --, --, --, --, --, --, --, --, --, --, --, --, --, --, --, --, --
Brendan Smith, Healthy, NJ, D, FA, Mon, L 2-3, --, --, --, --, --, --, --, --, --, --, --, --, --, --, --, --, --
Tyson Jost, O, Buf, C, FA, Chi, Postponed, --, --, --, --, --, --, --, --, --, --, --, --, --, --, --, --, --
Nathan Bastian, IR, NJ, RW, FA, Mon, L 2-3, 1, 0, 0, -1, 0, 0, 0, 0, 0, 0, 0, 1, 0, 0, 2, 0, 0.0
Jiri Kulich, Healthy, Buf, C- LW, FA, Chi, Postponed, --, --, --, --, --, --, --, --, --, --, --, --, --, --, --, --, --
Jonatan Berggren, Healthy, Det, RW, FA, @Fla, W 3-2, --, --, --, --, --, --, --, --, --, --, --, --, --, --, --, --, --
Wyatt Kaiser, Healthy, Chi, D, FA, @Buf, Postponed, --, --, --, --, --, --, --, --, --, --, --, --, --, --, --, --, --
Nate Danielson, Healthy, Det, C, FA, @Fla, W 3-2, --, --, --, --, --, --, --, --, --, --, --, --, --, --, --, --, --
Jaycob Megna, Healthy, Chi, D, FA, @Buf, Postponed, --, --, --, --, --, --, --, --, --, --, --, --, --, --, --, --, --
Oliver Moore, Healthy, Chi, C, FA, @Buf, Postponed, --, --, --, --, --, --, --, --, --, --, --, --, --, --, --, --, --
Colin Blackwell, DTD, Chi, C- RW, FA, @Buf, Postponed, --, --, --, --, --, --, --, --, --, --, --, --, --, --, --, --, --
Axel Sandin Pellikka, Healthy, Det, D, FA, @Fla, W 3-2, --, --, --, --, --, --, --, --, --, --, --, --, --, --, --, --, --
Johnathan Kovacevic, Healthy, Mon, D, FA, @NJ, W 3-2, --, --, --, --, --, --, --, --, --, --, --, --, --, --, --, --, --
Nick Cousins, Healthy, Fla, C, FA, Det, L 2-3, --, --, --, --, --, --, --, --, --, --, --, --, --, --, --, --, --
Eric Robinson, Healthy, Buf, LW, FA, Chi, Postponed, --, --, --, --, --, --, --, --, --, --, --, --, --, --, --, --, --
Cole Guttman, Healthy, Chi, C, FA, @Buf, Postponed, --, --, --, --, --, --, --, --, --, --, --, --, --, --, --, --, --
Reese Johnson, O, Chi, RW, FA, @Buf, Postponed, --, --, --, --, --, --, --, --, --, --, --, --, --, --, --, --, --
MacKenzie Entwistle, Healthy, Chi, RW, FA, @Buf, Postponed, --, --, --, --, --, --, --, --, --, --, --, --, --, --, --, --, --
Frank Nazar, Healthy, Chi, C, FA, @Buf, Postponed, --, --, --, --, --, --, --, --, --, --, --, --, --, --, --, --, --
Joe Thornton, Healthy, Fla, C, FA, Det, L 2-3, --, --, --, --, --, --, --, --, --, --, --, --, --, --, --, --, --
Mackie Samoskevich, Healthy, Fla, LW- RW, FA, Det, L 2-3, --, --, --, --, --, --, --, --, --, --, --, --, --, --, --, --, --
Eric Staal, Healthy, Fla, C, FA, Det, L 2-3, --, --, --, --, --, --, --, --, --, --, --, --, --, --, --, --, --
Ryan Johnson, Healthy, Buf, D, FA, Chi, Postponed, --, --, --, --, --, --, --, --, --, --, --, --, --, --, --, --, --
Isaak Phillips, Healthy, Chi, D, FA, @Buf, Postponed, --, --, --, --, --, --, --, --, --, --, --, --, --, --, --, --, --
Josh Mahura, Healthy, Fla, D, FA, Det, L 2-3, --, --, --, --, --, --, --, --, --, --, --, --, --, --, --, --, --
Christian Dvorak, IR, Mon, LW, FA, @NJ, W 3-2, --, --, --, --, --, --, --, --, --, --, --, --, --, --, --, --, --
Joey Anderson, Healthy, Chi, RW, FA, @Buf, Postponed, --, --, --, --, --, --, --, --, --, --, --, --, --, --, --, --, --
Jacob Bryson, Healthy, Buf, D, FA, Chi, Postponed, --, --, --, --, --, --, --, --, --, --, --, --, --, --, --, --, --
Tomas Nosek, Healthy, NJ, C, FA, Mon, L 2-3, --, --, --, --, --, --, --, --, --, --, --, --, --, --, --, --, --
Boris Katchouk, Healthy, Ott, LW, FA, --, --, --, --, --, --, --, --, --, --, --, --, --, --, --, --, --, --, --
Steven Lorentz, Healthy, Fla, C, FA, Det, L 2-3, 1, 0, 0, 0, 0, 0, 0, 0, 0, 0, 2, 5, 0, 0, 1, 0, 0.0
Egor Yakovlev, Healthy, NJ, D, FA, Mon, L 2-3, --, --, --, --, --, --, --, --, --, --, --, --, --, --, --, --, --
Chris Wideman, IR, Mon, D, FA, @NJ, W 3-2, --, --, --, --, --, --, --, --, --, --, --, --, --, --, --, --, --
Elmer Soderblom, Healthy, Det, LW- C, FA, @Fla, W 3-2, --, --, --, --, --, --, --, --, --, --, --, --, --, --, --, --, --
Nolan Foote, O, NJ, LW, FA, Mon, L 2-3, --, --, --, --, --, --, --, --, --, --, --, --, --, --, --, --, --
Sean Farrell, Healthy, Mon, LW, FA, @NJ, W 3-2, --, --, --, --, --, --, --, --, --, --, --, --, --, --, --, --, --
Noah Ostlund, Healthy, Buf, C, FA, Chi, Postponed, --, --, --, --, --, --, --, --, --, --, --, --, --, --, --, --, --
Uvis Balinskis, Healthy, Fla, D, FA, Det, L 2-3, --, --, --, --, --, --, --, --, --, --, --, --, --, --, --, --, --
Riley Stillman, Healthy, Buf, D, FA, Chi, Postponed, --, --, --, --, --, --, --, --, --, --, --, --, --, --, --, --, --
Justin Dowling, Healthy, NJ, C, FA, Mon, L 2-3, --, --, --, --, --, --, --, --, --, --, --, --, --, --, --, --, --
Madison Bowey, Healthy, Mon, D, FA, @NJ, W 3-2, --, --, --, --, --, --, --, --, --, --, --, --, --, --, --, --, --
Patric Hornqvist, Healthy, Fla, RW, FA, Det, L 2-3, --, --, --, --, --, --, --, --, --, --, --, --, --, --, --, --, --
Austin Czarnik, Healthy, Det, RW, FA, @Fla, W 3-2, --, --, --, --, --, --, --, --, --, --, --, --, --, --, --, --, --
Filip Mesar, Healthy, Mon, RW- LW, FA, @NJ, W 3-2, --, --, --, --, --, --, --, --, --, --, --, --, --, --, --, --, --
Rem Pitlick, Healthy, Chi, C, FA, @Buf, Postponed, --, --, --, --, --, --, --, --, --, --, --, --, --, --, --, --, --
Santeri Hatakka, Healthy, NJ, D, FA, Mon, L 2-3, --, --, --, --, --, --, --, --, --, --, --, --, --, --, --, --, --
Owen Beck, Healthy, Mon, C, FA, @NJ, W 3-2, --, --, --, --, --, --, --, --, --, --, --, --, --, --, --, --, --
Sam Rinzel, Healthy, Chi, D, FA, @Buf, Postponed, --, --, --, --, --, --, --, --, --, --, --, --, --, --, --, --, --
Kale Clague, Healthy, Buf, D, FA, Chi, Postponed, --, --, --, --, --, --, --, --, --, --, --, --, --, --, --, --, --
Anton Wahlberg, Healthy, Buf, C, FA, Chi, Postponed, --, --, --, --, --, --, --, --, --, --, --, --, --, --, --, --, --
Zach Sanford, Healthy, Chi, LW, FA, @Buf, Postponed, --, --, --, --, --, --, --, --, --, --, --, --, --, --, --, --, --
Mark Streit, Healthy, Mon, D, FA, @NJ, W 3-2, --, --, --, --, --, --, --, --, --, --, --, --, --, --, --, --, --
Isak Rosen, Healthy, Buf, LW- RW, FA, Chi, Postponed, --, --, --, --, --, --, --, --, --, --, --, --, --, --, --, --, --
Lukas Rousek, O, Buf, RW- LW, FA, Chi, Postponed, --, --, --, --, --, --, --, --, --, --, --, --, --, --, --, --, --
Anders Bjork, Healthy, Chi, LW, FA, @Buf, Postponed, --, --, --, --, --, --, --, --, --, --, --, --, --, --, --, --, --
Lucas Carlsson, Healthy, Fla, D, FA, Det, L 2-3, --, --, --, --, --, --, --, --, --, --, --, --, --, --, --, --, --
Jake Chelios, Healthy, Det, D, FA, @Fla, W 3-2, --, --, --, --, --, --, --, --, --, --, --, --, --, --, --, --, --
Connor Bunnaman, Healthy, Fla, LW, FA, Det, L 2-3, --, --, --, --, --, --, --, --, --, --, --, --, --, --, --, --, --
Paul Byron, Healthy, Mon, LW, FA, @NJ, W 3-2, --, --, --, --, --, --, --, --, --, --, --, --, --, --, --, --, --
Chris Kunitz, Healthy, Chi, LW, FA, @Buf, Postponed, --, --, --, --, --, --, --, --, --, --, --, --, --, --, --, --, --
Gracyn Sawchyn, Healthy, Fla, C, FA, Det, L 2-3, --, --, --, --, --, --, --, --, --, --, --, --, --, --, --, --, --
Zach Aston-Reese, Healthy, Det, C, FA, @Fla, W 3-2, --, --, --, --, --, --, --, --, --, --, --, --, --, --, --, --, --
Filip Roos, Healthy, Chi, D, FA, @Buf, Postponed, --, --, --, --, --, --, --, --, --, --, --, --, --, --, --, --, --
Zachary Hayes, Healthy, NJ, D, FA, Mon, L 2-3, --, --, --, --, --, --, --, --, --, --, --, --, --, --, --, --, --
Andrew Gibson, Healthy, Det, D, FA, @Fla, W 3-2, --, --, --, --, --, --, --, --, --, --, --, --, --, --, --, --, --
Lukas Vejdemo, Healthy, Mon, C, FA, @NJ, W 3-2, --, --, --, --, --, --, --, --, --, --, --, --, --, --, --, --, --
Buddy Robinson, Healthy, Chi, RW, FA, @Buf, Postponed, --, --, --, --, --, --, --, --, --, --, --, --, --, --, --, --, --
Curtis Valk, Healthy, Fla, C, FA, Det, L 2-3, --, --, --, --, --, --, --, --, --, --, --, --, --, --, --, --, --
Brett Connolly, Healthy, Chi, RW, FA, @Buf, Postponed, --, --, --, --, --, --, --, --, --, --, --, --, --, --, --, --, --
Luke Philp, Healthy, Chi, C, FA, @Buf, Postponed, --, --, --, --, --, --, --, --, --, --, --, --, --, --, --, --, --
Kurtis Gabriel, Healthy, Chi, RW, FA, @Buf, Postponed, --, --, --, --, --, --, --, --, --, --, --, --, --, --, --, --, --
Thomas Hickey, Healthy, NJ, D, FA, Mon, L 2-3, --, --, --, --, --, --, --, --, --, --, --, --, --, --, --, --, --
Justin Sourdif, Healthy, Fla, RW- C, FA, Det, L 2-3, --, --, --, --, --, --, --, --, --, --, --, --, --, --, --, --, --
Lucas Condotta, Healthy, Mon, C, FA, @NJ, W 3-2, --, --, --, --, --, --, --, --, --, --, --, --, --, --, --, --, --
Zac Dalpe, Healthy, Fla, RW- C, FA, Det, L 2-3, --, --, --, --, --, --, --, --, --, --, --, --, --, --, --, --, --
Brett Murray, Healthy, Buf, LW, FA, Chi, Postponed, --, --, --, --, --, --, --, --, --, --, --, --, --, --, --, --, --
P.A. Parenteau, Healthy, Det, RW, FA, @Fla, W 3-2, --, --, --, --, --, --, --, --, --, --, --, --, --, --, --, --, --
Shane Bowers, Healthy, NJ, C, FA, Mon, L 2-3, --, --, --, --, --, --, --, --, --, --, --, --, --, --, --, --, --
Rasmus Asplund, Healthy, Fla, C, FA, Det, L 2-3, --, --, --, --, --, --, --, --, --, --, --, --, --, --, --, --, --
Brett Ritchie, Healthy, Fla, RW, FA, Det, L 2-3, --, --, --, --, --, --, --, --, --, --, --, --, --, --, --, --, --
Brett Seney, Healthy, Chi, LW, FA, @Buf, Postponed, --, --, --, --, --, --, --, --, --, --, --, --, --, --, --, --, --
Petteri Lindbohm, Healthy, Fla, D, FA, Det, L 2-3, --, --, --, --, --, --, --, --, --, --, --, --, --, --, --, --, --
Brian Lashoff, Healthy, Det, D, FA, @Fla, W 3-2, --, --, --, --, --, --, --, --, --, --, --, --, --, --, --, --, --
Nicolas Beaudin, Healthy, Mon, D, FA, @NJ, W 3-2, --, --, --, --, --, --, --, --, --, --, --, --, --, --, --, --, --
Alexander True, Healthy, Fla, C, FA, Det, L 2-3, --, --, --, --, --, --, --, --, --, --, --, --, --, --, --, --, --
Cody Franson, Healthy, Chi, D, FA, @Buf, Postponed, --, --, --, --, --, --, --, --, --, --, --, --, --, --, --, --, --
Mike Hardman, Healthy, Chi, RW, FA, @Buf, Postponed, --, --, --, --, --, --, --, --, --, --, --, --, --, --, --, --, --
Roman Kantserov, Healthy, Chi, RW, FA, @Buf, Postponed, --, --, --, --, --, --, --, --, --, --, --, --, --, --, --, --, --
David Gust, Healthy, Chi, RW, FA, @Buf, Postponed, --, --, --, --, --, --, --, --, --, --, --, --, --, --, --, --, --
Mattias Norlinder, Healthy, Mon, D, FA, @NJ, W 3-2, --, --, --, --, --, --, --, --, --, --, --, --, --, --, --, --, --
Brady Cleveland, Healthy, Det, D, FA, @Fla, W 3-2, --, --, --, --, --, --, --, --, --, --, --, --, --, --, --, --, --
Maxim Strbak, Healthy, Buf, D, FA, Chi, Postponed, --, --, --, --, --, --, --, --, --, --, --, --, --, --, --, --, --
Lenni Hameenaho, Healthy, NJ, RW, FA, Mon, L 2-3, --, --, --, --, --, --, --, --, --, --, --, --, --, --, --, --, --
Gerry Mayhew, Healthy, Fla, RW, FA, Det, L 2-3, --, --, --, --, --, --, --, --, --, --, --, --, --, --, --, --, --
"Joel LEsperance", Healthy, Det, C, FA, @Fla, W 3-2, --, --, --, --, --, --, --, --, --, --, --, --, --, --, --, --, --
Brady Keeper, Healthy, Mon, D, FA, @NJ, W 3-2, --, --, --, --, --, --, --, --, --, --, --, --, --, --, --, --, --
Casey Nelson, Healthy, Buf, D, FA, Chi, Postponed, --, --, --, --, --, --, --, --, --, --, --, --, --, --, --, --, --
Victor Antipin, Healthy, Buf, D, FA, Chi, Postponed, --, --, --, --, --, --, --, --, --, --, --, --, --, --, --, --, --
Sami Niku, Healthy, Mon, D, FA, @NJ, W 3-2, --, --, --, --, --, --, --, --, --, --, --, --, --, --, --, --, --
Josh Gorges, Healthy, Buf, D, FA, Chi, Postponed, --, --, --, --, --, --, --, --, --, --, --, --, --, --, --, --, --
Matt Kiersted, Healthy, Fla, D, FA, Det, L 2-3, --, --, --, --, --, --, --, --, --, --, --, --, --, --, --, --, --
Cedric Paquette, Healthy, Mon, C, FA, @NJ, W 3-2, --, --, --, --, --, --, --, --, --, --, --, --, --, --, --, --, --
"Danny ORegan", Healthy, Det, C, FA, @Fla, W 3-2, --, --, --, --, --, --, --, --, --, --, --, --, --, --, --, --, --
Mathias Brome, Healthy, Det, LW, FA, @Fla, W 3-2, --, --, --, --, --, --, --, --, --, --, --, --, --, --, --, --, --
Chase Pearson, Healthy, Det, C, FA, @Fla, W 3-2, --, --, --, --, --, --, --, --, --, --, --, --, --, --, --, --, --
Taro Hirose, Healthy, Det, LW, FA, @Fla, W 3-2, --, --, --, --, --, --, --, --, --, --, --, --, --, --, --, --, --
Jason Garrison, Healthy, Chi, D, FA, @Buf, Postponed, --, --, --, --, --, --, --, --, --, --, --, --, --, --, --, --, --
Martin Misiak, Healthy, Chi, RW, FA, @Buf, Postponed, --, --, --, --, --, --, --, --, --, --, --, --, --, --, --, --, --
