Vincent Iorio, Healthy, Wsh, D, FA, @Mon, L 2-3, --, --, --, --, --, --, --, --, --, --, --, --, --, --, --, --, --
Paul LaDue, Healthy, NYI, D, FA, @Buf, L 1-3, --, --, --, --, --, --, --, --, --, --, --, --, --, --, --, --, --
Alec Regula, Healthy, Bos, D, FA, @LA, W 4-2, --, --, --, --, --, --, --, --, --, --, --, --, --, --, --, --, --
Nicolas Beaudin, Healthy, Mon, D, FA, Wsh, W 3-2, --, --, --, --, --, --, --, --, --, --, --, --, --, --, --, --, --
Otto Koivula, Healthy, NYI, LW, FA, @Buf, L 1-3, --, --, --, --, --, --, --, --, --, --, --, --, --, --, --, --, --
Elliot Desnoyers, Healthy, Phi, LW, FA, @Dal, L 4-5, --, --, --, --, --, --, --, --, --, --, --, --, --, --, --, --, --
Cole Reinhardt, Healthy, Ott, LW, FA, Det, L 2-5, --, --, --, --, --, --, --, --, --, --, --, --, --, --, --, --, --
Olle Lycksell, Healthy, Phi, RW, FA, @Dal, L 4-5, --, --, --, --, --, --, --, --, --, --, --, --, --, --, --, --, --
Jonathan Gruden, Healthy, Pit, C, FA, @StL, L 2-4, --, --, --, --, --, --, --, --, --, --, --, --, --, --, --, --, --
Joona Koppanen, Healthy, Pit, LW, FA, @StL, L 2-4, --, --, --, --, --, --, --, --, --, --, --, --, --, --, --, --, --
Nick Abruzzese, Healthy, Tor, C, FA, @TB, W 4-3, --, --, --, --, --, --, --, --, --, --, --, --, --, --, --, --, --
Jayson Megna, Healthy, Bos, C, FA, @LA, W 4-2, --, --, --, --, --, --, --, --, --, --, --, --, --, --, --, --, --
Joel Teasdale, Healthy, Min, LW, FA, Cls, L 4-5, --, --, --, --, --, --, --, --, --, --, --, --, --, --, --, --, --
Ryan Dzingel, Healthy, Ari, C, FA, Ana, W 2-1, --, --, --, --, --, --, --, --, --, --, --, --, --, --, --, --, --
Aleksi Heponiemi, Healthy, Fla, C, FA, Van, L 3-5, --, --, --, --, --, --, --, --, --, --, --, --, --, --, --, --, --
Alex Formenton, Healthy, Ott, LW, FA, Det, L 2-5, --, --, --, --, --, --, --, --, --, --, --, --, --, --, --, --, --
Rhett Gardner, Healthy, Phi, C, FA, @Dal, L 4-5, --, --, --, --, --, --, --, --, --, --, --, --, --, --, --, --, --
Rodion Amirov, Healthy, Tor, LW, FA, @TB, W 4-3, --, --, --, --, --, --, --, --, --, --, --, --, --, --, --, --, --
Jimmy Huntington, Healthy, Wsh, LW, FA, @Mon, L 2-3, --, --, --, --, --, --, --, --, --, --, --, --, --, --, --, --, --
Rasmus Asplund, Healthy, Fla, C, FA, Van, L 3-5, --, --, --, --, --, --, --, --, --, --, --, --, --, --, --, --, --
Andreas Johnsson, Healthy, Pit, LW, FA, @StL, L 2-4, --, --, --, --, --, --, --, --, --, --, --, --, --, --, --, --, --
Brandon Manning, Healthy, Edm, D, FA, Wpg, L 2-3, --, --, --, --, --, --, --, --, --, --, --, --, --, --, --, --, --
Jakub Galvas, Healthy, Chi, D, FA, Vgk, L 3-5, --, --, --, --, --, --, --, --, --, --, --, --, --, --, --, --, --
Hunter Drew, Healthy, Ari, D, FA, Ana, W 2-1, --, --, --, --, --, --, --, --, --, --, --, --, --, --, --, --, --
Andreas Borgman, Healthy, Dal, D, FA, Phi, W 5-4, --, --, --, --, --, --, --, --, --, --, --, --, --, --, --, --, --
Kyle Quincey, Healthy, Min, D, FA, Cls, L 4-5, --, --, --, --, --, --, --, --, --, --, --, --, --, --, --, --, --
Oscar Fantenberg, Healthy, Van, D, FA, @Fla, W 5-3, --, --, --, --, --, --, --, --, --, --, --, --, --, --, --, --, --
Cody Franson, Healthy, Chi, D, FA, Vgk, L 3-5, --, --, --, --, --, --, --, --, --, --, --, --, --, --, --, --, --
Mark Letestu, Healthy, Wpg, C, FA, @Edm, W 3-2, --, --, --, --, --, --, --, --, --, --, --, --, --, --, --, --, --
Jared Boll, Healthy, Ana, RW, FA, @Ari, L 1-2, --, --, --, --, --, --, --, --, --, --, --, --, --, --, --, --, --
Adam Raska, Healthy, Min, LW, FA, Cls, L 4-5, --, --, --, --, --, --, --, --, --, --, --, --, --, --, --, --, --
Jay Beagle, Healthy, Ari, C, FA, Ana, W 2-1, --, --, --, --, --, --, --, --, --, --, --, --, --, --, --, --, --
Vadim Shipachyov, Healthy, Vgk, LW, FA, @Chi, W 5-3, --, --, --, --, --, --, --, --, --, --, --, --, --, --, --, --, --
Jack Dugan, Healthy, Vgk, RW, FA, @Chi, W 5-3, --, --, --, --, --, --, --, --, --, --, --, --, --, --, --, --, --
Andrei Chibisov, Healthy, Wpg, RW, FA, @Edm, W 3-2, --, --, --, --, --, --, --, --, --, --, --, --, --, --, --, --, --
Charlie Stramel, Healthy, Min, C, FA, Cls, L 4-5, --, --, --, --, --, --, --, --, --, --, --, --, --, --, --, --, --
Kasper Halttunen, Healthy, SJ, RW, FA, @Nsh, L 1-5, --, --, --, --, --, --, --, --, --, --, --, --, --, --, --, --, --
Melker Karlsson, Healthy, SJ, RW, FA, @Nsh, L 1-5, --, --, --, --, --, --, --, --, --, --, --, --, --, --, --, --, --
Justin Kirkland, Healthy, Ari, LW, FA, Ana, W 2-1, --, --, --, --, --, --, --, --, --, --, --, --, --, --, --, --, --
Alexander Burmistrov, Healthy, Van, C, FA, @Fla, W 5-3, --, --, --, --, --, --, --, --, --, --, --, --, --, --, --, --, --
Anthony Angello, Healthy, Nsh, C, FA, SJ, W 5-1, --, --, --, --, --, --, --, --, --, --, --, --, --, --, --, --, --
Luke Philp, IR, Chi, C, FA, Vgk, L 3-5, --, --, --, --, --, --, --, --, --, --, --, --, --, --, --, --, --
Kristian Vesalainen, Healthy, Wpg, LW, FA, @Edm, W 3-2, --, --, --, --, --, --, --, --, --, --, --, --, --, --, --, --, --
Cameron Schilling, Healthy, Wsh, D, FA, @Mon, L 2-3, --, --, --, --, --, --, --, --, --, --, --, --, --, --, --, --, --
Kevin Connauton, Healthy, LA, D, FA, Bos, L 2-4, --, --, --, --, --, --, --, --, --, --, --, --, --, --, --, --, --
Brian Lashoff, Healthy, Det, D, FA, @Ott, W 5-2, --, --, --, --, --, --, --, --, --, --, --, --, --, --, --, --, --
Mark Pysyk, IR, Pit, D, FA, @StL, L 2-4, --, --, --, --, --, --, --, --, --, --, --, --, --, --, --, --, --
Robin Salo, Healthy, NYI, D, FA, @Buf, L 1-3, --, --, --, --, --, --, --, --, --, --, --, --, --, --, --, --, --
Casey Fitzgerald, Healthy, Fla, D, FA, Van, L 3-5, --, --, --, --, --, --, --, --, --, --, --, --, --, --, --, --, --
Tanner Fritz, Healthy, NYR, C, FA, @Sea, W 4-1, --, --, --, --, --, --, --, --, --, --, --, --, --, --, --, --, --
Cedric Paquette, Healthy, Mon, C, FA, Wsh, W 3-2, --, --, --, --, --, --, --, --, --, --, --, --, --, --, --, --, --
Paul Byron, Healthy, Mon, LW, FA, Wsh, W 3-2, --, --, --, --, --, --, --, --, --, --, --, --, --, --, --, --, --
Gustav Rydahl, Healthy, NYR, C, FA, @Sea, W 4-1, --, --, --, --, --, --, --, --, --, --, --, --, --, --, --, --, --
Kyle Clifford, Healthy, Tor, LW, FA, @TB, W 4-3, --, --, --, --, --, --, --, --, --, --, --, --, --, --, --, --, --
Hunter McKown, Healthy, Cls, C, FA, @Min, W 5-4, --, --, --, --, --, --, --, --, --, --, --, --, --, --, --, --, --
Ondrej Kase, Healthy, Car, RW, FA, @Col, L 4-6, --, --, --, --, --, --, --, --, --, --, --, --, --, --, --, --, --
Lukas Sedlak, Healthy, Phi, C, FA, @Dal, L 4-5, --, --, --, --, --, --, --, --, --, --, --, --, --, --, --, --, --
Gerry Mayhew, Healthy, Fla, RW, FA, Van, L 3-5, --, --, --, --, --, --, --, --, --, --, --, --, --, --, --, --, --
Daniel Catenacci, Healthy, NYR, C, FA, @Sea, W 4-1, --, --, --, --, --, --, --, --, --, --, --, --, --, --, --, --, --
Brett Ritchie, Healthy, Fla, RW, FA, Van, L 3-5, --, --, --, --, --, --, --, --, --, --, --, --, --, --, --, --, --
Michal Kempny, Healthy, Sea, D, FA, NYR, L 1-4, --, --, --, --, --, --, --, --, --, --, --, --, --, --, --, --, --
Nick Cicek, Healthy, SJ, D, FA, @Nsh, L 1-5, --, --, --, --, --, --, --, --, --, --, --, --, --, --, --, --, --
Jakub Dvorak, Healthy, LA, D, FA, Bos, L 2-4, --, --, --, --, --, --, --, --, --, --, --, --, --, --, --, --, --
Joe Hicketts, Healthy, LA, D, FA, Bos, L 2-4, --, --, --, --, --, --, --, --, --, --, --, --, --, --, --, --, --
Alex Biega, Healthy, Nsh, D, FA, SJ, W 5-1, --, --, --, --, --, --, --, --, --, --, --, --, --, --, --, --, --
Mike Liambas, Healthy, Min, D, FA, Cls, L 4-5, --, --, --, --, --, --, --, --, --, --, --, --, --, --, --, --, --
Christian Wolanin, Healthy, Van, D, FA, @Fla, W 5-3, --, --, --, --, --, --, --, --, --, --, --, --, --, --, --, --, --
Ben Gleason, Healthy, Edm, D, FA, Wpg, L 2-3, --, --, --, --, --, --, --, --, --, --, --, --, --, --, --, --, --
Steven Santini, Healthy, LA, D, FA, Bos, L 2-4, --, --, --, --, --, --, --, --, --, --, --, --, --, --, --, --, --
J.T. Brown, Healthy, Min, RW, FA, Cls, L 4-5, --, --, --, --, --, --, --, --, --, --, --, --, --, --, --, --, --
Scott Sabourin, Healthy, SJ, RW, FA, @Nsh, L 1-5, --, --, --, --, --, --, --, --, --, --, --, --, --, --, --, --, --
Chase De Leo, Healthy, Ana, C- RW, FA, @Ari, L 1-2, --, --, --, --, --, --, --, --, --, --, --, --, --, --, --, --, --
David Edstrom, Healthy, Vgk, C, FA, @Chi, W 5-3, --, --, --, --, --, --, --, --, --, --, --, --, --, --, --, --, --
Charles Hudon, Healthy, LA, LW, FA, Bos, L 2-4, --, --, --, --, --, --, --, --, --, --, --, --, --, --, --, --, --
Lukas Radil, Healthy, SJ, LW, FA, @Nsh, L 1-5, --, --, --, --, --, --, --, --, --, --, --, --, --, --, --, --, --
Chris Wagner, Healthy, Col, RW, FA, Car, W 6-4, --, --, --, --, --, --, --, --, --, --, --, --, --, --, --, --, --
Sven Baertschi, Healthy, Vgk, LW, FA, @Chi, W 5-3, --, --, --, --, --, --, --, --, --, --, --, --, --, --, --, --, --
Nate Thompson, Healthy, LA, C, FA, Bos, L 2-4, --, --, --, --, --, --, --, --, --, --, --, --, --, --, --, --, --
Sheldon Dries, Healthy, Van, C, FA, @Fla, W 5-3, --, --, --, --, --, --, --, --, --, --, --, --, --, --, --, --, --
Martin Kaut, Healthy, SJ, C, FA, @Nsh, L 1-5, --, --, --, --, --, --, --, --, --, --, --, --, --, --, --, --, --
Marc Michaelis, Healthy, Van, LW, FA, @Fla, W 5-3, --, --, --, --, --, --, --, --, --, --, --, --, --, --, --, --, --
Buddy Robinson, Healthy, Chi, RW, FA, Vgk, L 3-5, --, --, --, --, --, --, --, --, --, --, --, --, --, --, --, --, --
Joseph Cramarossa, Healthy, Min, C, FA, Cls, L 4-5, --, --, --, --, --, --, --, --, --, --, --, --, --, --, --, --, --
Brady Keeper, Healthy, Mon, D, FA, Wsh, W 3-2, --, --, --, --, --, --, --, --, --, --, --, --, --, --, --, --, --
Mattias Norlinder, Healthy, Mon, D, FA, Wsh, W 3-2, --, --, --, --, --, --, --, --, --, --, --, --, --, --, --, --, --
Libor Sulak, Healthy, Det, D, FA, @Ott, W 5-2, --, --, --, --, --, --, --, --, --, --, --, --, --, --, --, --, --
Brady Cleveland, Healthy, Det, D, FA, @Ott, W 5-2, --, --, --, --, --, --, --, --, --, --, --, --, --, --, --, --, --
"Will ONeill", Healthy, Pit, D, FA, @StL, L 2-4, --, --, --, --, --, --, --, --, --, --, --, --, --, --, --, --, --
Josh Teves, Healthy, Buf, D, FA, NYI, W 3-1, --, --, --, --, --, --, --, --, --, --, --, --, --, --, --, --, --
Taylor Fedun, Healthy, Pit, D, FA, @StL, L 2-4, --, --, --, --, --, --, --, --, --, --, --, --, --, --, --, --, --
Otto Leskinen, Healthy, Mon, D, FA, Wsh, W 3-2, --, --, --, --, --, --, --, --, --, --, --, --, --, --, --, --, --
Chase Priskie, Healthy, Wsh, D, FA, @Mon, L 2-3, --, --, --, --, --, --, --, --, --, --, --, --, --, --, --, --, --
Lassi Thomson, Healthy, Ott, D, FA, Det, L 2-5, --, --, --, --, --, --, --, --, --, --, --, --, --, --, --, --, --
Jimmy Schuldt, Healthy, Sea, D, FA, NYR, L 1-4, --, --, --, --, --, --, --, --, --, --, --, --, --, --, --, --, --
Jack Rodewald, Healthy, Ott, RW, FA, Det, L 2-5, --, --, --, --, --, --, --, --, --, --, --, --, --, --, --, --, --
Josh Currie, Healthy, Ott, RW, FA, Det, L 2-5, --, --, --, --, --, --, --, --, --, --, --, --, --, --, --, --, --
Johan Larsson, Healthy, Wsh, LW, FA, @Mon, L 2-3, --, --, --, --, --, --, --, --, --, --, --, --, --, --, --, --, --
Filip Hallander, Healthy, Pit, C, FA, @StL, L 2-4, --, --, --, --, --, --, --, --, --, --, --, --, --, --, --, --, --
"Danny ORegan", Healthy, Det, C, FA, @Ott, W 5-2, --, --, --, --, --, --, --, --, --, --, --, --, --, --, --, --, --
Matt Read, Healthy, Tor, RW, FA, @TB, W 4-3, --, --, --, --, --, --, --, --, --, --, --, --, --, --, --, --, --
Cory Conacher, Healthy, Car, LW, FA, @Col, L 4-6, --, --, --, --, --, --, --, --, --, --, --, --, --, --, --, --, --
Arnaud Durandeau, Healthy, NJ, LW, FA, --, --, --, --, --, --, --, --, --, --, --, --, --, --, --, --, --, --, --
Henrik Borgstrom, Healthy, Wsh, C, FA, @Mon, L 2-3, --, --, --, --, --, --, --, --, --, --, --, --, --, --, --, --, --
Frederik Gauthier, Healthy, Pit, C, FA, @StL, L 2-4, --, --, --, --, --, --, --, --, --, --, --, --, --, --, --, --, --
Taro Hirose, Healthy, Det, LW, FA, @Ott, W 5-2, --, --, --, --, --, --, --, --, --, --, --, --, --, --, --, --, --
Matt Luff, IR, Det, RW, FA, @Ott, W 5-2, --, --, --, --, --, --, --, --, --, --, --, --, --, --, --, --, --
Brendan Gaunce, Healthy, Cls, C, FA, @Min, W 5-4, --, --, --, --, --, --, --, --, --, --, --, --, --, --, --, --, --
James Neal, Healthy, Cls, RW, FA, @Min, W 5-4, --, --, --, --, --, --, --, --, --, --, --, --, --, --, --, --, --
Jayden Halbgewachs, Healthy, Car, LW, FA, @Col, L 4-6, --, --, --, --, --, --, --, --, --, --, --, --, --, --, --, --, --
Yohann Auvitu, Healthy, Edm, D, FA, Wpg, L 2-3, --, --, --, --, --, --, --, --, --, --, --, --, --, --, --, --, --
Joel Persson, Healthy, Ana, D, FA, @Ari, L 1-2, --, --, --, --, --, --, --, --, --, --, --, --, --, --, --, --, --
Kevin Czuczman, Healthy, Min, D, FA, Cls, L 4-5, --, --, --, --, --, --, --, --, --, --, --, --, --, --, --, --, --
Gustav Olofsson, Healthy, Sea, D, FA, NYR, L 1-4, --, --, --, --, --, --, --, --, --, --, --, --, --, --, --, --, --
Filip Johansson, Healthy, Min, D, FA, Cls, L 4-5, --, --, --, --, --, --, --, --, --, --, --, --, --, --, --, --, --
Mikhail Maltsev, Healthy, LA, LW, FA, Bos, L 2-4, --, --, --, --, --, --, --, --, --, --, --, --, --, --, --, --, --
Derek Dorsett, Healthy, Van, RW, FA, @Fla, W 5-3, --, --, --, --, --, --, --, --, --, --, --, --, --, --, --, --, --
Mike Hardman, Healthy, Chi, RW, FA, Vgk, L 3-5, --, --, --, --, --, --, --, --, --, --, --, --, --, --, --, --, --
Damien Giroux, Healthy, Min, C, FA, Cls, L 4-5, --, --, --, --, --, --, --, --, --, --, --, --, --, --, --, --, --
William Bitten, Healthy, StL, RW, FA, Pit, W 4-2, --, --, --, --, --, --, --, --, --, --, --, --, --, --, --, --, --
Chris DiDomenico, Healthy, Chi, LW, FA, Vgk, L 3-5, --, --, --, --, --, --, --, --, --, --, --, --, --, --, --, --, --
Jacob Nilsson, Healthy, Chi, C, FA, Vgk, L 3-5, --, --, --, --, --, --, --, --, --, --, --, --, --, --, --, --, --
Tim Schaller, Healthy, Van, LW, FA, @Fla, W 5-3, --, --, --, --, --, --, --, --, --, --, --, --, --, --, --, --, --
Dominik Simon, Healthy, Ana, LW, FA, @Ari, L 1-2, --, --, --, --, --, --, --, --, --, --, --, --, --, --, --, --, --
Teemu Pulkkinen, Healthy, Vgk, LW, FA, @Chi, W 5-3, --, --, --, --, --, --, --, --, --, --, --, --, --, --, --, --, --
Kristian Reichel, Healthy, Wpg, C, FA, @Edm, W 3-2, --, --, --, --, --, --, --, --, --, --, --, --, --, --, --, --, --
Ryan Kuffner, Healthy, Edm, LW, FA, Wpg, L 2-3, --, --, --, --, --, --, --, --, --, --, --, --, --, --, --, --, --
David Gust, Healthy, Chi, RW, FA, Vgk, L 3-5, --, --, --, --, --, --, --, --, --, --, --, --, --, --, --, --, --
Steven Fogarty, Healthy, Min, C, FA, Cls, L 4-5, --, --, --, --, --, --, --, --, --, --, --, --, --, --, --, --, --
Tristen Robins, Healthy, SJ, RW- C, FA, @Nsh, L 1-5, --, --, --, --, --, --, --, --, --, --, --, --, --, --, --, --, --
Lawrence Pilut, Healthy, Buf, D, FA, NYI, W 3-1, --, --, --, --, --, --, --, --, --, --, --, --, --, --, --, --, --
Mac Hollowell, Healthy, NYR, D, FA, @Sea, W 4-1, --, --, --, --, --, --, --, --, --, --, --, --, --, --, --, --, --
Christian Folin, Healthy, Mon, D, FA, Wsh, W 3-2, --, --, --, --, --, --, --, --, --, --, --, --, --, --, --, --, --
Matt Kiersted, Healthy, Fla, D, FA, Van, L 3-5, --, --, --, --, --, --, --, --, --, --, --, --, --, --, --, --, --
Jon Lizotte, Healthy, Pit, D, FA, @StL, L 2-4, --, --, --, --, --, --, --, --, --, --, --, --, --, --, --, --, --
Dmitri Samorukov, Healthy, Pit, D, FA, @StL, L 2-4, --, --, --, --, --, --, --, --, --, --, --, --, --, --, --, --, --
Maxim Mamin, Healthy, Fla, C, FA, Van, L 3-5, --, --, --, --, --, --, --, --, --, --, --, --, --, --, --, --, --
Alex Steeves, Healthy, Tor, RW, FA, @TB, W 4-3, --, --, --, --, --, --, --, --, --, --, --, --, --, --, --, --, --
David Desharnais, Healthy, NYR, C, FA, @Sea, W 4-1, --, --, --, --, --, --, --, --, --, --, --, --, --, --, --, --, --
Trey Fix-Wolansky, Healthy, Cls, RW, FA, @Min, W 5-4, --, --, --, --, --, --, --, --, --, --, --, --, --, --, --, --, --
Nikita Soshnikov, Healthy, NYI, RW, FA, @Buf, L 1-3, --, --, --, --, --, --, --, --, --, --, --, --, --, --, --, --, --
Mathias Brome, Healthy, Det, LW, FA, @Ott, W 5-2, --, --, --, --, --, --, --, --, --, --, --, --, --, --, --, --, --
Michael Dal Colle, Healthy, Ott, LW, FA, Det, L 2-5, --, --, --, --, --, --, --, --, --, --, --, --, --, --, --, --, --
Anton Levtchi, Healthy, Fla, LW, FA, Van, L 3-5, --, --, --, --, --, --, --, --, --, --, --, --, --, --, --, --, --
Lias Andersson, Healthy, Mon, C, FA, Wsh, W 3-2, --, --, --, --, --, --, --, --, --, --, --, --, --, --, --, --, --
Tyler Angle, Healthy, Cls, C, FA, @Min, W 5-4, --, --, --, --, --, --, --, --, --, --, --, --, --, --, --, --, --
Brian Gibbons, Healthy, Car, LW, FA, @Col, L 4-6, --, --, --, --, --, --, --, --, --, --, --, --, --, --, --, --, --
"Joel LEsperance", Healthy, Det, C, FA, @Ott, W 5-2, --, --, --, --, --, --, --, --, --, --, --, --, --, --, --, --, --
Daniel Carr, Healthy, Wsh, LW, FA, @Mon, L 2-3, --, --, --, --, --, --, --, --, --, --, --, --, --, --, --, --, --
Anton Blidh, Healthy, NYR, LW, FA, @Sea, W 4-1, --, --, --, --, --, --, --, --, --, --, --, --, --, --, --, --, --
Antti Suomela, Healthy, Tor, C, FA, @TB, W 4-3, --, --, --, --, --, --, --, --, --, --, --, --, --, --, --, --, --
Vladislav Provolnev, Healthy, Ari, D, FA, Ana, W 2-1, --, --, --, --, --, --, --, --, --, --, --, --, --, --, --, --, --
Ashton Sautner, Healthy, Wpg, D, FA, @Edm, W 3-2, --, --, --, --, --, --, --, --, --, --, --, --, --, --, --, --, --
Philip Holm, Healthy, Chi, D, FA, Vgk, L 3-5, --, --, --, --, --, --, --, --, --, --, --, --, --, --, --, --, --
David Farrance, Healthy, Nsh, D, FA, SJ, W 5-1, --, --, --, --, --, --, --, --, --, --, --, --, --, --, --, --, --
Wyatt Kalynuk, Healthy, StL, D, FA, Pit, W 4-2, --, --, --, --, --, --, --, --, --, --, --, --, --, --, --, --, --
Jake Livingstone, Healthy, Nsh, D, FA, SJ, W 5-1, --, --, --, --, --, --, --, --, --, --, --, --, --, --, --, --, --
Brendan Guhle, Healthy, Ana, D, FA, @Ari, L 1-2, --, --, --, --, --, --, --, --, --, --, --, --, --, --, --, --, --
Jason Garrison, Healthy, Chi, D, FA, Vgk, L 3-5, --, --, --, --, --, --, --, --, --, --, --, --, --, --, --, --, --
Roland McKeown, Healthy, Nsh, D, FA, SJ, W 5-1, --, --, --, --, --, --, --, --, --, --, --, --, --, --, --, --, --
Kevin Gravel, Healthy, Nsh, D, FA, SJ, W 5-1, --, --, --, --, --, --, --, --, --, --, --, --, --, --, --, --, --
Daniel Brickley, Healthy, LA, D, FA, Bos, L 2-4, --, --, --, --, --, --, --, --, --, --, --, --, --, --, --, --, --
Kyle Turris, Healthy, Edm, C, FA, Wpg, L 2-3, --, --, --, --, --, --, --, --, --, --, --, --, --, --, --, --, --
Tyler Benson, Healthy, Vgk, LW, FA, @Chi, W 5-3, --, --, --, --, --, --, --, --, --, --, --, --, --, --, --, --, --
Jeff Malott, Healthy, Wpg, LW, FA, @Edm, W 3-2, --, --, --, --, --, --, --, --, --, --, --, --, --, --, --, --, --
Rasmus Kumpulainen, Healthy, Min, C, FA, Cls, L 4-5, --, --, --, --, --, --, --, --, --, --, --, --, --, --, --, --, --
Felix Nilsson, Healthy, Nsh, C, FA, SJ, W 5-1, --, --, --, --, --, --, --, --, --, --, --, --, --, --, --, --, --
Juho Lammikko, Healthy, Van, RW, FA, @Fla, W 5-3, --, --, --, --, --, --, --, --, --, --, --, --, --, --, --, --, --
Lean Bergmann, Healthy, SJ, LW, FA, @Nsh, L 1-5, --, --, --, --, --, --, --, --, --, --, --, --, --, --, --, --, --
Brandon Baddock, Healthy, Min, LW, FA, Cls, L 4-5, --, --, --, --, --, --, --, --, --, --, --, --, --, --, --, --, --
Byron Froese, Healthy, Vgk, C, FA, @Chi, W 5-3, --, --, --, --, --, --, --, --, --, --, --, --, --, --, --, --, --
Fredrik Handemark, Healthy, SJ, C, FA, @Nsh, L 1-5, --, --, --, --, --, --, --, --, --, --, --, --, --, --, --, --, --
Riley Barber, Healthy, Dal, RW, FA, Phi, W 5-4, --, --, --, --, --, --, --, --, --, --, --, --, --, --, --, --, --
Kole Sherwood, Healthy, Nsh, RW, FA, SJ, W 5-1, --, --, --, --, --, --, --, --, --, --, --, --, --, --, --, --, --
Blake Speers, Healthy, Ari, RW, FA, Ana, W 2-1, --, --, --, --, --, --, --, --, --, --, --, --, --, --, --, --, --
Joel Kellman, Healthy, SJ, C, FA, @Nsh, L 1-5, --, --, --, --, --, --, --, --, --, --, --, --, --, --, --, --, --
Tanner Kero, Healthy, Col, C, FA, Car, W 6-4, --, --, --, --, --, --, --, --, --, --, --, --, --, --, --, --, --
Victor Ejdsell, Healthy, Chi, C, FA, Vgk, L 3-5, --, --, --, --, --, --, --, --, --, --, --, --, --, --, --, --, --
Dennis Rasmussen, Healthy, Ana, C, FA, @Ari, L 1-2, --, --, --, --, --, --, --, --, --, --, --, --, --, --, --, --, --
Laurent Dauphin, Healthy, Ari, C, FA, Ana, W 2-1, --, --, --, --, --, --, --, --, --, --, --, --, --, --, --, --, --
Dmitrij Jaskin, Healthy, Ari, RW, FA, Ana, W 2-1, --, --, --, --, --, --, --, --, --, --, --, --, --, --, --, --, --
Fredrik Claesson, Healthy, TB, D, FA, Tor, L 3-4, --, --, --, --, --, --, --, --, --, --, --, --, --, --, --, --, --
Victor Antipin, Healthy, Buf, D, FA, NYI, W 3-1, --, --, --, --, --, --, --, --, --, --, --, --, --, --, --, --, --
Adam Ginning, Healthy, Phi, D, FA, @Dal, L 4-5, --, --, --, --, --, --, --, --, --, --, --, --, --, --, --, --, --
Maxence Guenette, Healthy, Ott, D, FA, Det, L 2-5, --, --, --, --, --, --, --, --, --, --, --, --, --, --, --, --, --
Nate Prosser, Healthy, Phi, D, FA, @Dal, L 4-5, --, --, --, --, --, --, --, --, --, --, --, --, --, --, --, --, --
Juuso Riikola, Healthy, Pit, D, FA, @StL, L 2-4, --, --, --, --, --, --, --, --, --, --, --, --, --, --, --, --, --
Mikko Lehtonen, Healthy, Cls, D, FA, @Min, W 5-4, --, --, --, --, --, --, --, --, --, --, --, --, --, --, --, --, --
Josh Gorges, Healthy, Buf, D, FA, NYI, W 3-1, --, --, --, --, --, --, --, --, --, --, --, --, --, --, --, --, --
Dennis Cholowski, Healthy, NYI, D, FA, @Buf, L 1-3, --, --, --, --, --, --, --, --, --, --, --, --, --, --, --, --, --
Carl Dahlstrom, Healthy, Tor, D, FA, @TB, W 4-3, --, --, --, --, --, --, --, --, --, --, --, --, --, --, --, --, --
Justin Richards, Healthy, Buf, C, FA, NYI, W 3-1, --, --, --, --, --, --, --, --, --, --, --, --, --, --, --, --, --
Alexandre Fortin, Healthy, Mon, LW, FA, Wsh, W 3-2, --, --, --, --, --, --, --, --, --, --, --, --, --, --, --, --, --
Gabriel Fortier, Healthy, TB, LW, FA, Tor, L 3-4, --, --, --, --, --, --, --, --, --, --, --, --, --, --, --, --, --
Tim Gettinger, Healthy, Det, LW, FA, @Ott, W 5-2, --, --, --, --, --, --, --, --, --, --, --, --, --, --, --, --, --
Anthony Greco, Healthy, NYR, RW, FA, @Sea, W 4-1, --, --, --, --, --, --, --, --, --, --, --, --, --, --, --, --, --
Chasen Balisy, Healthy, Fla, C, FA, Van, L 3-5, --, --, --, --, --, --, --, --, --, --, --, --, --, --, --, --, --
Hayden Hodgson, Healthy, LA, RW, FA, Bos, L 2-4, --, --, --, --, --, --, --, --, --, --, --, --, --, --, --, --, --
Tyler Ennis, Healthy, Ott, LW, FA, Det, L 2-5, --, --, --, --, --, --, --, --, --, --, --, --, --, --, --, --, --
Micheal Haley, Healthy, Ott, C, FA, Det, L 2-5, --, --, --, --, --, --, --, --, --, --, --, --, --, --, --, --, --
Wade Megan, Healthy, Det, C, FA, @Ott, W 5-2, --, --, --, --, --, --, --, --, --, --, --, --, --, --, --, --, --
Ryan MacInnis, Healthy, Buf, C, FA, NYI, W 3-1, --, --, --, --, --, --, --, --, --, --, --, --, --, --, --, --, --
Semyon Der-Arguchintsev, Healthy, Tor, RW, FA, @TB, W 4-3, --, --, --, --, --, --, --, --, --, --, --, --, --, --, --, --, --
Cole Bardreau, Healthy, NYI, RW, FA, @Buf, L 1-3, --, --, --, --, --, --, --, --, --, --, --, --, --, --, --, --, --
Michael Sgarbossa, Healthy, Wsh, C, FA, @Mon, L 2-3, --, --, --, --, --, --, --, --, --, --, --, --, --, --, --, --, --
Andy Andreoff, Healthy, NYI, LW, FA, @Buf, L 1-3, --, --, --, --, --, --, --, --, --, --, --, --, --, --, --, --, --
Victor Rask, Healthy, Cls, C, FA, @Min, W 5-4, --, --, --, --, --, --, --, --, --, --, --, --, --, --, --, --, --
Michael Blunden, Healthy, Ott, RW, FA, Det, L 2-5, --, --, --, --, --, --, --, --, --, --, --, --, --, --, --, --, --
Matt Tennyson, Healthy, Sea, D, FA, NYR, L 1-4, --, --, --, --, --, --, --, --, --, --, --, --, --, --, --, --, --
Bogdan Kiselevich, Healthy, Wpg, D, FA, @Edm, W 3-2, --, --, --, --, --, --, --, --, --, --, --, --, --, --, --, --, --
Danny DeKeyser, Healthy, Van, D, FA, @Fla, W 5-3, --, --, --, --, --, --, --, --, --, --, --, --, --, --, --, --, --
Nick Lappin, Healthy, StL, RW, FA, Pit, W 4-2, --, --, --, --, --, --, --, --, --, --, --, --, --, --, --, --, --
Ben McCartney, Healthy, Ari, LW, FA, Ana, W 2-1, --, --, --, --, --, --, --, --, --, --, --, --, --, --, --, --, --
Seth Griffith, Healthy, Edm, C, FA, Wpg, L 2-3, --, --, --, --, --, --, --, --, --, --, --, --, --, --, --, --, --
Brendan Perlini, Healthy, Edm, LW, FA, Wpg, L 2-3, --, --, --, --, --, --, --, --, --, --, --, --, --, --, --, --, --
Gaetan Haas, Healthy, Edm, C, FA, Wpg, L 2-3, --, --, --, --, --, --, --, --, --, --, --, --, --, --, --, --, --
Dylan Sikura, Healthy, Ana, RW, FA, @Ari, L 1-2, --, --, --, --, --, --, --, --, --, --, --, --, --, --, --, --, --
Dominik Kahun, Healthy, Edm, C, FA, Wpg, L 2-3, --, --, --, --, --, --, --, --, --, --, --, --, --, --, --, --, --
Glenn Gawdin, Healthy, Ana, C, FA, @Ari, L 1-2, --, --, --, --, --, --, --, --, --, --, --, --, --, --, --, --, --
Riley Damiani, Healthy, Dal, C, FA, Phi, W 5-4, --, --, --, --, --, --, --, --, --, --, --, --, --, --, --, --, --
Brooks Laich, Healthy, LA, C, FA, Bos, L 2-4, --, --, --, --, --, --, --, --, --, --, --, --, --, --, --, --, --
Kalle Kossila, Healthy, Ana, LW, FA, @Ari, L 1-2, --, --, --, --, --, --, --, --, --, --, --, --, --, --, --, --, --
Sheldon Rempal, Healthy, Vgk, RW, FA, @Chi, W 5-3, --, --, --, --, --, --, --, --, --, --, --, --, --, --, --, --, --
Markus Hannikainen, Healthy, Ari, LW, FA, Ana, W 2-1, --, --, --, --, --, --, --, --, --, --, --, --, --, --, --, --, --
