Gustav Lindstrom, Healthy, Ana, D, FA, @Mon, L 0-5, --, --, --, --, --, --, --, --, --, --, --, --, --, --, --, --, --
Ryan Suzuki, Healthy, Car, C, FA, @Dal, L 2-4, --, --, --, --, --, --, --, --, --, --, --, --, --, --, --, --, --
Luke Witkowski, Healthy, StL, LW, FA, @Tor, L 1-4, --, --, --, --, --, --, --, --, --, --, --, --, --, --, --, --, --
Egor Yakovlev, Healthy, NJ, D, FA, @Nsh, W 4-2, --, --, --, --, --, --, --, --, --, --, --, --, --, --, --, --, --
Fraser Minten, Healthy, Tor, C, FA, StL, W 4-1, --, --, --, --, --, --, --, --, --, --, --, --, --, --, --, --, --
Gemel Smith, Healthy, TB, C, FA, @Bos, W 3-2, --, --, --, --, --, --, --, --, --, --, --, --, --, --, --, --, --
Zack MacEwen, IR, Ott, C, FA, Cls, W 6-3, --, --, --, --, --, --, --, --, --, --, --, --, --, --, --, --, --
Alexander Edler, Healthy, LA, D, FA, @Buf, L 0-7, --, --, --, --, --, --, --, --, --, --, --, --, --, --, --, --, --
Aatu Raty, Healthy, Van, C, FA, @Chi, W 4-2, --, --, --, --, --, --, --, --, --, --, --, --, --, --, --, --, --
Jason Spezza, Healthy, Tor, C, FA, StL, W 4-1, --, --, --, --, --, --, --, --, --, --, --, --, --, --, --, --, --
Alex Formenton, Healthy, Ott, LW, FA, Cls, W 6-3, --, --, --, --, --, --, --, --, --, --, --, --, --, --, --, --, --
Nils Aman, Healthy, Van, C, FA, @Chi, W 4-2, --, --, --, --, --, --, --, --, --, --, --, --, --, --, --, --, --
Tyce Thompson, Healthy, NYI, RW, FA, Sea, L 1-2, --, --, --, --, --, --, --, --, --, --, --, --, --, --, --, --, --
Eduard Sale, Healthy, Sea, RW, FA, @NYI, W 2-1, --, --, --, --, --, --, --, --, --, --, --, --, --, --, --, --, --
Patrick Wiercioch, Healthy, Van, D, FA, @Chi, W 4-2, --, --, --, --, --, --, --, --, --, --, --, --, --, --, --, --, --
Chris Wideman, IR, Mon, D, FA, Ana, W 5-0, --, --, --, --, --, --, --, --, --, --, --, --, --, --, --, --, --
Elmer Soderblom, Healthy, Det, LW- C, FA, @Edm, L 4-8, --, --, --, --, --, --, --, --, --, --, --, --, --, --, --, --, --
Nolan Foote, O, NJ, LW, FA, @Nsh, W 4-2, --, --, --, --, --, --, --, --, --, --, --, --, --, --, --, --, --
Ryan Getzlaf, Healthy, Ana, C, FA, @Mon, L 0-5, --, --, --, --, --, --, --, --, --, --, --, --, --, --, --, --, --
Sean Farrell, Healthy, Mon, LW, FA, Ana, W 5-0, --, --, --, --, --, --, --, --, --, --, --, --, --, --, --, --, --
Noah Ostlund, Healthy, Buf, C, FA, LA, W 7-0, --, --, --, --, --, --, --, --, --, --, --, --, --, --, --, --, --
Robert Hagg, Healthy, Ana, D, FA, @Mon, L 0-5, --, --, --, --, --, --, --, --, --, --, --, --, --, --, --, --, --
Igor Ozhiganov, Healthy, Tor, D, FA, StL, W 4-1, --, --, --, --, --, --, --, --, --, --, --, --, --, --, --, --, --
Gavin Brindley, Healthy, Cls, C, FA, @Ott, L 3-6, --, --, --, --, --, --, --, --, --, --, --, --, --, --, --, --, --
Carl Hagelin, Healthy, Wsh, LW, FA, Col, L 3-6, --, --, --, --, --, --, --, --, --, --, --, --, --, --, --, --, --
Denis Gurianov, Healthy, Phi, LW, FA, --, --, --, --, --, --, --, --, --, --, --, --, --, --, --, --, --, --, --
Patrick Brown, Healthy, Bos, C, FA, TB, L 2-3, --, --, --, --, --, --, --, --, --, --, --, --, --, --, --, --, --
Felix Unger Sorum, Healthy, Car, RW, FA, @Dal, L 2-4, --, --, --, --, --, --, --, --, --, --, --, --, --, --, --, --, --
Angus Crookshank, Healthy, Ott, LW, FA, Cls, W 6-3, --, --, --, --, --, --, --, --, --, --, --, --, --, --, --, --, --
Marc Del Gaizo, Healthy, Nsh, D, FA, NJ, L 2-4, --, --, --, --, --, --, --, --, --, --, --, --, --, --, --, --, --
Tanner Molendyk, Healthy, Nsh, D, FA, NJ, L 2-4, --, --, --, --, --, --, --, --, --, --, --, --, --, --, --, --, --
Colton White, Healthy, Ana, D, FA, @Mon, L 0-5, --, --, --, --, --, --, --, --, --, --, --, --, --, --, --, --, --
Nick Holden, Healthy, Ott, D, FA, Cls, W 6-3, --, --, --, --, --, --, --, --, --, --, --, --, --, --, --, --, --
Riley Stillman, Healthy, Buf, D, FA, LA, W 7-0, --, --, --, --, --, --, --, --, --, --, --, --, --, --, --, --, --
Samuel Bolduc, Healthy, NYI, D, FA, Sea, L 1-2, --, --, --, --, --, --, --, --, --, --, --, --, --, --, --, --, --
Justin Dowling, Healthy, NJ, C, FA, @Nsh, W 4-2, --, --, --, --, --, --, --, --, --, --, --, --, --, --, --, --, --
Darren Archibald, Healthy, Tor, LW, FA, StL, W 4-1, --, --, --, --, --, --, --, --, --, --, --, --, --, --, --, --, --
Jordan Gross, Healthy, Nsh, D, FA, NJ, L 2-4, --, --, --, --, --, --, --, --, --, --, --, --, --, --, --, --, --
Calum Ritchie, Healthy, Col, C, FA, @Wsh, W 6-3, --, --, --, --, --, --, --, --, --, --, --, --, --, --, --, --, --
Devin Shore, Healthy, Sea, C, FA, @NYI, W 2-1, --, --, --, --, --, --, --, --, --, --, --, --, --, --, --, --, --
Dustin Brown, Healthy, LA, RW, FA, @Buf, L 0-7, --, --, --, --, --, --, --, --, --, --, --, --, --, --, --, --, --
Nikita Alexandrov, Healthy, StL, C, FA, @Tor, L 1-4, --, --, --, --, --, --, --, --, --, --, --, --, --, --, --, --, --
Anton Stralman, Healthy, Bos, D, FA, TB, L 2-3, --, --, --, --, --, --, --, --, --, --, --, --, --, --, --, --, --
Madison Bowey, Healthy, Mon, D, FA, Ana, W 5-0, --, --, --, --, --, --, --, --, --, --, --, --, --, --, --, --, --
Kevan Miller, Healthy, Bos, D, FA, TB, L 2-3, --, --, --, --, --, --, --, --, --, --, --, --, --, --, --, --, --
Bradly Nadeau, Healthy, Car, C, FA, @Dal, L 2-4, --, --, --, --, --, --, --, --, --, --, --, --, --, --, --, --, --
Par Lindholm, Healthy, Bos, C, FA, TB, L 2-3, --, --, --, --, --, --, --, --, --, --, --, --, --, --, --, --, --
Mikhail Gulyayev, Healthy, Col, D, FA, @Wsh, W 6-3, --, --, --, --, --, --, --, --, --, --, --, --, --, --, --, --, --
Andrew Poturalski, Healthy, Sea, C, FA, @NYI, W 2-1, --, --, --, --, --, --, --, --, --, --, --, --, --, --, --, --, --
Reilly Walsh, Healthy, Bos, D, FA, TB, L 2-3, --, --, --, --, --, --, --, --, --, --, --, --, --, --, --, --, --
Tyler Kleven, Healthy, Ott, D, FA, Cls, W 6-3, --, --, --, --, --, --, --, --, --, --, --, --, --, --, --, --, --
Isaac Howard, Healthy, TB, LW, FA, @Bos, W 3-2, --, --, --, --, --, --, --, --, --, --, --, --, --, --, --, --, --
Austin Czarnik, Healthy, Det, RW, FA, @Edm, L 4-8, --, --, --, --, --, --, --, --, --, --, --, --, --, --, --, --, --
Josh Bailey, Healthy, Ott, LW, FA, Cls, W 6-3, --, --, --, --, --, --, --, --, --, --, --, --, --, --, --, --, --
Connor Carrick, Healthy, Sea, D, FA, @NYI, W 2-1, --, --, --, --, --, --, --, --, --, --, --, --, --, --, --, --, --
Jakub Zboril, Healthy, Bos, D, FA, TB, L 2-3, --, --, --, --, --, --, --, --, --, --, --, --, --, --, --, --, --
Philippe Myers, Healthy, TB, D, FA, @Bos, W 3-2, --, --, --, --, --, --, --, --, --, --, --, --, --, --, --, --, --
Jake Christiansen, Healthy, Cls, D, FA, @Ott, L 3-6, --, --, --, --, --, --, --, --, --, --, --, --, --, --, --, --, --
Derick Brassard, O, Ott, C, FA, Cls, W 6-3, --, --, --, --, --, --, --, --, --, --, --, --, --, --, --, --, --
Filip Mesar, Healthy, Mon, RW- LW, FA, Ana, W 5-0, --, --, --, --, --, --, --, --, --, --, --, --, --, --, --, --, --
Rem Pitlick, Healthy, Chi, C, FA, Van, L 2-4, --, --, --, --, --, --, --, --, --, --, --, --, --, --, --, --, --
Akito Hirose, Healthy, Van, D, FA, @Chi, W 4-2, --, --, --, --, --, --, --, --, --, --, --, --, --, --, --, --, --
Cole McWard, Healthy, Van, D, FA, @Chi, W 4-2, --, --, --, --, --, --, --, --, --, --, --, --, --, --, --, --, --
Brock McGinn, IR, Ana, LW, FA, @Mon, L 0-5, --, --, --, --, --, --, --, --, --, --, --, --, --, --, --, --, --
Oskar Olausson, O, Col, RW, FA, @Wsh, W 6-3, --, --, --, --, --, --, --, --, --, --, --, --, --, --, --, --, --
"Zachary LHeureux", Healthy, Nsh, LW, FA, NJ, L 2-4, --, --, --, --, --, --, --, --, --, --, --, --, --, --, --, --, --
James Hamblin, Healthy, Edm, RW- C, FA, Det, W 8-4, --, --, --, --, --, --, --, --, --, --, --, --, --, --, --, --, --
Riley Tufte, Healthy, Col, LW, FA, @Wsh, W 6-3, --, --, --, --, --, --, --, --, --, --, --, --, --, --, --, --, --
Santeri Hatakka, Healthy, NJ, D, FA, @Nsh, W 4-2, --, --, --, --, --, --, --, --, --, --, --, --, --, --, --, --, --
Paul Stastny, Healthy, Car, C, FA, @Dal, L 2-4, --, --, --, --, --, --, --, --, --, --, --, --, --, --, --, --, --
Chris Tierney, Healthy, NJ, C, FA, @Nsh, W 4-2, --, --, --, --, --, --, --, --, --, --, --, --, --, --, --, --, --
Brad Hunt, Healthy, Col, D, FA, @Wsh, W 6-3, --, --, --, --, --, --, --, --, --, --, --, --, --, --, --, --, --
Lukas Dragicevic, Healthy, Sea, D, FA, @NYI, W 2-1, --, --, --, --, --, --, --, --, --, --, --, --, --, --, --, --, --
Cale Fleury, Healthy, Sea, D, FA, @NYI, W 2-1, --, --, --, --, --, --, --, --, --, --, --, --, --, --, --, --, --
Tucker Poolman, IR, Van, D, FA, @Chi, W 4-2, --, --, --, --, --, --, --, --, --, --, --, --, --, --, --, --, --
Carson Rehkopf, Healthy, Sea, LW, FA, @NYI, W 2-1, --, --, --, --, --, --, --, --, --, --, --, --, --, --, --, --, --
Owen Beck, Healthy, Mon, C, FA, Ana, W 5-0, --, --, --, --, --, --, --, --, --, --, --, --, --, --, --, --, --
Josiah Slavin, Healthy, Tor, LW, FA, StL, W 4-1, --, --, --, --, --, --, --, --, --, --, --, --, --, --, --, --, --
Sam Rinzel, Healthy, Chi, D, FA, Van, L 2-4, --, --, --, --, --, --, --, --, --, --, --, --, --, --, --, --, --
Darren Helm, Healthy, Col, C, FA, @Wsh, W 6-3, --, --, --, --, --, --, --, --, --, --, --, --, --, --, --, --, --
Vladimir Tkachev, Healthy, LA, LW, FA, @Buf, L 0-7, --, --, --, --, --, --, --, --, --, --, --, --, --, --, --, --, --
Derek Grant, Healthy, Ana, C- LW, FA, @Mon, L 0-5, --, --, --, --, --, --, --, --, --, --, --, --, --, --, --, --, --
Kale Clague, Healthy, Buf, D, FA, LA, W 7-0, --, --, --, --, --, --, --, --, --, --, --, --, --, --, --, --, --
Dylan McIlrath, Healthy, Wsh, D, FA, Col, L 3-6, --, --, --, --, --, --, --, --, --, --, --, --, --, --, --, --, --
Dan Girardi, Healthy, TB, D, FA, @Bos, W 3-2, --, --, --, --, --, --, --, --, --, --, --, --, --, --, --, --, --
Anton Wahlberg, Healthy, Buf, C, FA, LA, W 7-0, --, --, --, --, --, --, --, --, --, --, --, --, --, --, --, --, --
Jacob Perreault, Healthy, Mon, RW, FA, Ana, W 5-0, --, --, --, --, --, --, --, --, --, --, --, --, --, --, --, --, --
Scott Harrington, Healthy, Ana, D, FA, @Mon, L 0-5, --, --, --, --, --, --, --, --, --, --, --, --, --, --, --, --, --
Max McCormick, Healthy, Sea, LW, FA, @NYI, W 2-1, --, --, --, --, --, --, --, --, --, --, --, --, --, --, --, --, --
Adam Gaudette, Healthy, StL, C, FA, @Tor, L 1-4, --, --, --, --, --, --, --, --, --, --, --, --, --, --, --, --, --
John Hayden, Healthy, Sea, RW, FA, @NYI, W 2-1, --, --, --, --, --, --, --, --, --, --, --, --, --, --, --, --, --
Maxime Lajoie, Healthy, Tor, D, FA, StL, W 4-1, --, --, --, --, --, --, --, --, --, --, --, --, --, --, --, --, --
Cole Koepke, Healthy, TB, LW, FA, @Bos, W 3-2, --, --, --, --, --, --, --, --, --, --, --, --, --, --, --, --, --
Alex Chiasson, Healthy, Bos, RW, FA, TB, L 2-3, --, --, --, --, --, --, --, --, --, --, --, --, --, --, --, --, --
Logan Brown, IR, TB, C, FA, @Bos, W 3-2, --, --, --, --, --, --, --, --, --, --, --, --, --, --, --, --, --
Michael Del Zotto, Healthy, Ana, D, FA, @Mon, L 0-5, --, --, --, --, --, --, --, --, --, --, --, --, --, --, --, --, --
Otto Stenberg, Healthy, StL, C, FA, @Tor, L 1-4, --, --, --, --, --, --, --, --, --, --, --, --, --, --, --, --, --
Carey Terrance, Healthy, Ana, C, FA, @Mon, L 0-5, --, --, --, --, --, --, --, --, --, --, --, --, --, --, --, --, --
Joonas Donskoi, Healthy, Sea, RW, FA, @NYI, W 2-1, --, --, --, --, --, --, --, --, --, --, --, --, --, --, --, --, --
Vitali Kravtsov, Healthy, Van, LW, FA, @Chi, W 4-2, --, --, --, --, --, --, --, --, --, --, --, --, --, --, --, --, --
Mark Streit, Healthy, Mon, D, FA, Ana, W 5-0, --, --, --, --, --, --, --, --, --, --, --, --, --, --, --, --, --
Isak Rosen, Healthy, Buf, LW- RW, FA, LA, W 7-0, --, --, --, --, --, --, --, --, --, --, --, --, --, --, --, --, --
Joe Snively, Healthy, Wsh, RW- LW, FA, Col, L 3-6, --, --, --, --, --, --, --, --, --, --, --, --, --, --, --, --, --
Lukas Rousek, O, Buf, RW- LW, FA, LA, W 7-0, --, --, --, --, --, --, --, --, --, --, --, --, --, --, --, --, --
Mackenzie MacEachern, Healthy, StL, LW, FA, @Tor, L 1-4, --, --, --, --, --, --, --, --, --, --, --, --, --, --, --, --, --
Rourke Chartier, IR, Ott, C, FA, Cls, W 6-3, --, --, --, --, --, --, --, --, --, --, --, --, --, --, --, --, --
Waltteri Merela, Healthy, TB, RW, FA, @Bos, W 3-2, --, --, --, --, --, --, --, --, --, --, --, --, --, --, --, --, --
Kyle MacLean, Healthy, NYI, C- LW, FA, Sea, L 1-2, --, --, --, --, --, --, --, --, --, --, --, --, --, --, --, --, --
Ryan Murray, O, Edm, D, FA, Det, W 8-4, --, --, --, --, --, --, --, --, --, --, --, --, --, --, --, --, --
Lian Bichsel, Healthy, Dal, D, FA, Car, W 4-2, --, --, --, --, --, --, --, --, --, --, --, --, --, --, --, --, --
Matt Irwin, Healthy, Van, D, FA, @Chi, W 4-2, --, --, --, --, --, --, --, --, --, --, --, --, --, --, --, --, --
Andrej Sekera, Healthy, Dal, D, FA, Car, W 4-2, --, --, --, --, --, --, --, --, --, --, --, --, --, --, --, --, --
Cody McLeod, Healthy, Nsh, LW, FA, NJ, L 2-4, --, --, --, --, --, --, --, --, --, --, --, --, --, --, --, --, --
Anders Bjork, Healthy, Chi, LW, FA, Van, L 2-4, --, --, --, --, --, --, --, --, --, --, --, --, --, --, --, --, --
Jake Chelios, Healthy, Det, D, FA, @Edm, L 4-8, --, --, --, --, --, --, --, --, --, --, --, --, --, --, --, --, --
Paul Byron, Healthy, Mon, LW, FA, Ana, W 5-0, --, --, --, --, --, --, --, --, --, --, --, --, --, --, --, --, --
Derek Stepan, Healthy, Car, C, FA, @Dal, L 2-4, --, --, --, --, --, --, --, --, --, --, --, --, --, --, --, --, --
Rudolfs Balcers, Healthy, TB, LW, FA, @Bos, W 3-2, --, --, --, --, --, --, --, --, --, --, --, --, --, --, --, --, --
Liam Foudy, Healthy, Nsh, RW- C- LW, FA, NJ, L 2-4, --, --, --, --, --, --, --, --, --, --, --, --, --, --, --, --, --
Mark Borowiecki, Healthy, Nsh, D, FA, NJ, L 2-4, --, --, --, --, --, --, --, --, --, --, --, --, --, --, --, --, --
Cam Dineen, Healthy, Edm, D, FA, Det, W 8-4, --, --, --, --, --, --, --, --, --, --, --, --, --, --, --, --, --
Jason Demers, Healthy, Edm, D, FA, Det, W 8-4, --, --, --, --, --, --, --, --, --, --, --, --, --, --, --, --, --
Spencer Stastney, DTD, Nsh, D, FA, NJ, L 2-4, --, --, --, --, --, --, --, --, --, --, --, --, --, --, --, --, --
Derrick Pouliot, Healthy, Dal, D, FA, Car, W 4-2, --, --, --, --, --, --, --, --, --, --, --, --, --, --, --, --, --
Sampo Ranta, Healthy, Col, LW, FA, @Wsh, W 6-3, --, --, --, --, --, --, --, --, --, --, --, --, --, --, --, --, --
Marian Studenic, Healthy, Sea, RW, FA, @NYI, W 2-1, --, --, --, --, --, --, --, --, --, --, --, --, --, --, --, --, --
Chris Kunitz, Healthy, Chi, LW, FA, Van, L 2-4, --, --, --, --, --, --, --, --, --, --, --, --, --, --, --, --, --
Denis Malgin, Healthy, Col, C- RW, FA, @Wsh, W 6-3, --, --, --, --, --, --, --, --, --, --, --, --, --, --, --, --, --
Raphael Lavoie, Healthy, Edm, C, FA, Det, W 8-4, --, --, --, --, --, --, --, --, --, --, --, --, --, --, --, --, --
Aidan McDonough, Healthy, Van, LW, FA, @Chi, W 4-2, --, --, --, --, --, --, --, --, --, --, --, --, --, --, --, --, --
Mikael Pyyhtia, Healthy, Cls, LW, FA, @Ott, L 3-6, --, --, --, --, --, --, --, --, --, --, --, --, --, --, --, --, --
Zach Aston-Reese, Healthy, Det, C, FA, @Edm, L 4-8, --, --, --, --, --, --, --, --, --, --, --, --, --, --, --, --, --
Ben Lovejoy, Healthy, Dal, D, FA, Car, W 4-2, --, --, --, --, --, --, --, --, --, --, --, --, --, --, --, --, --
Jacob Moverare, Healthy, LA, D, FA, @Buf, L 0-7, --, --, --, --, --, --, --, --, --, --, --, --, --, --, --, --, --
Beau Akey, Healthy, Edm, D, FA, Det, W 8-4, --, --, --, --, --, --, --, --, --, --, --, --, --, --, --, --, --
Gustav Olofsson, Healthy, Sea, D, FA, @NYI, W 2-1, --, --, --, --, --, --, --, --, --, --, --, --, --, --, --, --, --
Filip Roos, Healthy, Chi, D, FA, Van, L 2-4, --, --, --, --, --, --, --, --, --, --, --, --, --, --, --, --, --
Greg McKegg, Healthy, Edm, C, FA, Det, W 8-4, --, --, --, --, --, --, --, --, --, --, --, --, --, --, --, --, --
Chris Wagner, Healthy, Col, RW, FA, @Wsh, W 6-3, --, --, --, --, --, --, --, --, --, --, --, --, --, --, --, --, --
Zachary Hayes, Healthy, NJ, D, FA, @Nsh, W 4-2, --, --, --, --, --, --, --, --, --, --, --, --, --, --, --, --, --
Dylan Coghlan, Healthy, Car, D, FA, @Dal, L 2-4, --, --, --, --, --, --, --, --, --, --, --, --, --, --, --, --, --
Maxence Guenette, Healthy, Ott, D, FA, Cls, W 6-3, --, --, --, --, --, --, --, --, --, --, --, --, --, --, --, --, --
Grant Hutton, Healthy, NYI, D, FA, Sea, L 1-2, --, --, --, --, --, --, --, --, --, --, --, --, --, --, --, --, --
Andrew Gibson, Healthy, Det, D, FA, @Edm, L 4-8, --, --, --, --, --, --, --, --, --, --, --, --, --, --, --, --, --
Lucas Johansen, Healthy, Wsh, D, FA, Col, L 3-6, --, --, --, --, --, --, --, --, --, --, --, --, --, --, --, --, --
Nathan Beaulieu, Healthy, Car, D, FA, @Dal, L 2-4, --, --, --, --, --, --, --, --, --, --, --, --, --, --, --, --, --
William Dufour, Healthy, NYI, RW, FA, Sea, L 1-2, --, --, --, --, --, --, --, --, --, --, --, --, --, --, --, --, --
Danny Nelson, Healthy, NYI, C, FA, Sea, L 1-2, --, --, --, --, --, --, --, --, --, --, --, --, --, --, --, --, --
Lukas Vejdemo, Healthy, Mon, C, FA, Ana, W 5-0, --, --, --, --, --, --, --, --, --, --, --, --, --, --, --, --, --
Slater Koekkoek, Healthy, Edm, D, FA, Det, W 8-4, --, --, --, --, --, --, --, --, --, --, --, --, --, --, --, --, --
Martin Frk, Healthy, StL, RW, FA, @Tor, L 1-4, --, --, --, --, --, --, --, --, --, --, --, --, --, --, --, --, --
Pavol Regenda, Healthy, Ana, C, FA, @Mon, L 0-5, --, --, --, --, --, --, --, --, --, --, --, --, --, --, --, --, --
Reid Schaefer, Healthy, Nsh, LW, FA, NJ, L 2-4, --, --, --, --, --, --, --, --, --, --, --, --, --, --, --, --, --
Hugh McGing, Healthy, StL, C- LW, FA, @Tor, L 1-4, --, --, --, --, --, --, --, --, --, --, --, --, --, --, --, --, --
Drake Caggiula, Healthy, Edm, LW, FA, Det, W 8-4, --, --, --, --, --, --, --, --, --, --, --, --, --, --, --, --, --
Buddy Robinson, Healthy, Chi, RW, FA, Van, L 2-4, --, --, --, --, --, --, --, --, --, --, --, --, --, --, --, --, --
Stanislav Svozil, Healthy, Cls, D, FA, @Ott, L 3-6, --, --, --, --, --, --, --, --, --, --, --, --, --, --, --, --, --
Paul LaDue, Healthy, NYI, D, FA, Sea, L 1-2, --, --, --, --, --, --, --, --, --, --, --, --, --, --, --, --, --
Marcus Bjork, Healthy, Cls, D, FA, @Ott, L 3-6, --, --, --, --, --, --, --, --, --, --, --, --, --, --, --, --, --
Andy Greene, Healthy, NYI, D, FA, Sea, L 1-2, --, --, --, --, --, --, --, --, --, --, --, --, --, --, --, --, --
Mike Vecchione, Healthy, Wsh, C, FA, Col, L 3-6, --, --, --, --, --, --, --, --, --, --, --, --, --, --, --, --, --
Egor Sokolov, Healthy, Ott, LW, FA, Cls, W 6-3, --, --, --, --, --, --, --, --, --, --, --, --, --, --, --, --, --
Ethan Gauthier, Healthy, TB, RW, FA, @Bos, W 3-2, --, --, --, --, --, --, --, --, --, --, --, --, --, --, --, --, --
Matthew Highmore, IR, Ott, C, FA, Cls, W 6-3, --, --, --, --, --, --, --, --, --, --, --, --, --, --, --, --, --
Alex Burrows, Healthy, Ott, RW, FA, Cls, W 6-3, --, --, --, --, --, --, --, --, --, --, --, --, --, --, --, --, --
Dylan Gambrell, Healthy, Tor, C, FA, StL, W 4-1, --, --, --, --, --, --, --, --, --, --, --, --, --, --, --, --, --
Trevor Carrick, Healthy, Ana, D, FA, @Mon, L 0-5, --, --, --, --, --, --, --, --, --, --, --, --, --, --, --, --, --
Tristan Bertucci, Healthy, Dal, D, FA, Car, W 4-2, --, --, --, --, --, --, --, --, --, --, --, --, --, --, --, --, --
Guillaume Brisebois, Healthy, Van, D, FA, @Chi, W 4-2, --, --, --, --, --, --, --, --, --, --, --, --, --, --, --, --, --
Linus Karlsson, Healthy, Van, C- RW, FA, @Chi, W 4-2, --, --, --, --, --, --, --, --, --, --, --, --, --, --, --, --, --
Charles Hudon, Healthy, LA, LW, FA, @Buf, L 0-7, --, --, --, --, --, --, --, --, --, --, --, --, --, --, --, --, --
Brett Connolly, Healthy, Chi, RW, FA, Van, L 2-4, --, --, --, --, --, --, --, --, --, --, --, --, --, --, --, --, --
Anthony Angello, Healthy, Nsh, C, FA, NJ, L 2-4, --, --, --, --, --, --, --, --, --, --, --, --, --, --, --, --, --
Luke Philp, Healthy, Chi, C, FA, Van, L 2-4, --, --, --, --, --, --, --, --, --, --, --, --, --, --, --, --, --
Kurtis Gabriel, Healthy, Chi, RW, FA, Van, L 2-4, --, --, --, --, --, --, --, --, --, --, --, --, --, --, --, --, --
Thomas Hickey, Healthy, NJ, D, FA, @Nsh, W 4-2, --, --, --, --, --, --, --, --, --, --, --, --, --, --, --, --, --
Gabriel Carlsson, Healthy, Wsh, D, FA, Col, L 3-6, --, --, --, --, --, --, --, --, --, --, --, --, --, --, --, --, --
Joey Keane, Healthy, Car, D, FA, @Dal, L 2-4, --, --, --, --, --, --, --, --, --, --, --, --, --, --, --, --, --
Cole Reinhardt, Healthy, Ott, LW, FA, Cls, W 6-3, --, --, --, --, --, --, --, --, --, --, --, --, --, --, --, --, --
Lucas Condotta, Healthy, Mon, C, FA, Ana, W 5-0, --, --, --, --, --, --, --, --, --, --, --, --, --, --, --, --, --
Brett Murray, Healthy, Buf, LW, FA, LA, W 7-0, --, --, --, --, --, --, --, --, --, --, --, --, --, --, --, --, --
Jayson Megna, Healthy, Bos, C, FA, TB, L 2-3, --, --, --, --, --, --, --, --, --, --, --, --, --, --, --, --, --
P.A. Parenteau, Healthy, Det, RW, FA, @Edm, L 4-8, --, --, --, --, --, --, --, --, --, --, --, --, --, --, --, --, --
Shane Bowers, Healthy, NJ, C, FA, @Nsh, W 4-2, --, --, --, --, --, --, --, --, --, --, --, --, --, --, --, --, --
James Neal, Healthy, Cls, RW, FA, @Ott, L 3-6, --, --, --, --, --, --, --, --, --, --, --, --, --, --, --, --, --
Markus Niemelainen, Healthy, Edm, D, FA, Det, W 8-4, --, --, --, --, --, --, --, --, --, --, --, --, --, --, --, --, --
Michal Kempny, Healthy, Sea, D, FA, @NYI, W 2-1, --, --, --, --, --, --, --, --, --, --, --, --, --, --, --, --, --
Ryan Merkley, Healthy, Col, D, FA, @Wsh, W 6-3, --, --, --, --, --, --, --, --, --, --, --, --, --, --, --, --, --
Kris Russell, Healthy, Edm, D, FA, Det, W 8-4, --, --, --, --, --, --, --, --, --, --, --, --, --, --, --, --, --
Derek Dorsett, Healthy, Van, RW, FA, @Chi, W 4-2, --, --, --, --, --, --, --, --, --, --, --, --, --, --, --, --, --
Nikita Nesterenko, Healthy, Ana, LW, FA, @Mon, L 0-5, --, --, --, --, --, --, --, --, --, --, --, --, --, --, --, --, --
Andreas Martinsen, Healthy, Ana, LW, FA, @Mon, L 0-5, --, --, --, --, --, --, --, --, --, --, --, --, --, --, --, --, --
Oscar Fisker Molgaard, Healthy, Sea, C, FA, @NYI, W 2-1, --, --, --, --, --, --, --, --, --, --, --, --, --, --, --, --, --
Tyler Bozak, Healthy, StL, C, FA, @Tor, L 1-4, --, --, --, --, --, --, --, --, --, --, --, --, --, --, --, --, --
Brayden Tracey, Healthy, Ana, LW, FA, @Mon, L 0-5, --, --, --, --, --, --, --, --, --, --, --, --, --, --, --, --, --
Brett Seney, Healthy, Chi, LW, FA, Van, L 2-4, --, --, --, --, --, --, --, --, --, --, --, --, --, --, --, --, --
Kole Lind, Healthy, Sea, RW, FA, @NYI, W 2-1, --, --, --, --, --, --, --, --, --, --, --, --, --, --, --, --, --
Isaac Ratcliffe, Healthy, StL, LW, FA, @Tor, L 1-4, --, --, --, --, --, --, --, --, --, --, --, --, --, --, --, --, --
Alexander Radulov, Healthy, Dal, RW, FA, Car, W 4-2, --, --, --, --, --, --, --, --, --, --, --, --, --, --, --, --, --
Brennan Menell, Healthy, Tor, D, FA, StL, W 4-1, --, --, --, --, --, --, --, --, --, --, --, --, --, --, --, --, --
Sean Day, Healthy, TB, D, FA, @Bos, W 3-2, --, --, --, --, --, --, --, --, --, --, --, --, --, --, --, --, --
Billy Sweezey, Healthy, Cls, D, FA, @Ott, L 3-6, --, --, --, --, --, --, --, --, --, --, --, --, --, --, --, --, --
Jacob Larsson, Healthy, Ott, D, FA, Cls, W 6-3, --, --, --, --, --, --, --, --, --, --, --, --, --, --, --, --, --
Brian Lashoff, Healthy, Det, D, FA, @Edm, L 4-8, --, --, --, --, --, --, --, --, --, --, --, --, --, --, --, --, --
Nicolas Beaudin, Healthy, Mon, D, FA, Ana, W 5-0, --, --, --, --, --, --, --, --, --, --, --, --, --, --, --, --, --
Carson Meyer, Healthy, Cls, RW, FA, @Ott, L 3-6, --, --, --, --, --, --, --, --, --, --, --, --, --, --, --, --, --
Mitchell Stephens, Healthy, Mon, C, FA, Ana, W 5-0, --, --, --, --, --, --, --, --, --, --, --, --, --, --, --, --, --
Tyler Ennis, Healthy, Ott, LW, FA, Cls, W 6-3, --, --, --, --, --, --, --, --, --, --, --, --, --, --, --, --, --
Nick Abruzzese, Healthy, Tor, C, FA, StL, W 4-1, --, --, --, --, --, --, --, --, --, --, --, --, --, --, --, --, --
Kieffer Bellows, Healthy, Car, LW, FA, @Dal, L 2-4, --, --, --, --, --, --, --, --, --, --, --, --, --, --, --, --, --
Roby Jarventie, Healthy, Ott, LW, FA, Cls, W 6-3, --, --, --, --, --, --, --, --, --, --, --, --, --, --, --, --, --
Jack Ahcan, Healthy, Col, D, FA, @Wsh, W 6-3, --, --, --, --, --, --, --, --, --, --, --, --, --, --, --, --, --
Jake Livingstone, Healthy, Nsh, D, FA, NJ, L 2-4, --, --, --, --, --, --, --, --, --, --, --, --, --, --, --, --, --
John Moore, Healthy, Ana, D, FA, @Mon, L 0-5, --, --, --, --, --, --, --, --, --, --, --, --, --, --, --, --, --
Alex Biega, Healthy, Nsh, D, FA, NJ, L 2-4, --, --, --, --, --, --, --, --, --, --, --, --, --, --, --, --, --
Andrej Sustr, Healthy, Ana, D, FA, @Mon, L 0-5, --, --, --, --, --, --, --, --, --, --, --, --, --, --, --, --, --
Drew Helleson, Healthy, Ana, D, FA, @Mon, L 0-5, --, --, --, --, --, --, --, --, --, --, --, --, --, --, --, --, --
Cody Franson, Healthy, Chi, D, FA, Van, L 2-4, --, --, --, --, --, --, --, --, --, --, --, --, --, --, --, --, --
Kyle Turris, Healthy, Edm, C, FA, Det, W 8-4, --, --, --, --, --, --, --, --, --, --, --, --, --, --, --, --, --
Mike Hardman, Healthy, Chi, RW, FA, Van, L 2-4, --, --, --, --, --, --, --, --, --, --, --, --, --, --, --, --, --
Patrick Russell, Healthy, Edm, RW, FA, Det, W 8-4, --, --, --, --, --, --, --, --, --, --, --, --, --, --, --, --, --
Matej Blumel, Healthy, Dal, LW, FA, Car, W 4-2, --, --, --, --, --, --, --, --, --, --, --, --, --, --, --, --, --
Roman Kantserov, Healthy, Chi, RW, FA, Van, L 2-4, --, --, --, --, --, --, --, --, --, --, --, --, --, --, --, --, --
Scott Reedy, Healthy, Dal, C, FA, Car, W 4-2, --, --, --, --, --, --, --, --, --, --, --, --, --, --, --, --, --
