Name, Health, NHL Team, Position, GFHL Team, Opponent, Score, GP, G, A, +/-, PIM, PPG, PPA, SHG, SHA, GWG, FOW, FOL, HAT, SOG, HIT, BLK, FPTS
Sam Reinhart, Healthy, Fla, RW, ME, @NJ, W 4-3, 1, 2, 0, 1, 0, 1, 0, 0, 0, 1, 0, 3, 0, 5, 0, 3, 7.7
Alex Vlasic, Healthy, Chi, D, FA, @Tor, W 4-1, 1, 0, 1, 3, 0, 0, 0, 0, 0, 0, 0, 0, 0, 3, 3, 4, 6.2
Seth Jones, IR, Chi, D, FA, @Tor, W 4-1, 1, 0, 1, 3, 0, 0, 0, 0, 0, 0, 0, 0, 0, 2, 2, 4, 5.8
Matthew Tkachuk, Healthy, Fla, RW- LW, CLB, @NJ, W 4-3, 1, 0, 2, 1, 2, 0, 0, 0, 0, 0, 0, 0, 0, 4, 5, 1, 5.7
Taylor Raddysh, Healthy, Chi, RW, FA, @Tor, W 4-1, 1, 1, 0, 1, 0, 0, 0, 1, 0, 0, 1, 1, 0, 4, 4, 1, 5.6
Jesper Bratt, Healthy, NJ, RW, HERB, Fla, L 3-4, 1, 1, 1, -1, 0, 1, 1, 0, 0, 0, 0, 0, 0, 5, 2, 1, 5.35
Corey Perry, Healthy, Chi, RW, FA, @Tor, W 4-1, 1, 1, 0, 0, 0, 0, 0, 0, 0, 1, 0, 0, 0, 2, 5, 1, 5.2
Erik Haula, Healthy, NJ, LW, FA, Fla, L 3-4, 1, 1, 1, 1, 2, 1, 0, 0, 0, 0, 6, 8, 0, 6, 1, 0, 5.0
Niko Mikkola, Healthy, Fla, D, FA, @NJ, W 4-3, 1, 1, 0, 1, 4, 0, 0, 0, 0, 0, 0, 0, 0, 3, 2, 4, 5.0
Noah Hanifin, Healthy, Cgy, D, FA, @Wsh, L 2-3, 1, 0, 2, 1, 0, 0, 1, 0, 0, 0, 0, 0, 0, 4, 1, 1, 4.95
Andreas Athanasiou, IR, Chi, LW- C- RW, FA, @Tor, W 4-1, 1, 0, 2, 1, 0, 0, 1, 0, 0, 0, 2, 3, 0, 3, 0, 2, 4.95
Matthew Phillips, Healthy, Wsh, C, FA, Cgy, W 3-2, 1, 1, 1, 2, 0, 0, 0, 0, 0, 0, 0, 0, 0, 2, 0, 0, 4.7
TJ Brodie, Healthy, Tor, D, FA, Chi, L 1-4, 1, 0, 0, 0, 0, 0, 0, 0, 0, 0, 0, 0, 0, 1, 3, 7, 4.5
Oliver Ekman-Larsson, Healthy, Fla, D, FA, @NJ, W 4-3, 1, 0, 1, 0, 0, 0, 1, 0, 0, 0, 0, 0, 0, 1, 2, 4, 4.45
John Carlson, Healthy, Wsh, D, ME, Cgy, W 3-2, 1, 0, 1, 1, 0, 0, 0, 0, 0, 0, 0, 0, 0, 2, 0, 4, 4.2
Michael Rasmussen, Healthy, Det, C, FA, @Cls, W 4-0, 1, 1, 0, 1, 0, 0, 0, 0, 0, 0, 0, 0, 0, 1, 2, 2, 4.2
Andrew Copp, Healthy, Det, C, FA, @Cls, W 4-0, 1, 1, 0, 1, 2, 1, 0, 0, 0, 0, 6, 3, 0, 5, 0, 1, 4.1
Dillon Dube, Healthy, Cgy, C, FA, @Wsh, L 2-3, 1, 1, 1, -1, 0, 1, 0, 0, 0, 0, 0, 0, 0, 3, 1, 0, 4.1
John Tavares, Healthy, Tor, C, BBS, Chi, L 1-4, 1, 1, 0, 0, 0, 0, 0, 0, 0, 0, 11, 6, 0, 7, 1, 1, 4.0
Shayne Gostisbehere, Healthy, Det, D, FA, @Cls, W 4-0, 1, 1, 0, 1, 0, 0, 0, 0, 0, 1, 0, 0, 0, 2, 1, 0, 4.0
Michael McLeod, Healthy, NJ, C, SLC, Fla, L 3-4, 1, 1, 0, 0, 0, 0, 0, 0, 0, 0, 4, 8, 0, 3, 5, 1, 3.9
Mark Giordano, Healthy, Tor, D, FA, Chi, L 1-4, 1, 0, 1, 0, 0, 0, 0, 0, 0, 0, 0, 0, 0, 4, 1, 3, 3.7
Moritz Seider, Healthy, Det, D, SALT, @Cls, W 4-0, 1, 0, 1, 0, 0, 0, 1, 0, 0, 0, 0, 0, 0, 1, 1, 3, 3.65
Adam Ruzicka, Healthy, Cgy, C, FA, @Wsh, L 2-3, 1, 1, 1, -1, 0, 0, 1, 0, 0, 0, 2, 0, 0, 1, 0, 0, 3.55
Carter Verhaeghe, Healthy, Fla, LW- C, CLB, @NJ, W 4-3, 1, 1, 0, 1, 0, 0, 0, 0, 0, 0, 0, 1, 0, 1, 0, 2, 3.5
Vincent Trocheck, Healthy, NYR, C, LKR, Ari, W 2-1, 1, 1, 0, 0, 2, 1, 0, 0, 0, 1, 5, 9, 0, 3, 1, 0, 3.5
Dylan Larkin, Healthy, Det, C, OXP, @Cls, W 4-0, 1, 1, 0, 0, 0, 1, 0, 0, 0, 0, 10, 9, 0, 5, 0, 0, 3.1
Boris Katchouk, Healthy, Chi, LW, FA, @Tor, W 4-1, 1, 0, 1, 2, 0, 0, 0, 0, 0, 0, 0, 0, 0, 0, 2, 0, 3.1
J.T. Compher, Healthy, Det, RW- C- LW, FA, @Cls, W 4-0, 1, 0, 1, 1, 0, 0, 0, 0, 0, 0, 5, 2, 0, 2, 0, 1, 3.0
Joe Veleno, Healthy, Det, C, FA, @Cls, W 4-0, 1, 0, 1, 1, 0, 0, 0, 0, 0, 0, 11, 1, 0, 0, 0, 0, 3.0
MacKenzie Entwistle, Healthy, Chi, RW, FA, @Tor, W 4-1, 1, 1, 0, 1, 4, 0, 0, 0, 0, 0, 1, 1, 0, 1, 2, 0, 2.8
Rasmus Andersson, Healthy, Cgy, D, ME, @Wsh, L 2-3, 1, 0, 0, 1, 0, 0, 0, 0, 0, 0, 0, 0, 0, 3, 0, 4, 2.8
Jake Walman, Healthy, Det, D, CLB, @Cls, W 4-0, 1, 0, 1, 0, 0, 0, 1, 0, 0, 0, 0, 0, 0, 0, 0, 2, 2.75
Mika Zibanejad, DTD, NYR, C, ME, Ari, W 2-1, 1, 0, 1, 1, 2, 0, 0, 0, 0, 0, 8, 5, 0, 3, 1, 0, 2.7
Eetu Luostarinen, Healthy, Fla, LW- C, FA, @NJ, W 4-3, 1, 0, 0, 1, 0, 0, 0, 0, 0, 0, 14, 9, 0, 1, 2, 2, 2.7
Chris Kreider, Healthy, NYR, LW, LKR, Ari, W 2-1, 1, 1, 0, 1, 0, 0, 0, 0, 0, 0, 1, 3, 0, 3, 0, 0, 2.6
Kaapo Kakko, IR, NYR, RW, FA, Ari, W 2-1, 1, 0, 1, 1, 0, 0, 0, 0, 0, 0, 0, 0, 0, 1, 0, 1, 2.6
Olli Maatta, Healthy, Det, D, FA, @Cls, W 4-0, 1, 0, 1, 1, 0, 0, 0, 0, 0, 0, 0, 0, 0, 1, 0, 1, 2.6
Connor McMichael, Healthy, Wsh, C, FA, Cgy, W 3-2, 1, 1, 0, 1, 0, 0, 0, 0, 0, 0, 0, 0, 0, 1, 0, 0, 2.6
Aleksander Barkov, Healthy, Fla, C, SALT, @NJ, W 4-3, 1, 0, 1, 1, 0, 0, 1, 0, 0, 0, 9, 11, 0, 2, 1, 0, 2.55
Auston Matthews, Healthy, Tor, C, BOWS, Chi, L 1-4, 1, 0, 0, -2, 0, 0, 0, 0, 0, 0, 14, 9, 0, 8, 4, 2, 2.5
Jason Dickinson, Healthy, Chi, C, FA, @Tor, W 4-1, 1, 0, 0, 0, 2, 0, 0, 0, 0, 0, 6, 9, 0, 0, 5, 3, 2.5
Martin Fehervary, Healthy, Wsh, D, FA, Cgy, W 3-2, 1, 0, 0, 0, 0, 0, 0, 0, 0, 0, 0, 0, 0, 1, 3, 3, 2.5
Evan Rodrigues, Healthy, Fla, C, FA, @NJ, W 4-3, 1, 0, 1, 1, 2, 0, 0, 0, 0, 0, 0, 1, 0, 4, 1, 0, 2.4
Dmitry Kulikov, Healthy, Fla, D, FA, @NJ, W 4-3, 1, 0, 1, 1, 2, 0, 0, 0, 0, 0, 0, 0, 0, 1, 0, 1, 2.4
Clayton Keller, Healthy, Ari, LW- C- RW, SLC, @NYR, L 1-2, 1, 1, 0, -1, 0, 1, 0, 0, 0, 0, 0, 1, 0, 5, 0, 0, 2.4
Nick Foligno, IR, Chi, LW- C- RW, FA, @Tor, W 4-1, 1, 0, 0, 0, 0, 0, 0, 0, 0, 0, 0, 1, 0, 3, 4, 2, 2.4
Nikita Zaitsev, Healthy, Chi, D, FA, @Tor, W 4-1, 1, 0, 0, 0, 0, 0, 0, 0, 0, 0, 0, 0, 0, 0, 3, 3, 2.4
Josh Mahura, Healthy, Fla, D, FA, @NJ, W 4-3, 1, 0, 1, 0, 0, 0, 0, 0, 0, 0, 0, 0, 0, 1, 1, 1, 2.4
Adam Fox, Healthy, NYR, D, SALT, Ari, W 2-1, 1, 0, 1, 0, 0, 0, 1, 0, 0, 0, 0, 0, 0, 0, 2, 0, 2.35
Lucas Raymond, Healthy, Det, LW, SLC, @Cls, W 4-0, 1, 0, 1, 0, 0, 0, 1, 0, 0, 0, 0, 0, 0, 3, 1, 0, 2.35
Sean Durzi, Healthy, Ari, D, BOWS, @NYR, L 1-2, 1, 0, 0, 0, 2, 0, 0, 0, 0, 0, 0, 0, 0, 4, 2, 3, 2.3
Tyler Johnson, IR, Chi, C- LW- RW, FA, @Tor, W 4-1, 1, 1, 0, 0, 0, 1, 0, 0, 0, 0, 0, 7, 0, 1, 1, 0, 2.2
Artemi Panarin, Healthy, NYR, LW, BOWS, Ari, W 2-1, 1, 0, 1, 0, 0, 0, 1, 0, 0, 0, 0, 0, 0, 4, 0, 0, 2.15
Erik Gudbranson, Healthy, Cls, D, FA, Det, L 0-4, 1, 0, 0, 0, 5, 0, 0, 0, 0, 0, 0, 0, 0, 0, 2, 4, 2.1
Alexander Holtz, Healthy, NJ, RW, FA, Fla, L 3-4, 1, 0, 1, 1, 0, 0, 0, 0, 0, 0, 0, 0, 0, 1, 0, 0, 2.1
Nick Bonino, Healthy, NYR, C, FA, Ari, W 2-1, 1, 0, 0, 0, 0, 0, 0, 0, 0, 0, 4, 1, 0, 0, 1, 3, 2.1
Kevin Korchinski, Healthy, Chi, D, FA, @Tor, W 4-1, 1, 0, 1, -1, 0, 0, 1, 0, 0, 0, 0, 0, 0, 3, 0, 1, 2.05
Sonny Milano, IR, Wsh, LW, FA, Cgy, W 3-2, 1, 0, 1, 1, 0, 0, 0, 0, 0, 0, 0, 0, 0, 0, 0, 0, 2.0
Logan Cooley, Healthy, Ari, C, FA, @NYR, L 1-2, 1, 0, 1, 0, 0, 0, 1, 0, 0, 0, 3, 2, 0, 1, 0, 0, 1.95
Alex DeBrincat, Healthy, Det, LW- RW, SLC, @Cls, W 4-0, 1, 0, 1, 0, 0, 0, 1, 0, 0, 0, 0, 0, 0, 2, 0, 0, 1.95
Mikael Backlund, Healthy, Cgy, C, FA, @Wsh, L 2-3, 1, 0, 0, 0, 0, 0, 0, 0, 0, 0, 12, 6, 0, 5, 1, 1, 1.9
Rasmus Sandin, IR, Wsh, D, FA, Cgy, W 3-2, 1, 0, 0, 1, 0, 0, 0, 0, 0, 0, 0, 0, 0, 1, 1, 2, 1.9
Timothy Liljegren, Healthy, Tor, D, FA, Chi, L 1-4, 1, 0, 0, 1, 0, 0, 0, 0, 0, 0, 0, 0, 0, 1, 1, 2, 1.9
Kevin Bahl, Healthy, NJ, D, FA, Fla, L 3-4, 1, 0, 0, 0, 0, 0, 0, 0, 0, 0, 0, 0, 0, 0, 3, 2, 1.9
Wyatt Kaiser, Healthy, Chi, D, FA, @Tor, W 4-1, 1, 0, 0, 0, 0, 0, 0, 0, 0, 0, 0, 0, 0, 0, 3, 2, 1.9
Nico Hischier, Healthy, NJ, C, SLC, Fla, L 3-4, 1, 0, 0, 0, 2, 0, 0, 0, 0, 0, 15, 5, 0, 0, 3, 0, 1.7
Dougie Hamilton, IR, NJ, D, BBS, Fla, L 3-4, 1, 0, 1, -1, 0, 0, 1, 0, 0, 0, 0, 0, 0, 1, 1, 0, 1.65
Dylan Strome, Healthy, Wsh, C, FA, Cgy, W 3-2, 1, 0, 0, 1, 0, 0, 0, 0, 0, 0, 4, 3, 0, 2, 1, 1, 1.6
Daniel Sprong, Healthy, Det, RW, FA, @Cls, W 4-0, 1, 0, 0, 1, 2, 0, 0, 0, 0, 0, 0, 0, 0, 2, 2, 1, 1.6
Nick Jensen, Healthy, Wsh, D, FA, Cgy, W 3-2, 1, 0, 0, 0, 0, 0, 0, 0, 0, 0, 0, 0, 0, 0, 2, 2, 1.6
Tyler Pitlick, DTD, NYR, RW, FA, Ari, W 2-1, 1, 0, 0, 0, 0, 0, 0, 0, 0, 0, 0, 0, 0, 0, 2, 2, 1.6
Jack McBain, Healthy, Ari, C- LW, FA, @NYR, L 1-2, 1, 0, 0, 0, 0, 0, 0, 0, 0, 0, 2, 5, 0, 0, 3, 2, 1.6
Justin Sourdif, Healthy, Fla, RW- C, FA, @NJ, W 4-3, 1, 0, 0, 0, 0, 0, 0, 0, 0, 0, 0, 0, 0, 1, 3, 1, 1.5
"KAndre Miller", Healthy, NYR, D, FA, Ari, W 2-1, 1, 0, 0, 1, 2, 0, 0, 0, 0, 0, 0, 0, 0, 1, 0, 2, 1.4
Tom Wilson, DTD, Wsh, RW, CLB, Cgy, W 3-2, 1, 0, 0, 0, 2, 0, 0, 0, 0, 0, 0, 0, 0, 2, 3, 1, 1.4
David Perron, Healthy, Det, RW- LW, FA, @Cls, W 4-0, 1, 0, 0, 1, 0, 0, 0, 0, 0, 0, 0, 0, 0, 1, 1, 1, 1.4
Noah Gregor, Healthy, Tor, C, FA, Chi, L 1-4, 1, 0, 0, 0, 5, 0, 0, 0, 0, 0, 0, 0, 0, 1, 6, 0, 1.4
MacKenzie Weegar, Healthy, Cgy, D, ME, @Wsh, L 2-3, 1, 0, 0, -1, 0, 0, 0, 0, 0, 0, 0, 0, 0, 2, 2, 2, 1.3
Ben Chiarot, Healthy, Det, D, FA, @Cls, W 4-0, 1, 0, 0, 1, 0, 0, 0, 0, 0, 0, 0, 0, 0, 0, 1, 1, 1.3
Chris Tanev, Healthy, Cgy, D, FA, @Wsh, L 2-3, 1, 0, 0, -1, 0, 0, 0, 0, 0, 0, 0, 0, 0, 3, 0, 3, 1.3
Jonas Siegenthaler, Healthy, NJ, D, FA, Fla, L 3-4, 1, 0, 0, 0, 0, 0, 0, 0, 0, 0, 0, 0, 0, 2, 2, 1, 1.3
Braden Schneider, Healthy, NYR, D, FA, Ari, W 2-1, 1, 0, 0, 0, 2, 0, 0, 0, 0, 0, 0, 0, 0, 1, 3, 1, 1.3
Ondrej Palat, O, NJ, LW, FA, Fla, L 3-4, 1, 0, 0, 0, 2, 0, 0, 0, 0, 0, 0, 0, 0, 1, 3, 1, 1.3
Nathan Bastian, Healthy, NJ, RW, FA, Fla, L 3-4, 1, 0, 0, -1, 0, 0, 0, 0, 0, 0, 1, 0, 0, 2, 5, 0, 1.3
Uvis Balinskis, Healthy, Fla, D, FA, @NJ, W 4-3, 1, 0, 0, 1, 0, 0, 0, 0, 0, 0, 0, 0, 0, 0, 1, 1, 1.3
Nick Schmaltz, Healthy, Ari, RW- C, FA, @NYR, L 1-2, 1, 0, 1, -1, 0, 0, 1, 0, 0, 0, 0, 0, 0, 0, 0, 0, 1.25
Ryan Donato, Healthy, Chi, RW, FA, @Tor, W 4-1, 1, 0, 0, 0, 0, 0, 0, 0, 0, 0, 3, 1, 0, 4, 2, 0, 1.2
Taylor Hall, IR, Chi, LW, FA, @Tor, W 4-1, 1, 0, 0, 0, 0, 0, 0, 0, 0, 0, 1, 0, 0, 0, 2, 1, 1.2
Trevor van Riemsdyk, Healthy, Wsh, D, FA, Cgy, W 3-2, 1, 0, 0, 0, 0, 0, 0, 0, 0, 0, 0, 0, 0, 2, 0, 2, 1.2
Calle Jarnkrok, Healthy, Tor, LW- C- RW, FA, Chi, L 1-4, 1, 0, 0, 1, 0, 0, 0, 0, 0, 0, 0, 1, 0, 0, 1, 1, 1.2
Nick Cousins, IR, Fla, C, FA, @NJ, W 4-3, 1, 0, 0, 0, 2, 0, 0, 0, 0, 0, 2, 0, 0, 0, 2, 1, 1.1
Jacob Trouba, Healthy, NYR, D, BOWS, Ari, W 2-1, 1, 0, 0, 1, 12, 0, 0, 0, 0, 0, 0, 0, 0, 3, 0, 3, 1.1
William Nylander, Healthy, Tor, RW- LW, OXP, Chi, L 1-4, 1, 0, 1, -2, 0, 0, 0, 0, 0, 0, 0, 0, 0, 2, 1, 0, 1.0
Gustav Forsling, Healthy, Fla, D, SLC, @NJ, W 4-3, 1, 0, 0, 1, 0, 0, 0, 0, 0, 0, 0, 0, 0, 2, 1, 0, 1.0
J.J. Moser, Healthy, Ari, D, FA, @NYR, L 1-2, 1, 0, 0, 0, 0, 0, 0, 0, 0, 0, 0, 0, 0, 0, 0, 2, 1.0
Kevin Stenlund, Healthy, Fla, RW, FA, @NJ, W 4-3, 1, 0, 0, 0, 0, 0, 0, 0, 0, 0, 1, 0, 0, 1, 1, 1, 1.0
Matthew Knies, Healthy, Tor, LW, LKR, Chi, L 1-4, 1, 0, 0, 0, 0, 0, 0, 0, 0, 0, 0, 0, 0, 1, 1, 1, 0.9
Travis Boyd, IR, Ari, C, FA, @NYR, L 1-2, 1, 0, 0, 0, 0, 0, 0, 0, 0, 0, 2, 1, 0, 0, 1, 1, 0.9
Barclay Goodrow, Healthy, NYR, C- LW- RW, FA, Ari, W 2-1, 1, 0, 0, 0, 12, 0, 0, 0, 0, 0, 0, 1, 0, 0, 4, 2, 0.9
Morgan Rielly, Healthy, Tor, D, LKR, Chi, L 1-4, 1, 0, 0, -2, 0, 0, 0, 0, 0, 0, 0, 0, 0, 3, 0, 3, 0.8
Jonathan Huberdeau, Healthy, Cgy, LW, FA, @Wsh, L 2-3, 1, 0, 0, 0, 2, 0, 0, 0, 0, 0, 0, 0, 0, 2, 1, 1, 0.8
Lukas Reichel, Healthy, Chi, LW, FA, @Tor, W 4-1, 1, 0, 0, 0, 0, 0, 0, 0, 0, 0, 4, 5, 0, 1, 1, 1, 0.8
Connor Murphy, Healthy, Chi, D, FA, @Tor, W 4-1, 1, 0, 0, -1, 5, 0, 0, 0, 0, 0, 0, 0, 0, 0, 1, 3, 0.8
Alexander Kerfoot, Healthy, Ari, C, FA, @NYR, L 1-2, 1, 0, 0, 0, 0, 0, 0, 0, 0, 0, 1, 0, 0, 2, 0, 1, 0.8
Nic Dowd, Healthy, Wsh, C, FA, Cgy, W 3-2, 1, 0, 0, -1, 0, 0, 0, 0, 0, 0, 6, 8, 0, 0, 0, 3, 0.8
Elias Lindholm, Healthy, Cgy, RW, ME, @Wsh, L 2-3, 1, 0, 0, 0, 0, 0, 0, 0, 0, 0, 14, 10, 0, 3, 0, 0, 0.7
Blake Coleman, Healthy, Cgy, RW- LW, LKR, @Wsh, L 2-3, 1, 0, 0, 0, 0, 0, 0, 0, 0, 0, 0, 0, 0, 4, 1, 0, 0.7
Blake Wheeler, Healthy, NYR, RW, FA, Ari, W 2-1, 1, 0, 0, 0, 0, 0, 0, 0, 0, 0, 0, 0, 0, 4, 1, 0, 0.7
Jason Zucker, Healthy, Ari, LW- RW, FA, @NYR, L 1-2, 1, 0, 0, 0, 0, 0, 0, 0, 0, 0, 0, 0, 0, 2, 0, 1, 0.7
Brendan Smith, Healthy, NJ, D, FA, Fla, L 3-4, 1, 0, 0, -1, 0, 0, 0, 0, 0, 0, 0, 0, 0, 0, 4, 0, 0.7
Ryan Lomberg, Healthy, Fla, LW, FA, @NJ, W 4-3, 1, 0, 0, 0, 0, 0, 0, 0, 0, 0, 0, 0, 0, 1, 2, 0, 0.7
Walker Duehr, Healthy, Cgy, RW, FA, @Wsh, L 2-3, 1, 0, 0, 0, 0, 0, 0, 0, 0, 0, 1, 0, 0, 0, 2, 0, 0.7
Lawson Crouse, Healthy, Ari, RW- LW, CLB, @NYR, L 1-2, 1, 0, 0, 0, 0, 0, 0, 0, 0, 0, 0, 3, 0, 1, 3, 0, 0.7
Ivan Provorov, Healthy, Cls, D, OXP, Det, L 0-4, 1, 0, 0, 0, 2, 0, 0, 0, 0, 0, 0, 0, 0, 0, 1, 1, 0.6
Kirill Marchenko, Healthy, Cls, LW- RW, FA, Det, L 0-4, 1, 0, 0, 0, 0, 0, 0, 0, 0, 0, 1, 1, 0, 6, 0, 0, 0.6
Nikita Zadorov, Healthy, Van, D, FA, --, --, 1, 0, 0, -1, 2, 0, 0, 0, 0, 0, 0, 0, 0, 3, 0, 2, 0.6
Jack Hughes, O, NJ, C, BBS, Fla, L 3-4, 1, 0, 1, -2, 0, 0, 1, 0, 0, 0, 2, 10, 0, 6, 0, 0, 0.55
Connor Bedard, IR, Chi, C, DINK, @Tor, W 4-1, 1, 0, 0, 0, 0, 0, 0, 0, 0, 0, 4, 9, 0, 4, 2, 0, 0.5
Justin Danforth, Healthy, Cls, RW, FA, Det, L 0-4, 1, 0, 0, -1, 0, 0, 0, 0, 0, 0, 0, 1, 0, 0, 2, 1, 0.5
"Liam OBrien", Healthy, Ari, LW, FA, @NYR, L 1-2, 1, 0, 0, 0, 0, 0, 0, 0, 0, 0, 0, 0, 0, 2, 1, 0, 0.5
Will Cuylle, Healthy, NYR, LW, FA, Ari, W 2-1, 1, 0, 0, 0, 0, 0, 0, 0, 0, 0, 0, 1, 0, 0, 2, 0, 0.5
Alexander Alexeyev, Healthy, Wsh, D, FA, Cgy, W 3-2, 1, 0, 0, 0, 0, 0, 0, 0, 0, 0, 0, 0, 0, 0, 0, 1, 0.5
Fraser Minten, Healthy, Tor, C, FA, Chi, L 1-4, 1, 0, 0, 0, 0, 0, 0, 0, 0, 0, 4, 3, 0, 1, 1, 0, 0.5
Tyler Bertuzzi, Healthy, Tor, LW, FA, Chi, L 1-4, 1, 0, 0, 0, 4, 0, 0, 0, 0, 0, 0, 0, 0, 0, 1, 1, 0.4
Beck Malenstyn, Healthy, Wsh, LW, FA, Cgy, W 3-2, 1, 0, 0, -1, 0, 0, 0, 0, 0, 0, 0, 0, 0, 1, 1, 1, 0.4
Sean Kuraly, IR, Cls, C, FA, Det, L 0-4, 1, 0, 0, 0, 4, 0, 0, 0, 0, 0, 5, 5, 0, 2, 2, 0, 0.4
Emil Bemstrom, Healthy, Cls, C, FA, Det, L 0-4, 1, 0, 0, 0, 0, 0, 0, 0, 0, 0, 0, 0, 0, 1, 1, 0, 0.4
Nick Bjugstad, Healthy, Ari, C, FA, @NYR, L 1-2, 1, 0, 0, 0, 12, 0, 0, 0, 0, 0, 9, 3, 0, 2, 1, 1, 0.4
Anton Lundell, Healthy, Fla, LW- C, FA, @NJ, W 4-3, 1, 0, 0, 0, 0, 0, 0, 0, 0, 0, 6, 5, 0, 2, 0, 0, 0.3
Johnny Gaudreau, Healthy, Cls, LW, FA, Det, L 0-4, 1, 0, 0, 0, 0, 0, 0, 0, 0, 0, 0, 0, 0, 3, 0, 0, 0.3
David Kampf, Healthy, Tor, C- RW, FA, Chi, L 1-4, 1, 0, 0, -1, 0, 0, 0, 0, 0, 0, 7, 2, 0, 0, 1, 0, 0.3
Christian Fischer, Healthy, Det, RW, FA, @Cls, W 4-0, 1, 0, 0, 0, 0, 0, 0, 0, 0, 0, 0, 0, 0, 3, 0, 0, 0.3
Alex Ovechkin, DTD, Wsh, LW, BOWS, Cgy, W 3-2, 1, 0, 0, 0, 0, 0, 0, 0, 0, 0, 0, 0, 0, 0, 1, 0, 0.3
Matias Maccelli, Healthy, Ari, LW, FA, @NYR, L 1-2, 1, 0, 0, 0, 2, 0, 0, 0, 0, 0, 0, 0, 0, 0, 0, 1, 0.3
Juuso Valimaki, Healthy, Ari, D, FA, @NYR, L 1-2, 1, 0, 0, 0, 0, 0, 0, 0, 0, 0, 0, 0, 0, 0, 1, 0, 0.3
Justin Holl, Healthy, Det, D, FA, @Cls, W 4-0, 1, 0, 0, 1, 2, 0, 0, 0, 0, 0, 0, 0, 0, 0, 0, 0, 0.3
Ryan Lindgren, Healthy, NYR, D, FA, Ari, W 2-1, 1, 0, 0, 0, 2, 0, 0, 0, 0, 0, 0, 0, 0, 2, 1, 0, 0.3
Steven Lorentz, Healthy, Fla, C, FA, @NJ, W 4-3, 1, 0, 0, 0, 0, 0, 0, 0, 0, 0, 0, 0, 0, 0, 1, 0, 0.3
Matt Coronato, Healthy, Cgy, RW, FA, @Wsh, L 2-3, 1, 0, 0, 0, 0, 0, 0, 0, 0, 0, 0, 1, 0, 3, 0, 0, 0.2
Boone Jenner, IR, Cls, C, OXP, Det, L 0-4, 1, 0, 0, 0, 2, 0, 0, 0, 0, 0, 8, 5, 0, 1, 0, 0, 0.2
Filip Chytil, IR, NYR, C- RW, FA, Ari, W 2-1, 1, 0, 0, 0, 0, 0, 0, 0, 0, 0, 4, 4, 0, 2, 0, 0, 0.2
Timo Meier, IR, NJ, LW- RW, SALT, Fla, L 3-4, 1, 0, 0, 0, 4, 0, 0, 0, 0, 0, 0, 0, 0, 1, 0, 1, 0.2
John Klingberg, IR, Tor, D, FA, Chi, L 1-4, 1, 0, 0, -2, 2, 0, 0, 0, 0, 0, 0, 0, 0, 1, 1, 2, 0.2
Jack Roslovic, Healthy, Cls, C- RW, FA, Det, L 0-4, 1, 0, 0, 0, 0, 0, 0, 0, 0, 0, 1, 4, 0, 0, 0, 1, 0.2
Kent Johnson, Healthy, Cls, C, FA, Det, L 0-4, 1, 0, 0, -1, 0, 0, 0, 0, 0, 0, 0, 1, 0, 0, 1, 1, 0.2
Ryan Reaves, IR, Tor, RW, FA, Chi, L 1-4, 1, 0, 0, -1, 0, 0, 0, 0, 0, 0, 0, 0, 0, 1, 2, 0, 0.2
Matt Dumba, Healthy, Ari, D, FA, @NYR, L 1-2, 1, 0, 0, -1, 14, 0, 0, 0, 0, 0, 0, 0, 0, 2, 3, 2, 0.2
Adam Boqvist, Healthy, Cls, D, FA, Det, L 0-4, 1, 0, 0, -2, 0, 0, 0, 0, 0, 0, 0, 0, 0, 1, 0, 2, 0.1
Jake Bean, Healthy, Cls, D, FA, Det, L 0-4, 1, 0, 0, 0, 2, 0, 0, 0, 0, 0, 0, 0, 0, 3, 0, 0, 0.1
Max Domi, Healthy, Tor, C, FA, Chi, L 1-4, 1, 0, 0, 0, 0, 0, 0, 0, 0, 0, 1, 1, 0, 1, 0, 0, 0.1
Erik Gustafsson, Healthy, NYR, D, FA, Ari, W 2-1, 1, 0, 0, 0, 0, 0, 0, 0, 0, 0, 0, 0, 0, 1, 0, 0, 0.1
Andrew Mangiapane, Healthy, Cgy, RW- LW, FA, @Wsh, L 2-3, 1, 0, 0, 0, 0, 0, 0, 0, 0, 0, 0, 0, 0, 1, 0, 0, 0.1
Troy Stecher, Healthy, Ari, D, FA, @NYR, L 1-2, 1, 0, 0, 0, 0, 0, 0, 0, 0, 0, 0, 0, 0, 1, 0, 0, 0.1
A.J. Greer, Healthy, Cgy, LW- RW, FA, @Wsh, L 2-3, 1, 0, 0, 0, 0, 0, 0, 0, 0, 0, 1, 0, 0, 0, 0, 0, 0.1
Luke Hughes, Healthy, NJ, D, SLC, Fla, L 3-4, 1, 0, 0, -1, 0, 0, 0, 0, 0, 0, 0, 0, 0, 1, 0, 1, 0.1
Alexis Lafreniere, Healthy, NYR, LW, FA, Ari, W 2-1, 1, 0, 0, 0, 2, 0, 0, 0, 0, 0, 0, 2, 0, 0, 0, 1, 0.1
Yegor Sharangovich, Healthy, Cgy, C- LW- RW, FA, @Wsh, L 2-3, 1, 0, 0, 0, 0, 0, 0, 0, 0, 0, 2, 3, 0, 2, 0, 0, 0.1
John Marino, Healthy, NJ, D, FA, Fla, L 3-4, 1, 0, 0, -1, 0, 0, 0, 0, 0, 0, 0, 0, 0, 1, 0, 1, 0.1
Curtis Lazar, Healthy, NJ, RW, FA, Fla, L 3-4, 1, 0, 0, -1, 0, 0, 0, 0, 0, 0, 0, 0, 0, 0, 2, 0, 0.1
Zach Werenski, O, Cls, D, ME, Det, L 0-4, --, --, --, --, --, --, --, --, --, --, --, --, --, --, --, --, --
Brandon Montour, Healthy, Fla, D, OXP, @NJ, W 4-3, --, --, --, --, --, --, --, --, --, --, --, --, --, --, --, --, --
Patrick Kane, Healthy, Det, RW, DINK, @Cls, W 4-0, --, --, --, --, --, --, --, --, --, --, --, --, --, --, --, --, --
Jeff Petry, Healthy, Det, D, FA, @Cls, W 4-0, --, --, --, --, --, --, --, --, --, --, --, --, --, --, --, --, --
Aaron Ekblad, Healthy, Fla, D, FA, @NJ, W 4-3, --, --, --, --, --, --, --, --, --, --, --, --, --, --, --, --, --
Sam Bennett, Healthy, Fla, C- LW, FA, @NJ, W 4-3, --, --, --, --, --, --, --, --, --, --, --, --, --, --, --, --, --
Andrew Peeke, Healthy, Cls, D, FA, Det, L 0-4, --, --, --, --, --, --, --, --, --, --, --, --, --, --, --, --, --
Max Pacioretty, Healthy, Wsh, LW, SLC, Cgy, W 3-2, --, --, --, --, --, --, --, --, --, --, --, --, --, --, --, --, --
Robby Fabbri, Healthy, Det, LW- C, FA, @Cls, W 4-0, --, --, --, --, --, --, --, --, --, --, --, --, --, --, --, --, --
Simon Nemec, Healthy, NJ, D, SALT, Fla, L 3-4, --, --, --, --, --, --, --, --, --, --, --, --, --, --, --, --, --
Philipp Kurashev, Healthy, Chi, LW, FA, @Tor, W 4-1, --, --, --, --, --, --, --, --, --, --, --, --, --, --, --, --, --
Dylan Guenther, Healthy, Ari, RW, FA, @NYR, L 1-2, --, --, --, --, --, --, --, --, --, --, --, --, --, --, --, --, --
Michael Carcone, Healthy, Ari, RW, FA, @NYR, L 1-2, --, --, --, --, --, --, --, --, --, --, --, --, --, --, --, --, --
Yegor Chinakhov, Healthy, Cls, RW, FA, Det, L 0-4, --, --, --, --, --, --, --, --, --, --, --, --, --, --, --, --, --
Connor Zary, Healthy, Cgy, C, FA, @Wsh, L 2-3, --, --, --, --, --, --, --, --, --, --, --, --, --, --, --, --, --
David Jiricek, Healthy, Cls, D, FA, Det, L 0-4, 1, 0, 0, 0, 0, 0, 0, 0, 0, 0, 0, 0, 0, 0, 0, 0, 0.0
Jarred Tinordi, Healthy, Chi, D, FA, @Tor, W 4-1, --, --, --, --, --, --, --, --, --, --, --, --, --, --, --, --, --
Anthony Mantha, Healthy, Wsh, RW, FA, Cgy, W 3-2, --, --, --, --, --, --, --, --, --, --, --, --, --, --, --, --, --
Nicholas Robertson, Healthy, Tor, LW, FA, Chi, L 1-4, --, --, --, --, --, --, --, --, --, --, --, --, --, --, --, --, --
Mike Reilly, Healthy, NYI, D, FA, --, --, --, --, --, --, --, --, --, --, --, --, --, --, --, --, --, --, --
Nicklas Backstrom, IR, Wsh, C, FA, Cgy, W 3-2, 1, 0, 0, 0, 0, 0, 0, 0, 0, 0, 5, 10, 0, 2, 1, 0, 0.0
Simon Edvinsson, Healthy, Det, D, FA, @Cls, W 4-0, --, --, --, --, --, --, --, --, --, --, --, --, --, --, --, --, --
Connor Mackey, Healthy, NYR, D, FA, Ari, W 2-1, --, --, --, --, --, --, --, --, --, --, --, --, --, --, --, --, --
Simon Benoit, Healthy, Tor, D, FA, Chi, L 1-4, --, --, --, --, --, --, --, --, --, --, --, --, --, --, --, --, --
Nicolas Aube-Kubel, Healthy, Wsh, RW, FA, Cgy, W 3-2, --, --, --, --, --, --, --, --, --, --, --, --, --, --, --, --, --
Jimmy Vesey, Healthy, NYR, LW, FA, Ari, W 2-1, --, --, --, --, --, --, --, --, --, --, --, --, --, --, --, --, --
Jonathan Toews, Healthy, Chi, C, FA, @Tor, W 4-1, --, --, --, --, --, --, --, --, --, --, --, --, --, --, --, --, --
Jakob Pelletier, Healthy, Cgy, LW, FA, @Wsh, L 2-3, --, --, --, --, --, --, --, --, --, --, --, --, --, --, --, --, --
Conor Timmins, Healthy, Tor, D, FA, Chi, L 1-4, --, --, --, --, --, --, --, --, --, --, --, --, --, --, --, --, --
P.K. Subban, Healthy, NJ, D, FA, Fla, L 3-4, --, --, --, --, --, --, --, --, --, --, --, --, --, --, --, --, --
Nick Blankenburg, IR, Cls, D, FA, Det, L 0-4, --, --, --, --, --, --, --, --, --, --, --, --, --, --, --, --, --
Colin Blackwell, Healthy, Chi, C- RW, FA, @Tor, W 4-1, --, --, --, --, --, --, --, --, --, --, --, --, --, --, --, --, --
Josh Brown, Healthy, Ari, D, FA, @NYR, L 1-2, --, --, --, --, --, --, --, --, --, --, --, --, --, --, --, --, --
Ryan Leonard, Healthy, Wsh, RW, FA, Cgy, W 3-2, --, --, --, --, --, --, --, --, --, --, --, --, --, --, --, --, --
Marco Kasper, Healthy, Det, C, FA, @Cls, W 4-0, --, --, --, --, --, --, --, --, --, --, --, --, --, --, --, --, --
Wayne Simmonds, Healthy, Tor, RW, FA, Chi, L 1-4, --, --, --, --, --, --, --, --, --, --, --, --, --, --, --, --, --
Jonny Brodzinski, Healthy, NYR, C, FA, Ari, W 2-1, --, --, --, --, --, --, --, --, --, --, --, --, --, --, --, --, --
Colin Miller, Healthy, NJ, D, FA, Fla, L 3-4, --, --, --, --, --, --, --, --, --, --, --, --, --, --, --, --, --
Jonatan Berggren, Healthy, Det, RW, FA, @Cls, W 4-0, --, --, --, --, --, --, --, --, --, --, --, --, --, --, --, --, --
Michael Kesselring, Healthy, Ari, D, FA, @NYR, L 1-2, --, --, --, --, --, --, --, --, --, --, --, --, --, --, --, --, --
Bobby McMann, Healthy, Tor, C, FA, Chi, L 1-4, --, --, --, --, --, --, --, --, --, --, --, --, --, --, --, --, --
Oliver Kylington, IR, Cgy, D, FA, @Wsh, L 2-3, --, --, --, --, --, --, --, --, --, --, --, --, --, --, --, --, --
Cole Guttman, Healthy, Chi, C, FA, @Tor, W 4-1, --, --, --, --, --, --, --, --, --, --, --, --, --, --, --, --, --
Zac Jones, Healthy, NYR, D, FA, Ari, W 2-1, --, --, --, --, --, --, --, --, --, --, --, --, --, --, --, --, --
Nate Danielson, Healthy, Det, C, FA, @Cls, W 4-0, --, --, --, --, --, --, --, --, --, --, --, --, --, --, --, --, --
Ivan Miroshnichenko, Healthy, Wsh, LW, FA, Cgy, W 3-2, --, --, --, --, --, --, --, --, --, --, --, --, --, --, --, --, --
Joel Edmundson, Healthy, Wsh, D, FA, Cgy, W 3-2, --, --, --, --, --, --, --, --, --, --, --, --, --, --, --, --, --
Axel Sandin Pellikka, Healthy, Det, D, FA, @Cls, W 4-0, --, --, --, --, --, --, --, --, --, --, --, --, --, --, --, --, --
Oliver Moore, Healthy, Chi, C, FA, @Tor, W 4-1, --, --, --, --, --, --, --, --, --, --, --, --, --, --, --, --, --
Eric Robinson, Healthy, Buf, LW, FA, --, --, --, --, --, --, --, --, --, --, --, --, --, --, --, --, --, --, --
Gabriel Perreault, Healthy, NYR, RW, FA, Ari, W 2-1, --, --, --, --, --, --, --, --, --, --, --, --, --, --, --, --, --
Reese Johnson, Healthy, Chi, RW, FA, @Tor, W 4-1, --, --, --, --, --, --, --, --, --, --, --, --, --, --, --, --, --
Easton Cowan, Healthy, Tor, RW, FA, Chi, L 1-4, --, --, --, --, --, --, --, --, --, --, --, --, --, --, --, --, --
Mackie Samoskevich, Healthy, Fla, LW- RW, FA, @NJ, W 4-3, --, --, --, --, --, --, --, --, --, --, --, --, --, --, --, --, --
Max Willman, Healthy, NJ, C, FA, Fla, L 3-4, --, --, --, --, --, --, --, --, --, --, --, --, --, --, --, --, --
Conor Geekie, Healthy, Ari, C, FA, @NYR, L 1-2, --, --, --, --, --, --, --, --, --, --, --, --, --, --, --, --, --
Eric Staal, Healthy, Fla, C, FA, @NJ, W 4-3, --, --, --, --, --, --, --, --, --, --, --, --, --, --, --, --, --
Frank Nazar, Healthy, Chi, C, FA, @Tor, W 4-1, --, --, --, --, --, --, --, --, --, --, --, --, --, --, --, --, --
Dmitriy Simashev, Healthy, Ari, D, FA, @NYR, L 1-2, --, --, --, --, --, --, --, --, --, --, --, --, --, --, --, --, --
Alexander Yelesin, Healthy, Cgy, D, FA, @Wsh, L 2-3, --, --, --, --, --, --, --, --, --, --, --, --, --, --, --, --, --
Hendrix Lapierre, Healthy, Wsh, C, FA, Cgy, W 3-2, --, --, --, --, --, --, --, --, --, --, --, --, --, --, --, --, --
Jake Muzzin, IR, Tor, D, FA, Chi, L 1-4, --, --, --, --, --, --, --, --, --, --, --, --, --, --, --, --, --
Denton Mateychuk, Healthy, Cls, D, FA, Det, L 0-4, --, --, --, --, --, --, --, --, --, --, --, --, --, --, --, --, --
Michael Stone, Healthy, Cgy, D, FA, @Wsh, L 2-3, --, --, --, --, --, --, --, --, --, --, --, --, --, --, --, --, --
Dennis Wideman, Healthy, Cgy, D, FA, @Wsh, L 2-3, --, --, --, --, --, --, --, --, --, --, --, --, --, --, --, --, --
Egor Yakovlev, Healthy, NJ, D, FA, Fla, L 3-4, --, --, --, --, --, --, --, --, --, --, --, --, --, --, --, --, --
Joe Thornton, Healthy, Fla, C, FA, @NJ, W 4-3, --, --, --, --, --, --, --, --, --, --, --, --, --, --, --, --, --
Daniil But, Healthy, Ari, LW, FA, @NYR, L 1-2, --, --, --, --, --, --, --, --, --, --, --, --, --, --, --, --, --
Isaak Phillips, Healthy, Chi, D, FA, @Tor, W 4-1, --, --, --, --, --, --, --, --, --, --, --, --, --, --, --, --, --
Victor Soderstrom, Healthy, Ari, D, FA, @NYR, L 1-2, --, --, --, --, --, --, --, --, --, --, --, --, --, --, --, --, --
Cal Foote, Healthy, NJ, D, FA, Fla, L 3-4, --, --, --, --, --, --, --, --, --, --, --, --, --, --, --, --, --
William Lagesson, Healthy, Tor, D, FA, Chi, L 1-4, --, --, --, --, --, --, --, --, --, --, --, --, --, --, --, --, --
Jake Christiansen, Healthy, Cls, D, FA, Det, L 0-4, --, --, --, --, --, --, --, --, --, --, --, --, --, --, --, --, --
Jordan Oesterle, Healthy, Cgy, D, FA, @Wsh, L 2-3, --, --, --, --, --, --, --, --, --, --, --, --, --, --, --, --, --
Jasper Weatherby, Healthy, Det, LW, FA, @Cls, W 4-0, --, --, --, --, --, --, --, --, --, --, --, --, --, --, --, --, --
Elmer Soderblom, Healthy, Det, LW- C, FA, @Cls, W 4-0, --, --, --, --, --, --, --, --, --, --, --, --, --, --, --, --, --
Jakub Voracek, IR, Ari, RW, FA, @NYR, L 1-2, --, --, --, --, --, --, --, --, --, --, --, --, --, --, --, --, --
Andrew Cristall, Healthy, Wsh, LW, FA, Cgy, W 3-2, --, --, --, --, --, --, --, --, --, --, --, --, --, --, --, --, --
Tomas Nosek, IR, NJ, C, FA, Fla, L 3-4, --, --, --, --, --, --, --, --, --, --, --, --, --, --, --, --, --
Joey Anderson, Healthy, Chi, RW, FA, @Tor, W 4-1, --, --, --, --, --, --, --, --, --, --, --, --, --, --, --, --, --
Tyce Thompson, Healthy, NYI, RW, FA, --, --, --, --, --, --, --, --, --, --, --, --, --, --, --, --, --, --, --
Nolan Foote, IR, NJ, LW, FA, Fla, L 3-4, --, --, --, --, --, --, --, --, --, --, --, --, --, --, --, --, --
