Brad Malone, Healthy, Edm, LW, FA, Det, W 8-4, --, --, --, --, --, --, --, --, --, --, --, --, --, --, --, --, --
Fredrik Karlstrom, Healthy, Dal, C, FA, Car, W 4-2, --, --, --, --, --, --, --, --, --, --, --, --, --, --, --, --, --
Alexander Burmistrov, Healthy, Van, C, FA, @Chi, W 4-2, --, --, --, --, --, --, --, --, --, --, --, --, --, --, --, --, --
Michael Raffl, Healthy, Dal, LW, FA, Car, W 4-2, --, --, --, --, --, --, --, --, --, --, --, --, --, --, --, --, --
Nate Thompson, Healthy, LA, C, FA, @Buf, L 0-7, --, --, --, --, --, --, --, --, --, --, --, --, --, --, --, --, --
David Gust, Healthy, Chi, RW, FA, Van, L 2-4, --, --, --, --, --, --, --, --, --, --, --, --, --, --, --, --, --
Jason Polin, Healthy, Col, RW, FA, @Wsh, W 6-3, --, --, --, --, --, --, --, --, --, --, --, --, --, --, --, --, --
Gavin Bayreuther, Healthy, Dal, D, FA, Car, W 4-2, --, --, --, --, --, --, --, --, --, --, --, --, --, --, --, --, --
Mattias Norlinder, Healthy, Mon, D, FA, Ana, W 5-0, --, --, --, --, --, --, --, --, --, --, --, --, --, --, --, --, --
Brady Cleveland, Healthy, Det, D, FA, @Edm, L 4-8, --, --, --, --, --, --, --, --, --, --, --, --, --, --, --, --, --
Maxim Strbak, Healthy, Buf, D, FA, LA, W 7-0, --, --, --, --, --, --, --, --, --, --, --, --, --, --, --, --, --
Gabriel Fortier, Healthy, TB, LW, FA, @Bos, W 3-2, --, --, --, --, --, --, --, --, --, --, --, --, --, --, --, --, --
Johan Larsson, Healthy, Wsh, LW, FA, Col, L 3-6, --, --, --, --, --, --, --, --, --, --, --, --, --, --, --, --, --
Lenni Hameenaho, Healthy, NJ, RW, FA, @Nsh, W 4-2, --, --, --, --, --, --, --, --, --, --, --, --, --, --, --, --, --
Trey Fix-Wolansky, Healthy, Cls, RW, FA, @Ott, L 3-6, --, --, --, --, --, --, --, --, --, --, --, --, --, --, --, --, --
"Joel LEsperance", Healthy, Det, C, FA, @Edm, L 4-8, --, --, --, --, --, --, --, --, --, --, --, --, --, --, --, --, --
Brandon Manning, Healthy, Edm, D, FA, Det, W 8-4, --, --, --, --, --, --, --, --, --, --, --, --, --, --, --, --, --
David Farrance, Healthy, Nsh, D, FA, NJ, L 2-4, --, --, --, --, --, --, --, --, --, --, --, --, --, --, --, --, --
Joe Hicketts, Healthy, LA, D, FA, @Buf, L 0-7, --, --, --, --, --, --, --, --, --, --, --, --, --, --, --, --, --
Andreas Borgman, Healthy, Dal, D, FA, Car, W 4-2, --, --, --, --, --, --, --, --, --, --, --, --, --, --, --, --, --
Kevin Gravel, Healthy, Nsh, D, FA, NJ, L 2-4, --, --, --, --, --, --, --, --, --, --, --, --, --, --, --, --, --
Danny DeKeyser, Healthy, Van, D, FA, @Chi, W 4-2, --, --, --, --, --, --, --, --, --, --, --, --, --, --, --, --, --
Ryan Winterton, Healthy, Sea, C, FA, @NYI, W 2-1, --, --, --, --, --, --, --, --, --, --, --, --, --, --, --, --, --
Chase De Leo, Healthy, Ana, C- RW, FA, @Mon, L 0-5, --, --, --, --, --, --, --, --, --, --, --, --, --, --, --, --, --
Ondrej Pavel, Healthy, Col, C, FA, @Wsh, W 6-3, --, --, --, --, --, --, --, --, --, --, --, --, --, --, --, --, --
Nico Myatovic, Healthy, Ana, LW, FA, @Mon, L 0-5, --, --, --, --, --, --, --, --, --, --, --, --, --, --, --, --, --
William Bitten, Healthy, StL, RW, FA, @Tor, L 1-4, --, --, --, --, --, --, --, --, --, --, --, --, --, --, --, --, --
Dominik Simon, Healthy, Ana, LW, FA, @Mon, L 0-5, --, --, --, --, --, --, --, --, --, --, --, --, --, --, --, --, --
Josh Leivo, Healthy, StL, LW, FA, @Tor, L 1-4, --, --, --, --, --, --, --, --, --, --, --, --, --, --, --, --, --
Kole Sherwood, Healthy, Nsh, RW, FA, NJ, L 2-4, --, --, --, --, --, --, --, --, --, --, --, --, --, --, --, --, --
Glenn Gawdin, Healthy, Ana, C, FA, @Mon, L 0-5, --, --, --, --, --, --, --, --, --, --, --, --, --, --, --, --, --
Brooks Laich, Healthy, LA, C, FA, @Buf, L 0-7, --, --, --, --, --, --, --, --, --, --, --, --, --, --, --, --, --
Brady Keeper, Healthy, Mon, D, FA, Ana, W 5-0, --, --, --, --, --, --, --, --, --, --, --, --, --, --, --, --, --
Casey Nelson, Healthy, Buf, D, FA, LA, W 7-0, --, --, --, --, --, --, --, --, --, --, --, --, --, --, --, --, --
Fredrik Claesson, Healthy, TB, D, FA, @Bos, W 3-2, --, --, --, --, --, --, --, --, --, --, --, --, --, --, --, --, --
Victor Antipin, Healthy, Buf, D, FA, LA, W 7-0, --, --, --, --, --, --, --, --, --, --, --, --, --, --, --, --, --
Cameron Schilling, Healthy, Wsh, D, FA, Col, L 3-6, --, --, --, --, --, --, --, --, --, --, --, --, --, --, --, --, --
Lane Pederson, Healthy, Edm, C, FA, Det, W 8-4, --, --, --, --, --, --, --, --, --, --, --, --, --, --, --, --, --
Paul Postma, Healthy, Bos, D, FA, TB, L 2-3, --, --, --, --, --, --, --, --, --, --, --, --, --, --, --, --, --
Kevin Connauton, Healthy, LA, D, FA, @Buf, L 0-7, --, --, --, --, --, --, --, --, --, --, --, --, --, --, --, --, --
Sami Niku, Healthy, Mon, D, FA, Ana, W 5-0, --, --, --, --, --, --, --, --, --, --, --, --, --, --, --, --, --
Mikko Lehtonen, Healthy, Cls, D, FA, @Ott, L 3-6, --, --, --, --, --, --, --, --, --, --, --, --, --, --, --, --, --
Josh Gorges, Healthy, Buf, D, FA, LA, W 7-0, --, --, --, --, --, --, --, --, --, --, --, --, --, --, --, --, --
Chase Priskie, Healthy, Wsh, D, FA, Col, L 3-6, --, --, --, --, --, --, --, --, --, --, --, --, --, --, --, --, --
Pierre-Cedric Labrie, Healthy, TB, LW, FA, @Bos, W 3-2, --, --, --, --, --, --, --, --, --, --, --, --, --, --, --, --, --
Cedric Paquette, Healthy, Mon, C, FA, Ana, W 5-0, --, --, --, --, --, --, --, --, --, --, --, --, --, --, --, --, --
Georgii Merkulov, Healthy, Bos, C, FA, TB, L 2-3, --, --, --, --, --, --, --, --, --, --, --, --, --, --, --, --, --
"Danny ORegan", Healthy, Det, C, FA, @Edm, L 4-8, --, --, --, --, --, --, --, --, --, --, --, --, --, --, --, --, --
Mathias Brome, Healthy, Det, LW, FA, @Edm, L 4-8, --, --, --, --, --, --, --, --, --, --, --, --, --, --, --, --, --
Ondrej Kase, Healthy, Car, RW, FA, @Dal, L 2-4, --, --, --, --, --, --, --, --, --, --, --, --, --, --, --, --, --
Cory Conacher, Healthy, Car, LW, FA, @Dal, L 2-4, --, --, --, --, --, --, --, --, --, --, --, --, --, --, --, --, --
Chase Pearson, Healthy, Det, C, FA, @Edm, L 4-8, --, --, --, --, --, --, --, --, --, --, --, --, --, --, --, --, --
Semyon Der-Arguchintsev, Healthy, Tor, RW, FA, StL, W 4-1, --, --, --, --, --, --, --, --, --, --, --, --, --, --, --, --, --
Brian Gibbons, Healthy, Car, LW, FA, @Dal, L 2-4, --, --, --, --, --, --, --, --, --, --, --, --, --, --, --, --, --
Taro Hirose, Healthy, Det, LW, FA, @Edm, L 4-8, --, --, --, --, --, --, --, --, --, --, --, --, --, --, --, --, --
Brendan Gaunce, Healthy, Cls, C, FA, @Ott, L 3-6, --, --, --, --, --, --, --, --, --, --, --, --, --, --, --, --, --
Jimmy Huntington, Healthy, Wsh, LW, FA, Col, L 3-6, --, --, --, --, --, --, --, --, --, --, --, --, --, --, --, --, --
Yohann Auvitu, Healthy, Edm, D, FA, Det, W 8-4, --, --, --, --, --, --, --, --, --, --, --, --, --, --, --, --, --
Joel Persson, Healthy, Ana, D, FA, @Mon, L 0-5, --, --, --, --, --, --, --, --, --, --, --, --, --, --, --, --, --
Jakub Dvorak, Healthy, LA, D, FA, @Buf, L 0-7, --, --, --, --, --, --, --, --, --, --, --, --, --, --, --, --, --
Brendan Guhle, Healthy, Ana, D, FA, @Mon, L 0-5, --, --, --, --, --, --, --, --, --, --, --, --, --, --, --, --, --
Jason Garrison, Healthy, Chi, D, FA, Van, L 2-4, --, --, --, --, --, --, --, --, --, --, --, --, --, --, --, --, --
Roland McKeown, Healthy, Nsh, D, FA, NJ, L 2-4, --, --, --, --, --, --, --, --, --, --, --, --, --, --, --, --, --
Andrei Mironov, Healthy, Col, D, FA, @Wsh, W 6-3, --, --, --, --, --, --, --, --, --, --, --, --, --, --, --, --, --
Steven Santini, Healthy, LA, D, FA, @Buf, L 0-7, --, --, --, --, --, --, --, --, --, --, --, --, --, --, --, --, --
Oscar Fantenberg, Healthy, Van, D, FA, @Chi, W 4-2, --, --, --, --, --, --, --, --, --, --, --, --, --, --, --, --, --
Mikhail Maltsev, Healthy, LA, LW, FA, @Buf, L 0-7, --, --, --, --, --, --, --, --, --, --, --, --, --, --, --, --, --
Jesper Froden, Healthy, Sea, RW, FA, @NYI, W 2-1, --, --, --, --, --, --, --, --, --, --, --, --, --, --, --, --, --
Martin Misiak, Healthy, Chi, RW, FA, Van, L 2-4, --, --, --, --, --, --, --, --, --, --, --, --, --, --, --, --, --
Kalan Lind, Healthy, Nsh, LW, FA, NJ, L 2-4, --, --, --, --, --, --, --, --, --, --, --, --, --, --, --, --, --
Felix Nilsson, Healthy, Nsh, C, FA, NJ, L 2-4, --, --, --, --, --, --, --, --, --, --, --, --, --, --, --, --, --
Jacob Nilsson, Healthy, Chi, C, FA, Van, L 2-4, --, --, --, --, --, --, --, --, --, --, --, --, --, --, --, --, --
Andrew Agozzino, Healthy, Ana, LW, FA, @Mon, L 0-5, --, --, --, --, --, --, --, --, --, --, --, --, --, --, --, --, --
Dylan Sikura, Healthy, Ana, RW, FA, @Mon, L 0-5, --, --, --, --, --, --, --, --, --, --, --, --, --, --, --, --, --
Ryan Kuffner, Healthy, Edm, LW, FA, Det, W 8-4, --, --, --, --, --, --, --, --, --, --, --, --, --, --, --, --, --
Marc Michaelis, Healthy, Van, LW, FA, @Chi, W 4-2, --, --, --, --, --, --, --, --, --, --, --, --, --, --, --, --, --
Olle Alsing, Healthy, Ott, D, FA, Cls, W 6-3, --, --, --, --, --, --, --, --, --, --, --, --, --, --, --, --, --
Tim Berni, Healthy, Cls, D, FA, @Ott, L 3-6, --, --, --, --, --, --, --, --, --, --, --, --, --, --, --, --, --
Hardy Haman Aktell, Healthy, Wsh, D, FA, Col, L 3-6, --, --, --, --, --, --, --, --, --, --, --, --, --, --, --, --, --
Vincent Iorio, Healthy, Wsh, D, FA, Col, L 3-6, --, --, --, --, --, --, --, --, --, --, --, --, --, --, --, --, --
Maxwell Crozier, Healthy, TB, D, FA, @Bos, W 3-2, --, --, --, --, --, --, --, --, --, --, --, --, --, --, --, --, --
Carl Dahlstrom, Healthy, Tor, D, FA, StL, W 4-1, --, --, --, --, --, --, --, --, --, --, --, --, --, --, --, --, --
Otto Leskinen, Healthy, Mon, D, FA, Ana, W 5-0, --, --, --, --, --, --, --, --, --, --, --, --, --, --, --, --, --
Otto Koivula, Healthy, NYI, LW, FA, Sea, L 1-2, --, --, --, --, --, --, --, --, --, --, --, --, --, --, --, --, --
Jiri Smejkal, Healthy, Ott, LW, FA, Cls, W 6-3, --, --, --, --, --, --, --, --, --, --, --, --, --, --, --, --, --
Jack Rodewald, Healthy, Ott, RW, FA, Cls, W 6-3, --, --, --, --, --, --, --, --, --, --, --, --, --, --, --, --, --
Janne Kuokkanen, Healthy, NJ, LW, FA, @Nsh, W 4-2, --, --, --, --, --, --, --, --, --, --, --, --, --, --, --, --, --
Josh Currie, Healthy, Ott, RW, FA, Cls, W 6-3, --, --, --, --, --, --, --, --, --, --, --, --, --, --, --, --, --
Josh Dunne, Healthy, Cls, C, FA, @Ott, L 3-6, --, --, --, --, --, --, --, --, --, --, --, --, --, --, --, --, --
Kyle Clifford, Healthy, Tor, LW, FA, StL, W 4-1, --, --, --, --, --, --, --, --, --, --, --, --, --, --, --, --, --
Tyler Angle, Healthy, Cls, C, FA, @Ott, L 3-6, --, --, --, --, --, --, --, --, --, --, --, --, --, --, --, --, --
Kyle Criscuolo, Healthy, NJ, C, FA, @Nsh, W 4-2, --, --, --, --, --, --, --, --, --, --, --, --, --, --, --, --, --
Daniel Carr, Healthy, Wsh, LW, FA, Col, L 3-6, --, --, --, --, --, --, --, --, --, --, --, --, --, --, --, --, --
Andy Andreoff, Healthy, NYI, LW, FA, Sea, L 1-2, --, --, --, --, --, --, --, --, --, --, --, --, --, --, --, --, --
Victor Rask, Healthy, Cls, C, FA, @Ott, L 3-6, --, --, --, --, --, --, --, --, --, --, --, --, --, --, --, --, --
Jayden Halbgewachs, Healthy, Car, LW, FA, @Dal, L 2-4, --, --, --, --, --, --, --, --, --, --, --, --, --, --, --, --, --
Callahan Burke, Healthy, Car, C- RW, FA, @Dal, L 2-4, --, --, --, --, --, --, --, --, --, --, --, --, --, --, --, --, --
Philip Holm, Healthy, Chi, D, FA, Van, L 2-4, --, --, --, --, --, --, --, --, --, --, --, --, --, --, --, --, --
Wyatt Kalynuk, Healthy, StL, D, FA, @Tor, L 1-4, --, --, --, --, --, --, --, --, --, --, --, --, --, --, --, --, --
Jakub Galvas, Healthy, Chi, D, FA, Van, L 2-4, --, --, --, --, --, --, --, --, --, --, --, --, --, --, --, --, --
Greg Pateryn, Healthy, Ana, D, FA, @Mon, L 0-5, --, --, --, --, --, --, --, --, --, --, --, --, --, --, --, --, --
Christian Wolanin, Healthy, Van, D, FA, @Chi, W 4-2, --, --, --, --, --, --, --, --, --, --, --, --, --, --, --, --, --
Ben Gleason, Healthy, Edm, D, FA, Det, W 8-4, --, --, --, --, --, --, --, --, --, --, --, --, --, --, --, --, --
Nick Lappin, Healthy, StL, RW, FA, @Tor, L 1-4, --, --, --, --, --, --, --, --, --, --, --, --, --, --, --, --, --
Jared Boll, Healthy, Ana, RW, FA, @Mon, L 0-5, --, --, --, --, --, --, --, --, --, --, --, --, --, --, --, --, --
Anton Wedin, Healthy, Chi, LW, FA, Van, L 2-4, --, --, --, --, --, --, --, --, --, --, --, --, --, --, --, --, --
Juho Lammikko, Healthy, Van, RW, FA, @Chi, W 4-2, --, --, --, --, --, --, --, --, --, --, --, --, --, --, --, --, --
Tim Schaller, Healthy, Van, LW, FA, @Chi, W 4-2, --, --, --, --, --, --, --, --, --, --, --, --, --, --, --, --, --
Seth Griffith, Healthy, Edm, C, FA, Det, W 8-4, --, --, --, --, --, --, --, --, --, --, --, --, --, --, --, --, --
Riley Barber, Healthy, Dal, RW, FA, Car, W 4-2, --, --, --, --, --, --, --, --, --, --, --, --, --, --, --, --, --
Dominik Kahun, Healthy, Edm, C, FA, Det, W 8-4, --, --, --, --, --, --, --, --, --, --, --, --, --, --, --, --, --
Sheldon Dries, Healthy, Van, C, FA, @Chi, W 4-2, --, --, --, --, --, --, --, --, --, --, --, --, --, --, --, --, --
T.J. Tynan, Healthy, LA, C, FA, @Buf, L 0-7, --, --, --, --, --, --, --, --, --, --, --, --, --, --, --, --, --
Brad Richardson, Healthy, Van, RW, FA, @Chi, W 4-2, --, --, --, --, --, --, --, --, --, --, --, --, --, --, --, --, --
Justin Kloos, Healthy, Ana, C, FA, @Mon, L 0-5, --, --, --, --, --, --, --, --, --, --, --, --, --, --, --, --, --
Libor Sulak, Healthy, Det, D, FA, @Edm, L 4-8, --, --, --, --, --, --, --, --, --, --, --, --, --, --, --, --, --
Declan Carlile, Healthy, TB, D, FA, @Bos, W 3-2, --, --, --, --, --, --, --, --, --, --, --, --, --, --, --, --, --
Frederic Allard, Healthy, Mon, D, FA, Ana, W 5-0, --, --, --, --, --, --, --, --, --, --, --, --, --, --, --, --, --
Brogan Rafferty, Healthy, Det, D, FA, @Edm, L 4-8, --, --, --, --, --, --, --, --, --, --, --, --, --, --, --, --, --
Christian Jaros, Healthy, NJ, D, FA, @Nsh, W 4-2, --, --, --, --, --, --, --, --, --, --, --, --, --, --, --, --, --
Alec Regula, Healthy, Bos, D, FA, TB, L 2-3, --, --, --, --, --, --, --, --, --, --, --, --, --, --, --, --, --
Josh Teves, Healthy, Buf, D, FA, LA, W 7-0, --, --, --, --, --, --, --, --, --, --, --, --, --, --, --, --, --
Ethan Prow, Healthy, Buf, D, FA, LA, W 7-0, --, --, --, --, --, --, --, --, --, --, --, --, --, --, --, --, --
Dillon Heatherington, Healthy, Ott, D, FA, Cls, W 6-3, --, --, --, --, --, --, --, --, --, --, --, --, --, --, --, --, --
Robin Salo, Healthy, NYI, D, FA, Sea, L 1-2, --, --, --, --, --, --, --, --, --, --, --, --, --, --, --, --, --
Alexandre Fortin, Healthy, Mon, LW, FA, Ana, W 5-0, --, --, --, --, --, --, --, --, --, --, --, --, --, --, --, --, --
Samuel Laberge, Healthy, NJ, LW, FA, @Nsh, W 4-2, --, --, --, --, --, --, --, --, --, --, --, --, --, --, --, --, --
Tim Gettinger, Healthy, Det, LW, FA, @Edm, L 4-8, --, --, --, --, --, --, --, --, --, --, --, --, --, --, --, --, --
Cameron Hillis, Healthy, Mon, C, FA, Ana, W 5-0, --, --, --, --, --, --, --, --, --, --, --, --, --, --, --, --, --
Hayden Hodgson, Healthy, LA, RW, FA, @Buf, L 0-7, --, --, --, --, --, --, --, --, --, --, --, --, --, --, --, --, --
Micheal Haley, Healthy, Ott, C, FA, Cls, W 6-3, --, --, --, --, --, --, --, --, --, --, --, --, --, --, --, --, --
Hunter McKown, Healthy, Cls, C, FA, @Ott, L 3-6, --, --, --, --, --, --, --, --, --, --, --, --, --, --, --, --, --
Richard Panik, Healthy, NYI, RW, FA, Sea, L 1-2, --, --, --, --, --, --, --, --, --, --, --, --, --, --, --, --, --
Nikita Soshnikov, Healthy, NYI, RW, FA, Sea, L 1-2, --, --, --, --, --, --, --, --, --, --, --, --, --, --, --, --, --
Lias Andersson, Healthy, Mon, C, FA, Ana, W 5-0, --, --, --, --, --, --, --, --, --, --, --, --, --, --, --, --, --
Leo Komarov, Healthy, NYI, LW, FA, Sea, L 1-2, --, --, --, --, --, --, --, --, --, --, --, --, --, --, --, --, --
Ben Street, Healthy, NJ, C, FA, @Nsh, W 4-2, --, --, --, --, --, --, --, --, --, --, --, --, --, --, --, --, --
Carter Rowney, Healthy, Det, RW, FA, @Edm, L 4-8, --, --, --, --, --, --, --, --, --, --, --, --, --, --, --, --, --
Henrik Borgstrom, Healthy, Wsh, C, FA, Col, L 3-6, --, --, --, --, --, --, --, --, --, --, --, --, --, --, --, --, --
Matt Luff, Healthy, Det, RW, FA, @Edm, L 4-8, --, --, --, --, --, --, --, --, --, --, --, --, --, --, --, --, --
Michael Blunden, Healthy, Ott, RW, FA, Cls, W 6-3, --, --, --, --, --, --, --, --, --, --, --, --, --, --, --, --, --
Emil Heineman, Healthy, Mon, LW, FA, Ana, W 5-0, --, --, --, --, --, --, --, --, --, --, --, --, --, --, --, --, --
Stefan Matteau, Healthy, Cls, C, FA, @Ott, L 3-6, --, --, --, --, --, --, --, --, --, --, --, --, --, --, --, --, --
Philip Kemp, Healthy, Edm, D, FA, Det, W 8-4, --, --, --, --, --, --, --, --, --, --, --, --, --, --, --, --, --
Matt Tennyson, Healthy, Sea, D, FA, @NYI, W 2-1, --, --, --, --, --, --, --, --, --, --, --, --, --, --, --, --, --
Corey Schueneman, Healthy, Col, D, FA, @Wsh, W 6-3, --, --, --, --, --, --, --, --, --, --, --, --, --, --, --, --, --
Bryce Kindopp, Healthy, Ana, RW, FA, @Mon, L 0-5, --, --, --, --, --, --, --, --, --, --, --, --, --, --, --, --, --
Joakim Nygard, Healthy, Edm, LW, FA, Det, W 8-4, --, --, --, --, --, --, --, --, --, --, --, --, --, --, --, --, --
Chris DiDomenico, Healthy, Chi, LW, FA, Van, L 2-4, --, --, --, --, --, --, --, --, --, --, --, --, --, --, --, --, --
Andrew Crescenzi, Healthy, LA, C, FA, @Buf, L 0-7, --, --, --, --, --, --, --, --, --, --, --, --, --, --, --, --, --
Matthew Peca, Healthy, StL, LW, FA, @Tor, L 1-4, --, --, --, --, --, --, --, --, --, --, --, --, --, --, --, --, --
Gaetan Haas, Healthy, Edm, C, FA, Det, W 8-4, --, --, --, --, --, --, --, --, --, --, --, --, --, --, --, --, --
Riley Damiani, Healthy, Cgy, C, FA, --, --, --, --, --, --, --, --, --, --, --, --, --, --, --, --, --, --, --
Tanner Kero, Healthy, Col, C, FA, @Wsh, W 6-3, --, --, --, --, --, --, --, --, --, --, --, --, --, --, --, --, --
Victor Ejdsell, Healthy, Chi, C, FA, Van, L 2-4, --, --, --, --, --, --, --, --, --, --, --, --, --, --, --, --, --
Dennis Rasmussen, Healthy, Ana, C, FA, @Mon, L 0-5, --, --, --, --, --, --, --, --, --, --, --, --, --, --, --, --, --
Jakub Jerabek, Healthy, Wsh, D, FA, Col, L 3-6, --, --, --, --, --, --, --, --, --, --, --, --, --, --, --, --, --
Jack Thompson, Healthy, TB, D, FA, @Bos, W 3-2, --, --, --, --, --, --, --, --, --, --, --, --, --, --, --, --, --
Lawrence Pilut, Healthy, Buf, D, FA, LA, W 7-0, --, --, --, --, --, --, --, --, --, --, --, --, --, --, --, --, --
Erik Burgdoerfer, Healthy, Wsh, D, FA, Col, L 3-6, --, --, --, --, --, --, --, --, --, --, --, --, --, --, --, --, --
Nikolas Matinpalo, Healthy, Ott, D, FA, Cls, W 6-3, --, --, --, --, --, --, --, --, --, --, --, --, --, --, --, --, --
Filip Kral, Healthy, Tor, D, FA, StL, W 4-1, --, --, --, --, --, --, --, --, --, --, --, --, --, --, --, --, --
Dennis Cholowski, Healthy, NYI, D, FA, Sea, L 1-2, --, --, --, --, --, --, --, --, --, --, --, --, --, --, --, --, --
Tyler Lewington, Healthy, Bos, D, FA, TB, L 2-3, --, --, --, --, --, --, --, --, --, --, --, --, --, --, --, --, --
Justin Richards, Healthy, Buf, C, FA, LA, W 7-0, --, --, --, --, --, --, --, --, --, --, --, --, --, --, --, --, --
Joseph Gambardella, Healthy, NJ, LW, FA, @Nsh, W 4-2, --, --, --, --, --, --, --, --, --, --, --, --, --, --, --, --, --
Mathieu Perreault, Healthy, Mon, C, FA, Ana, W 5-0, --, --, --, --, --, --, --, --, --, --, --, --, --, --, --, --, --
Zach Senyshyn, Healthy, NJ, RW, FA, @Nsh, W 4-2, --, --, --, --, --, --, --, --, --, --, --, --, --, --, --, --, --
Philippe Maillet, Healthy, Mon, C, FA, Ana, W 5-0, --, --, --, --, --, --, --, --, --, --, --, --, --, --, --, --, --
Matt Read, Healthy, Tor, RW, FA, StL, W 4-1, --, --, --, --, --, --, --, --, --, --, --, --, --, --, --, --, --
Michael Dal Colle, Healthy, Ott, LW, FA, Cls, W 6-3, --, --, --, --, --, --, --, --, --, --, --, --, --, --, --, --, --
Ryan MacInnis, Healthy, Buf, C, FA, LA, W 7-0, --, --, --, --, --, --, --, --, --, --, --, --, --, --, --, --, --
Remi Elie, Healthy, TB, LW, FA, @Bos, W 3-2, --, --, --, --, --, --, --, --, --, --, --, --, --, --, --, --, --
Antti Suomela, Healthy, Tor, C, FA, StL, W 4-1, --, --, --, --, --, --, --, --, --, --, --, --, --, --, --, --, --
Logan Shaw, Healthy, Tor, RW, FA, StL, W 4-1, --, --, --, --, --, --, --, --, --, --, --, --, --, --, --, --, --
Gage Goncalves, Healthy, TB, C, FA, @Bos, W 3-2, --, --, --, --, --, --, --, --, --, --, --, --, --, --, --, --, --
Lassi Thomson, Healthy, Ott, D, FA, Cls, W 6-3, --, --, --, --, --, --, --, --, --, --, --, --, --, --, --, --, --
Jimmy Schuldt, Healthy, Sea, D, FA, @NYI, W 2-1, --, --, --, --, --, --, --, --, --, --, --, --, --, --, --, --, --
Daniel Brickley, Healthy, LA, D, FA, @Buf, L 0-7, --, --, --, --, --, --, --, --, --, --, --, --, --, --, --, --, --
Colton Sceviour, Healthy, Edm, RW, FA, Det, W 8-4, --, --, --, --, --, --, --, --, --, --, --, --, --, --, --, --, --
Brendan Perlini, Healthy, Edm, LW, FA, Det, W 8-4, --, --, --, --, --, --, --, --, --, --, --, --, --, --, --, --, --
Kalle Kossila, Healthy, Ana, LW, FA, @Mon, L 0-5, --, --, --, --, --, --, --, --, --, --, --, --, --, --, --, --, --
Dean Kukan, Healthy, Cls, D, FA, @Ott, L 3-6, --, --, --, --, --, --, --, --, --, --, --, --, --, --, --, --, --
Stefan Elliott, Healthy, Ott, D, FA, Cls, W 6-3, --, --, --, --, --, --, --, --, --, --, --, --, --, --, --, --, --
Christian Folin, Healthy, Mon, D, FA, Ana, W 5-0, --, --, --, --, --, --, --, --, --, --, --, --, --, --, --, --, --
Stephen Gionta, Healthy, NYI, RW, FA, Sea, L 1-2, --, --, --, --, --, --, --, --, --, --, --, --, --, --, --, --, --
Graeme Clarke, Healthy, NJ, RW, FA, @Nsh, W 4-2, --, --, --, --, --, --, --, --, --, --, --, --, --, --, --, --, --
Gregory Hofmann, Healthy, Cls, LW, FA, @Ott, L 3-6, --, --, --, --, --, --, --, --, --, --, --, --, --, --, --, --, --
Wade Megan, Healthy, Det, C, FA, @Edm, L 4-8, --, --, --, --, --, --, --, --, --, --, --, --, --, --, --, --, --
Riley Sheahan, Healthy, Buf, C, FA, LA, W 7-0, --, --, --, --, --, --, --, --, --, --, --, --, --, --, --, --, --
Cole Bardreau, Healthy, NYI, RW, FA, Sea, L 1-2, --, --, --, --, --, --, --, --, --, --, --, --, --, --, --, --, --
Arnaud Durandeau, Healthy, NJ, LW, FA, @Nsh, W 4-2, --, --, --, --, --, --, --, --, --, --, --, --, --, --, --, --, --
Viktor Lodin, Healthy, Ott, LW, FA, Cls, W 6-3, --, --, --, --, --, --, --, --, --, --, --, --, --, --, --, --, --
Karson Kuhlman, Healthy, NYI, C, FA, Sea, L 1-2, --, --, --, --, --, --, --, --, --, --, --, --, --, --, --, --, --
Kirill Semyonov, Healthy, Tor, C, FA, StL, W 4-1, --, --, --, --, --, --, --, --, --, --, --, --, --, --, --, --, --
Rocco Grimaldi, Healthy, Ana, LW- C- RW, FA, @Mon, L 0-5, --, --, --, --, --, --, --, --, --, --, --, --, --, --, --, --, --
Blake Comeau, Healthy, Dal, LW, FA, Car, W 4-2, --, --, --, --, --, --, --, --, --, --, --, --, --, --, --, --, --
Samuel Knazko, Healthy, Cls, D, FA, @Ott, L 3-6, --, --, --, --, --, --, --, --, --, --, --, --, --, --, --, --, --
Dan Renouf, Healthy, Bos, D, FA, TB, L 2-3, --, --, --, --, --, --, --, --, --, --, --, --, --, --, --, --, --
Garrett Pilon, Healthy, Ott, C, FA, Cls, W 6-3, --, --, --, --, --, --, --, --, --, --, --, --, --, --, --, --, --
Danick Martel, Healthy, Mon, C, FA, Ana, W 5-0, --, --, --, --, --, --, --, --, --, --, --, --, --, --, --, --, --
Joona Luoto, Healthy, Cls, RW, FA, @Ott, L 3-6, --, --, --, --, --, --, --, --, --, --, --, --, --, --, --, --, --
Jakob Lilja, Healthy, Cls, LW, FA, @Ott, L 3-6, --, --, --, --, --, --, --, --, --, --, --, --, --, --, --, --, --
Arttu Ruotsalainen, Healthy, Buf, C, FA, LA, W 7-0, --, --, --, --, --, --, --, --, --, --, --, --, --, --, --, --, --
Mark Kastelic, Healthy, Ott, C, FA, Cls, W 6-3, 1, 0, 0, 0, 0, 0, 0, 0, 0, 0, 2, 3, 0, 1, 0, 0, -2.78
Colton Parayko, Healthy, StL, D, ME, @Tor, L 1-4, 1, 0, 0, -1, 2, 0, 0, 0, 0, 0, 0, 0, 0, 1, 2, 0, -5.55
Fredrik Olofsson, Healthy, Col, LW, FA, @Wsh, W 6-3, 1, 0, 0, -1, 0, 0, 0, 0, 0, 0, 5, 3, 0, 0, 1, 0, -5.55
Jordan Kyrou, Healthy, StL, RW- LW, CLB, @Tor, L 1-4, 1, 0, 0, -2, 0, 0, 0, 0, 0, 0, 0, 0, 0, 1, 3, 0, -1.11
Jaycob Megna, Healthy, Chi, D, FA, Van, L 2-4, 1, 0, 0, -1, 0, 0, 0, 0, 0, 0, 0, 0, 0, 1, 1, 0, -0.1
Cam Fowler, Healthy, Ana, D, FA, @Mon, L 0-5, 1, 0, 0, -1, 2, 0, 0, 0, 0, 0, 0, 0, 0, 1, 0, 1, -0.1
Sean Kuraly, DTD, Cls, C, FA, @Ott, L 3-6, 1, 0, 0, -1, 0, 0, 0, 0, 0, 0, 3, 7, 0, 0, 1, 1, -0.1
Mikey Anderson, Healthy, LA, D, FA, @Buf, L 0-7, 1, 0, 0, -3, 0, 0, 0, 0, 0, 0, 0, 0, 0, 0, 3, 1, -0.1
Shayne Gostisbehere, Healthy, Det, D, FA, @Edm, L 4-8, 1, 0, 0, -1, 0, 0, 0, 0, 0, 0, 0, 0, 0, 3, 0, 0, -0.2
Ryan Strome, Healthy, Ana, C, FA, @Mon, L 0-5, 1, 0, 0, -2, 0, 0, 0, 0, 0, 0, 2, 1, 0, 1, 2, 0, -0.2
Nathan Bastian, IR, NJ, RW, FA, @Nsh, W 4-2, 1, 0, 0, -1, 2, 0, 0, 0, 0, 0, 0, 1, 0, 0, 2, 0, -0.2
Andrew Copp, Healthy, Det, C, FA, @Edm, L 4-8, 1, 0, 0, -2, 0, 0, 0, 0, 0, 0, 4, 10, 0, 0, 3, 1, -0.2
Robert Thomas, Healthy, StL, C, OXP, @Tor, L 1-4, 1, 0, 0, -2, 0, 0, 0, 0, 0, 0, 8, 10, 0, 1, 1, 1, -0.3
Quinton Byfield, Healthy, LA, C- LW, SLC, @Buf, L 0-7, 1, 0, 0, -1, 0, 0, 0, 0, 0, 0, 0, 0, 0, 2, 0, 0, -0.3
Colton Sissons, Healthy, Nsh, C, FA, NJ, L 2-4, 1, 0, 0, 0, 0, 0, 0, 0, 0, 0, 3, 9, 0, 0, 1, 0, -0.3
Mark Jankowski, Healthy, Nsh, C, FA, NJ, L 2-4, 1, 0, 0, -1, 0, 0, 0, 0, 0, 0, 3, 3, 0, 2, 0, 0, -0.3
Zach Sanford, Healthy, Chi, LW, FA, Van, L 2-4, 1, 0, 0, 0, 0, 0, 0, 0, 0, 0, 2, 5, 0, 0, 0, 0, -0.3
Kevin Hayes, Healthy, StL, C, FA, @Tor, L 1-4, 1, 0, 0, 0, 0, 0, 0, 0, 0, 0, 2, 6, 0, 1, 0, 0, -0.3
Sam Lafferty, Healthy, Van, C, FA, @Chi, W 4-2, 1, 0, 0, 0, 2, 0, 0, 0, 0, 0, 5, 8, 0, 2, 0, 0, -0.3
Kevin Fiala, Healthy, LA, LW- RW, SLC, @Buf, L 0-7, 1, 0, 0, -1, 0, 0, 0, 0, 0, 0, 0, 0, 0, 1, 0, 0, -0.4
Troy Terry, Healthy, Ana, C- RW, FA, @Mon, L 0-5, 1, 0, 0, -1, 0, 0, 0, 0, 0, 0, 1, 0, 0, 0, 0, 0, -0.4
Joel Edmundson, O, Tor, D, FA, StL, W 4-1, 1, 0, 0, -2, 0, 0, 0, 0, 0, 0, 0, 0, 0, 0, 2, 0, -0.4
