Evan Bouchard, Healthy, Edm, D, DINK, --, --, --, --, --, --, --, --, --, --, --, --, --, --, --, --, --, --, --
Alex Pietrangelo, Healthy, Vgk, D, DINK, --, --, --, --, --, --, --, --, --, --, --, --, --, --, --, --, --, --, --
Tim Stutzle, Healthy, Ott, C- LW, LKR, --, --, --, --, --, --, --, --, --, --, --, --, --, --, --, --, --, --, --
Travis Konecny, Healthy, Phi, RW, SLC, --, --, --, --, --, --, --, --, --, --, --, --, --, --, --, --, --, --, --
Joel Eriksson Ek, Healthy, Min, C, OXP, --, --, --, --, --, --, --, --, --, --, --, --, --, --, --, --, --, --, --
Tage Thompson, DTD, Buf, C, ME, --, --, --, --, --, --, --, --, --, --, --, --, --, --, --, --, --, --, --
Bo Horvat, Healthy, NYI, C, DINK, --, --, --, --, --, --, --, --, --, --, --, --, --, --, --, --, --, --, --
Adrian Kempe, Healthy, LA, RW- LW, BOWS, --, --, --, --, --, --, --, --, --, --, --, --, --, --, --, --, --, --, --
Roope Hintz, Healthy, Dal, C, ME, --, --, --, --, --, --, --, --, --, --, --, --, --, --, --, --, --, --, --
Zach Hyman, Healthy, Edm, RW- LW, BBS, --, --, --, --, --, --, --, --, --, --, --, --, --, --, --, --, --, --, --
Kyle Connor, IR, Wpg, LW, BBS, --, --, --, --, --, --, --, --, --, --, --, --, --, --, --, --, --, --, --
Filip Forsberg, Healthy, Nsh, LW, LKR, --, --, --, --, --, --, --, --, --, --, --, --, --, --, --, --, --, --, --
Brock Boeser, Healthy, Van, RW, BOWS, --, --, --, --, --, --, --, --, --, --, --, --, --, --, --, --, --, --, --
Ryan Nugent-Hopkins, Healthy, Edm, C, ME, --, --, --, --, --, --, --, --, --, --, --, --, --, --, --, --, --, --, --
Brad Marchand, Healthy, Bos, LW, DINK, --, --, --, --, --, --, --, --, --, --, --, --, --, --, --, --, --, --, --
Darnell Nurse, Healthy, Edm, D, OXP, --, --, --, --, --, --, --, --, --, --, --, --, --, --, --, --, --, --, --
Miro Heiskanen, O, Dal, D, LKR, --, --, --, --, --, --, --, --, --, --, --, --, --, --, --, --, --, --, --
Cole Caufield, Healthy, Mon, LW- RW, LKR, --, --, --, --, --, --, --, --, --, --, --, --, --, --, --, --, --, --, --
Kris Letang, Healthy, Pit, D, HERB, --, --, --, --, --, --, --, --, --, --, --, --, --, --, --, --, --, --, --
Mike Matheson, Healthy, Mon, D, CLB, --, --, --, --, --, --, --, --, --, --, --, --, --, --, --, --, --, --, --
Andrei Svechnikov, Healthy, Car, LW, HERB, --, --, --, --, --, --, --, --, --, --, --, --, --, --, --, --, --, --, --
Frank Vatrano, Healthy, Ana, RW- LW, LKR, --, --, --, --, --, --, --, --, --, --, --, --, --, --, --, --, --, --, --
Evgeni Malkin, Healthy, Pit, C, DINK, --, --, --, --, --, --, --, --, --, --, --, --, --, --, --, --, --, --, --
Joe Pavelski, Healthy, Dal, RW, DINK, --, --, --, --, --, --, --, --, --, --, --, --, --, --, --, --, --, --, --
Mikhail Sergachev, IR, TB, D, SLC, --, --, --, --, --, --, --, --, --, --, --, --, --, --, --, --, --, --, --
Kevin Fiala, Healthy, LA, LW- RW, SLC, --, --, --, --, --, --, --, --, --, --, --, --, --, --, --, --, --, --, --
Mark Scheifele, DTD, Wpg, C, ME, --, --, --, --, --, --, --, --, --, --, --, --, --, --, --, --, --, --, --
Nick Suzuki, Healthy, Mon, C, CLB, --, --, --, --, --, --, --, --, --, --, --, --, --, --, --, --, --, --, --
Anze Kopitar, Healthy, LA, C, BBS, --, --, --, --, --, --, --, --, --, --, --, --, --, --, --, --, --, --, --
Brandon Hagel, Healthy, TB, LW, HERB, --, --, --, --, --, --, --, --, --, --, --, --, --, --, --, --, --, --, --
Vince Dunn, Healthy, Sea, D, BOWS, --, --, --, --, --, --, --, --, --, --, --, --, --, --, --, --, --, --, --
Valeri Nichushkin, Healthy, Col, RW, SALT, --, --, --, --, --, --, --, --, --, --, --, --, --, --, --, --, --, --, --
Mathew Barzal, Healthy, NYI, C, LKR, --, --, --, --, --, --, --, --, --, --, --, --, --, --, --, --, --, --, --
Alex Tuch, Healthy, Buf, RW, ME, --, --, --, --, --, --, --, --, --, --, --, --, --, --, --, --, --, --, --
Mark Stone, Healthy, Vgk, RW, BBS, --, --, --, --, --, --, --, --, --, --, --, --, --, --, --, --, --, --, --
Jordan Kyrou, Healthy, StL, RW- LW, FA, --, --, --, --, --, --, --, --, --, --, --, --, --, --, --, --, --, --, --
Devon Toews, Healthy, Col, D, BBS, --, --, --, --, --, --, --, --, --, --, --, --, --, --, --, --, --, --, --
Brayden McNabb, Healthy, Vgk, D, LKR, --, --, --, --, --, --, --, --, --, --, --, --, --, --, --, --, --, --, --
Robert Thomas, Healthy, StL, C, OXP, --, --, --, --, --, --, --, --, --, --, --, --, --, --, --, --, --, --, --
Jonathan Marchessault, Healthy, Vgk, RW- LW, FA, --, --, --, --, --, --, --, --, --, --, --, --, --, --, --, --, --, --, --
Filip Hronek, Healthy, Van, D, BBS, --, --, --, --, --, --, --, --, --, --, --, --, --, --, --, --, --, --, --
Brock Nelson, Healthy, NYI, C, CLB, --, --, --, --, --, --, --, --, --, --, --, --, --, --, --, --, --, --, --
Eeli Tolvanen, Healthy, Sea, LW- RW, SALT, --, --, --, --, --, --, --, --, --, --, --, --, --, --, --, --, --, --, --
Brent Burns, Healthy, Car, D, FA, --, --, --, --, --, --, --, --, --, --, --, --, --, --, --, --, --, --, --
Owen Tippett, Healthy, Phi, RW, BOWS, --, --, --, --, --, --, --, --, --, --, --, --, --, --, --, --, --, --, --
Tomas Hertl, Healthy, SJ, C- LW, ME, --, --, --, --, --, --, --, --, --, --, --, --, --, --, --, --, --, --, --
Mats Zuccarello, Healthy, Min, RW, FA, --, --, --, --, --, --, --, --, --, --, --, --, --, --, --, --, --, --, --
Adam Larsson, Healthy, Sea, D, BOWS, --, --, --, --, --, --, --, --, --, --, --, --, --, --, --, --, --, --, --
"Ryan OReilly", Healthy, Nsh, C, BOWS, --, --, --, --, --, --, --, --, --, --, --, --, --, --, --, --, --, --, --
Evander Kane, Healthy, Edm, LW, OXP, --, --, --, --, --, --, --, --, --, --, --, --, --, --, --, --, --, --, --
Shea Theodore, IR, Vgk, D, BBS, --, --, --, --, --, --, --, --, --, --, --, --, --, --, --, --, --, --, --
Jared McCann, Healthy, Sea, RW- C- LW, FA, --, --, --, --, --, --, --, --, --, --, --, --, --, --, --, --, --, --, --
Matt Boldy, Healthy, Min, LW, FA, --, --, --, --, --, --, --, --, --, --, --, --, --, --, --, --, --, --, --
Justin Faulk, Healthy, StL, D, CLB, --, --, --, --, --, --, --, --, --, --, --, --, --, --, --, --, --, --, --
Vladimir Tarasenko, Healthy, Ott, RW, ME, --, --, --, --, --, --, --, --, --, --, --, --, --, --, --, --, --, --, --
Jeff Skinner, O, Buf, LW, CLB, --, --, --, --, --, --, --, --, --, --, --, --, --, --, --, --, --, --, --
Pavel Buchnevich, Healthy, StL, RW- C- LW, DINK, --, --, --, --, --, --, --, --, --, --, --, --, --, --, --, --, --, --, --
Drew Doughty, Healthy, LA, D, BBS, --, --, --, --, --, --, --, --, --, --, --, --, --, --, --, --, --, --, --
Martin Necas, DTD, Car, RW- C, FA, --, --, --, --, --, --, --, --, --, --, --, --, --, --, --, --, --, --, --
Josh Norris, O, Ott, C, FA, --, --, --, --, --, --, --, --, --, --, --, --, --, --, --, --, --, --, --
Travis Sanheim, Healthy, Phi, D, ME, --, --, --, --, --, --, --, --, --, --, --, --, --, --, --, --, --, --, --
Drake Batherson, Healthy, Ott, RW, FA, --, --, --, --, --, --, --, --, --, --, --, --, --, --, --, --, --, --, --
Jake Sanderson, Healthy, Ott, D, ME, --, --, --, --, --, --, --, --, --, --, --, --, --, --, --, --, --, --, --
Pierre-Luc Dubois, Healthy, LA, C, FA, --, --, --, --, --, --, --, --, --, --, --, --, --, --, --, --, --, --, --
Sean Couturier, Healthy, Phi, C, CLB, --, --, --, --, --, --, --, --, --, --, --, --, --, --, --, --, --, --, --
Colton Parayko, Healthy, StL, D, ME, --, --, --, --, --, --, --, --, --, --, --, --, --, --, --, --, --, --, --
Thomas Chabot, Healthy, Ott, D, ME, --, --, --, --, --, --, --, --, --, --, --, --, --, --, --, --, --, --, --
William Karlsson, IR, Vgk, C, HERB, --, --, --, --, --, --, --, --, --, --, --, --, --, --, --, --, --, --, --
Dylan Cozens, Healthy, Buf, C, FA, --, --, --, --, --, --, --, --, --, --, --, --, --, --, --, --, --, --, --
Jamie Benn, Healthy, Dal, LW, OXP, --, --, --, --, --, --, --, --, --, --, --, --, --, --, --, --, --, --, --
Claude Giroux, Healthy, Ott, RW- C, SALT, --, --, --, --, --, --, --, --, --, --, --, --, --, --, --, --, --, --, --
Matt Duchene, Healthy, Dal, C, SLC, --, --, --, --, --, --, --, --, --, --, --, --, --, --, --, --, --, --, --
Neal Pionk, Healthy, Wpg, D, CLB, --, --, --, --, --, --, --, --, --, --, --, --, --, --, --, --, --, --, --
Bowen Byram, IR, Col, D, FA, --, --, --, --, --, --, --, --, --, --, --, --, --, --, --, --, --, --, --
Andrei Kuzmenko, Healthy, Van, LW- RW, FA, --, --, --, --, --, --, --, --, --, --, --, --, --, --, --, --, --, --, --
Seth Jarvis, Healthy, Car, RW- C, BBS, --, --, --, --, --, --, --, --, --, --, --, --, --, --, --, --, --, --, --
Ivan Barbashev, Healthy, Vgk, LW- C- RW, FA, --, --, --, --, --, --, --, --, --, --, --, --, --, --, --, --, --, --, --
Trevor Moore, Healthy, LA, LW, OXP, --, --, --, --, --, --, --, --, --, --, --, --, --, --, --, --, --, --, --
Mason McTavish, Healthy, Ana, C- LW, BOWS, --, --, --, --, --, --, --, --, --, --, --, --, --, --, --, --, --, --, --
Jake DeBrusk, Healthy, Bos, RW- LW, LKR, --, --, --, --, --, --, --, --, --, --, --, --, --, --, --, --, --, --, --
Jaccob Slavin, Healthy, Car, D, OXP, --, --, --, --, --, --, --, --, --, --, --, --, --, --, --, --, --, --, --
Nikolaj Ehlers, DTD, Wpg, LW, HERB, --, --, --, --, --, --, --, --, --, --, --, --, --, --, --, --, --, --, --
Hampus Lindholm, Healthy, Bos, D, FA, --, --, --, --, --, --, --, --, --, --, --, --, --, --, --, --, --, --, --
Juraj Slafkovsky, Healthy, Mon, LW, FA, --, --, --, --, --, --, --, --, --, --, --, --, --, --, --, --, --, --, --
Trevor Zegras, IR, Ana, C, FA, --, --, --, --, --, --, --, --, --, --, --, --, --, --, --, --, --, --, --
Brady Skjei, Healthy, Car, D, FA, --, --, --, --, --, --, --, --, --, --, --, --, --, --, --, --, --, --, --
Gabriel Vilardi, Healthy, Wpg, C, SALT, --, --, --, --, --, --, --, --, --, --, --, --, --, --, --, --, --, --, --
Bryan Rust, Healthy, Pit, RW, DINK, --, --, --, --, --, --, --, --, --, --, --, --, --, --, --, --, --, --, --
Charlie Coyle, Healthy, Bos, C, OXP, --, --, --, --, --, --, --, --, --, --, --, --, --, --, --, --, --, --, --
Artturi Lehkonen, IR, Col, LW, FA, --, --, --, --, --, --, --, --, --, --, --, --, --, --, --, --, --, --, --
Rickard Rakell, Healthy, Pit, RW- C- LW, SALT, --, --, --, --, --, --, --, --, --, --, --, --, --, --, --, --, --, --, --
Matty Beniers, Healthy, Sea, C, FA, --, --, --, --, --, --, --, --, --, --, --, --, --, --, --, --, --, --, --
Tommy Novak, Healthy, Nsh, C, FA, --, --, --, --, --, --, --, --, --, --, --, --, --, --, --, --, --, --, --
David Savard, Healthy, Mon, D, FA, --, --, --, --, --, --, --, --, --, --, --, --, --, --, --, --, --, --, --
Matt Roy, Healthy, LA, D, OXP, --, --, --, --, --, --, --, --, --, --, --, --, --, --, --, --, --, --, --
Phillip Danault, Healthy, LA, C, FA, --, --, --, --, --, --, --, --, --, --, --, --, --, --, --, --, --, --, --
Radko Gudas, Healthy, Ana, D, BOWS, --, --, --, --, --, --, --, --, --, --, --, --, --, --, --, --, --, --, --
Troy Terry, Healthy, Ana, C- RW, FA, --, --, --, --, --, --, --, --, --, --, --, --, --, --, --, --, --, --, --
Ryan Graves, Healthy, Pit, D, FA, --, --, --, --, --, --, --, --, --, --, --, --, --, --, --, --, --, --, --
Cam Fowler, Healthy, Ana, D, FA, --, --, --, --, --, --, --, --, --, --, --, --, --, --, --, --, --, --, --
Jared Spurgeon, IR, Min, D, FA, --, --, --, --, --, --, --, --, --, --, --, --, --, --, --, --, --, --, --
Tyson Barrie, O, Nsh, D, FA, --, --, --, --, --, --, --, --, --, --, --, --, --, --, --, --, --, --, --
Chandler Stephenson, Healthy, Vgk, C, FA, --, --, --, --, --, --, --, --, --, --, --, --, --, --, --, --, --, --, --
Rafael Harvey-Pinard, Healthy, Mon, LW, FA, --, --, --, --, --, --, --, --, --, --, --, --, --, --, --, --, --, --, --
Kaiden Guhle, Healthy, Mon, D, HERB, --, --, --, --, --, --, --, --, --, --, --, --, --, --, --, --, --, --, --
Tony DeAngelo, Healthy, Car, D, FA, --, --, --, --, --, --, --, --, --, --, --, --, --, --, --, --, --, --, --
Jakub Vrana, Healthy, StL, RW- LW, FA, --, --, --, --, --, --, --, --, --, --, --, --, --, --, --, --, --, --, --
Logan Couture, IR, SJ, C, BOWS, --, --, --, --, --, --, --, --, --, --, --, --, --, --, --, --, --, --, --
Mario Ferraro, Healthy, SJ, D, FA, --, --, --, --, --, --, --, --, --, --, --, --, --, --, --, --, --, --, --
Alec Martinez, Healthy, Vgk, D, BBS, --, --, --, --, --, --, --, --, --, --, --, --, --, --, --, --, --, --, --
Philip Tomasino, Healthy, Nsh, C, FA, --, --, --, --, --, --, --, --, --, --, --, --, --, --, --, --, --, --, --
Teuvo Teravainen, Healthy, Car, RW, OXP, --, --, --, --, --, --, --, --, --, --, --, --, --, --, --, --, --, --, --
Esa Lindell, Healthy, Dal, D, FA, --, --, --, --, --, --, --, --, --, --, --, --, --, --, --, --, --, --, --
Thomas Harley, Healthy, Dal, D, DINK, --, --, --, --, --, --, --, --, --, --, --, --, --, --, --, --, --, --, --
Tyler Seguin, Healthy, Dal, RW- C, SALT, --, --, --, --, --, --, --, --, --, --, --, --, --, --, --, --, --, --, --
Connor Brown, Healthy, Edm, RW, FA, --, --, --, --, --, --, --, --, --, --, --, --, --, --, --, --, --, --, --
Alexander Romanov, Healthy, NYI, D, DINK, --, --, --, --, --, --, --, --, --, --, --, --, --, --, --, --, --, --, --
Jake Middleton, Healthy, Min, D, FA, --, --, --, --, --, --, --, --, --, --, --, --, --, --, --, --, --, --, --
Joel Farabee, Healthy, Phi, LW, SALT, --, --, --, --, --, --, --, --, --, --, --, --, --, --, --, --, --, --, --
Dmitry Orlov, Healthy, Car, D, FA, --, --, --, --, --, --, --, --, --, --, --, --, --, --, --, --, --, --, --
Gustav Nyquist, Healthy, Nsh, RW, BBS, --, --, --, --, --, --, --, --, --, --, --, --, --, --, --, --, --, --, --
Owen Power, Healthy, Buf, D, SLC, --, --, --, --, --, --, --, --, --, --, --, --, --, --, --, --, --, --, --
Oliver Bjorkstrand, Healthy, Sea, RW, OXP, --, --, --, --, --, --, --, --, --, --, --, --, --, --, --, --, --, --, --
Viktor Arvidsson, IR, LA, RW, FA, --, --, --, --, --, --, --, --, --, --, --, --, --, --, --, --, --, --, --
Ryan Hartman, Healthy, Min, C- RW, FA, --, --, --, --, --, --, --, --, --, --, --, --, --, --, --, --, --, --, --
Nicholas Paul, Healthy, TB, C, FA, --, --, --, --, --, --, --, --, --, --, --, --, --, --, --, --, --, --, --
Brock Faber, Healthy, Min, D, HERB, --, --, --, --, --, --, --, --, --, --, --, --, --, --, --, --, --, --, --
Michael Bunting, Healthy, Car, LW, FA, --, --, --, --, --, --, --, --, --, --, --, --, --, --, --, --, --, --, --
Mattias Ekholm, Healthy, Edm, D, SLC, --, --, --, --, --, --, --, --, --, --, --, --, --, --, --, --, --, --, --
Mikael Granlund, Healthy, SJ, LW, FA, --, --, --, --, --, --, --, --, --, --, --, --, --, --, --, --, --, --, --
Pavel Zacha, Healthy, Bos, C, FA, --, --, --, --, --, --, --, --, --, --, --, --, --, --, --, --, --, --, --
Wyatt Johnston, Healthy, Dal, C, HERB, --, --, --, --, --, --, --, --, --, --, --, --, --, --, --, --, --, --, --
Quinton Byfield, Healthy, LA, C- LW, FA, --, --, --, --, --, --, --, --, --, --, --, --, --, --, --, --, --, --, --
Marcus Pettersson, Healthy, Pit, D, FA, --, --, --, --, --, --, --, --, --, --, --, --, --, --, --, --, --, --, --
Jamie Oleksiak, Healthy, Sea, D, FA, --, --, --, --, --, --, --, --, --, --, --, --, --, --, --, --, --, --, --
Mason Marchment, Healthy, Dal, LW, SLC, --, --, --, --, --, --, --, --, --, --, --, --, --, --, --, --, --, --, --
Jaden Schwartz, Healthy, Sea, LW, FA, --, --, --, --, --, --, --, --, --, --, --, --, --, --, --, --, --, --, --
Nino Niederreiter, Healthy, Wpg, RW, CLB, --, --, --, --, --, --, --, --, --, --, --, --, --, --, --, --, --, --, --
Cole Perfetti, Healthy, Wpg, LW- C- RW, HERB, --, --, --, --, --, --, --, --, --, --, --, --, --, --, --, --, --, --, --
Casey Mittelstadt, Healthy, Buf, C, FA, --, --, --, --, --, --, --, --, --, --, --, --, --, --, --, --, --, --, --
Jamie Drysdale, Healthy, Phi, D, CLB, --, --, --, --, --, --, --, --, --, --, --, --, --, --, --, --, --, --, --
Sean Monahan, Healthy, Mon, C, FA, --, --, --, --, --, --, --, --, --, --, --, --, --, --, --, --, --, --, --
Jesperi Kotkaniemi, Healthy, Car, C, FA, --, --, --, --, --, --, --, --, --, --, --, --, --, --, --, --, --, --, --
JJ Peterka, Healthy, Buf, RW, FA, --, --, --, --, --, --, --, --, --, --, --, --, --, --, --, --, --, --, --
Cam Atkinson, Healthy, Phi, RW, FA, --, --, --, --, --, --, --, --, --, --, --, --, --, --, --, --, --, --, --
Samuel Girard, Healthy, Col, D, FA, --, --, --, --, --, --, --, --, --, --, --, --, --, --, --, --, --, --, --
Tyler Myers, Healthy, Van, D, FA, --, --, --, --, --, --, --, --, --, --, --, --, --, --, --, --, --, --, --
Nick Seeler, Healthy, Phi, D, BOWS, --, --, --, --, --, --, --, --, --, --, --, --, --, --, --, --, --, --, --
Jonathan Drouin, Healthy, Col, LW, FA, --, --, --, --, --, --, --, --, --, --, --, --, --, --, --, --, --, --, --
Kirby Dach, IR, Mon, C, FA, --, --, --, --, --, --, --, --, --, --, --, --, --, --, --, --, --, --, --
Pavel Mintyukov, IR, Ana, D, HERB, --, --, --, --, --, --, --, --, --, --, --, --, --, --, --, --, --, --, --
Colton Sissons, Healthy, Nsh, C, FA, --, --, --, --, --, --, --, --, --, --, --, --, --, --, --, --, --, --, --
Anders Lee, Healthy, NYI, LW- C, FA, --, --, --, --, --, --, --, --, --, --, --, --, --, --, --, --, --, --, --
Torey Krug, Healthy, StL, D, FA, --, --, --, --, --, --, --, --, --, --, --, --, --, --, --, --, --, --, --
Leo Carlsson, IR, Ana, C, SALT, --, --, --, --, --, --, --, --, --, --, --, --, --, --, --, --, --, --, --
Brenden Dillon, Healthy, Wpg, D, CLB, --, --, --, --, --, --, --, --, --, --, --, --, --, --, --, --, --, --, --
Alexandre Carrier, Healthy, Nsh, D, HERB, --, --, --, --, --, --, --, --, --, --, --, --, --, --, --, --, --, --, --
Adam Henrique, Healthy, Ana, LW- C, FA, --, --, --, --, --, --, --, --, --, --, --, --, --, --, --, --, --, --, --
Sean Walker, Healthy, Phi, D, FA, --, --, --, --, --, --, --, --, --, --, --, --, --, --, --, --, --, --, --
Brayden Schenn, Healthy, StL, C, FA, --, --, --, --, --, --, --, --, --, --, --, --, --, --, --, --, --, --, --
Pavel Dorofeyev, Healthy, Vgk, RW, FA, --, --, --, --, --, --, --, --, --, --, --, --, --, --, --, --, --, --, --
Jonas Brodin, IR, Min, D, FA, --, --, --, --, --, --, --, --, --, --, --, --, --, --, --, --, --, --, --
Reilly Smith, O, Pit, RW, FA, --, --, --, --, --, --, --, --, --, --, --, --, --, --, --, --, --, --, --
Dylan DeMelo, Healthy, Wpg, D, LKR, --, --, --, --, --, --, --, --, --, --, --, --, --, --, --, --, --, --, --
Kevin Shattenkirk, Healthy, Bos, D, FA, --, --, --, --, --, --, --, --, --, --, --, --, --, --, --, --, --, --, --
Cam York, Healthy, Phi, D, FA, --, --, --, --, --, --, --, --, --, --, --, --, --, --, --, --, --, --, --
Marco Rossi, Healthy, Min, C, FA, --, --, --, --, --, --, --, --, --, --, --, --, --, --, --, --, --, --, --
Luke Evangelista, Healthy, Nsh, RW, FA, --, --, --, --, --, --, --, --, --, --, --, --, --, --, --, --, --, --, --
Scott Laughton, Healthy, Phi, C- LW- RW, FA, --, --, --, --, --, --, --, --, --, --, --, --, --, --, --, --, --, --, --
James van Riemsdyk, Healthy, Bos, LW, FA, --, --, --, --, --, --, --, --, --, --, --, --, --, --, --, --, --, --, --
Ryan McDonagh, Healthy, Nsh, D, FA, --, --, --, --, --, --, --, --, --, --, --, --, --, --, --, --, --, --, --
Scott Mayfield, Healthy, NYI, D, FA, --, --, --, --, --, --, --, --, --, --, --, --, --, --, --, --, --, --, --
Mikey Anderson, Healthy, LA, D, FA, --, --, --, --, --, --, --, --, --, --, --, --, --, --, --, --, --, --, --
Dominik Kubalik, Healthy, Ott, LW, FA, --, --, --, --, --, --, --, --, --, --, --, --, --, --, --, --, --, --, --
Mattias Samuelsson, Healthy, Buf, D, FA, --, --, --, --, --, --, --, --, --, --, --, --, --, --, --, --, --, --, --
Dakota Joshua, Healthy, Van, C, BOWS, --, --, --, --, --, --, --, --, --, --, --, --, --, --, --, --, --, --, --
Jani Hakanpaa, Healthy, Dal, D, FA, --, --, --, --, --, --, --, --, --, --, --, --, --, --, --, --, --, --, --
Trent Frederic, Healthy, Bos, LW- C- RW, FA, --, --, --, --, --, --, --, --, --, --, --, --, --, --, --, --, --, --, --
Kyle Palmieri, Healthy, NYI, RW- LW, FA, --, --, --, --, --, --, --, --, --, --, --, --, --, --, --, --, --, --, --
Josh Manson, DTD, Col, D, FA, --, --, --, --, --, --, --, --, --, --, --, --, --, --, --, --, --, --, --
Tanner Jeannot, IR, TB, RW- LW, FA, --, --, --, --, --, --, --, --, --, --, --, --, --, --, --, --, --, --, --
Morgan Geekie, Healthy, Bos, C, FA, --, --, --, --, --, --, --, --, --, --, --, --, --, --, --, --, --, --, --
Ryan Johansen, Healthy, Col, C, FA, --, --, --, --, --, --, --, --, --, --, --, --, --, --, --, --, --, --, --
Mathieu Joseph, Healthy, Ott, LW- RW, LKR, --, --, --, --, --, --, --, --, --, --, --, --, --, --, --, --, --, --, --
Anthony Duclair, Healthy, SJ, LW, FA, --, --, --, --, --, --, --, --, --, --, --, --, --, --, --, --, --, --, --
Adam Lowry, Healthy, Wpg, C, FA, --, --, --, --, --, --, --, --, --, --, --, --, --, --, --, --, --, --, --
Jeremy Lauzon, Healthy, Nsh, D, CLB, --, --, --, --, --, --, --, --, --, --, --, --, --, --, --, --, --, --, --
Artem Zub, Healthy, Ott, D, FA, --, --, --, --, --, --, --, --, --, --, --, --, --, --, --, --, --, --, --
Alex Iafallo, Healthy, Wpg, LW, FA, --, --, --, --, --, --, --, --, --, --, --, --, --, --, --, --, --, --, --
Jean-Gabriel Pageau, Healthy, NYI, C, FA, --, --, --, --, --, --, --, --, --, --, --, --, --, --, --, --, --, --, --
Rasmus Ristolainen, Healthy, Phi, D, FA, --, --, --, --, --, --, --, --, --, --, --, --, --, --, --, --, --, --, --
Anthony Cirelli, Healthy, TB, C, FA, --, --, --, --, --, --, --, --, --, --, --, --, --, --, --, --, --, --, --
Ryan Pulock, IR, NYI, D, FA, --, --, --, --, --, --, --, --, --, --, --, --, --, --, --, --, --, --, --
Shane Wright, Healthy, Sea, C, FA, --, --, --, --, --, --, --, --, --, --, --, --, --, --, --, --, --, --, --
William Eklund, Healthy, SJ, LW- C, FA, --, --, --, --, --, --, --, --, --, --, --, --, --, --, --, --, --, --, --
Fabian Zetterlund, Healthy, SJ, RW- LW, FA, --, --, --, --, --, --, --, --, --, --, --, --, --, --, --, --, --, --, --
Brandon Carlo, IR, Bos, D, FA, --, --, --, --, --, --, --, --, --, --, --, --, --, --, --, --, --, --, --
Ross Colton, Healthy, Col, LW, FA, --, --, --, --, --, --, --, --, --, --, --, --, --, --, --, --, --, --, --
Yanni Gourde, Healthy, Sea, C- LW- RW, FA, --, --, --, --, --, --, --, --, --, --, --, --, --, --, --, --, --, --, --
Jake Neighbours, Healthy, StL, LW, FA, --, --, --, --, --, --, --, --, --, --, --, --, --, --, --, --, --, --, --
Matthew Poitras, DTD, Bos, C, FA, --, --, --, --, --, --, --, --, --, --, --, --, --, --, --, --, --, --, --
Arber Xhekaj, Healthy, Mon, D, FA, --, --, --, --, --, --, --, --, --, --, --, --, --, --, --, --, --, --, --
Brian Dumoulin, Healthy, Sea, D, FA, --, --, --, --, --, --, --, --, --, --, --, --, --, --, --, --, --, --, --
Ryan Strome, Healthy, Ana, C, FA, --, --, --, --, --, --, --, --, --, --, --, --, --, --, --, --, --, --, --
Ilya Lyubushkin, Healthy, Ana, D, FA, --, --, --, --, --, --, --, --, --, --, --, --, --, --, --, --, --, --, --
Ilya Mikheyev, Healthy, Van, LW- RW, FA, --, --, --, --, --, --, --, --, --, --, --, --, --, --, --, --, --, --, --
Paul Cotter, Healthy, Vgk, C, FA, --, --, --, --, --, --, --, --, --, --, --, --, --, --, --, --, --, --, --
Jack Quinn, Healthy, Buf, RW, FA, --, --, --, --, --, --, --, --, --, --, --, --, --, --, --, --, --, --, --
Adam Pelech, Healthy, NYI, D, FA, --, --, --, --, --, --, --, --, --, --, --, --, --, --, --, --, --, --, --
Jordan Eberle, Healthy, Sea, RW, FA, --, --, --, --, --, --, --, --, --, --, --, --, --, --, --, --, --, --, --
Morgan Frost, Healthy, Phi, C, FA, --, --, --, --, --, --, --, --, --, --, --, --, --, --, --, --, --, --, --
Marcus Foligno, Healthy, Min, RW- LW, FA, --, --, --, --, --, --, --, --, --, --, --, --, --, --, --, --, --, --, --
Josh Anderson, Healthy, Mon, RW- LW, FA, --, --, --, --, --, --, --, --, --, --, --, --, --, --, --, --, --, --, --
Luke Schenn, Healthy, Nsh, D, FA, --, --, --, --, --, --, --, --, --, --, --, --, --, --, --, --, --, --, --
Vladislav Namestnikov, Healthy, Wpg, C, FA, --, --, --, --, --, --, --, --, --, --, --, --, --, --, --, --, --, --, --
Gabriel Landeskog, IR, Col, LW, FA, --, --, --, --, --, --, --, --, --, --, --, --, --, --, --, --, --, --, --
Andre Burakovsky, Healthy, Sea, RW- LW, FA, --, --, --, --, --, --, --, --, --, --, --, --, --, --, --, --, --, --, --
Alex Newhook, IR, Mon, C, FA, --, --, --, --, --, --, --, --, --, --, --, --, --, --, --, --, --, --, --
Alex Killorn, Healthy, Ana, RW- LW, FA, --, --, --, --, --, --, --, --, --, --, --, --, --, --, --, --, --, --, --
Brett Pesce, Healthy, Car, D, FA, --, --, --, --, --, --, --, --, --, --, --, --, --, --, --, --, --, --, --
Carson Soucy, Healthy, Van, D, FA, --, --, --, --, --, --, --, --, --, --, --, --, --, --, --, --, --, --, --
Tyson Foerster, Healthy, Phi, RW, FA, --, --, --, --, --, --, --, --, --, --, --, --, --, --, --, --, --, --, --
Will Borgen, Healthy, Sea, D, FA, --, --, --, --, --, --, --, --, --, --, --, --, --, --, --, --, --, --, --
Vladislav Gavrikov, Healthy, LA, D, FA, --, --, --, --, --, --, --, --, --, --, --, --, --, --, --, --, --, --, --
Connor Clifton, Healthy, Buf, D, FA, --, --, --, --, --, --, --, --, --, --, --, --, --, --, --, --, --, --, --
"Logan OConnor", Healthy, Col, RW, FA, --, --, --, --, --, --, --, --, --, --, --, --, --, --, --, --, --, --, --
Brandt Clarke, Healthy, LA, D, FA, --, --, --, --, --, --, --, --, --, --, --, --, --, --, --, --, --, --, --
Mason Appleton, Healthy, Wpg, RW- C, FA, --, --, --, --, --, --, --, --, --, --, --, --, --, --, --, --, --, --, --
Jordan Staal, Healthy, Car, C, FA, --, --, --, --, --, --, --, --, --, --, --, --, --, --, --, --, --, --, --
Patrice Bergeron, Healthy, Bos, C, FA, --, --, --, --, --, --, --, --, --, --, --, --, --, --, --, --, --, --, --
Arthur Kaliyev, Healthy, LA, RW, FA, --, --, --, --, --, --, --, --, --, --, --, --, --, --, --, --, --, --, --
