Alexander Barabanov, DTD, SJ, LW, FA, --, --, --, --, --, --, --, --, --, --, --, --, --, --, --, --, --, --, --
Henry Thrun, Healthy, SJ, D, FA, --, --, --, --, --, --, --, --, --, --, --, --, --, --, --, --, --, --, --
Barclay Goodrow, Healthy, NYR, C- LW- RW, FA, --, --, --, --, --, --, --, --, --, --, --, --, --, --, --, --, --, --, --
Alex Vlasic, Healthy, Chi, D, FA, --, --, --, --, --, --, --, --, --, --, --, --, --, --, --, --, --, --, --
Pius Suter, Healthy, Van, C, FA, --, --, --, --, --, --, --, --, --, --, --, --, --, --, --, --, --, --, --
Zach Parise, Healthy, Col, LW, FA, --, --, --, --, --, --, --, --, --, --, --, --, --, --, --, --, --, --, --
Miles Wood, Healthy, Col, LW, FA, --, --, --, --, --, --, --, --, --, --, --, --, --, --, --, --, --, --, --
Bobby Brink, Healthy, Phi, RW, FA, --, --, --, --, --, --, --, --, --, --, --, --, --, --, --, --, --, --, --
Carson Soucy, Healthy, Van, D, FA, --, --, --, --, --, --, --, --, --, --, --, --, --, --, --, --, --, --, --
Juuso Parssinen, Healthy, Nsh, C- RW, FA, --, --, --, --, --, --, --, --, --, --, --, --, --, --, --, --, --, --, --
Thomas Bordeleau, Healthy, SJ, C- LW, FA, --, --, --, --, --, --, --, --, --, --, --, --, --, --, --, --, --, --, --
Matvei Michkov, Healthy, Phi, RW, FA, --, --, --, --, --, --, --, --, --, --, --, --, --, --, --, --, --, --, --
Brendan Gallagher, Healthy, Mon, RW, FA, --, --, --, --, --, --, --, --, --, --, --, --, --, --, --, --, --, --, --
Marc-Edouard Vlasic, Healthy, SJ, D, FA, --, --, --, --, --, --, --, --, --, --, --, --, --, --, --, --, --, --, --
Teddy Blueger, Healthy, Van, C, FA, --, --, --, --, --, --, --, --, --, --, --, --, --, --, --, --, --, --, --
Wade Allison, Healthy, Nsh, RW, FA, --, --, --, --, --, --, --, --, --, --, --, --, --, --, --, --, --, --, --
Olen Zellweger, Healthy, Ana, D, FA, --, --, --, --, --, --, --, --, --, --, --, --, --, --, --, --, --, --, --
Egor Zamula, Healthy, Phi, D, FA, --, --, --, --, --, --, --, --, --, --, --, --, --, --, --, --, --, --, --
Matt Coronato, Healthy, Cgy, RW, FA, --, --, --, --, --, --, --, --, --, --, --, --, --, --, --, --, --, --, --
Marcus Johansson, IR, Min, LW- RW, FA, --, --, --, --, --, --, --, --, --, --, --, --, --, --, --, --, --, --, --
Nick Perbix, Healthy, TB, D, FA, --, --, --, --, --, --, --, --, --, --, --, --, --, --, --, --, --, --, --
Andreas Athanasiou, Healthy, Chi, LW- C- RW, FA, --, --, --, --, --, --, --, --, --, --, --, --, --, --, --, --, --, --, --
Frederick Gaudreau, Healthy, Min, C, FA, --, --, --, --, --, --, --, --, --, --, --, --, --, --, --, --, --, --, --
Erik Johnson, Healthy, Phi, D, FA, --, --, --, --, --, --, --, --, --, --, --, --, --, --, --, --, --, --, --
"Drew OConnor", Healthy, Pit, LW, FA, --, --, --, --, --, --, --, --, --, --, --, --, --, --, --, --, --, --, --
Michael McCarron, Healthy, Nsh, RW, FA, --, --, --, --, --, --, --, --, --, --, --, --, --, --, --, --, --, --, --
Michael Amadio, Healthy, Vgk, RW- C- LW, FA, --, --, --, --, --, --, --, --, --, --, --, --, --, --, --, --, --, --, --
Dante Fabbro, DTD, Nsh, D, FA, --, --, --, --, --, --, --, --, --, --, --, --, --, --, --, --, --, --, --
Michael Pezzetta, Healthy, Mon, LW- RW, FA, --, --, --, --, --, --, --, --, --, --, --, --, --, --, --, --, --, --, --
Pat Maroon, IR, Bos, LW, FA, @Sea, L 3-4, --, --, --, --, --, --, --, --, --, --, --, --, --, --, --, --, --
Nate Schmidt, Healthy, Wpg, D, FA, --, --, --, --, --, --, --, --, --, --, --, --, --, --, --, --, --, --, --
Jake Bean, Healthy, Cls, D, FA, --, --, --, --, --, --, --, --, --, --, --, --, --, --, --, --, --, --, --
Jimmy Vesey, Healthy, NYR, LW, FA, --, --, --, --, --, --, --, --, --, --, --, --, --, --, --, --, --, --, --
Marat Khusnutdinov, Healthy, Min, C, FA, --, --, --, --, --, --, --, --, --, --, --, --, --, --, --, --, --, --, --
Peyton Krebs, Healthy, Buf, C, FA, --, --, --, --, --, --, --, --, --, --, --, --, --, --, --, --, --, --, --
Josh Archibald, Healthy, TB, RW, FA, --, --, --, --, --, --, --, --, --, --, --, --, --, --, --, --, --, --, --
William Smith, Healthy, SJ, C, FA, --, --, --, --, --, --, --, --, --, --, --, --, --, --, --, --, --, --, --
Curtis Lazar, Healthy, NJ, RW, FA, --, --, --, --, --, --, --, --, --, --, --, --, --, --, --, --, --, --, --
Yakov Trenin, Healthy, Col, LW- C, FA, --, --, --, --, --, --, --, --, --, --, --, --, --, --, --, --, --, --, --
Luke Glendening, Healthy, TB, RW- C, FA, --, --, --, --, --, --, --, --, --, --, --, --, --, --, --, --, --, --, --
Michael Eyssimont, Healthy, TB, RW- C, FA, --, --, --, --, --, --, --, --, --, --, --, --, --, --, --, --, --, --, --
Noel Acciari, IR, Pit, C, FA, --, --, --, --, --, --, --, --, --, --, --, --, --, --, --, --, --, --, --
Oliver Kylington, Healthy, Cgy, D, FA, --, --, --, --, --, --, --, --, --, --, --, --, --, --, --, --, --, --, --
Jack Johnson, Healthy, Col, D, FA, --, --, --, --, --, --, --, --, --, --, --, --, --, --, --, --, --, --, --
Cutter Gauthier, Healthy, Ana, LW, FA, --, --, --, --, --, --, --, --, --, --, --, --, --, --, --, --, --, --, --
Kyle Okposo, Healthy, Fla, RW, FA, --, --, --, --, --, --, --, --, --, --, --, --, --, --, --, --, --, --, --
Jordan Harris, Healthy, Mon, D, FA, --, --, --, --, --, --, --, --, --, --, --, --, --, --, --, --, --, --, --
Matt Benning, IR, SJ, D, FA, --, --, --, --, --, --, --, --, --, --, --, --, --, --, --, --, --, --, --
Justin Danforth, O, Cls, RW, FA, --, --, --, --, --, --, --, --, --, --, --, --, --, --, --, --, --, --, --
Jonathan Toews, Healthy, Chi, C, FA, --, --, --, --, --, --, --, --, --, --, --, --, --, --, --, --, --, --, --
Jake Evans, Healthy, Mon, C- RW, FA, --, --, --, --, --, --, --, --, --, --, --, --, --, --, --, --, --, --, --
Zemgus Girgensons, Healthy, Buf, C, FA, --, --, --, --, --, --, --, --, --, --, --, --, --, --, --, --, --, --, --
Brandon Duhaime, Healthy, Col, LW- RW, FA, --, --, --, --, --, --, --, --, --, --, --, --, --, --, --, --, --, --, --
P.K. Subban, Healthy, NJ, D, FA, --, --, --, --, --, --, --, --, --, --, --, --, --, --, --, --, --, --, --
Jordan Martinook, Healthy, Car, LW- RW, FA, --, --, --, --, --, --, --, --, --, --, --, --, --, --, --, --, --, --, --
Marc Staal, Healthy, Phi, D, FA, --, --, --, --, --, --, --, --, --, --, --, --, --, --, --, --, --, --, --
Caleb Jones, Healthy, Col, D, FA, --, --, --, --, --, --, --, --, --, --, --, --, --, --, --, --, --, --, --
Lane Hutson, Healthy, Mon, D, FA, --, --, --, --, --, --, --, --, --, --, --, --, --, --, --, --, --, --, --
Declan Chisholm, Healthy, Min, D, FA, --, --, --, --, --, --, --, --, --, --, --, --, --, --, --, --, --, --, --
Nicolas Deslauriers, Healthy, Phi, RW- LW, FA, --, --, --, --, --, --, --, --, --, --, --, --, --, --, --, --, --, --, --
Jakob Pelletier, Healthy, Cgy, LW, FA, --, --, --, --, --, --, --, --, --, --, --, --, --, --, --, --, --, --, --
Pierre-Olivier Joseph, Healthy, Pit, D, FA, --, --, --, --, --, --, --, --, --, --, --, --, --, --, --, --, --, --, --
Jackson LaCombe, Healthy, Ana, D, FA, --, --, --, --, --, --, --, --, --, --, --, --, --, --, --, --, --, --, --
Zach Bogosian, Healthy, Min, D, FA, --, --, --, --, --, --, --, --, --, --, --, --, --, --, --, --, --, --, --
Danil Gushchin, Healthy, SJ, RW, FA, --, --, --, --, --, --, --, --, --, --, --, --, --, --, --, --, --, --, --
Jack Drury, Healthy, Car, C- LW, FA, --, --, --, --, --, --, --, --, --, --, --, --, --, --, --, --, --, --, --
Sam Carrick, Healthy, Edm, C- RW, FA, LA, W 4-2, --, --, --, --, --, --, --, --, --, --, --, --, --, --, --, --, --
Nick Bonino, Healthy, NYR, C, FA, --, --, --, --, --, --, --, --, --, --, --, --, --, --, --, --, --, --, --
Scott Perunovich, Healthy, StL, D, FA, --, --, --, --, --, --, --, --, --, --, --, --, --, --, --, --, --, --, --
Brayden Pachal, Healthy, Cgy, D, FA, --, --, --, --, --, --, --, --, --, --, --, --, --, --, --, --, --, --, --
Luke Kunin, Healthy, SJ, C, FA, --, --, --, --, --, --, --, --, --, --, --, --, --, --, --, --, --, --, --
Sean Kuraly, DTD, Cls, C, FA, --, --, --, --, --, --, --, --, --, --, --, --, --, --, --, --, --, --, --
Brandon Biro, Healthy, Buf, LW, FA, --, --, --, --, --, --, --, --, --, --, --, --, --, --, --, --, --, --, --
Dylan Samberg, Healthy, Wpg, D, FA, --, --, --, --, --, --, --, --, --, --, --, --, --, --, --, --, --, --, --
Nico Sturm, Healthy, SJ, C, FA, --, --, --, --, --, --, --, --, --, --, --, --, --, --, --, --, --, --, --
Nikita Zaitsev, Healthy, Chi, D, FA, --, --, --, --, --, --, --, --, --, --, --, --, --, --, --, --, --, --, --
Sammy Blais, Healthy, StL, LW, FA, --, --, --, --, --, --, --, --, --, --, --, --, --, --, --, --, --, --, --
Brett Leason, Healthy, Ana, RW, FA, --, --, --, --, --, --, --, --, --, --, --, --, --, --, --, --, --, --, --
Alexandre Texier, Healthy, Cls, C- LW- RW, FA, --, --, --, --, --, --, --, --, --, --, --, --, --, --, --, --, --, --, --
Connor Dewar, Healthy, Tor, C, FA, --, --, --, --, --, --, --, --, --, --, --, --, --, --, --, --, --, --, --
Kaedan Korczak, Healthy, Vgk, D, FA, --, --, --, --, --, --, --, --, --, --, --, --, --, --, --, --, --, --, --
Jeff Carter, DTD, Pit, C, FA, --, --, --, --, --, --, --, --, --, --, --, --, --, --, --, --, --, --, --
Noah Juulsen, Healthy, Van, D, FA, --, --, --, --, --, --, --, --, --, --, --, --, --, --, --, --, --, --, --
David Reinbacher, Healthy, Mon, D, FA, --, --, --, --, --, --, --, --, --, --, --, --, --, --, --, --, --, --, --
Kevin Bahl, Healthy, NJ, D, FA, --, --, --, --, --, --, --, --, --, --, --, --, --, --, --, --, --, --, --
Alexey Toropchenko, Healthy, StL, RW, FA, --, --, --, --, --, --, --, --, --, --, --, --, --, --, --, --, --, --, --
David Kampf, Healthy, Tor, C- RW, FA, --, --, --, --, --, --, --, --, --, --, --, --, --, --, --, --, --, --, --
Josh Brown, Healthy, Ari, D, FA, --, --, --, --, --, --, --, --, --, --, --, --, --, --, --, --, --, --, --
Filip Zadina, Healthy, SJ, RW, FA, --, --, --, --, --, --, --, --, --, --, --, --, --, --, --, --, --, --, --
Cody Glass, Healthy, Nsh, C, FA, --, --, --, --, --, --, --, --, --, --, --, --, --, --, --, --, --, --, --
Brett Howden, Healthy, Vgk, LW- C, FA, --, --, --, --, --, --, --, --, --, --, --, --, --, --, --, --, --, --, --
Nick Blankenburg, Healthy, Cls, D, FA, --, --, --, --, --, --, --, --, --, --, --, --, --, --, --, --, --, --, --
Mike Hoffman, DTD, SJ, LW, FA, --, --, --, --, --, --, --, --, --, --, --, --, --, --, --, --, --, --, --
Jesper Fast, DTD, Car, RW, FA, --, --, --, --, --, --, --, --, --, --, --, --, --, --, --, --, --, --, --
Cal Foote, Healthy, NJ, D, FA, --, --, --, --, --, --, --, --, --, --, --, --, --, --, --, --, --, --, --
Nikita Okhotiuk, Healthy, Cgy, D, FA, --, --, --, --, --, --, --, --, --, --, --, --, --, --, --, --, --, --, --
Oskar Sundqvist, O, StL, C, FA, --, --, --, --, --, --, --, --, --, --, --, --, --, --, --, --, --, --, --
Radim Zohorna, Healthy, Pit, LW, FA, --, --, --, --, --, --, --, --, --, --, --, --, --, --, --, --, --, --, --
Noah Gregor, Healthy, Tor, C, FA, --, --, --, --, --, --, --, --, --, --, --, --, --, --, --, --, --, --, --
Wayne Simmonds, Healthy, Tor, RW, FA, --, --, --, --, --, --, --, --, --, --, --, --, --, --, --, --, --, --, --
Ben Hutton, Healthy, Vgk, D, FA, --, --, --, --, --, --, --, --, --, --, --, --, --, --, --, --, --, --, --
Matt Savoie, Healthy, Buf, C, FA, --, --, --, --, --, --, --, --, --, --, --, --, --, --, --, --, --, --, --
Austin Watson, Healthy, TB, RW, FA, --, --, --, --, --, --, --, --, --, --, --, --, --, --, --, --, --, --, --
Jacob MacDonald, Healthy, SJ, D, FA, --, --, --, --, --, --, --, --, --, --, --, --, --, --, --, --, --, --, --
Marco Kasper, Healthy, Det, C, FA, --, --, --, --, --, --, --, --, --, --, --, --, --, --, --, --, --, --, --
Ryan Lomberg, Healthy, Fla, LW, FA, --, --, --, --, --, --, --, --, --, --, --, --, --, --, --, --, --, --, --
Valtteri Puustinen, Healthy, Pit, LW, FA, --, --, --, --, --, --, --, --, --, --, --, --, --, --, --, --, --, --, --
Jan Rutta, Healthy, SJ, D, FA, --, --, --, --, --, --, --, --, --, --, --, --, --, --, --, --, --, --, --
Kevin Stenlund, Healthy, Fla, RW, FA, --, --, --, --, --, --, --, --, --, --, --, --, --, --, --, --, --, --, --
Brendan Smith, Healthy, NJ, D, FA, --, --, --, --, --, --, --, --, --, --, --, --, --, --, --, --, --, --, --
Tyson Jost, O, Buf, C, FA, --, --, --, --, --, --, --, --, --, --, --, --, --, --, --, --, --, --, --
Dominic Toninato, Healthy, Wpg, C, FA, --, --, --, --, --, --, --, --, --, --, --, --, --, --, --, --, --, --, --
Zac Jones, Healthy, NYR, D, FA, --, --, --, --, --, --, --, --, --, --, --, --, --, --, --, --, --, --, --
Chad Ruhwedel, Healthy, NYR, D, FA, --, --, --, --, --, --, --, --, --, --, --, --, --, --, --, --, --, --, --
William Carrier, DTD, Vgk, LW, FA, --, --, --, --, --, --, --, --, --, --, --, --, --, --, --, --, --, --, --
Conor Timmins, Healthy, Tor, D, FA, --, --, --, --, --, --, --, --, --, --, --, --, --, --, --, --, --, --, --
Nathan Bastian, IR, NJ, RW, FA, --, --, --, --, --, --, --, --, --, --, --, --, --, --, --, --, --, --, --
Brayden Yager, Healthy, Pit, C, FA, --, --, --, --, --, --, --, --, --, --, --, --, --, --, --, --, --, --, --
Jonny Brodzinski, Healthy, NYR, C, FA, --, --, --, --, --, --, --, --, --, --, --, --, --, --, --, --, --, --, --
Michael Kesselring, Healthy, Ari, D, FA, --, --, --, --, --, --, --, --, --, --, --, --, --, --, --, --, --, --, --
Jiri Kulich, Healthy, Buf, C- LW, FA, --, --, --, --, --, --, --, --, --, --, --, --, --, --, --, --, --, --, --
Jesse Puljujarvi, Healthy, Pit, RW, FA, --, --, --, --, --, --, --, --, --, --, --, --, --, --, --, --, --, --, --
Dakota Mermis, Healthy, Min, D, FA, --, --, --, --, --, --, --, --, --, --, --, --, --, --, --, --, --, --, --
Phillip Di Giuseppe, Healthy, Van, LW, FA, --, --, --, --, --, --, --, --, --, --, --, --, --, --, --, --, --, --, --
Vinnie Hinostroza, Healthy, Pit, RW, FA, --, --, --, --, --, --, --, --, --, --, --, --, --, --, --, --, --, --, --
Alex Goligoski, Healthy, Min, D, FA, --, --, --, --, --, --, --, --, --, --, --, --, --, --, --, --, --, --, --
Joshua Roy, O, Mon, LW- RW, FA, --, --, --, --, --, --, --, --, --, --, --, --, --, --, --, --, --, --, --
Andrew Cogliano, Healthy, Col, C, FA, --, --, --, --, --, --, --, --, --, --, --, --, --, --, --, --, --, --, --
Jonatan Berggren, Healthy, Det, RW, FA, --, --, --, --, --, --, --, --, --, --, --, --, --, --, --, --, --, --, --
Klim Kostin, Healthy, SJ, RW- LW, FA, --, --, --, --, --, --, --, --, --, --, --, --, --, --, --, --, --, --, --
Jon Merrill, Healthy, Min, D, FA, --, --, --, --, --, --, --, --, --, --, --, --, --, --, --, --, --, --, --
Vasily Podkolzin, Healthy, Van, RW, FA, --, --, --, --, --, --, --, --, --, --, --, --, --, --, --, --, --, --, --
Conor Sheary, Healthy, TB, LW, FA, --, --, --, --, --, --, --, --, --, --, --, --, --, --, --, --, --, --, --
Jean-Luc Foudy, Healthy, Col, RW- C, FA, --, --, --, --, --, --, --, --, --, --, --, --, --, --, --, --, --, --, --
Colin Miller, Healthy, Wpg, D, FA, --, --, --, --, --, --, --, --, --, --, --, --, --, --, --, --, --, --, --
Kurtis MacDermid, DTD, NJ, D, FA, --, --, --, --, --, --, --, --, --, --, --, --, --, --, --, --, --, --, --
Ben Meyers, Healthy, Ana, RW, FA, --, --, --, --, --, --, --, --, --, --, --, --, --, --, --, --, --, --, --
Matthew Wood, Healthy, Nsh, LW, FA, --, --, --, --, --, --, --, --, --, --, --, --, --, --, --, --, --, --, --
Gabriel Perreault, Healthy, NYR, RW, FA, --, --, --, --, --, --, --, --, --, --, --, --, --, --, --, --, --, --, --
Pontus Holmberg, Healthy, Tor, C, FA, --, --, --, --, --, --, --, --, --, --, --, --, --, --, --, --, --, --, --
Wyatt Kaiser, Healthy, Chi, D, FA, --, --, --, --, --, --, --, --, --, --, --, --, --, --, --, --, --, --, --
Travis Boyd, IR, Ari, C, FA, --, --, --, --, --, --, --, --, --, --, --, --, --, --, --, --, --, --, --
Nate Danielson, Healthy, Det, C, FA, --, --, --, --, --, --, --, --, --, --, --, --, --, --, --, --, --, --, --
Jaycob Megna, Healthy, Chi, D, FA, --, --, --, --, --, --, --, --, --, --, --, --, --, --, --, --, --, --, --
Jimmy Snuggerud, Healthy, StL, RW, FA, --, --, --, --, --, --, --, --, --, --, --, --, --, --, --, --, --, --, --
Calvin de Haan, Healthy, TB, D, FA, --, --, --, --, --, --, --, --, --, --, --, --, --, --, --, --, --, --, --
Morgan Barron, Healthy, Wpg, C, FA, --, --, --, --, --, --, --, --, --, --, --, --, --, --, --, --, --, --, --
Oliver Moore, Healthy, Chi, C, FA, --, --, --, --, --, --, --, --, --, --, --, --, --, --, --, --, --, --, --
Rutger McGroarty, O, Wpg, RW, FA, --, --, --, --, --, --, --, --, --, --, --, --, --, --, --, --, --, --, --
Joel Kiviranta, DTD, Col, LW, FA, --, --, --, --, --, --, --, --, --, --, --, --, --, --, --, --, --, --, --
Joel Armia, Healthy, Mon, RW, FA, --, --, --, --, --, --, --, --, --, --, --, --, --, --, --, --, --, --, --
Alex Barre-Boulet, Healthy, TB, LW- RW, FA, --, --, --, --, --, --, --, --, --, --, --, --, --, --, --, --, --, --, --
Dalibor Dvorsky, Healthy, StL, C, FA, --, --, --, --, --, --, --, --, --, --, --, --, --, --, --, --, --, --, --
Colin Blackwell, DTD, Chi, C- RW, FA, --, --, --, --, --, --, --, --, --, --, --, --, --, --, --, --, --, --, --
John Ludvig, Healthy, Pit, D, FA, --, --, --, --, --, --, --, --, --, --, --, --, --, --, --, --, --, --, --
Easton Cowan, Healthy, Tor, RW, FA, --, --, --, --, --, --, --, --, --, --, --, --, --, --, --, --, --, --, --
Brendan Lemieux, Healthy, Car, LW, FA, --, --, --, --, --, --, --, --, --, --, --, --, --, --, --, --, --, --, --
Axel Sandin Pellikka, Healthy, Det, D, FA, --, --, --, --, --, --, --, --, --, --, --, --, --, --, --, --, --, --, --
Adam Ruzicka, Healthy, Ari, C, FA, --, --, --, --, --, --, --, --, --, --, --, --, --, --, --, --, --, --, --
Nick DeSimone, Healthy, NJ, D, FA, --, --, --, --, --, --, --, --, --, --, --, --, --, --, --, --, --, --, --
Johnathan Kovacevic, Healthy, Mon, D, FA, --, --, --, --, --, --, --, --, --, --, --, --, --, --, --, --, --, --, --
Tom Willander, Healthy, Van, D, FA, --, --, --, --, --, --, --, --, --, --, --, --, --, --, --, --, --, --, --
Mason Morelli, Healthy, Vgk, LW, FA, --, --, --, --, --, --, --, --, --, --, --, --, --, --, --, --, --, --, --
Nick Cousins, Healthy, Fla, C, FA, --, --, --, --, --, --, --, --, --, --, --, --, --, --, --, --, --, --, --
Eric Robinson, Healthy, Buf, LW, FA, --, --, --, --, --, --, --, --, --, --, --, --, --, --, --, --, --, --, --
Cole Guttman, Healthy, Chi, C, FA, --, --, --, --, --, --, --, --, --, --, --, --, --, --, --, --, --, --, --
Joel Ward, Healthy, SJ, RW, FA, --, --, --, --, --, --, --, --, --, --, --, --, --, --, --, --, --, --, --
Max Jones, DTD, Ana, LW, FA, --, --, --, --, --, --, --, --, --, --, --, --, --, --, --, --, --, --, --
Christian Fischer, Healthy, Det, RW, FA, --, --, --, --, --, --, --, --, --, --, --, --, --, --, --, --, --, --, --
Ville Heinola, Healthy, Wpg, D, FA, --, --, --, --, --, --, --, --, --, --, --, --, --, --, --, --, --, --, --
Nathan Walker, Healthy, StL, C, FA, --, --, --, --, --, --, --, --, --, --, --, --, --, --, --, --, --, --, --
Givani Smith, Healthy, SJ, RW, FA, --, --, --, --, --, --, --, --, --, --, --, --, --, --, --, --, --, --, --
Reese Johnson, O, Chi, RW, FA, --, --, --, --, --, --, --, --, --, --, --, --, --, --, --, --, --, --, --
Ty Emberson, IR, SJ, D, FA, --, --, --, --, --, --, --, --, --, --, --, --, --, --, --, --, --, --, --
Jakob Silfverberg, Healthy, Ana, RW, FA, --, --, --, --, --, --, --, --, --, --, --, --, --, --, --, --, --, --, --
Tyler Motte, Healthy, TB, C, FA, --, --, --, --, --, --, --, --, --, --, --, --, --, --, --, --, --, --, --
Tyler Pitlick, Healthy, NYR, RW, FA, --, --, --, --, --, --, --, --, --, --, --, --, --, --, --, --, --, --, --
MacKenzie Entwistle, Healthy, Chi, RW, FA, --, --, --, --, --, --, --, --, --, --, --, --, --, --, --, --, --, --, --
Emil Bemstrom, Healthy, Pit, C, FA, --, --, --, --, --, --, --, --, --, --, --, --, --, --, --, --, --, --, --
Ross Johnston, Healthy, Ana, LW, FA, --, --, --, --, --, --, --, --, --, --, --, --, --, --, --, --, --, --, --
Troy Stecher, Healthy, Edm, D, FA, LA, W 4-2, --, --, --, --, --, --, --, --, --, --, --, --, --, --, --, --, --
Frank Nazar, Healthy, Chi, C, FA, --, --, --, --, --, --, --, --, --, --, --, --, --, --, --, --, --, --, --
Joe Thornton, Healthy, Fla, C, FA, --, --, --, --, --, --, --, --, --, --, --, --, --, --, --, --, --, --, --
Haydn Fleury, DTD, TB, D, FA, --, --, --, --, --, --, --, --, --, --, --, --, --, --, --, --, --, --, --
Jonathan Lekkerimaki, Healthy, Van, RW, FA, --, --, --, --, --, --, --, --, --, --, --, --, --, --, --, --, --, --, --
Joakim Kemell, Healthy, Nsh, RW, FA, --, --, --, --, --, --, --, --, --, --, --, --, --, --, --, --, --, --, --
Marco Scandella, Healthy, StL, D, FA, --, --, --, --, --, --, --, --, --, --, --, --, --, --, --, --, --, --, --
Brendan Brisson, Healthy, Vgk, C, FA, --, --, --, --, --, --, --, --, --, --, --, --, --, --, --, --, --, --, --
Mackie Samoskevich, Healthy, Fla, LW- RW, FA, --, --, --, --, --, --, --, --, --, --, --, --, --, --, --, --, --, --, --
Mathieu Olivier, Healthy, Cls, C, FA, --, --, --, --, --, --, --, --, --, --, --, --, --, --, --, --, --, --, --
Eric Staal, Healthy, Fla, C, FA, --, --, --, --, --, --, --, --, --, --, --, --, --, --, --, --, --, --, --
Conor Geekie, Healthy, Ari, C, FA, --, --, --, --, --, --, --, --, --, --, --, --, --, --, --, --, --, --, --
Mark Jankowski, Healthy, Nsh, C, FA, --, --, --, --, --, --, --, --, --, --, --, --, --, --, --, --, --, --, --
Matt Nieto, IR, Pit, LW, FA, --, --, --, --, --, --, --, --, --, --, --, --, --, --, --, --, --, --, --
Jonah Gadjovich, DTD, Fla, LW, FA, --, --, --, --, --, --, --, --, --, --, --, --, --, --, --, --, --, --, --
Logan Stanley, Healthy, Wpg, D, FA, --, --, --, --, --, --, --, --, --, --, --, --, --, --, --, --, --, --, --
Quentin Musty, Healthy, SJ, LW, FA, --, --, --, --, --, --, --, --, --, --, --, --, --, --, --, --, --, --, --
Kevin Labanc, Healthy, SJ, RW, FA, --, --, --, --, --, --, --, --, --, --, --, --, --, --, --, --, --, --, --
Ryan Johnson, Healthy, Buf, D, FA, --, --, --, --, --, --, --, --, --, --, --, --, --, --, --, --, --, --, --
Vasily Ponomarev, Healthy, Pit, C, FA, --, --, --, --, --, --, --, --, --, --, --, --, --, --, --, --, --, --, --
Travis Dermott, Healthy, Ari, D, FA, --, --, --, --, --, --, --, --, --, --, --, --, --, --, --, --, --, --, --
Denton Mateychuk, Healthy, Cls, D, FA, --, --, --, --, --, --, --, --, --, --, --, --, --, --, --, --, --, --, --
Mark Friedman, Healthy, Van, D, FA, --, --, --, --, --, --, --, --, --, --, --, --, --, --, --, --, --, --, --
A.J. Greer, Healthy, Cgy, LW- RW, FA, --, --, --, --, --, --, --, --, --, --, --, --, --, --, --, --, --, --, --
Isaak Phillips, Healthy, Chi, D, FA, --, --, --, --, --, --, --, --, --, --, --, --, --, --, --, --, --, --, --
Sammy Walker, Healthy, Min, LW, FA, --, --, --, --, --, --, --, --, --, --, --, --, --, --, --, --, --, --, --
Jayden Struble, Healthy, Mon, D, FA, --, --, --, --, --, --, --, --, --, --, --, --, --, --, --, --, --, --, --
Dmitriy Simashev, Healthy, Ari, D, FA, --, --, --, --, --, --, --, --, --, --, --, --, --, --, --, --, --, --, --
Michael Stone, Healthy, Cgy, D, FA, --, --, --, --, --, --, --, --, --, --, --, --, --, --, --, --, --, --, --
Urho Vaakanainen, Healthy, Ana, D, FA, --, --, --, --, --, --, --, --, --, --, --, --, --, --, --, --, --, --, --
Colby Barlow, Healthy, Wpg, LW, FA, --, --, --, --, --, --, --, --, --, --, --, --, --, --, --, --, --, --, --
Justin Bailey, Healthy, SJ, RW, FA, --, --, --, --, --, --, --, --, --, --, --, --, --, --, --, --, --, --, --
Josh Mahura, Healthy, Fla, D, FA, --, --, --, --, --, --, --, --, --, --, --, --, --, --, --, --, --, --, --
Jake Muzzin, IR, Tor, D, CLB, --, --, --, --, --, --, --, --, --, --, --, --, --, --, --, --, --, --, --
Christian Dvorak, IR, Mon, LW, FA, --, --, --, --, --, --, --, --, --, --, --, --, --, --, --, --, --, --, --
Daniil But, Healthy, Ari, LW, FA, --, --, --, --, --, --, --, --, --, --, --, --, --, --, --, --, --, --, --
Max Willman, Healthy, NJ, C, FA, --, --, --, --, --, --, --, --, --, --, --, --, --, --, --, --, --, --, --
Lukas Cormier, Healthy, Vgk, D, FA, --, --, --, --, --, --, --, --, --, --, --, --, --, --, --, --, --, --, --
Sam Malinski, Healthy, Col, D, FA, --, --, --, --, --, --, --, --, --, --, --, --, --, --, --, --, --, --, --
Tyler Tucker, Healthy, StL, D, FA, --, --, --, --, --, --, --, --, --, --, --, --, --, --, --, --, --, --, --
Victor Soderstrom, Healthy, Ari, D, FA, --, --, --, --, --, --, --, --, --, --, --, --, --, --, --, --, --, --, --
Rasmus Kupari, Healthy, Wpg, C, FA, --, --, --, --, --, --, --, --, --, --, --, --, --, --, --, --, --, --, --
Oliver Bonk, Healthy, Phi, D, FA, --, --, --, --, --, --, --, --, --, --, --, --, --, --, --, --, --, --, --
Jansen Harkins, IR, Pit, C, FA, --, --, --, --, --, --, --, --, --, --, --, --, --, --, --, --, --, --, --
Joey Anderson, Healthy, Chi, RW, FA, --, --, --, --, --, --, --, --, --, --, --, --, --, --, --, --, --, --, --
Jacob Bryson, Healthy, Buf, D, FA, --, --, --, --, --, --, --, --, --, --, --, --, --, --, --, --, --, --, --
Tomas Nosek, Healthy, NJ, C, FA, --, --, --, --, --, --, --, --, --, --, --, --, --, --, --, --, --, --, --
Boris Katchouk, Healthy, Ott, LW, FA, @Wsh, L 3-6, --, --, --, --, --, --, --, --, --, --, --, --, --, --, --, --, --
Dennis Wideman, Healthy, Cgy, D, FA, --, --, --, --, --, --, --, --, --, --, --, --, --, --, --, --, --, --, --
Nick Ritchie, Healthy, StL, LW, FA, --, --, --, --, --, --, --, --, --, --, --, --, --, --, --, --, --, --, --
Danil Yurtaykin, Healthy, SJ, LW, FA, --, --, --, --, --, --, --, --, --, --, --, --, --, --, --, --, --, --, --
Danila Yurov, Healthy, Min, RW, FA, --, --, --, --, --, --, --, --, --, --, --, --, --, --, --, --, --, --, --
William Lagesson, Healthy, Ana, D, FA, --, --, --, --, --, --, --, --, --, --, --, --, --, --, --, --, --, --, --
