Jason Spezza, Healthy, Tor, C, FA, --, --, --, --, --, --, --, --, --, --, --, --, --, --, --, --, --, --, --
Alex Formenton, Healthy, Ott, LW, FA, --, --, --, --, --, --, --, --, --, --, --, --, --, --, --, --, --, --, --
Jordan Oesterle, Healthy, Cgy, D, FA, --, --, --, --, --, --, --, --, --, --, --, --, --, --, --, --, --, --, --
Nils Aman, Healthy, Van, C, FA, --, --, --, --, --, --, --, --, --, --, --, --, --, --, --, --, --, --, --
Jujhar Khaira, Healthy, Min, LW- C, FA, --, --, --, --, --, --, --, --, --, --, --, --, --, --, --, --, --, --, --
Tyce Thompson, Healthy, NYI, RW, FA, --, --, --, --, --, --, --, --, --, --, --, --, --, --, --, --, --, --, --
Eduard Sale, Healthy, Sea, RW, FA, --, --, --, --, --, --, --, --, --, --, --, --, --, --, --, --, --, --, --
Louie Belpedio, Healthy, Phi, D, FA, --, --, --, --, --, --, --, --, --, --, --, --, --, --, --, --, --, --, --
Patrick Wiercioch, Healthy, Van, D, FA, --, --, --, --, --, --, --, --, --, --, --, --, --, --, --, --, --, --, --
Jakub Voracek, IR, Ari, RW, FA, --, --, --, --, --, --, --, --, --, --, --, --, --, --, --, --, --, --, --
Zack Bolduc, Healthy, StL, C, FA, --, --, --, --, --, --, --, --, --, --, --, --, --, --, --, --, --, --, --
Ryan Carpenter, Healthy, SJ, C, FA, --, --, --, --, --, --, --, --, --, --, --, --, --, --, --, --, --, --, --
Ryan Getzlaf, Healthy, Ana, C, FA, --, --, --, --, --, --, --, --, --, --, --, --, --, --, --, --, --, --, --
Owen Pickering, Healthy, Pit, D, FA, --, --, --, --, --, --, --, --, --, --, --, --, --, --, --, --, --, --, --
Sam Poulin, Healthy, Pit, LW- C- RW, FA, --, --, --, --, --, --, --, --, --, --, --, --, --, --, --, --, --, --, --
Tobias Bjornfot, Healthy, Fla, D, FA, Det, L 2-3, --, --, --, --, --, --, --, --, --, --, --, --, --, --, --, --, --
Samuel Honzek, Healthy, Cgy, C, FA, --, --, --, --, --, --, --, --, --, --, --, --, --, --, --, --, --, --, --
Walker Duehr, Healthy, Cgy, RW, FA, --, --, --, --, --, --, --, --, --, --, --, --, --, --, --, --, --, --, --
Ronnie Attard, Healthy, Phi, D, FA, --, --, --, --, --, --, --, --, --, --, --, --, --, --, --, --, --, --, --
Dysin Mayo, Healthy, Vgk, D, FA, --, --, --, --, --, --, --, --, --, --, --, --, --, --, --, --, --, --, --
Robert Hagg, Healthy, Ana, D, FA, --, --, --, --, --, --, --, --, --, --, --, --, --, --, --, --, --, --, --
Oskar Lindblom, IR, SJ, LW, FA, --, --, --, --, --, --, --, --, --, --, --, --, --, --, --, --, --, --, --
Nolan Patrick, Healthy, Vgk, C, FA, --, --, --, --, --, --, --, --, --, --, --, --, --, --, --, --, --, --, --
Jack Studnicka, Healthy, SJ, C, FA, --, --, --, --, --, --, --, --, --, --, --, --, --, --, --, --, --, --, --
Ryan Ellis, IR, Phi, D, FA, --, --, --, --, --, --, --, --, --, --, --, --, --, --, --, --, --, --, --
Igor Ozhiganov, Healthy, Tor, D, FA, --, --, --, --, --, --, --, --, --, --, --, --, --, --, --, --, --, --, --
Gavin Brindley, Healthy, Cls, C, FA, --, --, --, --, --, --, --, --, --, --, --, --, --, --, --, --, --, --, --
Colin White, Healthy, Mon, C, FA, @NJ, W 3-2, --, --, --, --, --, --, --, --, --, --, --, --, --, --, --, --, --
Carl Hagelin, Healthy, Wsh, LW, FA, --, --, --, --, --, --, --, --, --, --, --, --, --, --, --, --, --, --, --
Denis Gurianov, Healthy, Phi, LW, FA, --, --, --, --, --, --, --, --, --, --, --, --, --, --, --, --, --, --, --
Bo Groulx, Healthy, Ana, C, FA, --, --, --, --, --, --, --, --, --, --, --, --, --, --, --, --, --, --, --
Jasper Weatherby, Healthy, Nsh, C, FA, --, --, --, --, --, --, --, --, --, --, --, --, --, --, --, --, --, --, --
Dryden Hunt, Healthy, Cgy, LW, FA, --, --, --, --, --, --, --, --, --, --, --, --, --, --, --, --, --, --, --
Patrick Brown, Healthy, Bos, C, FA, --, --, --, --, --, --, --, --, --, --, --, --, --, --, --, --, --, --, --
Felix Unger Sorum, Healthy, Car, RW, FA, --, --, --, --, --, --, --, --, --, --, --, --, --, --, --, --, --, --, --
Angus Crookshank, Healthy, Ott, LW, FA, --, --, --, --, --, --, --, --, --, --, --, --, --, --, --, --, --, --, --
Marc Del Gaizo, Healthy, Nsh, D, FA, --, --, --, --, --, --, --, --, --, --, --, --, --, --, --, --, --, --, --
Tanner Molendyk, Healthy, Nsh, D, FA, --, --, --, --, --, --, --, --, --, --, --, --, --, --, --, --, --, --, --
Colton White, Healthy, Ana, D, FA, --, --, --, --, --, --, --, --, --, --, --, --, --, --, --, --, --, --, --
Dennis Gilbert, Healthy, Cgy, D, FA, --, --, --, --, --, --, --, --, --, --, --, --, --, --, --, --, --, --, --
Liam Ohgren, Healthy, Min, LW, FA, --, --, --, --, --, --, --, --, --, --, --, --, --, --, --, --, --, --, --
Nick Holden, Healthy, Ott, D, FA, --, --, --, --, --, --, --, --, --, --, --, --, --, --, --, --, --, --, --
Samuel Bolduc, Healthy, NYI, D, FA, --, --, --, --, --, --, --, --, --, --, --, --, --, --, --, --, --, --, --
Keith Yandle, Healthy, Phi, D, FA, --, --, --, --, --, --, --, --, --, --, --, --, --, --, --, --, --, --, --
Mitchell Chaffee, Healthy, TB, RW, FA, --, --, --, --, --, --, --, --, --, --, --, --, --, --, --, --, --, --, --
Darren Archibald, Healthy, Tor, LW, FA, --, --, --, --, --, --, --, --, --, --, --, --, --, --, --, --, --, --, --
Jordan Gross, Healthy, Nsh, D, FA, --, --, --, --, --, --, --, --, --, --, --, --, --, --, --, --, --, --, --
Calum Ritchie, Healthy, Col, C, FA, --, --, --, --, --, --, --, --, --, --, --, --, --, --, --, --, --, --, --
Devin Shore, Healthy, Sea, C, FA, --, --, --, --, --, --, --, --, --, --, --, --, --, --, --, --, --, --, --
Dustin Brown, Healthy, LA, RW, FA, --, --, --, --, --, --, --, --, --, --, --, --, --, --, --, --, --, --, --
Nikita Alexandrov, Healthy, StL, C, FA, --, --, --, --, --, --, --, --, --, --, --, --, --, --, --, --, --, --, --
Anton Stralman, Healthy, Bos, D, FA, --, --, --, --, --, --, --, --, --, --, --, --, --, --, --, --, --, --, --
Emil Martinsen Lilleberg, Healthy, TB, D, FA, --, --, --, --, --, --, --, --, --, --, --, --, --, --, --, --, --, --, --
Kevan Miller, Healthy, Bos, D, FA, --, --, --, --, --, --, --, --, --, --, --, --, --, --, --, --, --, --, --
Bradly Nadeau, Healthy, Car, C, FA, --, --, --, --, --, --, --, --, --, --, --, --, --, --, --, --, --, --, --
Par Lindholm, Healthy, Bos, C, FA, --, --, --, --, --, --, --, --, --, --, --, --, --, --, --, --, --, --, --
Anthony Richard, Healthy, Bos, C, FA, --, --, --, --, --, --, --, --, --, --, --, --, --, --, --, --, --, --, --
Max Comtois, Healthy, Car, LW, FA, --, --, --, --, --, --, --, --, --, --, --, --, --, --, --, --, --, --, --
Mikhail Gulyayev, Healthy, Col, D, FA, --, --, --, --, --, --, --, --, --, --, --, --, --, --, --, --, --, --, --
Jonas Rondbjerg, Healthy, Vgk, RW- LW, FA, --, --, --, --, --, --, --, --, --, --, --, --, --, --, --, --, --, --, --
Andrew Poturalski, Healthy, Sea, C, FA, --, --, --, --, --, --, --, --, --, --, --, --, --, --, --, --, --, --, --
Jacob Lucchini, Healthy, Min, LW, FA, --, --, --, --, --, --, --, --, --, --, --, --, --, --, --, --, --, --, --
Reilly Walsh, Healthy, Bos, D, FA, --, --, --, --, --, --, --, --, --, --, --, --, --, --, --, --, --, --, --
Tyler Kleven, Healthy, Ott, D, FA, --, --, --, --, --, --, --, --, --, --, --, --, --, --, --, --, --, --, --
Isaac Howard, Healthy, TB, LW, FA, --, --, --, --, --, --, --, --, --, --, --, --, --, --, --, --, --, --, --
Josh Bailey, Healthy, Ott, LW, FA, --, --, --, --, --, --, --, --, --, --, --, --, --, --, --, --, --, --, --
Radim Simek, Healthy, SJ, D, FA, --, --, --, --, --, --, --, --, --, --, --, --, --, --, --, --, --, --, --
Connor Carrick, Healthy, Sea, D, FA, --, --, --, --, --, --, --, --, --, --, --, --, --, --, --, --, --, --, --
Arshdeep Bains, Healthy, Van, LW- RW, FA, --, --, --, --, --, --, --, --, --, --, --, --, --, --, --, --, --, --, --
Jakub Zboril, Healthy, Bos, D, FA, --, --, --, --, --, --, --, --, --, --, --, --, --, --, --, --, --, --, --
Philippe Myers, Healthy, TB, D, FA, --, --, --, --, --, --, --, --, --, --, --, --, --, --, --, --, --, --, --
Jake Christiansen, Healthy, Cls, D, FA, --, --, --, --, --, --, --, --, --, --, --, --, --, --, --, --, --, --, --
Derick Brassard, O, Ott, C, FA, --, --, --, --, --, --, --, --, --, --, --, --, --, --, --, --, --, --, --
Akito Hirose, Healthy, Van, D, FA, --, --, --, --, --, --, --, --, --, --, --, --, --, --, --, --, --, --, --
Cole McWard, Healthy, Van, D, FA, --, --, --, --, --, --, --, --, --, --, --, --, --, --, --, --, --, --, --
Brock McGinn, IR, Ana, LW, FA, --, --, --, --, --, --, --, --, --, --, --, --, --, --, --, --, --, --, --
David Gustafsson, Healthy, Wpg, C, FA, --, --, --, --, --, --, --, --, --, --, --, --, --, --, --, --, --, --, --
Oskar Olausson, O, Col, RW, FA, --, --, --, --, --, --, --, --, --, --, --, --, --, --, --, --, --, --, --
"Zachary LHeureux", Healthy, Nsh, LW, FA, --, --, --, --, --, --, --, --, --, --, --, --, --, --, --, --, --, --, --
Zack Kassian, Healthy, Ari, RW, FA, --, --, --, --, --, --, --, --, --, --, --, --, --, --, --, --, --, --, --
James Hamblin, Healthy, Edm, RW- C, FA, --, --, --, --, --, --, --, --, --, --, --, --, --, --, --, --, --, --, --
Riley Tufte, Healthy, Col, LW, FA, --, --, --, --, --, --, --, --, --, --, --, --, --, --, --, --, --, --, --
Paul Stastny, Healthy, Car, C, FA, --, --, --, --, --, --, --, --, --, --, --, --, --, --, --, --, --, --, --
Grigori Denisenko, Healthy, Vgk, LW, FA, --, --, --, --, --, --, --, --, --, --, --, --, --, --, --, --, --, --, --
Brinson Pasichnuk, Healthy, SJ, D, FA, --, --, --, --, --, --, --, --, --, --, --, --, --, --, --, --, --, --, --
Brad Hunt, Healthy, Col, D, FA, --, --, --, --, --, --, --, --, --, --, --, --, --, --, --, --, --, --, --
Lukas Dragicevic, Healthy, Sea, D, FA, --, --, --, --, --, --, --, --, --, --, --, --, --, --, --, --, --, --, --
Cale Fleury, Healthy, Sea, D, FA, --, --, --, --, --, --, --, --, --, --, --, --, --, --, --, --, --, --, --
Tucker Poolman, IR, Van, D, FA, --, --, --, --, --, --, --, --, --, --, --, --, --, --, --, --, --, --, --
John Leonard, Healthy, Ari, LW, FA, --, --, --, --, --, --, --, --, --, --, --, --, --, --, --, --, --, --, --
Gage Quinney, Healthy, Vgk, LW, FA, --, --, --, --, --, --, --, --, --, --, --, --, --, --, --, --, --, --, --
Carson Rehkopf, Healthy, Sea, LW, FA, --, --, --, --, --, --, --, --, --, --, --, --, --, --, --, --, --, --, --
Riley Heidt, Healthy, Min, C, FA, --, --, --, --, --, --, --, --, --, --, --, --, --, --, --, --, --, --, --
Justin Braun, Healthy, Phi, D, FA, --, --, --, --, --, --, --, --, --, --, --, --, --, --, --, --, --, --, --
Josiah Slavin, Healthy, Tor, LW, FA, --, --, --, --, --, --, --, --, --, --, --, --, --, --, --, --, --, --, --
Darren Helm, Healthy, Col, C, FA, --, --, --, --, --, --, --, --, --, --, --, --, --, --, --, --, --, --, --
Vladimir Tkachev, Healthy, LA, LW, FA, --, --, --, --, --, --, --, --, --, --, --, --, --, --, --, --, --, --, --
Jaret Anderson-Dolan, Healthy, Nsh, C- RW, FA, --, --, --, --, --, --, --, --, --, --, --, --, --, --, --, --, --, --, --
Derek Grant, Healthy, Ana, C- LW, FA, --, --, --, --, --, --, --, --, --, --, --, --, --, --, --, --, --, --, --
Ryan Shea, Healthy, Pit, D, FA, --, --, --, --, --, --, --, --, --, --, --, --, --, --, --, --, --, --, --
Dylan McIlrath, Healthy, Wsh, D, FA, --, --, --, --, --, --, --, --, --, --, --, --, --, --, --, --, --, --, --
Dan Girardi, Healthy, TB, D, FA, --, --, --, --, --, --, --, --, --, --, --, --, --, --, --, --, --, --, --
Jacob Perreault, Healthy, Mon, RW, FA, @NJ, W 3-2, --, --, --, --, --, --, --, --, --, --, --, --, --, --, --, --, --
Patrik Nemeth, Healthy, Ari, D, FA, --, --, --, --, --, --, --, --, --, --, --, --, --, --, --, --, --, --, --
Mason Geertsen, Healthy, Vgk, D, FA, --, --, --, --, --, --, --, --, --, --, --, --, --, --, --, --, --, --, --
Nikolai Knyzhov, Healthy, SJ, D, FA, --, --, --, --, --, --, --, --, --, --, --, --, --, --, --, --, --, --, --
Scott Harrington, Healthy, Ana, D, FA, --, --, --, --, --, --, --, --, --, --, --, --, --, --, --, --, --, --, --
Max McCormick, Healthy, Sea, LW, FA, --, --, --, --, --, --, --, --, --, --, --, --, --, --, --, --, --, --, --
Adam Gaudette, Healthy, StL, C, FA, --, --, --, --, --, --, --, --, --, --, --, --, --, --, --, --, --, --, --
John Hayden, Healthy, Sea, RW, FA, --, --, --, --, --, --, --, --, --, --, --, --, --, --, --, --, --, --, --
Maxime Lajoie, Healthy, Tor, D, FA, --, --, --, --, --, --, --, --, --, --, --, --, --, --, --, --, --, --, --
Cole Koepke, Healthy, TB, LW, FA, --, --, --, --, --, --, --, --, --, --, --, --, --, --, --, --, --, --, --
Alex Chiasson, Healthy, Bos, RW, FA, --, --, --, --, --, --, --, --, --, --, --, --, --, --, --, --, --, --, --
Logan Brown, IR, TB, C, FA, --, --, --, --, --, --, --, --, --, --, --, --, --, --, --, --, --, --, --
Ilya Solovyov, Healthy, Cgy, D, FA, --, --, --, --, --, --, --, --, --, --, --, --, --, --, --, --, --, --, --
Michael Del Zotto, Healthy, Ana, D, FA, --, --, --, --, --, --, --, --, --, --, --, --, --, --, --, --, --, --, --
Axel Jonsson-Fjallby, Healthy, Wpg, LW, FA, --, --, --, --, --, --, --, --, --, --, --, --, --, --, --, --, --, --, --
Otto Stenberg, Healthy, StL, C, FA, --, --, --, --, --, --, --, --, --, --, --, --, --, --, --, --, --, --, --
Carey Terrance, Healthy, Ana, C, FA, --, --, --, --, --, --, --, --, --, --, --, --, --, --, --, --, --, --, --
Joonas Donskoi, Healthy, Sea, RW, FA, --, --, --, --, --, --, --, --, --, --, --, --, --, --, --, --, --, --, --
Vitali Kravtsov, Healthy, Van, LW, FA, --, --, --, --, --, --, --, --, --, --, --, --, --, --, --, --, --, --, --
Andrew Ladd, Healthy, Ari, LW, FA, --, --, --, --, --, --, --, --, --, --, --, --, --, --, --, --, --, --, --
Victor Mete, Healthy, Phi, D, FA, --, --, --, --, --, --, --, --, --, --, --, --, --, --, --, --, --, --, --
Joe Snively, Healthy, Wsh, RW- LW, FA, --, --, --, --, --, --, --, --, --, --, --, --, --, --, --, --, --, --, --
Mackenzie MacEachern, Healthy, StL, LW, FA, --, --, --, --, --, --, --, --, --, --, --, --, --, --, --, --, --, --, --
Rourke Chartier, IR, Ott, C, FA, --, --, --, --, --, --, --, --, --, --, --, --, --, --, --, --, --, --, --
Waltteri Merela, Healthy, TB, RW, FA, --, --, --, --, --, --, --, --, --, --, --, --, --, --, --, --, --, --, --
Kyle MacLean, Healthy, NYI, C- LW, FA, --, --, --, --, --, --, --, --, --, --, --, --, --, --, --, --, --, --, --
Louis Crevier, Healthy, Chi, D, FA, @Buf, Postponed, --, --, --, --, --, --, --, --, --, --, --, --, --, --, --, --, --
Ryan Murray, O, Edm, D, FA, --, --, --, --, --, --, --, --, --, --, --, --, --, --, --, --, --, --, --
Lian Bichsel, Healthy, Dal, D, FA, --, --, --, --, --, --, --, --, --, --, --, --, --, --, --, --, --, --, --
Matt Irwin, Healthy, Van, D, FA, --, --, --, --, --, --, --, --, --, --, --, --, --, --, --, --, --, --, --
Vladislav Kolyachonok, Healthy, Ari, D, FA, --, --, --, --, --, --, --, --, --, --, --, --, --, --, --, --, --, --, --
Andrej Sekera, Healthy, Dal, D, FA, --, --, --, --, --, --, --, --, --, --, --, --, --, --, --, --, --, --, --
Cody McLeod, Healthy, Nsh, LW, FA, --, --, --, --, --, --, --, --, --, --, --, --, --, --, --, --, --, --, --
Cole Schwindt, Healthy, Cgy, RW, FA, --, --, --, --, --, --, --, --, --, --, --, --, --, --, --, --, --, --, --
Jan Jenik, Healthy, Ari, C, FA, --, --, --, --, --, --, --, --, --, --, --, --, --, --, --, --, --, --, --
David Edstrom, Healthy, Vgk, C, FA, --, --, --, --, --, --, --, --, --, --, --, --, --, --, --, --, --, --, --
Egor Afanasyev, Healthy, Nsh, LW, FA, --, --, --, --, --, --, --, --, --, --, --, --, --, --, --, --, --, --, --
CJ Suess, Healthy, SJ, LW, FA, --, --, --, --, --, --, --, --, --, --, --, --, --, --, --, --, --, --, --
Derek Stepan, Healthy, Car, C, FA, --, --, --, --, --, --, --, --, --, --, --, --, --, --, --, --, --, --, --
Rudolfs Balcers, Healthy, TB, LW, FA, --, --, --, --, --, --, --, --, --, --, --, --, --, --, --, --, --, --, --
Michael Sgarbossa, Healthy, Wsh, C, FA, --, --, --, --, --, --, --, --, --, --, --, --, --, --, --, --, --, --, --
Liam Foudy, Healthy, Nsh, RW- C- LW, FA, --, --, --, --, --, --, --, --, --, --, --, --, --, --, --, --, --, --, --
Mark Borowiecki, Healthy, Nsh, D, FA, --, --, --, --, --, --, --, --, --, --, --, --, --, --, --, --, --, --, --
Cam Dineen, Healthy, Edm, D, FA, --, --, --, --, --, --, --, --, --, --, --, --, --, --, --, --, --, --, --
Jason Demers, Healthy, Edm, D, FA, --, --, --, --, --, --, --, --, --, --, --, --, --, --, --, --, --, --, --
Maveric Lamoureux, Healthy, Ari, D, FA, --, --, --, --, --, --, --, --, --, --, --, --, --, --, --, --, --, --, --
Spencer Stastney, DTD, Nsh, D, FA, --, --, --, --, --, --, --, --, --, --, --, --, --, --, --, --, --, --, --
Derrick Pouliot, Healthy, Dal, D, FA, --, --, --, --, --, --, --, --, --, --, --, --, --, --, --, --, --, --, --
Sampo Ranta, Healthy, Col, LW, FA, --, --, --, --, --, --, --, --, --, --, --, --, --, --, --, --, --, --, --
Marian Studenic, Healthy, Sea, RW, FA, --, --, --, --, --, --, --, --, --, --, --, --, --, --, --, --, --, --, --
Filip Bystedt, Healthy, SJ, C, FA, --, --, --, --, --, --, --, --, --, --, --, --, --, --, --, --, --, --, --
Denis Malgin, Healthy, Col, C- RW, FA, --, --, --, --, --, --, --, --, --, --, --, --, --, --, --, --, --, --, --
Raphael Lavoie, Healthy, Edm, C, FA, --, --, --, --, --, --, --, --, --, --, --, --, --, --, --, --, --, --, --
Aidan McDonough, Healthy, Van, LW, FA, --, --, --, --, --, --, --, --, --, --, --, --, --, --, --, --, --, --, --
Brian Boyle, Healthy, Pit, C, FA, --, --, --, --, --, --, --, --, --, --, --, --, --, --, --, --, --, --, --
Mikael Pyyhtia, Healthy, Cls, LW, FA, --, --, --, --, --, --, --, --, --, --, --, --, --, --, --, --, --, --, --
Jonathan Gruden, Healthy, Pit, C, FA, --, --, --, --, --, --, --, --, --, --, --, --, --, --, --, --, --, --, --
Andreas Johnsson, Healthy, Pit, LW, FA, --, --, --, --, --, --, --, --, --, --, --, --, --, --, --, --, --, --, --
Ben Lovejoy, Healthy, Dal, D, FA, --, --, --, --, --, --, --, --, --, --, --, --, --, --, --, --, --, --, --
Jacob Moverare, Healthy, LA, D, FA, --, --, --, --, --, --, --, --, --, --, --, --, --, --, --, --, --, --, --
Beau Akey, Healthy, Edm, D, FA, --, --, --, --, --, --, --, --, --, --, --, --, --, --, --, --, --, --, --
Markus Nutivaara, Healthy, SJ, D, FA, --, --, --, --, --, --, --, --, --, --, --, --, --, --, --, --, --, --, --
Gustav Olofsson, Healthy, Sea, D, FA, --, --, --, --, --, --, --, --, --, --, --, --, --, --, --, --, --, --, --
Kevin Rooney, Healthy, Cgy, C, FA, --, --, --, --, --, --, --, --, --, --, --, --, --, --, --, --, --, --, --
Landon Slaggert, Healthy, Chi, LW, FA, @Buf, Postponed, --, --, --, --, --, --, --, --, --, --, --, --, --, --, --, --, --
Milos Kelemen, Healthy, Ari, LW, FA, --, --, --, --, --, --, --, --, --, --, --, --, --, --, --, --, --, --, --
Greg McKegg, Healthy, Edm, C, FA, --, --, --, --, --, --, --, --, --, --, --, --, --, --, --, --, --, --, --
Chris Wagner, Healthy, Col, RW, FA, --, --, --, --, --, --, --, --, --, --, --, --, --, --, --, --, --, --, --
Max Veronneau, Healthy, SJ, RW, FA, --, --, --, --, --, --, --, --, --, --, --, --, --, --, --, --, --, --, --
Loui Eriksson, Healthy, Ari, LW, FA, --, --, --, --, --, --, --, --, --, --, --, --, --, --, --, --, --, --, --
Sheldon Rempal, Healthy, Vgk, RW, FA, --, --, --, --, --, --, --, --, --, --, --, --, --, --, --, --, --, --, --
Dylan Coghlan, Healthy, Car, D, FA, --, --, --, --, --, --, --, --, --, --, --, --, --, --, --, --, --, --, --
Maxence Guenette, Healthy, Ott, D, FA, --, --, --, --, --, --, --, --, --, --, --, --, --, --, --, --, --, --, --
Grant Hutton, Healthy, NYI, D, FA, --, --, --, --, --, --, --, --, --, --, --, --, --, --, --, --, --, --, --
Lucas Johansen, Healthy, Wsh, D, FA, --, --, --, --, --, --, --, --, --, --, --, --, --, --, --, --, --, --, --
Nathan Beaulieu, Healthy, Car, D, FA, --, --, --, --, --, --, --, --, --, --, --, --, --, --, --, --, --, --, --
William Dufour, Healthy, NYI, RW, FA, --, --, --, --, --, --, --, --, --, --, --, --, --, --, --, --, --, --, --
Danny Nelson, Healthy, NYI, C, FA, --, --, --, --, --, --, --, --, --, --, --, --, --, --, --, --, --, --, --
Olli Juolevi, Healthy, Ari, D, FA, --, --, --, --, --, --, --, --, --, --, --, --, --, --, --, --, --, --, --
Slater Koekkoek, Healthy, Edm, D, FA, --, --, --, --, --, --, --, --, --, --, --, --, --, --, --, --, --, --, --
Martin Frk, Healthy, StL, RW, FA, --, --, --, --, --, --, --, --, --, --, --, --, --, --, --, --, --, --, --
Pavol Regenda, Healthy, Ana, C, FA, --, --, --, --, --, --, --, --, --, --, --, --, --, --, --, --, --, --, --
Jack Dugan, Healthy, Vgk, RW, FA, --, --, --, --, --, --, --, --, --, --, --, --, --, --, --, --, --, --, --
Jeffrey Viel, Healthy, Wpg, LW, FA, --, --, --, --, --, --, --, --, --, --, --, --, --, --, --, --, --, --, --
Reid Schaefer, Healthy, Nsh, LW, FA, --, --, --, --, --, --, --, --, --, --, --, --, --, --, --, --, --, --, --
Austin Poganski, Healthy, Ari, RW, FA, --, --, --, --, --, --, --, --, --, --, --, --, --, --, --, --, --, --, --
Jonathan Dahlen, Healthy, SJ, RW, FA, --, --, --, --, --, --, --, --, --, --, --, --, --, --, --, --, --, --, --
Hugh McGing, Healthy, StL, C- LW, FA, --, --, --, --, --, --, --, --, --, --, --, --, --, --, --, --, --, --, --
Drake Caggiula, Healthy, Edm, LW, FA, --, --, --, --, --, --, --, --, --, --, --, --, --, --, --, --, --, --, --
Stanislav Svozil, Healthy, Cls, D, FA, --, --, --, --, --, --, --, --, --, --, --, --, --, --, --, --, --, --, --
Libor Hajek, Healthy, Pit, D, FA, --, --, --, --, --, --, --, --, --, --, --, --, --, --, --, --, --, --, --
Paul LaDue, Healthy, NYI, D, FA, --, --, --, --, --, --, --, --, --, --, --, --, --, --, --, --, --, --, --
Ben Harpur, O, NYR, D, FA, --, --, --, --, --, --, --, --, --, --, --, --, --, --, --, --, --, --, --
Marcus Bjork, Healthy, Cls, D, FA, --, --, --, --, --, --, --, --, --, --, --, --, --, --, --, --, --, --, --
Andy Greene, Healthy, NYI, D, FA, --, --, --, --, --, --, --, --, --, --, --, --, --, --, --, --, --, --, --
Mike Vecchione, Healthy, Wsh, C, FA, --, --, --, --, --, --, --, --, --, --, --, --, --, --, --, --, --, --, --
Jack Rathbone, Healthy, Pit, D, FA, --, --, --, --, --, --, --, --, --, --, --, --, --, --, --, --, --, --, --
Marshall Rifai, Healthy, Tor, D- LW, FA, --, --, --, --, --, --, --, --, --, --, --, --, --, --, --, --, --, --, --
Olle Lycksell, Healthy, Phi, RW, FA, --, --, --, --, --, --, --, --, --, --, --, --, --, --, --, --, --, --, --
Egor Sokolov, Healthy, Ott, LW, FA, --, --, --, --, --, --, --, --, --, --, --, --, --, --, --, --, --, --, --
Ethan Gauthier, Healthy, TB, RW, FA, --, --, --, --, --, --, --, --, --, --, --, --, --, --, --, --, --, --, --
Riley Nash, Healthy, NYR, C, FA, --, --, --, --, --, --, --, --, --, --, --, --, --, --, --, --, --, --, --
David Desharnais, Healthy, NYR, C, FA, --, --, --, --, --, --, --, --, --, --, --, --, --, --, --, --, --, --, --
Matthew Highmore, IR, Ott, C, FA, --, --, --, --, --, --, --, --, --, --, --, --, --, --, --, --, --, --, --
Alex Burrows, Healthy, Ott, RW, FA, --, --, --, --, --, --, --, --, --, --, --, --, --, --, --, --, --, --, --
Dylan Gambrell, Healthy, Tor, C, FA, --, --, --, --, --, --, --, --, --, --, --, --, --, --, --, --, --, --, --
Will Butcher, Healthy, Min, D, FA, --, --, --, --, --, --, --, --, --, --, --, --, --, --, --, --, --, --, --
Trevor Carrick, Healthy, Ana, D, FA, --, --, --, --, --, --, --, --, --, --, --, --, --, --, --, --, --, --, --
Tristan Bertucci, Healthy, Dal, D, FA, --, --, --, --, --, --, --, --, --, --, --, --, --, --, --, --, --, --, --
Guillaume Brisebois, Healthy, Van, D, FA, --, --, --, --, --, --, --, --, --, --, --, --, --, --, --, --, --, --, --
Nick Swaney, Healthy, Min, RW, FA, --, --, --, --, --, --, --, --, --, --, --, --, --, --, --, --, --, --, --
Linus Karlsson, Healthy, Van, C- RW, FA, --, --, --, --, --, --, --, --, --, --, --, --, --, --, --, --, --, --, --
Nathan Smith, Healthy, Ari, LW, FA, --, --, --, --, --, --, --, --, --, --, --, --, --, --, --, --, --, --, --
Charles Hudon, Healthy, LA, LW, FA, --, --, --, --, --, --, --, --, --, --, --, --, --, --, --, --, --, --, --
Anthony Angello, Healthy, Nsh, C, FA, --, --, --, --, --, --, --, --, --, --, --, --, --, --, --, --, --, --, --
Gabriel Carlsson, Healthy, Wsh, D, FA, --, --, --, --, --, --, --, --, --, --, --, --, --, --, --, --, --, --, --
Joey Keane, Healthy, Car, D, FA, --, --, --, --, --, --, --, --, --, --, --, --, --, --, --, --, --, --, --
Emil Andrae, Healthy, Phi, D, FA, --, --, --, --, --, --, --, --, --, --, --, --, --, --, --, --, --, --, --
Cole Reinhardt, Healthy, Ott, LW, FA, --, --, --, --, --, --, --, --, --, --, --, --, --, --, --, --, --, --, --
Frederik Tiffels, Healthy, Pit, LW, FA, --, --, --, --, --, --, --, --, --, --, --, --, --, --, --, --, --, --, --
Alex Steeves, Healthy, Tor, RW, FA, --, --, --, --, --, --, --, --, --, --, --, --, --, --, --, --, --, --, --
Joona Koppanen, Healthy, Pit, LW, FA, --, --, --, --, --, --, --, --, --, --, --, --, --, --, --, --, --, --, --
Marc Johnstone, Healthy, Pit, RW, FA, --, --, --, --, --, --, --, --, --, --, --, --, --, --, --, --, --, --, --
Antoine Roussel, Healthy, Phi, LW, FA, --, --, --, --, --, --, --, --, --, --, --, --, --, --, --, --, --, --, --
Jayson Megna, Healthy, Bos, C, FA, --, --, --, --, --, --, --, --, --, --, --, --, --, --, --, --, --, --, --
Jake Leschyshyn, Healthy, NYR, C, FA, --, --, --, --, --, --, --, --, --, --, --, --, --, --, --, --, --, --, --
James Neal, Healthy, Cls, RW, FA, --, --, --, --, --, --, --, --, --, --, --, --, --, --, --, --, --, --, --
Daemon Hunt, Healthy, Min, D, FA, --, --, --, --, --, --, --, --, --, --, --, --, --, --, --, --, --, --, --
Markus Niemelainen, Healthy, Edm, D, FA, --, --, --, --, --, --, --, --, --, --, --, --, --, --, --, --, --, --, --
Michal Kempny, Healthy, Sea, D, FA, --, --, --, --, --, --, --, --, --, --, --, --, --, --, --, --, --, --, --
