Warren Foegele, Healthy, Edm, LW- RW, FA, --, --, --, --, --, --, --, --, --, --, --, --, --, --, --, --, --, --, --
Marcus Johansson, Healthy, Min, LW- RW, FA, --, --, --, --, --, --, --, --, --, --, --, --, --, --, --, --, --, --, --
Zach Benson, Healthy, Buf, LW, FA, --, --, --, --, --, --, --, --, --, --, --, --, --, --, --, --, --, --, --
Jacob Peterson, Healthy, SJ, C- LW- RW, FA, --, --, --, --, --, --, --, --, --, --, --, --, --, --, --, --, --, --, --
Stefan Noesen, Healthy, Car, LW- RW, FA, --, --, --, --, --, --, --, --, --, --, --, --, --, --, --, --, --, --, --
Nicolas Hague, Healthy, Vgk, D, FA, --, --, --, --, --, --, --, --, --, --, --, --, --, --, --, --, --, --, --
Ryan McLeod, Healthy, Edm, C, FA, --, --, --, --, --, --, --, --, --, --, --, --, --, --, --, --, --, --, --
Calen Addison, Healthy, SJ, D, FA, --, --, --, --, --, --, --, --, --, --, --, --, --, --, --, --, --, --, --
Nicolas Roy, Healthy, Vgk, C, FA, --, --, --, --, --, --, --, --, --, --, --, --, --, --, --, --, --, --, --
Fabian Lysell, Healthy, Bos, RW, FA, --, --, --, --, --, --, --, --, --, --, --, --, --, --, --, --, --, --, --
Justin Barron, Healthy, Mon, D, FA, --, --, --, --, --, --, --, --, --, --, --, --, --, --, --, --, --, --, --
Alex Wennberg, Healthy, Sea, C, FA, --, --, --, --, --, --, --, --, --, --, --, --, --, --, --, --, --, --, --
Cole Smith, Healthy, Nsh, LW- RW, FA, --, --, --, --, --, --, --, --, --, --, --, --, --, --, --, --, --, --, --
Nate Schmidt, Healthy, Wpg, D, FA, --, --, --, --, --, --, --, --, --, --, --, --, --, --, --, --, --, --, --
Anthony Beauvillier, IR, Chi, RW- LW, FA, @Tor, W 4-1, --, --, --, --, --, --, --, --, --, --, --, --, --, --, --, --, --
Ty Smith, Healthy, Pit, D, FA, --, --, --, --, --, --, --, --, --, --, --, --, --, --, --, --, --, --, --
Conor Garland, Healthy, Van, RW, FA, --, --, --, --, --, --, --, --, --, --, --, --, --, --, --, --, --, --, --
Nils Hoglander, Healthy, Van, LW, FA, --, --, --, --, --, --, --, --, --, --, --, --, --, --, --, --, --, --, --
Sam Lafferty, Healthy, Van, C, FA, --, --, --, --, --, --, --, --, --, --, --, --, --, --, --, --, --, --, --
Teddy Blueger, Healthy, Van, C, FA, --, --, --, --, --, --, --, --, --, --, --, --, --, --, --, --, --, --, --
Kasperi Kapanen, Healthy, StL, RW, FA, --, --, --, --, --, --, --, --, --, --, --, --, --, --, --, --, --, --, --
Ridly Greig, Healthy, Ott, C- LW, FA, --, --, --, --, --, --, --, --, --, --, --, --, --, --, --, --, --, --, --
Kailer Yamamoto, Healthy, Sea, RW, FA, --, --, --, --, --, --, --, --, --, --, --, --, --, --, --, --, --, --, --
Ian Cole, Healthy, Van, D, FA, --, --, --, --, --, --, --, --, --, --, --, --, --, --, --, --, --, --, --
Ryan Suter, Healthy, Dal, D, FA, --, --, --, --, --, --, --, --, --, --, --, --, --, --, --, --, --, --, --
Tanner Pearson, IR, Mon, LW, FA, --, --, --, --, --, --, --, --, --, --, --, --, --, --, --, --, --, --, --
Tomas Tatar, Healthy, Sea, LW, FA, --, --, --, --, --, --, --, --, --, --, --, --, --, --, --, --, --, --, --
Bobby Brink, Healthy, Phi, RW, FA, --, --, --, --, --, --, --, --, --, --, --, --, --, --, --, --, --, --, --
Erik Cernak, DTD, TB, D, FA, --, --, --, --, --, --, --, --, --, --, --, --, --, --, --, --, --, --, --
Jacob Bernard-Docker, Healthy, Ott, D, FA, --, --, --, --, --, --, --, --, --, --, --, --, --, --, --, --, --, --, --
Zach Whitecloud, Healthy, Vgk, D, FA, --, --, --, --, --, --, --, --, --, --, --, --, --, --, --, --, --, --, --
Shane Pinto, SSPD, Ott, C, FA, --, --, --, --, --, --, --, --, --, --, --, --, --, --, --, --, --, --, --
Adam Edstrom, Healthy, NYR, C, FA, Ari, W 2-1, --, --, --, --, --, --, --, --, --, --, --, --, --, --, --, --, --
Victor Olofsson, Healthy, Buf, RW, FA, --, --, --, --, --, --, --, --, --, --, --, --, --, --, --, --, --, --, --
Justin Schultz, Healthy, Sea, D, FA, --, --, --, --, --, --, --, --, --, --, --, --, --, --, --, --, --, --, --
Henry Thrun, Healthy, SJ, D, FA, --, --, --, --, --, --, --, --, --, --, --, --, --, --, --, --, --, --, --
Garnet Hathaway, Healthy, Phi, RW, FA, --, --, --, --, --, --, --, --, --, --, --, --, --, --, --, --, --, --, --
Kevin Hayes, Healthy, StL, C, FA, --, --, --, --, --, --, --, --, --, --, --, --, --, --, --, --, --, --, --
Jesse Ylonen, Healthy, Mon, RW, FA, --, --, --, --, --, --, --, --, --, --, --, --, --, --, --, --, --, --, --
Sebastian Aho, Healthy, NYI, D, FA, --, --, --, --, --, --, --, --, --, --, --, --, --, --, --, --, --, --, --
Dominic Toninato, Healthy, Wpg, C, FA, --, --, --, --, --, --, --, --, --, --, --, --, --, --, --, --, --, --, --
Kiefer Sherwood, Healthy, Nsh, LW- RW, FA, --, --, --, --, --, --, --, --, --, --, --, --, --, --, --, --, --, --, --
Carl Grundstrom, Healthy, LA, LW, FA, --, --, --, --, --, --, --, --, --, --, --, --, --, --, --, --, --, --, --
Noah Cates, IR, Phi, LW, FA, --, --, --, --, --, --, --, --, --, --, --, --, --, --, --, --, --, --, --
Alexander Barabanov, Healthy, SJ, LW, FA, --, --, --, --, --, --, --, --, --, --, --, --, --, --, --, --, --, --, --
Martin Pospisil, Healthy, Cgy, LW- RW, FA, @Wsh, L 2-3, --, --, --, --, --, --, --, --, --, --, --, --, --, --, --, --, --
Matt Grzelcyk, Healthy, Bos, D, FA, --, --, --, --, --, --, --, --, --, --, --, --, --, --, --, --, --, --, --
Keegan Kolesar, Healthy, Vgk, RW, FA, --, --, --, --, --, --, --, --, --, --, --, --, --, --, --, --, --, --, --
Phil Kessel, Healthy, Vgk, RW, FA, --, --, --, --, --, --, --, --, --, --, --, --, --, --, --, --, --, --, --
Frederick Gaudreau, Healthy, Min, C, FA, --, --, --, --, --, --, --, --, --, --, --, --, --, --, --, --, --, --, --
Brandon Tanev, Healthy, Sea, LW, FA, --, --, --, --, --, --, --, --, --, --, --, --, --, --, --, --, --, --, --
Egor Zamula, Healthy, Phi, D, FA, --, --, --, --, --, --, --, --, --, --, --, --, --, --, --, --, --, --, --
Michael Pezzetta, Healthy, Mon, LW- RW, FA, --, --, --, --, --, --, --, --, --, --, --, --, --, --, --, --, --, --, --
Juuso Parssinen, Healthy, Nsh, C- RW, FA, --, --, --, --, --, --, --, --, --, --, --, --, --, --, --, --, --, --, --
Cody Ceci, Healthy, Edm, D, FA, --, --, --, --, --, --, --, --, --, --, --, --, --, --, --, --, --, --, --
Pat Maroon, Healthy, Min, LW, FA, --, --, --, --, --, --, --, --, --, --, --, --, --, --, --, --, --, --, --
Dmitri Voronkov, Healthy, Cls, LW, FA, Det, L 0-4, --, --, --, --, --, --, --, --, --, --, --, --, --, --, --, --, --
Kyle Burroughs, Healthy, SJ, D, FA, --, --, --, --, --, --, --, --, --, --, --, --, --, --, --, --, --, --, --
Brendan Gallagher, Healthy, Mon, RW, FA, --, --, --, --, --, --, --, --, --, --, --, --, --, --, --, --, --, --, --
Travis Hamonic, Healthy, Ott, D, FA, --, --, --, --, --, --, --, --, --, --, --, --, --, --, --, --, --, --, --
Dante Fabbro, Healthy, Nsh, D, FA, --, --, --, --, --, --, --, --, --, --, --, --, --, --, --, --, --, --, --
Michael Amadio, Healthy, Vgk, RW- C- LW, FA, --, --, --, --, --, --, --, --, --, --, --, --, --, --, --, --, --, --, --
Nils Lundkvist, Healthy, Dal, D, FA, --, --, --, --, --, --, --, --, --, --, --, --, --, --, --, --, --, --, --
Wade Allison, Healthy, Phi, RW, FA, --, --, --, --, --, --, --, --, --, --, --, --, --, --, --, --, --, --, --
Sam Gagner, Healthy, Edm, C, FA, --, --, --, --, --, --, --, --, --, --, --, --, --, --, --, --, --, --, --
Erik Johnson, Healthy, Buf, D, FA, --, --, --, --, --, --, --, --, --, --, --, --, --, --, --, --, --, --, --
Cal Clutterbuck, Healthy, NYI, RW, FA, --, --, --, --, --, --, --, --, --, --, --, --, --, --, --, --, --, --, --
Simon Holmstrom, Healthy, NYI, RW, FA, --, --, --, --, --, --, --, --, --, --, --, --, --, --, --, --, --, --, --
Milan Lucic, IR, Bos, LW, FA, --, --, --, --, --, --, --, --, --, --, --, --, --, --, --, --, --, --, --
Henri Jokiharju, Healthy, Buf, D, FA, --, --, --, --, --, --, --, --, --, --, --, --, --, --, --, --, --, --, --
Matvei Michkov, Healthy, Phi, RW, FA, --, --, --, --, --, --, --, --, --, --, --, --, --, --, --, --, --, --, --
Derek Forbort, IR, Bos, D, FA, --, --, --, --, --, --, --, --, --, --, --, --, --, --, --, --, --, --, --
Miles Wood, O, Col, LW, FA, --, --, --, --, --, --, --, --, --, --, --, --, --, --, --, --, --, --, --
Yakov Trenin, Healthy, Nsh, LW- C, FA, --, --, --, --, --, --, --, --, --, --, --, --, --, --, --, --, --, --, --
Noel Acciari, Healthy, Pit, C, FA, --, --, --, --, --, --, --, --, --, --, --, --, --, --, --, --, --, --, --
Brandon Saad, Healthy, StL, LW, FA, --, --, --, --, --, --, --, --, --, --, --, --, --, --, --, --, --, --, --
Lars Eller, Healthy, Pit, C, FA, --, --, --, --, --, --, --, --, --, --, --, --, --, --, --, --, --, --, --
Kyle Okposo, Healthy, Buf, RW, FA, --, --, --, --, --, --, --, --, --, --, --, --, --, --, --, --, --, --, --
Josh Archibald, Healthy, TB, RW, FA, --, --, --, --, --, --, --, --, --, --, --, --, --, --, --, --, --, --, --
Evgenii Dadonov, Healthy, Dal, RW, FA, --, --, --, --, --, --, --, --, --, --, --, --, --, --, --, --, --, --, --
Brett Kulak, Healthy, Edm, D, FA, --, --, --, --, --, --, --, --, --, --, --, --, --, --, --, --, --, --, --
"Drew OConnor", Healthy, Pit, LW, FA, --, --, --, --, --, --, --, --, --, --, --, --, --, --, --, --, --, --, --
Cutter Gauthier, Healthy, Ana, LW, FA, --, --, --, --, --, --, --, --, --, --, --, --, --, --, --, --, --, --, --
Matt Benning, IR, SJ, D, FA, --, --, --, --, --, --, --, --, --, --, --, --, --, --, --, --, --, --, --
Nick Perbix, Healthy, TB, D, FA, --, --, --, --, --, --, --, --, --, --, --, --, --, --, --, --, --, --, --
Logan Stankoven, Healthy, Dal, C, FA, --, --, --, --, --, --, --, --, --, --, --, --, --, --, --, --, --, --, --
Jack Johnson, Healthy, Col, D, FA, --, --, --, --, --, --, --, --, --, --, --, --, --, --, --, --, --, --, --
Casey Cizikas, O, NYI, C, FA, --, --, --, --, --, --, --, --, --, --, --, --, --, --, --, --, --, --, --
William Smith, Healthy, SJ, C, FA, --, --, --, --, --, --, --, --, --, --, --, --, --, --, --, --, --, --, --
Jordan Greenway, Healthy, Buf, LW, FA, --, --, --, --, --, --, --, --, --, --, --, --, --, --, --, --, --, --, --
Jordan Harris, Healthy, Mon, D, FA, --, --, --, --, --, --, --, --, --, --, --, --, --, --, --, --, --, --, --
Nicolas Deslauriers, Healthy, Phi, RW- LW, FA, --, --, --, --, --, --, --, --, --, --, --, --, --, --, --, --, --, --, --
Michael McCarron, Healthy, Nsh, RW, FA, --, --, --, --, --, --, --, --, --, --, --, --, --, --, --, --, --, --, --
Nick Leddy, Healthy, StL, D, FA, --, --, --, --, --, --, --, --, --, --, --, --, --, --, --, --, --, --, --
Mason Lohrei, Healthy, Bos, D, FA, --, --, --, --, --, --, --, --, --, --, --, --, --, --, --, --, --, --, --
Jack Drury, Healthy, Car, C- LW, FA, --, --, --, --, --, --, --, --, --, --, --, --, --, --, --, --, --, --, --
Caleb Jones, Healthy, Col, D, FA, --, --, --, --, --, --, --, --, --, --, --, --, --, --, --, --, --, --, --
Pius Suter, Healthy, Van, C, FA, --, --, --, --, --, --, --, --, --, --, --, --, --, --, --, --, --, --, --
Nikita Okhotiuk, Healthy, SJ, D, FA, --, --, --, --, --, --, --, --, --, --, --, --, --, --, --, --, --, --, --
Brandon Duhaime, Healthy, Min, LW- RW, FA, --, --, --, --, --, --, --, --, --, --, --, --, --, --, --, --, --, --, --
Brandon Biro, Healthy, Buf, LW, FA, --, --, --, --, --, --, --, --, --, --, --, --, --, --, --, --, --, --, --
Luke Glendening, Healthy, TB, RW- C, FA, --, --, --, --, --, --, --, --, --, --, --, --, --, --, --, --, --, --, --
Kaedan Korczak, Healthy, Vgk, D, FA, --, --, --, --, --, --, --, --, --, --, --, --, --, --, --, --, --, --, --
Dylan Samberg, Healthy, Wpg, D, FA, --, --, --, --, --, --, --, --, --, --, --, --, --, --, --, --, --, --, --
Marc Staal, Healthy, Phi, D, FA, --, --, --, --, --, --, --, --, --, --, --, --, --, --, --, --, --, --, --
Jordan Spence, Healthy, LA, D, FA, --, --, --, --, --, --, --, --, --, --, --, --, --, --, --, --, --, --, --
Ty Dellandrea, Healthy, Dal, RW- C, FA, --, --, --, --, --, --, --, --, --, --, --, --, --, --, --, --, --, --, --
Mike Hoffman, Healthy, SJ, LW, FA, --, --, --, --, --, --, --, --, --, --, --, --, --, --, --, --, --, --, --
Andreas Englund, Healthy, LA, D, FA, --, --, --, --, --, --, --, --, --, --, --, --, --, --, --, --, --, --, --
Valtteri Puustinen, Healthy, Pit, LW, FA, --, --, --, --, --, --, --, --, --, --, --, --, --, --, --, --, --, --, --
Peyton Krebs, Healthy, Buf, C, FA, --, --, --, --, --, --, --, --, --, --, --, --, --, --, --, --, --, --, --
Jake Evans, Healthy, Mon, C- RW, FA, --, --, --, --, --, --, --, --, --, --, --, --, --, --, --, --, --, --, --
Oliver Wahlstrom, Healthy, NYI, RW, FA, --, --, --, --, --, --, --, --, --, --, --, --, --, --, --, --, --, --, --
Connor Dewar, Healthy, Min, C, FA, --, --, --, --, --, --, --, --, --, --, --, --, --, --, --, --, --, --, --
Scott Perunovich, Healthy, StL, D, FA, --, --, --, --, --, --, --, --, --, --, --, --, --, --, --, --, --, --, --
Ethan Bear, Healthy, Wsh, D, FA, Cgy, W 3-2, --, --, --, --, --, --, --, --, --, --, --, --, --, --, --, --, --
Michael Eyssimont, Healthy, TB, RW- C, FA, --, --, --, --, --, --, --, --, --, --, --, --, --, --, --, --, --, --, --
Zach Bogosian, Healthy, Min, D, FA, --, --, --, --, --, --, --, --, --, --, --, --, --, --, --, --, --, --, --
Sammy Blais, Healthy, StL, LW, FA, --, --, --, --, --, --, --, --, --, --, --, --, --, --, --, --, --, --, --
Darren Raddysh, Healthy, TB, D, FA, --, --, --, --, --, --, --, --, --, --, --, --, --, --, --, --, --, --, --
Danil Gushchin, Healthy, SJ, RW, FA, --, --, --, --, --, --, --, --, --, --, --, --, --, --, --, --, --, --, --
Tye Kartye, Healthy, Sea, LW- C, FA, --, --, --, --, --, --, --, --, --, --, --, --, --, --, --, --, --, --, --
Pierre-Olivier Joseph, Healthy, Pit, D, FA, --, --, --, --, --, --, --, --, --, --, --, --, --, --, --, --, --, --, --
Luke Kunin, Healthy, SJ, C, FA, --, --, --, --, --, --, --, --, --, --, --, --, --, --, --, --, --, --, --
Lane Hutson, Healthy, Mon, D, FA, --, --, --, --, --, --, --, --, --, --, --, --, --, --, --, --, --, --, --
Johnny Beecher, Healthy, Bos, C, FA, --, --, --, --, --, --, --, --, --, --, --, --, --, --, --, --, --, --, --
Sam Carrick, Healthy, Ana, C- RW, FA, --, --, --, --, --, --, --, --, --, --, --, --, --, --, --, --, --, --, --
Radim Zohorna, Healthy, Pit, LW, FA, --, --, --, --, --, --, --, --, --, --, --, --, --, --, --, --, --, --, --
Jeff Carter, Healthy, Pit, C, FA, --, --, --, --, --, --, --, --, --, --, --, --, --, --, --, --, --, --, --
Dylan Holloway, Healthy, Edm, C- LW, FA, --, --, --, --, --, --, --, --, --, --, --, --, --, --, --, --, --, --, --
Jacob MacDonald, IR, SJ, D, FA, --, --, --, --, --, --, --, --, --, --, --, --, --, --, --, --, --, --, --
Jalen Chatfield, Healthy, Car, D, FA, --, --, --, --, --, --, --, --, --, --, --, --, --, --, --, --, --, --, --
Ryker Evans, Healthy, Sea, D, FA, --, --, --, --, --, --, --, --, --, --, --, --, --, --, --, --, --, --, --
Jesper Fast, Healthy, Car, RW, FA, --, --, --, --, --, --, --, --, --, --, --, --, --, --, --, --, --, --, --
Brett Howden, Healthy, Vgk, LW- C, FA, --, --, --, --, --, --, --, --, --, --, --, --, --, --, --, --, --, --, --
Morgan Barron, Healthy, Wpg, C, FA, --, --, --, --, --, --, --, --, --, --, --, --, --, --, --, --, --, --, --
Austin Watson, Healthy, TB, RW, FA, --, --, --, --, --, --, --, --, --, --, --, --, --, --, --, --, --, --, --
David Reinbacher, Healthy, Mon, D, FA, --, --, --, --, --, --, --, --, --, --, --, --, --, --, --, --, --, --, --
Zdeno Chara, Healthy, Bos, D, FA, --, --, --, --, --, --, --, --, --, --, --, --, --, --, --, --, --, --, --
Jaycob Megna, Healthy, Chi, D, FA, @Tor, W 4-1, --, --, --, --, --, --, --, --, --, --, --, --, --, --, --, --, --
Alex Laferriere, Healthy, LA, RW, FA, --, --, --, --, --, --, --, --, --, --, --, --, --, --, --, --, --, --, --
Cody Glass, Healthy, Nsh, C, FA, --, --, --, --, --, --, --, --, --, --, --, --, --, --, --, --, --, --, --
Matt Savoie, Healthy, Buf, C, FA, --, --, --, --, --, --, --, --, --, --, --, --, --, --, --, --, --, --, --
Danton Heinen, Healthy, Bos, C, FA, --, --, --, --, --, --, --, --, --, --, --, --, --, --, --, --, --, --, --
Ryan Poehling, Healthy, Phi, C, FA, --, --, --, --, --, --, --, --, --, --, --, --, --, --, --, --, --, --, --
Zach Parise, Healthy, NYI, LW, FA, --, --, --, --, --, --, --, --, --, --, --, --, --, --, --, --, --, --, --
Sam Steel, Healthy, Dal, C, FA, --, --, --, --, --, --, --, --, --, --, --, --, --, --, --, --, --, --, --
Erik Brannstrom, Healthy, Ott, D, FA, --, --, --, --, --, --, --, --, --, --, --, --, --, --, --, --, --, --, --
Matt Martin, Healthy, NYI, LW- RW, FA, --, --, --, --, --, --, --, --, --, --, --, --, --, --, --, --, --, --, --
Alex Goligoski, Healthy, Min, D, FA, --, --, --, --, --, --, --, --, --, --, --, --, --, --, --, --, --, --, --
Dakota Mermis, Healthy, Min, D, FA, --, --, --, --, --, --, --, --, --, --, --, --, --, --, --, --, --, --, --
Pierre Engvall, Healthy, NYI, LW- RW, FA, --, --, --, --, --, --, --, --, --, --, --, --, --, --, --, --, --, --, --
Nico Sturm, IR, SJ, C, FA, --, --, --, --, --, --, --, --, --, --, --, --, --, --, --, --, --, --, --
Oskar Sundqvist, Healthy, StL, C, FA, --, --, --, --, --, --, --, --, --, --, --, --, --, --, --, --, --, --, --
Joel Kiviranta, Healthy, Col, LW, FA, --, --, --, --, --, --, --, --, --, --, --, --, --, --, --, --, --, --, --
Ben Meyers, Healthy, Col, RW, FA, --, --, --, --, --, --, --, --, --, --, --, --, --, --, --, --, --, --, --
Vinnie Hinostroza, Healthy, Pit, RW, FA, --, --, --, --, --, --, --, --, --, --, --, --, --, --, --, --, --, --, --
Phillip Di Giuseppe, IR, Van, LW, FA, --, --, --, --, --, --, --, --, --, --, --, --, --, --, --, --, --, --, --
Conor Sheary, Healthy, TB, LW, FA, --, --, --, --, --, --, --, --, --, --, --, --, --, --, --, --, --, --, --
Brayden Yager, Healthy, Pit, C, FA, --, --, --, --, --, --, --, --, --, --, --, --, --, --, --, --, --, --, --
Blake Lizotte, Healthy, LA, C, FA, --, --, --, --, --, --, --, --, --, --, --, --, --, --, --, --, --, --, --
Alex Barre-Boulet, Healthy, TB, LW- RW, FA, --, --, --, --, --, --, --, --, --, --, --, --, --, --, --, --, --, --, --
Jackson LaCombe, Healthy, Ana, D, FA, --, --, --, --, --, --, --, --, --, --, --, --, --, --, --, --, --, --, --
William Carrier, IR, Vgk, LW, FA, --, --, --, --, --, --, --, --, --, --, --, --, --, --, --, --, --, --, --
Olen Zellweger, Healthy, Ana, D, FA, --, --, --, --, --, --, --, --, --, --, --, --, --, --, --, --, --, --, --
Tyson Jost, Healthy, Buf, C, FA, --, --, --, --, --, --, --, --, --, --, --, --, --, --, --, --, --, --, --
Lukas Cormier, Healthy, Vgk, D, FA, --, --, --, --, --, --, --, --, --, --, --, --, --, --, --, --, --, --, --
Filip Zadina, Healthy, SJ, RW, FA, --, --, --, --, --, --, --, --, --, --, --, --, --, --, --, --, --, --, --
Radek Faksa, Healthy, Dal, C, FA, --, --, --, --, --, --, --, --, --, --, --, --, --, --, --, --, --, --, --
Jordan Martinook, Healthy, Car, LW- RW, FA, --, --, --, --, --, --, --, --, --, --, --, --, --, --, --, --, --, --, --
Alex Nylander, Healthy, Pit, LW- RW, FA, --, --, --, --, --, --, --, --, --, --, --, --, --, --, --, --, --, --, --
David Krejci, Healthy, Bos, C, FA, --, --, --, --, --, --, --, --, --, --, --, --, --, --, --, --, --, --, --
Ben Hutton, IR, Vgk, D, FA, --, --, --, --, --, --, --, --, --, --, --, --, --, --, --, --, --, --, --
Matthew Wood, Healthy, Nsh, LW, FA, --, --, --, --, --, --, --, --, --, --, --, --, --, --, --, --, --, --, --
Thomas Bordeleau, Healthy, SJ, C- LW, FA, --, --, --, --, --, --, --, --, --, --, --, --, --, --, --, --, --, --, --
Jesse Puljujarvi, O, Car, RW, FA, --, --, --, --, --, --, --, --, --, --, --, --, --, --, --, --, --, --, --
Jon Merrill, Healthy, Min, D, FA, --, --, --, --, --, --, --, --, --, --, --, --, --, --, --, --, --, --, --
Ty Emberson, O, SJ, D, FA, --, --, --, --, --, --, --, --, --, --, --, --, --, --, --, --, --, --, --
Brayden Pachal, Healthy, Vgk, D, FA, --, --, --, --, --, --, --, --, --, --, --, --, --, --, --, --, --, --, --
Alexey Toropchenko, Healthy, StL, RW, FA, --, --, --, --, --, --, --, --, --, --, --, --, --, --, --, --, --, --, --
Chad Ruhwedel, Healthy, Pit, D, FA, --, --, --, --, --, --, --, --, --, --, --, --, --, --, --, --, --, --, --
Zemgus Girgensons, Healthy, Buf, C, FA, --, --, --, --, --, --, --, --, --, --, --, --, --, --, --, --, --, --, --
Pierre-Edouard Bellemare, IR, Sea, RW, FA, --, --, --, --, --, --, --, --, --, --, --, --, --, --, --, --, --, --, --
Andrew Cogliano, Healthy, Col, C, FA, --, --, --, --, --, --, --, --, --, --, --, --, --, --, --, --, --, --, --
Jiri Kulich, Healthy, Buf, C- LW, FA, --, --, --, --, --, --, --, --, --, --, --, --, --, --, --, --, --, --, --
Johnathan Kovacevic, Healthy, Mon, D, FA, --, --, --, --, --, --, --, --, --, --, --, --, --, --, --, --, --, --, --
Jakub Lauko, Healthy, Bos, RW, FA, --, --, --, --, --, --, --, --, --, --, --, --, --, --, --, --, --, --, --
Joel Armia, Healthy, Mon, RW, FA, --, --, --, --, --, --, --, --, --, --, --, --, --, --, --, --, --, --, --
Kurtis MacDermid, Healthy, Col, D, FA, --, --, --, --, --, --, --, --, --, --, --, --, --, --, --, --, --, --, --
Tom Willander, Healthy, Van, D, FA, --, --, --, --, --, --, --, --, --, --, --, --, --, --, --, --, --, --, --
Parker Wotherspoon, Healthy, Bos, D, FA, --, --, --, --, --, --, --, --, --, --, --, --, --, --, --, --, --, --, --
Parker Kelly, Healthy, Ott, C, FA, --, --, --, --, --, --, --, --, --, --, --, --, --, --, --, --, --, --, --
Jimmy Snuggerud, Healthy, StL, RW, FA, --, --, --, --, --, --, --, --, --, --, --, --, --, --, --, --, --, --, --
Samuel Fagemo, Healthy, LA, LW, FA, --, --, --, --, --, --, --, --, --, --, --, --, --, --, --, --, --, --, --
Brendan Lemieux, Healthy, Car, LW, FA, --, --, --, --, --, --, --, --, --, --, --, --, --, --, --, --, --, --, --
Julien Gauthier, Healthy, NYI, RW, FA, --, --, --, --, --, --, --, --, --, --, --, --, --, --, --, --, --, --, --
Ville Heinola, Healthy, Wpg, D, FA, --, --, --, --, --, --, --, --, --, --, --, --, --, --, --, --, --, --, --
Alex Turcotte, Healthy, LA, C, FA, --, --, --, --, --, --, --, --, --, --, --, --, --, --, --, --, --, --, --
Calvin de Haan, Healthy, TB, D, FA, --, --, --, --, --, --, --, --, --, --, --, --, --, --, --, --, --, --, --
Haydn Fleury, IR, TB, D, FA, --, --, --, --, --, --, --, --, --, --, --, --, --, --, --, --, --, --, --
Christian Dvorak, IR, Mon, LW, FA, --, --, --, --, --, --, --, --, --, --, --, --, --, --, --, --, --, --, --
Dalibor Dvorsky, Healthy, StL, C, FA, --, --, --, --, --, --, --, --, --, --, --, --, --, --, --, --, --, --, --
Trevor Lewis, Healthy, LA, C, FA, --, --, --, --, --, --, --, --, --, --, --, --, --, --, --, --, --, --, --
Denis Gurianov, Healthy, Nsh, LW, FA, --, --, --, --, --, --, --, --, --, --, --, --, --, --, --, --, --, --, --
Jan Rutta, Healthy, SJ, D, FA, --, --, --, --, --, --, --, --, --, --, --, --, --, --, --, --, --, --, --
Sammy Walker, Healthy, Min, LW, FA, --, --, --, --, --, --, --, --, --, --, --, --, --, --, --, --, --, --, --
Derek Ryan, Healthy, Edm, RW- C, FA, --, --, --, --, --, --, --, --, --, --, --, --, --, --, --, --, --, --, --
Brennan Othmann, Healthy, NYR, LW, FA, Ari, W 2-1, --, --, --, --, --, --, --, --, --, --, --, --, --, --, --, --, --
Craig Smith, Healthy, Dal, RW, FA, --, --, --, --, --, --, --, --, --, --, --, --, --, --, --, --, --, --, --
Vasily Podkolzin, Healthy, Van, RW, FA, --, --, --, --, --, --, --, --, --, --, --, --, --, --, --, --, --, --, --
Vincent Desharnais, Healthy, Edm, D, FA, --, --, --, --, --, --, --, --, --, --, --, --, --, --, --, --, --, --, --
Joel Ward, Healthy, SJ, RW, FA, --, --, --, --, --, --, --, --, --, --, --, --, --, --, --, --, --, --, --
Jordie Benn, Healthy, Dal, D, FA, --, --, --, --, --, --, --, --, --, --, --, --, --, --, --, --, --, --, --
Ian Mitchell, Healthy, Bos, D, FA, --, --, --, --, --, --, --, --, --, --, --, --, --, --, --, --, --, --, --
Matt Nieto, IR, Pit, LW, FA, --, --, --, --, --, --, --, --, --, --, --, --, --, --, --, --, --, --, --
Philip Broberg, Healthy, Edm, D, FA, --, --, --, --, --, --, --, --, --, --, --, --, --, --, --, --, --, --, --
Tyler Motte, Healthy, TB, C, FA, --, --, --, --, --, --, --, --, --, --, --, --, --, --, --, --, --, --, --
Givani Smith, IR, SJ, RW, FA, --, --, --, --, --, --, --, --, --, --, --, --, --, --, --, --, --, --, --
Joakim Kemell, Healthy, Nsh, RW, FA, --, --, --, --, --, --, --, --, --, --, --, --, --, --, --, --, --, --, --
Quentin Musty, Healthy, SJ, LW, FA, --, --, --, --, --, --, --, --, --, --, --, --, --, --, --, --, --, --, --
Marc-Edouard Vlasic, Healthy, SJ, D, FA, --, --, --, --, --, --, --, --, --, --, --, --, --, --, --, --, --, --, --
Rasmus Kupari, Healthy, Wpg, C, FA, --, --, --, --, --, --, --, --, --, --, --, --, --, --, --, --, --, --, --
Kevin Labanc, Healthy, SJ, RW, FA, --, --, --, --, --, --, --, --, --, --, --, --, --, --, --, --, --, --, --
Mavrik Bourque, Healthy, Dal, C, FA, --, --, --, --, --, --, --, --, --, --, --, --, --, --, --, --, --, --, --
Tyler Tucker, Healthy, StL, D, FA, --, --, --, --, --, --, --, --, --, --, --, --, --, --, --, --, --, --, --
Rutger McGroarty, O, Wpg, RW, FA, --, --, --, --, --, --, --, --, --, --, --, --, --, --, --, --, --, --, --
Jakob Silfverberg, Healthy, Ana, RW, FA, --, --, --, --, --, --, --, --, --, --, --, --, --, --, --, --, --, --, --
Adam Erne, Healthy, Edm, LW, FA, --, --, --, --, --, --, --, --, --, --, --, --, --, --, --, --, --, --, --
Hudson Fasching, Healthy, NYI, RW, FA, --, --, --, --, --, --, --, --, --, --, --, --, --, --, --, --, --, --, --
Marco Scandella, Healthy, StL, D, FA, --, --, --, --, --, --, --, --, --, --, --, --, --, --, --, --, --, --, --
Danil Yurtaykin, Healthy, SJ, LW, FA, --, --, --, --, --, --, --, --, --, --, --, --, --, --, --, --, --, --, --
Oliver Bonk, Healthy, Phi, D, FA, --, --, --, --, --, --, --, --, --, --, --, --, --, --, --, --, --, --, --
