Name, Health, NHL Team, Position, GFHL Team, Opponent, Score, GP, G, A, +/-, PIM, PPG, PPA, SHG, SHA, GWG, FOW, FOL, HAT, SOG, HIT, BLK, FPTS
Brady Tkachuk, Healthy, Ott, LW, BOWS, @Wsh, L 3-6, 1, 1, 2, 2, 0, 0, 0, 0, 0, 0, 2, 1, 0, 3, 4, 1, 8.1
Ryan Pulock, Healthy, NYI, D, FA, @Dal, W 3-2, 1, 1, 1, 2, 2, 0, 0, 0, 0, 0, 0, 0, 0, 2, 2, 5, 7.6
Aliaksei Protas, Healthy, Wsh, C, FA, Ott, W 6-3, 1, 1, 2, 2, 0, 0, 0, 0, 0, 0, 1, 0, 0, 2, 1, 2, 7.6
Beck Malenstyn, Healthy, Wsh, LW, FA, Ott, W 6-3, 1, 1, 1, 3, 0, 0, 0, 0, 0, 1, 1, 1, 0, 2, 1, 1, 7.0
Evan Bouchard, Healthy, Edm, D, DINK, LA, W 4-2, 1, 1, 1, 1, 2, 0, 1, 0, 0, 1, 0, 0, 0, 3, 2, 2, 6.95
David Pastrnak, Healthy, Bos, RW, CLB, @Sea, L 3-4, 1, 2, 1, 1, 0, 0, 1, 0, 0, 0, 0, 0, 0, 4, 0, 0, 6.65
Shane Pinto, Healthy, Ott, C, CLB, @Wsh, L 3-6, 1, 1, 2, 2, 0, 0, 0, 0, 0, 0, 5, 7, 0, 1, 1, 0, 6.2
Ryan Nugent-Hopkins, Healthy, Edm, C, BBS, LA, W 4-2, 1, 1, 1, 1, 0, 0, 1, 0, 0, 0, 11, 6, 0, 2, 2, 1, 6.05
Logan Stankoven, Healthy, Dal, C, SALT, NYI, L 2-3, 1, 1, 1, -1, 0, 0, 1, 0, 0, 0, 0, 0, 0, 2, 5, 2, 5.95
Hendrix Lapierre, Healthy, Wsh, C, FA, Ott, W 6-3, 1, 2, 0, 2, 0, 0, 0, 0, 0, 0, 3, 2, 0, 2, 0, 1, 5.8
Leon Draisaitl, Healthy, Edm, C- LW, SALT, LA, W 4-2, 1, 1, 1, 1, 0, 1, 0, 0, 0, 0, 3, 2, 0, 5, 1, 0, 5.4
Bo Horvat, Healthy, NYI, C, DINK, @Dal, W 3-2, 1, 1, 0, 1, 0, 0, 0, 0, 0, 1, 10, 9, 0, 7, 2, 1, 5.4
Anthony Mantha, Healthy, Vgk, RW, FA, --, --, 1, 0, 2, 2, 0, 0, 0, 0, 0, 0, 0, 0, 0, 1, 0, 1, 4.6
Mathew Barzal, Healthy, NYI, C, LKR, @Dal, W 3-2, 1, 0, 1, 1, 0, 0, 0, 0, 0, 0, 1, 2, 0, 4, 4, 2, 4.5
Connor McDavid, Healthy, Edm, C, DINK, LA, W 4-2, 1, 0, 2, 1, 0, 0, 0, 0, 0, 0, 4, 5, 0, 3, 2, 0, 4.3
John Carlson, Healthy, Wsh, D, ME, Ott, W 6-3, 1, 1, 0, 1, 0, 1, 0, 0, 0, 0, 0, 0, 0, 2, 0, 2, 4.2
Connor McMichael, Healthy, Wsh, C, FA, Ott, W 6-3, 1, 0, 2, 1, 0, 0, 1, 0, 0, 0, 6, 9, 0, 1, 0, 1, 4.05
Charlie McAvoy, Healthy, Bos, D, SLC, @Sea, L 3-4, 1, 0, 1, 0, 0, 0, 0, 0, 0, 0, 0, 0, 0, 0, 0, 5, 4.0
Vince Dunn, DTD, Sea, D, CLB, Bos, W 4-3, 1, 1, 0, 1, 0, 0, 0, 0, 0, 0, 0, 0, 0, 2, 1, 2, 4.0
Matt Roy, Healthy, LA, D, OXP, @Edm, L 2-4, 1, 0, 1, 1, 2, 0, 0, 0, 0, 0, 0, 0, 0, 0, 4, 2, 4.0
Matt Duchene, Healthy, Dal, C, SLC, NYI, L 2-3, 1, 1, 0, 0, 0, 1, 0, 0, 0, 0, 10, 2, 0, 1, 0, 1, 3.9
Nicolas Aube-Kubel, Healthy, Wsh, RW, FA, Ott, W 6-3, 1, 0, 1, 2, 0, 0, 0, 0, 0, 0, 0, 0, 0, 0, 3, 1, 3.9
Rasmus Sandin, Healthy, Wsh, D, FA, Ott, W 6-3, 1, 0, 0, 2, 0, 0, 0, 0, 0, 0, 0, 0, 0, 2, 2, 4, 3.8
Kevin Shattenkirk, Healthy, Bos, D, FA, @Sea, L 3-4, 1, 0, 1, 1, 0, 0, 0, 0, 0, 0, 0, 0, 0, 2, 0, 3, 3.7
Pierre Engvall, Healthy, NYI, LW- RW, FA, @Dal, W 3-2, 1, 0, 1, 2, 0, 0, 0, 0, 0, 0, 0, 0, 0, 4, 1, 1, 3.7
Mike Reilly, Healthy, NYI, D, FA, @Dal, W 3-2, 1, 0, 1, 1, 0, 0, 0, 0, 0, 0, 0, 0, 0, 1, 3, 1, 3.5
Kyle MacLean, Healthy, NYI, C- LW, FA, @Dal, W 3-2, 1, 1, 0, 1, 0, 0, 0, 0, 0, 0, 1, 2, 0, 1, 3, 0, 3.4
Jacob Moverare, Healthy, LA, D, FA, @Edm, L 2-4, 1, 0, 0, 1, 0, 0, 0, 0, 0, 0, 0, 0, 0, 1, 1, 5, 3.4
Zach Hyman, Healthy, Edm, RW- LW, BBS, LA, W 4-2, 1, 1, 0, 1, 0, 0, 0, 0, 0, 0, 0, 0, 0, 3, 0, 1, 3.3
Anze Kopitar, Healthy, LA, C, ME, @Edm, L 2-4, 1, 0, 1, 0, 0, 0, 0, 0, 0, 0, 9, 11, 0, 2, 1, 3, 3.3
Charlie Coyle, Healthy, Bos, C, SALT, @Sea, L 3-4, 1, 1, 0, -1, 0, 1, 0, 0, 0, 0, 15, 9, 0, 1, 2, 0, 3.3
Max Pacioretty, Healthy, Wsh, LW, FA, Ott, W 6-3, 1, 1, 0, 0, 0, 1, 0, 0, 0, 0, 0, 0, 0, 2, 2, 0, 3.3
Oliver Bjorkstrand, Healthy, Sea, RW, OXP, Bos, W 4-3, 1, 1, 0, 0, 0, 0, 0, 0, 0, 0, 0, 0, 0, 7, 0, 1, 3.2
Alexander Romanov, Healthy, NYI, D, DINK, @Dal, W 3-2, 1, 0, 0, 1, 0, 0, 0, 0, 0, 0, 0, 0, 0, 0, 2, 4, 3.1
Brad Marchand, Healthy, Bos, LW, DINK, @Sea, L 3-4, 1, 0, 1, 0, 0, 0, 1, 0, 0, 0, 0, 0, 0, 5, 1, 1, 3.05
Ryan Suter, Healthy, Dal, D, FA, NYI, L 2-3, 1, 0, 0, 0, 0, 0, 0, 0, 0, 0, 0, 0, 0, 3, 4, 3, 3.0
Trevor Moore, Healthy, LA, LW, OXP, @Edm, L 2-4, 1, 1, 0, 0, 0, 0, 0, 0, 0, 0, 0, 1, 0, 4, 2, 0, 2.9
Andreas Englund, Healthy, LA, D, FA, @Edm, L 2-4, 1, 0, 1, 1, 0, 0, 0, 0, 0, 0, 0, 0, 0, 0, 3, 0, 2.9
Casey Cizikas, Healthy, NYI, C, FA, @Dal, W 3-2, 1, 0, 1, 1, 0, 0, 0, 0, 0, 0, 5, 8, 0, 0, 2, 1, 2.8
Ethan Bear, O, Wsh, D, FA, Ott, W 6-3, 1, 0, 1, 2, 0, 0, 0, 0, 0, 0, 0, 0, 0, 0, 1, 0, 2.8
Pavel Zacha, Healthy, Bos, C, FA, @Sea, L 3-4, 1, 0, 1, 1, 0, 0, 0, 0, 0, 0, 6, 6, 0, 1, 0, 1, 2.6
Cal Clutterbuck, Healthy, NYI, RW, FA, @Dal, W 3-2, 1, 0, 0, 1, 0, 0, 0, 0, 0, 0, 0, 0, 0, 0, 7, 0, 2.6
Alex Laferriere, Healthy, LA, RW, FA, @Edm, L 2-4, 1, 1, 0, 0, 0, 0, 0, 0, 0, 0, 0, 0, 0, 3, 1, 0, 2.6
Mattias Janmark, Healthy, Edm, RW- LW, FA, LA, W 4-2, 1, 0, 1, 1, 0, 0, 0, 0, 0, 0, 0, 0, 0, 0, 2, 0, 2.6
Yanni Gourde, Healthy, Sea, C- LW- RW, FA, Bos, W 4-3, 1, 0, 1, 0, 0, 0, 0, 0, 0, 0, 5, 8, 0, 0, 3, 1, 2.6
Quinton Byfield, Healthy, LA, C- LW, SLC, @Edm, L 2-4, 1, 0, 1, 0, 0, 0, 0, 0, 0, 0, 0, 0, 0, 2, 1, 1, 2.5
Vincent Desharnais, Healthy, Edm, D, FA, LA, W 4-2, 1, 0, 0, 1, 2, 0, 0, 0, 0, 0, 0, 0, 0, 1, 2, 3, 2.5
Michael Sgarbossa, Healthy, Wsh, C, FA, Ott, W 6-3, 1, 0, 1, 0, 0, 0, 1, 0, 0, 0, 7, 7, 0, 2, 0, 1, 2.45
Drake Batherson, Healthy, Ott, RW, FA, @Wsh, L 3-6, 1, 1, 0, 1, 2, 0, 0, 0, 0, 0, 0, 0, 0, 1, 0, 0, 2.4
Jordan Eberle, Healthy, Sea, RW, FA, Bos, W 4-3, 1, 1, 0, 0, 2, 1, 0, 0, 0, 0, 0, 0, 0, 1, 0, 0, 2.4
Alexander Alexeyev, Healthy, Wsh, D, FA, Ott, W 6-3, 1, 0, 0, -2, 0, 0, 0, 0, 0, 0, 0, 0, 0, 0, 3, 5, 2.4
Vladimir Tarasenko, Healthy, Fla, RW, BBS, --, --, 1, 0, 1, 1, 0, 0, 0, 0, 0, 0, 0, 0, 0, 2, 0, 0, 2.2
Phillip Danault, Healthy, LA, C, FA, @Edm, L 2-4, 1, 0, 0, 0, 0, 0, 0, 0, 0, 0, 12, 6, 0, 4, 4, 0, 2.2
Andre Burakovsky, Healthy, Sea, RW- LW, FA, Bos, W 4-3, 1, 0, 1, 0, 0, 0, 0, 0, 0, 0, 0, 0, 0, 2, 0, 1, 2.2
Thomas Harley, Healthy, Dal, D, DINK, NYI, L 2-3, 1, 0, 1, 0, 2, 0, 1, 0, 0, 0, 0, 0, 0, 1, 0, 1, 2.15
Alex Wennberg, DTD, NYR, C, FA, --, --, 1, 0, 1, 0, 0, 0, 0, 0, 0, 0, 5, 9, 0, 2, 1, 1, 2.1
Parker Kelly, Healthy, Ott, C, FA, @Wsh, L 3-6, 1, 0, 0, -1, 0, 0, 0, 0, 0, 0, 0, 1, 0, 0, 4, 3, 2.1
Simon Holmstrom, Healthy, NYI, RW, FA, @Dal, W 3-2, 1, 0, 1, 1, 0, 0, 0, 0, 0, 0, 0, 0, 0, 0, 0, 0, 2.0
Jesper Boqvist, Healthy, Bos, C, FA, @Sea, L 3-4, 1, 0, 1, 1, 0, 0, 0, 0, 0, 0, 2, 2, 0, 0, 0, 0, 2.0
Adam Larsson, Healthy, Sea, D, BOWS, Bos, W 4-3, 1, 0, 0, 1, 0, 0, 0, 0, 0, 0, 0, 0, 0, 0, 3, 1, 1.9
Wyatt Johnston, Healthy, Dal, C, HERB, NYI, L 2-3, 1, 0, 1, 0, 0, 0, 0, 0, 0, 0, 3, 6, 0, 2, 0, 1, 1.9
Will Borgen, Healthy, Sea, D, FA, Bos, W 4-3, 1, 0, 1, -1, 0, 0, 0, 0, 0, 0, 0, 0, 0, 3, 2, 0, 1.9
Tom Wilson, SSPD, Wsh, RW, FA, Ott, W 6-3, 1, 0, 0, -3, 0, 0, 0, 0, 0, 0, 0, 0, 0, 1, 7, 2, 1.7
Noah Dobson, Healthy, NYI, D, SLC, @Dal, W 3-2, 1, 0, 0, -1, 0, 0, 0, 0, 0, 0, 0, 0, 0, 0, 2, 3, 1.6
Trent Frederic, Healthy, Bos, LW- C- RW, DINK, @Sea, L 3-4, 1, 0, 0, -1, 0, 0, 0, 0, 0, 0, 5, 4, 0, 4, 2, 2, 1.6
Joel Hanley, Healthy, Cgy, D, FA, --, --, 1, 0, 0, -1, 0, 0, 0, 0, 0, 0, 0, 0, 0, 0, 2, 3, 1.6
Matt Martin, Healthy, NYI, LW- RW, FA, @Dal, W 3-2, 1, 0, 0, 0, 0, 0, 0, 0, 0, 0, 0, 1, 0, 3, 3, 1, 1.6
Connor Brown, Healthy, Edm, RW, FA, LA, W 4-2, 1, 0, 1, 0, 0, 0, 0, 0, 0, 0, 0, 0, 0, 0, 0, 0, 1.5
Mattias Ekholm, Healthy, Edm, D, HERB, LA, W 4-2, 1, 0, 0, 1, 0, 0, 0, 0, 0, 0, 0, 0, 0, 1, 3, 0, 1.5
Justin Schultz, Healthy, Sea, D, FA, Bos, W 4-3, 1, 0, 0, 0, 0, 0, 0, 0, 0, 0, 0, 0, 0, 0, 0, 3, 1.5
Sebastian Aho, Healthy, NYI, D, FA, @Dal, W 3-2, 1, 0, 0, 1, 0, 0, 0, 0, 0, 0, 0, 0, 0, 0, 0, 2, 1.5
Ryan McLeod, Healthy, Edm, C, FA, LA, W 4-2, 1, 0, 0, 0, 0, 0, 0, 0, 0, 0, 7, 7, 0, 3, 4, 0, 1.5
Travis Hamonic, Healthy, Ott, D, FA, @Wsh, L 3-6, 1, 0, 1, -1, 0, 0, 0, 0, 0, 0, 0, 0, 0, 2, 1, 0, 1.5
Eeli Tolvanen, Healthy, Sea, LW- RW, SALT, Bos, W 4-3, 1, 0, 0, 0, 0, 0, 0, 0, 0, 0, 0, 0, 0, 3, 2, 1, 1.4
Josh Norris, IR, Ott, C, FA, @Wsh, L 3-6, 1, 0, 0, 0, 0, 0, 0, 0, 0, 0, 5, 5, 0, 0, 3, 1, 1.4
Jason Robertson, Healthy, Dal, LW, ME, NYI, L 2-3, 1, 0, 0, -1, 0, 0, 0, 0, 0, 0, 0, 0, 0, 2, 2, 2, 1.3
Adrian Kempe, Healthy, LA, RW- LW, BOWS, @Edm, L 2-4, 1, 0, 0, -1, 0, 0, 0, 0, 0, 0, 0, 0, 0, 7, 2, 1, 1.3
Adam Pelech, Healthy, NYI, D, FA, @Dal, W 3-2, 1, 0, 0, -1, 0, 0, 0, 0, 0, 0, 0, 0, 0, 0, 1, 3, 1.3
Joel Edmundson, O, Tor, D, FA, --, --, 1, 0, 0, 1, 0, 0, 0, 0, 0, 0, 0, 0, 0, 0, 1, 1, 1.3
Parker Wotherspoon, Healthy, Bos, D, FA, @Sea, L 3-4, 1, 0, 0, 2, 0, 0, 0, 0, 0, 0, 0, 0, 0, 0, 1, 0, 1.3
Evander Kane, Healthy, Edm, LW, OXP, LA, W 4-2, 1, 0, 0, 0, 0, 0, 0, 0, 0, 0, 0, 0, 0, 4, 3, 0, 1.3
Darnell Nurse, Healthy, Edm, D, OXP, LA, W 4-2, 1, 0, 0, -1, 0, 0, 0, 0, 0, 0, 0, 0, 0, 3, 3, 1, 1.2
Jake DeBrusk, Healthy, Bos, RW- LW, LKR, @Sea, L 3-4, 1, 0, 0, 1, 0, 0, 0, 0, 0, 0, 0, 0, 0, 4, 1, 0, 1.2
Jacob Bernard-Docker, Healthy, Ott, D, FA, @Wsh, L 3-6, 1, 0, 0, 1, 0, 0, 0, 0, 0, 0, 0, 0, 0, 1, 2, 0, 1.2
Jordan Spence, Healthy, LA, D, FA, @Edm, L 2-4, 1, 0, 0, 1, 0, 0, 0, 0, 0, 0, 0, 0, 0, 1, 2, 0, 1.2
Radek Faksa, Healthy, Dal, C, FA, NYI, L 2-3, 1, 0, 0, 0, 0, 0, 0, 0, 0, 0, 1, 1, 0, 1, 2, 1, 1.2
Trevor van Riemsdyk, Healthy, Wsh, D, FA, Ott, W 6-3, 1, 0, 0, -2, 0, 0, 0, 0, 0, 0, 0, 0, 0, 0, 2, 3, 1.1
Roope Hintz, Healthy, Dal, C, ME, NYI, L 2-3, 1, 0, 0, -1, 0, 0, 0, 0, 0, 0, 2, 2, 0, 2, 3, 1, 1.1
Jamie Oleksiak, Healthy, Sea, D, FA, Bos, W 4-3, 1, 0, 0, -1, 0, 0, 0, 0, 0, 0, 0, 0, 0, 2, 3, 1, 1.1
Jaden Schwartz, Healthy, Sea, LW, FA, Bos, W 4-3, 1, 0, 0, 0, 0, 0, 0, 0, 0, 0, 2, 2, 0, 2, 3, 0, 1.1
Kevin Fiala, Healthy, LA, LW- RW, SLC, @Edm, L 2-4, 1, 0, 0, -1, 0, 0, 0, 0, 0, 0, 0, 0, 0, 6, 3, 0, 1.0
Brian Dumoulin, Healthy, Sea, D, FA, Bos, W 4-3, 1, 0, 0, 0, 0, 0, 0, 0, 0, 0, 0, 0, 0, 0, 0, 2, 1.0
Vladislav Gavrikov, Healthy, LA, D, FA, @Edm, L 2-4, 1, 0, 0, -3, 2, 0, 0, 0, 0, 0, 0, 0, 0, 1, 7, 1, 1.0
Mason Lohrei, Healthy, Bos, D, FA, @Sea, L 3-4, 1, 0, 0, 0, 0, 0, 0, 0, 0, 0, 0, 0, 0, 0, 0, 2, 1.0
Ty Dellandrea, Healthy, Dal, RW- C, FA, NYI, L 2-3, 1, 0, 0, 0, 0, 0, 0, 0, 0, 0, 1, 2, 0, 3, 1, 1, 1.0
Pierrick Dube, Healthy, Wsh, RW, FA, Ott, W 6-3, 1, 0, 0, 0, 2, 0, 0, 0, 0, 0, 0, 1, 0, 2, 2, 1, 1.0
Warren Foegele, Healthy, Edm, LW- RW, FA, LA, W 4-2, 1, 0, 0, 0, 0, 0, 0, 0, 0, 0, 0, 0, 0, 1, 3, 0, 1.0
Miro Heiskanen, Healthy, Dal, D, LKR, NYI, L 2-3, 1, 0, 0, 0, 2, 0, 0, 0, 0, 0, 0, 0, 0, 3, 1, 1, 0.9
Brett Kulak, Healthy, Edm, D, FA, LA, W 4-2, 1, 0, 0, 1, 0, 0, 0, 0, 0, 0, 0, 0, 0, 1, 1, 0, 0.9
Blake Lizotte, Healthy, LA, C, FA, @Edm, L 2-4, 1, 0, 0, 0, 0, 0, 0, 0, 0, 0, 2, 0, 0, 1, 2, 0, 0.9
Jaret Anderson-Dolan, Healthy, Nsh, C- RW, FA, --, --, 1, 0, 0, 0, 0, 0, 0, 0, 0, 0, 0, 0, 0, 0, 3, 0, 0.9
Anders Lee, Healthy, NYI, LW- C, FA, @Dal, W 3-2, 1, 0, 0, -1, 0, 0, 0, 0, 0, 0, 0, 0, 0, 2, 2, 1, 0.8
Brandon Carlo, Healthy, Bos, D, FA, @Sea, L 3-4, 1, 0, 0, -1, 2, 0, 0, 0, 0, 0, 0, 0, 0, 0, 0, 3, 0.8
Derek Ryan, Healthy, Edm, RW- C, FA, LA, W 4-2, 1, 0, 0, -1, 0, 0, 0, 0, 0, 0, 5, 5, 0, 0, 1, 2, 0.8
Ridly Greig, Healthy, Ott, C- LW, FA, @Wsh, L 3-6, 1, 0, 0, 0, 0, 0, 0, 0, 0, 0, 0, 1, 0, 0, 3, 0, 0.8
Brock Nelson, Healthy, NYI, C, FA, @Dal, W 3-2, 1, 0, 0, 0, 0, 0, 0, 0, 0, 0, 0, 0, 0, 2, 0, 1, 0.7
Justin Brazeau, Healthy, Bos, RW, FA, @Sea, L 3-4, 1, 0, 0, 0, 2, 0, 0, 0, 0, 0, 0, 0, 0, 0, 1, 1, 0.6
Jake Sanderson, Healthy, Ott, D, FA, @Wsh, L 3-6, 1, 0, 0, 1, 0, 0, 0, 0, 0, 0, 0, 0, 0, 1, 0, 0, 0.6
Mathieu Joseph, Healthy, Ott, LW- RW, FA, @Wsh, L 3-6, 1, 0, 0, -1, 0, 0, 0, 0, 0, 0, 0, 0, 0, 2, 3, 0, 0.6
Sam Steel, Healthy, Dal, C, FA, NYI, L 2-3, 1, 0, 0, 0, 2, 0, 0, 0, 0, 0, 1, 5, 0, 3, 3, 0, 0.6
Jamie Benn, Healthy, Dal, LW, OXP, NYI, L 2-3, 1, 0, 0, -2, 0, 0, 0, 0, 0, 0, 4, 3, 0, 3, 2, 1, 0.5
Mason Marchment, Healthy, Dal, LW, FA, NYI, L 2-3, 1, 0, 0, 1, 0, 0, 0, 0, 0, 0, 0, 0, 0, 0, 0, 0, 0.5
Brandon Tanev, Healthy, Sea, LW, FA, Bos, W 4-3, 1, 0, 0, 0, 0, 0, 0, 0, 0, 0, 0, 0, 0, 0, 0, 1, 0.5
Derrick Pouliot, Healthy, Dal, D, FA, NYI, L 2-3, 1, 0, 0, 0, 0, 0, 0, 0, 0, 0, 0, 0, 0, 2, 1, 0, 0.5
Trevor Lewis, Healthy, LA, C, FA, @Edm, L 2-4, 1, 0, 0, 0, 2, 0, 0, 0, 0, 0, 2, 1, 0, 0, 2, 0, 0.5
Dylan Strome, Healthy, Wsh, C, FA, Ott, W 6-3, 1, 0, 1, -3, 0, 0, 1, 0, 0, 0, 8, 7, 0, 1, 0, 0, 0.45
Morgan Geekie, Healthy, Bos, C, FA, @Sea, L 3-4, 1, 0, 0, -1, 2, 0, 0, 0, 0, 0, 6, 2, 0, 4, 1, 0, 0.4
Arthur Kaliyev, Healthy, LA, RW, FA, @Edm, L 2-4, 1, 0, 0, 0, 0, 0, 0, 0, 0, 0, 0, 0, 0, 4, 0, 0, 0.4
Tim Stutzle, Healthy, Ott, C- LW, LKR, @Wsh, L 3-6, 1, 0, 0, -2, 0, 0, 0, 0, 0, 0, 0, 0, 0, 2, 2, 1, 0.3
James van Riemsdyk, Healthy, Bos, LW, FA, @Sea, L 3-4, 1, 0, 0, 0, 0, 0, 0, 0, 0, 0, 1, 0, 0, 2, 0, 0, 0.3
Matty Beniers, Healthy, Sea, C, FA, Bos, W 4-3, 1, 0, 0, 0, 0, 0, 0, 0, 0, 0, 10, 11, 0, 1, 1, 0, 0.3
Dylan Holloway, Healthy, Edm, C- LW, FA, LA, W 4-2, 1, 0, 0, -1, 0, 0, 0, 0, 0, 0, 0, 2, 0, 1, 3, 0, 0.3
Anthony Richard, Healthy, Bos, C, FA, @Sea, L 3-4, 1, 0, 0, 0, 0, 0, 0, 0, 0, 0, 0, 0, 0, 2, 0, 0, 0.2
Corey Perry, Healthy, Edm, RW, FA, LA, W 4-2, 1, 0, 0, 0, 0, 0, 0, 0, 0, 0, 0, 1, 0, 0, 1, 0, 0.2
Matt Grzelcyk, Healthy, Bos, D, FA, @Sea, L 3-4, 1, 0, 0, -2, 0, 0, 0, 0, 0, 0, 0, 0, 0, 2, 0, 2, 0.2
Alex Ovechkin, Healthy, Wsh, LW, BOWS, Ott, W 6-3, 1, 0, 0, -3, 0, 0, 0, 0, 0, 0, 0, 0, 0, 0, 2, 2, 0.1
Jakob Chychrun, Healthy, Ott, D, FA, @Wsh, L 3-6, 1, 0, 0, -1, 2, 0, 0, 0, 0, 0, 0, 0, 0, 3, 0, 1, 0.1
Esa Lindell, Healthy, Dal, D, FA, NYI, L 2-3, 1, 0, 0, -2, 0, 0, 0, 0, 0, 0, 0, 0, 0, 0, 2, 1, 0.1
Kyle Palmieri, Healthy, NYI, RW- LW, FA, @Dal, W 3-2, 1, 0, 0, -1, 0, 0, 0, 0, 0, 0, 1, 0, 0, 2, 1, 0, 0.1
Jared McCann, Healthy, Sea, RW- C- LW, DINK, Bos, W 4-3, 1, 0, 0, 0, 0, 0, 0, 0, 0, 0, 0, 0, 0, 1, 0, 0, 0.1
Tomas Tatar, Healthy, Sea, LW, FA, Bos, W 4-3, 1, 0, 0, 0, 0, 0, 0, 0, 0, 0, 0, 0, 0, 1, 0, 0, 0.1
Craig Smith, Healthy, Dal, RW, FA, NYI, L 2-3, 1, 0, 0, 0, 0, 0, 0, 0, 0, 0, 0, 0, 0, 1, 0, 0, 0.1
Kailer Yamamoto, Healthy, Sea, RW, FA, Bos, W 4-3, 1, 0, 0, 0, 0, 0, 0, 0, 0, 0, 1, 5, 0, 0, 0, 1, 0.1
Hampus Lindholm, Healthy, Bos, D, FA, @Sea, L 3-4, --, --, --, --, --, --, --, --, --, --, --, --, --, --, --, --, --
Viktor Arvidsson, Healthy, LA, RW, FA, @Edm, L 2-4, --, --, --, --, --, --, --, --, --, --, --, --, --, --, --, --, --
Tyler Seguin, Healthy, Dal, RW- C, SALT, NYI, L 2-3, --, --, --, --, --, --, --, --, --, --, --, --, --, --, --, --, --
Evgeny Kuznetsov, Healthy, Car, C, FA, --, --, --, --, --, --, --, --, --, --, --, --, --, --, --, --, --, --, --
T.J. Oshie, Healthy, Wsh, RW, FA, Ott, W 6-3, --, --, --, --, --, --, --, --, --, --, --, --, --, --, --, --, --
Jani Hakanpaa, DTD, Dal, D, HERB, NYI, L 2-3, --, --, --, --, --, --, --, --, --, --, --, --, --, --, --, --, --
Scott Mayfield, IR, NYI, D, FA, @Dal, W 3-2, --, --, --, --, --, --, --, --, --, --, --, --, --, --, --, --, --
Artem Zub, Healthy, Ott, D, FA, @Wsh, L 3-6, --, --, --, --, --, --, --, --, --, --, --, --, --, --, --, --, --
Mikey Anderson, Healthy, LA, D, FA, @Edm, L 2-4, --, --, --, --, --, --, --, --, --, --, --, --, --, --, --, --, --
Nick Jensen, Healthy, Wsh, D, FA, Ott, W 6-3, --, --, --, --, --, --, --, --, --, --, --, --, --, --, --, --, --
Shane Wright, Healthy, Sea, C, FA, Bos, W 4-3, --, --, --, --, --, --, --, --, --, --, --, --, --, --, --, --, --
Martin Fehervary, Healthy, Wsh, D, FA, Ott, W 6-3, --, --, --, --, --, --, --, --, --, --, --, --, --, --, --, --, --
Matthew Poitras, IR, Bos, C, FA, @Sea, L 3-4, --, --, --, --, --, --, --, --, --, --, --, --, --, --, --, --, --
Brandt Clarke, Healthy, LA, D, BBS, @Edm, L 2-4, --, --, --, --, --, --, --, --, --, --, --, --, --, --, --, --, --
Patrice Bergeron, Healthy, Bos, C, FA, @Sea, L 3-4, --, --, --, --, --, --, --, --, --, --, --, --, --, --, --, --, --
Fabian Lysell, Healthy, Bos, RW, FA, @Sea, L 3-4, --, --, --, --, --, --, --, --, --, --, --, --, --, --, --, --, --
Nicklas Backstrom, IR, Wsh, C, FA, Ott, W 6-3, --, --, --, --, --, --, --, --, --, --, --, --, --, --, --, --, --
Nic Dowd, Healthy, Wsh, C, FA, Ott, W 6-3, --, --, --, --, --, --, --, --, --, --, --, --, --, --, --, --, --
Sonny Milano, DTD, Wsh, LW, FA, Ott, W 6-3, --, --, --, --, --, --, --, --, --, --, --, --, --, --, --, --, --
Marc McLaughlin, Healthy, Bos, C, FA, @Sea, L 3-4, --, --, --, --, --, --, --, --, --, --, --, --, --, --, --, --, --
Carl Grundstrom, IR, LA, LW, FA, @Edm, L 2-4, --, --, --, --, --, --, --, --, --, --, --, --, --, --, --, --, --
Milan Lucic, IR, Bos, LW, FA, @Sea, L 3-4, --, --, --, --, --, --, --, --, --, --, --, --, --, --, --, --, --
Derek Forbort, IR, Bos, D, FA, @Sea, L 3-4, --, --, --, --, --, --, --, --, --, --, --, --, --, --, --, --, --
Sam Gagner, Healthy, Edm, C, FA, LA, W 4-2, --, --, --, --, --, --, --, --, --, --, --, --, --, --, --, --, --
Nils Lundkvist, Healthy, Dal, D, FA, NYI, L 2-3, --, --, --, --, --, --, --, --, --, --, --, --, --, --, --, --, --
Zdeno Chara, Healthy, Bos, D, FA, @Sea, L 3-4, --, --, --, --, --, --, --, --, --, --, --, --, --, --, --, --, --
Oliver Wahlstrom, Healthy, NYI, RW, FA, @Dal, W 3-2, --, --, --, --, --, --, --, --, --, --, --, --, --, --, --, --, --
Tye Kartye, Healthy, Sea, LW- C, FA, Bos, W 4-3, --, --, --, --, --, --, --, --, --, --, --, --, --, --, --, --, --
Ryan Leonard, Healthy, Wsh, RW, FA, Ott, W 6-3, --, --, --, --, --, --, --, --, --, --, --, --, --, --, --, --, --
Ivan Miroshnichenko, Healthy, Wsh, LW, FA, Ott, W 6-3, --, --, --, --, --, --, --, --, --, --, --, --, --, --, --, --, --
Johnny Beecher, Healthy, Bos, C, FA, @Sea, L 3-4, --, --, --, --, --, --, --, --, --, --, --, --, --, --, --, --, --
Ryker Evans, DTD, Sea, D, FA, Bos, W 4-3, --, --, --, --, --, --, --, --, --, --, --, --, --, --, --, --, --
Evgenii Dadonov, IR, Dal, RW, FA, NYI, L 2-3, --, --, --, --, --, --, --, --, --, --, --, --, --, --, --, --, --
Alex Turcotte, O, LA, C, FA, @Edm, L 2-4, --, --, --, --, --, --, --, --, --, --, --, --, --, --, --, --, --
David Krejci, Healthy, Bos, C, FA, @Sea, L 3-4, --, --, --, --, --, --, --, --, --, --, --, --, --, --, --, --, --
Jakub Lauko, Healthy, Bos, RW, FA, @Sea, L 3-4, --, --, --, --, --, --, --, --, --, --, --, --, --, --, --, --, --
Pierre-Edouard Bellemare, Healthy, Sea, RW, FA, Bos, W 4-3, --, --, --, --, --, --, --, --, --, --, --, --, --, --, --, --, --
Mavrik Bourque, Healthy, Dal, C, FA, NYI, L 2-3, --, --, --, --, --, --, --, --, --, --, --, --, --, --, --, --, --
Samuel Fagemo, Healthy, LA, LW, FA, @Edm, L 2-4, --, --, --, --, --, --, --, --, --, --, --, --, --, --, --, --, --
Philip Broberg, Healthy, Edm, D, FA, LA, W 4-2, --, --, --, --, --, --, --, --, --, --, --, --, --, --, --, --, --
Hudson Fasching, Healthy, NYI, RW, FA, @Dal, W 3-2, --, --, --, --, --, --, --, --, --, --, --, --, --, --, --, --, --
Duncan Keith, Healthy, Edm, D, FA, LA, W 4-2, --, --, --, --, --, --, --, --, --, --, --, --, --, --, --, --, --
Jordie Benn, Healthy, Dal, D, FA, NYI, L 2-3, --, --, --, --, --, --, --, --, --, --, --, --, --, --, --, --, --
Ian Mitchell, Healthy, Bos, D, FA, @Sea, L 3-4, --, --, --, --, --, --, --, --, --, --, --, --, --, --, --, --, --
Bokondji Imama, Healthy, Ott, LW, FA, @Wsh, L 3-6, --, --, --, --, --, --, --, --, --, --, --, --, --, --, --, --, --
Adam Erne, Healthy, Edm, LW, FA, LA, W 4-2, --, --, --, --, --, --, --, --, --, --, --, --, --, --, --, --, --
Julien Gauthier, Healthy, NYI, RW, FA, @Dal, W 3-2, --, --, --, --, --, --, --, --, --, --, --, --, --, --, --, --, --
Robert Bortuzzo, Healthy, NYI, D, FA, @Dal, W 3-2, --, --, --, --, --, --, --, --, --, --, --, --, --, --, --, --, --
Andrew Cristall, Healthy, Wsh, LW, FA, Ott, W 6-3, --, --, --, --, --, --, --, --, --, --, --, --, --, --, --, --, --
Oskar Steen, Healthy, Bos, C, FA, @Sea, L 3-4, --, --, --, --, --, --, --, --, --, --, --, --, --, --, --, --, --
Zack MacEwen, IR, Ott, C, FA, @Wsh, L 3-6, --, --, --, --, --, --, --, --, --, --, --, --, --, --, --, --, --
Alexander Edler, Healthy, LA, D, FA, @Edm, L 2-4, --, --, --, --, --, --, --, --, --, --, --, --, --, --, --, --, --
Alex Formenton, Healthy, Ott, LW, FA, @Wsh, L 3-6, --, --, --, --, --, --, --, --, --, --, --, --, --, --, --, --, --
Tyce Thompson, Healthy, NYI, RW, FA, @Dal, W 3-2, --, --, --, --, --, --, --, --, --, --, --, --, --, --, --, --, --
Eduard Sale, Healthy, Sea, RW, FA, Bos, W 4-3, --, --, --, --, --, --, --, --, --, --, --, --, --, --, --, --, --
Carl Hagelin, Healthy, Wsh, LW, FA, Ott, W 6-3, --, --, --, --, --, --, --, --, --, --, --, --, --, --, --, --, --
Patrick Brown, Healthy, Bos, C, FA, @Sea, L 3-4, --, --, --, --, --, --, --, --, --, --, --, --, --, --, --, --, --
Angus Crookshank, Healthy, Ott, LW, FA, @Wsh, L 3-6, --, --, --, --, --, --, --, --, --, --, --, --, --, --, --, --, --
Nick Holden, Healthy, Ott, D, FA, @Wsh, L 3-6, --, --, --, --, --, --, --, --, --, --, --, --, --, --, --, --, --
Samuel Bolduc, Healthy, NYI, D, FA, @Dal, W 3-2, --, --, --, --, --, --, --, --, --, --, --, --, --, --, --, --, --
Devin Shore, Healthy, Sea, C, FA, Bos, W 4-3, --, --, --, --, --, --, --, --, --, --, --, --, --, --, --, --, --
Dustin Brown, Healthy, LA, RW, FA, @Edm, L 2-4, --, --, --, --, --, --, --, --, --, --, --, --, --, --, --, --, --
Anton Stralman, Healthy, Bos, D, FA, @Sea, L 3-4, --, --, --, --, --, --, --, --, --, --, --, --, --, --, --, --, --
Kevan Miller, Healthy, Bos, D, FA, @Sea, L 3-4, --, --, --, --, --, --, --, --, --, --, --, --, --, --, --, --, --
Par Lindholm, Healthy, Bos, C, FA, @Sea, L 3-4, --, --, --, --, --, --, --, --, --, --, --, --, --, --, --, --, --
Andrew Poturalski, Healthy, Sea, C, FA, Bos, W 4-3, --, --, --, --, --, --, --, --, --, --, --, --, --, --, --, --, --
Reilly Walsh, Healthy, Bos, D, FA, @Sea, L 3-4, --, --, --, --, --, --, --, --, --, --, --, --, --, --, --, --, --
Tyler Kleven, Healthy, Ott, D, FA, @Wsh, L 3-6, --, --, --, --, --, --, --, --, --, --, --, --, --, --, --, --, --
Josh Bailey, Healthy, Ott, LW, FA, @Wsh, L 3-6, --, --, --, --, --, --, --, --, --, --, --, --, --, --, --, --, --
Connor Carrick, Healthy, Sea, D, FA, Bos, W 4-3, --, --, --, --, --, --, --, --, --, --, --, --, --, --, --, --, --
Jakub Zboril, Healthy, Bos, D, FA, @Sea, L 3-4, --, --, --, --, --, --, --, --, --, --, --, --, --, --, --, --, --
Derick Brassard, O, Ott, C, FA, @Wsh, L 3-6, --, --, --, --, --, --, --, --, --, --, --, --, --, --, --, --, --
James Hamblin, Healthy, Edm, RW- C, FA, LA, W 4-2, --, --, --, --, --, --, --, --, --, --, --, --, --, --, --, --, --
Lukas Dragicevic, Healthy, Sea, D, FA, Bos, W 4-3, --, --, --, --, --, --, --, --, --, --, --, --, --, --, --, --, --
Cale Fleury, Healthy, Sea, D, FA, Bos, W 4-3, --, --, --, --, --, --, --, --, --, --, --, --, --, --, --, --, --
Carson Rehkopf, Healthy, Sea, LW, FA, Bos, W 4-3, --, --, --, --, --, --, --, --, --, --, --, --, --, --, --, --, --
Vladimir Tkachev, Healthy, LA, LW, FA, @Edm, L 2-4, --, --, --, --, --, --, --, --, --, --, --, --, --, --, --, --, --
Dylan McIlrath, Healthy, Wsh, D, FA, Ott, W 6-3, --, --, --, --, --, --, --, --, --, --, --, --, --, --, --, --, --
Max McCormick, Healthy, Sea, LW, FA, Bos, W 4-3, --, --, --, --, --, --, --, --, --, --, --, --, --, --, --, --, --
John Hayden, Healthy, Sea, RW, FA, Bos, W 4-3, --, --, --, --, --, --, --, --, --, --, --, --, --, --, --, --, --
Alex Chiasson, Healthy, Bos, RW, FA, @Sea, L 3-4, --, --, --, --, --, --, --, --, --, --, --, --, --, --, --, --, --
Joonas Donskoi, Healthy, Sea, RW, FA, Bos, W 4-3, --, --, --, --, --, --, --, --, --, --, --, --, --, --, --, --, --
Joe Snively, Healthy, Wsh, RW- LW, FA, Ott, W 6-3, --, --, --, --, --, --, --, --, --, --, --, --, --, --, --, --, --
Rourke Chartier, IR, Ott, C, FA, @Wsh, L 3-6, --, --, --, --, --, --, --, --, --, --, --, --, --, --, --, --, --
Ryan Murray, O, Edm, D, FA, LA, W 4-2, --, --, --, --, --, --, --, --, --, --, --, --, --, --, --, --, --
Lian Bichsel, Healthy, Dal, D, FA, NYI, L 2-3, --, --, --, --, --, --, --, --, --, --, --, --, --, --, --, --, --
Andrej Sekera, Healthy, Dal, D, FA, NYI, L 2-3, --, --, --, --, --, --, --, --, --, --, --, --, --, --, --, --, --
Cam Dineen, Healthy, Edm, D, FA, LA, W 4-2, --, --, --, --, --, --, --, --, --, --, --, --, --, --, --, --, --
Jason Demers, Healthy, Edm, D, FA, LA, W 4-2, --, --, --, --, --, --, --, --, --, --, --, --, --, --, --, --, --
Marian Studenic, Healthy, Sea, RW, FA, Bos, W 4-3, --, --, --, --, --, --, --, --, --, --, --, --, --, --, --, --, --
Raphael Lavoie, Healthy, Edm, C, FA, LA, W 4-2, --, --, --, --, --, --, --, --, --, --, --, --, --, --, --, --, --
Ben Lovejoy, Healthy, Dal, D, FA, NYI, L 2-3, --, --, --, --, --, --, --, --, --, --, --, --, --, --, --, --, --
Beau Akey, Healthy, Edm, D, FA, LA, W 4-2, --, --, --, --, --, --, --, --, --, --, --, --, --, --, --, --, --
Gustav Olofsson, Healthy, Sea, D, FA, Bos, W 4-3, --, --, --, --, --, --, --, --, --, --, --, --, --, --, --, --, --
Greg McKegg, Healthy, Edm, C, FA, LA, W 4-2, --, --, --, --, --, --, --, --, --, --, --, --, --, --, --, --, --
Maxence Guenette, Healthy, Ott, D, FA, @Wsh, L 3-6, --, --, --, --, --, --, --, --, --, --, --, --, --, --, --, --, --
Grant Hutton, Healthy, NYI, D, FA, @Dal, W 3-2, --, --, --, --, --, --, --, --, --, --, --, --, --, --, --, --, --
Lucas Johansen, Healthy, Wsh, D, FA, Ott, W 6-3, --, --, --, --, --, --, --, --, --, --, --, --, --, --, --, --, --
William Dufour, Healthy, NYI, RW, FA, @Dal, W 3-2, --, --, --, --, --, --, --, --, --, --, --, --, --, --, --, --, --
Danny Nelson, Healthy, NYI, C, FA, @Dal, W 3-2, --, --, --, --, --, --, --, --, --, --, --, --, --, --, --, --, --
Slater Koekkoek, Healthy, Edm, D, FA, LA, W 4-2, --, --, --, --, --, --, --, --, --, --, --, --, --, --, --, --, --
Drake Caggiula, Healthy, Edm, LW, FA, LA, W 4-2, --, --, --, --, --, --, --, --, --, --, --, --, --, --, --, --, --
Paul LaDue, Healthy, NYI, D, FA, @Dal, W 3-2, --, --, --, --, --, --, --, --, --, --, --, --, --, --, --, --, --
Andy Greene, Healthy, NYI, D, FA, @Dal, W 3-2, --, --, --, --, --, --, --, --, --, --, --, --, --, --, --, --, --
Mike Vecchione, Healthy, Wsh, C, FA, Ott, W 6-3, --, --, --, --, --, --, --, --, --, --, --, --, --, --, --, --, --
Egor Sokolov, Healthy, Ott, LW, FA, @Wsh, L 3-6, --, --, --, --, --, --, --, --, --, --, --, --, --, --, --, --, --
