Brett Pesce, Healthy, Car, D, FA, @Col, L 4-6, --, --, --, --, --, --, --, --, --, --, --, --, --, --, --, --, --
Brandt Clarke, Healthy, LA, D, FA, Bos, L 2-4, --, --, --, --, --, --, --, --, --, --, --, --, --, --, --, --, --
Patrice Bergeron, Healthy, Bos, C, FA, @LA, W 4-2, --, --, --, --, --, --, --, --, --, --, --, --, --, --, --, --, --
Zach Benson, Healthy, Buf, LW, FA, NYI, W 3-1, --, --, --, --, --, --, --, --, --, --, --, --, --, --, --, --, --
Calen Addison, Healthy, SJ, D, FA, @Nsh, L 1-5, 1, 0, 0, 0, 2, 0, 0, 0, 0, 0, 0, 0, 0, 2, 0, 0, 0.0
Fabian Lysell, Healthy, Bos, RW, FA, @LA, W 4-2, --, --, --, --, --, --, --, --, --, --, --, --, --, --, --, --, --
Ty Smith, Healthy, Pit, D, FA, @StL, L 2-4, --, --, --, --, --, --, --, --, --, --, --, --, --, --, --, --, --
Nils Hoglander, Healthy, Van, LW, FA, @Fla, W 5-3, --, --, --, --, --, --, --, --, --, --, --, --, --, --, --, --, --
Teddy Blueger, Healthy, Van, C, FA, @Fla, W 5-3, --, --, --, --, --, --, --, --, --, --, --, --, --, --, --, --, --
Tomas Tatar, Healthy, Sea, LW, FA, NYR, L 1-4, 1, 0, 0, -1, 0, 0, 0, 0, 0, 0, 0, 0, 0, 0, 0, 1, 0.0
Ryan Reaves, IR, Tor, RW, FA, @TB, W 4-3, 1, 0, 0, 0, 0, 0, 0, 0, 0, 0, 0, 0, 0, 0, 0, 0, 0.0
Zach Whitecloud, Healthy, Vgk, D, FA, @Chi, W 5-3, --, --, --, --, --, --, --, --, --, --, --, --, --, --, --, --, --
Shane Pinto, SSPD, Ott, C, FA, Det, L 2-5, --, --, --, --, --, --, --, --, --, --, --, --, --, --, --, --, --
Henry Thrun, Healthy, SJ, D, FA, @Nsh, L 1-5, --, --, --, --, --, --, --, --, --, --, --, --, --, --, --, --, --
Nicholas Robertson, Healthy, Tor, LW, FA, @TB, W 4-3, --, --, --, --, --, --, --, --, --, --, --, --, --, --, --, --, --
Sebastian Aho, Healthy, NYI, D, FA, @Buf, L 1-3, 1, 0, 0, -1, 0, 0, 0, 0, 0, 0, 0, 0, 0, 0, 0, 1, 0.0
Dominic Toninato, Healthy, Wpg, C, FA, @Edm, W 3-2, --, --, --, --, --, --, --, --, --, --, --, --, --, --, --, --, --
Mike Reilly, Healthy, NYI, D, FA, @Buf, L 1-3, --, --, --, --, --, --, --, --, --, --, --, --, --, --, --, --, --
Nic Dowd, Healthy, Wsh, C, FA, @Mon, L 2-3, --, --, --, --, --, --, --, --, --, --, --, --, --, --, --, --, --
Simon Edvinsson, Healthy, Det, D, FA, @Ott, W 5-2, --, --, --, --, --, --, --, --, --, --, --, --, --, --, --, --, --
Tyler Johnson, IR, Chi, C- LW- RW, FA, Vgk, L 3-5, 1, 0, 0, -1, 0, 0, 0, 0, 0, 0, 0, 2, 0, 1, 2, 0, 0.0
Phil Kessel, Healthy, Vgk, RW, FA, @Chi, W 5-3, --, --, --, --, --, --, --, --, --, --, --, --, --, --, --, --, --
Connor Mackey, Healthy, NYR, D, FA, @Sea, W 4-1, --, --, --, --, --, --, --, --, --, --, --, --, --, --, --, --, --
Brandon Tanev, Healthy, Sea, LW, FA, NYR, L 1-4, --, --, --, --, --, --, --, --, --, --, --, --, --, --, --, --, --
Michael Pezzetta, Healthy, Mon, LW- RW, FA, Wsh, W 3-2, 1, 0, 0, 0, 0, 0, 0, 0, 0, 0, 0, 0, 0, 0, 0, 0, 0.0
Nikita Zaitsev, Healthy, Chi, D, FA, Vgk, L 3-5, --, --, --, --, --, --, --, --, --, --, --, --, --, --, --, --, --
Wade Allison, Healthy, Phi, RW, FA, @Dal, L 4-5, --, --, --, --, --, --, --, --, --, --, --, --, --, --, --, --, --
Simon Benoit, Healthy, Tor, D, FA, @TB, W 4-3, --, --, --, --, --, --, --, --, --, --, --, --, --, --, --, --, --
Sam Gagner, Healthy, Edm, C, FA, Wpg, L 2-3, --, --, --, --, --, --, --, --, --, --, --, --, --, --, --, --, --
Simon Holmstrom, Healthy, NYI, RW, FA, @Buf, L 1-3, --, --, --, --, --, --, --, --, --, --, --, --, --, --, --, --, --
Matvei Michkov, Healthy, Phi, RW, FA, @Dal, L 4-5, --, --, --, --, --, --, --, --, --, --, --, --, --, --, --, --, --
Nicolas Aube-Kubel, Healthy, Wsh, RW, FA, @Mon, L 2-3, --, --, --, --, --, --, --, --, --, --, --, --, --, --, --, --, --
Josh Archibald, Healthy, TB, RW, FA, Tor, L 3-4, --, --, --, --, --, --, --, --, --, --, --, --, --, --, --, --, --
Evgenii Dadonov, Healthy, Dal, RW, FA, Phi, W 5-4, 1, 0, 0, -1, 0, 0, 0, 0, 0, 0, 0, 0, 0, 2, 1, 0, 0.0
Cutter Gauthier, Healthy, Ana, LW, FA, @Ari, L 1-2, --, --, --, --, --, --, --, --, --, --, --, --, --, --, --, --, --
Logan Stankoven, Healthy, Dal, C, FA, Phi, W 5-4, --, --, --, --, --, --, --, --, --, --, --, --, --, --, --, --, --
Jack Johnson, Healthy, Col, D, FA, Car, W 6-4, 1, 0, 0, 0, 0, 0, 0, 0, 0, 0, 0, 0, 0, 0, 0, 0, 0.0
William Smith, Healthy, SJ, C, FA, @Nsh, L 1-5, --, --, --, --, --, --, --, --, --, --, --, --, --, --, --, --, --
Jonathan Toews, Healthy, Chi, C, FA, Vgk, L 3-5, --, --, --, --, --, --, --, --, --, --, --, --, --, --, --, --, --
Caleb Jones, Healthy, Col, D, FA, Car, W 6-4, --, --, --, --, --, --, --, --, --, --, --, --, --, --, --, --, --
Nikita Okhotiuk, Healthy, SJ, D, FA, @Nsh, L 1-5, --, --, --, --, --, --, --, --, --, --, --, --, --, --, --, --, --
Brandon Biro, Healthy, Buf, LW, FA, NYI, W 3-1, --, --, --, --, --, --, --, --, --, --, --, --, --, --, --, --, --
Marc Staal, Healthy, Phi, D, FA, @Dal, L 4-5, --, --, --, --, --, --, --, --, --, --, --, --, --, --, --, --, --
Ty Dellandrea, Healthy, Dal, RW- C, FA, Phi, W 5-4, --, --, --, --, --, --, --, --, --, --, --, --, --, --, --, --, --
Conor Timmins, Healthy, Tor, D, FA, @TB, W 4-3, --, --, --, --, --, --, --, --, --, --, --, --, --, --, --, --, --
Valtteri Puustinen, Healthy, Pit, LW, FA, @StL, L 2-4, --, --, --, --, --, --, --, --, --, --, --, --, --, --, --, --, --
Scott Perunovich, Healthy, StL, D, FA, Pit, W 4-2, --, --, --, --, --, --, --, --, --, --, --, --, --, --, --, --, --
Ethan Bear, Healthy, Wsh, D, FA, @Mon, L 2-3, --, --, --, --, --, --, --, --, --, --, --, --, --, --, --, --, --
Danil Gushchin, Healthy, SJ, RW, FA, @Nsh, L 1-5, --, --, --, --, --, --, --, --, --, --, --, --, --, --, --, --, --
Pierre-Olivier Joseph, Healthy, Pit, D, FA, @StL, L 2-4, --, --, --, --, --, --, --, --, --, --, --, --, --, --, --, --, --
Lane Hutson, Healthy, Mon, D, FA, Wsh, W 3-2, --, --, --, --, --, --, --, --, --, --, --, --, --, --, --, --, --
Jacob MacDonald, IR, SJ, D, FA, @Nsh, L 1-5, --, --, --, --, --, --, --, --, --, --, --, --, --, --, --, --, --
Nick Blankenburg, IR, Cls, D, FA, @Min, W 5-4, --, --, --, --, --, --, --, --, --, --, --, --, --, --, --, --, --
Austin Watson, Healthy, TB, RW, FA, Tor, L 3-4, --, --, --, --, --, --, --, --, --, --, --, --, --, --, --, --, --
Colin Blackwell, Healthy, Chi, C- RW, FA, Vgk, L 3-5, --, --, --, --, --, --, --, --, --, --, --, --, --, --, --, --, --
David Reinbacher, Healthy, Mon, D, FA, Wsh, W 3-2, --, --, --, --, --, --, --, --, --, --, --, --, --, --, --, --, --
Zdeno Chara, Healthy, Bos, D, FA, @LA, W 4-2, --, --, --, --, --, --, --, --, --, --, --, --, --, --, --, --, --
Jaycob Megna, Healthy, Chi, D, FA, Vgk, L 3-5, --, --, --, --, --, --, --, --, --, --, --, --, --, --, --, --, --
Cody Glass, Healthy, Nsh, C, FA, SJ, W 5-1, --, --, --, --, --, --, --, --, --, --, --, --, --, --, --, --, --
Matt Savoie, Healthy, Buf, C, FA, NYI, W 3-1, --, --, --, --, --, --, --, --, --, --, --, --, --, --, --, --, --
Danton Heinen, Healthy, Bos, C, FA, @LA, W 4-2, --, --, --, --, --, --, --, --, --, --, --, --, --, --, --, --, --
Zach Parise, Healthy, NYI, LW, FA, @Buf, L 1-3, --, --, --, --, --, --, --, --, --, --, --, --, --, --, --, --, --
Josh Brown, Healthy, Ari, D, FA, Ana, W 2-1, --, --, --, --, --, --, --, --, --, --, --, --, --, --, --, --, --
Ryan Leonard, Healthy, Wsh, RW, FA, @Mon, L 2-3, --, --, --, --, --, --, --, --, --, --, --, --, --, --, --, --, --
Erik Brannstrom, Healthy, Ott, D, FA, Det, L 2-5, 1, 0, 0, 0, 2, 0, 0, 0, 0, 0, 0, 0, 0, 2, 0, 0, 0.0
Alex Goligoski, Healthy, Min, D, FA, Cls, L 4-5, --, --, --, --, --, --, --, --, --, --, --, --, --, --, --, --, --
Marco Kasper, Healthy, Det, C, FA, @Ott, W 5-2, --, --, --, --, --, --, --, --, --, --, --, --, --, --, --, --, --
Wayne Simmonds, Healthy, Tor, RW, FA, @TB, W 4-3, --, --, --, --, --, --, --, --, --, --, --, --, --, --, --, --, --
Joel Kiviranta, Healthy, Col, LW, FA, Car, W 6-4, --, --, --, --, --, --, --, --, --, --, --, --, --, --, --, --, --
Ben Meyers, Healthy, Col, RW, FA, Car, W 6-4, --, --, --, --, --, --, --, --, --, --, --, --, --, --, --, --, --
Vinnie Hinostroza, Healthy, Pit, RW, FA, @StL, L 2-4, --, --, --, --, --, --, --, --, --, --, --, --, --, --, --, --, --
Brayden Yager, Healthy, Pit, C, FA, @StL, L 2-4, --, --, --, --, --, --, --, --, --, --, --, --, --, --, --, --, --
Jonny Brodzinski, Healthy, NYR, C, FA, @Sea, W 4-1, --, --, --, --, --, --, --, --, --, --, --, --, --, --, --, --, --
Olen Zellweger, Healthy, Ana, D, FA, @Ari, L 1-2, --, --, --, --, --, --, --, --, --, --, --, --, --, --, --, --, --
Jonatan Berggren, Healthy, Det, RW, FA, @Ott, W 5-2, --, --, --, --, --, --, --, --, --, --, --, --, --, --, --, --, --
Alex Nylander, Healthy, Pit, LW- RW, FA, @StL, L 2-4, --, --, --, --, --, --, --, --, --, --, --, --, --, --, --, --, --
David Krejci, Healthy, Bos, C, FA, @LA, W 4-2, --, --, --, --, --, --, --, --, --, --, --, --, --, --, --, --, --
Michael Kesselring, Healthy, Ari, D, FA, Ana, W 2-1, --, --, --, --, --, --, --, --, --, --, --, --, --, --, --, --, --
Travis Boyd, IR, Ari, C, FA, Ana, W 2-1, --, --, --, --, --, --, --, --, --, --, --, --, --, --, --, --, --
Ben Hutton, IR, Vgk, D, FA, @Chi, W 5-3, --, --, --, --, --, --, --, --, --, --, --, --, --, --, --, --, --
Matthew Wood, Healthy, Nsh, LW, FA, SJ, W 5-1, --, --, --, --, --, --, --, --, --, --, --, --, --, --, --, --, --
Thomas Bordeleau, Healthy, SJ, C- LW, FA, @Nsh, L 1-5, --, --, --, --, --, --, --, --, --, --, --, --, --, --, --, --, --
Jesse Puljujarvi, O, Car, RW, FA, @Col, L 4-6, --, --, --, --, --, --, --, --, --, --, --, --, --, --, --, --, --
Bobby McMann, Healthy, Tor, C, FA, @TB, W 4-3, --, --, --, --, --, --, --, --, --, --, --, --, --, --, --, --, --
Cole Guttman, Healthy, Chi, C, FA, Vgk, L 3-5, --, --, --, --, --, --, --, --, --, --, --, --, --, --, --, --, --
Zac Jones, Healthy, NYR, D, FA, @Sea, W 4-1, --, --, --, --, --, --, --, --, --, --, --, --, --, --, --, --, --
Nate Danielson, Healthy, Det, C, FA, @Ott, W 5-2, --, --, --, --, --, --, --, --, --, --, --, --, --, --, --, --, --
Jiri Kulich, Healthy, Buf, C- LW, FA, NYI, W 3-1, --, --, --, --, --, --, --, --, --, --, --, --, --, --, --, --, --
Ivan Miroshnichenko, Healthy, Wsh, LW, FA, @Mon, L 2-3, --, --, --, --, --, --, --, --, --, --, --, --, --, --, --, --, --
Joel Edmundson, Healthy, Wsh, D, FA, @Mon, L 2-3, --, --, --, --, --, --, --, --, --, --, --, --, --, --, --, --, --
Joel Armia, Healthy, Mon, RW, FA, Wsh, W 3-2, --, --, --, --, --, --, --, --, --, --, --, --, --, --, --, --, --
Kurtis MacDermid, Healthy, Col, D, FA, Car, W 6-4, --, --, --, --, --, --, --, --, --, --, --, --, --, --, --, --, --
Tyler Pitlick, DTD, NYR, RW, FA, @Sea, W 4-1, --, --, --, --, --, --, --, --, --, --, --, --, --, --, --, --, --
Tom Willander, Healthy, Van, D, FA, @Fla, W 5-3, --, --, --, --, --, --, --, --, --, --, --, --, --, --, --, --, --
Parker Wotherspoon, Healthy, Bos, D, FA, @LA, W 4-2, --, --, --, --, --, --, --, --, --, --, --, --, --, --, --, --, --
Jimmy Snuggerud, Healthy, StL, RW, FA, Pit, W 4-2, --, --, --, --, --, --, --, --, --, --, --, --, --, --, --, --, --
Axel Sandin Pellikka, Healthy, Det, D, FA, @Ott, W 5-2, --, --, --, --, --, --, --, --, --, --, --, --, --, --, --, --, --
Oliver Moore, Healthy, Chi, C, FA, Vgk, L 3-5, --, --, --, --, --, --, --, --, --, --, --, --, --, --, --, --, --
Ville Heinola, Healthy, Wpg, D, FA, @Edm, W 3-2, --, --, --, --, --, --, --, --, --, --, --, --, --, --, --, --, --
Alex Turcotte, Healthy, LA, C, FA, Bos, L 2-4, --, --, --, --, --, --, --, --, --, --, --, --, --, --, --, --, --
Calvin de Haan, Healthy, TB, D, FA, Tor, L 3-4, --, --, --, --, --, --, --, --, --, --, --, --, --, --, --, --, --
Haydn Fleury, IR, TB, D, FA, Tor, L 3-4, --, --, --, --, --, --, --, --, --, --, --, --, --, --, --, --, --
Christian Dvorak, IR, Mon, LW, FA, Wsh, W 3-2, --, --, --, --, --, --, --, --, --, --, --, --, --, --, --, --, --
Dalibor Dvorsky, Healthy, StL, C, FA, Pit, W 4-2, --, --, --, --, --, --, --, --, --, --, --, --, --, --, --, --, --
Denis Gurianov, Healthy, Nsh, LW, FA, SJ, W 5-1, --, --, --, --, --, --, --, --, --, --, --, --, --, --, --, --, --
Eric Robinson, Healthy, Buf, LW, FA, NYI, W 3-1, --, --, --, --, --, --, --, --, --, --, --, --, --, --, --, --, --
Gabriel Perreault, Healthy, NYR, RW, FA, @Sea, W 4-1, --, --, --, --, --, --, --, --, --, --, --, --, --, --, --, --, --
Klim Kostin, IR, Det, RW- LW, FA, @Ott, W 5-2, --, --, --, --, --, --, --, --, --, --, --, --, --, --, --, --, --
Vasily Podkolzin, Healthy, Van, RW, FA, @Fla, W 5-3, --, --, --, --, --, --, --, --, --, --, --, --, --, --, --, --, --
Joel Ward, Healthy, SJ, RW, FA, @Nsh, L 1-5, --, --, --, --, --, --, --, --, --, --, --, --, --, --, --, --, --
Easton Cowan, Healthy, Tor, RW, FA, @TB, W 4-3, --, --, --, --, --, --, --, --, --, --, --, --, --, --, --, --, --
Jordie Benn, Healthy, Dal, D, FA, Phi, W 5-4, --, --, --, --, --, --, --, --, --, --, --, --, --, --, --, --, --
Ian Mitchell, Healthy, Bos, D, FA, @LA, W 4-2, 1, 0, 0, 0, 0, 0, 0, 0, 0, 0, 0, 0, 0, 0, 0, 0, 0.0
Mackie Samoskevich, Healthy, Fla, LW- RW, FA, Van, L 3-5, --, --, --, --, --, --, --, --, --, --, --, --, --, --, --, --, --
Matt Nieto, IR, Pit, LW, FA, @StL, L 2-4, 1, 0, 0, 0, 0, 0, 0, 0, 0, 0, 0, 0, 0, 0, 0, 0, 0.0
Philip Broberg, Healthy, Edm, D, FA, Wpg, L 2-3, 1, 0, 0, 0, 0, 0, 0, 0, 0, 0, 0, 0, 0, 0, 0, 0, 0.0
Tyler Motte, Healthy, TB, C, FA, Tor, L 3-4, --, --, --, --, --, --, --, --, --, --, --, --, --, --, --, --, --
Givani Smith, IR, SJ, RW, FA, @Nsh, L 1-5, --, --, --, --, --, --, --, --, --, --, --, --, --, --, --, --, --
Joakim Kemell, Healthy, Nsh, RW, FA, SJ, W 5-1, --, --, --, --, --, --, --, --, --, --, --, --, --, --, --, --, --
Quentin Musty, Healthy, SJ, LW, FA, @Nsh, L 1-5, --, --, --, --, --, --, --, --, --, --, --, --, --, --, --, --, --
Conor Geekie, Healthy, Ari, C, FA, Ana, W 2-1, --, --, --, --, --, --, --, --, --, --, --, --, --, --, --, --, --
Eric Staal, Healthy, Fla, C, FA, Van, L 3-5, --, --, --, --, --, --, --, --, --, --, --, --, --, --, --, --, --
Frank Nazar, Healthy, Chi, C, FA, Vgk, L 3-5, --, --, --, --, --, --, --, --, --, --, --, --, --, --, --, --, --
MacKenzie Entwistle, Healthy, Chi, RW, FA, Vgk, L 3-5, --, --, --, --, --, --, --, --, --, --, --, --, --, --, --, --, --
Dmitriy Simashev, Healthy, Ari, D, FA, Ana, W 2-1, --, --, --, --, --, --, --, --, --, --, --, --, --, --, --, --, --
Mavrik Bourque, Healthy, Dal, C, FA, Phi, W 5-4, --, --, --, --, --, --, --, --, --, --, --, --, --, --, --, --, --
Rutger McGroarty, O, Wpg, RW, FA, @Edm, W 3-2, --, --, --, --, --, --, --, --, --, --, --, --, --, --, --, --, --
Adam Erne, Healthy, Edm, LW, FA, Wpg, L 2-3, --, --, --, --, --, --, --, --, --, --, --, --, --, --, --, --, --
Hudson Fasching, Healthy, NYI, RW, FA, @Buf, L 1-3, --, --, --, --, --, --, --, --, --, --, --, --, --, --, --, --, --
Hendrix Lapierre, Healthy, Wsh, C, FA, @Mon, L 2-3, --, --, --, --, --, --, --, --, --, --, --, --, --, --, --, --, --
Danil Yurtaykin, Healthy, SJ, LW, FA, @Nsh, L 1-5, --, --, --, --, --, --, --, --, --, --, --, --, --, --, --, --, --
Oliver Bonk, Healthy, Phi, D, FA, @Dal, L 4-5, --, --, --, --, --, --, --, --, --, --, --, --, --, --, --, --, --
Jake Muzzin, IR, Tor, D, FA, @TB, W 4-3, --, --, --, --, --, --, --, --, --, --, --, --, --, --, --, --, --
Denton Mateychuk, Healthy, Cls, D, FA, @Min, W 5-4, --, --, --, --, --, --, --, --, --, --, --, --, --, --, --, --, --
Colby Barlow, Healthy, Wpg, LW, FA, @Edm, W 3-2, --, --, --, --, --, --, --, --, --, --, --, --, --, --, --, --, --
Joe Thornton, Healthy, Fla, C, FA, Van, L 3-5, --, --, --, --, --, --, --, --, --, --, --, --, --, --, --, --, --
Max Jones, IR, Ana, LW, FA, @Ari, L 1-2, --, --, --, --, --, --, --, --, --, --, --, --, --, --, --, --, --
Noah Juulsen, Healthy, Van, D, FA, @Fla, W 5-3, --, --, --, --, --, --, --, --, --, --, --, --, --, --, --, --, --
Daniil But, Healthy, Ari, LW, FA, Ana, W 2-1, --, --, --, --, --, --, --, --, --, --, --, --, --, --, --, --, --
Luke Witkowski, Healthy, StL, LW, FA, Pit, W 4-2, --, --, --, --, --, --, --, --, --, --, --, --, --, --, --, --, --
Alexander Alexeyev, Healthy, Wsh, D, FA, @Mon, L 2-3, --, --, --, --, --, --, --, --, --, --, --, --, --, --, --, --, --
Robert Bortuzzo, IR, NYI, D, FA, @Buf, L 1-3, --, --, --, --, --, --, --, --, --, --, --, --, --, --, --, --, --
Gustav Lindstrom, Healthy, Ana, D, FA, @Ari, L 1-2, --, --, --, --, --, --, --, --, --, --, --, --, --, --, --, --, --
Bokondji Imama, Healthy, Ott, LW, FA, Det, L 2-5, --, --, --, --, --, --, --, --, --, --, --, --, --, --, --, --, --
Jonah Gadjovich, Healthy, Fla, LW, FA, Van, L 3-5, --, --, --, --, --, --, --, --, --, --, --, --, --, --, --, --, --
Isaak Phillips, Healthy, Chi, D, FA, Vgk, L 3-5, --, --, --, --, --, --, --, --, --, --, --, --, --, --, --, --, --
Joel Hanley, Healthy, Dal, D, FA, Phi, W 5-4, --, --, --, --, --, --, --, --, --, --, --, --, --, --, --, --, --
Victor Soderstrom, Healthy, Ari, D, FA, Ana, W 2-1, --, --, --, --, --, --, --, --, --, --, --, --, --, --, --, --, --
Jonathan Lekkerimaki, Healthy, Van, RW, FA, @Fla, W 5-3, --, --, --, --, --, --, --, --, --, --, --, --, --, --, --, --, --
Zack MacEwen, Healthy, Ott, C, FA, Det, L 2-5, --, --, --, --, --, --, --, --, --, --, --, --, --, --, --, --, --
Duncan Keith, Healthy, Edm, D, FA, Wpg, L 2-3, --, --, --, --, --, --, --, --, --, --, --, --, --, --, --, --, --
Jansen Harkins, Healthy, Pit, C, FA, @StL, L 2-4, --, --, --, --, --, --, --, --, --, --, --, --, --, --, --, --, --
Patrick Wiercioch, Healthy, Van, D, FA, @Fla, W 5-3, --, --, --, --, --, --, --, --, --, --, --, --, --, --, --, --, --
Aatu Raty, Healthy, Van, C, FA, @Fla, W 5-3, --, --, --, --, --, --, --, --, --, --, --, --, --, --, --, --, --
Justin Bailey, Healthy, SJ, RW, FA, @Nsh, L 1-5, --, --, --, --, --, --, --, --, --, --, --, --, --, --, --, --, --
William Lagesson, Healthy, Tor, D, FA, @TB, W 4-3, --, --, --, --, --, --, --, --, --, --, --, --, --, --, --, --, --
Nick Ritchie, Healthy, StL, LW, FA, Pit, W 4-2, --, --, --, --, --, --, --, --, --, --, --, --, --, --, --, --, --
Fraser Minten, Healthy, Tor, C, FA, @TB, W 4-3, --, --, --, --, --, --, --, --, --, --, --, --, --, --, --, --, --
Oskar Steen, Healthy, Bos, C, FA, @LA, W 4-2, --, --, --, --, --, --, --, --, --, --, --, --, --, --, --, --, --
Jake Christiansen, Healthy, Cls, D, FA, @Min, W 5-4, --, --, --, --, --, --, --, --, --, --, --, --, --, --, --, --, --
Brad Lambert, Healthy, Wpg, C, FA, @Edm, W 3-2, --, --, --, --, --, --, --, --, --, --, --, --, --, --, --, --, --
Chris Wideman, IR, Mon, D, FA, Wsh, W 3-2, --, --, --, --, --, --, --, --, --, --, --, --, --, --, --, --, --
Jasper Weatherby, Healthy, Det, LW, FA, @Ott, W 5-2, --, --, --, --, --, --, --, --, --, --, --, --, --, --, --, --, --
Elmer Soderblom, Healthy, Det, LW- C, FA, @Ott, W 5-2, --, --, --, --, --, --, --, --, --, --, --, --, --, --, --, --, --
Jujhar Khaira, Healthy, Min, LW- C, FA, Cls, L 4-5, --, --, --, --, --, --, --, --, --, --, --, --, --, --, --, --, --
Brendan Brisson, Healthy, Vgk, C, FA, @Chi, W 5-3, --, --, --, --, --, --, --, --, --, --, --, --, --, --, --, --, --
Colton White, Healthy, Ana, D, FA, @Ari, L 1-2, --, --, --, --, --, --, --, --, --, --, --, --, --, --, --, --, --
Jakub Voracek, IR, Ari, RW, FA, Ana, W 2-1, --, --, --, --, --, --, --, --, --, --, --, --, --, --, --, --, --
Jesper Boqvist, Healthy, Bos, C, FA, @LA, W 4-2, --, --, --, --, --, --, --, --, --, --, --, --, --, --, --, --, --
Urho Vaakanainen, Healthy, Ana, D, FA, @Ari, L 1-2, --, --, --, --, --, --, --, --, --, --, --, --, --, --, --, --, --
Alexander Edler, Healthy, LA, D, FA, Bos, L 2-4, --, --, --, --, --, --, --, --, --, --, --, --, --, --, --, --, --
Logan Stanley, Healthy, Wpg, D, FA, @Edm, W 3-2, --, --, --, --, --, --, --, --, --, --, --, --, --, --, --, --, --
Nils Aman, Healthy, Van, C, FA, @Fla, W 5-3, --, --, --, --, --, --, --, --, --, --, --, --, --, --, --, --, --
Nathan Walker, Healthy, StL, C, FA, Pit, W 4-2, --, --, --, --, --, --, --, --, --, --, --, --, --, --, --, --, --
Eduard Sale, Healthy, Sea, RW, FA, NYR, L 1-4, --, --, --, --, --, --, --, --, --, --, --, --, --, --, --, --, --
Evgeny Svechnikov, Healthy, SJ, LW, FA, @Nsh, L 1-5, --, --, --, --, --, --, --, --, --, --, --, --, --, --, --, --, --
Andrew Cristall, Healthy, Wsh, LW, FA, @Mon, L 2-3, --, --, --, --, --, --, --, --, --, --, --, --, --, --, --, --, --
Ryan Suzuki, Healthy, Car, C, FA, @Col, L 4-6, --, --, --, --, --, --, --, --, --, --, --, --, --, --, --, --, --
Rem Pitlick, Healthy, Chi, C, FA, Vgk, L 3-5, --, --, --, --, --, --, --, --, --, --, --, --, --, --, --, --, --
Tobias Bjornfot, Healthy, Vgk, D, FA, @Chi, W 5-3, --, --, --, --, --, --, --, --, --, --, --, --, --, --, --, --, --
Louie Belpedio, Healthy, Phi, D, FA, @Dal, L 4-5, --, --, --, --, --, --, --, --, --, --, --, --, --, --, --, --, --
Isac Lundestrom, Healthy, Ana, C, FA, @Ari, L 1-2, --, --, --, --, --, --, --, --, --, --, --, --, --, --, --, --, --
Joey Anderson, Healthy, Chi, RW, FA, Vgk, L 3-5, --, --, --, --, --, --, --, --, --, --, --, --, --, --, --, --, --
Calle Rosen, Healthy, StL, D, FA, Pit, W 4-2, --, --, --, --, --, --, --, --, --, --, --, --, --, --, --, --, --
Danila Yurov, Healthy, Min, RW, FA, Cls, L 4-5, --, --, --, --, --, --, --, --, --, --, --, --, --, --, --, --, --
Dysin Mayo, Healthy, Vgk, D, FA, @Chi, W 5-3, --, --, --, --, --, --, --, --, --, --, --, --, --, --, --, --, --
Anton Stralman, Healthy, Bos, D, FA, @LA, W 4-2, --, --, --, --, --, --, --, --, --, --, --, --, --, --, --, --, --
James Hamblin, Healthy, Edm, RW- C, FA, Wpg, L 2-3, --, --, --, --, --, --, --, --, --, --, --, --, --, --, --, --, --
Ryan Ellis, IR, Phi, D, FA, @Dal, L 4-5, --, --, --, --, --, --, --, --, --, --, --, --, --, --, --, --, --
Alex Galchenyuk, Healthy, Ari, LW, FA, Ana, W 2-1, --, --, --, --, --, --, --, --, --, --, --, --, --, --, --, --, --
Oskar Lindblom, IR, SJ, LW, FA, @Nsh, L 1-5, --, --, --, --, --, --, --, --, --, --, --, --, --, --, --, --, --
Riley Tufte, Healthy, Col, LW, FA, Car, W 6-4, --, --, --, --, --, --, --, --, --, --, --, --, --, --, --, --, --
Max Comtois, Healthy, Vgk, LW, FA, @Chi, W 5-3, --, --, --, --, --, --, --, --, --, --, --, --, --, --, --, --, --
Riley Stillman, Healthy, Buf, D, FA, NYI, W 3-1, --, --, --, --, --, --, --, --, --, --, --, --, --, --, --, --, --
Reilly Walsh, Healthy, Bos, D, FA, @LA, W 4-2, --, --, --, --, --, --, --, --, --, --, --, --, --, --, --, --, --
Igor Ozhiganov, Healthy, Tor, D, FA, @TB, W 4-3, --, --, --, --, --, --, --, --, --, --, --, --, --, --, --, --, --
Sean Farrell, Healthy, Mon, LW, FA, Wsh, W 3-2, --, --, --, --, --, --, --, --, --, --, --, --, --, --, --, --, --
Felix Unger Sorum, Healthy, Car, RW, FA, @Col, L 4-6, --, --, --, --, --, --, --, --, --, --, --, --, --, --, --, --, --
Gemel Smith, Healthy, TB, C, FA, Tor, L 3-4, --, --, --, --, --, --, --, --, --, --, --, --, --, --, --, --, --
Nick Holden, Healthy, Ott, D, FA, Det, L 2-5, --, --, --, --, --, --, --, --, --, --, --, --, --, --, --, --, --
Robert Hagg, Healthy, Ana, D, FA, @Ari, L 1-2, --, --, --, --, --, --, --, --, --, --, --, --, --, --, --, --, --
Liam Ohgren, Healthy, Min, LW, FA, Cls, L 4-5, --, --, --, --, --, --, --, --, --, --, --, --, --, --, --, --, --
Owen Pickering, Healthy, Pit, D, FA, @StL, L 2-4, --, --, --, --, --, --, --, --, --, --, --, --, --, --, --, --, --
Jason Spezza, Healthy, Tor, C, FA, @TB, W 4-3, --, --, --, --, --, --, --, --, --, --, --, --, --, --, --, --, --
Jordan Gross, Healthy, Nsh, D, FA, SJ, W 5-1, --, --, --, --, --, --, --, --, --, --, --, --, --, --, --, --, --
Nolan Patrick, Healthy, Vgk, C, FA, @Chi, W 5-3, --, --, --, --, --, --, --, --, --, --, --, --, --, --, --, --, --
Madison Bowey, Healthy, Mon, D, FA, Wsh, W 3-2, --, --, --, --, --, --, --, --, --, --, --, --, --, --, --, --, --
Kevan Miller, Healthy, Bos, D, FA, @LA, W 4-2, --, --, --, --, --, --, --, --, --, --, --, --, --, --, --, --, --
Tanner Molendyk, Healthy, Nsh, D, FA, SJ, W 5-1, --, --, --, --, --, --, --, --, --, --, --, --, --, --, --, --, --
Ryan Carpenter, Healthy, SJ, C, FA, @Nsh, L 1-5, --, --, --, --, --, --, --, --, --, --, --, --, --, --, --, --, --
Oskar Olausson, Healthy, Col, RW, FA, Car, W 6-4, --, --, --, --, --, --, --, --, --, --, --, --, --, --, --, --, --
Jakub Zboril, Healthy, Bos, D, FA, @LA, W 4-2, --, --, --, --, --, --, --, --, --, --, --, --, --, --, --, --, --
Anton Wahlberg, Healthy, Buf, C, FA, NYI, W 3-1, --, --, --, --, --, --, --, --, --, --, --, --, --, --, --, --, --
Filip Mesar, Healthy, Mon, RW- LW, FA, Wsh, W 3-2, --, --, --, --, --, --, --, --, --, --, --, --, --, --, --, --, --
Par Lindholm, Healthy, Bos, C, FA, @LA, W 4-2, --, --, --, --, --, --, --, --, --, --, --, --, --, --, --, --, --
Josiah Slavin, Healthy, Tor, LW, FA, @TB, W 4-3, --, --, --, --, --, --, --, --, --, --, --, --, --, --, --, --, --
Brad Hunt, Healthy, Col, D, FA, Car, W 6-4, --, --, --, --, --, --, --, --, --, --, --, --, --, --, --, --, --
Mikhail Gulyayev, Healthy, Col, D, FA, Car, W 6-4, --, --, --, --, --, --, --, --, --, --, --, --, --, --, --, --, --
Lian Bichsel, Healthy, Dal, D, FA, Phi, W 5-4, --, --, --, --, --, --, --, --, --, --, --, --, --, --, --, --, --
Axel Jonsson-Fjallby, Healthy, Wpg, LW, FA, @Edm, W 3-2, --, --, --, --, --, --, --, --, --, --, --, --, --, --, --, --, --
Devin Shore, Healthy, Sea, C, FA, NYR, L 1-4, --, --, --, --, --, --, --, --, --, --, --, --, --, --, --, --, --
Tyler Kleven, Healthy, Ott, D, FA, Det, L 2-5, --, --, --, --, --, --, --, --, --, --, --, --, --, --, --, --, --
Patric Hornqvist, Healthy, Fla, RW, FA, Van, L 3-5, --, --, --, --, --, --, --, --, --, --, --, --, --, --, --, --, --
Gavin Brindley, Healthy, Cls, C, FA, @Min, W 5-4, --, --, --, --, --, --, --, --, --, --, --, --, --, --, --, --, --
Sam Poulin, O, Pit, LW- C- RW, FA, @StL, L 2-4, --, --, --, --, --, --, --, --, --, --, --, --, --, --, --, --, --
Carl Hagelin, Healthy, Wsh, LW, FA, @Mon, L 2-3, --, --, --, --, --, --, --, --, --, --, --, --, --, --, --, --, --
