Kevan Miller, Healthy, Bos, D, FA, --, --, --, --, --, --, --, --, --, --, --, --, --, --, --, --, --, --, --
Ross Johnston, Healthy, Ana, LW, FA, --, --, --, --, --, --, --, --, --, --, --, --, --, --, --, --, --, --, --
Tanner Molendyk, Healthy, Nsh, D, FA, --, --, --, --, --, --, --, --, --, --, --, --, --, --, --, --, --, --, --
Ryan Carpenter, Healthy, SJ, C, FA, --, --, --, --, --, --, --, --, --, --, --, --, --, --, --, --, --, --, --
Oskar Olausson, Healthy, Col, RW, FA, --, --, --, --, --, --, --, --, --, --, --, --, --, --, --, --, --, --, --
Walker Duehr, Healthy, Cgy, RW, FA, --, --, --, --, --, --, --, --, --, --, --, --, --, --, --, --, --, --, --
Jakub Zboril, Healthy, Bos, D, FA, --, --, --, --, --, --, --, --, --, --, --, --, --, --, --, --, --, --, --
Uvis Balinskis, Healthy, Fla, D, FA, --, --, --, --, --, --, --, --, --, --, --, --, --, --, --, --, --, --, --
Samuel Bolduc, Healthy, NYI, D, FA, --, --, --, --, --, --, --, --, --, --, --, --, --, --, --, --, --, --, --
Anton Wahlberg, Healthy, Buf, C, FA, --, --, --, --, --, --, --, --, --, --, --, --, --, --, --, --, --, --, --
Par Lindholm, Healthy, Bos, C, FA, --, --, --, --, --, --, --, --, --, --, --, --, --, --, --, --, --, --, --
Josiah Slavin, Healthy, Tor, LW, FA, --, --, --, --, --, --, --, --, --, --, --, --, --, --, --, --, --, --, --
Brad Hunt, Healthy, Col, D, FA, --, --, --, --, --, --, --, --, --, --, --, --, --, --, --, --, --, --, --
Mikhail Gulyayev, Healthy, Col, D, FA, --, --, --, --, --, --, --, --, --, --, --, --, --, --, --, --, --, --, --
Lian Bichsel, Healthy, Dal, D, FA, --, --, --, --, --, --, --, --, --, --, --, --, --, --, --, --, --, --, --
Axel Jonsson-Fjallby, Healthy, Wpg, LW, FA, --, --, --, --, --, --, --, --, --, --, --, --, --, --, --, --, --, --, --
Devin Shore, Healthy, Sea, C, FA, --, --, --, --, --, --, --, --, --, --, --, --, --, --, --, --, --, --, --
Tyler Kleven, Healthy, Ott, D, FA, --, --, --, --, --, --, --, --, --, --, --, --, --, --, --, --, --, --, --
Patric Hornqvist, Healthy, Fla, RW, FA, --, --, --, --, --, --, --, --, --, --, --, --, --, --, --, --, --, --, --
Sam Poulin, O, Pit, LW- C- RW, FA, --, --, --, --, --, --, --, --, --, --, --, --, --, --, --, --, --, --, --
Grigori Denisenko, Healthy, Vgk, LW, FA, --, --, --, --, --, --, --, --, --, --, --, --, --, --, --, --, --, --, --
Matthew Kessel, Healthy, StL, D, FA, --, --, --, --, --, --, --, --, --, --, --, --, --, --, --, --, --, --, --
Daniil Miromanov, IR, Vgk, D, FA, --, --, --, --, --, --, --, --, --, --, --, --, --, --, --, --, --, --, --
Marc Del Gaizo, Healthy, Nsh, D, FA, --, --, --, --, --, --, --, --, --, --, --, --, --, --, --, --, --, --, --
Declan Chisholm, Healthy, Wpg, D, FA, --, --, --, --, --, --, --, --, --, --, --, --, --, --, --, --, --, --, --
Patrik Nemeth, Healthy, Ari, D, FA, --, --, --, --, --, --, --, --, --, --, --, --, --, --, --, --, --, --, --
Nick DeSimone, Healthy, Cgy, D, FA, --, --, --, --, --, --, --, --, --, --, --, --, --, --, --, --, --, --, --
Tucker Poolman, IR, Van, D, FA, --, --, --, --, --, --, --, --, --, --, --, --, --, --, --, --, --, --, --
Vitali Kravtsov, Healthy, Van, LW, FA, --, --, --, --, --, --, --, --, --, --, --, --, --, --, --, --, --, --, --
Zach Sanford, Healthy, Chi, LW, FA, --, --, --, --, --, --, --, --, --, --, --, --, --, --, --, --, --, --, --
Philippe Myers, Healthy, TB, D, FA, --, --, --, --, --, --, --, --, --, --, --, --, --, --, --, --, --, --, --
Bradly Nadeau, Healthy, Car, C, FA, --, --, --, --, --, --, --, --, --, --, --, --, --, --, --, --, --, --, --
Noah Ostlund, Healthy, Buf, C, FA, --, --, --, --, --, --, --, --, --, --, --, --, --, --, --, --, --, --, --
Rourke Chartier, IR, Ott, C, FA, --, --, --, --, --, --, --, --, --, --, --, --, --, --, --, --, --, --, --
Radim Simek, Healthy, SJ, D, FA, --, --, --, --, --, --, --, --, --, --, --, --, --, --, --, --, --, --, --
Nikolai Knyzhov, Healthy, SJ, D, FA, --, --, --, --, --, --, --, --, --, --, --, --, --, --, --, --, --, --, --
Bo Groulx, Healthy, Ana, C, FA, --, --, --, --, --, --, --, --, --, --, --, --, --, --, --, --, --, --, --
Gage Quinney, Healthy, Vgk, LW, FA, --, --, --, --, --, --, --, --, --, --, --, --, --, --, --, --, --, --, --
Zack Kassian, Healthy, Ari, RW, FA, --, --, --, --, --, --, --, --, --, --, --, --, --, --, --, --, --, --, --
Keith Yandle, Healthy, Phi, D, FA, --, --, --, --, --, --, --, --, --, --, --, --, --, --, --, --, --, --, --
Paul Stastny, Healthy, Car, C, FA, --, --, --, --, --, --, --, --, --, --, --, --, --, --, --, --, --, --, --
Brinson Pasichnuk, Healthy, SJ, D, FA, --, --, --, --, --, --, --, --, --, --, --, --, --, --, --, --, --, --, --
Akito Hirose, Healthy, Van, D, FA, --, --, --, --, --, --, --, --, --, --, --, --, --, --, --, --, --, --, --
Cale Fleury, Healthy, Sea, D, FA, --, --, --, --, --, --, --, --, --, --, --, --, --, --, --, --, --, --, --
Brock McGinn, Healthy, Ana, LW, FA, --, --, --, --, --, --, --, --, --, --, --, --, --, --, --, --, --, --, --
David Gustafsson, IR, Wpg, C, FA, --, --, --, --, --, --, --, --, --, --, --, --, --, --, --, --, --, --, --
Otto Stenberg, Healthy, StL, C, FA, --, --, --, --, --, --, --, --, --, --, --, --, --, --, --, --, --, --, --
Ryan Getzlaf, Healthy, Ana, C, FA, --, --, --, --, --, --, --, --, --, --, --, --, --, --, --, --, --, --, --
Andrew Poturalski, Healthy, Sea, C, FA, --, --, --, --, --, --, --, --, --, --, --, --, --, --, --, --, --, --, --
Justin Braun, Healthy, Phi, D, FA, --, --, --, --, --, --, --, --, --, --, --, --, --, --, --, --, --, --, --
Derick Brassard, O, Ott, C, FA, --, --, --, --, --, --, --, --, --, --, --, --, --, --, --, --, --, --, --
Darren Archibald, Healthy, Tor, LW, FA, --, --, --, --, --, --, --, --, --, --, --, --, --, --, --, --, --, --, --
Colin White, Healthy, Pit, C, FA, --, --, --, --, --, --, --, --, --, --, --, --, --, --, --, --, --, --, --
Josh Bailey, Healthy, Ott, LW, FA, --, --, --, --, --, --, --, --, --, --, --, --, --, --, --, --, --, --, --
Cole McWard, Healthy, Van, D, FA, --, --, --, --, --, --, --, --, --, --, --, --, --, --, --, --, --, --, --
Filip Roos, Healthy, Chi, D, FA, --, --, --, --, --, --, --, --, --, --, --, --, --, --, --, --, --, --, --
Jonas Rondbjerg, Healthy, Vgk, RW- LW, FA, --, --, --, --, --, --, --, --, --, --, --, --, --, --, --, --, --, --, --
Max Veronneau, Healthy, SJ, RW, FA, --, --, --, --, --, --, --, --, --, --, --, --, --, --, --, --, --, --, --
Mark Jankowski, Healthy, Nsh, C, FA, --, --, --, --, --, --, --, --, --, --, --, --, --, --, --, --, --, --, --
Adam Beckman, Healthy, Min, C, FA, --, --, --, --, --, --, --, --, --, --, --, --, --, --, --, --, --, --, --
Vinni Lettieri, Healthy, Min, C, FA, --, --, --, --, --, --, --, --, --, --, --, --, --, --, --, --, --, --, --
Kale Clague, Healthy, Buf, D, FA, --, --, --, --, --, --, --, --, --, --, --, --, --, --, --, --, --, --, --
Connor Bunnaman, Healthy, Fla, LW, FA, --, --, --, --, --, --, --, --, --, --, --, --, --, --, --, --, --, --, --
Gracyn Sawchyn, Healthy, Fla, C, FA, --, --, --, --, --, --, --, --, --, --, --, --, --, --, --, --, --, --, --
Isaac Howard, Healthy, TB, LW, FA, --, --, --, --, --, --, --, --, --, --, --, --, --, --, --, --, --, --, --
Mackenzie MacEachern, Healthy, StL, LW, FA, --, --, --, --, --, --, --, --, --, --, --, --, --, --, --, --, --, --, --
Alex Chiasson, Healthy, Bos, RW, FA, --, --, --, --, --, --, --, --, --, --, --, --, --, --, --, --, --, --, --
Connor Carrick, Healthy, Sea, D, FA, --, --, --, --, --, --, --, --, --, --, --, --, --, --, --, --, --, --, --
Lukas Dragicevic, Healthy, Sea, D, FA, --, --, --, --, --, --, --, --, --, --, --, --, --, --, --, --, --, --, --
Vladislav Kolyachonok, IR, Ari, D, FA, --, --, --, --, --, --, --, --, --, --, --, --, --, --, --, --, --, --, --
Scott Harrington, Healthy, Ana, D, FA, --, --, --, --, --, --, --, --, --, --, --, --, --, --, --, --, --, --, --
Carey Terrance, Healthy, Ana, C, FA, --, --, --, --, --, --, --, --, --, --, --, --, --, --, --, --, --, --, --
Jacob Bryson, Healthy, Buf, D, FA, --, --, --, --, --, --, --, --, --, --, --, --, --, --, --, --, --, --, --
Jack Rathbone, Healthy, Pit, D, FA, --, --, --, --, --, --, --, --, --, --, --, --, --, --, --, --, --, --, --
Cole Koepke, Healthy, TB, LW, FA, --, --, --, --, --, --, --, --, --, --, --, --, --, --, --, --, --, --, --
Marc McLaughlin, Healthy, Bos, C, FA, --, --, --, --, --, --, --, --, --, --, --, --, --, --, --, --, --, --, --
Isak Rosen, Healthy, Buf, LW- RW, FA, --, --, --, --, --, --, --, --, --, --, --, --, --, --, --, --, --, --, --
Danny Nelson, Healthy, NYI, C, FA, --, --, --, --, --, --, --, --, --, --, --, --, --, --, --, --, --, --, --
Liam Foudy, Healthy, Nsh, RW- C- LW, FA, --, --, --, --, --, --, --, --, --, --, --, --, --, --, --, --, --, --, --
Louis Crevier, Healthy, Chi, D, FA, --, --, --, --, --, --, --, --, --, --, --, --, --, --, --, --, --, --, --
Ryan Murray, O, Edm, D, FA, --, --, --, --, --, --, --, --, --, --, --, --, --, --, --, --, --, --, --
Jason Demers, Healthy, Edm, D, FA, --, --, --, --, --, --, --, --, --, --, --, --, --, --, --, --, --, --, --
Sam Rinzel, Healthy, Chi, D, FA, --, --, --, --, --, --, --, --, --, --, --, --, --, --, --, --, --, --, --
Slater Koekkoek, Healthy, Edm, D, FA, --, --, --, --, --, --, --, --, --, --, --, --, --, --, --, --, --, --, --
Andrej Sekera, Healthy, Dal, D, FA, --, --, --, --, --, --, --, --, --, --, --, --, --, --, --, --, --, --, --
Darren Helm, Healthy, Col, C, FA, --, --, --, --, --, --, --, --, --, --, --, --, --, --, --, --, --, --, --
Calum Ritchie, Healthy, Col, C, FA, --, --, --, --, --, --, --, --, --, --, --, --, --, --, --, --, --, --, --
Carson Rehkopf, Healthy, Sea, LW, FA, --, --, --, --, --, --, --, --, --, --, --, --, --, --, --, --, --, --, --
Mason Shaw, O, Min, C, FA, --, --, --, --, --, --, --, --, --, --, --, --, --, --, --, --, --, --, --
Denis Malgin, Healthy, Col, C- RW, FA, --, --, --, --, --, --, --, --, --, --, --, --, --, --, --, --, --, --, --
Raphael Lavoie, Healthy, Edm, C, FA, --, --, --, --, --, --, --, --, --, --, --, --, --, --, --, --, --, --, --
Brett Seney, Healthy, Chi, LW, FA, --, --, --, --, --, --, --, --, --, --, --, --, --, --, --, --, --, --, --
Nic Petan, Healthy, Min, C, FA, --, --, --, --, --, --, --, --, --, --, --, --, --, --, --, --, --, --, --
Jacob Perreault, Healthy, Ana, RW, FA, --, --, --, --, --, --, --, --, --, --, --, --, --, --, --, --, --, --, --
Victor Mete, Healthy, Phi, D, FA, --, --, --, --, --, --, --, --, --, --, --, --, --, --, --, --, --, --, --
Jackson Cates, Healthy, Phi, C, FA, --, --, --, --, --, --, --, --, --, --, --, --, --, --, --, --, --, --, --
Curtis Valk, Healthy, Fla, C, FA, --, --, --, --, --, --, --, --, --, --, --, --, --, --, --, --, --, --, --
Brett Murray, Healthy, Buf, LW, FA, --, --, --, --, --, --, --, --, --, --, --, --, --, --, --, --, --, --, --
Alexander True, Healthy, Fla, C, FA, --, --, --, --, --, --, --, --, --, --, --, --, --, --, --, --, --, --, --
Maveric Lamoureux, Healthy, Ari, D, FA, --, --, --, --, --, --, --, --, --, --, --, --, --, --, --, --, --, --, --
Jan Jenik, Healthy, Ari, C, FA, --, --, --, --, --, --, --, --, --, --, --, --, --, --, --, --, --, --, --
Dryden Hunt, Healthy, Cgy, LW, FA, --, --, --, --, --, --, --, --, --, --, --, --, --, --, --, --, --, --, --
Greg McKegg, Healthy, Edm, C, FA, --, --, --, --, --, --, --, --, --, --, --, --, --, --, --, --, --, --, --
"Zachary LHeureux", Healthy, Nsh, LW, FA, --, --, --, --, --, --, --, --, --, --, --, --, --, --, --, --, --, --, --
Sampo Ranta, Healthy, Col, LW, FA, --, --, --, --, --, --, --, --, --, --, --, --, --, --, --, --, --, --, --
Jeffrey Viel, Healthy, Wpg, LW, FA, --, --, --, --, --, --, --, --, --, --, --, --, --, --, --, --, --, --, --
Derek Grant, Healthy, Ana, C- LW, FA, --, --, --, --, --, --, --, --, --, --, --, --, --, --, --, --, --, --, --
Ronnie Attard, Healthy, Phi, D, FA, --, --, --, --, --, --, --, --, --, --, --, --, --, --, --, --, --, --, --
William Dufour, Healthy, NYI, RW, FA, --, --, --, --, --, --, --, --, --, --, --, --, --, --, --, --, --, --, --
Derek Stepan, Healthy, Car, C, FA, --, --, --, --, --, --, --, --, --, --, --, --, --, --, --, --, --, --, --
Waltteri Merela, Healthy, TB, RW, FA, --, --, --, --, --, --, --, --, --, --, --, --, --, --, --, --, --, --, --
Logan Brown, IR, TB, C, FA, --, --, --, --, --, --, --, --, --, --, --, --, --, --, --, --, --, --, --
Rudolfs Balcers, Healthy, TB, LW, FA, --, --, --, --, --, --, --, --, --, --, --, --, --, --, --, --, --, --, --
Dylan Gambrell, Healthy, Tor, C, FA, --, --, --, --, --, --, --, --, --, --, --, --, --, --, --, --, --, --, --
Ilya Solovyov, Healthy, Cgy, D, FA, --, --, --, --, --, --, --, --, --, --, --, --, --, --, --, --, --, --, --
Mark Borowiecki, Healthy, Nsh, D, FA, --, --, --, --, --, --, --, --, --, --, --, --, --, --, --, --, --, --, --
Matt Irwin, Healthy, Van, D, FA, --, --, --, --, --, --, --, --, --, --, --, --, --, --, --, --, --, --, --
Markus Nutivaara, Healthy, SJ, D, FA, --, --, --, --, --, --, --, --, --, --, --, --, --, --, --, --, --, --, --
Mason Geertsen, Healthy, Vgk, D, FA, --, --, --, --, --, --, --, --, --, --, --, --, --, --, --, --, --, --, --
Martin Frk, Healthy, StL, RW, FA, --, --, --, --, --, --, --, --, --, --, --, --, --, --, --, --, --, --, --
Nikita Nesterenko, Healthy, Ana, LW, FA, --, --, --, --, --, --, --, --, --, --, --, --, --, --, --, --, --, --, --
Milos Kelemen, Healthy, Ari, LW, FA, --, --, --, --, --, --, --, --, --, --, --, --, --, --, --, --, --, --, --
Riley Heidt, Healthy, Min, C, FA, --, --, --, --, --, --, --, --, --, --, --, --, --, --, --, --, --, --, --
Filip Bystedt, Healthy, SJ, C, FA, --, --, --, --, --, --, --, --, --, --, --, --, --, --, --, --, --, --, --
Andrew Ladd, Healthy, Ari, LW, FA, --, --, --, --, --, --, --, --, --, --, --, --, --, --, --, --, --, --, --
Thomas Hickey, Healthy, NJ, D, FA, --, --, --, --, --, --, --, --, --, --, --, --, --, --, --, --, --, --, --
Lucas Carlsson, Healthy, Fla, D, FA, --, --, --, --, --, --, --, --, --, --, --, --, --, --, --, --, --, --, --
Emil Andrae, Healthy, Phi, D, FA, --, --, --, --, --, --, --, --, --, --, --, --, --, --, --, --, --, --, --
Zac Dalpe, Healthy, Fla, RW- C, FA, --, --, --, --, --, --, --, --, --, --, --, --, --, --, --, --, --, --, --
William Lockwood, Healthy, Fla, RW, FA, --, --, --, --, --, --, --, --, --, --, --, --, --, --, --, --, --, --, --
Vasily Ponomarev, Healthy, Car, C, FA, --, --, --, --, --, --, --, --, --, --, --, --, --, --, --, --, --, --, --
Cam Dineen, Healthy, Edm, D, FA, --, --, --, --, --, --, --, --, --, --, --, --, --, --, --, --, --, --, --
Markus Niemelainen, Healthy, Edm, D, FA, --, --, --, --, --, --, --, --, --, --, --, --, --, --, --, --, --, --, --
Tristan Bertucci, Healthy, Dal, D, FA, --, --, --, --, --, --, --, --, --, --, --, --, --, --, --, --, --, --, --
Michael Del Zotto, Healthy, Ana, D, FA, --, --, --, --, --, --, --, --, --, --, --, --, --, --, --, --, --, --, --
Guillaume Brisebois, IR, Van, D, FA, --, --, --, --, --, --, --, --, --, --, --, --, --, --, --, --, --, --, --
Gavin Bayreuther, Healthy, Dal, D, FA, --, --, --, --, --, --, --, --, --, --, --, --, --, --, --, --, --, --, --
Cody McLeod, Healthy, Nsh, LW, FA, --, --, --, --, --, --, --, --, --, --, --, --, --, --, --, --, --, --, --
Nick Swaney, Healthy, Min, RW, FA, --, --, --, --, --, --, --, --, --, --, --, --, --, --, --, --, --, --, --
Nathan Smith, Healthy, Ari, LW, FA, --, --, --, --, --, --, --, --, --, --, --, --, --, --, --, --, --, --, --
Marian Studenic, Healthy, Sea, RW, FA, --, --, --, --, --, --, --, --, --, --, --, --, --, --, --, --, --, --, --
Scott Reedy, Healthy, Dal, C, FA, --, --, --, --, --, --, --, --, --, --, --, --, --, --, --, --, --, --, --
Brayden Tracey, Healthy, Ana, LW, FA, --, --, --, --, --, --, --, --, --, --, --, --, --, --, --, --, --, --, --
Max McCormick, Healthy, Sea, LW, FA, --, --, --, --, --, --, --, --, --, --, --, --, --, --, --, --, --, --, --
Egor Afanasyev, Healthy, Nsh, LW, FA, --, --, --, --, --, --, --, --, --, --, --, --, --, --, --, --, --, --, --
Adam Gaudette, Healthy, StL, C, FA, --, --, --, --, --, --, --, --, --, --, --, --, --, --, --, --, --, --, --
CJ Suess, Healthy, SJ, LW, FA, --, --, --, --, --, --, --, --, --, --, --, --, --, --, --, --, --, --, --
Libor Hajek, Healthy, Pit, D, FA, --, --, --, --, --, --, --, --, --, --, --, --, --, --, --, --, --, --, --
Dylan Coghlan, Healthy, Car, D, FA, --, --, --, --, --, --, --, --, --, --, --, --, --, --, --, --, --, --, --
Dan Girardi, Healthy, TB, D, FA, --, --, --, --, --, --, --, --, --, --, --, --, --, --, --, --, --, --, --
Mitchell Chaffee, Healthy, TB, RW, FA, --, --, --, --, --, --, --, --, --, --, --, --, --, --, --, --, --, --, --
Georgii Merkulov, Healthy, Bos, C, FA, --, --, --, --, --, --, --, --, --, --, --, --, --, --, --, --, --, --, --
Egor Sokolov, Healthy, Ott, LW, FA, --, --, --, --, --, --, --, --, --, --, --, --, --, --, --, --, --, --, --
Lukas Rousek, Healthy, Buf, RW- LW, FA, --, --, --, --, --, --, --, --, --, --, --, --, --, --, --, --, --, --, --
Matthew Highmore, Healthy, Ott, C, FA, --, --, --, --, --, --, --, --, --, --, --, --, --, --, --, --, --, --, --
Daemon Hunt, Healthy, Min, D, FA, --, --, --, --, --, --, --, --, --, --, --, --, --, --, --, --, --, --, --
Beau Akey, Healthy, Edm, D, FA, --, --, --, --, --, --, --, --, --, --, --, --, --, --, --, --, --, --, --
Olli Juolevi, Healthy, Ari, D, FA, --, --, --, --, --, --, --, --, --, --, --, --, --, --, --, --, --, --, --
Derrick Pouliot, Healthy, Dal, D, FA, --, --, --, --, --, --, --, --, --, --, --, --, --, --, --, --, --, --, --
Kris Russell, Healthy, Edm, D, FA, --, --, --, --, --, --, --, --, --, --, --, --, --, --, --, --, --, --, --
Jean-Luc Foudy, Healthy, Col, RW- C, FA, --, --, --, --, --, --, --, --, --, --, --, --, --, --, --, --, --, --, --
John Leonard, Healthy, Ari, LW, FA, --, --, --, --, --, --, --, --, --, --, --, --, --, --, --, --, --, --, --
Pavol Regenda, Healthy, Ana, C, FA, --, --, --, --, --, --, --, --, --, --, --, --, --, --, --, --, --, --, --
Jonathan Dahlen, Healthy, SJ, RW, FA, --, --, --, --, --, --, --, --, --, --, --, --, --, --, --, --, --, --, --
Joonas Donskoi, Healthy, Sea, RW, FA, --, --, --, --, --, --, --, --, --, --, --, --, --, --, --, --, --, --, --
Anders Bjork, Healthy, Chi, LW, FA, --, --, --, --, --, --, --, --, --, --, --, --, --, --, --, --, --, --, --
Hugh McGing, Healthy, StL, C- LW, FA, --, --, --, --, --, --, --, --, --, --, --, --, --, --, --, --, --, --, --
Chris Kunitz, Healthy, Chi, LW, FA, --, --, --, --, --, --, --, --, --, --, --, --, --, --, --, --, --, --, --
Drake Caggiula, Healthy, Edm, LW, FA, --, --, --, --, --, --, --, --, --, --, --, --, --, --, --, --, --, --, --
Aidan McDonough, Healthy, Van, LW, FA, --, --, --, --, --, --, --, --, --, --, --, --, --, --, --, --, --, --, --
Alexander Radulov, Healthy, Dal, RW, FA, --, --, --, --, --, --, --, --, --, --, --, --, --, --, --, --, --, --, --
Zachary Hayes, Healthy, NJ, D, FA, --, --, --, --, --, --, --, --, --, --, --, --, --, --, --, --, --, --, --
Sean Day, Healthy, TB, D, FA, --, --, --, --, --, --, --, --, --, --, --, --, --, --, --, --, --, --, --
Jacob Larsson, Healthy, Ott, D, FA, --, --, --, --, --, --, --, --, --, --, --, --, --, --, --, --, --, --, --
Paul Postma, Healthy, Bos, D, FA, --, --, --, --, --, --, --, --, --, --, --, --, --, --, --, --, --, --, --
Nathan Beaulieu, Healthy, Car, D, FA, --, --, --, --, --, --, --, --, --, --, --, --, --, --, --, --, --, --, --
Brian Boyle, Healthy, Pit, C, FA, --, --, --, --, --, --, --, --, --, --, --, --, --, --, --, --, --, --, --
Justin Sourdif, Healthy, Fla, RW- C, FA, --, --, --, --, --, --, --, --, --, --, --, --, --, --, --, --, --, --, --
Ethan Gauthier, Healthy, TB, RW, FA, --, --, --, --, --, --, --, --, --, --, --, --, --, --, --, --, --, --, --
Alex Burrows, Healthy, Ott, RW, FA, --, --, --, --, --, --, --, --, --, --, --, --, --, --, --, --, --, --, --
Trevor Carrick, Healthy, Ana, D, FA, --, --, --, --, --, --, --, --, --, --, --, --, --, --, --, --, --, --, --
John Moore, Healthy, Ana, D, FA, --, --, --, --, --, --, --, --, --, --, --, --, --, --, --, --, --, --, --
Ryan Merkley, Healthy, Col, D, FA, --, --, --, --, --, --, --, --, --, --, --, --, --, --, --, --, --, --, --
Kyle Capobianco, Healthy, Wpg, D, FA, --, --, --, --, --, --, --, --, --, --, --, --, --, --, --, --, --, --, --
Ryan Winterton, Healthy, Sea, C, FA, --, --, --, --, --, --, --, --, --, --, --, --, --, --, --, --, --, --, --
Linus Karlsson, Healthy, Van, C- RW, FA, --, --, --, --, --, --, --, --, --, --, --, --, --, --, --, --, --, --, --
Nico Myatovic, Healthy, Ana, LW, FA, --, --, --, --, --, --, --, --, --, --, --, --, --, --, --, --, --, --, --
Martin Misiak, Healthy, Chi, RW, FA, --, --, --, --, --, --, --, --, --, --, --, --, --, --, --, --, --, --, --
Reid Schaefer, Healthy, Nsh, LW, FA, --, --, --, --, --, --, --, --, --, --, --, --, --, --, --, --, --, --, --
Andrew Agozzino, Healthy, Ana, LW, FA, --, --, --, --, --, --, --, --, --, --, --, --, --, --, --, --, --, --, --
Austin Poganski, Healthy, Ari, RW, FA, --, --, --, --, --, --, --, --, --, --, --, --, --, --, --, --, --, --, --
Brett Connolly, Healthy, Chi, RW, FA, --, --, --, --, --, --, --, --, --, --, --, --, --, --, --, --, --, --, --
Josh Leivo, Healthy, StL, LW, FA, --, --, --, --, --, --, --, --, --, --, --, --, --, --, --, --, --, --, --
Kole Lind, Healthy, Sea, RW, FA, --, --, --, --, --, --, --, --, --, --, --, --, --, --, --, --, --, --, --
Loui Eriksson, Healthy, Ari, LW, FA, --, --, --, --, --, --, --, --, --, --, --, --, --, --, --, --, --, --, --
Maxime Lajoie, Healthy, Tor, D, FA, --, --, --, --, --, --, --, --, --, --, --, --, --, --, --, --, --, --, --
Grant Hutton, Healthy, NYI, D, FA, --, --, --, --, --, --, --, --, --, --, --, --, --, --, --, --, --, --, --
Petteri Lindbohm, Healthy, Fla, D, FA, --, --, --, --, --, --, --, --, --, --, --, --, --, --, --, --, --, --, --
Joey Keane, Healthy, Car, D, FA, --, --, --, --, --, --, --, --, --, --, --, --, --, --, --, --, --, --, --
Will Butcher, Healthy, Pit, D, FA, --, --, --, --, --, --, --, --, --, --, --, --, --, --, --, --, --, --, --
Andy Greene, Healthy, NYI, D, FA, --, --, --, --, --, --, --, --, --, --, --, --, --, --, --, --, --, --, --
Lane Pederson, Healthy, Edm, C, FA, --, --, --, --, --, --, --, --, --, --, --, --, --, --, --, --, --, --, --
Frederik Tiffels, Healthy, Pit, LW, FA, --, --, --, --, --, --, --, --, --, --, --, --, --, --, --, --, --, --, --
Antoine Roussel, Healthy, Phi, LW, FA, --, --, --, --, --, --, --, --, --, --, --, --, --, --, --, --, --, --, --
Anthony Richard, Healthy, Bos, C, FA, --, --, --, --, --, --, --, --, --, --, --, --, --, --, --, --, --, --, --
Kieffer Bellows, Healthy, Car, LW, FA, --, --, --, --, --, --, --, --, --, --, --, --, --, --, --, --, --, --, --
Jack Ahcan, Healthy, Col, D, FA, --, --, --, --, --, --, --, --, --, --, --, --, --, --, --, --, --, --, --
Ben Lovejoy, Healthy, Dal, D, FA, --, --, --, --, --, --, --, --, --, --, --, --, --, --, --, --, --, --, --
Kristians Rubins, Healthy, Cgy, D, FA, --, --, --, --, --, --, --, --, --, --, --, --, --, --, --, --, --, --, --
Andrei Mironov, Healthy, Col, D, FA, --, --, --, --, --, --, --, --, --, --, --, --, --, --, --, --, --, --, --
Andrej Sustr, Healthy, Ana, D, FA, --, --, --, --, --, --, --, --, --, --, --, --, --, --, --, --, --, --, --
Drew Helleson, Healthy, Ana, D, FA, --, --, --, --, --, --, --, --, --, --, --, --, --, --, --, --, --, --, --
Spencer Stastney, Healthy, Nsh, D, FA, --, --, --, --, --, --, --, --, --, --, --, --, --, --, --, --, --, --, --
Corey Schueneman, Healthy, Col, D, FA, --, --, --, --, --, --, --, --, --, --, --, --, --, --, --, --, --, --, --
Patrick Russell, Healthy, Edm, RW, FA, --, --, --, --, --, --, --, --, --, --, --, --, --, --, --, --, --, --, --
Matej Blumel, Healthy, Dal, LW, FA, --, --, --, --, --, --, --, --, --, --, --, --, --, --, --, --, --, --, --
Andreas Martinsen, Healthy, Ana, LW, FA, --, --, --, --, --, --, --, --, --, --, --, --, --, --, --, --, --, --, --
Oscar Fisker Molgaard, Healthy, Sea, C, FA, --, --, --, --, --, --, --, --, --, --, --, --, --, --, --, --, --, --, --
Roman Kantserov, Healthy, Chi, RW, FA, --, --, --, --, --, --, --, --, --, --, --, --, --, --, --, --, --, --, --
Brad Malone, Healthy, Edm, LW, FA, --, --, --, --, --, --, --, --, --, --, --, --, --, --, --, --, --, --, --
Tyler Bozak, Healthy, StL, C, FA, --, --, --, --, --, --, --, --, --, --, --, --, --, --, --, --, --, --, --
Fredrik Karlstrom, Healthy, Dal, C, FA, --, --, --, --, --, --, --, --, --, --, --, --, --, --, --, --, --, --, --
Matthew Peca, Healthy, StL, LW, FA, --, --, --, --, --, --, --, --, --, --, --, --, --, --, --, --, --, --, --
Zack Mitchell, Healthy, Min, RW, FA, --, --, --, --, --, --, --, --, --, --, --, --, --, --, --, --, --, --, --
Michael Raffl, Healthy, Dal, LW, FA, --, --, --, --, --, --, --, --, --, --, --, --, --, --, --, --, --, --, --
Isaac Ratcliffe, Healthy, StL, LW, FA, --, --, --, --, --, --, --, --, --, --, --, --, --, --, --, --, --, --, --
John Hayden, Healthy, Sea, RW, FA, --, --, --, --, --, --, --, --, --, --, --, --, --, --, --, --, --, --, --
Jacob Lucchini, Healthy, Min, LW, FA, --, --, --, --, --, --, --, --, --, --, --, --, --, --, --, --, --, --, --
Saku Maenalanen, Healthy, Wpg, RW, FA, --, --, --, --, --, --, --, --, --, --, --, --, --, --, --, --, --, --, --
Brennan Menell, Healthy, Tor, D, FA, --, --, --, --, --, --, --, --, --, --, --, --, --, --, --, --, --, --, --
Casey Nelson, Healthy, Buf, D, FA, --, --, --, --, --, --, --, --, --, --, --, --, --, --, --, --, --, --, --
David Schlemko, Healthy, Phi, D, FA, --, --, --, --, --, --, --, --, --, --, --, --, --, --, --, --, --, --, --
Maxim Strbak, Healthy, Buf, D, FA, --, --, --, --, --, --, --, --, --, --, --, --, --, --, --, --, --, --, --
