Evan Rodrigues, Healthy, Fla, C, FA, --, --, --, --, --, --, --, --, --, --, --, --, --, --, --, --, --, --, --
Nick Seeler, Healthy, Phi, D, BOWS, --, --, --, --, --, --, --, --, --, --, --, --, --, --, --, --, --, --, --
Jonathan Drouin, Healthy, Col, LW, FA, --, --, --, --, --, --, --, --, --, --, --, --, --, --, --, --, --, --, --
Pavel Mintyukov, IR, Ana, D, HERB, --, --, --, --, --, --, --, --, --, --, --, --, --, --, --, --, --, --, --
Colton Sissons, Healthy, Nsh, C, FA, --, --, --, --, --, --, --, --, --, --, --, --, --, --, --, --, --, --, --
Anders Lee, Healthy, NYI, LW- C, FA, --, --, --, --, --, --, --, --, --, --, --, --, --, --, --, --, --, --, --
Torey Krug, Healthy, StL, D, FA, --, --, --, --, --, --, --, --, --, --, --, --, --, --, --, --, --, --, --
Taylor Hall, IR, Chi, LW, FA, --, --, --, --, --, --, --, --, --, --, --, --, --, --, --, --, --, --, --
Leo Carlsson, IR, Ana, C, SALT, --, --, --, --, --, --, --, --, --, --, --, --, --, --, --, --, --, --, --
Brenden Dillon, Healthy, Wpg, D, CLB, --, --, --, --, --, --, --, --, --, --, --, --, --, --, --, --, --, --, --
Alexandre Carrier, Healthy, Nsh, D, HERB, --, --, --, --, --, --, --, --, --, --, --, --, --, --, --, --, --, --, --
Adam Henrique, Healthy, Ana, LW- C, FA, --, --, --, --, --, --, --, --, --, --, --, --, --, --, --, --, --, --, --
Sean Walker, Healthy, Phi, D, FA, --, --, --, --, --, --, --, --, --, --, --, --, --, --, --, --, --, --, --
Andrew Mangiapane, Healthy, Cgy, RW- LW, FA, --, --, --, --, --, --, --, --, --, --, --, --, --, --, --, --, --, --, --
Timothy Liljegren, Healthy, Tor, D, FA, --, --, --, --, --, --, --, --, --, --, --, --, --, --, --, --, --, --, --
Brayden Schenn, Healthy, StL, C, FA, --, --, --, --, --, --, --, --, --, --, --, --, --, --, --, --, --, --, --
Pavel Dorofeyev, Healthy, Vgk, RW, FA, --, --, --, --, --, --, --, --, --, --, --, --, --, --, --, --, --, --, --
Jonas Brodin, IR, Min, D, FA, --, --, --, --, --, --, --, --, --, --, --, --, --, --, --, --, --, --, --
Reilly Smith, O, Pit, RW, FA, --, --, --, --, --, --, --, --, --, --, --, --, --, --, --, --, --, --, --
Jason Dickinson, Healthy, Chi, C, FA, --, --, --, --, --, --, --, --, --, --, --, --, --, --, --, --, --, --, --
Dylan DeMelo, Healthy, Wpg, D, LKR, --, --, --, --, --, --, --, --, --, --, --, --, --, --, --, --, --, --, --
Kevin Shattenkirk, Healthy, Bos, D, FA, --, --, --, --, --, --, --, --, --, --, --, --, --, --, --, --, --, --, --
Cam York, Healthy, Phi, D, FA, --, --, --, --, --, --, --, --, --, --, --, --, --, --, --, --, --, --, --
Erik Haula, Healthy, NJ, LW, FA, --, --, --, --, --, --, --, --, --, --, --, --, --, --, --, --, --, --, --
Marco Rossi, Healthy, Min, C, FA, --, --, --, --, --, --, --, --, --, --, --, --, --, --, --, --, --, --, --
Luke Evangelista, Healthy, Nsh, RW, FA, --, --, --, --, --, --, --, --, --, --, --, --, --, --, --, --, --, --, --
Scott Laughton, Healthy, Phi, C- LW- RW, FA, --, --, --, --, --, --, --, --, --, --, --, --, --, --, --, --, --, --, --
James van Riemsdyk, Healthy, Bos, LW, FA, --, --, --, --, --, --, --, --, --, --, --, --, --, --, --, --, --, --, --
Ryan McDonagh, Healthy, Nsh, D, FA, --, --, --, --, --, --, --, --, --, --, --, --, --, --, --, --, --, --, --
Niko Mikkola, Healthy, Fla, D, FA, --, --, --, --, --, --, --, --, --, --, --, --, --, --, --, --, --, --, --
Scott Mayfield, Healthy, NYI, D, FA, --, --, --, --, --, --, --, --, --, --, --, --, --, --, --, --, --, --, --
Dominik Kubalik, Healthy, Ott, LW, FA, --, --, --, --, --, --, --, --, --, --, --, --, --, --, --, --, --, --, --
Mark Giordano, Healthy, Tor, D, FA, --, --, --, --, --, --, --, --, --, --, --, --, --, --, --, --, --, --, --
Mattias Samuelsson, Healthy, Buf, D, FA, --, --, --, --, --, --, --, --, --, --, --, --, --, --, --, --, --, --, --
Chris Tanev, Healthy, Cgy, D, FA, --, --, --, --, --, --, --, --, --, --, --, --, --, --, --, --, --, --, --
Dakota Joshua, Healthy, Van, C, BOWS, --, --, --, --, --, --, --, --, --, --, --, --, --, --, --, --, --, --, --
Jani Hakanpaa, Healthy, Dal, D, FA, --, --, --, --, --, --, --, --, --, --, --, --, --, --, --, --, --, --, --
Trent Frederic, Healthy, Bos, LW- C- RW, FA, --, --, --, --, --, --, --, --, --, --, --, --, --, --, --, --, --, --, --
Jonas Siegenthaler, Healthy, NJ, D, FA, --, --, --, --, --, --, --, --, --, --, --, --, --, --, --, --, --, --, --
Kyle Palmieri, Healthy, NYI, RW- LW, FA, --, --, --, --, --, --, --, --, --, --, --, --, --, --, --, --, --, --, --
Josh Manson, DTD, Col, D, FA, --, --, --, --, --, --, --, --, --, --, --, --, --, --, --, --, --, --, --
Tanner Jeannot, IR, TB, RW- LW, FA, --, --, --, --, --, --, --, --, --, --, --, --, --, --, --, --, --, --, --
Simon Nemec, Healthy, NJ, D, SALT, --, --, --, --, --, --, --, --, --, --, --, --, --, --, --, --, --, --, --
Morgan Geekie, Healthy, Bos, C, FA, --, --, --, --, --, --, --, --, --, --, --, --, --, --, --, --, --, --, --
Ryan Johansen, Healthy, Col, C, FA, --, --, --, --, --, --, --, --, --, --, --, --, --, --, --, --, --, --, --
Mathieu Joseph, Healthy, Ott, LW- RW, LKR, --, --, --, --, --, --, --, --, --, --, --, --, --, --, --, --, --, --, --
Anthony Duclair, Healthy, SJ, LW, FA, --, --, --, --, --, --, --, --, --, --, --, --, --, --, --, --, --, --, --
Mikael Backlund, Healthy, Cgy, C, FA, --, --, --, --, --, --, --, --, --, --, --, --, --, --, --, --, --, --, --
Nick Bjugstad, Healthy, Ari, C, FA, --, --, --, --, --, --, --, --, --, --, --, --, --, --, --, --, --, --, --
Adam Lowry, Healthy, Wpg, C, FA, --, --, --, --, --, --, --, --, --, --, --, --, --, --, --, --, --, --, --
J.J. Moser, Healthy, Ari, D, FA, --, --, --, --, --, --, --, --, --, --, --, --, --, --, --, --, --, --, --
Philipp Kurashev, Healthy, Chi, LW, FA, --, --, --, --, --, --, --, --, --, --, --, --, --, --, --, --, --, --, --
Jeremy Lauzon, Healthy, Nsh, D, CLB, --, --, --, --, --, --, --, --, --, --, --, --, --, --, --, --, --, --, --
Artem Zub, Healthy, Ott, D, FA, --, --, --, --, --, --, --, --, --, --, --, --, --, --, --, --, --, --, --
Alex Iafallo, Healthy, Wpg, LW, FA, --, --, --, --, --, --, --, --, --, --, --, --, --, --, --, --, --, --, --
Jean-Gabriel Pageau, Healthy, NYI, C, FA, --, --, --, --, --, --, --, --, --, --, --, --, --, --, --, --, --, --, --
Dylan Guenther, Healthy, Ari, RW, FA, --, --, --, --, --, --, --, --, --, --, --, --, --, --, --, --, --, --, --
Rasmus Ristolainen, Healthy, Phi, D, FA, --, --, --, --, --, --, --, --, --, --, --, --, --, --, --, --, --, --, --
Anthony Cirelli, Healthy, TB, C, FA, --, --, --, --, --, --, --, --, --, --, --, --, --, --, --, --, --, --, --
Ryan Pulock, IR, NYI, D, FA, --, --, --, --, --, --, --, --, --, --, --, --, --, --, --, --, --, --, --
Shane Wright, Healthy, Sea, C, FA, --, --, --, --, --, --, --, --, --, --, --, --, --, --, --, --, --, --, --
Eetu Luostarinen, Healthy, Fla, LW- C, FA, --, --, --, --, --, --, --, --, --, --, --, --, --, --, --, --, --, --, --
Barrett Hayton, IR, Ari, C, FA, --, --, --, --, --, --, --, --, --, --, --, --, --, --, --, --, --, --, --
William Eklund, Healthy, SJ, LW- C, FA, --, --, --, --, --, --, --, --, --, --, --, --, --, --, --, --, --, --, --
Fabian Zetterlund, Healthy, SJ, RW- LW, FA, --, --, --, --, --, --, --, --, --, --, --, --, --, --, --, --, --, --, --
Brandon Carlo, IR, Bos, D, FA, --, --, --, --, --, --, --, --, --, --, --, --, --, --, --, --, --, --, --
Alexander Kerfoot, Healthy, Ari, C, FA, --, --, --, --, --, --, --, --, --, --, --, --, --, --, --, --, --, --, --
Ross Colton, Healthy, Col, LW, FA, --, --, --, --, --, --, --, --, --, --, --, --, --, --, --, --, --, --, --
Yanni Gourde, Healthy, Sea, C- LW- RW, FA, --, --, --, --, --, --, --, --, --, --, --, --, --, --, --, --, --, --, --
Jake Neighbours, Healthy, StL, LW, FA, --, --, --, --, --, --, --, --, --, --, --, --, --, --, --, --, --, --, --
Matthew Poitras, DTD, Bos, C, FA, --, --, --, --, --, --, --, --, --, --, --, --, --, --, --, --, --, --, --
Brian Dumoulin, Healthy, Sea, D, FA, --, --, --, --, --, --, --, --, --, --, --, --, --, --, --, --, --, --, --
Ryan Strome, Healthy, Ana, C, FA, --, --, --, --, --, --, --, --, --, --, --, --, --, --, --, --, --, --, --
Michael Carcone, Healthy, Ari, RW, FA, --, --, --, --, --, --, --, --, --, --, --, --, --, --, --, --, --, --, --
Ilya Lyubushkin, Healthy, Ana, D, FA, --, --, --, --, --, --, --, --, --, --, --, --, --, --, --, --, --, --, --
Ilya Mikheyev, Healthy, Van, LW- RW, FA, --, --, --, --, --, --, --, --, --, --, --, --, --, --, --, --, --, --, --
Paul Cotter, Healthy, Vgk, C, FA, --, --, --, --, --, --, --, --, --, --, --, --, --, --, --, --, --, --, --
Jack Quinn, Healthy, Buf, RW, FA, --, --, --, --, --, --, --, --, --, --, --, --, --, --, --, --, --, --, --
Adam Pelech, Healthy, NYI, D, FA, --, --, --, --, --, --, --, --, --, --, --, --, --, --, --, --, --, --, --
Jordan Eberle, Healthy, Sea, RW, FA, --, --, --, --, --, --, --, --, --, --, --, --, --, --, --, --, --, --, --
Morgan Frost, Healthy, Phi, C, FA, --, --, --, --, --, --, --, --, --, --, --, --, --, --, --, --, --, --, --
Michael McLeod, Healthy, NJ, C, SLC, --, --, --, --, --, --, --, --, --, --, --, --, --, --, --, --, --, --, --
Marcus Foligno, Healthy, Min, RW- LW, FA, --, --, --, --, --, --, --, --, --, --, --, --, --, --, --, --, --, --, --
TJ Brodie, Healthy, Tor, D, FA, --, --, --, --, --, --, --, --, --, --, --, --, --, --, --, --, --, --, --
Luke Schenn, Healthy, Nsh, D, FA, --, --, --, --, --, --, --, --, --, --, --, --, --, --, --, --, --, --, --
Vladislav Namestnikov, Healthy, Wpg, C, FA, --, --, --, --, --, --, --, --, --, --, --, --, --, --, --, --, --, --, --
Nick Foligno, IR, Chi, LW- C- RW, FA, --, --, --, --, --, --, --, --, --, --, --, --, --, --, --, --, --, --, --
Gabriel Landeskog, IR, Col, LW, FA, --, --, --, --, --, --, --, --, --, --, --, --, --, --, --, --, --, --, --
Andre Burakovsky, Healthy, Sea, RW- LW, FA, --, --, --, --, --, --, --, --, --, --, --, --, --, --, --, --, --, --, --
Jack McBain, Healthy, Ari, C- LW, FA, --, --, --, --, --, --, --, --, --, --, --, --, --, --, --, --, --, --, --
Taylor Raddysh, Healthy, Chi, RW, FA, --, --, --, --, --, --, --, --, --, --, --, --, --, --, --, --, --, --, --
Alex Killorn, Healthy, Ana, RW- LW, FA, --, --, --, --, --, --, --, --, --, --, --, --, --, --, --, --, --, --, --
Brett Pesce, Healthy, Car, D, FA, --, --, --, --, --, --, --, --, --, --, --, --, --, --, --, --, --, --, --
Carson Soucy, Healthy, Van, D, FA, --, --, --, --, --, --, --, --, --, --, --, --, --, --, --, --, --, --, --
Tyson Foerster, Healthy, Phi, RW, FA, --, --, --, --, --, --, --, --, --, --, --, --, --, --, --, --, --, --, --
Connor Zary, Healthy, Cgy, C, FA, --, --, --, --, --, --, --, --, --, --, --, --, --, --, --, --, --, --, --
Will Borgen, Healthy, Sea, D, FA, --, --, --, --, --, --, --, --, --, --, --, --, --, --, --, --, --, --, --
Dillon Dube, Healthy, Cgy, C, FA, --, --, --, --, --, --, --, --, --, --, --, --, --, --, --, --, --, --, --
Connor Clifton, Healthy, Buf, D, FA, --, --, --, --, --, --, --, --, --, --, --, --, --, --, --, --, --, --, --
"Logan OConnor", Healthy, Col, RW, FA, --, --, --, --, --, --, --, --, --, --, --, --, --, --, --, --, --, --, --
Calle Jarnkrok, Healthy, Tor, LW- C- RW, FA, --, --, --, --, --, --, --, --, --, --, --, --, --, --, --, --, --, --, --
Mason Appleton, Healthy, Wpg, RW- C, FA, --, --, --, --, --, --, --, --, --, --, --, --, --, --, --, --, --, --, --
Jordan Staal, Healthy, Car, C, FA, --, --, --, --, --, --, --, --, --, --, --, --, --, --, --, --, --, --, --
Patrice Bergeron, Healthy, Bos, C, FA, --, --, --, --, --, --, --, --, --, --, --, --, --, --, --, --, --, --, --
Anton Lundell, Healthy, Fla, LW- C, FA, --, --, --, --, --, --, --, --, --, --, --, --, --, --, --, --, --, --, --
Warren Foegele, Healthy, Edm, LW- RW, FA, --, --, --, --, --, --, --, --, --, --, --, --, --, --, --, --, --, --, --
Marcus Johansson, Healthy, Min, LW- RW, FA, --, --, --, --, --, --, --, --, --, --, --, --, --, --, --, --, --, --, --
Zach Benson, Healthy, Buf, LW, FA, --, --, --, --, --, --, --, --, --, --, --, --, --, --, --, --, --, --, --
Jacob Peterson, Healthy, SJ, C- LW- RW, FA, --, --, --, --, --, --, --, --, --, --, --, --, --, --, --, --, --, --, --
Stefan Noesen, Healthy, Car, LW- RW, FA, --, --, --, --, --, --, --, --, --, --, --, --, --, --, --, --, --, --, --
Jason Zucker, Healthy, Ari, LW- RW, FA, --, --, --, --, --, --, --, --, --, --, --, --, --, --, --, --, --, --, --
Nicolas Hague, Healthy, Vgk, D, FA, --, --, --, --, --, --, --, --, --, --, --, --, --, --, --, --, --, --, --
John Marino, Healthy, NJ, D, FA, --, --, --, --, --, --, --, --, --, --, --, --, --, --, --, --, --, --, --
Ryan McLeod, Healthy, Edm, C, FA, --, --, --, --, --, --, --, --, --, --, --, --, --, --, --, --, --, --, --
Calen Addison, Healthy, SJ, D, FA, --, --, --, --, --, --, --, --, --, --, --, --, --, --, --, --, --, --, --
Nicolas Roy, Healthy, Vgk, C, FA, --, --, --, --, --, --, --, --, --, --, --, --, --, --, --, --, --, --, --
Matt Dumba, Healthy, Ari, D, FA, --, --, --, --, --, --, --, --, --, --, --, --, --, --, --, --, --, --, --
Fabian Lysell, Healthy, Bos, RW, FA, --, --, --, --, --, --, --, --, --, --, --, --, --, --, --, --, --, --, --
Alex Wennberg, Healthy, Sea, C, FA, --, --, --, --, --, --, --, --, --, --, --, --, --, --, --, --, --, --, --
Nikita Zadorov, Healthy, Van, D, FA, --, --, --, --, --, --, --, --, --, --, --, --, --, --, --, --, --, --, --
Cole Smith, Healthy, Nsh, LW- RW, FA, --, --, --, --, --, --, --, --, --, --, --, --, --, --, --, --, --, --, --
Nate Schmidt, Healthy, Wpg, D, FA, --, --, --, --, --, --, --, --, --, --, --, --, --, --, --, --, --, --, --
Anthony Beauvillier, IR, Chi, RW- LW, FA, --, --, --, --, --, --, --, --, --, --, --, --, --, --, --, --, --, --, --
Dmitry Kulikov, Healthy, Fla, D, FA, --, --, --, --, --, --, --, --, --, --, --, --, --, --, --, --, --, --, --
Ty Smith, Healthy, Pit, D, FA, --, --, --, --, --, --, --, --, --, --, --, --, --, --, --, --, --, --, --
Conor Garland, Healthy, Van, RW, FA, --, --, --, --, --, --, --, --, --, --, --, --, --, --, --, --, --, --, --
Jarred Tinordi, Healthy, Chi, D, FA, --, --, --, --, --, --, --, --, --, --, --, --, --, --, --, --, --, --, --
Kevin Korchinski, Healthy, Chi, D, FA, --, --, --, --, --, --, --, --, --, --, --, --, --, --, --, --, --, --, --
Nils Hoglander, Healthy, Van, LW, FA, --, --, --, --, --, --, --, --, --, --, --, --, --, --, --, --, --, --, --
Sam Lafferty, Healthy, Van, C, FA, --, --, --, --, --, --, --, --, --, --, --, --, --, --, --, --, --, --, --
Teddy Blueger, Healthy, Van, C, FA, --, --, --, --, --, --, --, --, --, --, --, --, --, --, --, --, --, --, --
Ondrej Palat, O, NJ, LW, FA, --, --, --, --, --, --, --, --, --, --, --, --, --, --, --, --, --, --, --
Kasperi Kapanen, Healthy, StL, RW, FA, --, --, --, --, --, --, --, --, --, --, --, --, --, --, --, --, --, --, --
Alexander Holtz, Healthy, NJ, RW, FA, --, --, --, --, --, --, --, --, --, --, --, --, --, --, --, --, --, --, --
Ridly Greig, Healthy, Ott, C- LW, FA, --, --, --, --, --, --, --, --, --, --, --, --, --, --, --, --, --, --, --
Kailer Yamamoto, Healthy, Sea, RW, FA, --, --, --, --, --, --, --, --, --, --, --, --, --, --, --, --, --, --, --
Ian Cole, Healthy, Van, D, FA, --, --, --, --, --, --, --, --, --, --, --, --, --, --, --, --, --, --, --
Ryan Suter, Healthy, Dal, D, FA, --, --, --, --, --, --, --, --, --, --, --, --, --, --, --, --, --, --, --
Corey Perry, Healthy, Chi, RW, FA, --, --, --, --, --, --, --, --, --, --, --, --, --, --, --, --, --, --, --
Ryan Donato, Healthy, Chi, RW, FA, --, --, --, --, --, --, --, --, --, --, --, --, --, --, --, --, --, --, --
Tomas Tatar, Healthy, Sea, LW, FA, --, --, --, --, --, --, --, --, --, --, --, --, --, --, --, --, --, --, --
Ryan Reaves, IR, Tor, RW, FA, --, --, --, --, --, --, --, --, --, --, --, --, --, --, --, --, --, --, --
Bobby Brink, Healthy, Phi, RW, FA, --, --, --, --, --, --, --, --, --, --, --, --, --, --, --, --, --, --, --
Erik Cernak, DTD, TB, D, FA, --, --, --, --, --, --, --, --, --, --, --, --, --, --, --, --, --, --, --
Jacob Bernard-Docker, Healthy, Ott, D, FA, --, --, --, --, --, --, --, --, --, --, --, --, --, --, --, --, --, --, --
Zach Whitecloud, Healthy, Vgk, D, FA, --, --, --, --, --, --, --, --, --, --, --, --, --, --, --, --, --, --, --
Shane Pinto, SSPD, Ott, C, FA, --, --, --, --, --, --, --, --, --, --, --, --, --, --, --, --, --, --, --
Adam Edstrom, Healthy, NYR, C, FA, Det, W 3-2, --, --, --, --, --, --, --, --, --, --, --, --, --, --, --, --, --
Victor Olofsson, Healthy, Buf, RW, FA, --, --, --, --, --, --, --, --, --, --, --, --, --, --, --, --, --, --, --
Justin Schultz, Healthy, Sea, D, FA, --, --, --, --, --, --, --, --, --, --, --, --, --, --, --, --, --, --, --
Henry Thrun, Healthy, SJ, D, FA, --, --, --, --, --, --, --, --, --, --, --, --, --, --, --, --, --, --, --
Garnet Hathaway, Healthy, Phi, RW, FA, --, --, --, --, --, --, --, --, --, --, --, --, --, --, --, --, --, --, --
Kevin Hayes, Healthy, StL, C, FA, --, --, --, --, --, --, --, --, --, --, --, --, --, --, --, --, --, --, --
Nicholas Robertson, Healthy, Tor, LW, FA, --, --, --, --, --, --, --, --, --, --, --, --, --, --, --, --, --, --, --
Alex Vlasic, Healthy, Chi, D, FA, --, --, --, --, --, --, --, --, --, --, --, --, --, --, --, --, --, --, --
Sebastian Aho, Healthy, NYI, D, FA, --, --, --, --, --, --, --, --, --, --, --, --, --, --, --, --, --, --, --
Dominic Toninato, Healthy, Wpg, C, FA, --, --, --, --, --, --, --, --, --, --, --, --, --, --, --, --, --, --, --
Mike Reilly, Healthy, NYI, D, FA, --, --, --, --, --, --, --, --, --, --, --, --, --, --, --, --, --, --, --
Kiefer Sherwood, Healthy, Nsh, LW- RW, FA, --, --, --, --, --, --, --, --, --, --, --, --, --, --, --, --, --, --, --
Noah Cates, IR, Phi, LW, FA, --, --, --, --, --, --, --, --, --, --, --, --, --, --, --, --, --, --, --
Alexander Barabanov, Healthy, SJ, LW, FA, --, --, --, --, --, --, --, --, --, --, --, --, --, --, --, --, --, --, --
Martin Pospisil, Healthy, Cgy, LW- RW, FA, --, --, --, --, --, --, --, --, --, --, --, --, --, --, --, --, --, --, --
Matt Grzelcyk, Healthy, Bos, D, FA, --, --, --, --, --, --, --, --, --, --, --, --, --, --, --, --, --, --, --
Keegan Kolesar, Healthy, Vgk, RW, FA, --, --, --, --, --, --, --, --, --, --, --, --, --, --, --, --, --, --, --
Tyler Johnson, IR, Chi, C- LW- RW, FA, --, --, --, --, --, --, --, --, --, --, --, --, --, --, --, --, --, --, --
Phil Kessel, Healthy, Vgk, RW, FA, --, --, --, --, --, --, --, --, --, --, --, --, --, --, --, --, --, --, --
Frederick Gaudreau, Healthy, Min, C, FA, --, --, --, --, --, --, --, --, --, --, --, --, --, --, --, --, --, --, --
Brandon Tanev, Healthy, Sea, LW, FA, --, --, --, --, --, --, --, --, --, --, --, --, --, --, --, --, --, --, --
"Liam OBrien", Healthy, Ari, LW, FA, --, --, --, --, --, --, --, --, --, --, --, --, --, --, --, --, --, --, --
Egor Zamula, Healthy, Phi, D, FA, --, --, --, --, --, --, --, --, --, --, --, --, --, --, --, --, --, --, --
Juuso Parssinen, Healthy, Nsh, C- RW, FA, --, --, --, --, --, --, --, --, --, --, --, --, --, --, --, --, --, --, --
Cody Ceci, Healthy, Edm, D, FA, --, --, --, --, --, --, --, --, --, --, --, --, --, --, --, --, --, --, --
Pat Maroon, Healthy, Min, LW, FA, --, --, --, --, --, --, --, --, --, --, --, --, --, --, --, --, --, --, --
Kyle Burroughs, Healthy, SJ, D, FA, --, --, --, --, --, --, --, --, --, --, --, --, --, --, --, --, --, --, --
Nikita Zaitsev, Healthy, Chi, D, FA, --, --, --, --, --, --, --, --, --, --, --, --, --, --, --, --, --, --, --
Travis Hamonic, Healthy, Ott, D, FA, --, --, --, --, --, --, --, --, --, --, --, --, --, --, --, --, --, --, --
Dante Fabbro, Healthy, Nsh, D, FA, --, --, --, --, --, --, --, --, --, --, --, --, --, --, --, --, --, --, --
Michael Amadio, Healthy, Vgk, RW- C- LW, FA, --, --, --, --, --, --, --, --, --, --, --, --, --, --, --, --, --, --, --
Nils Lundkvist, Healthy, Dal, D, FA, --, --, --, --, --, --, --, --, --, --, --, --, --, --, --, --, --, --, --
Wade Allison, Healthy, Phi, RW, FA, --, --, --, --, --, --, --, --, --, --, --, --, --, --, --, --, --, --, --
Simon Benoit, Healthy, Tor, D, FA, --, --, --, --, --, --, --, --, --, --, --, --, --, --, --, --, --, --, --
Sam Gagner, Healthy, Edm, C, FA, --, --, --, --, --, --, --, --, --, --, --, --, --, --, --, --, --, --, --
Erik Johnson, Healthy, Buf, D, FA, --, --, --, --, --, --, --, --, --, --, --, --, --, --, --, --, --, --, --
Cal Clutterbuck, Healthy, NYI, RW, FA, --, --, --, --, --, --, --, --, --, --, --, --, --, --, --, --, --, --, --
Simon Holmstrom, Healthy, NYI, RW, FA, --, --, --, --, --, --, --, --, --, --, --, --, --, --, --, --, --, --, --
Matt Coronato, Healthy, Cgy, RW, FA, --, --, --, --, --, --, --, --, --, --, --, --, --, --, --, --, --, --, --
Milan Lucic, IR, Bos, LW, FA, --, --, --, --, --, --, --, --, --, --, --, --, --, --, --, --, --, --, --
Henri Jokiharju, Healthy, Buf, D, FA, --, --, --, --, --, --, --, --, --, --, --, --, --, --, --, --, --, --, --
Matvei Michkov, Healthy, Phi, RW, FA, --, --, --, --, --, --, --, --, --, --, --, --, --, --, --, --, --, --, --
Derek Forbort, IR, Bos, D, FA, --, --, --, --, --, --, --, --, --, --, --, --, --, --, --, --, --, --, --
Andreas Athanasiou, IR, Chi, LW- C- RW, FA, --, --, --, --, --, --, --, --, --, --, --, --, --, --, --, --, --, --, --
Miles Wood, O, Col, LW, FA, --, --, --, --, --, --, --, --, --, --, --, --, --, --, --, --, --, --, --
Yakov Trenin, Healthy, Nsh, LW- C, FA, --, --, --, --, --, --, --, --, --, --, --, --, --, --, --, --, --, --, --
Noel Acciari, Healthy, Pit, C, FA, --, --, --, --, --, --, --, --, --, --, --, --, --, --, --, --, --, --, --
Brandon Saad, Healthy, StL, LW, FA, --, --, --, --, --, --, --, --, --, --, --, --, --, --, --, --, --, --, --
Lars Eller, Healthy, Pit, C, FA, --, --, --, --, --, --, --, --, --, --, --, --, --, --, --, --, --, --, --
Kyle Okposo, Healthy, Buf, RW, FA, --, --, --, --, --, --, --, --, --, --, --, --, --, --, --, --, --, --, --
Josh Archibald, Healthy, TB, RW, FA, --, --, --, --, --, --, --, --, --, --, --, --, --, --, --, --, --, --, --
Evgenii Dadonov, Healthy, Dal, RW, FA, --, --, --, --, --, --, --, --, --, --, --, --, --, --, --, --, --, --, --
Brett Kulak, Healthy, Edm, D, FA, --, --, --, --, --, --, --, --, --, --, --, --, --, --, --, --, --, --, --
"Drew OConnor", Healthy, Pit, LW, FA, --, --, --, --, --, --, --, --, --, --, --, --, --, --, --, --, --, --, --
Cutter Gauthier, Healthy, Ana, LW, FA, --, --, --, --, --, --, --, --, --, --, --, --, --, --, --, --, --, --, --
Matt Benning, IR, SJ, D, FA, --, --, --, --, --, --, --, --, --, --, --, --, --, --, --, --, --, --, --
Nick Perbix, Healthy, TB, D, FA, --, --, --, --, --, --, --, --, --, --, --, --, --, --, --, --, --, --, --
Logan Stankoven, Healthy, Dal, C, FA, --, --, --, --, --, --, --, --, --, --, --, --, --, --, --, --, --, --, --
Jack Johnson, Healthy, Col, D, FA, --, --, --, --, --, --, --, --, --, --, --, --, --, --, --, --, --, --, --
Casey Cizikas, O, NYI, C, FA, --, --, --, --, --, --, --, --, --, --, --, --, --, --, --, --, --, --, --
William Smith, Healthy, SJ, C, FA, --, --, --, --, --, --, --, --, --, --, --, --, --, --, --, --, --, --, --
Jordan Greenway, Healthy, Buf, LW, FA, --, --, --, --, --, --, --, --, --, --, --, --, --, --, --, --, --, --, --
Curtis Lazar, Healthy, NJ, RW, FA, --, --, --, --, --, --, --, --, --, --, --, --, --, --, --, --, --, --, --
Nicolas Deslauriers, Healthy, Phi, RW- LW, FA, --, --, --, --, --, --, --, --, --, --, --, --, --, --, --, --, --, --, --
Michael McCarron, Healthy, Nsh, RW, FA, --, --, --, --, --, --, --, --, --, --, --, --, --, --, --, --, --, --, --
Nick Leddy, Healthy, StL, D, FA, --, --, --, --, --, --, --, --, --, --, --, --, --, --, --, --, --, --, --
Jonathan Toews, Healthy, Chi, C, FA, --, --, --, --, --, --, --, --, --, --, --, --, --, --, --, --, --, --, --
Mason Lohrei, Healthy, Bos, D, FA, --, --, --, --, --, --, --, --, --, --, --, --, --, --, --, --, --, --, --
Jack Drury, Healthy, Car, C- LW, FA, --, --, --, --, --, --, --, --, --, --, --, --, --, --, --, --, --, --, --
Caleb Jones, Healthy, Col, D, FA, --, --, --, --, --, --, --, --, --, --, --, --, --, --, --, --, --, --, --
Pius Suter, Healthy, Van, C, FA, --, --, --, --, --, --, --, --, --, --, --, --, --, --, --, --, --, --, --
Nikita Okhotiuk, Healthy, SJ, D, FA, --, --, --, --, --, --, --, --, --, --, --, --, --, --, --, --, --, --, --
Brandon Duhaime, Healthy, Min, LW- RW, FA, --, --, --, --, --, --, --, --, --, --, --, --, --, --, --, --, --, --, --
Brandon Biro, Healthy, Buf, LW, FA, --, --, --, --, --, --, --, --, --, --, --, --, --, --, --, --, --, --, --
Luke Glendening, Healthy, TB, RW- C, FA, --, --, --, --, --, --, --, --, --, --, --, --, --, --, --, --, --, --, --
Kaedan Korczak, Healthy, Vgk, D, FA, --, --, --, --, --, --, --, --, --, --, --, --, --, --, --, --, --, --, --
Dylan Samberg, Healthy, Wpg, D, FA, --, --, --, --, --, --, --, --, --, --, --, --, --, --, --, --, --, --, --
Jakob Pelletier, Healthy, Cgy, LW, FA, --, --, --, --, --, --, --, --, --, --, --, --, --, --, --, --, --, --, --
Marc Staal, Healthy, Phi, D, FA, --, --, --, --, --, --, --, --, --, --, --, --, --, --, --, --, --, --, --
Ty Dellandrea, Healthy, Dal, RW- C, FA, --, --, --, --, --, --, --, --, --, --, --, --, --, --, --, --, --, --, --
Mike Hoffman, Healthy, SJ, LW, FA, --, --, --, --, --, --, --, --, --, --, --, --, --, --, --, --, --, --, --
Conor Timmins, Healthy, Tor, D, FA, --, --, --, --, --, --, --, --, --, --, --, --, --, --, --, --, --, --, --
Valtteri Puustinen, Healthy, Pit, LW, FA, --, --, --, --, --, --, --, --, --, --, --, --, --, --, --, --, --, --, --
Peyton Krebs, Healthy, Buf, C, FA, --, --, --, --, --, --, --, --, --, --, --, --, --, --, --, --, --, --, --
P.K. Subban, Healthy, NJ, D, FA, --, --, --, --, --, --, --, --, --, --, --, --, --, --, --, --, --, --, --
