Name, Health, NHL Team, Position, GFHL Team, Opponent, Score, GP, G, A, +/-, PIM, PPG, PPA, SHG, SHA, GWG, FOW, FOL, HAT, SOG, HIT, BLK, FPTS
Jacob Trouba, Healthy, NYR, D, BOWS, Det, W 3-2, 1, 0, 1, 1, 0, 0, 0, 0, 0, 0, 0, 0, 0, 1, 4, 5, 5.8
Alexis Lafreniere, Healthy, NYR, LW, FA, Det, W 3-2, 1, 0, 2, 2, 2, 0, 0, 0, 0, 0, 0, 0, 0, 4, 0, 2, 5.2
"KAndre Miller", Healthy, NYR, D, FA, Det, W 3-2, 1, 1, 1, 2, 0, 0, 0, 0, 0, 0, 0, 0, 0, 3, 1, 0, 5.1
Connor McMichael, Healthy, Wsh, C, FA, @LA, W 2-1, 1, 1, 1, 1, 0, 0, 0, 0, 0, 1, 2, 2, 0, 1, 0, 0, 5.1
Mike Matheson, Healthy, Mon, D, CLB, @Cls, W 4-2, 1, 0, 2, 1, 0, 0, 0, 0, 0, 0, 0, 0, 0, 0, 0, 3, 5.0
Aliaksei Protas, Healthy, Wsh, C, FA, @LA, W 2-1, 1, 0, 2, 1, 0, 0, 0, 0, 0, 0, 0, 0, 0, 1, 0, 2, 4.6
Anthony Mantha, Healthy, Wsh, RW, FA, @LA, W 2-1, 1, 1, 1, 1, 0, 0, 0, 0, 0, 0, 0, 0, 0, 4, 0, 0, 4.4
Joel Armia, Healthy, Mon, RW, FA, @Cls, W 4-2, 1, 1, 0, 2, 0, 0, 0, 0, 0, 1, 0, 0, 0, 3, 0, 0, 4.3
Gustav Lindstrom, Healthy, Ana, D, FA, --, --, 1, 1, 0, 2, 2, 0, 0, 0, 0, 0, 0, 0, 0, 2, 1, 2, 4.3
Jimmy Vesey, Healthy, NYR, LW, FA, Det, W 3-2, 1, 1, 0, 1, 2, 0, 0, 0, 0, 1, 1, 1, 0, 3, 0, 1, 4.1
Moritz Seider, Healthy, Det, D, SALT, @NYR, L 2-3, 1, 1, 0, 0, 0, 1, 0, 0, 0, 0, 0, 0, 0, 3, 0, 2, 3.8
Kaiden Guhle, Healthy, Mon, D, HERB, @Cls, W 4-2, 1, 0, 1, 1, 0, 0, 0, 0, 0, 0, 0, 0, 0, 2, 2, 2, 3.8
Yegor Chinakhov, Healthy, Cls, RW, FA, Mon, L 2-4, 1, 1, 0, 1, 0, 0, 0, 0, 0, 0, 0, 0, 0, 5, 2, 0, 3.6
Jake Walman, Healthy, Det, D, CLB, @NYR, L 2-3, 1, 0, 0, -1, 0, 0, 0, 0, 0, 0, 0, 0, 0, 1, 0, 8, 3.6
Zach Werenski, O, Cls, D, ME, Mon, L 2-4, 1, 0, 1, 1, 0, 0, 0, 0, 0, 0, 0, 0, 0, 3, 0, 2, 3.3
Alex Newhook, IR, Mon, C, FA, @Cls, W 4-2, 1, 1, 0, 1, 0, 0, 0, 0, 0, 0, 1, 1, 0, 2, 2, 0, 3.3
Andrew Copp, Healthy, Det, C, FA, @NYR, L 2-3, 1, 0, 2, -2, 0, 0, 1, 0, 0, 0, 8, 7, 0, 3, 2, 0, 3.25
Justin Barron, Healthy, Mon, D, FA, @Cls, W 4-2, 1, 0, 1, 0, 0, 0, 0, 0, 0, 0, 0, 0, 0, 3, 3, 1, 3.2
Andreas Englund, Healthy, LA, D, FA, Wsh, L 1-2, 1, 0, 1, 0, 0, 0, 0, 0, 0, 0, 0, 0, 0, 0, 4, 1, 3.2
Vincent Trocheck, Healthy, NYR, C, LKR, Det, W 3-2, 1, 0, 1, 2, 6, 0, 0, 0, 0, 0, 10, 5, 0, 3, 0, 1, 3.2
Mika Zibanejad, DTD, NYR, C, ME, Det, W 3-2, 1, 0, 1, 0, 0, 0, 0, 0, 0, 0, 9, 3, 0, 5, 0, 1, 3.1
Dmitri Voronkov, Healthy, Cls, LW, FA, Mon, L 2-4, 1, 0, 1, 1, 0, 0, 0, 0, 0, 0, 1, 0, 0, 2, 1, 1, 3.1
Robby Fabbri, Healthy, Det, LW- C, FA, @NYR, L 2-3, 1, 1, 1, -2, 0, 0, 1, 0, 0, 0, 1, 0, 0, 2, 0, 0, 3.05
Nick Suzuki, Healthy, Mon, C, CLB, @Cls, W 4-2, 1, 0, 1, 1, 0, 0, 0, 0, 0, 0, 6, 3, 0, 3, 1, 0, 2.9
Artemi Panarin, Healthy, NYR, LW, BOWS, Det, W 3-2, 1, 1, 0, 1, 2, 0, 0, 0, 0, 0, 0, 0, 0, 3, 0, 0, 2.6
Christian Dvorak, IR, Mon, LW, FA, @Cls, W 4-2, 1, 0, 1, 1, 0, 0, 0, 0, 0, 0, 4, 2, 0, 2, 0, 0, 2.4
Jayden Struble, Healthy, Mon, D, FA, @Cls, W 4-2, 1, 0, 0, 0, 0, 0, 0, 0, 0, 0, 0, 0, 0, 2, 4, 2, 2.4
Jordan Spence, Healthy, LA, D, FA, Wsh, L 1-2, 1, 0, 1, 0, 0, 0, 0, 0, 0, 0, 0, 0, 0, 0, 1, 1, 2.3
Arthur Kaliyev, Healthy, LA, RW, FA, Wsh, L 1-2, 1, 1, 0, 0, 0, 0, 0, 0, 0, 0, 0, 0, 0, 2, 0, 0, 2.2
Beck Malenstyn, Healthy, Wsh, LW, FA, @LA, W 2-1, 1, 0, 0, 0, 0, 0, 0, 0, 0, 0, 0, 0, 0, 0, 4, 2, 2.2
Joel Edmundson, Healthy, Wsh, D, FA, @LA, W 2-1, 1, 0, 0, 1, 0, 0, 0, 0, 0, 0, 0, 0, 0, 0, 2, 2, 2.1
Juraj Slafkovsky, Healthy, Mon, LW, FA, @Cls, W 4-2, 1, 0, 1, 0, 0, 0, 0, 0, 0, 0, 0, 0, 0, 2, 1, 0, 2.0
John Carlson, Healthy, Wsh, D, ME, @LA, W 2-1, 1, 0, 0, 1, 2, 0, 0, 0, 0, 0, 0, 0, 0, 1, 0, 3, 1.9
Matt Roy, Healthy, LA, D, OXP, Wsh, L 1-2, 1, 0, 0, -1, 0, 0, 0, 0, 0, 0, 0, 0, 0, 3, 2, 3, 1.9
Nic Dowd, Healthy, Wsh, C, FA, @LA, W 2-1, 1, 0, 0, 0, 2, 0, 0, 0, 0, 0, 6, 11, 0, 2, 1, 4, 1.8
Cole Caufield, Healthy, Mon, LW- RW, LKR, @Cls, W 4-2, 1, 1, 0, -1, 0, 0, 0, 0, 0, 0, 0, 0, 0, 3, 0, 0, 1.8
Sean Kuraly, IR, Cls, C, FA, Mon, L 2-4, 1, 0, 0, -1, 2, 0, 0, 0, 0, 0, 3, 1, 0, 0, 6, 1, 1.8
Mikey Anderson, Healthy, LA, D, FA, Wsh, L 1-2, 1, 0, 0, 0, 0, 0, 0, 0, 0, 0, 0, 0, 0, 4, 1, 2, 1.7
Jonatan Berggren, Healthy, Det, RW, FA, @NYR, L 2-3, 1, 0, 1, 0, 0, 0, 0, 0, 0, 0, 0, 0, 0, 2, 0, 0, 1.7
Tom Wilson, DTD, Wsh, RW, CLB, @LA, W 2-1, 1, 0, 0, 0, 0, 0, 0, 0, 0, 0, 0, 1, 0, 1, 2, 2, 1.6
Adam Boqvist, Healthy, Cls, D, FA, Mon, L 2-4, 1, 0, 0, 2, 0, 0, 0, 0, 0, 0, 0, 0, 0, 1, 0, 1, 1.6
Olli Maatta, Healthy, Det, D, FA, @NYR, L 2-3, 1, 0, 0, 0, 2, 0, 0, 0, 0, 0, 0, 0, 0, 0, 1, 3, 1.6
Ryan Lindgren, Healthy, NYR, D, FA, Det, W 3-2, 1, 0, 0, 0, 0, 0, 0, 0, 0, 0, 0, 0, 0, 2, 1, 2, 1.5
Boone Jenner, IR, Cls, C, OXP, Mon, L 2-4, 1, 0, 0, 0, 0, 0, 0, 0, 0, 0, 5, 5, 0, 1, 1, 2, 1.4
Trevor Moore, Healthy, LA, LW, OXP, Wsh, L 1-2, 1, 0, 0, 0, 0, 0, 0, 0, 0, 0, 0, 0, 0, 3, 2, 1, 1.4
Patrik Laine, O, Cls, RW, FA, Mon, L 2-4, 1, 1, 0, -2, 0, 0, 0, 0, 0, 0, 0, 1, 0, 2, 1, 0, 1.4
Martin Fehervary, Healthy, Wsh, D, FA, @LA, W 2-1, 1, 0, 0, 1, 0, 0, 0, 0, 0, 0, 0, 0, 0, 0, 3, 0, 1.4
Ben Chiarot, Healthy, Det, D, FA, @NYR, L 2-3, 1, 0, 0, -1, 0, 0, 0, 0, 0, 0, 0, 0, 0, 2, 0, 3, 1.2
David Jiricek, Healthy, Cls, D, FA, Mon, L 2-4, 1, 0, 0, -1, 0, 0, 0, 0, 0, 0, 0, 0, 0, 2, 0, 3, 1.2
Sean Monahan, Healthy, Mon, C, FA, @Cls, W 4-2, 1, 0, 0, 0, 0, 0, 0, 0, 0, 0, 5, 4, 0, 0, 0, 2, 1.1
Nick Jensen, Healthy, Wsh, D, FA, @LA, W 2-1, 1, 0, 0, 1, 0, 0, 0, 0, 0, 0, 0, 0, 0, 1, 0, 1, 1.1
Blake Wheeler, Healthy, NYR, RW, FA, Det, W 3-2, 1, 0, 0, 0, 0, 0, 0, 0, 0, 0, 3, 1, 0, 1, 1, 1, 1.1
Josh Anderson, Healthy, Mon, RW- LW, FA, @Cls, W 4-2, 1, 0, 0, 1, 0, 0, 0, 0, 0, 0, 1, 0, 0, 2, 1, 0, 1.1
Braden Schneider, Healthy, NYR, D, FA, Det, W 3-2, 1, 0, 0, 1, 0, 0, 0, 0, 0, 0, 0, 0, 0, 3, 1, 0, 1.1
Barclay Goodrow, Healthy, NYR, C- LW- RW, FA, Det, W 3-2, 1, 0, 0, 0, 0, 0, 0, 0, 0, 0, 3, 0, 0, 0, 1, 1, 1.1
Adrian Kempe, Healthy, LA, RW- LW, BOWS, Wsh, L 1-2, 1, 0, 0, 0, 0, 0, 0, 0, 0, 0, 0, 0, 0, 7, 1, 0, 1.0
Michael Rasmussen, Healthy, Det, C, FA, @NYR, L 2-3, 1, 0, 0, 0, 0, 0, 0, 0, 0, 0, 0, 1, 0, 1, 0, 2, 1.0
Alex Ovechkin, DTD, Wsh, LW, BOWS, @LA, W 2-1, 1, 0, 0, 0, 0, 0, 0, 0, 0, 0, 0, 0, 0, 2, 2, 0, 0.8
David Perron, Healthy, Det, RW- LW, FA, @NYR, L 2-3, 1, 0, 0, 0, 2, 0, 0, 0, 0, 0, 0, 1, 0, 1, 0, 2, 0.8
Cole Sillinger, Healthy, Cls, C, FA, Mon, L 2-4, 1, 0, 0, 0, 0, 0, 0, 0, 0, 0, 5, 8, 0, 3, 1, 1, 0.8
Justin Holl, Healthy, Det, D, FA, @NYR, L 2-3, 1, 0, 0, 0, 0, 0, 0, 0, 0, 0, 0, 0, 0, 0, 1, 1, 0.8
Will Cuylle, Healthy, NYR, LW, FA, Det, W 3-2, 1, 0, 0, 0, 2, 0, 0, 0, 0, 0, 0, 0, 0, 1, 3, 0, 0.8
Kevin Fiala, Healthy, LA, LW- RW, SLC, Wsh, L 1-2, 1, 0, 0, 0, 0, 0, 0, 0, 0, 0, 0, 0, 0, 4, 1, 0, 0.7
Kirill Marchenko, Healthy, Cls, LW- RW, FA, Mon, L 2-4, 1, 0, 0, -1, 0, 0, 0, 0, 0, 0, 0, 1, 0, 0, 1, 2, 0.7
Justin Danforth, Healthy, Cls, RW, FA, Mon, L 2-4, 1, 0, 0, -1, 0, 0, 0, 0, 0, 0, 3, 0, 0, 1, 1, 1, 0.7
Nicolas Aube-Kubel, Healthy, Wsh, RW, FA, @LA, W 2-1, 1, 0, 0, 0, 0, 0, 0, 0, 0, 0, 1, 0, 0, 0, 2, 0, 0.7
Shayne Gostisbehere, Healthy, Det, D, FA, @NYR, L 2-3, 1, 0, 0, -1, 0, 0, 0, 0, 0, 0, 0, 0, 0, 1, 0, 2, 0.6
Jake Bean, Healthy, Cls, D, FA, Mon, L 2-4, 1, 0, 0, -1, 0, 0, 0, 0, 0, 0, 0, 0, 0, 3, 1, 1, 0.6
Phillip Danault, Healthy, LA, C, FA, Wsh, L 1-2, 1, 0, 0, 0, 0, 0, 0, 0, 0, 0, 9, 4, 0, 1, 0, 0, 0.6
Quinton Byfield, Healthy, LA, C- LW, FA, Wsh, L 1-2, 1, 0, 0, 0, 0, 0, 0, 0, 0, 0, 1, 0, 0, 5, 0, 0, 0.6
Erik Gustafsson, Healthy, NYR, D, FA, Det, W 3-2, 1, 0, 0, 0, 0, 0, 0, 0, 0, 0, 0, 0, 0, 1, 0, 1, 0.6
Brendan Gallagher, Healthy, Mon, RW, FA, @Cls, W 4-2, 1, 0, 0, 1, 0, 0, 0, 0, 0, 0, 0, 0, 0, 1, 0, 0, 0.6
Carl Grundstrom, Healthy, LA, LW, FA, Wsh, L 1-2, 1, 0, 0, -1, 0, 0, 0, 0, 0, 0, 0, 0, 0, 2, 3, 0, 0.6
Jake Evans, Healthy, Mon, C- RW, FA, @Cls, W 4-2, 1, 0, 0, 1, 0, 0, 0, 0, 0, 0, 2, 8, 0, 1, 2, 0, 0.6
Anze Kopitar, Healthy, LA, C, BBS, Wsh, L 1-2, 1, 0, 0, 0, 0, 0, 0, 0, 0, 0, 11, 8, 0, 2, 0, 0, 0.5
Chris Kreider, Healthy, NYR, LW, LKR, Det, W 3-2, 1, 0, 0, 0, 0, 0, 0, 0, 0, 0, 0, 2, 0, 4, 1, 0, 0.5
Trevor Lewis, Healthy, LA, C, FA, Wsh, L 1-2, 1, 0, 0, 0, 0, 0, 0, 0, 0, 0, 2, 0, 0, 0, 1, 0, 0.5
Dylan Strome, Healthy, Wsh, C, FA, @LA, W 2-1, 1, 0, 0, 0, 2, 0, 0, 0, 0, 0, 7, 4, 0, 0, 1, 0, 0.4
Tanner Pearson, IR, Mon, LW, FA, @Cls, W 4-2, 1, 0, 0, 0, 0, 0, 0, 0, 0, 0, 0, 0, 0, 1, 1, 0, 0.4
Jesse Ylonen, Healthy, Mon, RW, FA, @Cls, W 4-2, 1, 0, 0, 0, 0, 0, 0, 0, 0, 0, 0, 0, 0, 1, 1, 0, 0.4
Nick Bonino, Healthy, NYR, C, FA, Det, W 3-2, 1, 0, 0, 0, 0, 0, 0, 0, 0, 0, 7, 3, 0, 0, 0, 0, 0.4
Eric Robinson, Healthy, Buf, LW, FA, --, --, 1, 0, 0, -1, 0, 0, 0, 0, 0, 0, 0, 0, 0, 0, 3, 0, 0.4
Drew Doughty, Healthy, LA, D, BBS, Wsh, L 1-2, 1, 0, 0, 0, 0, 0, 0, 0, 0, 0, 0, 0, 0, 3, 0, 0, 0.3
Johnny Gaudreau, Healthy, Cls, LW, FA, Mon, L 2-4, 1, 0, 0, -1, 0, 0, 0, 0, 0, 0, 0, 1, 0, 1, 1, 1, 0.3
Jaret Anderson-Dolan, Healthy, LA, C- RW, FA, Wsh, L 1-2, 1, 0, 0, 0, 0, 0, 0, 0, 0, 0, 1, 1, 0, 0, 1, 0, 0.3
Pierre-Luc Dubois, Healthy, LA, C, FA, Wsh, L 1-2, 1, 0, 0, -1, 0, 0, 0, 0, 0, 0, 3, 5, 0, 1, 1, 1, 0.2
Adam Fox, Healthy, NYR, D, SALT, Det, W 3-2, 1, 0, 0, 0, 0, 0, 0, 0, 0, 0, 0, 0, 0, 2, 0, 0, 0.2
Jonny Brodzinski, Healthy, NYR, C, FA, Det, W 3-2, 1, 0, 0, 0, 0, 0, 0, 0, 0, 0, 0, 2, 0, 4, 0, 0, 0.2
Johnathan Kovacevic, Healthy, Mon, D, FA, @Cls, W 4-2, 1, 0, 0, 0, 2, 0, 0, 0, 0, 0, 0, 0, 0, 1, 1, 0, 0.2
Klim Kostin, IR, Det, RW- LW, FA, @NYR, L 2-3, 1, 0, 0, 0, 2, 0, 0, 0, 0, 0, 0, 0, 0, 1, 1, 0, 0.2
Lucas Raymond, Healthy, Det, LW, SLC, @NYR, L 2-3, 1, 0, 0, 0, 0, 0, 0, 0, 0, 0, 0, 0, 0, 1, 0, 0, 0.1
Tyler Pitlick, DTD, NYR, RW, FA, Det, W 3-2, 1, 0, 0, 0, 0, 0, 0, 0, 0, 0, 0, 0, 0, 1, 0, 0, 0.1
Alex DeBrincat, Healthy, Det, LW- RW, SLC, @NYR, L 2-3, 1, 0, 0, -1, 0, 0, 0, 0, 0, 0, 1, 0, 0, 5, 0, 0, 0.1
Rasmus Sandin, IR, Wsh, D, FA, @LA, W 2-1, 1, 0, 0, -1, 0, 0, 0, 0, 0, 0, 0, 0, 0, 1, 0, 1, 0.1
Trevor van Riemsdyk, Healthy, Wsh, D, FA, @LA, W 2-1, 1, 0, 0, -1, 0, 0, 0, 0, 0, 0, 0, 0, 0, 1, 0, 1, 0.1
Vladislav Gavrikov, Healthy, LA, D, FA, Wsh, L 1-2, 1, 0, 0, -1, 0, 0, 0, 0, 0, 0, 0, 0, 0, 1, 0, 1, 0.1
J.T. Compher, Healthy, Det, RW- C- LW, FA, @NYR, L 2-3, 1, 0, 0, 0, 2, 0, 0, 0, 0, 0, 3, 12, 0, 2, 0, 2, 0.1
Dylan Larkin, Healthy, Det, C, OXP, @NYR, L 2-3, --, --, --, --, --, --, --, --, --, --, --, --, --, --, --, --, --
Patrick Kane, Healthy, Det, RW, DINK, @NYR, L 2-3, --, --, --, --, --, --, --, --, --, --, --, --, --, --, --, --, --
Jeff Petry, Healthy, Det, D, FA, @NYR, L 2-3, --, --, --, --, --, --, --, --, --, --, --, --, --, --, --, --, --
David Savard, Healthy, Mon, D, FA, @Cls, W 4-2, --, --, --, --, --, --, --, --, --, --, --, --, --, --, --, --, --
Rafael Harvey-Pinard, Healthy, Mon, LW, FA, @Cls, W 4-2, --, --, --, --, --, --, --, --, --, --, --, --, --, --, --, --, --
Andrew Peeke, Healthy, Cls, D, FA, Mon, L 2-4, --, --, --, --, --, --, --, --, --, --, --, --, --, --, --, --, --
Viktor Arvidsson, IR, LA, RW, FA, Wsh, L 1-2, --, --, --, --, --, --, --, --, --, --, --, --, --, --, --, --, --
Erik Gudbranson, Healthy, Cls, D, FA, Mon, L 2-4, 1, 0, 0, -2, 0, 0, 0, 0, 0, 0, 0, 0, 0, 2, 1, 1, 0.0
Kirby Dach, IR, Mon, C, FA, @Cls, W 4-2, --, --, --, --, --, --, --, --, --, --, --, --, --, --, --, --, --
Max Pacioretty, Healthy, Wsh, LW, SLC, @LA, W 2-1, --, --, --, --, --, --, --, --, --, --, --, --, --, --, --, --, --
Filip Chytil, IR, NYR, C- RW, FA, Det, W 3-2, --, --, --, --, --, --, --, --, --, --, --, --, --, --, --, --, --
Damon Severson, Healthy, Cls, D, FA, Mon, L 2-4, --, --, --, --, --, --, --, --, --, --, --, --, --, --, --, --, --
Arber Xhekaj, Healthy, Mon, D, FA, @Cls, W 4-2, --, --, --, --, --, --, --, --, --, --, --, --, --, --, --, --, --
Jack Roslovic, Healthy, Cls, C- RW, FA, Mon, L 2-4, --, --, --, --, --, --, --, --, --, --, --, --, --, --, --, --, --
Kent Johnson, Healthy, Cls, C, FA, Mon, L 2-4, --, --, --, --, --, --, --, --, --, --, --, --, --, --, --, --, --
T.J. Oshie, Healthy, Wsh, RW, FA, @LA, W 2-1, --, --, --, --, --, --, --, --, --, --, --, --, --, --, --, --, --
Brandt Clarke, Healthy, LA, D, FA, Wsh, L 1-2, --, --, --, --, --, --, --, --, --, --, --, --, --, --, --, --, --
Kaapo Kakko, IR, NYR, RW, FA, Det, W 3-2, --, --, --, --, --, --, --, --, --, --, --, --, --, --, --, --, --
Nicklas Backstrom, IR, Wsh, C, FA, @LA, W 2-1, --, --, --, --, --, --, --, --, --, --, --, --, --, --, --, --, --
Simon Edvinsson, Healthy, Det, D, FA, @NYR, L 2-3, --, --, --, --, --, --, --, --, --, --, --, --, --, --, --, --, --
Connor Mackey, Healthy, NYR, D, FA, Det, W 3-2, --, --, --, --, --, --, --, --, --, --, --, --, --, --, --, --, --
Michael Pezzetta, Healthy, Mon, LW- RW, FA, @Cls, W 4-2, --, --, --, --, --, --, --, --, --, --, --, --, --, --, --, --, --
Jordan Harris, Healthy, Mon, D, FA, @Cls, W 4-2, --, --, --, --, --, --, --, --, --, --, --, --, --, --, --, --, --
Sonny Milano, IR, Wsh, LW, FA, @LA, W 2-1, 1, 0, 0, 0, 0, 0, 0, 0, 0, 0, 0, 0, 0, 0, 0, 0, 0.0
Lane Hutson, Healthy, Mon, D, FA, @Cls, W 4-2, --, --, --, --, --, --, --, --, --, --, --, --, --, --, --, --, --
Nick Blankenburg, IR, Cls, D, FA, Mon, L 2-4, --, --, --, --, --, --, --, --, --, --, --, --, --, --, --, --, --
David Reinbacher, Healthy, Mon, D, FA, @Cls, W 4-2, --, --, --, --, --, --, --, --, --, --, --, --, --, --, --, --, --
Ryan Leonard, Healthy, Wsh, RW, FA, @LA, W 2-1, --, --, --, --, --, --, --, --, --, --, --, --, --, --, --, --, --
Marco Kasper, Healthy, Det, C, FA, @NYR, L 2-3, --, --, --, --, --, --, --, --, --, --, --, --, --, --, --, --, --
Blake Lizotte, Healthy, LA, C, FA, Wsh, L 1-2, --, --, --, --, --, --, --, --, --, --, --, --, --, --, --, --, --
Zac Jones, Healthy, NYR, D, FA, Det, W 3-2, --, --, --, --, --, --, --, --, --, --, --, --, --, --, --, --, --
Nate Danielson, Healthy, Det, C, FA, @NYR, L 2-3, --, --, --, --, --, --, --, --, --, --, --, --, --, --, --, --, --
Ivan Miroshnichenko, Healthy, Wsh, LW, FA, @LA, W 2-1, --, --, --, --, --, --, --, --, --, --, --, --, --, --, --, --, --
Matthew Phillips, Healthy, Wsh, C, FA, @LA, W 2-1, 1, 0, 0, 0, 0, 0, 0, 0, 0, 0, 0, 0, 0, 0, 0, 0, 0.0
Samuel Fagemo, Healthy, LA, LW, FA, Wsh, L 1-2, --, --, --, --, --, --, --, --, --, --, --, --, --, --, --, --, --
Axel Sandin Pellikka, Healthy, Det, D, FA, @NYR, L 2-3, --, --, --, --, --, --, --, --, --, --, --, --, --, --, --, --, --
Alex Turcotte, Healthy, LA, C, FA, Wsh, L 1-2, --, --, --, --, --, --, --, --, --, --, --, --, --, --, --, --, --
Gabriel Perreault, Healthy, NYR, RW, FA, Det, W 3-2, --, --, --, --, --, --, --, --, --, --, --, --, --, --, --, --, --
Emil Bemstrom, Healthy, Cls, C, FA, Mon, L 2-4, --, --, --, --, --, --, --, --, --, --, --, --, --, --, --, --, --
Hendrix Lapierre, Healthy, Wsh, C, FA, @LA, W 2-1, --, --, --, --, --, --, --, --, --, --, --, --, --, --, --, --, --
Denton Mateychuk, Healthy, Cls, D, FA, Mon, L 2-4, --, --, --, --, --, --, --, --, --, --, --, --, --, --, --, --, --
Alexander Alexeyev, Healthy, Wsh, D, FA, @LA, W 2-1, --, --, --, --, --, --, --, --, --, --, --, --, --, --, --, --, --
Jake Christiansen, Healthy, Cls, D, FA, Mon, L 2-4, --, --, --, --, --, --, --, --, --, --, --, --, --, --, --, --, --
Chris Wideman, IR, Mon, D, FA, @Cls, W 4-2, --, --, --, --, --, --, --, --, --, --, --, --, --, --, --, --, --
Jasper Weatherby, Healthy, Det, LW, FA, @NYR, L 2-3, --, --, --, --, --, --, --, --, --, --, --, --, --, --, --, --, --
Elmer Soderblom, Healthy, Det, LW- C, FA, @NYR, L 2-3, --, --, --, --, --, --, --, --, --, --, --, --, --, --, --, --, --
Alexander Edler, Healthy, LA, D, FA, Wsh, L 1-2, --, --, --, --, --, --, --, --, --, --, --, --, --, --, --, --, --
Andrew Cristall, Healthy, Wsh, LW, FA, @LA, W 2-1, --, --, --, --, --, --, --, --, --, --, --, --, --, --, --, --, --
Tobias Bjornfot, Healthy, Vgk, D, FA, --, --, --, --, --, --, --, --, --, --, --, --, --, --, --, --, --, --, --
Sean Farrell, Healthy, Mon, LW, FA, @Cls, W 4-2, --, --, --, --, --, --, --, --, --, --, --, --, --, --, --, --, --
Madison Bowey, Healthy, Mon, D, FA, @Cls, W 4-2, --, --, --, --, --, --, --, --, --, --, --, --, --, --, --, --, --
Filip Mesar, Healthy, Mon, RW- LW, FA, @Cls, W 4-2, --, --, --, --, --, --, --, --, --, --, --, --, --, --, --, --, --
Gavin Brindley, Healthy, Cls, C, FA, Mon, L 2-4, --, --, --, --, --, --, --, --, --, --, --, --, --, --, --, --, --
Carl Hagelin, Healthy, Wsh, LW, FA, @LA, W 2-1, --, --, --, --, --, --, --, --, --, --, --, --, --, --, --, --, --
Vladimir Tkachev, Healthy, LA, LW, FA, Wsh, L 1-2, --, --, --, --, --, --, --, --, --, --, --, --, --, --, --, --, --
Dylan McIlrath, Healthy, Wsh, D, FA, @LA, W 2-1, --, --, --, --, --, --, --, --, --, --, --, --, --, --, --, --, --
Mathieu Olivier, Healthy, Cls, C, FA, Mon, L 2-4, --, --, --, --, --, --, --, --, --, --, --, --, --, --, --, --, --
Austin Czarnik, Healthy, Det, RW, FA, @NYR, L 2-3, --, --, --, --, --, --, --, --, --, --, --, --, --, --, --, --, --
Zach Aston-Reese, Healthy, Det, C, FA, @NYR, L 2-3, --, --, --, --, --, --, --, --, --, --, --, --, --, --, --, --, --
Joe Snively, Healthy, Wsh, RW- LW, FA, @LA, W 2-1, --, --, --, --, --, --, --, --, --, --, --, --, --, --, --, --, --
Owen Beck, Healthy, Mon, C, FA, @Cls, W 4-2, --, --, --, --, --, --, --, --, --, --, --, --, --, --, --, --, --
Dustin Brown, Healthy, LA, RW, FA, Wsh, L 1-2, --, --, --, --, --, --, --, --, --, --, --, --, --, --, --, --, --
Andrew Gibson, Healthy, Det, D, FA, @NYR, L 2-3, --, --, --, --, --, --, --, --, --, --, --, --, --, --, --, --, --
Riley Nash, Healthy, NYR, C, FA, Det, W 3-2, --, --, --, --, --, --, --, --, --, --, --, --, --, --, --, --, --
Lukas Vejdemo, Healthy, Mon, C, FA, @Cls, W 4-2, --, --, --, --, --, --, --, --, --, --, --, --, --, --, --, --, --
Stanislav Svozil, Healthy, Cls, D, FA, Mon, L 2-4, --, --, --, --, --, --, --, --, --, --, --, --, --, --, --, --, --
Mike Vecchione, Healthy, Wsh, C, FA, @LA, W 2-1, --, --, --, --, --, --, --, --, --, --, --, --, --, --, --, --, --
Gabriel Carlsson, Healthy, Wsh, D, FA, @LA, W 2-1, --, --, --, --, --, --, --, --, --, --, --, --, --, --, --, --, --
Jake Chelios, Healthy, Det, D, FA, @NYR, L 2-3, --, --, --, --, --, --, --, --, --, --, --, --, --, --, --, --, --
Lucas Johansen, Healthy, Wsh, D, FA, @LA, W 2-1, --, --, --, --, --, --, --, --, --, --, --, --, --, --, --, --, --
Jacob Moverare, Healthy, LA, D, FA, Wsh, L 1-2, --, --, --, --, --, --, --, --, --, --, --, --, --, --, --, --, --
Mark Streit, Healthy, Mon, D, FA, @Cls, W 4-2, --, --, --, --, --, --, --, --, --, --, --, --, --, --, --, --, --
Marcus Bjork, Healthy, Cls, D, FA, Mon, L 2-4, --, --, --, --, --, --, --, --, --, --, --, --, --, --, --, --, --
Sami Niku, Healthy, Mon, D, FA, @Cls, W 4-2, --, --, --, --, --, --, --, --, --, --, --, --, --, --, --, --, --
Ben Harpur, O, NYR, D, FA, Det, W 3-2, --, --, --, --, --, --, --, --, --, --, --, --, --, --, --, --, --
Mitchell Stephens, Healthy, Mon, C, FA, @Cls, W 4-2, --, --, --, --, --, --, --, --, --, --, --, --, --, --, --, --, --
Alex Belzile, Healthy, NYR, C, FA, Det, W 3-2, --, --, --, --, --, --, --, --, --, --, --, --, --, --, --, --, --
P.A. Parenteau, Healthy, Det, RW, FA, @NYR, L 2-3, --, --, --, --, --, --, --, --, --, --, --, --, --, --, --, --, --
Jake Leschyshyn, Healthy, NYR, C, FA, Det, W 3-2, --, --, --, --, --, --, --, --, --, --, --, --, --, --, --, --, --
T.J. Tynan, Healthy, LA, C, FA, Wsh, L 1-2, --, --, --, --, --, --, --, --, --, --, --, --, --, --, --, --, --
Tim Berni, Healthy, Cls, D, FA, Mon, L 2-4, --, --, --, --, --, --, --, --, --, --, --, --, --, --, --, --, --
Mikael Pyyhtia, Healthy, Cls, LW, FA, Mon, L 2-4, --, --, --, --, --, --, --, --, --, --, --, --, --, --, --, --, --
Lucas Condotta, Healthy, Mon, C, FA, @Cls, W 4-2, --, --, --, --, --, --, --, --, --, --, --, --, --, --, --, --, --
Nick Merkley, Healthy, NYR, RW, FA, Det, W 3-2, --, --, --, --, --, --, --, --, --, --, --, --, --, --, --, --, --
Chase Pearson, Healthy, Det, C, FA, @NYR, L 2-3, --, --, --, --, --, --, --, --, --, --, --, --, --, --, --, --, --
C.J. Smith, Healthy, NYR, LW, FA, Det, W 3-2, --, --, --, --, --, --, --, --, --, --, --, --, --, --, --, --, --
Billy Sweezey, Healthy, Cls, D, FA, Mon, L 2-4, --, --, --, --, --, --, --, --, --, --, --, --, --, --, --, --, --
Vincent Iorio, Healthy, Wsh, D, FA, @LA, W 2-1, --, --, --, --, --, --, --, --, --, --, --, --, --, --, --, --, --
Nicolas Beaudin, Healthy, Mon, D, FA, @Cls, W 4-2, --, --, --, --, --, --, --, --, --, --, --, --, --, --, --, --, --
Jimmy Huntington, Healthy, Wsh, LW, FA, @LA, W 2-1, --, --, --, --, --, --, --, --, --, --, --, --, --, --, --, --, --
Cameron Schilling, Healthy, Wsh, D, FA, @LA, W 2-1, --, --, --, --, --, --, --, --, --, --, --, --, --, --, --, --, --
Kevin Connauton, Healthy, LA, D, FA, Wsh, L 1-2, --, --, --, --, --, --, --, --, --, --, --, --, --, --, --, --, --
Brian Lashoff, Healthy, Det, D, FA, @NYR, L 2-3, --, --, --, --, --, --, --, --, --, --, --, --, --, --, --, --, --
Tanner Fritz, Healthy, NYR, C, FA, Det, W 3-2, --, --, --, --, --, --, --, --, --, --, --, --, --, --, --, --, --
Cedric Paquette, Healthy, Mon, C, FA, @Cls, W 4-2, --, --, --, --, --, --, --, --, --, --, --, --, --, --, --, --, --
Paul Byron, Healthy, Mon, LW, FA, @Cls, W 4-2, --, --, --, --, --, --, --, --, --, --, --, --, --, --, --, --, --
Gustav Rydahl, Healthy, NYR, C, FA, Det, W 3-2, --, --, --, --, --, --, --, --, --, --, --, --, --, --, --, --, --
Hunter McKown, Healthy, Cls, C, FA, Mon, L 2-4, --, --, --, --, --, --, --, --, --, --, --, --, --, --, --, --, --
Daniel Catenacci, Healthy, NYR, C, FA, Det, W 3-2, --, --, --, --, --, --, --, --, --, --, --, --, --, --, --, --, --
Jakub Dvorak, Healthy, LA, D, FA, Wsh, L 1-2, --, --, --, --, --, --, --, --, --, --, --, --, --, --, --, --, --
Joe Hicketts, Healthy, LA, D, FA, Wsh, L 1-2, --, --, --, --, --, --, --, --, --, --, --, --, --, --, --, --, --
Steven Santini, Healthy, LA, D, FA, Wsh, L 1-2, --, --, --, --, --, --, --, --, --, --, --, --, --, --, --, --, --
Charles Hudon, Healthy, LA, LW, FA, Wsh, L 1-2, --, --, --, --, --, --, --, --, --, --, --, --, --, --, --, --, --
Nate Thompson, Healthy, LA, C, FA, Wsh, L 1-2, --, --, --, --, --, --, --, --, --, --, --, --, --, --, --, --, --
Brady Keeper, Healthy, Mon, D, FA, @Cls, W 4-2, --, --, --, --, --, --, --, --, --, --, --, --, --, --, --, --, --
Mattias Norlinder, Healthy, Mon, D, FA, @Cls, W 4-2, --, --, --, --, --, --, --, --, --, --, --, --, --, --, --, --, --
Libor Sulak, Healthy, Det, D, FA, @NYR, L 2-3, --, --, --, --, --, --, --, --, --, --, --, --, --, --, --, --, --
Brady Cleveland, Healthy, Det, D, FA, @NYR, L 2-3, --, --, --, --, --, --, --, --, --, --, --, --, --, --, --, --, --
Otto Leskinen, Healthy, Mon, D, FA, @Cls, W 4-2, --, --, --, --, --, --, --, --, --, --, --, --, --, --, --, --, --
Chase Priskie, Healthy, Wsh, D, FA, @LA, W 2-1, --, --, --, --, --, --, --, --, --, --, --, --, --, --, --, --, --
Johan Larsson, Healthy, Wsh, LW, FA, @LA, W 2-1, --, --, --, --, --, --, --, --, --, --, --, --, --, --, --, --, --
"Danny ORegan", Healthy, Det, C, FA, @NYR, L 2-3, --, --, --, --, --, --, --, --, --, --, --, --, --, --, --, --, --
Henrik Borgstrom, Healthy, Wsh, C, FA, @LA, W 2-1, --, --, --, --, --, --, --, --, --, --, --, --, --, --, --, --, --
Taro Hirose, Healthy, Det, LW, FA, @NYR, L 2-3, --, --, --, --, --, --, --, --, --, --, --, --, --, --, --, --, --
Matt Luff, IR, Det, RW, FA, @NYR, L 2-3, --, --, --, --, --, --, --, --, --, --, --, --, --, --, --, --, --
Brendan Gaunce, Healthy, Cls, C, FA, Mon, L 2-4, --, --, --, --, --, --, --, --, --, --, --, --, --, --, --, --, --
James Neal, Healthy, Cls, RW, FA, Mon, L 2-4, --, --, --, --, --, --, --, --, --, --, --, --, --, --, --, --, --
Mikhail Maltsev, Healthy, LA, LW, FA, Wsh, L 1-2, --, --, --, --, --, --, --, --, --, --, --, --, --, --, --, --, --
Mac Hollowell, Healthy, NYR, D, FA, Det, W 3-2, --, --, --, --, --, --, --, --, --, --, --, --, --, --, --, --, --
Christian Folin, Healthy, Mon, D, FA, @Cls, W 4-2, --, --, --, --, --, --, --, --, --, --, --, --, --, --, --, --, --
David Desharnais, Healthy, NYR, C, FA, Det, W 3-2, --, --, --, --, --, --, --, --, --, --, --, --, --, --, --, --, --
Trey Fix-Wolansky, Healthy, Cls, RW, FA, Mon, L 2-4, --, --, --, --, --, --, --, --, --, --, --, --, --, --, --, --, --
Mathias Brome, Healthy, Det, LW, FA, @NYR, L 2-3, --, --, --, --, --, --, --, --, --, --, --, --, --, --, --, --, --
Lias Andersson, Healthy, Mon, C, FA, @Cls, W 4-2, --, --, --, --, --, --, --, --, --, --, --, --, --, --, --, --, --
Tyler Angle, Healthy, Cls, C, FA, Mon, L 2-4, --, --, --, --, --, --, --, --, --, --, --, --, --, --, --, --, --
"Joel LEsperance", Healthy, Det, C, FA, @NYR, L 2-3, --, --, --, --, --, --, --, --, --, --, --, --, --, --, --, --, --
Daniel Carr, Healthy, Wsh, LW, FA, @LA, W 2-1, --, --, --, --, --, --, --, --, --, --, --, --, --, --, --, --, --
Anton Blidh, Healthy, NYR, LW, FA, Det, W 3-2, --, --, --, --, --, --, --, --, --, --, --, --, --, --, --, --, --
Daniel Brickley, Healthy, LA, D, FA, Wsh, L 1-2, --, --, --, --, --, --, --, --, --, --, --, --, --, --, --, --, --
Hardy Haman Aktell, Healthy, Wsh, D, FA, @LA, W 2-1, --, --, --, --, --, --, --, --, --, --, --, --, --, --, --, --, --
Mikko Lehtonen, Healthy, Cls, D, FA, Mon, L 2-4, --, --, --, --, --, --, --, --, --, --, --, --, --, --, --, --, --
Alexandre Fortin, Healthy, Mon, LW, FA, @Cls, W 4-2, --, --, --, --, --, --, --, --, --, --, --, --, --, --, --, --, --
Tim Gettinger, Healthy, Det, LW, FA, @NYR, L 2-3, --, --, --, --, --, --, --, --, --, --, --, --, --, --, --, --, --
Anthony Greco, Healthy, NYR, RW, FA, Det, W 3-2, --, --, --, --, --, --, --, --, --, --, --, --, --, --, --, --, --
Hayden Hodgson, Healthy, LA, RW, FA, Wsh, L 1-2, --, --, --, --, --, --, --, --, --, --, --, --, --, --, --, --, --
Wade Megan, Healthy, Det, C, FA, @NYR, L 2-3, --, --, --, --, --, --, --, --, --, --, --, --, --, --, --, --, --
Michael Sgarbossa, Healthy, Wsh, C, FA, @LA, W 2-1, --, --, --, --, --, --, --, --, --, --, --, --, --, --, --, --, --
Victor Rask, Healthy, Cls, C, FA, Mon, L 2-4, --, --, --, --, --, --, --, --, --, --, --, --, --, --, --, --, --
