Name, Health, NHL Team, Position, GFHL Team, Opponent, Score, GS, W, L, GA, SV, SO, FPTS
David Rittich, Healthy, LA, G, HERB, NYI, W 3-0, 1, 1, 0, 0, 26, 1, 8.6
Connor Hellebuyck, O, Wpg, G, HERB, Wsh, W 3-0, 1, 1, 0, 0, 23, 1, 8.3
Joel Hofer, Healthy, StL, G, FA, @Bos, W 5-1, 1, 1, 0, 1, 36, 0, 7.1
Jonathan Quick, Healthy, NYR, G, OXP, NJ, W 3-1, 1, 1, 0, 1, 19, 0, 5.4
Kaapo Kahkonen, Healthy, NJ, G, FA, @NYR, L 1-3, 1, 0, 1, 2, 23, 0, 0.3
Ilya Sorokin, Healthy, NYI, G, CLB, @LA, L 0-3, 1, 0, 1, 2, 22, 0, 0.2
Charlie Lindgren, Healthy, Wsh, G, FA, @Wpg, L 0-3, 1, 0, 1, 3, 26, 0, 0.1
Igor Shesterkin, Healthy, NYR, G, DINK, NJ, W 3-1, --, --, --, --, --, --, --
Linus Ullmark, Healthy, Bos, G, LKR, StL, L 1-5, --, --, --, --, --, --, --
Cam Talbot, Healthy, LA, G, BOWS, NYI, W 3-0, --, --, --, --, --, --, --
Jordan Binnington, Healthy, StL, G, ME, @Bos, W 5-1, --, --, --, --, --, --, --
Semyon Varlamov, Healthy, NYI, G, FA, @LA, L 0-3, --, --, --, --, --, --, --
Darcy Kuemper, Healthy, Wsh, G, FA, @Wpg, L 0-3, --, --, --, --, --, --, --
Laurent Brossoit, Healthy, Wpg, G, FA, Wsh, W 3-0, --, --, --, --, --, --, --
Jake Allen, Healthy, NJ, G, FA, @NYR, L 1-3, --, --, --, --, --, --, --
Pheonix Copley, IR, LA, G, FA, NYI, W 3-0, --, --, --, --, --, --, --
Akira Schmid, Healthy, NJ, G, FA, @NYR, L 1-3, --, --, --, --, --, --, --
Nico Daws, Healthy, NJ, G, FA, @NYR, L 1-3, --, --, --, --, --, --, --
Louis Domingue, Healthy, NYR, G, FA, NJ, W 3-1, --, --, --, --, --, --, --
Malcolm Subban, Healthy, Cls, G, FA, --, --, --, --, --, --, --, --, --
Tuukka Rask, Healthy, Bos, G, FA, StL, L 1-5, --, --, --, --, --, --, --
Jaroslav Halak, Healthy, NYR, G, FA, NJ, W 3-1, --, --, --, --, --, --, --
Hunter Shepard, Healthy, Wsh, G, FA, @Wpg, L 0-3, --, --, --, --, --, --, --
Michael DiPietro, Healthy, Bos, G, FA, StL, L 1-5, --, --, --, --, --, --, --
Thomas Greiss, Healthy, StL, G, FA, @Bos, W 5-1, --, --, --, --, --, --, --
Jonathan Bernier, Healthy, NJ, G, FA, @NYR, L 1-3, --, --, --, --, --, --, --
Collin Delia, Healthy, Wpg, G, FA, Wsh, W 3-0, --, --, --, --, --, --, --
Cory Schneider, Healthy, NYI, G, FA, @LA, L 0-3, --, --, --, --, --, --, --
Zach Fucale, Healthy, Wsh, G, FA, @Wpg, L 0-3, --, --, --, --, --, --, --
Kenneth Appleby, Healthy, NYI, G, FA, @LA, L 0-3, --, --, --, --, --, --, --
Eddie Lack, Healthy, NJ, G, FA, @NYR, L 1-3, --, --, --, --, --, --, --
Erik Kallgren, Healthy, NJ, G, FA, @NYR, L 1-3, --, --, --, --, --, --, --
Andrew Hammond, Healthy, NJ, G, FA, @NYR, L 1-3, --, --, --, --, --, --, --
Adam Huska, Healthy, NYR, G, FA, NJ, W 3-1, --, --, --, --, --, --, --
Garret Sparks, Healthy, LA, G, FA, NYI, W 3-0, --, --, --, --, --, --, --
Keith Kinkaid, Healthy, NJ, G, FA, @NYR, L 1-3, --, --, --, --, --, --, --
Jared Coreau, Healthy, NYI, G, FA, @LA, L 0-3, --, --, --, --, --, --, --
Jean-Francois Berube, Healthy, LA, G, FA, NYI, W 3-0, --, --, --, --, --, --, --
Jeremy Swayman, Healthy, Bos, G, SALT, StL, L 1-5, 1, 0, 1, 4, 17, 0, -1.3
Andrei Vasilevskiy, Healthy, TB, G, LKR, --, --, --, --, --, --, --, --, --
Alexandar Georgiev, Healthy, Col, G, SLC, --, --, --, --, --, --, --, --, --
Jake Oettinger, Healthy, Dal, G, LKR, --, --, --, --, --, --, --, --, --
Thatcher Demko, Healthy, Van, G, BOWS, --, --, --, --, --, --, --, --, --
Juuse Saros, Healthy, Nsh, G, SALT, --, --, --, --, --, --, --, --, --
Sergei Bobrovsky, Healthy, Fla, G, ME, --, --, --, --, --, --, --, --, --
Stuart Skinner, Healthy, Edm, G, ME, --, --, --, --, --, --, --, --, --
Adin Hill, Healthy, Vgk, G, DINK, --, --, --, --, --, --, --, --, --
Logan Thompson, Healthy, Vgk, G, DINK, --, --, --, --, --, --, --, --, --
Tristan Jarry, Healthy, Pit, G, SLC, --, --, --, --, --, --, --, --, --
Ilya Samsonov, Healthy, Tor, G, HERB, --, --, --, --, --, --, --, --, --
Frederik Andersen, Healthy, Car, G, BBS, --, --, --, --, --, --, --, --, --
Jacob Markstrom, Healthy, Cgy, G, BBS, --, --, --, --, --, --, --, --, --
Filip Gustavsson, Healthy, Min, G, BOWS, --, --, --, --, --, --, --, --, --
Carter Hart, IR, Phi, G, FA, --, --, --, --, --, --, --, --, --
Vitek Vanecek, IR, SJ, G, BOWS, --, --, --, --, --, --, --, --, --
Pyotr Kochetkov, Healthy, Car, G, BBS, --, --, --, --, --, --, --, --, --
Joey Daccord, Healthy, Sea, G, FA, --, --, --, --, --, --, --, --, --
Connor Ingram, Healthy, Ari, G, OXP, --, --, --, --, --, --, --, --, --
Ukko-Pekka Luukkonen, Healthy, Buf, G, CLB, --, --, --, --, --, --, --, --, --
Spencer Knight, Healthy, Fla, G, FA, --, --, --, --, --, --, --, --, --
Joonas Korpisalo, Healthy, Ott, G, FA, --, --, --, --, --, --, --, --, --
Alex Lyon, Healthy, Det, G, SALT, --, --, --, --, --, --, --, --, --
Marc-Andre Fleury, Healthy, Min, G, FA, --, --, --, --, --, --, --, --, --
Joseph Woll, Healthy, Tor, G, BBS, --, --, --, --, --, --, --, --, --
Alex Nedeljkovic, Healthy, Pit, G, FA, --, --, --, --, --, --, --, --, --
Ville Husso, O, Det, G, OXP, --, --, --, --, --, --, --, --, --
Calvin Pickard, Healthy, Edm, G, FA, --, --, --, --, --, --, --, --, --
Jonas Johansson, DTD, TB, G, OXP, --, --, --, --, --, --, --, --, --
Devon Levi, Healthy, Buf, G, SALT, --, --, --, --, --, --, --, --, --
Petr Mrazek, Healthy, Chi, G, FA, --, --, --, --, --, --, --, --, --
Samuel Ersson, Healthy, Phi, G, BBS, --, --, --, --, --, --, --, --, --
Casey DeSmith, Healthy, Van, G, FA, --, --, --, --, --, --, --, --, --
John Gibson, Healthy, Ana, G, FA, --, --, --, --, --, --, --, --, --
Philipp Grubauer, Healthy, Sea, G, FA, --, --, --, --, --, --, --, --, --
Martin Jones, Healthy, Tor, G, FA, --, --, --, --, --, --, --, --, --
Anthony Stolarz, Healthy, Fla, G, FA, --, --, --, --, --, --, --, --, --
James Reimer, Healthy, Det, G, FA, --, --, --, --, --, --, --, --, --
Lukas Dostal, Healthy, Ana, G, FA, --, --, --, --, --, --, --, --, --
Scott Wedgewood, Healthy, Dal, G, FA, --, --, --, --, --, --, --, --, --
Dustin Wolf, Healthy, Cgy, G, SLC, --, --, --, --, --, --, --, --, --
Sam Montembeault, Healthy, Mon, G, BOWS, --, --, --, --, --, --, --, --, --
Elvis Merzlikins, Healthy, Cls, G, FA, --, --, --, --, --, --, --, --, --
Karel Vejmelka, Healthy, Ari, G, FA, --, --, --, --, --, --, --, --, --
Arturs Silovs, Healthy, Van, G, FA, --, --, --, --, --, --, --, --, --
Justus Annunen, Healthy, Col, G, FA, --, --, --, --, --, --, --, --, --
Antti Raanta, Healthy, Car, G, FA, --, --, --, --, --, --, --, --, --
Jack Campbell, Healthy, Edm, G, FA, --, --, --, --, --, --, --, --, --
Mackenzie Blackwood, O, SJ, G, FA, --, --, --, --, --, --, --, --, --
Jesper Wallstedt, Healthy, Min, G, FA, --, --, --, --, --, --, --, --, --
Anton Forsberg, Healthy, Ott, G, FA, --, --, --, --, --, --, --, --, --
Matt Tomkins, Healthy, TB, G, FA, --, --, --, --, --, --, --, --, --
Robin Lehner, IR, Vgk, G, FA, --, --, --, --, --, --, --, --, --
Kevin Lankinen, Healthy, Nsh, G, FA, --, --, --, --, --, --, --, --, --
Spencer Martin, Healthy, Car, G, FA, --, --, --, --, --, --, --, --, --
Yaroslav Askarov, Healthy, Nsh, G, FA, --, --, --, --, --, --, --, --, --
Cayden Primeau, Healthy, Mon, G, FA, --, --, --, --, --, --, --, --, --
Arvid Soderblom, Healthy, Chi, G, FA, --, --, --, --, --, --, --, --, --
Daniil Tarasov, O, Cls, G, FA, --, --, --, --, --, --, --, --, --
Ivan Fedotov, Healthy, Phi, G, CLB, --, --, --, --, --, --, --, --, --
Mads Sogaard, Healthy, Ott, G, FA, --, --, --, --, --, --, --, --, --
Carey Price, IR, Mon, G, FA, --, --, --, --, --, --, --, --, --
Matt Murray, IR, Tor, G, FA, --, --, --, --, --, --, --, --, --
Matt Murray, Healthy, Dal, G, FA, --, --, --, --, --, --, --, --, --
Jet Greaves, Healthy, Cls, G, FA, --, --, --, --, --, --, --, --, --
Dan Vladar, O, Cgy, G, FA, --, --, --, --, --, --, --, --, --
Ivan Prosvetov, Healthy, Col, G, FA, --, --, --, --, --, --, --, --, --
Chris Driedger, Healthy, Sea, G, FA, --, --, --, --, --, --, --, --, --
Pavel Francouz, IR, Col, G, FA, --, --, --, --, --, --, --, --, --
Devin Cooley, Healthy, SJ, G, FA, --, --, --, --, --, --, --, --, --
Braden Holtby, Healthy, Dal, G, FA, --, --, --, --, --, --, --, --, --
Eric Comrie, Healthy, Buf, G, FA, --, --, --, --, --, --, --, --, --
Sebastian Cossa, Healthy, Det, G, FA, --, --, --, --, --, --, --, --, --
Jiri Patera, Healthy, Vgk, G, FA, --, --, --, --, --, --, --, --, --
Artyom Zagidulin, Healthy, Cgy, G, FA, --, --, --, --, --, --, --, --, --
Cal Petersen, Healthy, Phi, G, FA, --, --, --, --, --, --, --, --, --
Mike Smith, Healthy, Edm, G, FA, --, --, --, --, --, --, --, --, --
Craig Anderson, Healthy, Buf, G, FA, --, --, --, --, --, --, --, --, --
Felix Sandstrom, Healthy, Phi, G, FA, --, --, --, --, --, --, --, --, --
Brian Elliott, Healthy, TB, G, FA, --, --, --, --, --, --, --, --, --
Anton Khudobin, Healthy, Chi, G, FA, --, --, --, --, --, --, --, --, --
Georgi Romanov, Healthy, SJ, G, FA, --, --, --, --, --, --, --, --, --
Dylan Wells, Healthy, Dal, G, FA, --, --, --, --, --, --, --, --, --
Adam Gajan, Healthy, Chi, G, FA, --, --, --, --, --, --, --, --, --
Drew Commesso, Healthy, Chi, G, FA, --, --, --, --, --, --, --, --, --
Magnus Chrona, Healthy, SJ, G, FA, --, --, --, --, --, --, --, --, --
Magnus Hellberg, Healthy, Fla, G, FA, --, --, --, --, --, --, --, --, --
Trey Augustine, Healthy, Det, G, FA, --, --, --, --, --, --, --, --, --
Michael Hrabal, Healthy, Ari, G, FA, --, --, --, --, --, --, --, --, --
Eetu Makiniemi, Healthy, SJ, G, FA, --, --, --, --, --, --, --, --, --
Jack LaFontaine, Healthy, TB, G, FA, --, --, --, --, --, --, --, --, --
Hunter Miska, Healthy, Col, G, FA, --, --, --, --, --, --, --, --, --
Antti Niemi, Healthy, Mon, G, FA, --, --, --, --, --, --, --, --, --
Hugo Alnefelt, Healthy, TB, G, FA, --, --, --, --, --, --, --, --, --
Jaxson Stauber, Healthy, Chi, G, FA, --, --, --, --, --, --, --, --, --
Mikko Koskinen, Healthy, Edm, G, FA, --, --, --, --, --, --, --, --, --
Niklas Svedberg, Healthy, Min, G, FA, --, --, --, --, --, --, --, --, --
Alex Stalock, Healthy, Ana, G, FA, --, --, --, --, --, --, --, --, --
Olle Eriksson Ek, Healthy, Ana, G, FA, --, --, --, --, --, --, --, --, --
Jett Alexander, Healthy, Tor, G, FA, --, --, --, --, --, --, --, --, --
Kasimir Kaskisuo, Healthy, Nsh, G, FA, --, --, --, --, --, --, --, --, --
Jeff Glass, Healthy, Chi, G, FA, --, --, --, --, --, --, --, --, --
Leevi Merilainen, Healthy, Ott, G, FA, --, --, --, --, --, --, --, --, --
Mike Condon, Healthy, TB, G, FA, --, --, --, --, --, --, --, --, --
Alexei Melnichuk, Healthy, TB, G, FA, --, --, --, --, --, --, --, --, --
Dylan Ferguson, Healthy, Ott, G, FA, --, --, --, --, --, --, --, --, --
Danny Taylor, Healthy, Ott, G, FA, --, --, --, --, --, --, --, --, --
Zach Sawchenko, Healthy, Van, G, FA, --, --, --, --, --, --, --, --, --
Harri Sateri, Healthy, Ari, G, FA, --, --, --, --, --, --, --, --, --
Dustin Tokarski, Healthy, Buf, G, FA, --, --, --, --, --, --, --, --, --
Matthew Berlin, Healthy, Edm, G, FA, --, --, --, --, --, --, --, --, --
Troy Grosenick, Healthy, Nsh, G, FA, --, --, --, --, --, --, --, --, --
Dennis Hildeby, Healthy, Tor, G, FA, --, --, --, --, --, --, --, --, --
Michael Hutchinson, Healthy, Det, G, FA, --, --, --, --, --, --, --, --, --
Maxime Lagace, Healthy, TB, G, FA, --, --, --, --, --, --, --, --, --
Aaron Dell, Healthy, Cls, G, FA, --, --, --, --, --, --, --, --, --
Shane Starrett, Healthy, Edm, G, FA, --, --, --, --, --, --, --, --, --
Keith Petruzzelli, Healthy, Tor, G, FA, --, --, --, --, --, --, --, --, --
Michael McNiven, Healthy, Ott, G, FA, --, --, --, --, --, --, --, --, --
Landon Bow, Healthy, Dal, G, FA, --, --, --, --, --, --, --, --, --
Damian Clara, Healthy, Ana, G, FA, --, --, --, --, --, --, --, --, --
Carson Bjarnason, Healthy, Phi, G, FA, --, --, --, --, --, --, --, --, --
Jon Gillies, O, Cls, G, FA, --, --, --, --, --, --, --, --, --
Michael Houser, Healthy, Buf, G, FA, --, --, --, --, --, --, --, --, --
Tom Hodges, Healthy, Ana, G, FA, --, --, --, --, --, --, --, --, --
Carter Hutton, Healthy, Tor, G, FA, --, --, --, --, --, --, --, --, --
Josef Korenar, Healthy, Ari, G, FA, --, --, --, --, --, --, --, --, --
Kaden Fulcher, Healthy, Det, G, FA, --, --, --, --, --, --, --, --, --
Kevin Boyle, Healthy, Det, G, FA, --, --, --, --, --, --, --, --, --
Kevin Mandolese, Healthy, Ott, G, FA, --, --, --, --, --, --, --, --, --
Yaniv Perets, Healthy, Car, G, FA, --, --, --, --, --, --, --, --, --
Matt Villalta, Healthy, Ari, G, FA, --, --, --, --, --, --, --, --, --
