Name, Health, NHL Team, Position, GFHL Team, Opponent, Score, GS, W, L, GA, SV, SO, FPTS
Jeremy Swayman, Healthy, Bos, G, BBS, Phi, W 6-0, 1, 1, 0, 0, 29, 1, 8.9
Jake Oettinger, Healthy, Dal, G, LKR, @Vgk, W 4-0, 1, 1, 0, 0, 27, 1, 8.7
Juuse Saros, Healthy, Nsh, G, SALT, Cgy, W 2-1, 1, 1, 0, 1, 38, 0, 7.3
Jordan Binnington, Healthy, StL, G, SLC, Ott, W 2-1, 1, 1, 0, 1, 32, 0, 6.7
Sergei Bobrovsky, DTD, Fla, G, SLC, @Buf, W 4-1, 1, 1, 0, 1, 28, 0, 6.3
Jaroslav Halak, Healthy, NYR, G, FA, @Cls, W 3-1, 1, 1, 0, 1, 24, 0, 5.9
Andrei Vasilevskiy, Healthy, TB, G, LKR, @Sea, W 4-1, 1, 1, 0, 1, 22, 0, 5.7
Vitek Vanecek, Healthy, NJ, G, CLB, @SJ, W 4-3, 1, 1, 0, 3, 29, 0, 5.4
Darcy Kuemper, Healthy, Wsh, G, SALT, @NYI, W 4-3, 1, 1, 0, 3, 27, 0, 5.2
Pavel Francouz, O, Col, G, FA, Det, W 6-3, 1, 1, 0, 3, 26, 0, 5.1
Casey DeSmith, Healthy, Pit, G, FA, Ana, W 4-3, 1, 1, 0, 3, 26, 0, 5.1
James Reimer, Healthy, SJ, G, FA, NJ, L 3-4, 1, 0, 0, 3, 38, 0, 2.3
John Gibson, Healthy, Ana, G, ME, @Pit, L 3-4, 1, 0, 0, 4, 41, 0, 2.1
Ilya Sorokin, Healthy, NYI, G, CLB, Wsh, L 3-4, 1, 0, 0, 4, 31, 0, 1.1
Jacob Markstrom, Healthy, Cgy, G, OXP, @Nsh, L 1-2, 1, 0, 1, 2, 27, 0, 0.7
Logan Thompson, DTD, Vgk, G, DINK, Dal, L 0-4, 1, 0, 1, 3, 32, 0, 0.7
Philipp Grubauer, Healthy, Sea, G, BBS, TB, L 1-4, 1, 0, 1, 2, 27, 0, 0.7
Elvis Merzlikins, DTD, Cls, G, FA, NYR, L 1-3, 1, 0, 1, 3, 30, 0, 0.5
Ukko-Pekka Luukkonen, Healthy, Buf, G, BOWS, Fla, L 1-4, 1, 0, 1, 3, 30, 0, 0.5
Samuel Ersson, Healthy, Phi, G, FA, @Bos, L 0-6, 0, 0, 0, 2, 11, 0, 0.1
Igor Shesterkin, Healthy, NYR, G, DINK, @Cls, W 3-1, 0, 0, 0, 0, 0, 0, --
Linus Ullmark, Healthy, Bos, G, SALT, Phi, W 6-0, 0, 0, 0, 0, 0, 0, --
Alexandar Georgiev, Healthy, Col, G, SLC, Det, W 6-3, 0, 0, 0, 0, 0, 0, --
Tristan Jarry, Healthy, Pit, G, HERB, Ana, W 4-3, 0, 0, 0, 0, 0, 0, --
Martin Jones, Healthy, Sea, G, DINK, TB, L 1-4, 0, 0, 0, 0, 0, 0, --
Spencer Knight, IR, Fla, G, FA, @Buf, W 4-1, 0, 0, 0, 0, 0, 0, --
Joonas Korpisalo, Healthy, LA, G, DINK, --, --, 0, 0, 0, 0, 0, 0, --
Adin Hill, O, Vgk, G, FA, Dal, L 0-4, 0, 0, 0, 0, 0, 0, --
Semyon Varlamov, Healthy, NYI, G, FA, Wsh, L 3-4, 0, 0, 0, 0, 0, 0, --
Anton Forsberg, IR, Ott, G, FA, @StL, L 1-2, 0, 0, 0, 0, 0, 0, --
Craig Anderson, O, Buf, G, FA, Fla, L 1-4, 0, 0, 0, 0, 0, 0, --
Charlie Lindgren, O, Wsh, G, FA, @NYI, W 4-3, 0, 0, 0, 0, 0, 0, --
Joel Hofer, Healthy, StL, G, FA, Ott, W 2-1, 0, 0, 0, 0, 0, 0, --
Eric Comrie, Healthy, Buf, G, FA, Fla, L 1-4, 0, 0, 0, 0, 0, 0, --
Robin Lehner, IR, Vgk, G, FA, Dal, L 0-4, 0, 0, 0, 0, 0, 0, --
Dan Vladar, Healthy, Cgy, G, FA, @Nsh, L 1-2, 0, 0, 0, 0, 0, 0, --
Mackenzie Blackwood, Healthy, NJ, G, FA, @SJ, W 4-3, 0, 0, 0, 0, 0, 0, --
Mads Sogaard, DTD, Ott, G, FA, @StL, L 1-2, 0, 0, 0, 0, 0, 0, --
Akira Schmid, Healthy, NJ, G, FA, @SJ, W 4-3, 0, 0, 0, 0, 0, 0, --
Alex Nedeljkovic, Healthy, Det, G, FA, @Col, L 3-6, 0, 0, 0, 0, 0, 0, --
Kevin Lankinen, Healthy, Nsh, G, FA, Cgy, W 2-1, 0, 0, 0, 0, 0, 0, --
Alex Lyon, Healthy, Fla, G, FA, @Buf, W 4-1, 0, 0, 0, 0, 0, 0, --
Laurent Brossoit, Healthy, Vgk, G, FA, Dal, L 0-4, 0, 0, 0, 0, 0, 0, --
Brian Elliott, Healthy, TB, G, FA, @Sea, W 4-1, 0, 0, 0, 0, 0, 0, --
Kaapo Kahkonen, Healthy, SJ, G, FA, NJ, L 3-4, 0, 0, 0, 0, 0, 0, --
Scott Wedgewood, O, Dal, G, FA, @Vgk, W 4-0, 0, 0, 0, 0, 0, 0, --
Thomas Greiss, DTD, StL, G, FA, Ott, W 2-1, 0, 0, 0, 0, 0, 0, --
Lukas Dostal, Healthy, Ana, G, FA, @Pit, L 3-4, 0, 0, 0, 0, 0, 0, --
Jonas Johansson, Healthy, Col, G, FA, Det, W 6-3, 0, 0, 0, 0, 0, 0, --
Yaroslav Askarov, Healthy, Nsh, G, FA, Cgy, W 2-1, 0, 0, 0, 0, 0, 0, --
Keith Kinkaid, Healthy, Col, G, FA, Det, W 6-3, 0, 0, 0, 0, 0, 0, --
Tuukka Rask, Healthy, Bos, G, FA, Phi, W 6-0, 0, 0, 0, 0, 0, 0, --
Felix Sandstrom, Healthy, Phi, G, FA, @Bos, L 0-6, 0, 0, 0, 0, 0, 0, --
Malcolm Subban, Healthy, Buf, G, FA, Fla, L 1-4, 0, 0, 0, 0, 0, 0, --
Michael Hutchinson, Healthy, Cls, G, FA, NYR, L 1-3, 0, 0, 0, 0, 0, 0, --
Anthony Stolarz, IR, Ana, G, FA, @Pit, L 3-4, 0, 0, 0, 0, 0, 0, --
Dustin Wolf, Healthy, Cgy, G, FA, @Nsh, L 1-2, 0, 0, 0, 0, 0, 0, --
Daniil Tarasov, Healthy, Cls, G, FA, NYR, L 1-3, 0, 0, 0, 0, 0, 0, --
Braden Holtby, O, Dal, G, FA, @Vgk, W 4-0, 0, 0, 0, 0, 0, 0, --
Pekka Rinne, Healthy, Nsh, G, FA, Cgy, W 2-1, 0, 0, 0, 0, 0, 0, --
Justus Annunen, Healthy, Col, G, FA, Det, W 6-3, 0, 0, 0, 0, 0, 0, --
Joey Daccord, Healthy, Sea, G, FA, TB, L 1-4, 0, 0, 0, 0, 0, 0, --
Louis Domingue, Healthy, NYR, G, FA, @Cls, W 3-1, 0, 0, 0, 0, 0, 0, --
Anton Khudobin, Healthy, Chi, G, FA, --, --, 0, 0, 0, 0, 0, 0, --
Devan Dubnyk, Healthy, Col, G, FA, Det, W 6-3, 0, 0, 0, 0, 0, 0, --
Chris Driedger, IR, Sea, G, FA, TB, L 1-4, 0, 0, 0, 0, 0, 0, --
Dustin Tokarski, Healthy, Pit, G, FA, Ana, W 4-3, 0, 0, 0, 0, 0, 0, --
Ryan Miller, Healthy, Ana, G, FA, @Pit, L 3-4, 0, 0, 0, 0, 0, 0, --
Jonathan Bernier, IR, NJ, G, FA, @SJ, W 4-3, 0, 0, 0, 0, 0, 0, --
Nico Daws, Healthy, NJ, G, FA, @SJ, W 4-3, 0, 0, 0, 0, 0, 0, --
Christopher Gibson, Healthy, Sea, G, FA, TB, L 1-4, 0, 0, 0, 0, 0, 0, --
Aaron Dell, Healthy, SJ, G, FA, NJ, L 3-4, 0, 0, 0, 0, 0, 0, --
Cory Schneider, Healthy, NYI, G, FA, Wsh, L 3-4, 0, 0, 0, 0, 0, 0, --
Curtis McElhinney, Healthy, TB, G, FA, @Sea, W 4-1, 0, 0, 0, 0, 0, 0, --
Zach Fucale, Healthy, Wsh, G, FA, @NYI, W 4-3, 0, 0, 0, 0, 0, 0, --
Hugo Alnefelt, Healthy, TB, G, FA, @Sea, W 4-1, 0, 0, 0, 0, 0, 0, --
Troy Grosenick, Healthy, Phi, G, FA, @Bos, L 0-6, 0, 0, 0, 0, 0, 0, --
Adam Huska, Healthy, NYR, G, FA, @Cls, W 3-1, 0, 0, 0, 0, 0, 0, --
Maxime Lagace, Healthy, TB, G, FA, @Sea, W 4-1, 0, 0, 0, 0, 0, 0, --
Mike Condon, Healthy, TB, G, FA, @Sea, W 4-1, 0, 0, 0, 0, 0, 0, --
Eddie Lack, Healthy, NJ, G, FA, @SJ, W 4-3, 0, 0, 0, 0, 0, 0, --
Andrew Hammond, Healthy, NJ, G, FA, @SJ, W 4-3, 0, 0, 0, 0, 0, 0, --
Kasimir Kaskisuo, Healthy, Nsh, G, FA, Cgy, W 2-1, 0, 0, 0, 0, 0, 0, --
Hunter Miska, Healthy, Col, G, FA, Det, W 6-3, 0, 0, 0, 0, 0, 0, --
Kenneth Appleby, Healthy, NYI, G, FA, Wsh, L 3-4, 0, 0, 0, 0, 0, 0, --
Jack LaFontaine, Healthy, TB, G, FA, @Sea, W 4-1, 0, 0, 0, 0, 0, 0, --
Artyom Zagidulin, Healthy, Cgy, G, FA, @Nsh, L 1-2, 0, 0, 0, 0, 0, 0, --
Alexei Melnichuk, Healthy, TB, G, FA, @Sea, W 4-1, 0, 0, 0, 0, 0, 0, --
Danny Taylor, Healthy, Ott, G, FA, @StL, L 1-2, 0, 0, 0, 0, 0, 0, --
Michael Houser, Healthy, Buf, G, FA, Fla, L 1-4, 0, 0, 0, 0, 0, 0, --
Jean-Francois Berube, Healthy, Cls, G, FA, NYR, L 1-3, 0, 0, 0, 0, 0, 0, --
Tom Hodges, Healthy, Ana, G, FA, @Pit, L 3-4, 0, 0, 0, 0, 0, 0, --
Oscar Dansk, Healthy, Cgy, G, FA, @Nsh, L 1-2, 0, 0, 0, 0, 0, 0, --
Jared Coreau, Healthy, NYI, G, FA, Wsh, L 3-4, 0, 0, 0, 0, 0, 0, --
Eetu Makiniemi, Healthy, SJ, G, FA, NJ, L 3-4, 0, 0, 0, 0, 0, 0, --
Kevin Boyle, Healthy, Det, G, FA, @Col, L 3-6, 0, 0, 0, 0, 0, 0, --
Marcus Hogberg, Healthy, Ott, G, FA, @StL, L 1-2, 0, 0, 0, 0, 0, 0, --
Michael McNiven, Healthy, Ott, G, FA, @StL, L 1-2, 0, 0, 0, 0, 0, 0, --
Kaden Fulcher, Healthy, Det, G, FA, @Col, L 3-6, 0, 0, 0, 0, 0, 0, --
Landon Bow, Healthy, Dal, G, FA, @Vgk, W 4-0, 0, 0, 0, 0, 0, 0, --
Magnus Hellberg, Healthy, Det, G, FA, @Col, L 3-6, 0, 0, 0, 1, 4, 0, -0.1
Cam Talbot, Healthy, Ott, G, ME, @StL, L 1-2, 1, 0, 1, 2, 18, 0, -0.2
Ville Husso, DTD, Det, G, DINK, @Col, L 3-6, 1, 0, 1, 5, 17, 0, -1.8
Carter Hart, DTD, Phi, G, OXP, @Bos, L 0-6, 1, 0, 1, 4, 12, 0, -1.8
Connor Hellebuyck, Healthy, Wpg, G, ME, --, --, 0, 0, 0, 0, 0, 0, --
Frederik Andersen, Healthy, Car, G, HERB, --, --, 0, 0, 0, 0, 0, 0, --
Ilya Samsonov, Healthy, Tor, G, CLB, --, --, 0, 0, 0, 0, 0, 0, --
Marc-Andre Fleury, Healthy, Min, G, LKR, --, --, 0, 0, 0, 0, 0, 0, --
Filip Gustavsson, Healthy, Min, G, OXP, --, --, 0, 0, 0, 0, 0, 0, --
Matt Murray, DTD, Tor, G, BOWS, --, --, 0, 0, 0, 0, 0, 0, --
Jack Campbell, Healthy, Edm, G, FA, --, --, 0, 0, 0, 0, 0, 0, --
Thatcher Demko, Healthy, Van, G, BOWS, --, --, 0, 0, 0, 0, 0, 0, --
Stuart Skinner, Healthy, Edm, G, BBS, --, --, 0, 0, 0, 0, 0, 0, --
Petr Mrazek, Healthy, Chi, G, FA, --, --, 0, 0, 0, 0, 0, 0, --
Pheonix Copley, Healthy, LA, G, HERB, --, --, 0, 0, 0, 0, 0, 0, --
Jonathan Quick, Healthy, Vgk, G, FA, Dal, L 0-4, 0, 0, 0, 0, 0, 0, --
Karel Vejmelka, Healthy, Ari, G, FA, --, --, 0, 0, 0, 0, 0, 0, --
Antti Raanta, Healthy, Car, G, FA, --, --, 0, 0, 0, 0, 0, 0, --
Pyotr Kochetkov, Healthy, Car, G, HERB, --, --, 0, 0, 0, 0, 0, 0, --
Jake Allen, Healthy, Mon, G, FA, --, --, 0, 0, 0, 0, 0, 0, --
Sam Montembeault, Healthy, Mon, G, FA, --, --, 0, 0, 0, 0, 0, 0, --
Cal Petersen, Healthy, LA, G, FA, --, --, 0, 0, 0, 0, 0, 0, --
Joseph Woll, Healthy, Tor, G, FA, --, --, 0, 0, 0, 0, 0, 0, --
Alex Stalock, Healthy, Chi, G, FA, --, --, 0, 0, 0, 0, 0, 0, --
Devon Levi, Healthy, Buf, G, SALT, Fla, L 1-4, 0, 0, 0, 0, 0, 0, --
Collin Delia, Healthy, Van, G, FA, --, --, 0, 0, 0, 0, 0, 0, --
Ivan Prosvetov, Healthy, Ari, G, FA, --, --, 0, 0, 0, 0, 0, 0, --
Spencer Martin, Healthy, Van, G, FA, --, --, 0, 0, 0, 0, 0, 0, --
Connor Ingram, Healthy, Ari, G, FA, --, --, 0, 0, 0, 0, 0, 0, --
Carey Price, IR, Mon, G, FA, --, --, 0, 0, 0, 0, 0, 0, --
David Rittich, Healthy, Wpg, G, FA, --, --, 0, 0, 0, 0, 0, 0, --
Jesper Wallstedt, Healthy, Min, G, FA, --, --, 0, 0, 0, 0, 0, 0, --
Mike Smith, O, Edm, G, FA, --, --, 0, 0, 0, 0, 0, 0, --
Erik Kallgren, Healthy, Tor, G, FA, --, --, 0, 0, 0, 0, 0, 0, --
Mikko Koskinen, Healthy, Edm, G, FA, --, --, 0, 0, 0, 0, 0, 0, --
Arvid Soderblom, Healthy, Chi, G, FA, --, --, 0, 0, 0, 0, 0, 0, --
Kevin Mandolese, Healthy, Ott, G, FA, @StL, L 1-2, 0, 0, 0, 0, 0, 0, --
Jaxson Stauber, Healthy, Chi, G, FA, --, --, 0, 0, 0, 0, 0, 0, --
Michael DiPietro, Healthy, Van, G, FA, --, --, 0, 0, 0, 0, 0, 0, --
Cayden Primeau, Healthy, Mon, G, FA, --, --, 0, 0, 0, 0, 0, 0, --
Dylan Ferguson, Healthy, Ott, G, FA, @StL, L 1-2, 0, 0, 0, 0, 0, 0, --
Matt Murray, Healthy, Dal, G, FA, @Vgk, W 4-0, 0, 0, 0, 0, 0, 0, --
Jon Gillies, Healthy, Cls, G, FA, NYR, L 1-3, 0, 0, 0, 0, 0, 0, --
Jiri Patera, Healthy, Vgk, G, FA, Dal, L 0-4, 0, 0, 0, 0, 0, 0, --
Arturs Silovs, Healthy, Van, G, FA, --, --, 0, 0, 0, 0, 0, 0, --
Antti Niemi, Healthy, Mon, G, FA, --, --, 0, 0, 0, 0, 0, 0, --
Calvin Pickard, Healthy, Edm, G, FA, --, --, 0, 0, 0, 0, 0, 0, --
Garret Sparks, Healthy, LA, G, FA, --, --, 0, 0, 0, 0, 0, 0, --
Harri Sateri, Healthy, Ari, G, FA, --, --, 0, 0, 0, 0, 0, 0, --
Veini Vehvilainen, Healthy, Tor, G, FA, --, --, 0, 0, 0, 0, 0, 0, --
Carter Hutton, Healthy, Tor, G, FA, --, --, 0, 0, 0, 0, 0, 0, --
Josef Korenar, Healthy, Ari, G, FA, --, --, 0, 0, 0, 0, 0, 0, --
Zach Sawchenko, Healthy, Car, G, FA, --, --, 0, 0, 0, 0, 0, 0, --
Niklas Svedberg, Healthy, Min, G, FA, --, --, 0, 0, 0, 0, 0, 0, --
Jeff Glass, Healthy, Chi, G, FA, --, --, 0, 0, 0, 0, 0, 0, --
Dylan Wells, Healthy, Dal, G, FA, @Vgk, W 4-0, 0, 0, 0, 0, 0, 0, --
Shane Starrett, Healthy, Edm, G, FA, --, --, 0, 0, 0, 0, 0, 0, --
Keith Petruzzelli, Healthy, Tor, G, FA, --, --, 0, 0, 0, 0, 0, 0, --
Zane McIntyre, Healthy, Min, G, FA, --, --, 0, 0, 0, 0, 0, 0, --
Matthew Berlin, Healthy, Edm, G, FA, --, --, 0, 0, 0, 0, 0, 0, --
Olle Eriksson Ek, Healthy, Ana, G, FA, @Pit, L 3-4, 0, 0, 0, 0, 0, 0, --
