Name, Health, NHL Team, Position, GFHL Team, Opponent, Score, GS, W, L, GA, SV, SO, FPTS
Juuse Saros, Healthy, Nsh, G, SALT, Wpg, W 2-1, 1, 1, 0, 1, 32, 0, 6.7
Alexandar Georgiev, Healthy, Col, G, SLC, Wsh, W 3-2, 1, 1, 0, 2, 37, 0, 6.7
Anthony Stolarz, IR, Ana, G, FA, @Ari, W 5-2, 1, 1, 0, 2, 37, 0, 6.7
Andrei Vasilevskiy, Healthy, TB, G, LKR, Min, W 4-2, 1, 1, 0, 2, 33, 0, 6.3
Vitek Vanecek, Healthy, NJ, G, CLB, Vgk, W 3-2, 1, 1, 0, 2, 28, 0, 5.8
Ville Husso, DTD, Det, G, DINK, SJ, W 3-2, 1, 1, 0, 2, 28, 0, 5.8
Pheonix Copley, Healthy, LA, G, HERB, @Phi, W 4-3, 1, 1, 0, 3, 28, 0, 5.3
Jeremy Swayman, Healthy, Bos, G, BBS, @Mon, W 4-2, 1, 1, 0, 2, 20, 0, 5.0
Ukko-Pekka Luukkonen, Healthy, Buf, G, BOWS, @StL, W 5-3, 1, 1, 0, 3, 25, 0, 5.0
Casey DeSmith, Healthy, Pit, G, FA, Fla, W 7-6, 1, 1, 0, 6, 33, 0, 4.3
Collin Delia, Healthy, Van, G, FA, Chi, W 5-2, 1, 1, 0, 2, 12, 0, 4.2
Connor Hellebuyck, Healthy, Wpg, G, ME, @Nsh, L 1-2, 1, 0, 1, 2, 39, 0, 1.9
Logan Thompson, DTD, Vgk, G, DINK, @NJ, L 2-3, 1, 0, 0, 3, 33, 0, 1.8
James Reimer, Healthy, SJ, G, FA, @Det, L 2-3, 1, 0, 0, 3, 32, 0, 1.7
Carter Hart, DTD, Phi, G, OXP, LA, L 3-4, 1, 0, 0, 4, 34, 0, 1.4
Petr Mrazek, Healthy, Chi, G, FA, @Van, L 2-5, 1, 0, 1, 4, 43, 0, 1.3
Marc-Andre Fleury, Healthy, Min, G, LKR, @TB, L 2-4, 1, 0, 1, 3, 35, 0, 1.0
Connor Ingram, Healthy, Ari, G, FA, Ana, L 2-5, 1, 0, 1, 4, 38, 0, 0.8
Alex Lyon, Healthy, Fla, G, FA, @Pit, L 6-7, 1, 0, 0, 7, 42, 0, 0.7
Linus Ullmark, Healthy, Bos, G, SALT, @Mon, W 4-2, 0, 0, 0, 0, 0, 0, --
Tristan Jarry, Healthy, Pit, G, HERB, Fla, W 7-6, 0, 0, 0, 0, 0, 0, --
Filip Gustavsson, Healthy, Min, G, OXP, @TB, L 2-4, 0, 0, 0, 0, 0, 0, --
Sergei Bobrovsky, DTD, Fla, G, SLC, @Pit, L 6-7, 0, 0, 0, 0, 0, 0, --
John Gibson, Healthy, Ana, G, ME, @Ari, W 5-2, 0, 0, 0, 0, 0, 0, --
Thatcher Demko, Healthy, Van, G, BOWS, Chi, W 5-2, 0, 0, 0, 0, 0, 0, --
Jonathan Quick, Healthy, Vgk, G, FA, @NJ, L 2-3, 0, 0, 0, 0, 0, 0, --
Pavel Francouz, O, Col, G, FA, Wsh, W 3-2, 0, 0, 0, 0, 0, 0, --
Spencer Knight, IR, Fla, G, FA, @Pit, L 6-7, 0, 0, 0, 0, 0, 0, --
Karel Vejmelka, Healthy, Ari, G, FA, Ana, L 2-5, 0, 0, 0, 0, 0, 0, --
Adin Hill, O, Vgk, G, FA, @NJ, L 2-3, 0, 0, 0, 0, 0, 0, --
Craig Anderson, O, Buf, G, FA, @StL, W 5-3, 0, 0, 0, 0, 0, 0, --
Jake Allen, Healthy, Mon, G, FA, Bos, L 2-4, 0, 0, 0, 0, 0, 0, --
Charlie Lindgren, O, Wsh, G, FA, @Col, L 2-3, 0, 0, 0, 0, 0, 0, --
Sam Montembeault, Healthy, Mon, G, FA, Bos, L 2-4, 1, 0, 1, 3, 25, 0, 0.0
Joel Hofer, Healthy, StL, G, FA, Buf, L 3-5, 0, 0, 0, 0, 0, 0, --
Eric Comrie, Healthy, Buf, G, FA, @StL, W 5-3, 0, 0, 0, 0, 0, 0, --
Robin Lehner, IR, Vgk, G, FA, @NJ, L 2-3, 0, 0, 0, 0, 0, 0, --
Cal Petersen, Healthy, LA, G, FA, @Phi, W 4-3, 0, 0, 0, 0, 0, 0, --
Mackenzie Blackwood, Healthy, NJ, G, FA, Vgk, W 3-2, 0, 0, 0, 0, 0, 0, --
Akira Schmid, Healthy, NJ, G, FA, Vgk, W 3-2, 0, 0, 0, 0, 0, 0, --
Alex Nedeljkovic, Healthy, Det, G, FA, SJ, W 3-2, 0, 0, 0, 0, 0, 0, --
Alex Stalock, Healthy, Chi, G, FA, @Van, L 2-5, 0, 0, 0, 0, 0, 0, --
Kevin Lankinen, Healthy, Nsh, G, FA, Wpg, W 2-1, 0, 0, 0, 0, 0, 0, --
Laurent Brossoit, Healthy, Vgk, G, FA, @NJ, L 2-3, 0, 0, 0, 0, 0, 0, --
Brian Elliott, Healthy, TB, G, FA, Min, W 4-2, 0, 0, 0, 0, 0, 0, --
Kaapo Kahkonen, Healthy, SJ, G, FA, @Det, L 2-3, 0, 0, 0, 0, 0, 0, --
Ivan Prosvetov, Healthy, Ari, G, FA, Ana, L 2-5, 0, 0, 0, 0, 0, 0, --
Spencer Martin, Healthy, Van, G, FA, Chi, W 5-2, 0, 0, 0, 0, 0, 0, --
Thomas Greiss, DTD, StL, G, FA, Buf, L 3-5, 0, 0, 0, 0, 0, 0, --
Samuel Ersson, Healthy, Phi, G, FA, LA, L 3-4, 0, 0, 0, 0, 0, 0, --
Carey Price, IR, Mon, G, FA, Bos, L 2-4, 0, 0, 0, 0, 0, 0, --
David Rittich, Healthy, Wpg, G, FA, @Nsh, L 1-2, 0, 0, 0, 0, 0, 0, --
Lukas Dostal, Healthy, Ana, G, FA, @Ari, W 5-2, 0, 0, 0, 0, 0, 0, --
Magnus Hellberg, Healthy, Det, G, FA, SJ, W 3-2, 0, 0, 0, 0, 0, 0, --
Jonas Johansson, Healthy, Col, G, FA, Wsh, W 3-2, 0, 0, 0, 0, 0, 0, --
Yaroslav Askarov, Healthy, Nsh, G, FA, Wpg, W 2-1, 0, 0, 0, 0, 0, 0, --
Keith Kinkaid, Healthy, Col, G, FA, Wsh, W 3-2, 0, 0, 0, 0, 0, 0, --
Jesper Wallstedt, Healthy, Min, G, FA, @TB, L 2-4, 0, 0, 0, 0, 0, 0, --
Tuukka Rask, Healthy, Bos, G, FA, @Mon, W 4-2, 0, 0, 0, 0, 0, 0, --
Felix Sandstrom, Healthy, Phi, G, FA, LA, L 3-4, 0, 0, 0, 0, 0, 0, --
Malcolm Subban, Healthy, Buf, G, FA, @StL, W 5-3, 0, 0, 0, 0, 0, 0, --
Michael Hutchinson, Healthy, Cls, G, FA, --, --, 0, 0, 0, 0, 0, 0, --
Arvid Soderblom, Healthy, Chi, G, FA, @Van, L 2-5, 0, 0, 0, 0, 0, 0, --
Jaxson Stauber, Healthy, Chi, G, FA, @Van, L 2-5, 0, 0, 0, 0, 0, 0, --
Pekka Rinne, Healthy, Nsh, G, FA, Wpg, W 2-1, 0, 0, 0, 0, 0, 0, --
Justus Annunen, Healthy, Col, G, FA, Wsh, W 3-2, 0, 0, 0, 0, 0, 0, --
Devan Dubnyk, Healthy, Col, G, FA, Wsh, W 3-2, 0, 0, 0, 0, 0, 0, --
Dustin Tokarski, Healthy, Pit, G, FA, Fla, W 7-6, 0, 0, 0, 0, 0, 0, --
Michael DiPietro, Healthy, Van, G, FA, Chi, W 5-2, 0, 0, 0, 0, 0, 0, --
Cayden Primeau, Healthy, Mon, G, FA, Bos, L 2-4, 0, 0, 0, 0, 0, 0, --
Ryan Miller, Healthy, Ana, G, FA, @Ari, W 5-2, 0, 0, 0, 0, 0, 0, --
Jonathan Bernier, IR, NJ, G, FA, Vgk, W 3-2, 0, 0, 0, 0, 0, 0, --
Nico Daws, Healthy, NJ, G, FA, Vgk, W 3-2, 0, 0, 0, 0, 0, 0, --
Jon Gillies, Healthy, Cls, G, FA, --, --, 0, 0, 0, 0, 0, 0, --
Aaron Dell, Healthy, SJ, G, FA, @Det, L 2-3, 0, 0, 0, 0, 0, 0, --
Curtis McElhinney, Healthy, TB, G, FA, Min, W 4-2, 0, 0, 0, 0, 0, 0, --
Zach Fucale, Healthy, Wsh, G, FA, @Col, L 2-3, 0, 0, 0, 0, 0, 0, --
Hugo Alnefelt, Healthy, TB, G, FA, Min, W 4-2, 0, 0, 0, 0, 0, 0, --
Antti Niemi, Healthy, Mon, G, FA, Bos, L 2-4, 0, 0, 0, 0, 0, 0, --
Troy Grosenick, Healthy, Phi, G, FA, LA, L 3-4, 0, 0, 0, 0, 0, 0, --
Maxime Lagace, Healthy, TB, G, FA, Min, W 4-2, 0, 0, 0, 0, 0, 0, --
Garret Sparks, Healthy, LA, G, FA, @Phi, W 4-3, 0, 0, 0, 0, 0, 0, --
Mike Condon, Healthy, TB, G, FA, Min, W 4-2, 0, 0, 0, 0, 0, 0, --
Eddie Lack, Healthy, NJ, G, FA, Vgk, W 3-2, 0, 0, 0, 0, 0, 0, --
Andrew Hammond, Healthy, NJ, G, FA, Vgk, W 3-2, 0, 0, 0, 0, 0, 0, --
Harri Sateri, Healthy, Ari, G, FA, Ana, L 2-5, 0, 0, 0, 0, 0, 0, --
Kasimir Kaskisuo, Healthy, Nsh, G, FA, Wpg, W 2-1, 0, 0, 0, 0, 0, 0, --
Hunter Miska, Healthy, Col, G, FA, Wsh, W 3-2, 0, 0, 0, 0, 0, 0, --
Jack LaFontaine, Healthy, TB, G, FA, Min, W 4-2, 0, 0, 0, 0, 0, 0, --
Josef Korenar, Healthy, Ari, G, FA, Ana, L 2-5, 0, 0, 0, 0, 0, 0, --
Alexei Melnichuk, Healthy, TB, G, FA, Min, W 4-2, 0, 0, 0, 0, 0, 0, --
Niklas Svedberg, Healthy, Min, G, FA, @TB, L 2-4, 0, 0, 0, 0, 0, 0, --
Jeff Glass, Healthy, Chi, G, FA, @Van, L 2-5, 0, 0, 0, 0, 0, 0, --
Michael Houser, Healthy, Buf, G, FA, @StL, W 5-3, 0, 0, 0, 0, 0, 0, --
Tom Hodges, Healthy, Ana, G, FA, @Ari, W 5-2, 0, 0, 0, 0, 0, 0, --
Dylan Wells, Healthy, Dal, G, FA, --, --, 0, 0, 0, 0, 0, 0, --
Eetu Makiniemi, Healthy, SJ, G, FA, @Det, L 2-3, 0, 0, 0, 0, 0, 0, --
Kevin Boyle, Healthy, Det, G, FA, SJ, W 3-2, 0, 0, 0, 0, 0, 0, --
Kaden Fulcher, Healthy, Det, G, FA, SJ, W 3-2, 0, 0, 0, 0, 0, 0, --
Zane McIntyre, Healthy, Min, G, FA, @TB, L 2-4, 0, 0, 0, 0, 0, 0, --
Darcy Kuemper, Healthy, Wsh, G, SALT, @Col, L 2-3, 1, 0, 1, 3, 23, 0, -0.2
Jordan Binnington, Healthy, StL, G, SLC, Buf, L 3-5, 1, 0, 1, 4, 26, 0, -0.4
Igor Shesterkin, Healthy, NYR, G, DINK, --, --, 0, 0, 0, 0, 0, 0, --
Jake Oettinger, Healthy, Dal, G, LKR, --, --, 0, 0, 0, 0, 0, 0, --
Ilya Sorokin, Healthy, NYI, G, CLB, --, --, 0, 0, 0, 0, 0, 0, --
Frederik Andersen, Healthy, Car, G, HERB, --, --, 0, 0, 0, 0, 0, 0, --
Jacob Markstrom, Healthy, Cgy, G, OXP, --, --, 0, 0, 0, 0, 0, 0, --
Ilya Samsonov, Healthy, Tor, G, CLB, --, --, 0, 0, 0, 0, 0, 0, --
Matt Murray, DTD, Tor, G, BOWS, --, --, 0, 0, 0, 0, 0, 0, --
Jack Campbell, Healthy, Edm, G, FA, --, --, 0, 0, 0, 0, 0, 0, --
Stuart Skinner, Healthy, Edm, G, BBS, --, --, 0, 0, 0, 0, 0, 0, --
Cam Talbot, Healthy, Ott, G, ME, --, --, 0, 0, 0, 0, 0, 0, --
Martin Jones, Healthy, Sea, G, DINK, --, --, 0, 0, 0, 0, 0, 0, --
Elvis Merzlikins, DTD, Cls, G, FA, --, --, 0, 0, 0, 0, 0, 0, --
Joonas Korpisalo, Healthy, LA, G, DINK, @Phi, W 4-3, 0, 0, 0, 0, 0, 0, --
Antti Raanta, Healthy, Car, G, FA, --, --, 0, 0, 0, 0, 0, 0, --
Pyotr Kochetkov, Healthy, Car, G, HERB, --, --, 0, 0, 0, 0, 0, 0, --
Philipp Grubauer, Healthy, Sea, G, BBS, --, --, 0, 0, 0, 0, 0, 0, --
Semyon Varlamov, Healthy, NYI, G, FA, --, --, 0, 0, 0, 0, 0, 0, --
Anton Forsberg, IR, Ott, G, FA, --, --, 0, 0, 0, 0, 0, 0, --
Jaroslav Halak, Healthy, NYR, G, FA, --, --, 0, 0, 0, 0, 0, 0, --
Dan Vladar, Healthy, Cgy, G, FA, --, --, 0, 0, 0, 0, 0, 0, --
Mads Sogaard, DTD, Ott, G, FA, --, --, 0, 0, 0, 0, 0, 0, --
Joseph Woll, Healthy, Tor, G, FA, --, --, 0, 0, 0, 0, 0, 0, --
Devon Levi, Healthy, Buf, G, SALT, @StL, W 5-3, 0, 0, 0, 0, 0, 0, --
Scott Wedgewood, O, Dal, G, FA, --, --, 0, 0, 0, 0, 0, 0, --
Mike Smith, O, Edm, G, FA, --, --, 0, 0, 0, 0, 0, 0, --
Erik Kallgren, Healthy, Tor, G, FA, --, --, 0, 0, 0, 0, 0, 0, --
Mikko Koskinen, Healthy, Edm, G, FA, --, --, 0, 0, 0, 0, 0, 0, --
Kevin Mandolese, Healthy, Ott, G, FA, --, --, 0, 0, 0, 0, 0, 0, --
Dustin Wolf, Healthy, Cgy, G, FA, --, --, 0, 0, 0, 0, 0, 0, --
Daniil Tarasov, Healthy, Cls, G, FA, --, --, 0, 0, 0, 0, 0, 0, --
Braden Holtby, O, Dal, G, FA, --, --, 0, 0, 0, 0, 0, 0, --
Joey Daccord, Healthy, Sea, G, FA, --, --, 0, 0, 0, 0, 0, 0, --
Louis Domingue, Healthy, NYR, G, FA, --, --, 0, 0, 0, 0, 0, 0, --
Anton Khudobin, Healthy, Chi, G, FA, @Van, L 2-5, 0, 0, 0, 0, 0, 0, --
Chris Driedger, IR, Sea, G, FA, --, --, 0, 0, 0, 0, 0, 0, --
Dylan Ferguson, Healthy, Ott, G, FA, --, --, 0, 0, 0, 0, 0, 0, --
Matt Murray, Healthy, Dal, G, FA, --, --, 0, 0, 0, 0, 0, 0, --
Christopher Gibson, Healthy, Sea, G, FA, --, --, 0, 0, 0, 0, 0, 0, --
Jiri Patera, Healthy, Vgk, G, FA, @NJ, L 2-3, 0, 0, 0, 0, 0, 0, --
Cory Schneider, Healthy, NYI, G, FA, --, --, 0, 0, 0, 0, 0, 0, --
Arturs Silovs, Healthy, Van, G, FA, Chi, W 5-2, 0, 0, 0, 0, 0, 0, --
Adam Huska, Healthy, NYR, G, FA, --, --, 0, 0, 0, 0, 0, 0, --
Calvin Pickard, Healthy, Edm, G, FA, --, --, 0, 0, 0, 0, 0, 0, --
Kenneth Appleby, Healthy, NYI, G, FA, --, --, 0, 0, 0, 0, 0, 0, --
Veini Vehvilainen, Healthy, Tor, G, FA, --, --, 0, 0, 0, 0, 0, 0, --
Carter Hutton, Healthy, Tor, G, FA, --, --, 0, 0, 0, 0, 0, 0, --
Artyom Zagidulin, Healthy, Cgy, G, FA, --, --, 0, 0, 0, 0, 0, 0, --
Danny Taylor, Healthy, Ott, G, FA, --, --, 0, 0, 0, 0, 0, 0, --
Zach Sawchenko, Healthy, Car, G, FA, --, --, 0, 0, 0, 0, 0, 0, --
Jean-Francois Berube, Healthy, Cls, G, FA, --, --, 0, 0, 0, 0, 0, 0, --
Oscar Dansk, Healthy, Cgy, G, FA, --, --, 0, 0, 0, 0, 0, 0, --
Shane Starrett, Healthy, Edm, G, FA, --, --, 0, 0, 0, 0, 0, 0, --
Jared Coreau, Healthy, NYI, G, FA, --, --, 0, 0, 0, 0, 0, 0, --
Marcus Hogberg, Healthy, Ott, G, FA, --, --, 0, 0, 0, 0, 0, 0, --
Michael McNiven, Healthy, Ott, G, FA, --, --, 0, 0, 0, 0, 0, 0, --
Keith Petruzzelli, Healthy, Tor, G, FA, --, --, 0, 0, 0, 0, 0, 0, --
Landon Bow, Healthy, Dal, G, FA, --, --, 0, 0, 0, 0, 0, 0, --
Matthew Berlin, Healthy, Edm, G, FA, --, --, 0, 0, 0, 0, 0, 0, --
Olle Eriksson Ek, Healthy, Ana, G, FA, @Ari, W 5-2, 0, 0, 0, 0, 0, 0, --
